{
    "abstractText": "Abstract: This article studies point concentration phenomena of nonlinear Schr\u00f6dinger equations with magnetic potentials and constant electric potentials. The existing results show that a common magnetic field has no effect on the locations of point concentrations, as long as the electric potential is not a constant. This article finds out the role of the magnetic fields in the locations of point concentrations when the electric potential is a constant.",
    "authors": [
        {
            "affiliations": [],
            "name": "Liping Wang"
        },
        {
            "affiliations": [],
            "name": "Chunyi Zhao"
        }
    ],
    "id": "SP:4d2b78b5b4123863664704f4c99a11a7ce977570",
    "references": [
        {
            "authors": [
                "G. Arioli",
                "A. Szulkin"
            ],
            "title": "A semilinear Schr\u00f6dinger equation in the presence of a magnetic field",
            "venue": "Arch. Ration. Mech. Anal. 170 ",
            "year": 2003
        },
        {
            "authors": [
                "D. Bonheure",
                "S. Cingolani",
                "M. Nys"
            ],
            "title": "Nonlinear Schr\u00f6dinger equation: concentration on circles driven by an external magnetic field",
            "venue": "Calc. Var. Partial Differ. Equ. 55 ",
            "year": 2016
        },
        {
            "authors": [
                "D. Bonheure",
                "M. Nys",
                "J. Van Schaftingen"
            ],
            "title": "Properties of ground states of nonlinear Schr\u00f6dinger equations under a weak constant magnetic field",
            "venue": "J. Math. Pures Appl. 124 ",
            "year": 2019
        },
        {
            "authors": [
                "D.M. Cao",
                "Z.W. Tang"
            ],
            "title": "Existence and uniqueness of multi-bump bound states of nonlinear Schr\u00f6dinger equations with electromagnetic fields",
            "venue": "J. Differ. Equ. 222 ",
            "year": 2006
        },
        {
            "authors": [
                "S. Cingolani",
                "M. Clapp"
            ],
            "title": "Intertwining semiclassical bound states to a nonlinear magnetic Schr\u00f6dinger equation",
            "venue": "Nonlinearity 22 ",
            "year": 2009
        },
        {
            "authors": [
                "S. Cingolani",
                "L. Jeanjean",
                "S. Secchi"
            ],
            "title": "Multi-peak solutions for magnetic NLS equations without non-degeneracy conditions",
            "venue": "ESAIM Control Optim. Calc. Var. 15 ",
            "year": 2009
        },
        {
            "authors": [
                "C. Cingolani",
                "S. Secchi"
            ],
            "title": "Semiclassical limit for nonlinear Schr\u00f6dinger equations with electromagnetic fields",
            "venue": "J. Math. Anal. Appl. 275 ",
            "year": 2002
        },
        {
            "authors": [
                "C. Cingolani",
                "S. Secchi"
            ],
            "title": "Semiclassical states for NLS equations with magnetic potentials having polynomial growths",
            "venue": "J. Math. Phys.. 46 ",
            "year": 2005
        },
        {
            "authors": [
                "M. delPino",
                "M. Kowalczyk",
                "M. Musso"
            ],
            "title": "Singular limits in Liouville-type equations, Calc",
            "venue": "Var. Partial Differ. Equ",
            "year": 2005
        },
        {
            "authors": [
                "J. DiCosmo",
                "J. Van Schaftingen"
            ],
            "title": "Semiclassical stationary states for nonlinear Schr\u00f6dinger equations under a strong external magnetic field",
            "venue": "J. Differ. Equ. 259 ",
            "year": 2015
        },
        {
            "authors": [
                "M. Esteban",
                "P.L. Lions"
            ],
            "title": "Stationary solutions of nonlinear Schr\u00f6dinger equations with an external magnetic field",
            "venue": "Partial differential equations and the calculus of variations, In: Progress in Nonlinear Differential Equations and Their Application, 1, Vol. I, Birkh\u00e4user Boston, Boston, MA",
            "year": 1989
        },
        {
            "authors": [
                "A. Floer",
                "A. Weinstein"
            ],
            "title": "Nonspreading wave packets for the cubic Schr\u00f6dinger equation with a bounded potential",
            "venue": "J. Funct. Anal. 69 ",
            "year": 1986
        },
        {
            "authors": [
                "B. Helffer"
            ],
            "title": "Semiclassical analysis for Schr\u00f6dinger operators with magnetic wells",
            "venue": "Quasiclassical methods ",
            "year": 1995
        },
        {
            "authors": [
                "B. Helffer"
            ],
            "title": "On spectral theory for Schr\u00f6dinger operators with magnetic potentials",
            "venue": "Spectral and scattering theory and applications, Advanced Studies in Pure Mathematics, vol. 23, The Mathematical Society of Japan, Tokyo",
            "year": 1994
        },
        {
            "authors": [
                "K. Kurata"
            ],
            "title": "Existence and semi-classical limit of the least energy solution to a nonlinear Schr\u00f6dinger equation with electromagnetic fields",
            "venue": "Nonlinear Anal. 41 ",
            "year": 2000
        },
        {
            "authors": [
                "L.D. Landau",
                "E.M. Lifshitz"
            ],
            "title": "Quantum mechanics: non-relativistic theory",
            "venue": "Course of Theoretical Physics, Addison- Wesley Series in Advanced Physics, vol. 3, Pergamon Press, Ltd., London-Paris, for U.S.A. and Canada: Addison-Wesley Publishing Company, Inc., Reading, Mass",
            "year": 1958
        },
        {
            "authors": [
                "D.L. Mills"
            ],
            "title": "Nonlinear Optics: Basic Concepts",
            "venue": "Springer Science & Business Media, Berlin, Heidelberg, New York",
            "year": 2012
        },
        {
            "authors": [
                "S. Secchi",
                "M. Squassina"
            ],
            "title": "On the location of spikes for the Schr\u00f6dinger equation with electromagnetic field",
            "venue": "Commun. Contemp. Math. 7 ",
            "year": 2005
        },
        {
            "authors": [
                "C. Sulem",
                "P.-L. Sulem"
            ],
            "title": "Self-focusing and wave collapse",
            "venue": "Applied Mathematical Sciences, vol. 139, Springer-Verlag, New York",
            "year": 1999
        },
        {
            "authors": [
                "Z.W. Tang"
            ],
            "title": "Multi-bump bound states of nonlinear Schr\u00f6dinger equations with electromagnetic fields and critical frequency",
            "venue": "J. Differ. Equ. 245 ",
            "year": 2008
        },
        {
            "authors": [
                "L.P. Wang",
                "C.Y. Zhao"
            ],
            "title": "Concentration on curves for a nonlinear Schr\u00f6dinger problem with electromagnetic potential",
            "venue": "J. Differ. Equ. 266 ",
            "year": 2019
        }
    ],
    "sections": [
        {
            "text": "Keywords: magnetic Schr\u00f6dinger equations, concentrations, constant electric potentials\nMSC 2020: 35J10, 35A01, 35B25\n1 Introduction\nThe magnetic Schr\u00f6dinger equation in N is given by\n( ( )) ( ) \u2223 \u2223 \u2202 \u2202 = \u2207 + + \u2212 \u2212A\u03b5 \u03c8 t \u03b5 x \u03c8 Q x \u03c8 \u03c8 \u03c8i i ,p2 1 (1)\nwhere >\u03b5 0 is a small parameter, < < + \u2212 p1 NN 2 2 if \u2265N 3, >p 1 if =N 2 and i is the imaginary unit. Here the function \u03c8 is complex-valued. The vector ( )= \u2026 \u2192A A A A, , , :N N N1 2 denotes the magnetic potential and \u2192Q : N represents the electric potential. The magnetic Laplacian ( )\u2207 + A\u03b5i 2 is defined by\n( ) \u2223 \u2223\u2207 + \u2254 \u2212 + \u22c5\u2207 + + \u2207\u22c5A A A A\u03b5 \u03c8 \u03b5 \u03c8 \u03b5 \u03c8 \u03c8 \u03b5\u03c8i \u0394 2i i .2 2 2\nThe vector A models the presence in some quantum model of the magnetic field B, which is given by\n\u23a7 \u23a8 \u23a9 ( ) =\n\u2202 \u2212 \u2202 =\n=\n\u2202 \u2212 \u2202 >\u00d7\nB A A A N\nN A A N\n, for 2, curl , for 3,\n, for 3.j k k j N N\n1 2 2 1\nFor the discussion of this operator, one may refer to [16]. Equation (1) arises in various physical contexts such as Bose-Einstein condensates and nonlinear optics [17]; or plasma physics where one can simulate the interaction effect among many particles by introducing some nonlinear terms, see [19].\nLiping Wang: School of Mathematical Sciences, Shanghai Key Laboratory of PMMP, East China Normal University, 200241, Shanghai, China\n * Corresponding author: Chunyi Zhao, School of Mathematical Sciences, Shanghai Key Laboratory of PMMP, East China Normal University, 200241, Shanghai, China, e-mail: cyzhao@math.ecnu.edu.cn\nOpen Access. \u00a9 2022 Liping Wang and Chunyi Zhao, published by De Gruyter. This work is licensed under the Creative Commons Attribution 4.0 International License.\nFrom now on we consider standing wave solutions to problem (1), namely ( ) ( )= \u2212\u03c8 t x u x, e \u03bb\u03b5 ti 1 for some complex-valued function ( )u x . Substituting this ansatz into problem (1), ( )u x should satisfy the following nonlinear magnetic Schr\u00f6dinger equation:\n( ) ( ) \u2223 \u2223\u2207 + + \u2212 =\u2212A\u03b5 u V x u u ui 0 in ,p N2 1 (2)\nwhere ( ) ( )= +V x Q x \u03bb. The potential ( )V x is then usually assumed to be smooth and satisfy\n( ) >V xinf 0.\nN\nConcerning nonlinear Schr\u00f6dinger equations with the magnetic field, the pioneer work is by Esteban-Lions [11], in which they prove the existence of standing waves to (1) by a constrained minimization approach, in the case ( ) =V x 1 and for special classes of magnetic fields. For more results, one can refer to [1,13,14] and references therein. On the other hand, problem (2) seems to be a very interesting problem since the correspondence\u2019s principle establishes that classical mechanics is, roughly speaking, contained in quantum mechanics. The mathematical transition from quantum mechanics to classical mechanics can be formally described by letting the Planck constant \u2192\u03b5 0, and thus the existence of solutions for \u03b5 small has physical interest. Standing waves for \u03b5 small are usually referred to as semi-classical bound states, see e.g., [13]. In the linear case, Helffer et al. [14] studied the asymptotic behavior of the eigenfunctions of the Schr\u00f6dinger operators with magnetic fields in the semiclassical limit.\nConcentrations play an important role in the study of problem (2). When \u2261A 0, the pioneer work of concentrations to problem (2) in one dimension was carried out by Floer andWeistein [12]. They proved that if the electric potential ( )V x has a non-degenerate critical point, then ( )u x concentrates near this critical point as \u2192\u03b5 0. This kind of solution with point concentrations is sometimes called peak solutions. After that, there are too many peak solution results for nonlinear Schr\u00f6dinger problems to give a full reference list here.\nThe first concentration result for nonlinear magnetic Schr\u00f6dinger equation (2) is given by Kurata [15]. Under some assumptions linking the magnetic field and electric potential, he showed that least energy solutions exist for every small \u03b5 and they exhibit peak concentrations at a global minimum point of V . Moreover, Kurata [15] mentioned that the magnetic potential A only contributes the phase factor of least energy solutions. Next, previous studies [4,7] proved that peak concentrations may also occur at any nondegenerate critical point, not necessarily a minimum of V , as \u2192\u03b5 0 by a reduction method. Cingolani and Secchi [8] again show that there exist peak solutions concentrating at topologically nontrivial critical points ofV by a penalization procedure. In the aforementioned papers, the presence of a magnetic field produce a phase in the complex wave, but does not influence the location of peaks. Later Cingolani et al. [6] used a variational approach and proved the existence of a multi-peak solution without any non-degenerate condition. But the locations of peaks are still near local minimum points ofV . For more related results see [5,20] and references therein.\nIt is interesting to ask whether the magnetic field affects the locations of concentrations. Secchi and Squassina in [18] show that the magnetic potential A might perhaps affect the locations of concentration points for the three-dimensional magnetic Schr\u00f6dinger equation. Nevertheless, in the particular but important case of power-type nonlinearities just as our case, they emphasize that the locations of peaks are independent of A. DiCosmo and Van Schaftingen in [10] then consider a strong magnetic field case ( )= \u2212A O \u03b5 2 , where the interaction between the magnetic field and the electric field is thus comparable. In this case, they obtain solutions concentrating around global or local minima of a limit energy that depends on the electric potential and the magnetic field. However, their limit energy does not show the effect of magnetic fields explicitly. Later Bonheure et al. [2] proved the existence of semiclassical cylindrically symmetric solutions to three-dimensional problem (2) whose moduli concentrates around a circle, which is driven by the magnetic and electric potentials. Their result shows that the magnetic field really influences the locations of concentrations if it occurs around a locus. Actually, this is a high-dimensional concentration phenomenon, not a peak concentration. See also [21] for a curve concentration phenomenon under a weak magnetic potential without symmetric conditions.\nThus, a nature question arises that whether a common, neither weak nor strong, magnetic potential A influences the locations of peak concentrations to the nonlinear magnetic Schr\u00f6dinger problem. What role does A play in this kind of concentration? To this aim, we assume the electric potentialV to be a constant, otherwise A has no effect on the locations of peaks due to the aforementioned works [4,6,7,15].\nRecently, Bonheure et al. [3] considers the ground state solution of magnetic Schr\u00f6dinger equations with a constant electric potential and no Planck constant \u03b5. Based on the assumption of a weak constant magnetic field, they show that the ground state solution is unique up to magnetic translations and rotations. Furthermore, the energy expansion of the ground state solution is also given in [3] as the constant magnetic field B is small enough.\nIn this article, we study the following nonlinear magnetic Schr\u00f6dinger equation:\n( ( )) \u2223 \u2223\u2207 + + \u2212 =\u2212A\u03b5 x u u u ui 0 in .p N2 1 (3)\nHere >p 1 is Sobolev subcritical, and ( )= \u2026A A A, , N1 : \u2192N N is assumed in ( )\u221eW ,N N1, and smooth everywhere for simplicity. To state our main result, we introduce the Frobenius norm of a matrix ( )= \u00d7mij I J\n\u239b \u239d \u239c\n\u2223 \u2223 \u239e\n\u23a0 \u239f\u2211\u2211\u2016 \u2016 = = = m .F i\nI\nj\nJ\nij 1 1\n2\n1 2\nAnd denote by ( ) (\u2223 \u2223)=w y w y the unique radial real-valued solution of\n( ) ( )\u2212 + = = > \u00b1\u221e =w w w w w w\u0394 0 in , 0 max 0, 0.p N N (4)\nNow our main results are the following.\nTheorem 1.1. Assume that the Frobenius norm \u2016 \u2016B F of the magnetic field B admits K local maximum (minimum) points { } =Pm mK 1 (which may be degenerate) and K disjoint, closed and bounded regions { } =\u03a9m mK 1 of N such that\n\u239c \u239f( ) \u239b \u239d ( ) \u239e \u23a0 \u2016 \u2016 = \u2016 \u2016 > \u2016 \u2016 \u2016 \u2016 = \u2016 \u2016 < \u2016 \u2016 \u2202 \u2202 B B B B B BP Pmax max . min min . .m F F F m F F F \u03a9 \u03a9 \u03a9 \u03a9m m m m\nThen there exists an >\u03b5 00 , such that for every < <\u03b5 \u03b50 0, problem (3) admits a solution u\u03b5 with the form\n\u239c \u239f( ) \u23a1\n\u23a3 \u23a2\n\u239b \u239d\n\u2223 \u2223 \u239e\n\u23a0\n\u239b \u239d \u239e \u23a0\n\u23a4 \u23a6 \u23a5 ( ) ( )\u2211= \u2212 + + = + \u22c5 \u2212u x w x \u03b6 \u03b5 \u03b5 x \u03b5 O \u03b5\u03a8 e ,A\u03b5 m K m \u03b5 m \u03c3 \u03b5 \u03b6 x 1 i i 2m \u03b5 m \u03b51\nfor some ( ) [ ]\u2026 \u2208\u03c3 \u03c3 \u03c0, , 0, 2\u03b5 K\u03b5 K1 , \u2208\u03b6 \u03a9m \u03b5 m. The definition of \u03a8m is given in (9).\nFor general critical points, i.e., not local extremum points, we also have the following result.\nTheorem 1.2. Assume that >p 32 and \u2026P P P, , , K1 2 , \u2265K 1 are all non-degenerate critical points of \u2016 \u2016B F 2 . Then there exists an >\u03b5 00 such that for any < <\u03b5 \u03b50 ,0 problem (3) admits a solution u\u03b5 with the form\n\u239c \u239f( ) \u23a1\n\u23a3 \u23a2\n\u239b \u239d\n\u2223 \u2223 \u239e\n\u23a0\n\u239b \u239d \u239e \u23a0\n\u23a4 \u23a6 \u23a5 ( ) ( )\u2211= \u2212 + + = + \u22c5 \u2212u x w x \u03b6 \u03b5 \u03b5 x \u03b5 O \u03b5\u03a8 e ,A\u03b5 m K m \u03b5 m \u03c3 \u03b5 \u03b6 x 1 i i 2m \u03b5 m \u03b51\nfor some ( ) [ ]\u2026 \u2208\u03c3 \u03c3 \u03c0, , 0, 2\u03b5 K\u03b5 K1 and ( )= +\u03b6 P o 1m \u03b5 m . The definition of \u03a8m is given in (9).\nRemark 1.3. Theorems 1.1 and 1.2 clearly show the effect of the magnetic vector A, or precisely the magnetic field B, in driving the locations of peak concentrations if the electric potential is constant. This is a new phenomenon.\nRemark 1.4. Theorem 1.1 holds for any subcritical >p 1. And Theorem 1.2 holds only for the subcritical >p 32 . The reason is that the critical point of the function deduced by the energy functional is the local extremum point in Theorem 1.1, which may be obtained by direct comparison. While in Theorem 1.2, \u2026P P P, , , K1 2 may not be extremum points any more. Thus, we have to study the derivatives of the energy functional. Naturally, the corresponding estimates should have higher accuracy for which the better regularity of the nonlinear term \u2223 \u2223 \u2212u up 1 is required.\nFrom the point view of physics, the magnetic field B is essential, not the particular choice of magnetic potential A. At the same time, there is a gauge invariance for the magnetic Laplacian correspondingly, that is, the magnetic field B is invariant under the transform of the potential \u2192 + \u2207A A f . Also, it is easy to see that the energy of problem (3) is unchanged under the gauge invariance, with which our result coincides (see Proposition 4.3).\nThe proofs of main theorems are based on the reduction method. When the electric potential ( )V x has some non-degeneracy, we just need to make an approximation from the limit equation, which is enough to deduce the roles of function ( )V x . But in order to see the roles of magnetic vector potential A in our case, we need an approximation up to order \u03b5 of problem (3), i.e., a second approximation have to be done. Finally, we mention that the solutions given in both Theorems 1.1 and 1.2 show simple peak concentrations. In the forthcoming article, we will deal with multi-bump solutions for constant electric potential.\nThe article is organized as follows. In Section 2, the ansatz and the estimate of the error are given. The corresponding nonlinear problem is solved in Section 3. In Section 4, the original problem is reduced to the finite dimension problem using variational reduction process and the expansion of the energy functional is shown. Finally, Theorems 1.1 and 1.2 are proved in Section 5. Notations. 1. Constant { }= \u2212\u03b2 pmin 1, 1 . 2. The real part of \u2208z will be denoted by zRe . 3. The complex conjugate of \u2208z will be denoted by z\u0304 . 4. C denotes a generic positive constant, which may be different from lines to lines. 5. Landau symbol ( )O \u03b5 is a generic function such that \u2223 ( )\u2223 \u2264O \u03b5 C\u03b5 and ( )o \u03b5 means that \u2223 ( ) \u2223 =\u2192 +lim 0\u03b5 o \u03b5\u03b50 .\n2 Ansatz\nIn this section, we present the approximation of the problem and give the corresponding error estimate. Recall in [15] that the problem\n\u2223 \u2223 ( )\u2212 + = \u2208\u2212w w w w w H\u0394 \u02dc \u02dc \u02dc \u02dc 0, \u02dc , ,p N1 1\npossesses a unique ground state solution ( ) ( )=w y w y\u02dc e \u03c3i , [ ]\u2200 \u2208\u03c3 \u03c00, 2 where ( )w y is the radial solution of problem (4). Thus, by the gauge invariance,\n\u239c \u239f( ) \u239b\n\u239d\n\u2223 \u2223 \u239e\n\u23a0 [ ]\u0360 ( )=\n\u2212 \u2200 \u2208+ \u22c5 \u2212U x w x \u03b6 \u03b5 \u03c3 \u03c0e , 0, 2 ,A\u03c3 \u03b5 \u03b6 xi i 1\nis also the ground state solution to the constant magnetic potential problem\n( ( )) \u2223 \u2223 ( )\u0360 \u0360 \u0360 \u0360 \u0360\u2207 + + \u2212 = \u2208\u2212A\u03b5 \u03b6 U U U U U Hi 0, , .p N2 1 1\nIn the frame of large variable = /y x \u03b5, the original problem (3) is equivalent to\n( ( )) \u2223 \u2223\u2207 + + \u2212 =\u2212A \u03b5y u u u ui 0 in .p N2 1 (5)\nTherefore, the function\n( ) (\u2223 \u2223) ( )= \u2212 \u2032 \u2032 = /+ \u22c5U y w y \u03b6 \u03b6 \u03b6 \u03b5e , ,A\u03c3 \u03b6 yi i\nformally approximates the solution at least near = \u2032y \u03b6 . Now it is time to give the first approximation\n( ) ( ) ( ) (\u2223 \u2223) [ ]( )\u2211= = \u2212 \u2032 \u2208 = + \u22c5W y U y U y w y \u03b6 \u03c3 \u03c0, e , 0, 2 ,A m\nK\nm m m \u03c3 \u03b6 y\nm 1\ni im m (6)\nwhere \u2208\u03b6 \u03a9m m, = \u2026m K1, 2, , . Denote\n( )\u2254 > \u2264 \u2260 \u2264 \u03c1 min dist \u03a9 , \u03a9 0 i j K i j 1\nand take a positive number \u03b4 such that \u2264\u03b4 \u03c114 . Let ( )R y be the error caused by the first approximation W , which is\n( ) ( ( )) \u2223 \u2223= \u2207 + + \u2212 \u2212AR y \u03b5y W W W Wi .p2 1\nIt is checked that for \u2223 \u2223\u2212 \u2032 \u2264y \u03b6 \u03b4\u03b51 , \u2223 \u2223 \u2223 \u2223\u2264 \u2212\n\u2223 \u2032 \u2212 \u2032\u2223 U U em 1 \u03b6m \u03b61 3 , = \u2026m K2, 3, , and\n( ) ( ) \u239b \u239d (\u2223 \u2223) (\u2223 \u2223) \u239e \u23a0\n( ) ( (\u2223 \u2223) (\u2223 \u2223))\n\u0360\n\u0360\n= + \u2212 \u2032 + \u2212 \u2032\n= + \u2212 \u2032 + \u2212 \u2032\n\u2264 \u2264\n\u2212 \u2212\n\u2264 \u2264\n\u2212\n\u2212 \u2212\n\u2223 \u2212 \u2223 \u2223 \u2212 \u2223\nR y R y O w y \u03b6 w y \u03b6\nR y O w y \u03b6 w y \u03b6\nmax e max e\ne , m K\np m K\np\n1 2 1\n1 2\n1 1\n1\n\u03b6m \u03b6 \u03b5\n\u03b6m \u03b6 \u03b5\n\u03b4 \u03b5\n1 3\n1 2\nwhere\n( ) ( ( )) \u2223 \u2223 ( ( )) ( ( ))\n( ( ) ( )) ( ) (\u2223 ( )\u2223 \u2223 ( )\u2223 ) ( ( ) ( )) [ (\u2223 \u2223) ( ) (\u2223 \u2223)] ( )\n(\u2223 ( )\u2223 \u2223 ( )\u2223 ) (\u2223 \u2223)\n[ ( ) ( ( ) ( )) (\u2223 ( )\u2223 \u2223 ( )\u2223 )] [ ( ( ) ( )) (\u2223 \u2223)\n( ) (\u2223 \u2223)]\n(\u2223 ( ) ( )\u2223) (\u2223 \u2223) [ ( ( ) ( )) (\u2223 \u2223)\n( ) (\u2223 \u2223)]\n\u0360\n( )\n( )\n( )\n( )\n( )\n= \u2207 + + \u2212 = \u2207 + \u2212 \u2207 + = \u2212 \u22c5\u2207 + \u2207 \u22c5 + \u2212 = \u2212 \u22c5 \u2207 \u2212 \u2032 + \u2212 \u2032 + \u2207 \u22c5\n+ \u2212 \u2212 \u2032\n= \u2212 \u22c5 \u2212 + \u2212 + \u2212 \u22c5\u2207 \u2212 \u2032\n+ \u2207 \u22c5 \u2212 \u2032\n= \u2212 \u2212 \u2032 + \u2212 \u22c5\u2207 \u2212 \u2032\n+ \u2207 \u22c5 \u2212 \u2032\n\u2212\n+ \u22c5\n+ \u22c5\n+ \u22c5\n+ \u22c5\n+ \u22c5\nA A A A A A A A A A A\nA A\nA A A A A A A\nA A A A\nA\nR y \u03b5y U U U U \u03b5y U \u03b6 U \u03b5y \u03b6 U \u03b5 A U \u03b5y \u03b6 U\n\u03b5y \u03b6 w y \u03b6 \u03b6 w y \u03b6 \u03b5 U\n\u03b5y \u03b6 w y \u03b6\n\u03b6 \u03b5y \u03b6 \u03b5y \u03b6 U \u03b5y \u03b6 w y \u03b6\n\u03b5 A w y \u03b6\n\u03b5y \u03b6 w y \u03b6 \u03b5y \u03b6 w y \u03b6\n\u03b5 w y \u03b6\ni i i 2i i 2i i e i\ne\n2 i 2\ne\ne i 2\ne .\nA\nA\nA\nA\nA\np\nx\n\u03c3 \u03b6 y x\n\u03c3 \u03b6 y\nx \u03c3 \u03b6 y\n\u03c3 \u03b6 y\nx \u03c3 \u03b6 y\n2 1 1 1 1 1\n2 1 1 2 1\n1 1 1 2\n1 2 1\n1 1 1 1 i i\n1\n2 1 2 1 i i\n1 1 2\n1 2 1 1 1\n1 i i\n1 2\n1 i i\n1 1\n1 i i\n1 1\n1 1\n1 1\n1 1\n1 1\n(7)\nAs usual one writes ( )\u2032 = \u2032 \u2032 \u2026 \u2032\u03b6 \u03b6 \u03b6 \u03b6, , ,m m m m N,1 ,2 , . Direct calculation shows that\n\u239c \u239f\n\u2223 ( ) ( )\u2223 ( ( ) ( ))\n\u239b \u239d ( ) ( ) ( ) ( ) ( ) ( \u2223 \u2223 )\u239e \u23a0\n( ) ( )( )( ) ( ) ( )( )( )(\n) ( \u2223 \u2223 )\n\u2211\n\u2211\n\u2211 \u2211\n\u2212 = \u2212\n= \u2207 \u22c5 \u2212 \u2032 + \u2212 \u2032 \u22c5\u2207 \u22c5 \u2212 \u2032 + \u2212 \u2032\n= \u2202 \u2202 \u2212 \u2032 \u2212 \u2032 + \u2202 \u2202 \u2212 \u2032 \u2212 \u2032\n\u2212 \u2032 + \u2212 \u2032\n=\n=\n\u22a5\n= \u2113=\n\u2113 \u2113\n\u2113\nA A\u03b5y \u03b6 A \u03b5y A \u03b6\n\u03b5 A \u03b6 y \u03b6 \u03b5 y \u03b6 A \u03b6 y \u03b6 O \u03b5 y \u03b6\n\u03b5 A \u03b6 A \u03b6 y \u03b6 y \u03b6 \u03b5 A \u03b6 A \u03b6 y \u03b6 y \u03b6 y\n\u03b6 O \u03b5 y \u03b6\n2\n.\ni\nN\ni i\ni\nN\ni i\ni j k\nN\nj i k i j j k k i j k\nN\nj i k i j j k k\n1 2\n1 1\n2\n1 1 1\n2\n1 2\n1 1 3\n1 3\n2\n2\n, , 1 1 1 1, 1,\n3\n, , , 1 1 1 1, 1,\n1, 4\n1 4\nSimilarly, it is verified that\n( ( ) ( )) (\u2223 \u2223) ( ( ) ( )) (\u2223 \u2223)\n( )( ) (\u2223 \u2223) ( )( )( ) (\u2223 \u2223)\n( )( )( )( ) (\u2223 \u2223)\n( \u2223 \u2223 \u2223 (\u2223 \u2223)\u2223)\n\u2211\n\u2211 \u2211\n\u2211\n\u2212 \u22c5\u2207 \u2212 \u2032 = \u2212 \u2202 \u2212 \u2032\n= \u2202 \u2212 \u2032 \u2202 \u2212 \u2032 + \u2202 \u2212 \u2032 \u2212 \u2032 \u2202 \u2212 \u2032\n+ \u2202 \u2212 \u2032 \u2212 \u2032 \u2212 \u2032 \u2202 \u2212 \u2032\n+ \u2212 \u2032 \u2207 \u2212 \u2032\n=\n= =\n\u2113=\n\u2113 \u2113 \u2113\nA A\u03b5y \u03b6 w y \u03b6 A \u03b5y A \u03b6 w y \u03b6\n\u03b5 A \u03b6 y \u03b6 w y \u03b6 \u03b5 A \u03b6 y \u03b6 y \u03b6 w y \u03b6\n\u03b5 A \u03b6 y \u03b6 y \u03b6 y \u03b6 w y \u03b6\nO \u03b5 y \u03b6 w y \u03b6\n2\n6\n.\ni\nN\ni i i\ni j\nN\nj i j j i i j k\nN\njk i j j k k i\ni j k\nN\njk i j j k k i\n1 1 1\n1 1\n, 1 1 1, 1\n2\n, , 1 1 1, 1, 1\n3\n, , , 1 1 1, 1, 1, 1\n4 1 4 1\nAs for the term ( ) (\u2223 \u2223)\u2207 \u22c5 \u2212 \u2032A \u03b5y w y \u03b6 ,x 1 we expand it similarly to\n( ) (\u2223 \u2223) ( ) (\u2223 \u2223) ( )( ) ( ) (\u2223 \u2223)\n( ) ( )( ) ( ) (\u2223 \u2223) ( \u2223 \u2223 (\u2223 \u2223))\n( ) (\u2223 \u2223) ( )( ) (\u2223 \u2223)\n( )( )( ) (\u2223 \u2223) ( \u2223 \u2223 (\u2223 \u2223))\n\u2211\n\u2211\n\u2207 \u22c5 \u2212 \u2032 = \u2207 \u22c5 \u2212 \u2032 + \u2207 \u2207 \u22c5 \u22c5 \u2212 \u2032 \u2212 \u2032\n+ \u2212 \u2032 \u22c5\u2207 \u2207 \u22c5 \u22c5 \u2212 \u2032 \u2212 \u2032 + \u2212 \u2032 \u2212 \u2032\n= \u2207 \u22c5 \u2212 \u2032 + \u2202 \u2212 \u2032 \u2212 \u2032\n+ \u2202 \u2212 \u2032 \u2212 \u2032 \u2212 \u2032 + \u2212 \u2032 \u2212 \u2032\n\u22a5\n=\n=\nA A A\nA\nA\n\u03b5y w y \u03b6 \u03b6 w y \u03b6 \u03b5 \u03b6 y \u03b6 w y \u03b6\n\u03b5 y \u03b6 \u03b6 y \u03b6 w y \u03b6 O \u03b5 y \u03b6 w y \u03b6\n\u03b6 w y \u03b6 \u03b5 A \u03b6 y \u03b6 w y \u03b6\n\u03b5 A \u03b6 y \u03b6 y \u03b6 w y \u03b6 O \u03b5 y \u03b6 w y \u03b6\n1 2\n2 .\nx x x\nx\nx i j\nN\nij i j j\ni j k\nN\njki i j j k k\n1 1 1 1 1 1\n2 1\n2 1 1 1\n3 1 3 1\n1 1 , 1\n1 1, 1\n2\n, , 1 1 1, 1, 1\n3 1 3 1\nTherefore, in the region \u2223 \u2223\u2212 \u2032 <y \u03b6 \u03b4\u03b51 , we obtain that\n( ) \u239b\n\u239d \u239c\n( )( ) (\u2223 \u2223) ( ) (\u2223 \u2223) \u239e\n\u23a0 \u239f\n( ) ( )( )( ) (\u2223 \u2223)\n( )( )( ) (\u2223 \u2223) ( )( ) (\u2223 \u2223)\n( ) ( )( )( )( ) (\u2223 \u2223)\n( )( )( )( ) (\u2223 \u2223)\n( )( )( ) (\u2223 \u2223)\n( \u2223 \u2223 \u2223 (\u2223 \u2223)\u2223) ( \u2223 \u2223 \u2223 (\u2223 \u2223)\u2223 \u2223 \u2223 \u2223 (\u2223 \u2223)\u2223)\n\u0360 ( ) \u2211\n\u2211\n\u2211 \u2211\n\u2211\n\u2211\n\u2211\n= \u2202 \u2212 \u2032 \u2202 \u2212 \u2032 + \u2207 \u22c5 \u2212 \u2032\n+ \u2202 \u2202 \u2212 \u2032 \u2212 \u2032 \u2212 \u2032\n+ \u2202 \u2212 \u2032 \u2212 \u2032 \u2202 \u2212 \u2032 + \u2202 \u2212 \u2032 \u2212 \u2032\n+ \u2202 \u2202 \u2212 \u2032 \u2212 \u2032 \u2212 \u2032 \u2212 \u2032\n+ \u2202 \u2212 \u2032 \u2212 \u2032 \u2212 \u2032 \u2202 \u2212 \u2032\n+ \u2202 \u2212 \u2032 \u2212 \u2032 \u2212 \u2032\n+ \u2212 \u2032 \u2212 \u2032 + \u2212 \u2032 \u2207 \u2212 \u2032 + \u2212 \u2032 \u2212 \u2032\n\u2212 \u2212 \u22c5\n=\n=\n= =\n\u2113=\n\u2113 \u2113 \u2113\n\u2113=\n\u2113 \u2113 \u2113\n=\nAR y \u03b5 A \u03b6 y \u03b6 w y \u03b6 \u03b6 w y \u03b6\n\u03b5 A \u03b6 A \u03b6 y \u03b6 y \u03b6 w y \u03b6\n\u03b5 A \u03b6 y \u03b6 y \u03b6 w y \u03b6 \u03b5 A \u03b6 y \u03b6 w y \u03b6\n\u03b5 A \u03b6 A \u03b6 y \u03b6 y \u03b6 y \u03b6 w y \u03b6\n\u03b5 A \u03b6 y \u03b6 y \u03b6 y \u03b6 w y \u03b6\n\u03b5 A \u03b6 y \u03b6 y \u03b6 w y \u03b6\nO \u03b5 y \u03b6 w y \u03b6 O \u03b5 y \u03b6 w y \u03b6 \u03b5 y \u03b6 w y \u03b6\ne i 2\ni i\n3 i\n2 i\ni .\nA\u03c3 \u03b6 y\ni j\nN\nj i j j i x\ni j k\nN\nj i k i j j k k\ni j k\nN\njk i j j k k i i j\nN\nij i j j\ni j k\nN\nj i k i j j k k\ni j k\nN\njk i j j k k i\ni j k\nN\njki i j j k k\ni i\n, 1 1 1, 1 1 1\n2\n, , 1 1 1 1, 1, 1\n2\n, , 1 1 1, 1, 1\n2\n, 1 1 1, 1\n3\n, , , 1 1 1 1, 1, 1, 1\n3\n, , , 1 1 1, 1, 1, 1\n3\n, , 1 1 1, 1, 1\n4 1 4 1\n4 1 4 1\n4 1 3 1\n1 1\nNote that the imaginary part of ( )\u0360 ( )\u2212 \u2212 \u22c5R y e A\u03c3 \u03b6 yi i1 1 is ( )O \u03b5 . It is of less accuracy for later application. Complying with the guideline that the better approximation, the more possibility to obtain a solution, we should improve the accuracy of the approximation. To this purpose, we find that the real-valued function ( ) ( )( ) (\u2223 \u2223)= \u2212 \u2032 \u2212 \u2032 \u2212 \u2032y y \u03b6 y \u03b6 w y \u03b6\u03a8 ij i i j j1, 1 2 1, 1, 1 ( )\u2260i j is the solution to\n(\u2223 \u2223) ( ) (\u2223 \u2223) ( ) (\u2223 \u2223)\u2212 + \u2212 \u2212 \u2032 = \u2212 \u2212 \u2032 \u2202 \u2212 \u2032 = \u2212 \u2212 \u2032 \u2202 \u2212 \u2032\u2212w y \u03b6 y \u03b6 w y \u03b6 y \u03b6 w y \u03b6\u0394\u03a8 \u03a8 \u03a8 2 2 .ij ij p ij j j i i i j1, 1, 1 1 1, 1, 1 1, 1\nBesides, ( ) ( ) (\u2223 \u2223)= \u2212 \u2032 \u2212 \u2032y y \u03b6 w y \u03b6\u03a8 ii i i1, 1 2 1, 2 1 satisfies the equation\n(\u2223 \u2223) ( ) (\u2223 \u2223) (\u2223 \u2223)\u2212 + \u2212 \u2212 \u2032 = \u2212 \u2212 \u2032 \u2202 \u2212 \u2032 \u2212 \u2212 \u2032\u2212w y \u03b6 y \u03b6 w y \u03b6 w y \u03b6\u0394\u03a8 \u03a8 \u03a8 2 .ii ii p ii i i i1, 1, 1 1 1, 1, 1 1\nThen obviously the function\n( )\n\u239b\n\u239d\n\u239c \u239c \u239c\n( ) ( ) ( ) ( )\n\u239e\n\u23a0\n\u239f \u239f \u239f\n\u239b \u239d \u239c\n( ) ( ) \u239e\n\u23a0 \u239f\n( )( ) ( ) ( )\u2211 \u2211 \u2211= \u2202 + \u2202 = \u2202 \u2254 =\n\u2260\n=\n+ \u22c5\n= + \u22c5 + \u22c5y A \u03b6 y A \u03b6 y A \u03b6 y \u03c8 y\u03a8 i \u03a8 \u03a8 e i \u03a8 e i eA A A i j i j\nN\nj i ij i\nN\ni i ii \u03c3 \u03b6 y\ni j\nN\nj i ij \u03c3 \u03b6 y \u03c3 \u03b6 y\n1 , 1\n1 1, 1\n1 1, i i\n, 1 1 1,\ni i 1 i i1 1 1 1 1 1\nsatisfies\n( ( )) ( )\u2223 \u2223 ( ) \u2223 \u2223\n\u23a1 \u23a3 \u23a2 ( )( ) (\u2223 \u2223) ( ) (\u2223 \u2223) \u23a4 \u23a6 \u23a5 ( )\u2211\n\u2207 + + \u2212 \u2212 \u2212\n= \u2212 \u2202 \u2212 \u2032 \u2202 \u2212 \u2032 \u2212 \u2207 \u22c5 \u2212 \u2032\n\u2212 \u2212\n=\n+ \u22c5\nA\nA\n\u03b6 p U U U U\nA \u03b6 y \u03b6 w y \u03b6 \u03b6 w y \u03b6\ni \u03a8 \u03a8 1 Re \u03a8 \u03a8\ni 2 e ,A\np p\ni j\nN\nj i j j i x \u03c3 \u03b6 y\n1 2 1 1 1 3\n1 1 1 1 1 1\n, 1 1 1, 1 1 1\ni i1 1\nsince ( ) =URe \u03a8 01 1 . Moreover, the same computation may also be carried out in the region \u2223 \u2223\u2212 \u2032 <y \u03b6m \u03b4 \u03b5 for = \u2026m K2, , . The ultimate approximation is then selected as\n( ) ( ) ( )= +y W y \u03b5 y\u03a8 , (8)\nwhere ( ) ( )= \u2211 = y y\u03a8 \u03a8m K m1 . Here\n( ) \u239b\n\u239d \u239c\n( ) ( ) \u239e\n\u23a0 \u239f ( )( ) ( )\u2211= \u2202 \u2254 = + \u22c5 + \u22c5y A \u03b6 y \u03c8 y\u03a8 i \u03a8 e i eA Am i j\nN\nj i m m ij \u03c3 \u03b6 y\nm \u03c3 \u03b6 y\n, 1 ,\ni i i im m m m (9)\nand\n( ) ( )( ) (\u2223 \u2223)= \u2212 \u2032 \u2212 \u2032 \u2212 \u2032y y \u03b6 y \u03b6 w y \u03b6\u03a8 1 2 .m ij i m i j m j m, , ,\nNow the approximation is good enough to help us find a solution. Precisely, our aim is to find a solution with the form ( ) ( )+y \u03d5 y of problem (3), where \u03d5 is a small perturbation and satisfies the equation\n( ( )) ( )\u2223 \u2223 ( ) \u2223 \u2223 ( ) ( )\u2254 \u2207 + + \u2212 \u2212 \u2212 = \u2212 +\u2212 \u2212AL\u03d5 \u03b5y \u03d5 \u03d5 p \u03d5 \u03d5 R y N \u03d5i 1 Re .p p2 3 1 (10)\nHere ( )R y denotes the error caused by , which is\n( ) ( ( )) \u2223 \u2223= \u2207 + + \u2212 \u2212AR y \u03b5yi ,p2 1\nand the nonlinear term\n( ) \u2223 \u2223 ( ) \u2223 \u2223 ( )\u2223 \u2223 ( ) \u2223 \u2223= + + \u2212 \u2212 \u2212 \u2212\u2212 \u2212 \u2212 \u2212N \u03d5 \u03d5 \u03d5 p \u03d5 \u03d51 Re .p p p p1 1 3 1\nObviously, with the notation { }= \u2212\u03b2 pmin 1, 1 ,\n\u2223 ( )\u2223 \u2223 \u2223\u2264 +N \u03d5 C \u03d5 .\u03b21\nTo solve problem (10), it is important to estimate the error ( )R y .\nProposition 2.1. We have that\n( )\u2016 \u2016 \u2264R y C\u03b5L 22\nand\n( ) ( )\u2016\u2202 \u2016 \u2264 \u2016\u2202 \u2016 \u2264 \u2200 = \u2026 = \u2026\u2032 R y C\u03b5 R y C\u03b5 m K k N, , 1, , , 1, , .\u03b6 L \u03c3 L2 2m k m, 2 2\nProof. First, we consider the domain \u2223 \u2223\u2212 \u2032 \u2264y \u03b6 ,m \u03b4 \u03b5 without loss of generality, say =m 1. Then\n( ) ( ) [( ( )) ( )\u2223 \u2223 ( ) \u2223 \u2223 ] [\u2223 \u2223 ( ) \u2223 \u2223 ( )\u2223 \u2223 ( ) \u2223 \u2223 ]\n( ) \u239b\n\u239d \u239c\n( )( ) (\u2223 \u2223) ( )( ) (\u2223 \u2223) \u239e\n\u23a0 \u239f\n[( ( )) ( ( )) ] \u23a1\n\u23a3 \u23a2\n( ( )) \u23a4\n\u23a6 \u23a5\n( ) (\u2223 \u2223) ( ) (\u2223 \u2223)\n\u2223 \u2223 \u2223 (\u2223 \u2223) (\u2223 \u2223) (\u2223 \u2223)\n\u0360 ( )\n( ) ( )\n( )\n\u2211\n\u2211 \u2211\n= + \u2207 + + \u2212 \u2212 \u2212\n\u2212 + + \u2212 \u2212 \u2212 \u2212\n= \u2212 \u2202 \u2212 \u2032 \u2202 \u2212 \u2032 + \u2207 \u22c5 \u2212 \u2032\n+ \u2207 + \u2212 \u2207 + + \u2207 + +\n\u2212 \u2212\n\u2212 \u2032 \u2212 \u2212\n\u2212 \u2032\n+ \u2212 \u2032 \u2212 \u2032 + \u2212 \u2032 + \u2212 \u2032\n\u2212 \u2212\n\u2212 \u2212 \u2212 \u2212\n=\n+ \u22c5\n= =\n\u2212 + \u22c5 \u2212 + \u22c5\n\u2212 \u2212 \u2212\nA\nA\nA A A\nR y R y \u03b5 \u03b5y p W W W W W \u03b5 W \u03b5 W W \u03b5 p W W W \u03b5 W\nR y \u03b5 A \u03b6 y \u03b6 w y \u03b6 \u03b6 w y \u03b6\n\u03b5 \u03b5y \u03b6 \u03b5 \u03b5y\np \u03b5 \u03c8 y w y \u03b6 p \u03b5 \u03c8 y w y \u03b6\nO \u03b5 y \u03b6 w y \u03b6 w y \u03b6 w y \u03b6\ni \u03a8 \u03a8 1 Re \u03a8 \u03a8 \u03a8 \u03a8 1 Re \u03a8 \u03a8\ni 2 e\ni \u03a8 i \u03a8 i \u03a8 \u03a8\n1 2\ne i 1 2\ne\ne e .\nA\nA A\np p\np p p p\ni j\nN\nj i j j i x \u03c3 \u03b6 y\nm\nK\nm m\nK\nm\np \u03c3 \u03b6 y p \u03c3 \u03b6 y\np p\n2 3 1\n1 1 3 1\n, 1 1 1, 1 1 1\ni i\n2 1 1 2 1\n2\n2 2\n2 1 2 2\n1 i i 3 1 3 3\n1 i i\n4 1 8 1 1\n1 1 \u03b4 \u03b5 \u03b4 \u03b5\n1 1\n1 1 1 1\nObviously, we have that\n( ) (\u2223 \u2223) (\u2223 \u2223) ( ) ( ) ( ) ( )\n(\u2223 \u2223) ( ) ( )( )( )( )( )\n\u2211 \u2211\n\u2211\n\u2212 \u2032 = \u2212 \u2032 \u2202 \u2202\n= \u2212 \u2032 \u2202 \u2202 \u2212 \u2032 \u2212 \u2032 \u2212 \u2032 \u2212 \u2032\n\u2212 \u2212\n= \u2113=\n\u2113 \u2113\n\u2113=\n\u2113 \u2113 \u2113\n\u03b5 \u03c8 y w y \u03b6 \u03b5 w y \u03b6 A \u03b6 y A \u03b6 y\n\u03b5 w y \u03b6 A \u03b6 A \u03b6 y \u03b6 y \u03b6 y \u03b6 y \u03b6\n\u03a8 \u03a8\n4\np p\ni j\nN\nj i ij k\nN\nk k\np\ni j k\nN\nj i k i i j j k k\n2 1 2 2 1\n2 2 1\n, 1 1 1,\n, 1 1 1,\n2\n1 , , , 1\n1 1 1, 1, 1, 1,\nand\n\u239c \u239f \u23a1 \u23a3 \u23a2 ( ( )) \u23a4 \u23a6 \u23a5 \u239b \u239d (\u2223 \u2223) \u239e \u23a0 (\u2223 \u2223)( )\u2211 \u2211 \u2211\u2207 + + = \u2212 \u2032 = \u2212 \u2032 = = = \u2212A\u03b5 \u03b5y O w y \u03b6 O w y \u03b6i \u03a8 \u03a8 e . m\nK\nm m\nK\nm m\nK\nm 2\n2 2 2 1\n\u03b4 \u03b5\nMoreover, it is checked as in (7) that\n( ( )) ( ( )) ( ( ) ( )) ( ( )) (\u2223 ( )\u2223 \u2223 ( )\u2223 )\n[ ( ( ) ( )) ( ( )) ] \u2223 ( )\n( )\u2223\n( )\n( )\n\u2207 + \u2212 \u2207 + = \u2212 \u22c5\u2207 + \u2207 \u22c5 + \u2212\n= \u2212 \u2212 \u22c5\u2207 + \u2207 \u22c5 +\n\u2212\n+ \u22c5\n+ \u22c5\nA A A A A A A\nA A A A A\n\u03b5y \u03b6 \u03b5y \u03b6 \u03b5 \u03b5y \u03b5y \u03b6\n\u03b5y \u03b6 \u03c8 \u03b5 \u03b5y \u03c8 e \u03b5y \u03b6 \u03c8 e\ni \u03a8 i \u03a8 2i \u03a8 i \u03a8 \u03a8\n2 i\n.\nA\nA\nx\nx \u03c3 \u03b6 y\n\u03c3 \u03b6 y\n2 1 1 2 1 1 1 1\n2 1 2 1\n1 1 1 i i\n1 2 1 i i\n1 1\n1 1\n(11)\nLet us estimate them one by one in (11) for \u2260 \u2032y \u03b61 . Note that\n( ( ) ( )) ( ( ) ( ))\n( ) ( ) ( ) ( ) ( ) ( \u2223 \u2223 \u2223 \u2223)\n( )( ) \u23a1\n\u23a3 \u23a2 ( )\n\u23a4 \u23a6 \u23a5\n( )( )( ) \u23a1\n\u23a3 \u23a2 ( )\n\u23a4 \u23a6 \u23a5 ( \u2223 \u2223 (\u2223 \u2223))\n\u2211\n\u2211 \u2211\n\u2211 \u2211\n\u2211 \u2211\n\u2212 \u22c5\u2207 = \u2212 \u2202\n= \u2207 \u22c5 \u2212 \u2032 \u2202 + \u2212 \u2032 \u22c5\u2207 \u22c5 \u2212 \u2032 \u2202 + \u2212 \u2032 \u2207\n= \u2202 \u2212 \u2032 \u2202 \u2202\n+ \u2202 \u2212 \u2032 \u2212 \u2032 \u2202 \u2202 + \u2212 \u2032 \u2212 \u2032\n=\n= =\n\u22a5\n\u2113=\n\u2113 \u2113 \u2113\n=\n\u2113 =\n\u2113 \u2113 \u2113\n=\nA A\u03b5y \u03b6 \u03c8 A \u03b5y A \u03b6 \u03c8\n\u03b5 A \u03b6 y \u03b6 \u03c8 \u03b5 y \u03b6 A \u03b6 y \u03b6 \u03c8 O \u03b5 y \u03b6 \u03c8\n\u03b5 A \u03b6 y \u03b6 A \u03b6\n\u03b5 A \u03b6 y \u03b6 y \u03b6 A \u03b6 O \u03b5 y \u03b6 w y \u03b6\n2\n\u03a8\n2 \u03a8 .\nk\nN\nk k k\nk\nN\nk k k\nN\nk k\nk\nN\nk i j\nN\nj i k ij\nk s\nN\ns k s s i j\nN\nj i k ij\n1 1 1\n1 1\n1 1 1 1\n2\n1 1\n2 1 1 1\n3 1 3 1\n, 1 1 1, , 1 1 1,\n2\n, , 1 1 1, 1, , 1 1 1,\n3 1 5 1\nIt is easy to see that (\u03b4ik is the Kronecker symbol) for \u2260 \u2032y \u03b61 ,\n( ) \u23a1\n\u23a3 \u23a2\n( ( ) ( )) (\u2223 \u2223) ( )( )( ) (\u2223 \u2223)\n\u2223 \u2223\n\u23a4 \u23a6 \u23a5\n\u2202 = \u2212 \u2032 + \u2212 \u2032 \u2212 \u2032 + \u2212 \u2032 \u2212 \u2032 \u2212 \u2032 \u2032 \u2212 \u2032\n\u2212 \u2032 y \u03b4 y \u03b6 \u03b4 y \u03b6 w y \u03b6 y \u03b6 y \u03b6 y \u03b6 w y \u03b6 y \u03b6 \u03a8 1 2 .k ij ik j j jk i i i i j j k k1, 1, 1, 1 1, 1, 1, 1\n1\nThus, we conclude that\n( ( ) ( )) ( )[ ( ) ( )]( )( ) (\u2223 \u2223)\n( ) ( )( )( )( )( ) (\u2223 \u2223)\n\u2223 \u2223\n( )[ ( ) ( )]( )( )( ) (\u2223 \u2223)\n( ) ( )( )( )( )( )\n( ) (\u2223 \u2223)\n\u2223 \u2223 ( \u2223 \u2223 (\u2223 \u2223))\n\u2211\n\u2211\n\u2211\n\u2211\n\u2212 \u22c5\u2207 = \u2202 \u2202 + \u2202 \u2212 \u2032 \u2212 \u2032 \u2212 \u2032\n+ \u2202 \u2202 \u2212 \u2032 \u2212 \u2032 \u2212 \u2032 \u2212 \u2032 \u2032 \u2212 \u2032\n\u2212 \u2032\n+ \u2202 \u2202 + \u2202 \u2212 \u2032 \u2212 \u2032 \u2212 \u2032 \u2212 \u2032\n+ \u2202 \u2202 \u2212 \u2032 \u2212 \u2032 \u2212 \u2032 \u2212 \u2032\n\u00d7 \u2212 \u2032 \u2032 \u2212 \u2032\n\u2212 \u2032 + \u2212 \u2032 \u2212 \u2032\n\u2113=\n\u2113 \u2113 \u2113\n\u2113=\n\u2113 \u2113 \u2113\n\u2113 =\n\u2113 \u2113 \u2113\n\u2113 =\n\u2113 \u2113 \u2113\nA A\u03b5y \u03b6 \u03c8 \u03b5 A \u03b6 A \u03b6 A \u03b6 y \u03b6 y \u03b6 w y \u03b6\n\u03b5 A \u03b6 A \u03b6 y \u03b6 y \u03b6 y \u03b6 y \u03b6 w y \u03b6\ny \u03b6\n\u03b5 A \u03b6 A \u03b6 A \u03b6 y \u03b6 y \u03b6 y \u03b6 w y \u03b6\n\u03b5 A \u03b6 A \u03b6 y \u03b6 y \u03b6 y \u03b6 y \u03b6\ny \u03b6 w y \u03b6\ny \u03b6 O \u03b5 y \u03b6 w y \u03b6\n2\n2\n4\n4\n.\nj k\nN\nk j k k j j j\ni j k\nN\nk j i i i j j k k\nj k s\nN\ns k j k k j j j s s\ni j k s\nN\ns k j i i i j j k k\ns s\n1 1 , , 1\n1 1 1 1, 1, 1\n, , , 1 1 1 1, 1, 1, 1,\n1\n1\n2\n, , , 1 1 1 1 1, 1, 1, 1\n2\n, , , , 1 1 1 1, 1, 1, 1,\n1, 1\n1\n3 1 5 1\n(12)\nAlso, it can be obtained that\n( ( )) ( )( ) ( )( )( ) (\u2223 \u2223)\n( ) ( )( )( )( ) (\u2223 \u2223)\n( \u2223 \u2223 (\u2223 \u2223))\n\u2211\n\u2211\n\u2207 \u22c5 = \u2207 \u22c5 \u2202 \u2212 \u2032 \u2212 \u2032 \u2212 \u2032\n+ \u2202 \u2202 \u2212 \u2032 \u2212 \u2032 \u2212 \u2032 \u2212 \u2032\n+ \u2212 \u2032 \u2212 \u2032\n=\n\u2113=\n\u2113 \u2113\nA A\u03b5y \u03c8 \u03b6 A \u03b6 y \u03b6 y \u03b6 w y \u03b6\n\u03b5 A \u03b6 A \u03b6 y \u03b6 y \u03b6 y \u03b6 w y \u03b6\nO \u03b5 y \u03b6 w y \u03b6\n1 2\n2\nx x i j\nN\nj i i i j j\ni j k\nN\nj i k i i j j k k\n1 1 , 1\n1 1, 1, 1\n, , , 1 1 1 1, 1, 1, 1\n2 1 4 1\nand\n\u2223 ( ) ( )\u2223 ( \u2223 \u2223 (\u2223 \u2223))\u2212 = \u2212 \u2032 \u2212 \u2032A A\u03b5y \u03b6 \u03c8 O \u03b5 y \u03b6 w y \u03b6 .1 2 1 2 1 4 1\nNow (11) can be expanded as\n( ( )) ( ( ))\n( )[ ( ) ( )]( )( ) (\u2223 \u2223)\n( ) ( )( )( )( )( ) (\u2223 \u2223)\n\u2223 \u2223\n( ( )) ( )( )( ) (\u2223 \u2223)\n( )[ ( ) ( )]( )( )( ) (\u2223 \u2223)\n( ) ( )( )( )( )( )( ) (\u2223 \u2223)\n\u2223 \u2223\n( ) ( )( )( )( ) (\u2223 \u2223)\n[ ( \u2223 \u2223 \u2223 \u2223 ) ( \u2223 \u2223 )] (\u2223 \u2223)\n( )\n( )\n( )\n( )\n( )\n( )\n( )\n\u2211\n\u2211\n\u2211\n\u2211\n\u2211\n\u2211\n\u2207 + \u2212 \u2207 +\n= \u2212 \u2202 \u2202 + \u2202 \u2212 \u2032 \u2212 \u2032 \u2212 \u2032\n\u2212 \u2202 \u2202 \u2212 \u2032 \u2212 \u2032 \u2212 \u2032 \u2212 \u2032 \u2032 \u2212 \u2032\n\u2212 \u2032\n\u2212 \u2207 \u22c5 \u2202 \u2212 \u2032 \u2212 \u2032 \u2212 \u2032\n\u2212 \u2202 \u2202 + \u2202 \u2212 \u2032 \u2212 \u2032 \u2212 \u2032 \u2212 \u2032\n\u2212 \u2202 \u2202 \u2212 \u2032 \u2212 \u2032 \u2212 \u2032 \u2212 \u2032 \u2212 \u2032 \u2032 \u2212 \u2032\n\u2212 \u2032\n\u2212 \u2202 \u2202 \u2212 \u2032 \u2212 \u2032 \u2212 \u2032 \u2212 \u2032\n+ \u2212 \u2032 + \u2212 \u2032 + \u2212 \u2032 \u2212 \u2032\n\u2113=\n\u2113 \u2113 \u2113\n+ \u22c5\n\u2113=\n\u2113 \u2113 \u2113\n+ \u22c5\n=\n+ \u22c5\n\u2113 =\n\u2113 \u2113 \u2113\n+ \u22c5\n\u2113 =\n\u2113 \u2113 \u2113\n+ \u22c5\n\u2113=\n\u2113 \u2113 + \u22c5\n+ \u22c5\nA A\nA\n\u03b5y \u03b6\n\u03b5 A \u03b6 A \u03b6 A \u03b6 y \u03b6 y \u03b6 w y \u03b6\n\u03b5 A \u03b6 A \u03b6 y \u03b6 y \u03b6 y \u03b6 y \u03b6 w y \u03b6\ny \u03b6\n\u03b5 \u03b6 A \u03b6 y \u03b6 y \u03b6 w y \u03b6\n\u03b5 A \u03b6 A \u03b6 A \u03b6 y \u03b6 y \u03b6 y \u03b6 w y \u03b6\n\u03b5 A \u03b6 A \u03b6 y \u03b6 y \u03b6 y \u03b6 y \u03b6 y \u03b6 w y \u03b6\ny \u03b6\n\u03b5 A \u03b6 A \u03b6 y \u03b6 y \u03b6 y \u03b6 w y \u03b6\nO \u03b5 y \u03b6 \u03b5 y \u03b6 O \u03b5 y \u03b6 w y \u03b6\ni \u03a8 i \u03a8\ne\ne\n2 e\n2 e\n2 e\n2 e\ni e .\nA\nA\nA\nA\nA\nA\nA\nj k\nN\nk j k k j j j \u03c3 \u03b6 y\ni j k\nN\nk j i i i j j k k \u03c3 \u03b6 y\nx i j\nN\nj i i i j j \u03c3 \u03b6 y\nj k s\nN\ns k j k k j j j s s \u03c3 \u03b6 y\ni j k s\nN\ns k j i i i j j k k s s \u03c3 \u03b6 y\ni j k\nN\nj i k i i j j k k \u03c3 \u03b6 y\n\u03c3 \u03b6 y\n2 1 1 2 1\n, , 1 1 1 1 1, 1, 1\ni i\n, , , 1 1 1 1, 1, 1, 1,\n1\n1\ni i\n1 , 1\n1 1, 1, 1 i i\n2\n, , , 1 1 1 1 1, 1, 1, 1\ni i\n2\n, , , , 1 1 1 1, 1, 1, 1, 1,\n1\n1\ni i\n2\n, , , 1 1 1 1, 1, 1, 1\ni i\n3 1 5 3 1 4 2 1 4 1 i i\n1 1\n1 1\n1 1\n1 1\n1 1\n1 1\n1 1\nTherefore, we have, in \u2223 \u2223\u2212 \u2032 \u2264y \u03b6m \u03b4 \u03b5 , that\n( ) ( ) ( )( ) \u2254 +\u2212 \u2212 \u22c5R y R y R ye i ,A\u03c3 \u03b6 y m mi i ,1 ,2m m\nwhere\n( ) ( ) ( )( )( ) (\u2223 \u2223)\n( )[ ( ) ( )]( )( ) (\u2223 \u2223)\n( ) ( )( )( )( )( ) (\u2223 \u2223)\n\u2223 \u2223\n( ( )) ( )( )( ) (\u2223 \u2223)\n( ) ( ) ( )( )( )( )( ) (\u2223 \u2223)\n( ) ( )( )( )( ) (\u2223 \u2223)\n( )[ ( ) ( )]( )( )( ) (\u2223 \u2223)\n( ) ( )( )( )( )( )( ) (\u2223 \u2223)\n\u2223 \u2223\n( ) ( )( )( )( ) (\u2223 \u2223)\n( \u2223 \u2223 \u2223 \u2223 ) (\u2223 \u2223) ( \u2223 \u2223 (\u2223 \u2223))\n\u2211\n\u2211\n\u2211\n\u2211\n\u2211\n\u2211\n\u2211\n\u2211\n\u2211\n= \u2202 \u2202 \u2212 \u2032 \u2212 \u2032 \u2212 \u2032\n\u2212 \u2202 \u2202 + \u2202 \u2212 \u2032 \u2212 \u2032 \u2212 \u2032\n\u2212 \u2202 \u2202 \u2212 \u2032 \u2212 \u2032 \u2212 \u2032 \u2212 \u2032 \u2032 \u2212 \u2032\n\u2212 \u2032\n\u2212 \u2207 \u22c5 \u2202 \u2212 \u2032 \u2212 \u2032 \u2212 \u2032\n\u2212 \u2212\n\u2202 \u2202 \u2212 \u2032 \u2212 \u2032 \u2212 \u2032 \u2212 \u2032 \u2212 \u2032\n+ \u2202 \u2202 \u2212 \u2032 \u2212 \u2032 \u2212 \u2032 \u2212 \u2032\n\u2212 \u2202 \u2202 + \u2202 \u2212 \u2032 \u2212 \u2032 \u2212 \u2032 \u2212 \u2032\n\u2212 \u2202 \u2202 \u2212 \u2032 \u2212 \u2032 \u2212 \u2032 \u2212 \u2032 \u2212 \u2032 \u2032 \u2212 \u2032\n\u2212 \u2032\n\u2212 \u2202 \u2202 \u2212 \u2032 \u2212 \u2032 \u2212 \u2032 \u2212 \u2032\n+ \u2212 \u2032 + \u2212 \u2032 \u2212 \u2032 + \u2212 \u2032 \u2212 \u2032\n=\n\u2113=\n\u2113 \u2113 \u2113\n\u2113=\n\u2113 \u2113 \u2113\n=\n\u2113=\n\u2113 \u2113 \u2113\n\u2113=\n\u2113 \u2113 \u2113\n\u2113 =\n\u2113 \u2113 \u2113\n\u2113 =\n\u2113 \u2113 \u2113\n\u2113=\n\u2113 \u2113\nA\nR y \u03b5 A \u03b6 A \u03b6 y \u03b6 y \u03b6 w y \u03b6\n\u03b5 A \u03b6 A \u03b6 A \u03b6 y \u03b6 y \u03b6 w y \u03b6\n\u03b5 A \u03b6 A \u03b6 y \u03b6 y \u03b6 y \u03b6 y \u03b6 w y \u03b6\ny \u03b6\n\u03b5 \u03b6 A \u03b6 y \u03b6 y \u03b6 w y \u03b6\np \u03b5 A \u03b6 A \u03b6 y \u03b6 y \u03b6 y \u03b6 y \u03b6 w y \u03b6\n\u03b5 A \u03b6 A \u03b6 y \u03b6 y \u03b6 y \u03b6 w y \u03b6\n\u03b5 A \u03b6 A \u03b6 A \u03b6 y \u03b6 y \u03b6 y \u03b6 w y \u03b6\n\u03b5 A \u03b6 A \u03b6 y \u03b6 y \u03b6 y \u03b6 y \u03b6 y \u03b6 w y \u03b6\ny \u03b6\n\u03b5 A \u03b6 A \u03b6 y \u03b6 y \u03b6 y \u03b6 w y \u03b6\nO \u03b5 y \u03b6 \u03b5 y \u03b6 w y \u03b6 O \u03b5 y \u03b6 w y \u03b6\n2\n1 8\n2\n2\n2\nm i j k\nN\nj i m k i m j m j k m k m\nj k\nN\nk m j k m k j m j m j m m\ni j k\nN\nk m j i m i m i j m j k m k m m\nm\nx m i j\nN\nj i m i m i j m j m\ni j k\nN\nj i m k m i m i j m j k m k m p\nm\ni j k\nN\nj i m k i m j m j k m k m m\nj k s\nN\ns k m j k m k i m j m j m s m s m\ni j k s\nN\ns k m j i m i m i j m j k m k m s m s m\nm\ni j k\nN\nj i m k m i m i j m j k m k m\nm m m m p\nm\n,1 2\n, , 1 , ,\n2\n, , 1 , ,\n2\n, , , 1 , , , ,\n2\n, 1 , ,\n2\n, , , 1 , , , ,\n3\n, , , 1 , , ,\n3\n, , , 1 , , ,\n3\n, , , , 1 , , , , ,\n3\n, , , 1 , , , 4 4 4 5 4 8\n(13)\nand\n( ) ( )( )( ) (\u2223 \u2223) ( )( ) (\u2223 \u2223)\n( \u2223 \u2223 \u2223 \u2223 ) (\u2223 \u2223) ( \u2223 \u2223 ) (\u2223 \u2223)\n\u2211 \u2211= \u2202 \u2212 \u2032 \u2212 \u2032 \u2202 \u2212 \u2032 + \u2202 \u2212 \u2032 \u2212 \u2032\n+ \u2212 \u2032 + \u2212 \u2032 \u2212 \u2032 + \u2212 \u2032 \u2212 \u2032\n= =\nR y \u03b5 A \u03b6 y \u03b6 y \u03b6 w y \u03b6 \u03b5 A \u03b6 y \u03b6 w y \u03b6\nO \u03b5 y \u03b6 \u03b5 y \u03b6 w y \u03b6 O \u03b5 y \u03b6 w y \u03b6 .\nm i j k\nN\njk i m j m j k m k i m i j\nN\nij i m j m j m\nm m m m p\nm\n,2 2\n, , 1 , ,\n2\n, 1 ,\n3 4 3 2 4 8\nHence, we obtain the estimate\n\u2223 ( )\u2223\n( )\n\u222b\u2211 \u2264 =\n\u2032\nR y y C\u03b5d . m\nK\nB \u03b61\n2 2\n\u03b4 \u03b5 m\nAs for the domain \u2223 \u2223\u2212 \u2032 \u2265 \u2200 = \u2026y \u03b6 m K, 1, 2, ,m \u03b4 \u03b5 , using the asymptotic behavior of (\u2223 \u2223)\u2212 \u2032w y \u03b6m , it is easy to see that\n\u2223 ( )\u2223\n( )\n\u222b \u2264\n\u29f9 \u222a\n\u2212\n\u2032 =\nR y y Cd e .\nB \u03b6\n2\nN m K \u03b4 \u03b5 m\n\u03b4 \u03b5\n1\nThe result for ( )R y is concluded. As for the estimates of \u2202 \u2032 R\u03b6m k, and \u2202 R\u03c3m , one may check it similarly. \u25a1\n3 The linear problem and the nonlinear problem\nThis section is devoted to the invertibility of the linear operator L in order to solve problem (10):\n( ( )) ( )\u2223 \u2223 ( ) \u2223 \u2223 ( ) ( )= \u2207 + + \u2212 \u2212 \u2212 = \u2212 +\u2212 \u2212AL\u03d5 \u03b5y \u03d5 \u03d5 p \u03d5 \u03d5 R y N \u03d5i 1 Re .p p2 3 1\nLet H be the Hilbert space as the closure of ( )\u221eC ,N0 under the scalar product\n( ) ( ( ) )( ( ) )\u222b= \u2207 + \u2207 + +A Au v u \u03b5y u v \u03b5y v uv, Re i i \u00af. N\nThe norm deduced by the above scalar product is equivalent to the usual norm of ( )H ,N1 due to the boundness of \u2223 ( )\u2223A x , see [7]. In \u2223 \u2223\u2212 \u2032 \u2264y \u03b6m \u03b4 \u03b5 , the operator L formally looks like\n( ( )) ( )\u2223 \u2223 ( ) \u2223 \u2223\u2207 + + \u2212 \u2212 \u2212\u2212 \u2212A \u03b6 \u03d5 \u03d5 p U U \u03d5 U U \u03d5i 1 Re ,m m p m m m p2 3 1\nwhich is not invertible. Precisely, the null space of this limit operator is\n{ }\u2026Z Z Zspan , , , ,m m m N,0 ,1 ,\nwhere\n(\u2223 \u2223) (\u2223 \u2223) ( ) ( )= \u2212 \u2032 = = \u2202 \u2212 \u2032\n\u2202 \u2032 \u2264 \u2264+ \u22c5 + \u22c5Z w y \u03b6 U Z w y \u03b6 \u03b6 i Ni e i and e , 1 .A Am m \u03c3 \u03b6 y m m i m\nm i\n\u03c3 \u03b6 y ,0 i i ,\n,\ni im m m m\nThe symbol span means the linear combinations on real numbers, see for instance [7,8]. Therefore, we study the following linear problem with ( )\u2208h L ,N2\n\u23a7\n\u23a8\n\u23aa \u23aa\n\u23a9\n\u23aa \u23aa\n\u222b\n\u2211 \u2211= +\n= = \u2026 = \u2026\n= =\nL\u03d5 h c \u03c7 Z\n\u03c7 Z \u03d5 i N m K\n,\nRe 0, 0, 1, , , 1, , ,\ni\nN\nm\nK\nm i m m i\nm m i\n0 1 , ,\n, N\n(14)\nwhere ( ) (\u2223 \u2223)= \u2212 \u2032\u03c7 y \u03c7 y \u03b6m m is a smooth cut-off function on the large ball ( )\u2032B \u03b6R m , satisfying ( ) =\u03c7 s 1 for \u2223 \u2223 \u2264s R and ( ) =\u03c7 s 0 for \u2223 \u2223 \u2265 +s R 1.\nNext, we prove the following invertibility proposition, which is the main result in this section.\nProposition 3.1. The linear problem (14) admits a unique solution ( ) ( ( ) )\u0360=\u03d5 c T h c, ,m i m i, , , = \u2026i N0, 1, , , = \u2026m K1, , satisfying\n( ) \u2223 \u2223\u0360\u2016 \u2016 = \u2016 \u2016 \u2264 \u2016 \u2016 \u2264 \u2016 \u2016\u03d5 T h C h c C h, .H H L m i L,2 2 2 2\nBefore giving the proof, it is necessary to obtain an a priori estimate.\nLemma 3.2. If ( )\u03d5 c, m i, is a solution of problem (14), then\n\u2223 \u2223\u2016 \u2016 \u2264 \u2016 \u2016 \u2264 \u2016 \u2016\u03d5 C h c C h, .H L m i L,2 2 2\nProof. The proof is very standard and we here prove it briefly for the completion. First, we test the equation (14) by \u2113Z j, , \u2264 \u2113 \u2264 K1 , \u2264 \u2264j N0 and obtain that\n\u239c \u239f\u2223 \u2223 \u239b\n\u239d\n\u2223 \u2223 \u239e\n\u23a0 \u222b \u222b \u2211 \u2211\u27e8 \u27e9 = + +\u2113 \u2113 \u2113 \u2113 \u2212 = = L\u03d5 Z hZ c Z O c, Re e .j j j j i\nN\nm\nK\nm i, , , , 2\n0 1 ,\nN N\n\u03b4 \u03b5 (15)\nNote that\n( ( )) ( ( )) ( ( )) ( ( ))\n( ( )) ( ( )) ( )\n\u222b \u222b\n\u222b\n\u2207 + \u2207 + = \u2207 + \u2207 +\n= \u2207 + \u2207 + + \u2016 \u2016\n\u2113 \u2113\n\u2113 \u2113 \u2113\nA \u03b5y \u03d5 A \u03b5y Z A \u03b5y Z A \u03b5y \u03d5\nA \u03b6 Z A \u03b6 \u03d5 O \u03b5 \u03d5\nRe i i Re i i\nRe i i ,\nj j\nj H\n, ,\n,\nN N\nN\n1\nand\n\u222b \u2264 \u2016 \u2016\u2113hZ C h .j L, N 2\nThus, it holds from (15) and the equation of \u2113Z j, that\n( )= \u2016 \u2016 + \u2016 \u2016\u2113c O \u03b5 \u03d5 h .j H L, 1 2 (16)\nNext we will prove \u2016 \u2016 \u2264 \u2016 \u2016\u03d5 C hH L1 2 by contradiction. Suppose that for some sequence { }\u03b5n , there always exist { }\u03d5n and { }hn such that\n( )\u2016 \u2016 = \u2016 \u2016 = \u2192\u03d5 h o \u03b51 and 1 as 0.n H n L n1 2\nTesting (14) against \u03b7 \u03c6m ( ( ))\u2208 \u221e\u03c6 C ,c N where ( ) \u2261\u03b7 y 1m in \u2223 \u2223\u2212 \u2032 <y \u03b6m \u03b4 \u03b5 and ( ) \u2261\u03b7 y 0m in \u2223 \u2223\u2212 \u2032 >y \u03b6m \u03b4 \u03b5 2 , one can obtain that\n( ( )) ( ( )) ( ) \u2223 \u2223 ( ( ))\n\u2223 \u2223\n\u222b \u222b \u222b\n\u222b \u222b \u222b\u2211\n\u2207 + \u2207 + + \u2212 \u2212\n\u2212 = +\n\u2212\n\u2212\n=\nA \u03b5 y \u03d5 A \u03b5 y \u03b7 \u03c6 \u03d5 \u03b7 \u03c6 p \u03d5 \u03b7 \u03c6\n\u03d5 \u03b7 \u03c6 h \u03b7 \u03c6 c \u03c7 Z \u03c6\nRe i i Re 1 Re Re\nRe Re Re .\nn n n m n m p\nn m\np n m n m\ni\nN\nm i m m i\n3\n1\n0 , ,\nN N N\nN N N\nNote that \u21c0\u03d5 \u03d5n in ( )H ,Nloc 1 up to a subsequence. Thus, dominated convergence theorem tells us that\n( ( )) ( ( )) ( ) \u2223 \u2223 ( ( )) \u2223 \u2223\u222b \u222b \u222b \u222b\u2207 + \u2207 + + \u2212 \u2212 \u2212 =\u2212 \u2212A \u03b6 \u03d5 A \u03b6 \u03c6 \u03d5\u03c6 p U U \u03d5 U \u03c6 U \u03d5\u03c6Re i i Re \u00af 1 Re Re \u00af Re \u00af 0.m m m p m m m p3 1 N N N N\nThis means that \u03d5 is a solution of ( ( )) ( )\u2223 \u2223 ( ) \u2223 \u2223\u2207 + + \u2212 \u2212 \u2212 =\u2212 \u2212A \u03b6 \u03d5 \u03d5 p U U \u03d5 U U \u03d5i 1 Re 0 in .m m p m m m p N2 3 1 Then one obtains that =\u03d5 0 from the orthogonal conditions, which further implies that ( )\u2192 \u2032 \u2200 > = \u2026\u03d5 B \u03b6 R m K0 a.e. in , 0, 1, 2, , .n R m (17) On the other hand, note that\n\u2223( ( )) \u2223 \u2223 \u2223 ( ) \u2223 \u2223 ( ( )) \u2223 \u2223 \u2223 \u2223 ( )\u222b \u222b \u222b \u222b \u222b\u2207 + + \u2212 \u2212 \u2212 = =\u2212 \u2212A \u03b5y \u03d5 \u03d5 p \u03d5 \u03d5 h \u03d5 oi 1 Re Re \u00af 1 .n n p n p n n n2 2 3 2 1 2 N N N N N (18)\nFrom (17) and the exponential decay of \u2223 \u2223Um , we obviously have\n\u2223 \u2223 \u2223 \u2223 \u2223 \u2223 \u2223 \u2223 \u2223 \u2223 \u2223 \u2223 ( ) ( ) ( )\n( ) ( )\n\u222b \u222b \u222b\u2211= + + = +\u2212\n=\n\u2212\n\u29f9\u222a\n\u2212 \u2212\n\u2032 \u2032 =\n\u03d5 U \u03d5 \u03d5 O \u03b5 O oe 1 .p n m\nK\nB \u03b6\nm p\nn\nB \u03b6\np n R1 2\n1\n1 2 1 2\nN R m\nN m K R m1\nSo is \u2223 \u2223 ( ( ))\u222b \u2212 \u03d5Rep n3 2 N , which toobtainher with (18) shows that\n\u2223 \u2223 ( ) ( ) \u2223( ( )) \u2223 ( ) ( )\u222b \u222b= + \u2207 + = +\u2212 \u2212A\u03d5 O o \u03b5y \u03d5 O oe 1 and i e 1 .n R n R2 2 N N\nFinally, it is derived that\n( ) ( ) \u2223( ( )) \u2223\n\u2223 \u2223 \u2223 ( )\u2223 \u2223 \u2223 ( )\n\u2223 \u2223 \u2223 ( )\u2223 \u2223 \u2223 ( ) ( )\n\u222b\n\u222b \u222b \u222b\n\u222b \u222b\n+ = \u2207 +\n= \u2207 + + \u22c5\u2207\n\u2265 \u2207 \u2212 = \u2016 \u2016 + +\n\u2212\n\u2212\nA\nA A\nA\nO o \u03b5y \u03d5\n\u03d5 \u03b5 y \u03d5 \u03b5 y \u03d5 \u03d5\n\u03d5 \u03b5 y \u03d5 \u03d5 O o\ne 1 i\n2Re i\n1 2\n1 2\ne 1 ,\nR n\nn n n n n n\nn n n n H R\n2\n2 2 2\n2 2 2\nN\nN N N\nN N\n1\nsince ( )A x is bounded. This leads to a contradiction to \u2016 \u2016 =\u03d5 1n H1 . Hence,\n\u2016 \u2016 \u2264 \u2016 \u2016\u03d5 C h .H L1 2\nFinally, the regularity theory gives \u2016 \u2016 \u2264 \u2016 \u2016\u03d5 C hH L2 2. \u25a1\nProof of Proposition 3.1. Denote the Hilbert space\n\u23a7 \u23a8 \u23a9\n( ) \u23ab\n\u23ac \u23ad\n\u222b= \u2208 = = \u2026 = \u2026\u03d5 H \u03c7 \u03d5Z i N m KRe 0, 0, , , 1, ,N m m i1 , N\nwith the equivalent inner product introduced at the beginning of this section. Problem (14) expressed in weak form is equivalent to finding a \u2208\u03d5 , such that\n( ) [( )\u2223 \u2223 ( ) \u2223 \u2223 ]\u222b \u222b\u2212 \u2212 + = \u2200 \u2208\u2212 \u2212\u03d5 v p \u03d5 \u03d5 v hv v, Re 1 Re \u00af Re \u00af, .p p3 1 N N\nThen, from Riesz representation theorem equation (14) is equivalent to\n( )\u2212 =\u03d5 T \u03d5 h\u0303, in ,\nwhere T is a compact operator on . Based on Proposition 3.1, Fredholm alternative tells us the unique existence of \u03d5. And cm i, can be given by \u03d5 using integration. Their estimates were given in the aforementioned proposition. \u25a1\nAlso for ( )\u0360=\u03d5 T h , it is important for later purposes to understand the differentiability of the operator T\u0360 with respect to \u2032\u03b6 j and = \u2026\u03c3 j K, 1, ,j . Recall that \u03d5 satisfies the equation\n( ( )) ( )\u2223 \u2223 ( ) \u2223 \u2223 \u2211 \u2211= \u2207 + + \u2212 \u2212 \u2212 = +\u2212 \u2212\n= = L\u03d5 A \u03b5y \u03d5 \u03d5 p \u03d5 \u03d5 h c \u03c7 Zi 1 Re .p p i\nN\nm\nK\nm i m m i 2 3 1\n0 1 , ,\nThus, for = \u2026k N1, , ,\n( ( )) ( )\u2223 \u2223 \u2223 \u2223\n\u2223 \u2223 \u2223 \u2223\u2223 \u2223 ( )\n( ) ( ) ( )\n( ) ( )\u2211 \u2211 \u2211\n\u2202 = \u2207 + \u2202 + \u2202 \u2212 \u2212 \u2202 \u2212 \u2202\n= \u2202 + \u2202 + \u2202\n\u2212 \u2212\n\u2212\n= = =\n\u2032 \u2032 \u2032 \u2032 \u2032\n\u2032 \u2032 \u2032\nL \u03d5 A \u03b5y \u03d5 \u03d5 p \u03d5 \u03d5\nO \u03d5 c \u03c7 Z c \u03c7 Z\ni 1 Re\n.\n\u03b6 \u03b6 \u03b6 p\n\u03b6 p \u03b6\np \u03b6\ni\nN\nj i \u03b6 j j i m\nK\ni\nN\n\u03b6 m i m m i\n2 3 1\n2\n0 , ,\n1 0 , ,\nj k j k j k j k j k\nj k j k j k\n, , , , ,\n, , ,\nMoreover, the derivative of the orthogonal condition is\n( )\n\u222b ( )\n\u222b ( ) \u222b\n\u2202 = \u2260\n\u2202 = \u2212 \u2202\n\u2032\n\u2032 \u2032\n\u03c7 Z \u03d5 m j\n\u03c7 Z \u03d5 \u03c7 Z \u03d5\nRe 0, for ,\nRe Re .\nm m i \u03b6\nj j i \u03b6 \u03b6 j j i\n,\n, ,\nN j k\nN j k\nN j k\n,\n, ,\nSet = \u2202 + \u2211 =\u2032 \u03c6 \u03d5 b \u03c7 Z\u03b6 i N jk i j j i0 , ,j k, and\n( ) \u2223 \u2223\u222b \u222b= \u2202 \u2032b \u03c7 Z \u03d5 \u03c7 ZRe .jk i \u03b6 j j i j j i, , , 2 N j k N ,\nNote that \u2223 \u2223 \u2264 \u2016 \u2016 \u2264 \u2016 \u2016b C \u03d5 C hjk i L L, 2 2. Then \u03c6 satisfies all the orthogonal conditions in (14), and direct computations show that\n( ) \u2223 \u2223 \u2223 \u2223\u2223 \u2223 ( )( ) ( )\u2211 \u2211 \u2211 \u2211= + \u2202 + \u2202 + \u2202 =\n\u2212\n= = = \u2032 \u2032 \u2032L\u03c6 b L \u03c7 Z O \u03d5 c \u03c7 Z c \u03c7 Z . i\nN\njk i j j i p\n\u03b6 i\nN\nj i \u03b6 j j i m\nK\ni\nN\n\u03b6 m i m m i 0\n, , 2\n0 , , 1 0 , ,j k j k j k, , ,\nWith Lemma 3.2 in hand,\n( ) \u2223 \u2223 ( )\u2211 \u2211\u2016 \u2016 \u2264 \u2016 \u2016 + \u2016 \u2202 \u2016 + \u2016 \u2202 \u2016 \u2264 \u2016 \u2016 =\n\u2212\n= \u2032 \u2032\u03c6 C b L \u03c7 Z C \u03d5 C c \u03c7 Z C h .H i\nN\njk i j j i L p\n\u03b6 L i\nN\nj i \u03b6 j j i L L 0\n, , 2\n0 , ,j k j k 2 2 , 2 , 2 2\nTherefore, we conclude that\n( )\u0360 \u2211\u2016\u2202 \u2016 = \u2016\u2202 \u2016 \u2264 \u2016 \u2016 + \u2016 \u2016 \u2264 \u2016 \u2016 = \u2032 \u2032T h \u03d5 \u03c6 b \u03c7 Z C h .\u03b6 H \u03b6 H H i\nN\njk i j j i H L 0 , ,j k j k, 2 , 2 2 2 2\nThe same process may be carried out for \u2202 \u03d5\u03c3j . Based on the above discussion, the following proposition holds obviously.\nProposition 3.3. For the unique solution ( )\u0360=\u03d5 T h in Proposition 3.1, it holds that\n( ) ( )\u0360 \u0360\u2016\u2202 \u2016 \u2264 \u2016 \u2016 \u2016\u2202 \u2016 \u2264 \u2016 \u2016 \u2200 = \u2026 = \u2026\u2032 T h C h T h C h m K i N, , 1, , , 1, , .\u03b6 H L \u03c3 H Lm i m, 2 2 2 2\nNow we can deal with the following nonlinear problem:\n\u23a7\n\u23a8\n\u23aa \u23aa\n\u23a9\n\u23aa \u23aa\n( ) ( )\n\u222b\n\u2211 \u2211= \u2212 + +\n= = \u2026 = \u2026\n= =\nL\u03d5 R y N \u03d5 c \u03c7 Z\n\u03c7 Z \u03d5 i N m K\n,\nRe 0, 0, , , 1, , .\ni\nN\nm\nK\nm i m m i\nm m i\n0 1 , ,\n, N\n(19)\nProposition 3.4. The nonlinear problem (19) admits a unique solution \u03d5 satisfying\n( )\u2016 \u2016 =\u03d5 O \u03b5 .H 22\nMoreover, ( )\u2032 \u2192\u03c3 \u03b6 \u03d5, is of class C1 for ( ) ( )= \u2026 \u2032 = \u2032 \u2026 \u2032\u03c3 \u03b6\u03c3 \u03c3 \u03b6 \u03b6, , , , ,K K1 1 , and\n( ) ( )\u2016\u2202 \u2016 = \u2016\u2202 \u2016 = \u2200 = \u2026 = \u2026\u2032 \u03d5 O \u03b5 and \u03d5 O \u03b5 m K i N, 1, , 1, , .\u03b6 H \u03b2 \u03c3 H \u03b22 2m i m, 2 2\nProof. Recall that { }= \u2212\u03b2 pmin 1, 1 . The proof is based on the contraction mapping theorem. First, for a large enough number >\u03b3 00 , we set\n{ \u2223 }= \u2208 \u2016 \u2016 \u2264\u03d5 \u03d5 \u03b3 \u03b5 .H 0 22\nIn terms of the operator T\u0360 defined in Proposition 3.1, the nonlinear problem (19) is transferred to solving\n( ( ) ( )) ( )\u0360= \u2212 + \u2254\u03d5 T R y N \u03d5 \u03d5 ,\nwhich means to find a fixed point of the operator . First, the operator is from to itself. In fact,\n( ) ( ( ) ( )) ( ) ( )\u0360\u2016 \u2016 = \u2016 \u2212 + \u2016 \u2264 \u2016 \u2016 + \u2016 \u2016 \u2264 + \u2016 \u2016 \u2264+\u03d5 T R y N \u03d5 C R y C N \u03d5 C\u03b5 C \u03d5 \u03b3 \u03b5 .H H L L H \u03b22 1 0 22 2 2 2 2\nNext the operator is a contraction mapping, since\n( ) ( ) ( ( ) ( )) ( ) ( )\n( )\n\u0360\u2016 \u2212 \u2016 = \u2016 \u2212 \u2016 \u2264 \u2016 \u2212 \u2016\n\u2264 \u2016 \u2016 + \u2016 \u2016 \u2016 \u2212 \u2016\n\u03d5 \u03d5 T N \u03d5 N \u03d5 C N \u03d5 N \u03d5\nC \u03d5 \u03d5 \u03d5 \u03d5 . H H L\nH \u03b2\nH \u03b2\nH\n1 2 1 2 1 2\n1 2 1 2\n2 2 2\n2 2 2\nThus, has a unique fixed point in , which is the unique solution of problem (19). Next we come to \u2202 \u2032 \u03d5\u03b6m i, and \u2202 \u03d5\u03c3m . The C\n1-regularity in \u2032\u03b6m and \u03c3m is guaranteed by the implicit function theorem. One may refer to the proof of Lemma 4.1 in [7]. In order to estimate the differentiability, we follow the procedure in [9]. It is easy to see\n( ( ) ( )) ( ) ( )\u0360 \u0360 ( )\u2202 = \u2202 \u2212 + + \u2212\u2202 + \u2202\u2032 \u2032 \u2032 \u2032\u03d5 T R y N \u03d5 T R y N \u03d5 .\u03b6 \u03b6 \u03b6 \u03b6m i m i m i m i, , , , (20)\nNote that \u2223 ( )\u2223 (\u2223 \u2223 \u2223 \u2223 \u2223 \u2223 \u2223 \u2223)\u2202 = \u2202 + \u2202\u2032 \u2032 \u2032N \u03d5 O \u03d5 w \u03d5 \u03d5\u03b6 \u03b2 \u03b6 \u03b2 \u03b6m i m i m i, , , . So we obtain\n( )\u2016\u2202 \u2016 \u2264 \u2016 \u2016 + \u2016 \u2016 \u2016\u2202 \u2016\u2032 \u2032N \u03d5 C \u03d5 C \u03d5 \u03d5 .\u03b6 L H \u03b2 H \u03b2 \u03b6 Hm i m i, 2 2 2 , 2\nThus, (20) and Proposition 3.3 lead to\n( ) ( ) ( ) ( )\u2016\u2202 \u2016 \u2264 \u2016 \u2016 + \u2016 \u2016 + \u2016\u2202 \u2016 + \u2016\u2202 \u2016 \u2264\u2032 \u2032 \u2032\u03d5 C R y C N \u03d5 C R y C N \u03d5 C\u03b5 .\u03b6 H L L \u03b6 L \u03b6 L \u03b22m i m i m i, 2 2 2 , 2 , 2\nThe estimate for \u2016\u2202 \u2016\u03d5\u03c3 Hm 2 may be obtained by the same process. \u25a1\n4 Variational reduction\nAccording to the above discussion, the remaining thing is to let =c 0m i, in the nonlinear problem (19) in order to make + \u03d5 be a solution of the original problem. It can be done by the variational reduction process.\nNote the energy functional of problem (5) is\n( ) \u2223 ( ) \u2223 \u2223 \u2223 \u2223 \u2223\u222b \u222b \u222b= \u2207 + + \u2212 + +AE u u \u03b5y u y u p u1 2 i d 1 2 1 1\n.p2 2 1 N N N\nDefine\n( ) ( )( )\u2032 = + \u2032\u03c3 \u03b6 \u03c3 \u03b6F E \u03d5, , ,\nthen the existence of critical points to ( )E u may be reduced to find critical points of the finite dimensional function ( )\u2032\u03c3 \u03b6F , .\nProposition 4.1. If ( )\u2032\u03c3 \u03b6, is a critical point of ( )\u2032\u03c3 \u03b6F , , then =c 0m i, for all m i, .\nProof. It is easy to see that\n( ) ( ) ( ) \u23a1\n\u23a3 \u23a2\n\u23a4 \u23a6 \u23a5\n\u23a1 \u23a3 \u23a2\n\u23a4\n\u23a6 \u23a5 \u2223 \u2223 ( )\u222b \u222b\u2211 \u2211\n\u2202 \u2032 = \u2202 + = \u2032 + \u2202\n\u2202 \u2032 +\n\u2202\n\u2202 \u2032\n= \u2202\n\u2202 \u2032 +\n\u2202 \u2202 \u2032 + \u2202 \u2202 \u2032 = +\n= \u2113=\n\u2113 \u2113 \u2113\n\u2032 \u2032\u03c3 \u03b6F E \u03d5 E \u03d5 \u03b6 \u03d5 \u03b6\nc \u03c7 Z U \u03b6\n\u03b5 \u03b6\n\u03d5 \u03b6\nc \u03c7 Z o\n,\nRe \u03a8 1 .\n\u03b6 \u03b6 m i m i\nj\nN K\nj j m\nm i\nm\nm i m i m i m m i\n, ,\n0 1 , ,\n, , , , ,\n2\nm i m i\nN N\n, ,\nSimilarly, it is also true that\n( ) \u2223 \u2223 ( )\u222b\u2202 \u2032 = +\u03c3 \u03b6F c \u03c7 Z o, 1 .\u03c3 m m m,0 ,0 2m N\nThus, =c 0m i, if ( )\u2032\u03c3 \u03b6, is a critical point of F since the coefficient matrix of cm i, is diagonal dominant. \u25a1\nNext we should calculate ( )\u2032\u03c3 \u03b6F , in view of Proposition 4.1.\nProposition 4.2. It holds that\n( ) ( ) ( )\u2032 = +\u03c3 \u03b6F E O \u03b5, ,4\nand for any = \u2026 = \u2026m K i N1, , , 1, , ,\n( ) ( ) ( ) ( ) ( ) ( )\u2202 \u2032 = \u2202 + \u2202 \u2032 = \u2202 ++ +\u2032 \u2032\u03c3 \u03b6 \u03c3 \u03b6F E O \u03b5 F E O \u03b5, , , .\u03b6 \u03b6 \u03b2 \u03c3 \u03c3 \u03b22 2 2 2m i m i m m, ,\nProof. Direct computation leads to\n( ) \u2223 ( ) ( )( )\u2223 \u2223 \u2223 \u2223 \u2223\n( ) ( ( )) ( ( ))\n\u2223 ( ) \u2223 \u2223 \u2223 \u2223 \u2223 \u2223 \u2223\n\u222b \u222b \u222b\n\u222b \u222b\n\u222b \u222b \u222b \u222b\n\u2032 = \u2207 + + + + + \u2212 +\n+\n= + \u2207 + \u2207 + +\n+ \u2207 + + \u2212 +\n+ + +\n+\n+ +\n\u03c3 \u03b6 A\nA A\nA\nF \u03d5 \u03b5y \u03d5 \u03d5 p\n\u03d5\nE \u03b5y \u03b5y \u03d5 \u03d5\n\u03d5 \u03b5y \u03d5 \u03d5 p\n\u03d5 p\n, 1 2\ni 1 2\n1 1\nRe i i Re \u00af\n1 2\ni 1 2\n1 1\n1 1\n.\np\np p\n2 2 1\n2 2 1 1\nN N N\nN N\nN N N N\nUsing equation (10) of \u03d5 and definitions of ( )R y , ( )N \u03d5 below it, we obtain from integration by parts that\n( ) ( ) (( ( ) ( )) ) \u23a1\n\u23a3\u23a2 \u2223 \u2223 \u2223 \u2223 \u2223 \u2223 ( )\n\u2223 \u2223 ( ( )) \u2223 \u2223 \u2223 \u2223 \u23a4\n\u23a6\u23a5\n\u222b \u222b\u2032 = + + \u2212 +\n+ \u2212 +\n\u2212\n\u2212 \u2212\n\u2212\n+ + \u2212\n\u2212 \u2212\n\u03c3 \u03b6F E R y N \u03d5 \u03d5 p\n\u03d5 p\n\u03d5\np \u03d5 \u03d5\n, 1 2 Re \u00af 1 1\n1 1\nRe \u00af\n1 2\nRe \u00af 1 2\n.\np p p\np p\n1 1 1\n3 2 1 2\nN N\nThen the proposition follows from Propositions 2.1 and 3.4 easily. By the computation in Proposition 3.4, it is easy to check that\n( ) ( ) ( )\u2202 \u2032 = \u2202 + \u2016 \u2016 +\u2032 \u2032\u03c3 \u03b6F E O \u03d5, .\u03b6 \u03b6 \u03b21m i m i, ,\nSo is ( )\u2202 \u2032\u03c3 \u03b6F ,\u03c3m . \u25a1\nSince ( )E is the main part of ( )\u2032\u03c3 \u03b6F , , it is important to obtain the expression of ( )E . Elegant computation shows the following proposition.\nProposition 4.3. It holds that for \u03b5 small enough,\n( ) ( ( ) ( )) ( )\u2211 \u2211= + \u2202 \u2212 \u2202 + = = E A K B \u03b5 A \u03b6 A \u03b6 O \u03b5 . m\nK\ni j\nN\ni j m j i m0 0 2\n1 , 1\n2 4\nFurthermore, the remainder term ( )O \u03b54 also holds for the derivatives in \u2032\u03b6 \u03c3, . Here\n(\u2223 \u2223) ( )\n\u222b= \u2212\n+ +A w y ydpp p 0 1 2 1 1 N\nand (\u2223 \u2223)\u222b=B y w y yd0 18 1 2 2 N are both universal positive constants.\nProof. It is easy to see that\n( ) \u2223 ( ) \u2223 \u2223 \u2223 \u2223 \u2223\n( ) ( ) \u2223 \u2223\n\u23a1 \u23a3\u23a2 ( )\n( ) \u2223 \u2223 \u23a4 \u23a6\u23a5 \u23a1 \u23a3\u23a2 ( )\n( ) \u2223 \u2223 \u23a4\n\u23a6\u23a5\n[ (\u2223 \u2223) ( ) ( )\n\u2223 \u2223 ( ) \u2223 \u2223 \u2223 \u2223 ]\n( )\n( ) ( )\n( )\n\u222b \u222b \u222b\n\u222b \u222b\n\u222b \u222b\n\u222b\n\u2211\n\u2211\n= \u2207 + + \u2212 +\n= + \u2212\n+\n= + \u2212\n+ +\n+ \u2212\n+\n= \u2212 \u2032 + + \u2212\n+ +\n\u2212\n+\n+\n+\n=\n+\n\u29f9\u222a\n+\n=\n+ \u2212\n\u2032 \u2032\n\u2032\n=\nAE \u03b5y p\nR y p p\nR y p p\nR y\np p\nR w y \u03b6 \u03b5 R \u03c8 y p p U p \u03b5 U\nO \u03b5\n1 2\ni 1 2\n1 1\n1 2 Re 1 2 1\nRe 1 2\n1 2 1\nRe 1 2\n1 2 1\n2 2 1 2 1 1 4 \u03a8\n,\np\np\nm\nK\nB \u03b6\np\nB \u03b6\np\nm\nK\nB \u03b6\nm m\nm m m p m p m\n2 2 1\n1\n1\n1\n1\n1\n,1 ,2 1 2\n1 2\n4\nN N N\nN N\n\u03b4 \u03b5\nm N m K \u03b4\n\u03b5 m\n\u03b4 \u03b5 m\n1 (21)\nwhere\u03c8 , \u03a8m m are given in (9), and Rm,1, Rm,2 are defined in Proposition 2.1. First, by the oddness of the terms in order \u03b53 in (13), it can be obtained that\n(\u2223 \u2223) ( ) ( ) ( )( ) (\u2223 \u2223)\n( )[ ( ) ( )] ( )( ) (\u2223 \u2223)\n( ) ( ) ( )( )( )( )\n(\u2223 \u2223) \u2223 \u2223 (\u2223 \u2223) ( ( )) ( ) ( )( ) (\u2223 \u2223)\n( ) ( ) ( ) ( )( )( )( )\n(\u2223 \u2223) ( )\n( ) ( )\n( )\n( )\n( )\n( )\n\u222b \u222b\n\u222b\n\u222b\n\u222b\n\u222b\n\u2211\n\u2211\n\u2211\n\u2211\n\u2211\n\u2212 \u2032 = \u2202 \u2202 \u2212 \u2032 \u2212 \u2032 \u2212 \u2032\n\u2212 \u2202 \u2202 + \u2202 \u2212 \u2032 \u2212 \u2032 \u2212 \u2032\n\u2212 \u2202 \u2202 \u2212 \u2032 \u2212 \u2032 \u2212 \u2032 \u2212 \u2032\n\u22c5 \u2032 \u2212 \u2032\n\u2212 \u2032 \u2212 \u2032 \u2212 \u2207 \u22c5 \u2202 \u2212 \u2032 \u2212 \u2032 \u2212 \u2032\n\u2212 \u2212\n\u2202 \u2202 \u2212 \u2032 \u2212 \u2032 \u2212 \u2032 \u2212 \u2032\n\u2212 \u2032 +\n\u2032 =\n\u2032\n\u2113=\n\u2113\n\u2032\n\u2113 \u2113\n\u2113\n\u2113\n\u2032\n\u2113 \u2113\n= \u2032\n\u2113\n\u2113\n\u2032\n\u2113 \u2113\n+\nA\nR w y \u03b6 \u03b5 A \u03b6 A \u03b6 y \u03b6 y \u03b6 w y \u03b6\n\u03b5 A \u03b6 A \u03b6 A \u03b6 y \u03b6 y \u03b6 w y \u03b6\n\u03b5 A \u03b6 A \u03b6 y \u03b6 y \u03b6 y \u03b6 y \u03b6\nw y \u03b6 y \u03b6 w y \u03b6 \u03b5 \u03b6 A \u03b6 y \u03b6 y \u03b6 w y \u03b6\np \u03b5 A \u03b6 A \u03b6 y \u03b6 y \u03b6 y \u03b6 y \u03b6 w\ny \u03b6 O \u03b5\n2\n1 8\n.\nB \u03b6\nm m i j k\nN\nj i m k i m\nB \u03b6\nj m j k m k m\nj k\nN\nk m j k m k j m\nB \u03b6\nj m j m m\ni j k\nN\nk m j i m\nB \u03b6\ni m i j m j k m k m\nm\nm m x m i j\nN\nj i m\nB \u03b6\ni m i j m j m\ni j k\nN\nj i m k m\nB \u03b6\ni m i j m j k m k m p\nm\n,1 2\n, , 1 , ,\n2\n2\n, , 1 , ,\n2\n2\n, , , , , , ,\n2\n, 1 , ,\n2\n2\n, , , , , , ,\n1\n4\n\u03b4 \u03b5 m \u03b4 \u03b5 m\n\u03b4 \u03b5 m\n\u03b4 \u03b5 m\n\u03b4 \u03b5 m\n\u03b4 \u03b5 m\nSince integration by parts gives\n(\u2223 \u2223) (\u2223 \u2223)\n\u2223 \u2223 ( (\u2223 \u2223))\n(\u2223 \u2223) (\u2223 \u2223) (\u2223 \u2223)\n\u222b \u222b\n\u222b \u222b \u222b\n\u2032 = \u2202\n= \u2212 \u2212 \u2212\n\u2113 \u2113\n\u2113 \u2113 \u2113\nyyy y w y w y y y yyy w y\n\u03b4 \u03b4 yy w y \u03b4 \u03b4 yy w y \u03b4 \u03b4 yyw y\nd 1 2\n1 2\n1 2\n1 2\n,\ni j k i j k\ni jk j k j ik i k k ij i j\n2\n2 2 2\nN N\nN N N\none obtains that\n( ) ( ) ( )( )( )( ) (\u2223 \u2223)\n\u2223 \u2223 (\u2223 \u2223)\n[ ( ) ( ) ( ( )) ( ) ( )]\n\u222b\u2211\n\u2211\n\u2202 \u2202 \u2212 \u2032 \u2212 \u2032 \u2212 \u2032 \u2212 \u2032 \u2032 \u2212 \u2032\n\u2212 \u2032 \u2212 \u2032\n= \u2212 \u2202 \u2202 + \u2202 + \u2202 \u2202\n\u2113=\n\u2113 \u2113 \u2113\n=\nA \u03b6 A \u03b6 y \u03b6 y \u03b6 y \u03b6 y \u03b6 w y \u03b6\ny \u03b6 w y \u03b6\nB A \u03b6 A \u03b6 A \u03b6 A \u03b6 A \u03b64 .\ni j k\nN\nk m j i m i m i j m j k m k m m\nm m\ni j\nN\ni i m j j m j i m i j m j i m\n, , , 1 , , , ,\n0 , 1\n2\nN\nIt may be checked that\n\u239c \u239f\n(\u2223 \u2223)\n\u23a7 \u23a8 \u23a9\n( ( )) ( )( ( ) ( )) [ ( ) ( )\n( ( )) ( ) ( )] \u239b\n\u239d\n( ) \u239e\n\u23a0\n\u23ab \u23ac \u23ad ( ) ( ) ( )\n( )( )( )( ) (\u2223 \u2223) ( )\n( )\n( )\n\u222b\n\u222b\n\u2211 \u2211 \u2211\n\u2211 \u2211\n\u2212 \u2032\n= \u2202 \u2212 \u2202 \u2202 + \u2202 + \u2202 \u2202\n+ \u2202 + \u2202 \u2202 \u2212 \u2202 \u2212 \u2212\n\u2202 \u2202\n\u00d7 \u2212 \u2032 \u2212 \u2032 \u2212 \u2032 \u2212 \u2032 \u2212 \u2032 +\n= = =\n= \u2113=\n\u2113\n\u2113 \u2113\n+\n\u2032\n\u2032\nR w y \u03b6\nB \u03b5 A \u03b6 A \u03b6 A \u03b6 A \u03b6 A \u03b6 A \u03b6\nA \u03b6 A \u03b6 A \u03b6 A \u03b6 p \u03b5 A \u03b6 A \u03b6\ny \u03b6 y \u03b6 y \u03b6 y \u03b6 w y \u03b6 O \u03b5\n2\n2 2 2\n1 16\n.\nB \u03b6\nm m\ni j\nN\nj i m i j\nN\nj i m j i m i j m i j\nN\ni i m j j m\nj i m i j m j i m i\nN\ni i m i j k\nN\nj i m k m\nB \u03b6\ni m i j m j k m k m p\nm\n,1\n0 2\n, 1\n2\n, 1 , 1\n2\n1\n2 2\n, , , 1\n, , , , 1 4\n\u03b4 \u03b5 m\n\u03b4 \u03b5 m\n(22)\nAlso,\n\u2223 \u2223 \u2223 \u2223 ( ) ( ) ( )( )( )( ) (\u2223 \u2223)\n( ) ( )\n( )\n\u222b \u222b\u2211= \u2202 \u2202 \u2212 \u2032 \u2212 \u2032 \u2212 \u2032 \u2212 \u2032 \u2212 \u2032\n+\n\u2212\n\u2113=\n\u2113 \u2113 \u2113\n+\n\u2212\n\u2032 \u2032\nU A \u03b6 A \u03b6 y \u03b6 y \u03b6 y \u03b6 y \u03b6 w y \u03b6\nO\n\u03a8 1 4\ne\nB \u03b6\nm p\nm i j k\nN\nj i m k m B \u03b6\ni m i j m j k m k m p m 1 2\n, , , 1 , , , ,\n1\n\u03b4 \u03b5 m \u03b4 \u03b5 m\n\u03b4 \u03b5\nand\n( )\n( )\n\u222b = \u2032 R \u03c8 O \u03b5 B \u03b6 m m,2 3\n\u03b4 \u03b5 m\nby the oddness. Obviously, one has\n\u2223 \u2223 (\u2223 \u2223)\n( )\n( )\u222b \u222b= ++ + \u2212\n\u2032 U w y y Od e . B \u03b6 m p p1 1\n\u03b4 \u03b5\nm N\n\u03b4 \u03b5\nNote that in (22) the term containing +wp 1 is canceled with \u2223 \u2223 \u2223 \u2223\u222b \u2212 \u2212\u03b5 U \u03a8p m p m14 2 1 2\nN\n. So we conclude, from (21), that\n( ) [( ( )) ( ) ( )] ( )\n( ( ) ( )) ( )\n\u2211 \u2211\n\u2211 \u2211\n= + \u2202 \u2212 \u2202 \u2202 +\n= + \u2202 \u2212 \u2202 +\n= =\n= =\nE A K \u03b5 B A \u03b6 A \u03b6 A \u03b6 O \u03b5\nA K \u03b5 B A \u03b6 A \u03b6 O \u03b5\n2\n.\nm\nK\ni j\nN\nj i m j i m i j m\nm\nK\ni j\nN\nj i m i j m\n0 2\n0 1 , 1\n2 4\n0 2\n0 1 , 1\n2 4\nThe last equality is due to the symmetry of indexes i and j. The remainder ( )O \u03b54 also holds for the derivatives of ( )E in ( )\u2032\u03c3 \u03b6, from directly checking the expressions of Rm,1 and Rm,2 in the proof of Proposition 2.1. \u25a1\n5 Proof of the main theorems\nThis section devotes to the proof of main theorems.\nProof of Theorem 1.1. Propositions 4.2 and 4.3 mean\n( ) ( ) ( )\u2211\u2032 = + \u2016 \u2016 + = \u03c3 \u03b6 BF A K B \u03b5 \u03b6 O \u03b5, . m\nK\nm F0 0 2\n1\n2 4\nWe shall show that F has a critical point under the assumption. Note that for any fixed \u2032\u03b6 , ( )\u2032\u03c3 \u03b6F , is periodic in [ ]\u2208\u03c3 \u03c00, 2 K . So there always exists a ( )\u2032\u03c3 \u03b6 such that ( ( ) )\u2202 \u2032 \u2032 =\u03c3 \u03b6 \u03b6F , 0\u03c3 . Next consider the configuration set \u2032 = \u2032 \u00d7 \u2032 \u00d7\u22ef\u00d7 \u2032\u03a9 \u03a9 \u03a9 \u03a9m1 2 of ( )\u2032 = \u2032 \u2032 \u2026 \u2032\u03b6 \u03b6 \u03b6 \u03b6, , , m1 2 , where \u2032 = \u2212\u03b5\u03a9 \u03a9m m1 . Obviously,\n( ( ) ) ( ) ( )\u2211\u2032 \u2032 \u2265 + \u2016 \u2016 + \u2032\n= \u03c3 \u03b6 \u03b6 BF A K B \u03b5 P O \u03b5max , . m\nK\nm F \u03a9\n0 0 2\n1\n2 4\nOn the other hand, for any \u2032\u03b6 on the boundary \u2202 \u2032\u03a9 , i.e., at least \u2032 \u2208 \u2202 \u2032\u03b6 \u03a91 1 without loss of generality, then ( ) ( )\u2016 \u2016 \u2264 \u2016 \u2016 \u2212B \u03b6 B P \u03b4F F1 2 1 2 0 for some fixed small >\u03b4 00 . Thus, one finds that\n( ( ) )\u2223 ( ) ( ( ) ) ( )\u2211\u2032 \u2032 \u2264 + \u2016 \u2016 + \u2016 \u2016 \u2212 +\u2032\u2208\u2202 \u2032 = \u03c3 \u03b6 \u03b6 B BF A K B \u03b5 P B \u03b5 P \u03b4 O \u03b5, .\u03b6 \u03a9 m\nK\nm F F0 0 2\n2\n2 0 2 1 2 0\n4\nTherefore, ( ( ) ) ( ( ) )\u2032 \u2032 > \u2032 \u2032\u2032 \u2202 \u2032\u03c3 \u03b6 \u03b6 \u03c3 \u03b6 \u03b6F Fmax , max ,\u03a9 \u03a9 . It implies that ( )\u2032\u03c3 \u03b6F , admits a critical point. The same procedure can be carried out for the case of K local minimum points. Theorem 1.1 concludes from Proposition 4.1. \u25a1\nProof of Theorem 1.2. From Propositions 4.2 and 4.3, we see that\n( ) ( ( ) ) ( ) ( ( ) ) ( )\u2207 \u2032 = \u2207 \u2016 \u2016 + = \u2207 \u2016 \u2016 ++ +\u2032 \u2032\u03c3 \u03b6 B BF B \u03b5 \u03b6 O \u03b5 B \u03b5 \u03b6 O \u03b5, .\u03b6 \u03b6 m F \u03b2 \u03b6 m F \u03b20 2 2 2 2 0 3 2 2 2\nm m m\nAssume =m 1 for simplicity. Choose = +\u03b6 P \u03b5 \u03be\u03b11 1 1 where < < \u2212\u03b1 \u03b20 2 1. Here the assumption >p 3 2 is used to let { }= \u2212 > /\u03b2 pmin 1, 1 1 2. Then it is equivalent to find a \u2223 \u2223 \u2264\u03be 11 such that\n( ( ) ) ( ) ( ( ) ) ( ( ) ) ( \u2223 \u2223 ) ( )= \u2207 \u2016 \u2016 + = \u2207 \u2016 \u2016 + \u2207 \u2016 \u2016 \u22c5 + +\u2212 \u2212B B B\u03b6 O \u03b5 P \u03b5 P \u03be O \u03b5 \u03be O \u03b50 .\u03b6 F \u03b2 \u03b6 F \u03b1 \u03b6 \u03b6 F \u03b1 \u03b21 2 2 1 1 2 2 1 2 1 2 1 2 2 1\n1 1 1 1\nThus, the nondegeneracy of the critical point P1, together with the Brouwer fixed point theorem, leads to the existence of \u03be1 and also \u2223 \u2223 ( )=\u03be o 11 . Finally, the existence of critical point \u03c3 is guaranteed by the periodicity just like in the proof of Theorem 1.1. The proof is complete. \u25a1\nFunding information: The authors are partially supported by NSFC 11971169 and Natural Science Foundation of Shanghai 22ZR1421600.\nConflict of interest: The authors state no conflict of interest.\nReferences\n[1] G. Arioli and A. Szulkin, A semilinear Schr\u00f6dinger equation in the presence of a magnetic field, Arch. Ration. Mech. Anal. 170 (2003), no. 4, 277\u2013295. [2] D. Bonheure, S. Cingolani, and M. Nys, Nonlinear Schr\u00f6dinger equation: concentration on circles driven by an external magnetic field, Calc. Var. Partial Differ. Equ. 55 (2016), no. 4, Art. 82, 33 pp. [3] D. Bonheure, M. Nys, and J. Van Schaftingen, Properties of ground states of nonlinear Schr\u00f6dinger equations under a weak constant magnetic field, J. Math. Pures Appl. 124 (2019), no. 9, 123\u2013168. [4] D. M. Cao and Z. W. Tang, Existence and uniqueness of multi-bump bound states of nonlinear Schr\u00f6dinger equations with electromagnetic fields, J. Differ. Equ. 222 (2006), no. 2, 381\u2013424. [5] S. Cingolani and M. Clapp, Intertwining semiclassical bound states to a nonlinear magnetic Schr\u00f6dinger equation, Nonlinearity 22 (2009), 2309\u20132331. [6] S. Cingolani, L. Jeanjean, S. Secchi, Multi-peak solutions for magnetic NLS equations without non-degeneracy conditions, ESAIM Control Optim. Calc. Var. 15 (2009), 653\u2013675. [7] C. Cingolani and S. Secchi, Semiclassical limit for nonlinear Schr\u00f6dinger equations with electromagnetic fields, J. Math. Anal. Appl. 275 (2002), 108\u2013130. [8] C. Cingolani and S. Secchi, Semiclassical states for NLS equations with magnetic potentials having polynomial growths, J. Math. Phys.. 46 (2005), no. 5, 053503, 19 pp.\n[9] M. delPino, M. Kowalczyk, and M. Musso, Singular limits in Liouville-type equations, Calc. Var. Partial Differ. Equ. 24 (2005), no. 1, 47\u201381. [10] J. DiCosmo and J. Van Schaftingen, Semiclassical stationary states for nonlinear Schr\u00f6dinger equations under a strong external magnetic field, J. Differ. Equ. 259 (2015), no. 2, 596\u2013627. [11] M. Esteban and P. L. Lions, Stationary solutions of nonlinear Schr\u00f6dinger equations with an external magnetic field, Partial differential equations and the calculus of variations, In: Progress in Nonlinear Differential Equations and Their Application, 1, Vol. I, Birkh\u00e4user Boston, Boston, MA, 1989, pp. 401\u2013449. [12] A. Floer and A. Weinstein, Nonspreading wave packets for the cubic Schr\u00f6dinger equation with a bounded potential, J. Funct. Anal. 69 (1986), no. 3, 397\u2013408. [13] B. Helffer, Semiclassical analysis for Schr\u00f6dinger operators with magnetic wells, Quasiclassical methods (Minneapolis, MN, 1995), The IMA Volumes in Mathematics and its Applications, vol. 95, Springer, New York, 1997, pp. 99\u2013114. [14] B. Helffer, On spectral theory for Schr\u00f6dinger operators with magnetic potentials. Spectral and scattering theory and applications, Advanced Studies in Pure Mathematics, vol. 23, The Mathematical Society of Japan, Tokyo, 1994, pp. 113\u2013141. [15] K. Kurata, Existence and semi-classical limit of the least energy solution to a nonlinear Schr\u00f6dinger equation with electromagnetic fields, Nonlinear Anal. 41 (2000), no. 5\u20136, Ser. A: Theory Methods, 763\u2013778. [16] L. D. Landau and E. M. Lifshitz, Quantum mechanics: non-relativistic theory, Course of Theoretical Physics, AddisonWesley Series in Advanced Physics, vol. 3, Pergamon Press, Ltd., London-Paris, for U.S.A. and Canada: Addison-Wesley Publishing Company, Inc., Reading, Mass, 1958, xii+515 pp.81.0X. [17] D. L. Mills, Nonlinear Optics: Basic Concepts, Springer Science & Business Media, Berlin, Heidelberg, New York, 2012. [18] S. Secchi and M. Squassina, On the location of spikes for the Schr\u00f6dinger equation with electromagnetic field, Commun.\nContemp. Math. 7 (2005), no. 2, 251\u2013268. [19] C. Sulem and P.-L. Sulem, Self-focusing and wave collapse, Applied Mathematical Sciences, vol. 139, Springer-Verlag,\nNew York, 1999, xvi+350 pp. [20] Z. W. Tang, Multi-bump bound states of nonlinear Schr\u00f6dinger equations with electromagnetic fields and critical fre-\nquency, J. Differ. Equ. 245 (2008), no. 10, 2723\u20132748. [21] L. P. Wang and C. Y. Zhao, Concentration on curves for a nonlinear Schr\u00f6dinger problem with electromagnetic potential,\nJ. Differ. Equ. 266 (2019), no. 8, 4800\u20134834."
        }
    ],
    "title": "Concentrations for nonlinear Schro\u0308dinger equations with magnetic potentials and constant electric potentials",
    "year": 2022
}