{
    "abstractText": ". . . . . . . . . . . . . . . . . . . . . . . . . . . . . . . . . . . . . . . . . . . . . . . . . . . . . . . . . . . . . . . . . . . . . . . . . . . . . . . . . . . . . . The open N = 2 string theory is defined on the 4D space-time with the split signature (+, +, \u2212, \u2212). The string field theory action of the open N = 2 string theory is described by the 4D Wess\u2013Zumino\u2013Witten (WZW4) model. The equation of motion of the WZW4 model is the Yang equation, which is equivalent to the anti-self-dual Yang\u2013Mills equation. In this paper, we study soliton-type classical solutions of the WZW4 model in the split signature by calculating the action density of the WZW4 model. We find that the action density of the one-soliton solutions is localized on a 3D hyperplane. This shows that there would be codimension-one-solitonic objects, or equivalently some kind of three-branes in the open N = 2 string theory. We also prove that, in the asymptotic region of the space-time, the action density of the n-soliton solutions is a \u201cnon-linear superposition\u201d of n one-solitons. This suggests the existence of n intersecting three-branes in the N = 2 strings. Finally we make a reduction to a (1 + 2)D real space-time to calculate the energy densities of the soliton solutions. We can successfully evaluate the energy distribution for the two-soliton solutions and find that there is no singularity in the interacting region. This implies the existence of smooth intersecting codimension-one branes in the whole region. Soliton solutions in the Euclidean signature are also discussed. . . . . . . . . . . . . . . . . . . . . . . . . . . . . . . . . . . . . . . . . . . . . . . . . . . . . . . . . . . . . . . . . . . . . . . . . . . . . . . . . . . . . . .",
    "authors": [
        {
            "affiliations": [],
            "name": "Masashi Hamanaka"
        },
        {
            "affiliations": [],
            "name": "Shan-Chi Huang"
        },
        {
            "affiliations": [],
            "name": "Hiroaki Kanno"
        }
    ],
    "id": "SP:81babc3de04f285049fcbd5d4c10fd54230b2608",
    "references": [
        {
            "authors": [
                "L.J. Mason",
                "N.M. Woodhouse"
            ],
            "title": "Integrability, Self-Duality, and Twistor Theory (Oxford",
            "year": 1996
        },
        {
            "authors": [
                "KP Y. Kodama"
            ],
            "title": "Solitons and the Grassmannians",
            "year": 2017
        },
        {
            "authors": [
                "M. Green",
                "J. Schwarz",
                "E. Witten"
            ],
            "title": "Superstring Theory (Cambridge",
            "year": 1987
        },
        {
            "authors": [
                "V.P. Nair"
            ],
            "title": "Kahler-Chen-Simons theory, STRINGS",
            "venue": "(World Scientific,",
            "year": 1991
        },
        {
            "authors": [
                "N. Marcus"
            ],
            "title": "A tour through N=2 strings,String Theory, Quantum Gravity and the Unification of the Fundamental Interactions,391\u2013413 (World Scientific,1993) [arXiv:hep-th/9211059] [Search inSPIR E",
            "year": 1993
        },
        {
            "authors": [
                "S.C. Huang"
            ],
            "title": "On soliton solutions of the anti-self-dual Yang-Mills equations from the perspective of integrable systems, Ph.D. Thesis, Nagoya University (2021) [arXiv:2112.10702 [hep-th]] [Search inSPIRE",
            "year": 2021
        },
        {
            "authors": [
                "Y. Kodama"
            ],
            "title": "Solitons in Two-Dimensional Shallow Water (SIAM, Philadelphia, PA, 2018)",
            "year": 2018
        },
        {
            "authors": [
                "B. Dai",
                "C.-L. Terng",
                "K. Uhlenbeck"
            ],
            "title": "On the space-time monopole equation, in Surveys in Differential Geometry",
            "venue": "Search inSPIRE]",
            "year": 2005
        },
        {
            "authors": [
                "K. Ohmori"
            ],
            "title": "A review on tachyon condensation in open string field theories, Master thesis, University of Tokyo (2001) [arXiv:hep-th/0102085] [Search inSPIRE",
            "year": 2085
        },
        {
            "authors": [
                "K. Costello",
                "M. Yamazaki"
            ],
            "title": "arXiv:1908.02289 [hep-th]] [Search inSPIRE",
            "year": 1908
        },
        {
            "authors": [
                "M. Sato",
                "RIMSKokyuroku",
                "Y. Sato"
            ],
            "title": "Soliton equations as dynamical systems on infinite dimensional Grassmann manifold, in Nonlinear Partial Differential Equations in Applied Sciences",
            "year": 1983
        }
    ],
    "sections": [
        {
            "text": "Prog. Theor. Exp. Phys. 2023 043B03(47 pages) DOI: 10.1093/ptep/ptad037\nSolitons in open N = 2 string theory Masashi Hamanaka 1, Shan-Chi Huang 1, , and Hiroaki Kanno 1,2 1Graduate School of Mathematics, Nagoya University, Nagoya 464-8602, Japan 2KMI, Nagoya University, Nagoya 464-8602, Japan E-mail: x18003x@math.nagoya-u.ac.jp\nReceived January 25, 2023; Revised March 10, 2023; Accepted March 10, 2023; Published March 29, 2023\n. . . . . . . . . . . . . . . . . . . . . . . . . . . . . . . . . . . . . . . . . . . . . . . . . . . . . . . . . . . . . . . . . . . . . . . . . . . . . . . . . . . . . . The open N = 2 string theory is defined on the 4D space-time with the split signature (+, +, \u2212, \u2212). The string field theory action of the open N = 2 string theory is described by the 4D Wess\u2013Zumino\u2013Witten (WZW4) model. The equation of motion of the WZW4 model is the Yang equation, which is equivalent to the anti-self-dual Yang\u2013Mills equation. In this paper, we study soliton-type classical solutions of the WZW4 model in the split signature by calculating the action density of the WZW4 model. We find that the action density of the one-soliton solutions is localized on a 3D hyperplane. This shows that there would be codimension-one-solitonic objects, or equivalently some kind of three-branes in the open N = 2 string theory. We also prove that, in the asymptotic region of the space-time, the action density of the n-soliton solutions is a \u201cnon-linear superposition\u201d of n one-solitons. This suggests the existence of n intersecting three-branes in the N = 2 strings. Finally we make a reduction to a (1 + 2)D real space-time to calculate the energy densities of the soliton solutions. We can successfully evaluate the energy distribution for the two-soliton solutions and find that there is no singularity in the interacting region. This implies the existence of smooth intersecting codimension-one branes in the whole region. Soliton solutions in the Euclidean signature are also discussed. . . . . . . . . . . . . . . . . . . . . . . . . . . . . . . . . . . . . . . . . . . . . . . . . . . . . . . . . . . . . . . . . . . . . . . . . . . . . . . . . . . . . . .\nSubject Index B28, B35, B81\n1. Introduction The anti-self-dual Yang\u2013Mills equation in four dimensions is of great interest in elementary particle physics and mathematics. In the Euclidean signature, it has quite important soliton solutions, instantons that are crucial to reveal the non-perturbative aspects of quantum field theory. In the split signature (+, +, \u2212, \u2212), it has a close relationship to integrable systems. It is well known that, by imposing appropriate reduction conditions for the gauge fields, the anti-selfdual Yang\u2013Mills equations in the split signature can be reduced to various lower-dimensional integrable equations, such as the KdV equation, the non-linear Schr\u00f6dinger equation, the Toda equations, and so on [1,2]. The integrability of these equations is well understood in the geometrical framework of twistor theory [1]. Soliton solutions are mostly of codimension-one in the sense that the energy density of the one-soliton solutions is localized on a codimension-one hyperplane in the space-time (see, e.g., Refs. [3,4]).\n\u00a9 The Author(s) 2023. Published by Oxford University Press on behalf of the Physical Society of Japan. This is an Open Access article distributed under the terms of the Creative Commons Attribution License (https://creativecommons.org/licenses/by/4.0/), which permits unrestricted reuse, distribution, and reproduction in any medium, provided the original work is properly cited. Funded by SCOAP3. SCOAP3 and OUP support the goals of the International Year of Basic Sciences for Sustainable Development\nD ow nloaded from https://academ ic.oup.com /ptep/article/2023/4/043B03/7093422 by Indian Institute of Technology Patna user on 18 January 2024\nThe anti-self-dual Yang\u2013Mills equation is realized in string theories that are classified according to the number N of the world-sheet supersymmetry. Under the condition that the critical dimension of the target space is positive and the string world-sheet theory has an appropriate conformal symmetry, the maximal number is found to be N = 2 (see Sect. 4.5 in Ref. [5] and references therein). In the case of the N = 2 string theories, the condition of conformal anomaly cancellation determines the critical dimension to be four, and the Virasoro constraints forbid any excited physical states except for massless scalars [5]. Hence, the string field theory can be reduced to the conventional field theory. The world-sheet N = 2 supersymmetry induces a complex structure on the 4D target space and hence the Minkowski target space is forbidden [6,7]. This is the reason why non-trivial string field theories are realized only when the metric has a split signature. (In the Euclidean case, the momentum of the massless scalar fields becomes identically zero.) Therefore the N = 2 string theory is closely related to the Ward conjecture and integrable systems.\nThe space-time action of the open N = 2 string theory is described by the 4D Wess\u2013Zumino\u2013 Witten (WZW4) model [6\u201310] (see also Refs. [11\u201316]). The equation of motion of this model is the Yang equation that is equivalent to the anti-self-dual Yang\u2013Mills equation [17]. Hence solutions of the Yang equation are classical solutions of the open string field theory action of the N = 2 strings. It is surprising that the action of the string field theory is explicitly written down in terms of massless scalar fields only. Exact analysis of the classical solutions leads to exact analysis of classical aspects of the string field theory.\nRecently a new type of soliton solution of the Yang equation has been constructed by using the Darboux transformation [18,19] in 4D flat spaces with all kinds of signatures, i.e., Euclidean, Minkowski, and split signatures [20]. These soliton solutions have localized Yang\u2013Mills action densities on 3D hyperplanes, and hence can be interpreted as codimension-one solitons. Furthermore, an asymptotic analysis has also been undertaken in Refs. [17, 21, 22], which suggests the existence of intersecting three-branes. In the case of the split signature, these solutions are supposed to be relevant to the open N = 2 string theory. Therefore, analysis of the solitonic behavior (including the interacting region) for the WZW4 action is much more appropriate than the Yang\u2013Mills action.\nIn this paper, we study the classical soliton solutions in the WZW4 model. The WZW4 action (15) consists of the non-linear sigma model (NL\u03c3M) term and the Wess\u2013Zumino (WZ) term [23]. We calculate the action densities of the NL\u03c3M model term and the Wess\u2013Zumino term for the soliton solutions.1 For the one-soliton solutions, we find that the WZW4 action density is localized on a 3D hyperplane. This suggests that there would be a codimension-one solitonic object, or equivalently some kind of three-brane in the open N = 2 string theory. For the multi-soliton solutions, we clarify the asymptotic behavior and conclude that the n-soliton solution possesses n isolated and localized lumps of the action density, and can be interpreted as n intersecting soliton walls. More precisely, each lump of the action density is essentially the same as a one-soliton because it preserves its shape and \u201cvelocity\u201d with a possible position shift (called the phase shift) of the peak in the scattering process. We evaluate the distribution of the NL\u03c3M term for the two-soliton solutions successfully and find that there is no singularity in the interacting region. This is consistent with the existence of smooth intersecting three-branes in the whole region. Finally, we make a reduction to a (1 + 2)D real space-time to calculate\n1In Ref. [13], Parkes discussed similar problems by using the SL(2,C) non-linear plane wave solutions [24] without calculating any action density.\n2/47\nD ow nloaded from https://academ ic.oup.com /ptep/article/2023/4/043B03/7093422 by Indian Institute of Technology Patna user on 18 January 2024\nthe energy densities of the soliton solutions. In (2 + 2) dimensions, the concept of energy is ambiguous because of the existence of two time directions. This is the reason why in this paper we discuss action density instead of energy density. We compute the energy densities of the one-soliton and two-soliton solutions in (1 + 2) dimensions to confirm that they are localized on the same hyperplanes as the action densities. This suggests that the locus where the action density is localized could be considered as a physical object.\nThis paper is organized as follows. In Sect. 2, the WZW4 model is introduced and our conventions are set up. In Sect. 3, soliton solutions of the Yang equation are reviewed and some properties of the solutions, such as the flip symmetry, singularities, and an asymptotic behavior, are discussed. In Sect. 4, the action density for the one- and two-soliton solutions is calculated. In Sect. 5, an asymptotic analysis of the n-soliton solution is given. In Sect. 6, we reduce the WZW4 model from (2 + 2) dimensions to (1 + 2) dimensions and calculate the Hamiltonian density for the one- and two-soliton solutions. Section 7 is devoted to the conclusion and discussion. Appendix A is a brief review of the quasideterminant. In Appendix B, a statement in footnote 8 is proved (see Sect. 5). Appendix C is a proof of unitarity of the n-soliton solutions on the Euclidean space. Appendix D includes miscellaneous formulas and detailed calculations.\n2. 4D Wess\u2013Zumino\u2013Witten model In this section, we review the 4D Wess\u2013Zumino\u2013Witten (WZW4) model. In order to treat it in a unified way, we introduce a 4D space with complex coordinates (z, z\u0303, w, w\u0303) and the flat metric:\nds2 = gmndzmdzn = 2(dzdz\u0303 \u2212 dwdw\u0303), m, n = 1, 2, 3, 4,\nwhere gmn := \u239b\u239c\u239c\u239c\u239d 0 1 0 0 1 0 0 0 0 0 0 \u22121 0 0 \u22121 0 \u239e\u239f\u239f\u239f\u23a0 , (z1, z2, z3, z4) := (z, z\u0303, w, w\u0303). (1) The space C4 can be reduced to the three kinds of real spaces by imposing suitable reality conditions on (z, z\u0303, w, w\u0303). For example, the Euclidean real space E is given by z\u0303 = z, w\u0303 = \u2212w, and the ultrahyperbolic real space U by (1) z, z\u0303, w, w\u0303 \u2208 R or (2) z\u0303 = z, w\u0303 = w, which are denoted respectively by U1 and U2. Our choices are shown in terms of real coordinates x\u03bc (\u03bc = 1, 2, 3, 4) as follows:\n(E) ( z w w\u0303 z\u0303 ) = 1\u221a\n2\n( x1 + ix2 x3 + ix4 \u2212(x3 \u2212 ix4) x1 \u2212 ix2 ) , (2)\nds2 = (dx1)2 + (dx2)2 + (dx3)2 + (dx4)2. (3)\n(U1) ( z w w\u0303 z\u0303 ) = 1\u221a\n2\n( x1 + x3 x2 + x4 \u2212(x2 \u2212 x4) x1 \u2212 x3 ) , (4)\nds2 = (dx1)2 + (dx2)2 \u2212 (dx3)2 \u2212 (dx4)2. (5) In this paper, we mainly consider the case of the ultrahyperbolic space U1.2\nLet M4 be a 4D flat space and \u03c3 be a map from M4 to G = GL(N, C) or its subgroup. The action of the WZW4 model consists of two parts as follows:\n2The case of U2 is not considered in this paper because the unitarity condition of \u03c3 leads to trivial action densities, as we will see in Appendix C. The case of the Euclidean space is discussed at the end of each (sub)section.\n3/47\nD ow nloaded from https://academ ic.oup.com /ptep/article/2023/4/043B03/7093422 by Indian Institute of Technology Patna user on 18 January 2024\nSWZW4 := S\u03c3 + SWZ, (6)\nS\u03c3 := i4\u03c0 \u222b M4 \u03c9 \u2227 Tr [(\u2202\u03c3 ) \u03c3\u22121 \u2227 (\u2202\u0303\u03c3 )\u03c3\u22121] , (7)\nSWZ := \u2212 i12\u03c0 \u222b M5 \u03c9 \u2227 Tr [(d \u03c3\u0302 ) \u03c3\u0302\u22121]3 , (8)\nwhere M5 := M4 \u00d7 [0, 1] and \u03c3\u0302 (z, z\u0303, w, w\u0303, t), t \u2208 [0, 1] is a homotopy such that \u03c3\u0302 (z, z\u0303, w, w\u0303, 0) = Id and \u03c3\u0302 (z, z\u0303, w, w\u0303, 1) = \u03c3 (z, z\u0303, w, w\u0303), and \u03c9 is the K\u00e4hler two-form on M4 given by\n\u03c9 = i 2\n(dz \u2227 dz\u0303 \u2212 dw \u2227 dw\u0303) . (9) The exterior derivatives are defined as follows:\nd := \u2202 + \u2202\u0303 + dt\u2202t, \u2202 := dw\u2202w + dz\u2202z, \u2202\u0303 := dw\u0303\u2202w\u0303 + dz\u0303\u2202\u0303z. (10) The first part S\u03c3 is called the non-linear sigma model (NL\u03c3M) term and the second part is called the Wess\u2013Zumino (WZ) term. In the Wess\u2013Zumino term, we use an abbreviated notation: A3 := A\u2227A\u2227A for a differential one-form A.\nThe equation of motion is\n\u2202\u0303 ( \u03c9 \u2227 (\u2202\u03c3 ) \u03c3\u22121) = 0. (11)\nThis is derived as follows. Let us consider an infinitesimal variation of the dynamical variable \u03c3 such that \u03b4\u03c3 |\u2202M4 = 0 and d\u03b4 = \u03b4d. Then, \u03b4((d\u03c3 )\u03c3\u22121) = d ((\u03b4\u03c3 )\u03c3\u22121) \u2212 (d\u03c3 )\u03c3\u22121(\u03b4\u03c3 )\u03c3\u22121 + (\u03b4\u03c3 )\u03c3\u22121(d\u03c3 )\u03c3\u22121. Note that (\u03b4\u03c3 )\u03c3\u22121 is a g-valued zero-form while (d\u03c3 )\u03c3\u22121 is a g-valued one-form, where g is the Lie algebra of G. The cyclic symmetry of trace implies\n\u03b4Tr [ (d \u03c3\u0302 )\u03c3\u0302\u22121 ]3 = 3dTr [(\u03b4\u03c3\u0302 )\u03c3\u0302\u22121 ((d \u03c3\u0302 )\u03c3\u0302\u22121)2] . Since d\u03c9 = 0, we have\n\u03b4SWZ = \u2212 i4\u03c0 \u222b M5 \u03c9 \u2227 \u03b4Tr [(d \u03c3\u0302 ) \u03c3\u0302\u22121]3 = \u2212 i 4\u03c0 \u222b M4 \u03c9 \u2227 Tr [ (\u03b4\u03c3 )\u03c3\u22121 ( (d\u03c3 )\u03c3\u22121 )2] .\nThe variation of the sigma model term is \u03b4S\u03c3 = i4\u03c0 \u222b M4 \u03c9 \u2227 \u03b4Tr [(\u2202\u03c3 ) \u03c3\u22121 \u2227 (\u2202\u0303\u03c3 )\u03c3\u22121]\n= i 4\u03c0 \u222b M4 \u03c9 \u2227 Tr [\u2202 ((\u03b4\u03c3 )\u03c3\u22121(\u2202\u0303\u03c3 )\u03c3\u22121) \u2212 \u2202\u0303 ((\u03b4\u03c3 )\u03c3\u22121 (\u2202\u03c3 ) \u03c3\u22121) + (\u03b4\u03c3 )\u03c3\u22121 (\u2202\u0303 ((\u2202\u03c3 ) \u03c3\u22121) \u2212 \u2202 ((\u2202\u0303\u03c3 )\u03c3\u22121)] ,\nwhere we use \u2202\u2202\u0303 + \u2202\u0303\u2202 = 0 due to \u22022 = 0, \u2202\u03032 = 0, and d = \u2202 + \u2202\u0303. The first and second terms become a surface integration due to d\u03c9 = 0 and the fact that:\nTr [ \u2202 ( (\u03b4\u03c3 )\u03c3\u22121(\u2202\u0303\u03c3 )\u03c3\u22121 ) \u2212 \u2202\u0303 ((\u03b4\u03c3 )\u03c3\u22121 (\u2202\u03c3 ) \u03c3\u22121)] = Tr [d ((\u03b4\u03c3 )\u03c3\u22121(\u2202\u0303\u03c3 )\u03c3\u22121) \u2212 d ((\u03b4\u03c3 )\u03c3\u22121 (\u2202\u03c3 ) \u03c3\u22121)] .\nTherefore we get the final form of the total action variation and the equation of motion is obtained:\n\u03b4SWZW4 = i\n2\u03c0 \u222b M4 \u03c9 \u2227 Tr [(\u03b4\u03c3 )\u03c3\u22121\u2202\u0303 ((\u2202\u03c3 ) \u03c3\u22121)] . 4/47\nD ow nloaded from https://academ ic.oup.com /ptep/article/2023/4/043B03/7093422 by Indian Institute of Technology Patna user on 18 January 2024\nFinally we rewrite the WZW4 action without integration over M5. By the cyclic property of the trace we have\ndTr [ (d \u03c3\u0302 ) \u03c3\u0302\u22121 ]3 = \u2212Tr [(d \u03c3\u0302 ) \u03c3\u0302\u22121]4 = 0. (12) The K\u00e4hler two-form \u03c9 is closed and H2(M4, R) = 0 and hence there exists a one-form A on the flat space-time such that\n\u03c9 = dA. (13) Note that A is not uniquely determined and has ambiguity with respect to the following degree of freedom: A \u2192A + d\u03ba, where \u03ba is an arbitrary zero-form.\nThe Wess\u2013Zumino term is written as\u222b M5 d ( A \u2227 Tr [(d \u03c3\u0302 ) \u03c3\u0302\u22121]3) = \u222b M4 A \u2227 Tr [(d \u03c3\u0302 ) \u03c3\u0302\u22121]3 \u2223\u2223\u2223\u2223 t=1 \u2212 \u222b M4 A \u2227 Tr [(d \u03c3\u0302 ) \u03c3\u0302\u22121]3 \u2223\u2223\u2223\u2223 t=0 .\n(14)\nIf there exists a homotopy such that \u03c3\u0302 (t = 0) = Id and \u03c3\u0302 (t = 1) = \u03c3 , the second term vanishes and we obtain\nSWZW4 = i\n4\u03c0 \u222b M4 \u03c9 \u2227 Tr [(\u2202\u03c3 ) \u03c3\u22121 \u2227 (\u2202\u0303\u03c3 )\u03c3\u22121] \u2212 i 12\u03c0 \u222b M4 A \u2227 Tr [(d\u03c3 ) \u03c3\u22121]3 . (15) From now on, we use this form of action. Since our soliton solutions allow such a homotopy as above, we can use Eq. (15) for computing the action density.\n2.1. Component representation of WZW4 action density Let us write down explicit representations of the WZW4 action density (15) in the flat 4D real spaces.\nIn terms of the local complex coordinates (1)\u2013(4), the NL\u03c3M action is described as follows: S\u03c3 = i4\u03c0 \u222b M4 \u03c9 \u2227 Tr [(\u2202\u03c3 ) \u03c3\u22121 \u2227 (\u2202\u0303\u03c3 )\u03c3\u22121]\n= \u2212 1 16\u03c0 \u222b M4 Tr [ (\u2202m\u03c3 ) \u03c3\u22121 (\u2202m\u03c3 ) \u03c3\u22121 ] dz \u2227 dz\u0303 \u2227 dw \u2227 dw\u0303, (16)\nwhere \u2202m := gmn\u2202n and the metric is given by Eq. (1). This can be represented explicitly in terms of real coordinates on U, E:\nS\u03c3 = \u2212 116\u03c0 \u222b UorE Tr [( \u2202\u03bc\u03c3 ) \u03c3\u22121 (\u2202\u03bc\u03c3 ) \u03c3\u22121 ] dx1 \u2227 dx2 \u2227 dx3 \u2227 dx4, (17)\nwhere the real space metrics are given in Eqs. (3) and (5). The NL\u03c3M action density is read from the integrand as L\u03c3 := \u2212(1/16\u03c0 )Tr [( \u2202\u03bc\u03c3 ) \u03c3\u22121 (\u2202\u03bc\u03c3 ) \u03c3\u22121 ] .\nSimilarly, the Wess\u2013Zumino action is described as follows: SWZ = \u2212 i12\u03c0 \u222b M4 A \u2227 Tr [(d\u03c3 ) \u03c3\u22121 \u2227 (d\u03c3 ) \u03c3\u22121 \u2227 (d\u03c3 ) \u03c3\u22121]\n= 1 16\u03c0 \u222b M4 \u23a7\u23aa\u23aa\u23aa\u23aa\u23a8\u23aa\u23aa\u23aa\u23aa\u23a9 Tr (\u03b8w\u03b8z\u03b8\u0303z \u2212 \u03b8w\u03b8\u0303z\u03b8z) w +Tr (\u03b8w\u0303\u03b8z\u03b8\u0303z \u2212 \u03b8w\u0303\u03b8\u0303z\u03b8z) w\u0303 \u2212Tr (\u03b8z\u03b8w\u03b8w\u0303 \u2212 \u03b8z\u03b8w\u0303\u03b8w) z \u2212Tr (\u03b8\u0303z\u03b8w\u03b8w\u0303 \u2212 \u03b8\u0303z\u03b8w\u0303\u03b8w) z\u0303 \u23ab\u23aa\u23aa\u23aa\u23aa\u23ac\u23aa\u23aa\u23aa\u23aa\u23ad dz \u2227 dz\u0303 \u2227 dw \u2227 dw\u0303, (18) where \u03b8m := (\u2202m\u03c3 )\u03c3\u22121. Here we choose the potential one-form A as A = (i/4) (zdz\u0303 \u2212z\u0303dz \u2212 wdw\u0303 + w\u0303dw). This can be reduced to the three kinds of real spaces. For\n5/47\nD ow nloaded from https://academ ic.oup.com /ptep/article/2023/4/043B03/7093422 by Indian Institute of Technology Patna user on 18 January 2024\nexample, in the ultrahyperbolic space U1, it is\nSWZ = \u2212 116\u03c0 \u222b\nU1 \u23a7\u23aa\u23aa\u23aa\u23aa\u23a8\u23aa\u23aa\u23aa\u23aa\u23a9 Tr (\u03b81\u03b82\u03b84 \u2212 \u03b81\u03b84\u03b82) x1 +Tr (\u03b82\u03b81\u03b83 \u2212 \u03b82\u03b83\u03b81) x2 +Tr (\u03b83\u03b82\u03b84 \u2212 \u03b83\u03b84\u03b82) x3 +Tr (\u03b84\u03b81\u03b83 \u2212 \u03b84\u03b83\u03b81) x4 \u23ab\u23aa\u23aa\u23aa\u23aa\u23ac\u23aa\u23aa\u23aa\u23aa\u23ad dx 1 \u2227 dx2 \u2227 dx3 \u2227 dx4. (19)\nwhere \u03b8\u03bc := (\u2202\u03bc\u03c3 )\u03c3\u22121. The Wess\u2013Zumino action density LWZ can be read from the integrand.\n2.2. Useful formulas for G = GL(2, C) In this subsection, we focus on the case of G = GL(2, C). Additionally we impose the condition \u2202m|\u03c3 | = 0 on \u03c3 because our soliton solutions \u03c3 obtained in Sect. 3.2 satisfy this condition. Then the WZW action density becomes a concise determinant form as follows. By Jacobi\u2019s formula, Tr[(\u2202m\u03c3 )\u03c3\u22121] = \u2202m|\u03c3 |/|\u03c3 | = \u2202mlog |\u03c3 |, we find that the condition \u2202m|\u03c3 | = 0 is equivalent to the condition Tr[(\u2202m\u03c3 )\u03c3\u22121] = 0, which can be expressed in terms of the matrix elements (\u2202m\u03c3 11)\u03c3 22 \u2212 (\u2202m\u03c3 12)\u03c3 21 = \u2212{\u03c3 11(\u2202m\u03c3 22) \u2212 \u03c3 12(\u2202m\u03c3 21)}. Therefore, we have\nTr [ (\u2202m\u03c3 )\u03c3\u22121(\u2202n\u03c3 )\u03c3\u22121 ] = \u22121|\u03c3 | (\u2223\u2223\u2223\u2223\u2223\u2202m\u03c311 \u2202m\u03c312\u2202n\u03c321 \u2202n\u03c322 \u2223\u2223\u2223\u2223\u2223 + \u2223\u2223\u2223\u2223\u2223\u2202n\u03c311 \u2202n\u03c312\u2202m\u03c321 \u2202m\u03c322 \u2223\u2223\u2223\u2223\u2223 ) . (20)\nIn this paper, we always take the following parametrization for the soliton solution \u03c3 :\n\u03c3 = \u22121\n( 11 12\n21 22\n) , (21)\nunder the condition \u2202m|\u03c3 | = 0. Note that this reparametrization is not unique and there is a relation between the five variables:\n11 22 \u2212 12 21 = |\u03c3 | 2. (22) In this setting, the quadratic term (20) can be rewritten as\nTr [ (\u2202m\u03c3 )\u03c3\u22121(\u2202n\u03c3 )\u03c3\u22121 ] = 1|\u03c3 | 2 {\u2223\u2223\u2223\u2223\u2223\u2202m 11 \u2202m 12\u2202n 21 \u2202n 22 \u2223\u2223\u2223\u2223\u2223 + \u2223\u2223\u2223\u2223\u2223\u2202n 11 \u2202n 12\u2202m 21 \u2202m 22 \u2223\u2223\u2223\u2223\u2223 \u2212 2|\u03c3 |(\u2202m )(\u2202n ) } . (23)\nSimilarly, the cubic term is: Tr [ (\u2202m\u03c3 )\u03c3\u22121(\u2202n\u03c3 )\u03c3\u22121(\u2202p\u03c3 )\u03c3\u22121 ] (24)\n= 1 2|\u03c3 |2 4 \u2223\u2223\u2223\u2223\u2223\u2223\u2223\u2223\u2223 11 12 21 22 \u2202m 11 \u2202m 12 \u2202m 21 \u2202m 22 \u2202n 11 \u2202n 12 \u2202n 21 \u2202n 22\n\u2202p 11 \u2202p 12 \u2202p 21 \u2202p 22\n\u2223\u2223\u2223\u2223\u2223\u2223\u2223\u2223\u2223 = 1 2|\u03c3 |2 4 (Amnp + Anpm + Apmn),\nAmnp := \u2223\u2223\u2223\u2223\u2223 11 22\u2202m 11 \u2202m 22 \u2223\u2223\u2223\u2223\u2223 \u2223\u2223\u2223\u2223\u2223\u2202n 12 \u2202n 21\u2202p 12 \u2202p 21 \u2223\u2223\u2223\u2223\u2223 + \u2223\u2223\u2223\u2223\u2223 12 21\u2202m 12 \u2202m 21 \u2223\u2223\u2223\u2223\u2223 \u2223\u2223\u2223\u2223\u2223\u2202n 11 \u2202n 22\u2202p 11 \u2202p 22 \u2223\u2223\u2223\u2223\u2223 . (25) By the permutation property of determinants (cf. Eq. (24)), we have\nTr [ (\u2202m\u03c3 )\u03c3\u22121(\u2202n\u03c3 )\u03c3\u22121(\u2202p\u03c3 )\u03c3\u22121 ] = \u2212Tr [(\u2202m\u03c3 )\u03c3\u22121(\u2202p\u03c3 )\u03c3\u22121(\u2202n\u03c3 )\u03c3\u22121] . (26) Therefore under the condition \u2202m|\u03c3 | = 0, the Wess\u2013Zumino term can be further simplified as\n6/47\nD ow nloaded from https://academ ic.oup.com /ptep/article/2023/4/043B03/7093422 by Indian Institute of Technology Patna user on 18 January 2024\nSWZ = \u2212 i12\u03c0 \u222b M4 A \u2227 Tr [(d\u03c3 ) \u03c3\u22121 \u2227 (d\u03c3 ) \u03c3\u22121 \u2227 (d\u03c3 ) \u03c3\u22121]\n= 1 8\u03c0 \u222b M4 { Tr (\u03b8w\u03b8z\u03b8\u0303z) w + Tr (\u03b8w\u0303\u03b8z\u03b8\u0303z) w\u0303 \u2212Tr (\u03b8z\u03b8w\u03b8w\u0303) z \u2212 Tr (\u03b8\u0303z\u03b8w\u03b8w\u0303) z\u0303 } dz \u2227 dz\u0303 \u2227 dw \u2227 dw\u0303\nU1= \u222b\nU1\nLWZdx1 \u2227 dx2 \u2227 dx3 \u2227 dx4, (27)\nLWZ U1= \u2212 1\n8\u03c0\n( Tr (\u03b81\u03b82\u03b84) x1 + Tr (\u03b82\u03b81\u03b83) x2 + Tr (\u03b83\u03b82\u03b84) x3 + Tr (\u03b84\u03b81\u03b83) x4 ) . (28)\n3. Darboux transformation and soliton solutions In this section, we review the soliton solutions of the Yang equation, which are constructed by applying the Darboux transformation [18,19].\n3.1. Darboux transformation for the Yang equation Let us assume that G = GL(N, C) in this subsection. The Yang equation (11) can be rewritten as the following differential equation: \u2202\u0303z((\u2202z\u03c3 )\u03c3\u22121) \u2212 \u2202w\u0303((\u2202w\u03c3 )\u03c3\u22121) = 0. (29) There exists a Lax representation of Eq. (29) given by the following linear system [19]:\nL( f ) := \u03c3\u2202w(\u03c3\u22121 f ) \u2212 (\u2202\u0303z f )\u03b6 = 0, M( f ) := \u03c3\u2202z(\u03c3\u22121 f ) \u2212 (\u2202w\u0303 f )\u03b6 = 0. (30)\nThe spectral parameter \u03b6 here must be generalized to an N \u00d7 N constant matrix otherwise the Darboux transformation would be a trivial transformation. This is a key point to define a non-trivial Darboux transformation as we will see later.\nIt is not hard to verify that the compatibility condition L(M(f)) \u2212 M(L(f)) = 0 implies the Yang equation (29). The existence of N-independent solutions of the linear system (30) is an assumption here; however, we will show later that it actually exists for the soliton solution cases. Then, f can be rewritten as an N \u00d7 N matrix that consists of the N-independent solutions as column vectors of length N.\nThe Darboux transformation is defined as an auto-B\u00e4cklund transformation of the linear system (30). Firstly, we start with a solution \u03c3 of the Yang equation, and a solution f = f(\u03b6 ) of the linear system (30). Secondly, we prepare a special solution \u03c8( ) := f( ) for a fixed spectral parameter matrix \u03b6 = . Then the following Darboux transformation, f \u2032 = f \u03b6 \u2212 \u03c8 \u03c8\u22121 f , \u03c3 \u2032 = \u2212\u03c8 \u03c8\u22121\u03c3, (31) keeps the linear system (30) invariant in form, i.e.,\nL\u2032( f \u2032) := \u03c3 \u2032\u2202w(\u03c3 \u2032\u22121 f \u2032) \u2212 (\u2202\u0303z f \u2032)\u03b6 = 0, M \u2032( f \u2032) := \u03c3 \u2032\u2202z(\u03c3 \u2032\u22121 f \u2032) \u2212 (\u2202w\u0303 f \u2032)\u03b6 = 0. (32)\nAs mentioned before, the transformation (31) becomes trivial if the spectral parameter is a scalar matrix where commutes with \u03c8 . The Darboux transformation maps the input data (\u03c3 , f(\u03b6 ), \u03c8( )) to the output data (\u03c3 \u2032, f \u2032(\u03b6 )) and therefore we get a new solution \u03c3 \u2032 of the Yang equation successfully. In the same way, these output data can be reused as the next input data\n7/47\nD ow nloaded from https://academ ic.oup.com /ptep/article/2023/4/043B03/7093422 by Indian Institute of Technology Patna user on 18 January 2024\n(\u03c3 \u2032, f \u2032(\u03b6 ), \u03c8 \u2032( \u2032)) for the Darboux transformation. Here we define a special solution \u03c8 \u2032( \u2032) := f \u2032( \u2032) by choosing a suitable spectral parameter matrix \u03b6 = \u2032. Continuing this process, we get a series of input\u2013output data: (\u03c3 , f, \u03c8) \u2192(\u03c3 \u2032, f \u2032, \u03c8 \u2032) \u2192\u00b7\u00b7\u00b7. Therefore by applying n iterations of the Darboux transformation, we can get n exact solutions \u03c3 [j] of the Yang equation and express them in terms of the quasideterminants in a compact form [18,19]. For our purposes in this paper, it is sufficient to choose a trivial seed solution \u03c3 [1] = 1:\n\u03c3[n+1] = \u2223\u2223\u2223\u2223\u2223\u2223\u2223\u2223\u2223\u2223\u2223\u2223 \u03c81 \u00b7 \u00b7 \u00b7 \u03c8n 1 \u03c81 1 \u00b7 \u00b7 \u00b7 \u03c8n n 0 ... ... ... \u03c81 n\u22121 1 \u00b7 \u00b7 \u00b7 \u03c8n n\u22121n 0\n\u03c81 n 1 \u00b7 \u00b7 \u00b7 \u03c8n nn 0\n\u2223\u2223\u2223\u2223\u2223\u2223\u2223\u2223\u2223\u2223\u2223\u2223 , n \u2208 N (33)\nwhere each \u03c8 j = \u03c8 j( j) (j = 1, 2,\u2026, n) is a solution (N \u00d7 N matrix) of the initial linear system (\u03c3 = 1):\n\u2202w\u03c8 j = (\u2202\u0303z\u03c8 j ) j, \u2202z\u03c8 j = (\u2202w\u0303\u03c8 j ) j . (34) Hence the problem of solving the Yang equation reduces to solving Eq. (34). (The label [n + 1] in the n-soliton solution is omitted in most of this paper except for Appendix C.)\nIn the main part of this paper, we do not explain the details of the quasideterminant, but provide the definition and properties of the quasideterminant in Appendix A. The detailed computations can be found in Appendices B and C.\n3.2. Soliton solutions for G = GL(2, C) From now on, we focus only on the soliton solutions for G = GL(2, C). An example of the multi-soliton solution is given by [21]:\n\u03c8 j = ( eL j e\u2212Lj\n\u2212e\u2212L j eL j\n) , j = ( \u03bb j 0 0 \u03bc j ) , (35)\nwhere the two kinds of spectral parameters \u03bbj, \u03bcj (j = 1, 2,\u2026, n) are complex constants with the following mutual relationship on each real space:\n(\u03bb j, \u03bc j ) = { (\u03bb j, \u03bb j ) on U1, (\u03bb j, 1/\u03bb j ) on U2,\n(\u03bb j, \u22121/\u03bb j ) on E. (36)\nThe powers Lj of the exponential function are linear in the complex coordinates: Lj := \u03bb j\u03b1 jz + \u03b2 j z\u0303 + \u03bb j\u03b2 jw + \u03b1 j w\u0303, where \u03b1 j, \u03b2 j \u2208 C. The representations of Lj in real coordinates are\nLj U1= 1\u221a\n2\n{ (\u03bb j\u03b1 j + \u03b2 j )x1 + (\u03bb j\u03b2 j \u2212 \u03b1 j )x2 + (\u03bb j\u03b1i \u2212 \u03b2 j )x3 + (\u03bb j\u03b2 j + \u03b1 j )x4 } , (37)\nE= 1\u221a 2\n{ (\u03bb j\u03b1 j + \u03b2 j )x1 + i(\u03bb j\u03b1 j \u2212 \u03b2 j )x2 + (\u03bb j\u03b2 j \u2212 \u03b1 j )x3 + i(\u03bb j\u03b2 j + \u03b1 j )x4 } . (38)\nWe use the notation ( j)\u03bc to simplify the coefficients of Lj in the following sections, i.e., Lj :=\n( j) \u03bc x\u03bc. We remark that the determinant of the n-soliton solution \u03c3 is constant [17, 21]:\n|\u03c3 | = n\u220f\nj=1 \u03bb j\u03bc j, (39)\n8/47\nD ow nloaded from https://academ ic.oup.com /ptep/article/2023/4/043B03/7093422 by Indian Institute of Technology Patna user on 18 January 2024\nwhich satisfies the requirement \u2202\u03bc|\u03c3 | = 0. Therefore, we can apply the formulas (23) and (24) to the n-soliton solutions. On the ultrahyperbolic space U1 in particular, the n-soliton solution \u03c3 satisfies \u03c3\u03c3 \u2020 = \u03c3 \u2020\u03c3 = |\u03c3 | [17, 21] and hence after the scale transformation \u03c3 \u2192|\u03c3 |1/2\u03c3 , \u03c3 belongs to SU(2). On the Euclidean space E, \u03c3 can take values in U(2), which is proved in Appendix C.\nBy the definition (A5) of the quasideterminant, the n-soliton solution \u03c3 (cf. Eqs. (33) and (35)) can be represented in the form of Eq. (21):\n= \u2223\u2223\u2223\u2223\u2223\u2223\u2223\u2223\u2223\u2223 \u03c81 \u00b7 \u00b7 \u00b7 \u03c8n \u03c81 1 \u00b7 \u00b7 \u00b7 \u03c8n n ... ... \u03c81 n\u22121 1 \u00b7 \u00b7 \u00b7 \u03c8n n\u22121n \u2223\u2223\u2223\u2223\u2223\u2223\u2223\u2223\u2223\u2223 = \u2223\u2223\u2223\u2223\u2223\u2223\u2223 (\u03c81)1 \u00b7 \u00b7 \u00b7 (\u03c8n)1 (\u03c81)2 \u00b7 \u00b7 \u00b7 (\u03c8n)2 (n\u22121)\u00d7n \u2223\u2223\u2223\u2223\u2223\u2223\u2223 ,\n11 = \u2212 \u2223\u2223\u2223\u2223\u2223\u2223\u2223\u2223\u2223\u2223\u2223\u2223 \u03c81 \u00b7 \u00b7 \u00b7 \u03c8n e1 \u03c81 1 \u00b7 \u00b7 \u00b7 \u03c8n n 0 ... ... ... \u03c81 n\u22121 1 \u00b7 \u00b7 \u00b7 \u03c8n n\u22121n 0\n(\u03c81 n1)1 \u00b7 \u00b7 \u00b7 (\u03c8n nn)1 0\n\u2223\u2223\u2223\u2223\u2223\u2223\u2223\u2223\u2223\u2223\u2223\u2223 = \u2223\u2223\u2223\u2223\u2223\u2223\u2223 (\u03c81 n1)1 \u00b7 \u00b7 \u00b7 (\u03c8n nn)1 (\u03c81)2 \u00b7 \u00b7 \u00b7 (\u03c8n)2 (n\u22121)\u00d7n \u2223\u2223\u2223\u2223\u2223\u2223\u2223 ,\n12 = \u2212 \u2223\u2223\u2223\u2223\u2223\u2223\u2223\u2223\u2223\u2223\u2223\u2223 \u03c81 \u00b7 \u00b7 \u00b7 \u03c8n e2 \u03c81 1 \u00b7 \u00b7 \u00b7 \u03c8n n 0 ... ... ... \u03c81 n\u22121 1 \u00b7 \u00b7 \u00b7 \u03c8n n\u22121n 0\n(\u03c81 n1)1 \u00b7 \u00b7 \u00b7 (\u03c8n nn)1 0\n\u2223\u2223\u2223\u2223\u2223\u2223\u2223\u2223\u2223\u2223\u2223\u2223 = \u2223\u2223\u2223\u2223\u2223\u2223\u2223 (\u03c81)1 \u00b7 \u00b7 \u00b7 (\u03c8n)1 (\u03c81 n1)1 \u00b7 \u00b7 \u00b7 (\u03c8n nn)1 (n\u22121)\u00d7n \u2223\u2223\u2223\u2223\u2223\u2223\u2223 ,\n21 = \u2212 \u2223\u2223\u2223\u2223\u2223\u2223\u2223\u2223\u2223\u2223\u2223\u2223 \u03c81 \u00b7 \u00b7 \u00b7 \u03c8n e1 \u03c81 1 \u00b7 \u00b7 \u00b7 \u03c8n n 0 ... ... ... \u03c81 n\u22121 1 \u00b7 \u00b7 \u00b7 \u03c8n n\u22121n 0\n(\u03c81 n1)2 \u00b7 \u00b7 \u00b7 (\u03c8n nn)2 0\n\u2223\u2223\u2223\u2223\u2223\u2223\u2223\u2223\u2223\u2223\u2223\u2223 = \u2223\u2223\u2223\u2223\u2223\u2223\u2223 (\u03c81 n1)2 \u00b7 \u00b7 \u00b7 (\u03c8n nn)2 (\u03c81)2 \u00b7 \u00b7 \u00b7 (\u03c8n)2 (n\u22121)\u00d7n \u2223\u2223\u2223\u2223\u2223\u2223\u2223 ,\n22 = \u2212 \u2223\u2223\u2223\u2223\u2223\u2223\u2223\u2223\u2223\u2223\u2223\u2223 \u03c81 \u00b7 \u00b7 \u00b7 \u03c8n e2 \u03c81 1 \u00b7 \u00b7 \u00b7 \u03c8n n 0 ... ... ... \u03c81 n\u22121 1 \u00b7 \u00b7 \u00b7 \u03c8n n\u22121n 0\n(\u03c81 n1)2 \u00b7 \u00b7 \u00b7 (\u03c8n nn)2 0\n\u2223\u2223\u2223\u2223\u2223\u2223\u2223\u2223\u2223\u2223\u2223\u2223 = \u2223\u2223\u2223\u2223\u2223\u2223\u2223 (\u03c81)1 \u00b7 \u00b7 \u00b7 (\u03c8n)1 (\u03c81 n1)2 \u00b7 \u00b7 \u00b7 (\u03c8n nn)2 (n\u22121)\u00d7n \u2223\u2223\u2223\u2223\u2223\u2223\u2223 , (40)\nwhere\n(n\u22121)\u00d7n := \u239b\u239c\u239d \u03c81 1 \u00b7 \u00b7 \u00b7 \u03c8n n... ... \u03c81 n\u22121 1 \u00b7 \u00b7 \u00b7 \u03c8n n\u22121n \u239e\u239f\u23a0 , and e1 := (1, 0)t, e2 := (0, 1)t, 0 := (0, 0)t, and (A)k is the kth row of a square matrix A. The data and jk are determinants of 2n \u00d7 2n matrices.\n9/47\nD ow nloaded from https://academ ic.oup.com /ptep/article/2023/4/043B03/7093422 by Indian Institute of Technology Patna user on 18 January 2024\nWe remark that \u03c8 j can be decomposed into, for instance, \u03c8 j = ( eL j e\u2212L j\n\u2212e\u2212L j eL j\n) = ( eXj ei j \u2212e\u2212i j eXj )( e\u2212L j 0 0 e\u2212L j ) , (41)\nwhere Xj := Lj + Lj , i j := Lj \u2212 Lj . The second factor diag(e\u2212L j , e\u2212L j ) can be eliminated in the n-soliton solutions (33) due to the property of the quasideterminant (A7). Hence the nsoliton solutions (33) depend only on Xj and j. The expansion coefficients for the real coordinates are denoted by Xj = r( j)\u03bc x\u03bc, i j = s( j)\u03bc x\u03bc, i.e., r( j)\u03bc := ( j)\u03bc + ( j)\u03bc \u2208 R, s( j)\u03bc := ( j)\u03bc \u2212 ( j) \u03bc \u2208 iR, where Lj = ( j)\u03bc x\u03bc. It is obvious that \u2202\u03bce\u00b1Xj = \u00b1r( j)\u03bc e\u00b1Xj , \u2202\u03bce\u00b1i j = \u00b1s( j)\u03bc e\u00b1i j , \u2202\u03bce\u00b1i jk = \u00b1 ( s( j)\u03bc \u2212 s(k)\u03bc ) e\u00b1i jk, (42)\nwhere jk := j \u2212 k. Note that the flip of space-time coordinates x \u2192 \u2212x\u21d4(x1, x2, x3, x4) \u2192 (\u2212 x1, \u2212x2, \u2212x3, \u2212x4) corresponds to the following flips of the new variables:\nx \u2192 \u2212x \u21d0\u21d2 Lj \u2192 \u2212Lj \u21d0\u21d2 (Xj, j ) \u2192 (\u2212Xj, \u2212 j ). (43) Under this flip, we find the following symmetry (cf. Eq. (D1)):\n( , 11, 12, 21, 22) \u2223\u2223\u2223 (Xj , j )\u2192(\u2212Xj ,\u2212 j ) = ( , 22, 21, 12, 11), (44)\n\u2202\u03bc( , 11, 12, 21, 22) \u2223\u2223\u2223 (Xj , j )\u2192(\u2212Xj ,\u2212 j )\n= \u2212\u2202\u03bc( , 22, 21, 12, 11). (45) Here let us discuss the singularities of the solution \u03c3 . Under the decomposition (21), possible singularities correspond to zeros of . For the one-soliton solution (cf. Eq. (D6)), = 2cosh X1 and hence there is no singularity.3 For the two-soliton solution (cf. Eq. (D7)), we can evaluate the value of on the ultrahyperbolic space U1 as follows:\n1 2 = acosh(X1 + X2) + bcosh(X1 \u2212 X2) + ccos 12\n\u2265 |\u03bb1 \u2212 \u03bb2|2 + \u2223\u2223\u03bb1 \u2212 \u03bb2\u2223\u22232 \u2212 \u2223\u2223(\u03bb1 \u2212 \u03bb1)(\u03bb2 \u2212 \u03bb2)\u2223\u2223\n= { 2 \u2223\u2223\u03bb1 \u2212 \u03bb2\u2223\u22232 > 0 if c > 0\n2 |\u03bb1 \u2212 \u03bb2|2 > 0 if c < 0 , (46)\nwhere a, b, c are real constants defined in Table 1. Therefore, the denominator is positive anywhere and \u03c3 is proved to be non-singular on U1.\nOn the other hand, on the Euclidean space E, \u03c3 has singularities because it has zero locus due to the fact that cosh(X1 \u00b1 X2) \u2265 1, |cos 12| \u2264 1 and a, b have opposite signs (see Table 1). However, this problem can be solved successfully by choosing suitable initial data \u03c8 , which will be discussed in Sect. 5.\nFinally we comment on an asymptotic behavior in the region that r2 := (x1)2 + (x2)2 + (x3)2 + (x4)2 is large enough in order to prove that the Wess\u2013Zumino action density decays exponentially in the asymptotic region. We note that the n-soliton solution (33) is a meromorphic function of (\u03be 1,\u2026, \u03be n, \u03b71,\u2026, \u03b7n) where \u03beK := eXK , \u03b7K := ei K . Let us discuss the absolute value of the Wess\u2013Zumino action density. In fact, we will see in Sect. 5 that the action density tends\n3If the (2,1) component \u2212e\u2212L1 in the one-soliton solution \u03c8 is replaced with +e\u2212L1 , then = 2sinh X1 and has zero on X1 = 0. This corresponds to the following singular one-soliton solution of the KP equation: u = 2\u22022x log(eX \u2212 e\u2212X ) \u221d csch2X , where X is a linear combination of the space-time coordinates t, x, y. On the other hand, a non-singular one-soliton solution is given by u(t, x, y) = 2\u22022x log(eX + e\u2212X ) \u221d sech2X .\n10/47\nD ow nloaded from https://academ ic.oup.com /ptep/article/2023/4/043B03/7093422 by Indian Institute of Technology Patna user on 18 January 2024\nTable 1. Summary of coefficients.\nSpace U1 E (Metric) (+, +, \u2212, \u2212) (+, +, +, +) a \u2208 R+ |\u03bb1 \u2212 \u03bb2|2 > 0 |\u03bb1 \u2212 \u03bb2|2 > 0 b \u2208 R \u2223\u2223\u03bb1 \u2212 \u03bb2\u2223\u22232 > 0 \u2212 \u2223\u2223\u03bb1\u03bb2 + 1\u2223\u22232 < 0 c \u2208 R (\u03bb1 \u2212 \u03bb1)(\u03bb2 \u2212 \u03bb2) (|\u03bb1|2 + 1)(|\u03bb2|2 + 1) djk ( \u03b1 j\u03b2k \u2212 \u03b2 j\u03b1k )( \u03bb j \u2212 \u03bbk )3 ( \u03b1 j\u03b1k + \u03b2 j\u03b2k )( \u03bb j\u03bbk + 1\n)3 (= dk j ) \u03bb j\u03bbk \u03bb j\u03bbk ejk (\u03b1 j\u03b2k \u2212 \u03b2 j\u03b1k)(\u03bb j \u2212 \u03bbk)3 (\u03b1 j\u03b2k \u2212 \u03b2 j\u03b1k)(\u03bb j \u2212 \u03bbk)3\n\u03bbj\u03bbk \u03bbj\u03bbk\nto zero in the asymptotic region. This implies that, for any variable \u03beK, the polynomial degree of the denominator is greater than that of the numerator. (\u03b7K is not essential because of |\u03b7K| = 1.) Let us consider a specific asymptotic direction where the most dominant terms are \u03be i11 \u00b7 \u00b7 \u00b7 \u03be inn in the numerator and \u03be j11 \u00b7 \u00b7 \u00b7 \u03be jnn in the denominator where ik \u2264 jk. Then the action density behaves as O(\u03be i1\u2212 j11 \u00b7 \u00b7 \u00b7 \u03be in\u2212 jnn ). At least for one K, iK < jK and hence this implies that it decays exponentially.\nLet us take the two-soliton case as an example. If we consider the asymptotic limit such that X1 is finite and |X2| 1 (cf. Eq. (61)), the most dominant factor is e\u00b1X2 and the denominator and the numerator have the same order of \u03be1 \u2261 e\u00b1X2 . However, due to the identity (63), the most dominant term in the numerator vanishes and hence the Wess\u2013Zumino action density is O(\u03be\u2212k1 ), where k is some positive integer. Therefore we can conclude that the Wess\u2013Zumino action density decays exponentially.\nTherefore, on U1, the Wess\u2013Zumino action converges for the one- and two-soliton solutions because it has no singularity and decays exponentially. For the n-soliton solution, this is an open problem, which is discussed in Sect. 7.\n4. Evaluation of action density In this section, we compute the action density of the SU(2) WZW4 model for the one- and two-soliton solutions and find that the corresponding action densities are real-valued on each space. We also find that, for the one-soliton solution, the NL\u03c3M action density is localized on a 3D hyperplane and the Wess\u2013Zumino action density identically vanishes. For the twosoliton solution, we complete the calculation of the NL\u03c3M term, and reach a compact form. In particular, the two peaks of the action density are localized on two non-parallel 3D hyperplanes. As for the Wess\u2013Zumino term, we show that the action density is asymptotic to zero. On the ultrahyperbolic space U1 in particular, no singularity appears in the action densities for the two-soliton case as indicated in Sect. 3.\n4.1. One-soliton solutions In this subsection, we compute the action densities of the SU(2) WZW4 model for the onesoliton solutions.\n11/47\nD ow nloaded from https://academ ic.oup.com /ptep/article/2023/4/043B03/7093422 by Indian Institute of Technology Patna user on 18 January 2024\nTo calculate the NL\u03c3M action density explicitly, we substitute the data of one-soliton (D6) and Eq. (39) into Eq. (23) for m = n = \u03bc and then obtain the following result:\nL\u03c3 = \u2212 116\u03c0 Tr [ (\u2202\u03bc\u03c3 )\u03c3\u22121 (\u2202\u03bc\u03c3 ) \u03c3\u22121 ] = 1 8\u03c0 d11 sech 2X1, (47)\nwhere d11 is determined by Eq. (36) and Eqs. (37)\u2013(38), for instance, d U1 11 = (\u03b11\u03b21 \u2212 \u03b11\u03b21)(\u03bb1 \u2212 \u03bb1)3/ |\u03bb1|2 and d E11 = (|\u03b11|2 + |\u03b21|2)(|\u03bb1|2 + 1)3/ |\u03bb1|2 (cf. djk in Table 1). Hence d11 and L\u03c3 are clearly real-valued. Note that the action density vanishes identically in the case of \u03b11, \u03b21, \u03bb1 \u2208 R on U1 and hence the result is trivial. For the non-trivial cases, the peak of the action density lies on the 3D hyperplane described by the linear equation X1 = 0 on each space.\nThe Wess\u2013Zumino action density can be calculated by substituting the data of one-soliton (D6) and Eq. (39) into Eq. (25) directly. Then we have\n\u2223\u2223\u2223\u2223\u2223 11 22\u2202\u03bc 11 \u2202\u03bc 22 \u2223\u2223\u2223\u2223\u2223 = \u2223\u2223\u2223\u2223\u2223 \u03bb1eX1 + \u03bc1e\u2212X1 \u03bc1eX1 + \u03bb1e\u2212X1r(1)\u03bc (\u03bb1eX1 \u2212 \u03bc1e\u2212X1 ) r(1)\u03bc (\u03bc1eX1 \u2212 \u03bb1e\u2212X1 ) \u2223\u2223\u2223\u2223\u2223\n= \u22122r(1)\u03bc (\u03bb21 \u2212 \u03bc21), (48)\u2223\u2223\u2223\u2223\u2223\u2202\u03bd 11 \u2202\u03bd 22\u2202\u03c1 11 \u2202\u03c1 22 \u2223\u2223\u2223\u2223\u2223 = \u2223\u2223\u2223\u2223\u2223r(1)\u03bd (\u03bb1eX1 \u2212 \u03bc1e\u2212X1 ) r(1)\u03bd (\u03bc1eX1 \u2212 \u03bb1e\u2212X1 )r(1)\u03c1 (\u03bb1eX1 \u2212 \u03bc1e\u2212X1 ) r(1)\u03c1 (\u03bc1eX1 \u2212 \u03bb1e\u2212X1 ) \u2223\u2223\u2223\u2223\u2223 = 0, (49)\u2223\u2223\u2223\u2223\u2223 12 21\u2202\u03bc 12 \u2202\u03bc 21 \u2223\u2223\u2223\u2223\u2223 = (\u03bb1 \u2212 \u03bc1)2 \u2223\u2223\u2223\u2223\u2223 ei 1 e\u2212i 1s(1)\u03bc ei 1 \u2212s(1)\u03bc e\u2212i 1\n\u2223\u2223\u2223\u2223\u2223 = \u22122s(1)\u03bc (\u03bb1 \u2212 \u03bc1)2, (50)\u2223\u2223\u2223\u2223\u2223\u2202\u03bd 12 \u2202\u03bd 21\u2202\u03c1 12 \u2202\u03c1 21 \u2223\u2223\u2223\u2223\u2223 = (\u03bb1 \u2212 \u03bc1)2 \u2223\u2223\u2223\u2223\u2223s(1)\u03bd ei 1 \u2212s(1)\u03bd e\u2212i 1s(1)\u03c1 ei 1 \u2212s(1)\u03c1 e\u2212i 1 \u2223\u2223\u2223\u2223\u2223 = 0. (51)\nThese facts imply that\nTr [ (\u2202\u03bc\u03c3 )\u03c3\u22121(\u2202\u03bd\u03c3 )\u03c3\u22121(\u2202\u03c1\u03c3 )\u03c3\u22121 ] = 0, (52) and therefore the Wess\u2013Zumino action density is identical to zero for the one-soliton case. In fact, the identity (52) holds even when \u03c3 is not a classical solution of the WZW4 model because the condition (34) is not used in our discussion. More explicitly, as long as the power Lj of the exponential function in \u03c8 j is an arbitrary linear function of x\u03bc, the Wess\u2013Zumino action density vanishes identically.\nAll the above results also hold in the case of E.\n4.2. Two-soliton solutions In this subsection, we calculate the action densities of the SU(2) WZW4 model explicitly for the two-soliton solutions.\n12/47\nD ow nloaded from https://academ ic.oup.com /ptep/article/2023/4/043B03/7093422 by Indian Institute of Technology Patna user on 18 January 2024\nBy the result of Appendix D.3 together with Eqs. (36)\u2013(38), we get the following compact form of the NL\u03c3M action density for the two-soliton solution:\nL\u03c3 = \u2212 116\u03c0 Tr [( \u2202\u03bc\u03c3 ) \u03c3\u22121 (\u2202\u03bc\u03c3 ) \u03c3\u22121 ]\n=\n\u23a7\u23aa\u23aa\u23aa\u23aa\u23aa\u23aa\u23aa\u23a8\u23aa\u23aa\u23aa\u23aa\u23aa\u23aa\u23aa\u23a9 ab [ d11 cosh 2 X2 + d22 cosh2 X1 ] +ac [ d12 cosh 2 ( X1 + X2 \u2212 i 12 2 ) + d21 cosh2 ( X1 + X2 + i 12 2 )] \u2212bc [ e12 sinh 2 (\nX1 \u2212 X2 \u2212 i 12 2\n) + e12 sinh2 ( X1 \u2212 X2 + i 12\n2\n)] \u23ab\u23aa\u23aa\u23aa\u23aa\u23aa\u23aa\u23aa\u23ac\u23aa\u23aa\u23aa\u23aa\u23aa\u23aa\u23aa\u23ad 2\u03c0 [a cosh(X1 + X2) + b cosh(X1 \u2212 X2) + c cos 12]2\n=\n\u23a7\u23aa\u23aa\u23aa\u23aa\u23aa\u23aa\u23aa\u23aa\u23a8\u23aa\u23aa\u23aa\u23aa\u23aa\u23aa\u23aa\u23aa\u23a9 2ab [ d11 cosh 2X2 + d22 cosh2X1 ] + c [a(d12 + d21) \u2212 b(e12 + e12)] coshX1coshX2cos 12 + c [a(d12 + d21) + b(e12 + e12)] (sinhX1sinhX2 + 1)cos 12 \u2212ic [a(d12 \u2212 d21) + b(e12 \u2212 e12)] sinhX1coshX2sin 12 \u2212ic [a(d12 \u2212 d21) \u2212 b(e12 \u2212 e12)] coshX1sinhX2sin 12 \u23ab\u23aa\u23aa\u23aa\u23aa\u23aa\u23aa\u23aa\u23aa\u23ac\u23aa\u23aa\u23aa\u23aa\u23aa\u23aa\u23aa\u23aa\u23ad 4\u03c0 [a cosh(X1 + X2) + b cosh(X1 \u2212 X2) + c cos 12]2\n(53)\nwhere a, b, c, djk, ejk are defined in Table 1 for each space. (The difference between E and U1 appears only in the coefficients like the one-soliton case.) Note that the coefficients in Table 1 also guarantee the NL\u03c3M action density to be real-valued on U1 and E.\nNext, let us explain why Eq. (53) can be interpreted as two intersecting one-solitons in the asymptotic region. Due to the solitonic property, individual one-solitons will regain all their features (wave shape, velocity, amplitude, etc.) outside the scattering region except for respective differences of an additional position shift. Theoretically, each one-soliton can be separated completely from the other one-soliton in the asymptotic region in which it mainly dominates the asymptotic behavior. Therefore, we can consider the following type of asymptotic limit:\n{ X1 is finite\n|X2| |X1| (54)\nin which the first one-soliton, localized on the hyperplane X1 = 0, mainly dominates the asymptotic behavior. Such asymptotics will be discussed more systematically in Sect. 5. In the asymptotic limit (54), the action density (53) is dominated by\nTr [( \u2202\u03bc\u03c3 ) \u03c3\u22121 (\u2202\u03bc\u03c3 ) \u03c3\u22121 ] |X2| |X1|\n= 8abd11 cosh 2 X2 + O(cosh X2)\n[acosh(X1 + X2) + bcosh(X1 \u2212 X2) + O(1)]2\n= 8abd11 + O(sechX2) [(a + b)coshX1 + (a \u2212 b)sinhX1 tanhX2 + O(sechX2)]2 . (55)\n13/47\nD ow nloaded from https://academ ic.oup.com /ptep/article/2023/4/043B03/7093422 by Indian Institute of Technology Patna user on 18 January 2024\nSince sinhX1 and coshX1 are finite and sechX2 \u2192 0 and tanhX2 \u2192 \u00b11 as X2 \u2192 \u00b1\u221e, we have Tr [( \u2202\u03bc\u03c3 ) \u03c3\u22121 (\u2202\u03bc\u03c3 ) \u03c3\u22121 ] X2\u2192\u00b1\u221e\u2212\u2192 8abd11 [(a + b)coshX1 \u00b1 (a \u2212 b)sinhX1]2\n= \u23a7\u23aa\u23aa\u23a8\u23aa\u23aa\u23a9 8abd11 (aeX1 + be\u2212X1 )2 as X2 \u2212\u2192 +\u221e 8abd11\n(beX1 + ae\u2212X1 )2 as X2 \u2212\u2192 \u2212\u221e . (56)\nNow we conclude that\n\u22128\u03c0L\u03c3 \u2212\u2192 \u23a7\u23aa\u23aa\u23aa\u23aa\u23aa\u23aa\u23a8\u23aa\u23aa\u23aa\u23aa\u23aa\u23aa\u23a9 (1) X1 is finite, X2 \u2192 +\u221e : d11 sech2 (X1 + \u03b41) (2) X1 is finite, X2 \u2192 \u2212\u221e : d11 sech2 (X1 \u2212 \u03b41) (3) X2 is finite, X1 \u2192 +\u221e : d22 sech2 (X2 + \u03b42) (4) X2 is finite, X1 \u2192 \u2212\u221e : d22 sech2 (X2 \u2212 \u03b42) , (57)\nwhere the position shift factors (or the phase shift factors) are \u03b41 \u2261 \u03b42 := 12 log (a b ) = 1 2 log [ a(1, 1) a(1, \u22121) ] (cf. Eq. (D8)). (58)\nCases (3) and (4) are obtained by the same argument and we just skip the details here. By the above analysis, we find that the NL\u03c3M action density (53) has two peaks that are localized on two non-parallel 3D hyperplanes described by the linear equation X1 \u00b1 \u03b41 = 0 and X2 \u00b1 \u03b42 = 0. A more general discussion for n-soliton case is given in Appendix D.5.\nAs for other asymptotic regions that differ from cases (1)\u2013(4), no solitonic effect contributes to the action density; i.e., the action density is asymptotic to zero in these regions. This will be proved in Sect. 5.\nLet us proceed to calculate the Wess\u2013Zumino action density for the two-soliton solution. By substituting Eqs. (39), (D7), and (42) into Eq. (25) for (m, n, p) = (\u03bc, \u03bd, \u03c1), we have\nTr [ (\u2202\u03bc\u03c3 )\u03c3\u22121(\u2202\u03bd\u03c3 )\u03c3\u22121(\u2202\u03c1\u03c3 )\u03c3\u22121 ] = 1 2 (B\u03bc\u03bd\u03c1 + B\u03bd\u03c1\u03bc + B\u03c1\u03bc\u03bd ),\nB\u03bc\u03bd\u03c1 := 1|\u03c3 |2 4 (\u2223\u2223\u2223\u2223\u2223 11 22\u2202\u03bc 11 \u2202\u03bc 22 \u2223\u2223\u2223\u2223\u2223 \u2223\u2223\u2223\u2223\u2223\u2202\u03bd 12 \u2202\u03bd 21\u2202\u03c1 12 \u2202\u03c1 21 \u2223\u2223\u2223\u2223\u2223 + \u2223\u2223\u2223\u2223\u2223 12 21\u2202\u03bc 12 \u2202\u03bc 21 \u2223\u2223\u2223\u2223\u2223 \u2223\u2223\u2223\u2223\u2223\u2202\u03bd 11 \u2202\u03bd 22\u2202\u03c1 11 \u2202\u03c1 22 \u2223\u2223\u2223\u2223\u2223 ) .\n(59)\nHere each ingredient of B\u03bc\u03bd\u03c1 can be calculated in the same way as the previous section. For example, the result of the first determinant factor in Eq. (59) is\n1 |\u03c3 | 2 \u2223\u2223\u2223\u2223\u2223 11 22\u2202\u03bc 11 \u2202\u03bc 22 \u2223\u2223\u2223\u2223\u2223\n=\n\u2212 \u23a7\u23aa\u23aa\u23aa\u23aa\u23aa\u23aa\u23aa\u23aa\u23aa\u23aa\u23a8\u23aa\u23aa\u23aa\u23aa\u23aa\u23aa\u23aa\u23aa\u23aa\u23aa\u23a9 2r(1)\u03bc abD11 cosh(2X2) + 2r(2)\u03bc abD22 cosh(2X1) + [ (r(1)\u03bc + r(2)\u03bc ) + (s(1)\u03bc \u2212 s(2)\u03bc ) ] acD12 cosh(X1 + X2 \u2212 i 12) + [ (r(1)\u03bc + r(2)\u03bc ) \u2212 (s(1)\u03bc \u2212 s(2)\u03bc ) ] acD21 cosh(X1 + X2 + i 12) + [ (r(1)\u03bc \u2212 r(2)\u03bc ) + (s(1)\u03bc \u2212 s(2)\u03bc ) ] bcE12 cosh(X1 \u2212 X2 \u2212 i 12) \u2212 [ (r(1)\u03bc \u2212 r(2)\u03bc ) \u2212 (s(1)\u03bc \u2212 s(2)\u03bc ) ] bcE\u030312 cosh(X1 \u2212 X2 + i 12) \u23ab\u23aa\u23aa\u23aa\u23aa\u23aa\u23aa\u23aa\u23aa\u23aa\u23aa\u23ac\u23aa\u23aa\u23aa\u23aa\u23aa\u23aa\u23aa\u23aa\u23aa\u23aa\u23ad \u2212 F\n2 [ acosh(X1 + X2) + bcosh(X1 \u2212 X2) + ccos 12 ]2 . (60) 14/47\nD ow nloaded from https://academ ic.oup.com /ptep/article/2023/4/043B03/7093422 by Indian Institute of Technology Patna user on 18 January 2024\nThe definition of the coefficients and the result of the remaining determinant factors can be found in Appendix D.4. Furthermore, we can also show that the Wess\u2013Zumino action density is real-valued on U1 and E (cf. Appendix D.4).\nBy the same technique used in the previous section, we consider the asymptotic limit such that |X2| |X1| for finite X1, and find that\nB\u03bc\u03bd\u03c1 |X2| |X1| \u22124a 2b2C\u03bc\u03bd\u03c1 D11d11tanhX2 + O(sechX2) [(a + b)coshX1 + (a \u2212 b)sinhX1tanhX2 + O(sechX2)]4 , (61)\nwhere C\u03bc\u03bd\u03c1 := ( r(1)\u03bc s (1) \u03bd + s(1)\u03bc r(1)\u03bd ) r(2)\u03c1 \u2212 ( r(1)\u03bc s (1) \u03c1 + s(1)\u03bc r(1)\u03c1 ) r(2)\u03bd . This is asymptotic to\nB\u03bc\u03bd\u03c1 X2\u2192\u00b1\u221e\u2212\u2192 \u22134C\u03bc\u03bd\u03c1 D11d11sech4(X1 \u00b1 \u03b41), (62)\nwhere the phase shift factor is \u03b41 := (1/2)log(a/b). In fact, the coefficient C\u03bc\u03bd\u03c1 in Eq. (62) satisfies the following relation:\nC\u03bc\u03bd\u03c1 + C\u03bd\u03c1\u03bc + C\u03c1\u03bc\u03bd = 0. (63) Therefore the cubic term (59) identically vanishes in the asymptotic region, and the Wess\u2013 Zumino action density is asymptotic to zero for the two-soliton case:\nTr [ (\u2202\u03bc\u03c3 )\u03c3\u22121(\u2202\u03bd\u03c3 )\u03c3\u22121(\u2202\u03c1\u03c3 )\u03c3\u22121 ] \u2212\u2192 0. (64) A more general discussion for the n-soliton case can be found in Appendix D.5.\nThe Wess\u2013Zumino action density for the two-soliton is a smooth function and non-singular and is hence bounded. Moreover, it decays to zero exponentially as mentioned in Sect. 3.2. Therefore, we conjecture that the Wess\u2013Zumino action SWZ would be zero exactly.\n5. Asymptotic analysis of n-soliton solutions Due to the problem of the singularity of the two-soliton solution on the Euclidean space E, in this section, we consider a modified n-soliton solution and discuss the corresponding asymptotic behaviors in a systematic way. The modified n-soliton solution is\n\u03c3 = \u2223\u2223\u2223\u2223\u2223\u2223\u2223\u2223\u2223\u2223\u2223\u2223 \u03c81 \u03c82 \u00b7 \u00b7 \u00b7 \u03c8n 1 \u03c81 1 \u03c82 2 \u00b7 \u00b7 \u00b7 \u03c8n n 0 \u03c81 2 1 \u03c82 2 2 \u00b7 \u00b7 \u00b7 \u03c8n 2n 0 ... ... . . . ... ... \u03c81 n 1 \u03c82 n 2 \u00b7 \u00b7 \u00b7 \u03c8n nn 0 \u2223\u2223\u2223\u2223\u2223\u2223\u2223\u2223\u2223\u2223\u2223\u2223 , \u03c8 j = ( eL j e\u2212L j \u2212 e\u2212L j eL j ) , Lj = ( j)\u03bc x\u03bc j = ( \u03bb (+) j 0 0 \u03bb(\u2212)j ) , (65)\nwhere the spectral parameters (\u03bbj, \u03bcj) are rewritten by (\u03bb (+) j , \u03bb (\u2212) j ) for later convenience. The slight difference between Eqs. (65) and (35) is an additional constant factor taking values in {\u00b11}. The case of = +1 coincides with Eq. (35). We will show that the non-singular n-solitons can be constructed completely for all n \u2208 N by suitable choices of the constant with respect to the ultrahyperbolic space U1 and the Euclidean space E.\nFirst of all, we define two types of the asymptotic region for the n-soliton solutions. Let us consider the asymptotic region of the 4D space where r2 = (x1) + (x2) + (x3) + (x4) is large enough for the spacial point x = (x1, x2, x3, x4). The asymptotic region is divided into 2n regions by the n hyperplanes Xj = 0 (j = 1, 2,\u2026, n) depending on Xj > 0 or Xj < 0. In order to label these regions, it is convenient to introduce a new notation \u03b5j \u2208 {\u00b11, 0}. Then the 2n asymptotic regions can be denoted by R(\u03b51, . . . , \u03b5n) in which \u03b5j = +1, and \u03b5j = \u22121 correspond to the\n15/47\nD ow nloaded from https://academ ic.oup.com /ptep/article/2023/4/043B03/7093422 by Indian Institute of Technology Patna user on 18 January 2024\nfollowing cases (+) and (\u2212) respectively:4 (+)Xj +1 \u21d4 ReLj +1 \u21d4 \u2223\u2223eL j \u2223\u2223 1 \u21d4 \u2223\u2223e\u2212L j \u2223\u2223 1,\n(\u2212)Xj \u22121 \u21d4 ReLj \u22121 \u21d4 \u2223\u2223eL j \u2223\u2223 1 \u21d4 \u2223\u2223e\u2212L j \u2223\u2223 1. (66)\nThen we can unify the asymptotic regions as R := \u22c3\n\u03b5 j=\u00b11 R(\u03b51, . . . , \u03b5n). (67)\nWe will see that the Wess\u2013Zumino action density vanishes in R. On the other hand, there is the other type of asymptotic region along the hyperplane Xj, which corresponds to the case of \u03b5j = 0. To make the asymptotic region 4D, let us define the asymptotic region along XK as a tubular neighborhood of R(\u03b51, . . . , \u03b5K = 0, . . . , \u03b5n), which is denoted by RK (\u03b51, \u00b7 \u00b7 \u00b7 , \u03b5n). In this region, the value of XK is considered to be finite. We will see that the NL\u03c3M and the Wess\u2013Zumino action densities coincide with a one-soliton configuration in RK .\nThe two type of asymptotic regions can be expressed in terms of the following sets: R := { x \u2208 M4 \u2223\u2223\u2223\u2223\u2223x21 + x22 + x23 + x24 is large enough.Xj are all positive or negative ( j = 1, . . . , n). }\nRK := \u23a7\u23aa\u23aa\u23aa\u23aa\u23aa\u23a8\u23aa\u23aa\u23aa\u23aa\u23aa\u23a9 x = k1e1 + k2e2 + k3e3 + a \u2208 M4 \u2223\u2223\u2223\u2223\u2223\u2223\u2223\u2223\u2223\u2223\u2223 e1, e2, e3 are linearly independent vectors tangent to the hyperplane: XK = 0. a is a finite vector. k21 + k22 + k23 is large enough. Xj ( j = K ) are all positive or negative. \u23ab\u23aa\u23aa\u23aa\u23aa\u23aa\u23ac\u23aa\u23aa\u23aa\u23aa\u23aa\u23ad A simple example of the asymptotic regions is shown in the figure below (R3 is shown in pink).\nFor the asymptotic regions of type R, the behavior of Eq. (65) is dominated by all Xj for large enough |Xj|. By Eq. (66), we find that \u03c3 is asymptotic to a constant matrix for each asymptotic\n4Here we suppose that |Xj| are large enough in the asymptotic region and hence Xj > 0 implies Xj +1.\n16/47\nD ow nloaded from https://academ ic.oup.com /ptep/article/2023/4/043B03/7093422 by Indian Institute of Technology Patna user on 18 January 2024\nregion of the type R:\n\u03c3 R \u2223\u2223\u2223\u2223\u2223\u2223\u2223\u2223\u2223\u2223 C(\u00b1)1 \u00b7 \u00b7 \u00b7 C(\u00b1)n 1 C(\u00b1)1 1 \u00b7 \u00b7 \u00b7 C(\u00b1)n n 0 ... ... ...\nC(\u00b1)1 n 1 \u00b7 \u00b7 \u00b7 C(\u00b1)n nn 0\n\u2223\u2223\u2223\u2223\u2223\u2223\u2223\u2223\u2223\u2223 , where C(+)i := ( 1 0 0 1 ) , C(\u2212)i := ( 0 1 \u2212 0 ) .\nThe suffix (\u00b1) in Cj corresponds to the signature of \u03b5j. Therefore, the action densities L\u03c3 and LWZ identically vanish in the type R asymptotic regions.\nOn the other hand, since XK is kept to be finite for the type RK asymptotic regions, we have [21]\n\u03c3 RK \u2223\u2223\u2223\u2223\u2223\u2223\u2223\u2223\u2223\u2223 C(\u00b1)1 \u00b7 \u00b7 \u00b7 \u03c8K \u00b7 \u00b7 \u00b7 C(\u00b1)n 1 C(\u00b1)1 1 \u00b7 \u00b7 \u00b7 \u03c8K K \u00b7 \u00b7 \u00b7 C(\u00b1)n n 0 ... ... ... ... C(\u00b1)1 n 1 \u00b7 \u00b7 \u00b7 \u03c8K nK \u00b7 \u00b7 \u00b7 C(\u00b1)n nn 0 \u2223\u2223\u2223\u2223\u2223\u2223\u2223\u2223\u2223\u2223 .\nThis actually leads to the following one-soliton-type solution [21]:5\n\u03c3 RK \u2223\u2223\u2223\u2223\u2223 \u03c8\u030cK 1\u03c8\u030cK K 0 \u2223\u2223\u2223\u2223\u2223D(k), where \u23a7\u23aa\u23a8\u23aa\u23a9 \u03c8\u030cK := ( aKeLK bKe\u2212LK \u2212cKe\u2212LK dKeLK ) DK : a constant matrix,\n(68)\nand the coefficients aK, bK, cK, dK can be expressed in terms of the spectral parameters as:\naK = n\u220f\nj=1, j =K\n( \u03bb\n(+) K \u2212 \u03bb(\u00b1)j ) , bK = n\u220f j=1, j =K ( \u03bb (\u2212) K \u2212 \u03bb(\u00b1)j ) ,\ncK = n\u220f\nj=1, j =K\n( \u03bb\n(+) K \u2212 \u03bb(\u2213)j ) , dK = n\u220f j=1, j =K ( \u03bb (\u2212) K \u2212 \u03bb(\u2213)j ) . (69)\nIn fact, we will see later that the coefficients aK, bK, cK, dK determine the position shift (known as the phase shift) of the one-soliton solution (68) in each asymptotic region of type RK . Furthermore, these coefficients also determine whether the singularities of n-solitons exist in the action density of the WZW4 model. First of all, we can calculate the asymptotic form of the following \u03bcth component of the quadratic term by using Eq. (68). (The summation is not taken\n5We note that the two operations of taking the limit and taking the derivation do not commute in general; however, in our case, they do commute. This is proved in Appendix B.\n17/47\nD ow nloaded from https://academ ic.oup.com /ptep/article/2023/4/043B03/7093422 by Indian Institute of Technology Patna user on 18 January 2024\nover \u03bc.) The result is Tr [ (\u2202\u03bc\u03c3 )\u03c3\u22121 ]2 := Tr [(\u2202\u03bc\u03c3 )\u03c3\u22121(\u2202\u03bc\u03c3 )\u03c3\u22121] RK 8 \u2223\u2223\u2223 (K )\u03bc \u2223\u2223\u22232 (\u03bb(+)K \u2212 \u03bb(\u2212)K )2\n\u03bbK\u03bcK \u00b7 aKbKcKdK (aKdKeXK + bKcKe\u2212XK )2\n= 8 \u2223\u2223\u2223 (K )\u03bc \u2223\u2223\u22232 (\u03bb(+)K \u2212 \u03bb(\u2212)K )2\n\u03bb (+) K \u03bb (\u2212) K\n\u00b7 1( aKdK bKcK e2XK + bKcK aKdK e\u22122XK + 2 )\n= 8 \u2223\u2223\u2223 (K )\u03bc \u2223\u2223\u22232 (\u03bb(+)K \u2212 \u03bb(\u2212)K )2\n\u03bb (+) K \u03bb (\u2212) K\n\u00b7 1 ei\u03d5K ( eXK+\u03b4K + e\u2212i\u03d5K e\u2212(XK+\u03b4K ) )2 , where \u03b4K := (1/2)log rK, rK := |aKdK/bKcK| and the ratio aKdK/bKcK := rKei\u03d5K . In particular, aKdK/bKcK \u2208 R+ if \u03d5K = 0 and aKdK/bKcK \u2208 R\u2212 if \u03d5K = \u03c0 . This fact implies\nTr [ (\u2202\u03bc\u03c3 )\u03c3\u22121 ]2 RK \u23a7\u23aa\u23aa\u23aa\u23aa\u23aa\u23aa\u23a8\u23aa\u23aa\u23aa\u23aa\u23aa\u23aa\u23a9 2 \u2223\u2223\u2223 (K )\u03bc \u2223\u2223\u22232(\u03bb(+)K \u2212 \u03bb(\u2212)K )2 \u03bb (+) K \u03bb (\u2212) K sech2(XK + \u03b4K ) if aKdK/bKck \u2208 R+ \u22122 \u2223\u2223\u2223 (K )\u03bc \u2223\u2223\u22232(\u03bb(+)K \u2212 \u03bb(\u2212)K )2\n\u03bb (+) K \u03bb (\u2212) K\ncsch2(XK + \u03b4K ) if aKdK/bKck \u2208 R\u2212 (70)\nwhere cschx := 1/sinh x. Apparently, for aKdK/bKck < 0, the singularities exist on the entire 3D hyperplane XK + \u03b4K = 0.\nNow let us find out the condition such that the NL\u03c3M action density is non-singular. For the ultrahyperbolic space U1, the reality condition is \u03bb (\u2212) j = \u03bb (+) j . By Eq. (69), we have\naKdK bKcK = 1 n\u220f j=1, j =K \u2223\u2223\u2223\u2223\u2223\u03bbK \u2212 \u03bb j\u03bbK \u2212 \u03bb j \u2223\u2223\u2223\u2223\u2223 2\u03b5 j on U1. (71)\nComparing this with Eq. (70), we can conclude that, in the case of = +1, the NL\u03c3M action density of the n-soliton is definitely asymptotic to a non-singular one-soliton for the ultrahyperbolic signature. This fact implies that, for all n \u2208 N, the n-soliton solution (35) gives a class of non-singular NL\u03c3M action densities for the ultrahyperbolic signature.\nSimilarly, the reality condition of the Euclidean space E : \u03bb(\u2212)j = \u22121/\u03bb (+) j implies\naKdK bKcK\n= (\u22121) n\u22121 n\u220f j=1, j =K \u2223\u2223\u2223\u2223\u2223 \u03bbK \u2212 \u03bb j\u03bbK\u03bb j + 1 \u2223\u2223\u2223\u2223\u2223 2\u03b5 j on E. (72)\nThe ratio (72) is positive in the following two cases: (1) n is odd and = +1 or (2) n is even and = \u22121. Then the NL\u03c3M action densities are non-singular. On the other hand, the ratio (72) is negative in the following two cases: (3) n is even and = +16 or (4) n is odd and = \u22121.7 Then the NL\u03c3M action densities are singular. It is quite interesting that, in the Euclidean signature, singular and non-singular solutions are generated alternately by the Darboux transformations with respect to initial solutions \u03c8 j for = \u00b11.\n6Case (3) for n = 2 corresponds to the singular two-soliton solution on E (cf. Table 1). 7Case (4) for n = 1 corresponds to the singular solution in footnote 5.\n18/47\nD ow nloaded from https://academ ic.oup.com /ptep/article/2023/4/043B03/7093422 by Indian Institute of Technology Patna user on 18 January 2024\nIn summary, for all n \u2208 N, non-singular NL\u03c3M action densities of the n-soliton can be constructed by taking = +1 for all n \u2208 N (cf. Eq. (71)) on the ultrahyperbolic space U1, and by taking = +1 for all odd n and = \u22121 for all even n (cf. Eq. (72) and cases (1) and (2)) on the Euclidean space E. They would share the same asymptotic form in RK on each real space:\nL\u03c3 = \u2212 116\u03c0 Tr [ (\u2202\u03bc\u03c3 )\u03c3\u22121(\u2202\u03bc\u03c3 )\u03c3\u22121 ] RK \u2212 1 8\u03c0 dKK sech 2 (XK + \u03b4K ) , (73)\nwhere dKK is defined in Table 1 (cf. U1 and E) and the phase shift factor is\n\u03b4K = 12 log ( aKdK bKcK ) = \u23a7\u23aa\u23aa\u23aa\u23aa\u23aa\u23a8\u23aa\u23aa\u23aa\u23aa\u23aa\u23a9 n\u2211 j=1, j =K \u03b5 j log \u2223\u2223\u2223\u2223\u2223\u03bbK \u2212 \u03bb j\u03bbK \u2212 \u03bb j \u2223\u2223\u2223\u2223\u2223 on U1 n\u2211 j=1, j =K \u03b5 j log \u2223\u2223\u2223\u2223\u2223 \u03bbK \u2212 \u03bb j\u03bbK\u03bb j + 1 \u2223\u2223\u2223\u2223\u2223 on E . (74)\nSince the result of Eq. (73) is valid for arbitrary K in {1, 2,\u2026, n}, we can regard the behavior of non-singular n-soliton as a \u201cnon-linear superposition\u201d of n non-singular and mutually nonparallel one-solitons on each real space in which each one-soliton in the asymptotic region RK keeps its form invariant but is shifted by \u03b4K, called the phase shift factor, which results from a non-linear effect.\nIn conclusion, in the asymptotic region, the n-soliton solution possesses n isolated and localized lumps of the NL\u03c3M action density, and we can interpret this as n intersecting soliton walls. The phase shift factors are also obtained explicitly. The scattering process of the n-soliton solution is quite similar to that of the KP solitons [3,25,26]. On the other hand, the Wess\u2013Zumino action density identically vanishes in the asymptotic region because in the asymptotic region R, the action density identically vanishes, and in the asymptotic region RK , the n-soliton solution is reduced to the one-soliton (68) whose Wess\u2013Zumino action density is identically zero as proved in Sect. 4.1.\n6. Reduction to (1 + 2) dimensions So far, we have discussed the action density of the WZW4 model for n-soliton solutions and have found that it is localized on n non-parallel codimension-one hyperplanes in four dimensions. However, to understand better the physical meaning of our soliton solutions, it would be a good idea to calculate the energy density of the soliton solutions and compare it with the action density. For this purpose, we assume translation invariance in the x2 direction.\nThe WZW4 model Lagrangian is reduced to the following one (cf. Eqs. (17) and (27)):\nLtot = \u2212 116\u03c0 ( Tr(\u03b8t )2 \u2212 Tr(\u03b8x)2 \u2212 Tr(\u03b8y)2 + 2Tr ( \u03b8t\u03b8x\u03b8y ) y ) , (75)\nwhere we reset (t, x, y) := (x1, x3, x4) and \u03b8\u03bc := (\u2202\u03bc\u03c3 )\u03c3\u22121 (\u03bc = t, x, y). The equation of motion is the Ward chiral model [27] or the space-time monopole equation [28,29] in (1 + 2) dimensions in the Yang form. The n-soliton solution of Eq. (75) is obtained by imposing the condition \u03b1j = \u03bbj\u03b2 j (cf. Eq. (37)) on the powers Lj of the n-soliton solution (35). Then, the powers of the n-soliton solution is actually reduced to Lj = (\u03b2 j/ \u221a 2) [ (\u03bb2j + 1)t + (\u03bb2j \u2212 1)x + 2\u03bb jy ] in the (1+2)D space-time. Let us consider three angular coordinates \u03c6i(x) (i = 1, 2, 3) that parametrize SU(2) \u2248 S3, where \u03c3 (x) belongs. Then the Hamiltonian density can be obtained by the Legendre transfor-\n19/47\nD ow nloaded from https://academ ic.oup.com /ptep/article/2023/4/043B03/7093422 by Indian Institute of Technology Patna user on 18 January 2024\nmation of the Lagrangian:\nHtot = 3\u2211\ni=1\n\u2202Ltot \u2202 (\u2202t\u03c6i) \u2202t\u03c6i \u2212 Ltot = \u2212 116\u03c0\n( Tr(\u03b8t )2 + Tr(\u03b8x)2 + Tr(\u03b8y)2 ) .\nThis Hamiltonian physically makes sense because it is positive definite due to the fact that \u03b8\u03bc is an anti-Hermitian matrix. This is a conserved energy density by definition. Note that the contribution of the Wess\u2013Zumino term to Htot vanishes identically: HWZ = 0, or equivalently Htot = H\u03c3 .\nLet us calculate the energy density of the reduced soliton solution from the Hamiltonian density Htot. For the one-soliton solution, the Hamiltonian Htot is:\nHtot = \u2212 18\u03c0 d11sech 2X1, d11 := (|\u03bb1| 2 + 1)2(\u03bb1 \u2212 \u03bb1)2 |\u03bb1|2 |\u03b21| 2. (76)\nThis is in the same form as the reduced NL\u03c3M action density L\u03c3 up to an overall coefficient (cf. Eq. (47)). Therefore, the peaks of Htot and L\u03c3 are localized on the same 2D hyperplane X = 0 in the (1 + 2)D space-time. In this sense, L\u03c3 can also be interpreted as an analogue of the energy density in physical reality.\nFor the two-soliton solution, the Hamiltonian density for the two-soliton solution is calculated by using the result of Appendix D.3; we have\nHtot = \u2212\n\u23a7\u23aa\u23aa\u23aa\u23aa\u23aa\u23aa\u23aa\u23a8\u23aa\u23aa\u23aa\u23aa\u23aa\u23aa\u23aa\u23a9 ab [ d11 cosh 2 X2 + d22 cosh2 X1 ] +ac [ d12 cosh 2 ( X1 + X2 \u2212 i 12 2 ) + d21 cosh2 ( X1 + X2 + i 12 2 )] \u2212bc [ e12 sinh 2 (\nX1 \u2212 X2 \u2212 i 12 2\n) + e12 sinh2 ( X1 \u2212 X2 + i 12\n2\n)] \u23ab\u23aa\u23aa\u23aa\u23aa\u23aa\u23aa\u23aa\u23ac\u23aa\u23aa\u23aa\u23aa\u23aa\u23aa\u23aa\u23ad 2\u03c0 [a cosh (X1 + X2) + b cosh (X1 \u2212 X2) + c cos 12]2 , (77)\nwhere a, b, c are the same coefficients defined in Table 1 and\nd jk := (\u03bb j\u03bbk + 1) 2(\u03bb j \u2212 \u03bbk)2\n\u03bb j\u03bbk \u03b2 j\u03b2k, e jk := (\u03bb j\u03bbk + 1)2(\u03bb j \u2212 \u03bbk)2 \u03bb j\u03bbk \u03b2 j\u03b2k. (78)\nAs for the NL\u03c3M term, the Hamiltonian density Htot for the two-soliton is also in the same form as the reduced NL\u03c3M action density L\u03c3 up to the differences of the coefficients dij and eij (cf. Eq. (53)). Therefore, the two peaks of Htot are localized on the same hyperplanes X1 \u00b1 \u03b41 = 0 and X2 \u00b1 \u03b42 = 0 as those of L\u03c3 (cf. Eq. (57)). The phase shift factors are also exactly the same. There is no singularity either. This result implies that there is no essential difference between Htot and L\u03c3 for describing the solitonic properties.\nThe peaks of the energy density of the two-soliton solutions are shown in the figure below.\n20/47\nD ow nloaded from https://academ ic.oup.com /ptep/article/2023/4/043B03/7093422 by Indian Institute of Technology Patna user on 18 January 2024\nOn the other hand, as for the Wess\u2013Zumino term, there is a mismatch that the Hamiltonian density HWZ is identical to zero, while we cannot confirm whether the action density LWZ is. The physical meaning of this mismatch should be clarified in future work.\n7. Conclusion and discussion In this paper, we calculated the action density of the WZW4 model for the classical soliton solutions. We found that, for the one-soliton solutions, the NL\u03c3M action density is localized on a 3D hyperplane and the Wess\u2013Zumino action density identically vanishes. This suggests the existence of a three-brane in the open N = 2 string theory. For the two-soliton solutions, the NL\u03c3M action density has a beautiful compact form that represents two intersecting one-solitons. The Wess\u2013Zumino action density does not vanish in the interaction region but does vanish in the asymptotic region. For the n-soliton solutions, we clarified the asymptotic behavior and found that the NL\u03c3M action density describes \u201cnon-linear superposition\u201d of n intersecting one-solitons and the Wess\u2013Zumino action density asymptotically vanishes. The non-linear interaction gives rise to phase shifts that were evaluated explicitly. We also calculated the Hamiltonian (energy) density of the one- and two-soliton solutions of the reduced WZW model in (1 + 2) dimensions. We found that the energy density of the Wess\u2013Zumino term identically vanishes, and the energy density of the NL\u03c3M term has the same profile as the action density for our soliton solutions. The peaks of the energy densities perfectly coincide with those of the action density, including the phase shift factor.\nWe also discussed whether singularities exist for the n-soliton solutions. For the one- and twosoliton solutions, we proved that there is no singularity. For the n-soliton solutions (n \u2265 3), it is unsolved; however, we can argue as follows. The existence of singularities in the solution is equivalent to the existence of zeros in the data , which is a polynomial of eXj and ei j . Because Xj and j are linear functions of the real coordinates, possible singularities would lie on the intersection of Xj = Cj and/or j = Dj where Cj and Dj are constants. These possibilities are mostly forbidden because there is no singularity of the action density of the n-soliton solutions in the asymptotic region where the intersection still exists. The intersection of just four hyperplanes defined by Xj = Cj or j = Dj (j = 1, 2, 3, 4) gives rise to an isolated singularity. This possibility might arise when the parameters in the solutions are appropriately tuned, which should be clarified in the future.\nThe next step is to clarify the roles and properties of the soliton solutions in the open N = 2 string theory. At least we can see that they are not D-branes because the number of solitons is not related to the rank of the gauge group. It is worth studying the topological charge and mass of the solitons, and explicit calculation of infinite conserved densities [8, 30\u201332] for the n-soliton solutions. It is also interesting to construct resonance solutions of the solitons that represent the three-brane reconnections or, in other words, annihilation and creation of the three-branes. Then a classification of the soliton solutions could be possible, like the positive Grassmannian description of the KP solitons by Kodama and Williams [33]. The moduli space of the n-soliton solutions could be described in a geometrical framework. Extension of the model to non-commutative spaces would allow the presence of background B-fields in the open N = 2 string theory [34,35,36,37]. The isolated singularities mentioned above might be resolved and new physical objects appear on the non-commutative spaces such as non-commutative U(1) instantons [38]. Sen\u2019s conjecture on the tachyon condensation (for a review see Ref. [39]) could\n21/47\nD ow nloaded from https://academ ic.oup.com /ptep/article/2023/4/043B03/7093422 by Indian Institute of Technology Patna user on 18 January 2024\nbe confirmed by the solution-generating technique [40] in the context of the open N = 2 string theory.\nFurthermore, the WZW4 model can be realized in the context of the twistor string theory [41]. Recently, Bittleston and Skinner showed that a meromorphic Chern\u2013Simons theory on the twistor space in six dimensions has a double fibration structure that gives rise to the WZW4 model by solving along fibers in one direction and the 4D Chern\u2013 Simons theory by symmetry reduction in another direction [42]. These models are connected to each other and have a close relationship to integrable systems [43]. The KP equation has not yet obtained a symmetry reduction of the anti-self-dual Yang\u2013Mills equation so far; however, this 6D Chern\u2013Simons theory might give a \u201cunified theory\u201d of integrable systems including both the Sato theory [44] of the KP equation and the twistor descriptions of classical integrable systems. This might give a stringy viewpoint to various aspects of integrability and duality. The relation to mirror symmetry is also exciting [45].\nAcknowledgements M.H. thanks the string group members at Nagoya University for useful comments at the String Journal Club on July 21, 2022. M.H. is also grateful to the YITP at Kyoto University, where he had fruitful discussions at the conference on Strings and Fields 2022 (YITP-W-22-09) on August 19, 2022. The work of H.K. and S.C.H. is supported in part by a Grant-in-Aid for Scientific Research (#18K03274). The work of S.C.H. is supported by the Iwanami Fujukai Foundation.\nFunding Open Access funding: SCOAP3.\nA. Brief review of quasideterminants In this subsection, we excerpt some necessary pre-knowledge of quasideterminants mentioned in Sect. 2 of the previous paper [21]. It is a brief review of the work of Gelfand and Retakh [46,47] (see also, e.g., Refs. [17, 48]).\nThe quasideterminant is defined for an n \u00d7 n matrix X where matrix elements belong to a non-commutative ring. The quasideterminant is a non-commutative generalization of the matrix determinant in this sense; however, it rather has a direct relation to the inverse matrix of X.\nLet X = (xij) be an n \u00d7 n invertible matrix over a non-commutative ring and Y = (yij) be the inverse matrix of X: XY = YX = 1. The existence of Y is assumed. Then the (i, j)th quasideterminant of X is defined as the inverse of an element of Y = X\u22121: |X |i j := y\u22121ji . (A1) This has a convenient expression as follows:\n|X |i j = \u2223\u2223\u2223\u2223\u2223\u2223\u2223\u2223\u2223\u2223\u2223\u2223\u2223 x11 \u00b7 \u00b7 \u00b7 x1 j \u00b7 \u00b7 \u00b7 x1n ... ... ... xi1 \u00b7 \u00b7 \u00b7 xi j \u00b7 \u00b7 \u00b7 xin ... ... ...\nxn1 \u00b7 \u00b7 \u00b7 xn j \u00b7 \u00b7 \u00b7 xnn\n\u2223\u2223\u2223\u2223\u2223\u2223\u2223\u2223\u2223\u2223\u2223\u2223\u2223 . (A2)\nWhen the matrix elements belong to a commutative ring, e.g., C, the quasideterminant can be represented as a ratio of ordinary determinants by virtue of the Laplace formula on inverse\n22/47\nD ow nloaded from https://academ ic.oup.com /ptep/article/2023/4/043B03/7093422 by Indian Institute of Technology Patna user on 18 January 2024\nmatrices:\n|X |i j = y\u22121ji = (\u22121)i+ j det X\ndet X i j , (A3)\nwhere Xij is a matrix obtained from X by deleting the ith row and jth column. In order to find another representation of the quasideterminant, let us consider the inverse matrix formula for the 2 \u00d7 2 block matrix divided as follows:\nX \u22121 = (\nA B C d\n)\u22121 = ( A\u22121 + A\u22121Bs\u22121CA\u22121 \u2212A\u22121Bs\u22121 \u2212s\u22121CA\u22121 s\u22121 ) ,\nwhere A is a square matrix, d is a single element, and s := d \u2212 CA\u22121B is called the Schur complement. The quantity s\u22121 is just the (n, n)-element of X\u22121 and hence the quasideterminant |X|nn is s. If we decompose X into a 2 \u00d7 2 block matrix where xij corresponds to the single element d, the (i, j)th quasideterminant can be expressed in the form of the Schur complement:\n|X |i j = xi j \u2212 \u2211\nk( =i),l ( = j) xik(X i j )\u22121kl xl j, = xi j \u2212 \u2211 k( =i),l ( = j) xik|X i j |\u22121lk xl j . (A4)\nBy using this, explicit representations of the quasideterminants can be obtained iteratively. We note that the quasideterminant is well defined in the case that each matrix element xij in Eq. (A2) take values in GL(N, C). (Then, X is an nN \u00d7 nN matrix.) The following example of the N = 2 case can be expressed finally by the ratios of determinants due to Eqs. (A4) and (A3): \u2223\u2223\u2223\u2223\u2223\u2223\u2223\u2223 M C1 C2 R1 R2 a b c d \u2223\u2223\u2223\u2223\u2223\u2223\u2223\u2223 = ( a b c d ) \u2212 ( R1 R2 ) M\u22121 ( C1 C2 )\n= \u239b\u239c\u239c\u239c\u239c\u239d \u2223\u2223\u2223\u2223\u2223M C1R1 a \u2223\u2223\u2223\u2223\u2223 \u2223\u2223\u2223\u2223\u2223M C2R1 b \u2223\u2223\u2223\u2223\u2223\u2223\u2223\u2223\u2223\u2223M C1R2 c \u2223\u2223\u2223\u2223\u2223 \u2223\u2223\u2223\u2223\u2223M C2R2 d \u2223\u2223\u2223\u2223\u2223 \u239e\u239f\u239f\u239f\u239f\u23a0 = 1|M| \u239b\u239c\u239c\u239c\u239c\u239d \u2223\u2223\u2223\u2223\u2223M C1R1 a \u2223\u2223\u2223\u2223\u2223 \u2223\u2223\u2223\u2223\u2223M C2R1 b \u2223\u2223\u2223\u2223\u2223\u2223\u2223\u2223\u2223\u2223M C1R2 c \u2223\u2223\u2223\u2223\u2223 \u2223\u2223\u2223\u2223\u2223M C2R2 d \u2223\u2223\u2223\u2223\u2223 \u239e\u239f\u239f\u239f\u239f\u23a0 . (A5) The final form corresponds to the parametrization (21) of \u03c3 for the soliton solution (33):\n= |M|, \u2212 11 = \u2223\u2223\u2223\u2223\u2223M C1R1 a \u2223\u2223\u2223\u2223\u2223, \u2212 12 = \u2223\u2223\u2223\u2223\u2223M C2R1 b \u2223\u2223\u2223\u2223\u2223, \u2212 21 = \u2223\u2223\u2223\u2223\u2223M C1R2 c \u2223\u2223\u2223\u2223\u2223, \u2212 22 = \u2223\u2223\u2223\u2223\u2223M C2R2 d \u2223\u2223\u2223\u2223\u2223, (A6)\nwhich leads to the soliton data (40). Here we summarize some properties and identities of the quasideterminant, which are rele-\nvant to discussions in this paper.\nProposition A.1 [17, 46\u201348] Let A = (aij) be a square matrix of order n in (1), while in (2) and (3) appropriate partitions are made so that all matrices in quasideterminants are square.\n(1) The common multiplication of rows and columns For any invertible elements j (j = 1,\u2026, n), we have\n23/47\nD ow nloaded from https://academ ic.oup.com /ptep/article/2023/4/043B03/7093422 by Indian Institute of Technology Patna user on 18 January 2024\n\u2223\u2223\u2223\u2223\u2223\u2223\u2223\u2223\u2223\u2223\u2223\u2223\u2223 a1,1 1 \u00b7 \u00b7 \u00b7 a1, j j \u00b7 \u00b7 \u00b7 a1,n n ... ... ... ai,1 1 \u00b7 \u00b7 \u00b7 ai, j j \u00b7 \u00b7 \u00b7 ai,n n ... ... ...\nan,1 1 \u00b7 \u00b7 \u00b7 an, j j \u00b7 \u00b7 \u00b7 an,n n\n\u2223\u2223\u2223\u2223\u2223\u2223\u2223\u2223\u2223\u2223\u2223\u2223\u2223 = \u2223\u2223\u2223\u2223\u2223\u2223\u2223\u2223\u2223\u2223\u2223\u2223\u2223 a1,1 \u00b7 \u00b7 \u00b7 a1, j \u00b7 \u00b7 \u00b7 a1,n ... ... ... ai,1 \u00b7 \u00b7 \u00b7 ai, j \u00b7 \u00b7 \u00b7 ai,n ... ... ...\nan,1 \u00b7 \u00b7 \u00b7 an, j \u00b7 \u00b7 \u00b7 an,n\n\u2223\u2223\u2223\u2223\u2223\u2223\u2223\u2223\u2223\u2223\u2223\u2223\u2223 j, (A7)\n\u2223\u2223\u2223\u2223\u2223\u2223\u2223\u2223\u2223\u2223\u2223\u2223\u2223 1a1,1 \u00b7 \u00b7 \u00b7 1a1, j \u00b7 \u00b7 \u00b7 1a1,n ... ... ... iai,1 \u00b7 \u00b7 \u00b7 iai, j \u00b7 \u00b7 \u00b7 iai,n ... ... ...\nnan,1 \u00b7 \u00b7 \u00b7 nan, j \u00b7 \u00b7 \u00b7 nan,n\n\u2223\u2223\u2223\u2223\u2223\u2223\u2223\u2223\u2223\u2223\u2223\u2223\u2223 = i \u2223\u2223\u2223\u2223\u2223\u2223\u2223\u2223\u2223\u2223\u2223\u2223\u2223 a1,1 \u00b7 \u00b7 \u00b7 a1, j \u00b7 \u00b7 \u00b7 a1,n ... ... ... ai,1 \u00b7 \u00b7 \u00b7 ai, j \u00b7 \u00b7 \u00b7 ai,n ... ... ...\nan,1 \u00b7 \u00b7 \u00b7 an, j \u00b7 \u00b7 \u00b7 an,n\n\u2223\u2223\u2223\u2223\u2223\u2223\u2223\u2223\u2223\u2223\u2223\u2223\u2223 . (A8)\n(2) Non-commutative Jacobi identity [49]\u2223\u2223\u2223\u2223\u2223\u2223\u2223 a R b P M Q c S d \u2223\u2223\u2223\u2223\u2223\u2223\u2223 = \u2223\u2223\u2223\u2223\u2223M QS d \u2223\u2223\u2223\u2223\u2223 \u2212 \u2223\u2223\u2223\u2223\u2223 P Mc S \u2223\u2223\u2223\u2223\u2223 \u2223\u2223\u2223\u2223\u2223 a RP M \u2223\u2223\u2223\u2223\u2223 \u22121\u2223\u2223\u2223\u2223\u2223R bM Q \u2223\u2223\u2223\u2223\u2223. (A9) (3) Homological relations [46, 47, 49]\u2223\u2223\u2223\u2223\u2223\u2223\u2223 a R b P M Q c S d \u2223\u2223\u2223\u2223\u2223\u2223\u2223 = \u2223\u2223\u2223\u2223\u2223\u2223\u2223 a R b P M Q c S d \u2223\u2223\u2223\u2223\u2223\u2223\u2223 \u2223\u2223\u2223\u2223\u2223\u2223\u2223 a R b P M Q 0 0 1 \u2223\u2223\u2223\u2223\u2223\u2223\u2223, \u2223\u2223\u2223\u2223\u2223\u2223\u2223 a R b P M Q c S d\n\u2223\u2223\u2223\u2223\u2223\u2223\u2223 =\n\u2223\u2223\u2223\u2223\u2223\u2223\u2223 a R 0 P M 0 c S 1 \u2223\u2223\u2223\u2223\u2223\u2223\u2223 \u2223\u2223\u2223\u2223\u2223\u2223\u2223 a R b P M Q c S d \u2223\u2223\u2223\u2223\u2223\u2223\u2223. (A10) B. Proof of statement in footnote 8\nProposition B.1 Let \u03c3 be the n-soliton solution defined by\n\u03c3 = \u2223\u2223\u2223\u2223\u2223\u2223\u2223\u2223\u2223\u2223\u2223\u2223 \u03c81 \u03c82 \u00b7 \u00b7 \u00b7 \u03c8n 1 \u03c81 1 \u03c82 2 \u00b7 \u00b7 \u00b7 \u03c8n n 0 \u03c81 2 1 \u03c82 2 2 \u00b7 \u00b7 \u00b7 \u03c8n 2n 0 ... ... . . . ... ... \u03c81 n 1 \u03c82 n 2 \u00b7 \u00b7 \u00b7 \u03c8n nn 0 \u2223\u2223\u2223\u2223\u2223\u2223\u2223\u2223\u2223\u2223\u2223\u2223 , \u03c8 j = ( eL j e\u2212L j \u2212e\u2212L j eL j ) , Lj = ( j)\u03bc x\u03bc j := ( \u03bb j 0 0 \u03bc j ) , (B1)\nand RK be the asymptotic region defined by the asymptotic limit{ ReLK is fixed\nReLj, j =K \u2212\u2192 \u00b1\u221e . (B2)\nThen the operation of the partial derivative \u2202\u03bc commutes with the operation of the asymptotic limit (B2) for \u03c3 .\nProof. Without loss of generality, we consider the K = 1 case due to the fact that the quasideterminant |\u03c3 |ij does not depend on permutations of rows and columns in the matrix \u03c3 [46,47].\n24/47\nD ow nloaded from https://academ ic.oup.com /ptep/article/2023/4/043B03/7093422 by Indian Institute of Technology Patna user on 18 January 2024\nFor j = 1, \u03c8 j mj can be decomposed into\n\u03c8 j m j = \u23a7\u23aa\u23aa\u23aa\u23aa\u23a8\u23aa\u23aa\u23aa\u23aa\u23a9 ( 1 e\u22122L j \u2212e\u22122L j 1 ) mj ( eL j 0 0 eLj ) =: f (+)j mj E (+)j(\n\u2212e2L j 1 1 e2L j ) mj ( \u2212e\u2212L j 0 0 e\u2212L j ) =: f (\u2212)j mj E (\u2212)j , (B3)\nand\nf (\u00b1)j \u2212\u2192 C(\u00b1)j as ReLj \u2212\u2192 \u00b1\u221e, where \u23a7\u23aa\u23aa\u23aa\u23aa\u23a8\u23aa\u23aa\u23aa\u23aa\u23a9 C(+)j := ( 1 0 0 1 ) C(\u2212)j := (\n0 1 1 0\n) . (B4)\nBy Eqs. (B3) and (A7), the right common factors E (\u00b1)j of each column of \u03c3 can be omitted completely, and hence\n\u03c3 = \u2223\u2223\u2223\u2223\u2223\u2223\u2223\u2223\u2223\u2223\u2223\u2223 \u03c81 f (\u00b1) 2 \u00b7 \u00b7 \u00b7 f (\u00b1)n 1 \u03c81 1 f (\u00b1) 2 2 \u00b7 \u00b7 \u00b7 f (\u00b1)n n 0 \u03c81 2 1 f (\u00b1) 2 2 2 \u00b7 \u00b7 \u00b7 f (\u00b1)n 2n 0 ... ... . . . ... ... \u03c81 n 1 f (\u00b1) 2 n 2 \u00b7 \u00b7 \u00b7 f (\u00b1)n nn 0 \u2223\u2223\u2223\u2223\u2223\u2223\u2223\u2223\u2223\u2223\u2223\u2223 , (B5)\nwhich is asymptotic to\n\u03c3\u0303 := \u2223\u2223\u2223\u2223\u2223\u2223\u2223\u2223\u2223\u2223\u2223\u2223 \u03c81 C (\u00b1) 2 \u00b7 \u00b7 \u00b7 C(\u00b1)n 1 \u03c81 1 C (\u00b1) 2 2 \u00b7 \u00b7 \u00b7 C(\u00b1)n n 0 \u03c81 2 1 C (\u00b1) 2 2 2 \u00b7 \u00b7 \u00b7 C(\u00b1)n 2n 0 ... ... . . . ... ... \u03c81 n 1 C (\u00b1) 2 n 2 \u00b7 \u00b7 \u00b7 C(\u00b1)n nn 0 \u2223\u2223\u2223\u2223\u2223\u2223\u2223\u2223\u2223\u2223\u2223\u2223 . (B6)\nBy the fact that\nC(\u00b1)j m j = (\u00b1)mj C(\u00b1)j , \u23a7\u23aa\u23aa\u23aa\u23aa\u23a8\u23aa\u23aa\u23aa\u23aa\u23a9 (+) j := ( \u03bb j 0 0 \u03bc j ) (\u2212) j := ( \u03bc j 0 0 \u03bb j ) , (B7)\nand Eq. (A7), the right common factors C(\u00b1)j of each column of \u03c3\u0303 can be omitted completely, and hence\n\u03c3\u0303 = \u2223\u2223\u2223\u2223\u2223\u2223\u2223\u2223\u2223\u2223\u2223\u2223 \u03c81 1 \u00b7 \u00b7 \u00b7 1 1 \u03c81 1 (\u00b1) 2 \u00b7 \u00b7 \u00b7 (\u00b1)n 0 \u03c81 2 1 (\u00b1)2 2 \u00b7 \u00b7 \u00b7 (\u00b1)2n 0 ... ... . . . ... ... \u03c81 n 1 (\u00b1)n 2 \u00b7 \u00b7 \u00b7 (\u00b1)nn 0 \u2223\u2223\u2223\u2223\u2223\u2223\u2223\u2223\u2223\u2223\u2223\u2223 , (B8)\n25/47\nD ow nloaded from https://academ ic.oup.com /ptep/article/2023/4/043B03/7093422 by Indian Institute of Technology Patna user on 18 January 2024\nwhich is called the asymptotic form of the n-soliton solution \u03c3 . By the derivative formula [49] of the quasideterminant\n\u2202\u03bc \u2223\u2223\u2223\u2223\u2223A BC d \u2223\u2223\u2223\u2223\u2223 = \u2223\u2223\u2223\u2223\u2223A \u2202\u03bcBC \u2202\u03bcd \u2223\u2223\u2223\u2223\u2223 + n\u2211 j=1 \u2223\u2223\u2223\u2223\u2223A \u2202\u03bcAjC \u2202\u03bcCj \u2223\u2223\u2223\u2223\u2223 \u2223\u2223\u2223\u2223\u2223 A BE j 0 \u2223\u2223\u2223\u2223\u2223 , (Aj : jth column of A, E j : jth row of identity matrix I ) (B9)\nwe have\n\u2202\u03bc\u03c3\u0303 =\n\u2223\u2223\u2223\u2223\u2223\u2223\u2223\u2223\u2223\u2223\u2223\u2223 \u03c81 1 \u00b7 \u00b7 \u00b7 1 \u2202\u03bc\u03c81 \u03c81 1 (\u00b1) 2 \u00b7 \u00b7 \u00b7 (\u00b1)n (\u2202\u03bc\u03c81) 1 \u03c81 2 1 (\u00b1)2 2 \u00b7 \u00b7 \u00b7 (\u00b1)2n (\u2202\u03bc\u03c81) 21 ... ... . . . ... ... \u03c81 n 1 (\u00b1)n 2 \u00b7 \u00b7 \u00b7 (\u00b1)nn (\u2202\u03bc\u03c81) n1 \u2223\u2223\u2223\u2223\u2223\u2223\u2223\u2223\u2223\u2223\u2223\u2223 \u2223\u2223\u2223\u2223\u2223\u2223\u2223\u2223\u2223\u2223\u2223\u2223 \u03c81 1 \u00b7 \u00b7 \u00b7 1 1 \u03c81 1 (\u00b1) 2 \u00b7 \u00b7 \u00b7 (\u00b1)n 0 ... ... . . . ... ... \u03c81 n\u22121 1 (\u00b1)n\u22121 2 \u00b7 \u00b7 \u00b7 (\u00b1)n\u22121n 0 1 0 \u00b7 \u00b7 \u00b7 0 0 \u2223\u2223\u2223\u2223\u2223\u2223\u2223\u2223\u2223\u2223\u2223\u2223\n+ n\u2211\nj=2 \u2223\u2223\u2223\u2223\u2223\u2223\u2223\u2223\u2223\u2223\u2223\u2223 \u03c81 1 \u00b7 \u00b7 \u00b7 1 0 \u03c81 1 (\u00b1) 2 \u00b7 \u00b7 \u00b7 (\u00b1)n 0 \u03c81 2 1 (\u00b1)2 2 \u00b7 \u00b7 \u00b7 (\u00b1)2n 0 ... ... . . . ... ... \u03c81 n 1 (\u00b1)n 2 \u00b7 \u00b7 \u00b7 (\u00b1)nn 0 \u2223\u2223\u2223\u2223\u2223\u2223\u2223\u2223\u2223\u2223\u2223\u2223\ufe38 \ufe37\ufe37 \ufe38 \u2223\u2223\u2223\u2223\u2223\u2223\u2223\u2223\u2223\u2223\u2223\u2223 \u03c81 \u00b7 \u00b7 \u00b7 1 \u00b7 \u00b7 \u00b7 1 \u03c81 1 \u00b7 \u00b7 \u00b7 (\u00b1)j \u00b7 \u00b7 \u00b7 0 ... . . . ... . . . ... \u03c81 n\u22121 1 \u00b7 \u00b7 \u00b7 (\u00b1)n\u22121j \u00b7 \u00b7 \u00b7 0 0 \u00b7 \u00b7 \u00b7 1 \u00b7 \u00b7 \u00b7 0 \u2223\u2223\u2223\u2223\u2223\u2223\u2223\u2223\u2223\u2223\u2223\u2223 = 0 (\u2202\u03bc (\u00b1)mj = 0 in the last column). (B10)\nNow we can conclude that\n\u2202\u03bc\u03c3\u0303\n= \u2223\u2223\u2223\u2223\u2223\u2223\u2223\u2223\u2223\u2223\u2223\u2223 \u03c81 1 \u00b7 \u00b7 \u00b7 1 \u2202\u03bc\u03c81 \u03c81 1 (\u00b1) 2 \u00b7 \u00b7 \u00b7 (\u00b1)n (\u2202\u03bc\u03c81) 1 \u03c81 2 1 (\u00b1)2 2 \u00b7 \u00b7 \u00b7 (\u00b1)2n (\u2202\u03bc\u03c81) 21 ... ... . . . ... ... \u03c81 n 1 (\u00b1)n 2 \u00b7 \u00b7 \u00b7 (\u00b1)nn (\u2202\u03bc\u03c81) n1 \u2223\u2223\u2223\u2223\u2223\u2223\u2223\u2223\u2223\u2223\u2223\u2223 \u2223\u2223\u2223\u2223\u2223\u2223\u2223\u2223\u2223\u2223\u2223\u2223 \u03c81 1 \u00b7 \u00b7 \u00b7 1 1 \u03c81 1 (\u00b1) 2 \u00b7 \u00b7 \u00b7 (\u00b1)n 0 ... ... . . . ... ... \u03c81 n\u22121 1 (\u00b1)n\u22121 2 \u00b7 \u00b7 \u00b7 (\u00b1)n\u22121n 0 1 0 \u00b7 \u00b7 \u00b7 0 0 \u2223\u2223\u2223\u2223\u2223\u2223\u2223\u2223\u2223\u2223\u2223\u2223 . (B11)\nOn the other hand, by the derivative formula of the quasideterminant on \u03c3 we have\n\u2202\u03bc\u03c3\n= n\u2211\nj=1 \u2223\u2223\u2223\u2223\u2223\u2223\u2223\u2223\u2223\u2223\u2223\u2223 \u03c81 \u03c82 \u00b7 \u00b7 \u00b7 \u03c8n \u2202\u03bc\u03c8 j \u03c81 1 \u03c82 2 \u00b7 \u00b7 \u00b7 \u03c8n n (\u2202\u03bc\u03c8 j ) j \u03c81 2 1 \u03c82 2 2 \u00b7 \u00b7 \u00b7 \u03c8n 2n (\u2202\u03bc\u03c8 j ) 2j ... ... . . . ... ... \u03c81 n 1 \u03c82 n 2 \u00b7 \u00b7 \u00b7 \u03c8n nn (\u2202\u03bc\u03c8 j ) nj \u2223\u2223\u2223\u2223\u2223\u2223\u2223\u2223\u2223\u2223\u2223\u2223 \u2223\u2223\u2223\u2223\u2223\u2223\u2223\u2223\u2223\u2223\u2223\u2223 \u03c81 \u00b7 \u00b7 \u00b7 \u03c8 j \u00b7 \u00b7 \u00b7 1 \u03c81 1 \u00b7 \u00b7 \u00b7 \u03c8 j j \u00b7 \u00b7 \u00b7 0 ... . . . ... . . . ... \u03c81 n\u22121 1 \u00b7 \u00b7 \u00b7 \u03c8 j n\u22121j \u00b7 \u00b7 \u00b7 0 0 \u00b7 \u00b7 \u00b7 1 \u00b7 \u00b7 \u00b7 0 \u2223\u2223\u2223\u2223\u2223\u2223\u2223\u2223\u2223\u2223\u2223\u2223 . (B12)\nBy a similar argument to Eqs. (B3), (B4), we have\n(\u2202\u03bc\u03c8 j ) mj = \u23a7\u23aa\u23aa\u23aa\u23aa\u23a8\u23aa\u23aa\u23aa\u23aa\u23a9 ( 1 \u2212e\u22122L j e\u22122L j 1 ) mj ( ( j) \u03bc eL j 0 0 ( j) \u03bc e L j ) =: f\u0303 (+)j mj E\u0303 (+)j(\ne2L j 1 1 \u2212e2L j\n) mj ( ( j) \u03bc e\u2212L j 0\n0 \u2212 ( j)\u03bc e\u2212L j\n) =: f\u0303 (\u2212)j mj E\u0303 (\u2212)j , (B13)\n26/47\nD ow nloaded from https://academ ic.oup.com /ptep/article/2023/4/043B03/7093422 by Indian Institute of Technology Patna user on 18 January 2024\nand\nf\u0303 (\u00b1)j \u2212\u2192 C(\u00b1)j as ReLj \u2212\u2192 \u00b1\u221e, where \u23a7\u23aa\u23aa\u23aa\u23aa\u23a8\u23aa\u23aa\u23aa\u23aa\u23a9 C(+)j := ( 1 0 0 1 ) C(\u2212)j := (\n0 1 1 0\n) . (B14)\nNow by Eqs. (B3), (B13), and (A7), we can omit the right common factor E (\u00b1)j from the jth column (j = 2 \u2212 n), and take the right common factor E\u0303 (\u00b1)j of the last column out of the quasideterminant. Then we obtain\n\u2202\u03bc\u03c3\n=\n\u2223\u2223\u2223\u2223\u2223\u2223\u2223\u2223\u2223\u2223\u2223\u2223\u2223 \u03c81 f (\u00b1) 2 \u00b7 \u00b7 \u00b7 f (\u00b1)n \u2202\u03bc\u03c81 \u03c81 1 f (\u00b1) 2 2 \u00b7 \u00b7 \u00b7 f (\u00b1)n n (\u2202\u03bc\u03c81) 1 \u03c81 2 1 f (\u00b1) 2 2 2 \u00b7 \u00b7 \u00b7 f (\u00b1)n 2n (\u2202\u03bc\u03c81) 21 ... ... . . . ... ... \u03c81 n 1 f (\u00b1) 2 n 2 \u00b7 \u00b7 \u00b7 f (\u00b1)n nn (\u2202\u03bc\u03c81) n1 \u2223\u2223\u2223\u2223\u2223\u2223\u2223\u2223\u2223\u2223\u2223\u2223\u2223 \u2223\u2223\u2223\u2223\u2223\u2223\u2223\u2223\u2223\u2223\u2223\u2223 \u03c81 \u00b7 \u00b7 \u00b7 f (\u00b1)j \u00b7 \u00b7 \u00b7 1 \u03c81 1 \u00b7 \u00b7 \u00b7 f (\u00b1)j j \u00b7 \u00b7 \u00b7 0 ... . . . ... . . . ... \u03c81 n\u22121 1 \u00b7 \u00b7 \u00b7 f (\u00b1)j n\u22121j \u00b7 \u00b7 \u00b7 0 1 \u00b7 \u00b7 \u00b7 0 \u00b7 \u00b7 \u00b7 0 \u2223\u2223\u2223\u2223\u2223\u2223\u2223\u2223\u2223\u2223\u2223\u2223\n+ n\u2211\nj=2 \u2223\u2223\u2223\u2223\u2223\u2223\u2223\u2223\u2223\u2223\u2223\u2223\u2223 \u03c81 f (\u00b1) 2 \u00b7 \u00b7 \u00b7 f (\u00b1)n f\u0303 (\u00b1)j \u03c81 1 f (\u00b1) 2 2 \u00b7 \u00b7 \u00b7 f (\u00b1)n n f\u0303 (\u00b1)j j \u03c81 2 1 f (\u00b1) 2 2 2 \u00b7 \u00b7 \u00b7 f (\u00b1)n 2n f\u0303 (\u00b1)j 2j ... ... . . . ... ...\n\u03c81 n 1 f (\u00b1) 2 n 2 \u00b7 \u00b7 \u00b7 f (\u00b1)n nn ( f\u0303 (\u00b1)j nj\n\u2223\u2223\u2223\u2223\u2223\u2223\u2223\u2223\u2223\u2223\u2223\u2223\u2223 E\u0303 (\u00b1)j\n\u00d7 \u2223\u2223\u2223\u2223\u2223\u2223\u2223\u2223\u2223\u2223\u2223\u2223 \u03c81 f (\u00b1) 2 \u00b7 \u00b7 \u00b7 \u03c8 j \u00b7 \u00b7 \u00b7 f (\u00b1)n 1 \u03c81 1 f (\u00b1) 2 2 \u00b7 \u00b7 \u00b7 \u03c8 j j \u00b7 \u00b7 \u00b7 f (\u00b1)n n 0 ... ... . . . ... . . . ... ... \u03c81 n\u22121 1 f (\u00b1) 2 n\u22121 2 \u00b7 \u00b7 \u00b7 \u03c8 j n\u22121j \u00b7 \u00b7 \u00b7 f (\u00b1)n n\u22121n 0\n0 0 \u00b7 \u00b7 \u00b7 1 \u00b7 \u00b7 \u00b7 0 0\n\u2223\u2223\u2223\u2223\u2223\u2223\u2223\u2223\u2223\u2223\u2223\u2223 .\n(B15)\nBy the Jacobi identity (A9), we have\n27/47\nD ow nloaded from https://academ ic.oup.com /ptep/article/2023/4/043B03/7093422 by Indian Institute of Technology Patna user on 18 January 2024\nE\u0303 (\u00b1)j \u2223\u2223\u2223\u2223\u2223\u2223\u2223\u2223\u2223\u2223\u2223\u2223 \u03c81 f (\u00b1) 2 \u00b7 \u00b7 \u00b7 \u03c8 j \u00b7 \u00b7 \u00b7 f (\u00b1)n 1 \u03c81 1 f (\u00b1) 2 2 \u00b7 \u00b7 \u00b7 \u03c8 j j \u00b7 \u00b7 \u00b7 f (\u00b1)n n 0 ... ... . . . ... . . . ... ... \u03c81 n\u22121 1 f (\u00b1) 2 n\u22121 2 \u00b7 \u00b7 \u00b7 \u03c8 j n\u22121j \u00b7 \u00b7 \u00b7 f (\u00b1)n n\u22121n 0\n0 0 \u00b7 \u00b7 \u00b7 1 \u00b7 \u00b7 \u00b7 0 0\n\u2223\u2223\u2223\u2223\u2223\u2223\u2223\u2223\u2223\u2223\u2223\u2223 (B16)\n= \u2212E\u0303 (\u00b1)j \u2223\u2223\u2223\u2223\u2223\u2223\u2223\u2223\u2223\u2223 \u03c81 f (\u00b1) 2 \u00b7 \u00b7 \u00b7 \u03c8 j \u00b7 \u00b7 \u00b7 f (\u00b1)n \u03c81 1 f (\u00b1) 2 2 \u00b7 \u00b7 \u00b7 \u03c8 j j \u00b7 \u00b7 \u00b7 f (\u00b1)n n ... ... . . . ... . . . ...\n\u03c81 n\u22121 1 f (\u00b1) 2 n\u22121 2 \u00b7 \u00b7 \u00b7 \u03c8 j n\u22121j \u00b7 \u00b7 \u00b7 f (\u00b1)n n\u22121n\n\u2223\u2223\u2223\u2223\u2223\u2223\u2223\u2223\u2223\u2223 \u22121\n(B17)\n= \u2212E\u0303 (\u00b1)j (E (\u00b1)j )\u22121 \u2223\u2223\u2223\u2223\u2223\u2223\u2223\u2223\u2223\u2223\u2223 \u03c81 f (\u00b1) 2 \u00b7 \u00b7 \u00b7 f (\u00b1)j \u00b7 \u00b7 \u00b7 f (\u00b1)n \u03c81 1 f (\u00b1) 2 2 \u00b7 \u00b7 \u00b7 f (\u00b1)j i \u00b7 \u00b7 \u00b7 f (\u00b1)n n ... ... . . . ... . . . ...\n\u03c81 n\u22121 1 f (\u00b1) 2 n\u22121 2 \u00b7 \u00b7 \u00b7 f (\u00b1)j n\u22121j \u00b7 \u00b7 \u00b7 f (\u00b1)n n\u22121n\n\u2223\u2223\u2223\u2223\u2223\u2223\u2223\u2223\u2223\u2223\u2223 \u22121 .\n(With Eqs. (B3) and (A7), we can take the right common factor E (\u00b1)j out of the\nquasideterminant.) (B18)\nBy Eqs. (B3) and (B13),\nE\u0303 (\u00b1)j (E (\u00b1) j ) \u22121 = \u23a7\u23aa\u23aa\u23aa\u23aa\u23a8\u23aa\u23aa\u23aa\u23aa\u23a9 ( ( j) \u03bc eL j 0 0 ( j) \u03bc e L j )( e\u2212L j 0 0 e\u2212Lj ) ( ( j) \u03bc e\u2212L j 0\n0 \u2212 ( j)\u03bc e\u2212L j\n)( \u2212eL j 0\n0 eLj\n) = \u00b1( ( j)\u03bc 0 0\n( j) \u03bc\n) =: \u0303(\u00b1)j , (B19)\nwhich are constant matrices. Therefore, we can conclude that\n\u2202\u03bc\u03c3 = \u2223\u2223\u2223\u2223\u2223\u2223\u2223\u2223\u2223\u2223\u2223 \u03c81 f (\u00b1) 2 \u00b7 \u00b7 \u00b7 f (\u00b1)n \u2202\u03bc\u03c81 \u03c81 1 f (\u00b1) 2 2 \u00b7 \u00b7 \u00b7 f (\u00b1)n n (\u2202\u03bc\u03c81) 1 ... ... . . . ... ...\n\u03c81 n 1 f (\u00b1) 2 n 2 \u00b7 \u00b7 \u00b7 f (\u00b1)n nn (\u2202\u03bc\u03c81) n1 \u2223\u2223\u2223\u2223\u2223\u2223\u2223\u2223\u2223\u2223\u2223 \u2223\u2223\u2223\u2223\u2223\u2223\u2223\u2223\u2223\u2223\u2223\u2223\u2223 \u03c81 \u00b7 \u00b7 \u00b7 f (\u00b1)j \u00b7 \u00b7 \u00b7 1 \u03c81 1 \u00b7 \u00b7 \u00b7 f (\u00b1)j j \u00b7 \u00b7 \u00b7 0 ... . . . ... . . . ... \u03c81 n\u22121 1 \u00b7 \u00b7 \u00b7 f (\u00b1)j n\u22121j \u00b7 \u00b7 \u00b7 0\n1 \u00b7 \u00b7 \u00b7 0 \u00b7 \u00b7 \u00b7 0\n\u2223\u2223\u2223\u2223\u2223\u2223\u2223\u2223\u2223\u2223\u2223\u2223\u2223\n\u2212 n\u2211\nj=2 \u2223\u2223\u2223\u2223\u2223\u2223\u2223\u2223\u2223\u2223\u2223\u2223 \u03c81 f (\u00b1) 2 \u00b7 \u00b7 \u00b7 f (\u00b1)n f\u0303 (\u00b1)j \u03c81 1 f (\u00b1) 2 2 \u00b7 \u00b7 \u00b7 f (\u00b1)n n f\u0303 (\u00b1)j j ... ... . . . ... ... \u03c81 n 1 f (\u00b1) 2 n 2 \u00b7 \u00b7 \u00b7 f (\u00b1)n nn f\u0303 (\u00b1)j nj \u2223\u2223\u2223\u2223\u2223\u2223\u2223\u2223\u2223\u2223\u2223\u2223 \u0303 (\u00b1) j \u2223\u2223\u2223\u2223\u2223\u2223\u2223\u2223\u2223\u2223\u2223\u2223 \u03c81 f (\u00b1) 2 \u00b7 \u00b7 \u00b7 f (\u00b1)j \u00b7 \u00b7 \u00b7 f (\u00b1)n \u03c81 1 f (\u00b1) 2 2 \u00b7 \u00b7 \u00b7 f (\u00b1)j i \u00b7 \u00b7 \u00b7 f (\u00b1)n n ... ... . . . ... . . . ...\n\u03c81 n\u22121 1 f (\u00b1) 2 n\u22121 2 \u00b7 \u00b7 \u00b7 f (\u00b1)j n\u22121j \u00b7 \u00b7 \u00b7 f (\u00b1)n n\u22121n\n\u2223\u2223\u2223\u2223\u2223\u2223\u2223\u2223\u2223\u2223\u2223\u2223 \u22121 ,\n28/47\nD ow nloaded from https://academ ic.oup.com /ptep/article/2023/4/043B03/7093422 by Indian Institute of Technology Patna user on 18 January 2024\nwhich is asymptotic (cf. Eqs. (B4), (B14)) to\n\u2202\u0303\u03bc\u03c3\n= \u2223\u2223\u2223\u2223\u2223\u2223\u2223\u2223\u2223\u2223\u2223\u2223\u2223 \u03c81 C (\u00b1) 2 \u00b7 \u00b7 \u00b7 C(\u00b1)n \u2202\u03bc\u03c81 \u03c81 1 C (\u00b1) 2 2 \u00b7 \u00b7 \u00b7 C(\u00b1)n n (\u2202\u03bc\u03c81) 1 \u03c81 2 1 C (\u00b1) 2 2 2 \u00b7 \u00b7 \u00b7 C(\u00b1)n 2n (\u2202\u03bc\u03c81) 21 ... ... . . . ... ... \u03c81 n 1 C (\u00b1) 2 n 2 \u00b7 \u00b7 \u00b7 C(\u00b1)n nn (\u2202\u03bc\u03c81) n1 \u2223\u2223\u2223\u2223\u2223\u2223\u2223\u2223\u2223\u2223\u2223\u2223\u2223 \u2223\u2223\u2223\u2223\u2223\u2223\u2223\u2223\u2223\u2223\u2223\u2223 \u03c81 \u00b7 \u00b7 \u00b7 C(\u00b1)j \u00b7 \u00b7 \u00b7 1 \u03c81 1 \u00b7 \u00b7 \u00b7 C(\u00b1)j j \u00b7 \u00b7 \u00b7 0 ... . . . ... . . . ... \u03c81 n\u22121 1 \u00b7 \u00b7 \u00b7 C(\u00b1)j n\u22121j \u00b7 \u00b7 \u00b7 0 1 \u00b7 \u00b7 \u00b7 0 \u00b7 \u00b7 \u00b7 0 \u2223\u2223\u2223\u2223\u2223\u2223\u2223\u2223\u2223\u2223\u2223\u2223\n\u2212 n\u2211\nj=2 \u2223\u2223\u2223\u2223\u2223\u2223\u2223\u2223\u2223\u2223\u2223\u2223\u2223 \u03c81 C (\u00b1) 2 \u00b7 \u00b7 \u00b7 C(\u00b1)n C(\u00b1)j \u03c81 1 C (\u00b1) 2 2 \u00b7 \u00b7 \u00b7 C(\u00b1)n n C(\u00b1)j j \u03c81 2 1 C (\u00b1) 2 2 2 \u00b7 \u00b7 \u00b7 C(\u00b1)n 2n C(\u00b1)j 2j ... ... . . . ... ...\n\u03c81 n 1 C (\u00b1) 2 n 2 \u00b7 \u00b7 \u00b7 C(\u00b1)n nn (C(\u00b1)j nj \u2223\u2223\u2223\u2223\u2223\u2223\u2223\u2223\u2223\u2223\u2223\u2223\u2223\ufe38 \ufe37\ufe37 \ufe38 \u0303 (\u00b1) j \u2223\u2223\u2223\u2223\u2223\u2223\u2223\u2223\u2223\u2223\u2223 \u03c81 \u00b7 \u00b7 \u00b7 C(\u00b1)j \u00b7 \u00b7 \u00b7 1 \u03c81 1 \u00b7 \u00b7 \u00b7 C(\u00b1)j j \u00b7 \u00b7 \u00b7 0 ... . . . ... . . . ... \u03c81 n\u22121 1 \u00b7 \u00b7 \u00b7 C(\u00b1)j n\u22121j \u00b7 \u00b7 \u00b7 0 \u2223\u2223\u2223\u2223\u2223\u2223\u2223\u2223\u2223\u2223\u2223 \u22121\n= 0 (the jth column is identical to the last column). (B20) By Eqs. (B7) and (A7), the right common factors C(\u00b1)j of each column can be omitted completely, and hence\n\u2202\u0303\u03bc\u03c3\n= \u2223\u2223\u2223\u2223\u2223\u2223\u2223\u2223\u2223\u2223\u2223\u2223 \u03c81 1 \u00b7 \u00b7 \u00b7 1 \u2202\u03bc\u03c81 \u03c81 1 (\u00b1) 2 \u00b7 \u00b7 \u00b7 (\u00b1)n (\u2202\u03bc\u03c81) 1 \u03c81 2 1 (\u00b1)2 2 \u00b7 \u00b7 \u00b7 (\u00b1)2n (\u2202\u03bc\u03c81) 21 ... ... . . . ... ... \u03c81 n 1 (\u00b1)n 2 \u00b7 \u00b7 \u00b7 (\u00b1)nn (\u2202\u03bc\u03c81) n1 \u2223\u2223\u2223\u2223\u2223\u2223\u2223\u2223\u2223\u2223\u2223\u2223 \u2223\u2223\u2223\u2223\u2223\u2223\u2223\u2223\u2223\u2223\u2223\u2223 \u03c81 1 \u00b7 \u00b7 \u00b7 1 1 \u03c81 1 (\u00b1) 2 \u00b7 \u00b7 \u00b7 (\u00b1)n 0 ... ... . . . ... ... \u03c81 n\u22121 1 (\u00b1)n\u22121 2 \u00b7 \u00b7 \u00b7 (\u00b1)n\u22121n 0 1 0 \u00b7 \u00b7 \u00b7 0 0 \u2223\u2223\u2223\u2223\u2223\u2223\u2223\u2223\u2223\u2223\u2223\u2223 (B21)\n= \u2202\u03bc\u03c3\u0303 . (B22)\nC. Proof of unitarity for n-soliton solutions on E\nProposition C.1 Let \u03c3 [n + 1] be defined in Eq. (B1) with the reality condition (36) on E. Then \u03c3 [n + 1] \u2208 U(2) on the Euclidean space if |\u03bbj| = 1. Proof. For n = 1, we have\n\u03c8 \u2020 1\u03c81 = \u03c81\u03c8\u20201 = (eL1+L1 + e\u2212(L1+L1 ) )I, \u20201 1 = 1 \u20201 = |\u03bb1|2I = I, (C1)\nwhich implies\n\u03c3 \u2020 [2]\u03c3[2] = (\u2212\u03c81 1\u03c8\u221211 )\u2020(\u2212\u03c81 1\u03c8\u221211 ) = (\u03c8\u20201\u03c81)(\u03c81\u03c8\u20201 )\u22121( \u20201 1) = I = \u03c3[2]\u03c3 \u2020[2], (C2)\ni.e., the one-soliton solution \u03c3 [2] \u2208 U(2). Assume that the n-soliton solution \u03c3 [n + 1] \u2208 U(2) for\n29/47\nD ow nloaded from https://academ ic.oup.com /ptep/article/2023/4/043B03/7093422 by Indian Institute of Technology Patna user on 18 January 2024\n1 \u2264 n \u2264 k \u2212 1. For n = k and by the Darboux transformation [18], we have\n\u03c3[k+1] = \u2212\u03c8[k] [k]\u03c8\u22121[k] \u03c3[k], (C3)\nwhere\n\u03c8[k] := \u2223\u2223\u2223\u2223\u2223\u2223\u2223\u2223\u2223\u2223\u2223\u2223\u2223 \u03c81 \u03c82 \u00b7 \u00b7 \u00b7 \u03c8k\u22121 \u03c8k \u03c81 1 \u03c82 2 \u00b7 \u00b7 \u00b7 \u03c8k\u22121 k\u22121 \u03c8k k ... ... ... ... \u03c81 k\u22122 1 \u03c82 k\u22122 2 \u00b7 \u00b7 \u00b7 \u03c8k\u22121 k\u22122k\u22121 \u03c8k k\u22122k \u03c81 k\u22121 1 \u03c82 k\u22121 2 \u00b7 \u00b7 \u00b7 \u03c8k\u22121 k\u22121k\u22121 \u03c8k k\u22121k \u2223\u2223\u2223\u2223\u2223\u2223\u2223\u2223\u2223\u2223\u2223\u2223\u2223 . (C4)\nBy using the Jacobi identity (A9) in the following two equalities marked by = notation, we have\n\u03c8[k] = \u2223\u2223\u2223\u2223\u2223\u2223\u2223\u2223 \u03c82 2 \u00b7 \u00b7 \u00b7 \u03c8k k ... ...\n\u03c82 k\u22121 2 \u00b7 \u00b7 \u00b7 \u03c8k k\u22121k \u2223\u2223\u2223\u2223\u2223\u2223\u2223\u2223 \u2212\n\u2223\u2223\u2223\u2223\u2223\u2223\u2223\u2223 \u03c81 1 \u00b7 \u00b7 \u00b7 \u03c8k\u22121 k\u22121 ... ...\n\u03c81 k\u22121 1 \u00b7 \u00b7 \u00b7 \u03c8k\u22121 k\u22121k\u22121\n\u2223\u2223\u2223\u2223\u2223\u2223\u2223\u2223 \u2223\u2223\u2223\u2223\u2223\u2223\u2223 \u03c81 \u00b7 \u00b7 \u00b7 \u03c8k\u22121 ... ... \u03c81 k\u22122 1 \u00b7 \u00b7 \u00b7 \u03c8k\u22121 k\u22122k\u22121 \u2223\u2223\u2223\u2223\u2223\u2223\u2223 \u22121 \u2223\u2223\u2223\u2223\u2223\u2223\u2223 \u03c82 \u00b7 \u00b7 \u00b7 \u03c8k ... ... \u03c82 k\u22122 2 \u00b7 \u00b7 \u00b7 \u03c8k k\u22122k \u2223\u2223\u2223\u2223\u2223\u2223\u2223\n= \u23a1\u23a2\u23a2\u23a2\u23a2\u23a2\u23a2\u23a2\u23a2\u23a2\u23a2\u23a2\u23a3\n\u2223\u2223\u2223\u2223\u2223\u2223\u2223\u2223 \u03c82 2 \u00b7 \u00b7 \u00b7 \u03c8k k ... ...\n\u03c82 k\u22121 2 \u00b7 \u00b7 \u00b7 \u03c8k k\u22121k\n\u2223\u2223\u2223\u2223\u2223\u2223\u2223\u2223 \u2223\u2223\u2223\u2223\u2223\u2223\u2223 \u03c82 \u00b7 \u00b7 \u00b7 \u03c8k ... ... \u03c82 k\u22122 2 \u00b7 \u00b7 \u00b7 \u03c8k k\u22122k \u2223\u2223\u2223\u2223\u2223\u2223\u2223 \u22121\n\u2212 \u2223\u2223\u2223\u2223\u2223\u2223\u2223\u2223 \u03c81 1 \u00b7 \u00b7 \u00b7 \u03c8k\u22121 k\u22121 ... ...\n\u03c81 k\u22121 1 \u00b7 \u00b7 \u00b7 \u03c8k\u22121 k\u22121k\u22121\n\u2223\u2223\u2223\u2223\u2223\u2223\u2223\u2223 \u2223\u2223\u2223\u2223\u2223\u2223\u2223 \u03c81 \u00b7 \u00b7 \u00b7 \u03c8k\u22121 ... ... \u03c81 k\u22122 1 \u00b7 \u00b7 \u00b7 \u03c8k\u22121 k\u22122k\u22121 \u2223\u2223\u2223\u2223\u2223\u2223\u2223 \u22121\n\u23a4\u23a5\u23a5\u23a5\u23a5\u23a5\u23a5\u23a5\u23a5\u23a5\u23a5\u23a5\u23a6 \u2223\u2223\u2223\u2223\u2223\u2223\u2223 \u03c82 \u00b7 \u00b7 \u00b7 \u03c8k ... ... \u03c82 k\u22122 2 \u00b7 \u00b7 \u00b7 \u03c8k k\u22122k \u2223\u2223\u2223\u2223\u2223\u2223\u2223\n= \u23a1\u23a2\u23a2\u23a2\u23a2\u23a3 \u2223\u2223\u2223\u2223\u2223\u2223\u2223\u2223\u2223\u2223 \u03c82 \u00b7 \u00b7 \u00b7 \u03c8k 1 \u03c82 2 \u00b7 \u00b7 \u00b7 \u03c8k k 0 ... ... ... \u03c82 k\u22121 2 \u00b7 \u00b7 \u00b7 \u03c8k k\u22121k 0 \u2223\u2223\u2223\u2223\u2223\u2223\u2223\u2223\u2223\u2223 \u2212 \u2223\u2223\u2223\u2223\u2223\u2223\u2223\u2223\u2223\u2223 \u03c81 \u00b7 \u00b7 \u00b7 \u03c8k\u22121 1 \u03c81 1 \u00b7 \u00b7 \u00b7 \u03c8k\u22121 k\u22121 0 ... ... ... \u03c81 k\u22121 1 \u00b7 \u00b7 \u00b7 \u03c8k k\u22121k\u22121 0 \u2223\u2223\u2223\u2223\u2223\u2223\u2223\u2223\u2223\u2223 \u23a4\u23a5\u23a5\u23a5\u23a5\u23a6 \u2223\u2223\u2223\u2223\u2223\u2223\u2223 \u03c82 \u00b7 \u00b7 \u00b7 \u03c8k ... ... \u03c82 k\u22122 2 \u00b7 \u00b7 \u00b7 \u03c8k k\u22122k \u2223\u2223\u2223\u2223\u2223\u2223\u2223 =: (\u03c3\u0303[k] \u2212 \u03c3[k] )\u03c8\u0303[k\u22121], (C5)\n30/47\nD ow nloaded from https://academ ic.oup.com /ptep/article/2023/4/043B03/7093422 by Indian Institute of Technology Patna user on 18 January 2024\nwhere \u03c3\u0303[k] := \u03c3[k] \u2223\u2223\u2223 (\u03c81, 1 )\u2192(\u03c8k, k ) \u2208 U (2). On the other hand,\n\u03c8\u0303[k\u22121] k\u03c8\u0303\u22121[k\u22121]\n= \u2212 \u2223\u2223\u2223\u2223\u2223\u2223\u2223 \u03c82 \u00b7 \u00b7 \u00b7 \u03c8k ... ... \u03c82 k\u22122 2 \u00b7 \u00b7 \u00b7 \u03c8k k\u22122k \u2223\u2223\u2223\u2223\u2223\u2223\u2223\ufe38 \ufe37\ufe37 \ufe38 k \u2223\u2223\u2223\u2223\u2223\u2223\u2223 \u03c82 \u00b7 \u00b7 \u00b7 \u03c8k ... ... \u03c82 k\u22122 2 \u00b7 \u00b7 \u00b7 \u03c8k k\u22122k \u2223\u2223\u2223\u2223\u2223\u2223\u2223 \u22121\n|| By the homological relation (A10)\u2223\u2223\u2223\u2223\u2223\u2223\u2223 \u03c82 \u00b7 \u00b7 \u00b7 \u03c8k\u22121 0 ... ... ...\n\u03c82 k\u22122 2 \u00b7 \u00b7 \u00b7 \u03c8k\u22121 k\u22122k\u22121 1\n\u2223\u2223\u2223\u2223\u2223\u2223\u2223 \u2223\u2223\u2223\u2223\u2223\u2223\u2223\u2223 \u03c82 \u00b7 \u00b7 \u00b7 \u03c8k ... ...\n\u03c82 k\u22122 2 \u00b7 \u00b7 \u00b7 \u03c8k k\u22122k \u2223\u2223\u2223\u2223\u2223\u2223\u2223\u2223 =\n\u2223\u2223\u2223\u2223\u2223\u2223\u2223 \u03c82 \u00b7 \u00b7 \u00b7 \u03c8k\u22121 1 ... ... ...\n\u03c82 k\u22122 2 \u00b7 \u00b7 \u00b7 \u03c8k\u22121 k\u22122k\u22121 0\n\u2223\u2223\u2223\u2223\u2223\u2223\u2223 \u22121 \u23a7\u23aa\u23aa\u23aa\u23aa\u23a8\u23aa\u23aa\u23aa\u23aa\u23a9\u2212 \u2223\u2223\u2223\u2223\u2223\u2223\u2223\u2223 \u03c82 2 \u00b7 \u00b7 \u00b7 \u03c8k k ... ... \u03c82 k\u22121 2 \u00b7 \u00b7 \u00b7 \u03c8k k\u22121k \u2223\u2223\u2223\u2223\u2223\u2223\u2223\u2223 \u2223\u2223\u2223\u2223\u2223\u2223\u2223 \u03c82 \u00b7 \u00b7 \u00b7 \u03c8k ... ... \u03c82 k\u22122 2 \u00b7 \u00b7 \u00b7 \u03c8k k\u22122k \u2223\u2223\u2223\u2223\u2223\u2223\u2223 \u22121\n\ufe38 \ufe37\ufe37 \ufe38 \u23ab\u23aa\u23aa\u23aa\u23aa\u23ac\u23aa\u23aa\u23aa\u23aa\u23ad || By the Jacobi identity (A9)\u2223\u2223\u2223\u2223\u2223\u2223\u2223 \u03c82 \u00b7 \u00b7 \u00b7 \u03c8k 1 ... ... ...\n\u03c82 k\u22121 2 \u00b7 \u00b7 \u00b7 \u03c8k k\u22121k 0 \u2223\u2223\u2223\u2223\u2223\u2223\u2223 = \u03c3\u0303\u22121[k\u22121]\u03c3\u0303[k] \u2208 U (2). (C6)\nNote that the second equality from the bottom is obtained by using the homological relation (A10) and (A7). By Eqs. (C3), (C5), and (C6), we can conclude that\n\u03c3[k+1] = (\u03c3\u0303[k] \u2212 \u03c3[k] )\u03c3\u0303\u22121[k\u22121]\u03c3\u0303[k](\u03c3\u0303[k] \u2212 \u03c3[k] )\u22121\u03c3[k] \u2208 U (2). (C7)\nD. Miscellaneous formulas D.1. Flip symmetry of n-soliton solutions\nProposition D.1 The data of the n-soliton solutions have the following symmetry:\n( , 11, 12, 21, 22) \u2223\u2223\u2223\u2223 L j\u2192\u2212L j = ( , 22, 21, 12, 11) , (D1)\n\u2202\u03bc ( , 11, 12, 21, 22) \u2223\u2223\u2223\u2223 L j\u2192\u2212L j = \u2202\u03bc ( , 22, 21, 12, 11) . (D2)\n31/47\nD ow nloaded from https://academ ic.oup.com /ptep/article/2023/4/043B03/7093422 by Indian Institute of Technology Patna user on 18 January 2024\nProof. Let \u03c8\u0303 j be defined by \u03c8\u0303 j := \u03c8 j \u2223\u2223\u2223\u2223 L j\u2192\u2212L j = ( e\u2212L j eL j \u2212eL j e\u2212Lj ) , which satisfies\n\u03c8\u0303 j k j = E (\u03c8 j kj )F, E := ( 0 1 1 0 ) , F := ( \u22121 0 0 1 ) .\nThen\n\u03c3 \u2223\u2223\u2223\u2223 L j\u2192\u2212L j = \u2223\u2223\u2223\u2223\u2223\u2223\u2223\u2223\u2223\u2223 \u03c8\u03031 \u03c8\u03032 \u00b7 \u00b7 \u00b7 \u03c8\u0303n 1 \u03c8\u03031 1 \u03c8\u03032 2 \u00b7 \u00b7 \u00b7 \u03c8\u0303n n 0 ... ... . . . ... ...\n\u03c8\u03031 n 1 \u03c8\u03032 n 2 \u00b7 \u00b7 \u00b7 \u03c8\u0303n nn 0 \u2223\u2223\u2223\u2223\u2223\u2223\u2223\u2223\u2223\u2223 =\n\u2223\u2223\u2223\u2223\u2223\u2223\u2223\u2223\u2223\u2223 E (\u03c81)F E (\u03c82)F \u00b7 \u00b7 \u00b7 E (\u03c8n)F E1E E (\u03c81 1)F E (\u03c82 2)F \u00b7 \u00b7 \u00b7 E (\u03c8n n)F E0E ... ... . . . ... ...\nE (\u03c81 n1)F E (\u03c82 n 2)F \u00b7 \u00b7 \u00b7 E (\u03c8n nn)F E0E \u2223\u2223\u2223\u2223\u2223\u2223\u2223\u2223\u2223\u2223 = E\n\u2223\u2223\u2223\u2223\u2223\u2223\u2223\u2223\u2223\u2223 \u03c81 \u03c82 \u00b7 \u00b7 \u00b7 \u03c8n 1 \u03c81 1 \u03c82 2 \u00b7 \u00b7 \u00b7 \u03c8n n 0 ... ... . . . ... ...\n\u03c81 n 1 \u03c82 n 2 \u00b7 \u00b7 \u00b7 \u03c8n nn 0\n\u2223\u2223\u2223\u2223\u2223\u2223\u2223\u2223\u2223\u2223 E = E\u03c3E\nby the multiplicative rule (A7) and (A8) of the quasideterminant. (The common multiplier for the rows is E, the common multipliers for the columns are F and E.) Now we have\n\u03c3 \u2223\u2223\u2223\u2223 L j\u2192\u2212L j = ( 0 1 1 0 ) \u22121 ( 11 12 21 22 )( 0 1 1 0 ) = \u22121 ( 22 21 12 11 ) .\nTherefore, ( , 11, 12, 21, 22) \u2223\u2223\u2223\u2223 L j\u2192\u2212L j = ( , 22, 21, 12, 11).\nBy the fact that df (\u2212x) dx = \u2212df (x) dx \u2223\u2223\u2223\u2223 x\u2192\u2212x , we have\n( \u2202\u03bc , \u2202\u03bc 11, \u2202\u03bc 12, \u2202\u03bc 21, \u2202\u03bc 22 ) \u2223\u2223\u2223\u2223 L j\u2192\u2212L j\n= \u2212\u2202\u03bc ( \u2223\u2223 L j\u2192\u2212L j , 11 \u2223\u2223 L j\u2192\u2212L j , 12 \u2223\u2223 L j\u2192\u2212L j , 21 \u2223\u2223 L j\u2192\u2212L j , 22 \u2223\u2223 L j\u2192\u2212L j ) = \u2212\u2202\u03bc ( , 22, 21, 12, 11) by (D.1) = \u2212 (\u2202\u03bc , \u2202\u03bc 22, \u2202\u03bc 21, \u2202\u03bc 12, \u2202\u03bc 11) .\nCorollary D.2 Proposition D.1 implies that: (1) Tr[(\u2202\u03bc\u03c3)\u03c3\u22121(\u2202\u03bd\u03c3)\u03c3\u22121] is an even function with respect to Lj. (2) Tr[(\u2202\u03bc\u03c3)\u03c3\u22121(\u2202\u03bd\u03c3)\u03c3\u22121(\u2202\u03c1\u03c3)\u03c3\u22121] is an odd function with respect to Lj.\n32/47\nD ow nloaded from https://academ ic.oup.com /ptep/article/2023/4/043B03/7093422 by Indian Institute of Technology Patna user on 18 January 2024\nProof. (1)\nTr [ (\u2202\u03bc\u03c3 )\u03c3\u22121(\u2202\u03bd\u03c3 )\u03c3\u22121 ] \u2223\u2223\u2223\u2223 L j\u2192\u2212L j\n= \u22121|\u03c3 | 2 {\u2223\u2223\u2223\u2223\u2223\u2202\u03bc 11 \u2202\u03bc 12\u2202\u03bd 21 \u2202\u03bd 22 \u2223\u2223\u2223\u2223\u2223 + \u2223\u2223\u2223\u2223\u2223\u2202\u03bd 11 \u2202\u03bd 12\u2202\u03bc 21 \u2202\u03bc 22 \u2223\u2223\u2223\u2223\u2223 \u2212 2|\u03c3 |(\u2202\u03bc )(\u2202\u03bd ) } \u2223\u2223\u2223\u2223\nL j\u2192\u2212L j = \u22121|\u03c3 | 2 {\u2223\u2223\u2223\u2223\u2223\u2212\u2202\u03bc 22 \u2212\u2202\u03bc 21\u2212\u2202\u03bd 12 \u2212\u2202\u03bd 11 \u2223\u2223\u2223\u2223\u2223 + \u2223\u2223\u2223\u2223\u2223\u2212\u2202\u03bd 22 \u2212\u2202\u03bd 21\u2212\u2202\u03bc 12 \u2212\u2202\u03bc 11 \u2223\u2223\u2223\u2223\u2223 \u2212 2|\u03c3 |(\u2212\u2202\u03bc )(\u2212\u2202\u03bd ) }\n= \u22121|\u03c3 | 2 {\u2223\u2223\u2223\u2223\u2223\u2202\u03bd 11 \u2202\u03bd 12\u2202\u03bc 21 \u2202\u03bc 22 \u2223\u2223\u2223\u2223\u2223 + \u2223\u2223\u2223\u2223\u2223\u2202\u03bc 11 \u2202\u03bc 12\u2202\u03bd 21 \u2202\u03bd 22 \u2223\u2223\u2223\u2223\u2223 \u2212 2|\u03c3 |(\u2202\u03bc )(\u2202\u03bd ) }\n= Tr [(\u2202\u03bc\u03c3 )\u03c3\u22121(\u2202\u03bd\u03c3 )\u03c3\u22121] . (2)\nTr [ (\u2202\u03bc\u03c3 )\u03c3\u22121(\u2202\u03bd\u03c3 )\u03c3\u22121(\u2202\u03c1\u03c3 )\u03c3\u22121 ] \u2223\u2223\u2223\u2223 L j\u2192\u2212L j\n= 1 2|\u03c3 |2 4 \u2223\u2223\u2223\u2223\u2223\u2223\u2223\u2223\u2223 11 12 21 22 \u2202\u03bc 11 \u2202\u03bc 12 \u2202\u03bc 21 \u2202\u03bc 22 \u2202\u03bd 11 \u2202\u03bd 12 \u2202\u03bd 21 \u2202\u03bd 22\n\u2202\u03c1 11 \u2202\u03c1 12 \u2202\u03c1 21 \u2202\u03c1 22 \u2223\u2223\u2223\u2223\u2223\u2223\u2223\u2223\u2223 L j\u2192\u2212L j\n= 1 2|\u03c3 |2 4 \u2223\u2223\u2223\u2223\u2223\u2223\u2223\u2223\u2223 22 21 12 11 \u2212\u2202\u03bc 22 \u2212\u2202\u03bc 21 \u2212\u2202\u03bc 12 \u2212\u2202\u03bc 11 \u2212\u2202\u03bd 22 \u2212\u2202\u03bd 21 \u2212\u2202\u03bd 12 \u2212\u2202\u03bd 11 \u2212\u2202\u03c1 22 \u2212\u2202\u03c1 21 \u2212\u2202\u03c1 12 \u2212\u2202\u03c1 11 \u2223\u2223\u2223\u2223\u2223\u2223\u2223\u2223\u2223 = (\u22121) 3\n2|\u03c3 |2 4 \u2223\u2223\u2223\u2223\u2223\u2223\u2223\u2223\u2223 22 21 12 11 \u2202\u03bc 22 \u2202\u03bc 21 \u2202\u03bc 12 \u2202\u03bc 11 \u2202\u03bd 22 \u2202\u03bd 21 \u2202\u03bd 12 \u2202\u03bd 11\n\u2202\u03c1 22 \u2202\u03c1 21 \u2202\u03c1 12 \u2202\u03c1 11\n\u2223\u2223\u2223\u2223\u2223\u2223\u2223\u2223\u2223 = \u22121 2|\u03c3 |2 4 \u2223\u2223\u2223\u2223\u2223\u2223\u2223\u2223\u2223 11 12 21 22 \u2202\u03bc 11 \u2202\u03bc 12 \u2202\u03bc 21 \u2202\u03bc 22 \u2202\u03bd 11 \u2202\u03bd 12 \u2202\u03bd 21 \u2202\u03bd 22\n\u2202\u03c1 11 \u2202\u03c1 12 \u2202\u03c1 21 \u2202\u03c1 22 \u2223\u2223\u2223\u2223\u2223\u2223\u2223\u2223\u2223 = \u2212Tr [(\u2202\u03bc\u03c3 )\u03c3\u22121(\u2202\u03bd\u03c3 )\u03c3\u22121(\u2202\u03c1\u03c3 )\u03c3\u22121] .\nD.2. Data of n-soliton solutions In this subsection we present the data of n-soliton solutions in terms of Xj, j. We introduce the convention \u03b5j, which takes values in {\u00b11, \u00b1i}, and define an informal symbol P{(\u03b51, . . . , \u03b5n)} to denote the set of all permutations of (\u03b51,\u2026, \u03b5n). The data of n-soliton solutions can be expressed formally as the following , ij with some undetermined coefficients a(\u03b5) := a(\u03b51, . . . , \u03b5n) and\n33/47\nD ow nloaded from https://academ ic.oup.com /ptep/article/2023/4/043B03/7093422 by Indian Institute of Technology Patna user on 18 January 2024\nA(\u03b5) := A(\u03b51, . . . , \u03b5n):\n= \u2211\n1 \u2264 j \u2264 n, \u03b5 = \u00b11\na(\u03b5) exp \u239b\u239d n\u2211 j=1 \u03b5 jXj \u239e\u23a0\n+ \u2211\n1 \u2264 k < \u2264 n, \u03b5 j = \u00b11, j = k,\n(\u03b5k, \u03b5 ) \u2208 P{(i, \u2212i)}\na(\u03b5) exp( n\u2211\nj =k, \u03b5 jXj + \u03b5k k + \u03b5 ) + terms involving more i j\n= 1 2 \u2211 1 \u2264 j \u2264 n, \u03b5 j = \u00b11\n[ a(\u03b5) exp ( n\u2211 j=1 \u03b5 jXj ) + a(\u2212\u03b5) exp (\u2212 n\u2211 j=1 \u03b5 jXj ) ]\n+ 1 2 \u2211 1 \u2264 k < \u2264 n,\n\u03b5 j = \u00b11, j = k, (\u03b5k, \u03b5 ) \u2208 P{(i, \u2212i)}\n\u23a1\u23a2\u23a2\u23a2\u23a2\u23a3 a(\u03b5) exp( n\u2211 j =k, \u03b5 jXj + \u03b5k k + \u03b5 ) +a(\u2212\u03b5) exp(\u2212 n\u2211\nj =k, \u03b5 jXj \u2212 \u03b5k k \u2212 \u03b5 )\n\u23a4\u23a5\u23a5\u23a5\u23a5\u23a6 + \u00b7 \u00b7 \u00b7\n\ufe38 \ufe37\ufe37 \ufe38 \u2211\n1 \u2264 k < \u2264 n, \u03b5 j, j =k, = \u00b11\nO \u239b\u239dcosh( n\u2211 j=1, j =k, \u03b5 jXj ) \u239e\u23a0 .\nBy the symmetry (44), \u2223\u2223\u2223 (Xj , j )\u2192(\u2212Xj , j ) = implies a(\u03b5) = a(\u2212\u03b5), and hence\n= \u2211\n1 \u2264 j \u2264 n, \u03b5 j = \u00b11\na(\u03b5) cosh \u239b\u239d n\u2211 j=1 \u03b5 jXj \u239e\u23a0 + \u2211 1 \u2264 k < \u2264 n, \u03b5 j, j =k, = \u00b11 O \u239b\u239dcosh( n\u2211 j=1, j = ,m \u03b5 jXj ) \u239e\u23a0 . (D3)\n34/47\nD ow nloaded from https://academ ic.oup.com /ptep/article/2023/4/043B03/7093422 by Indian Institute of Technology Patna user on 18 January 2024\nSimilarly, we have\n11 = \u2211\n1 \u2264 j \u2264 n, \u03b5 j = \u00b11\nA(\u03b5) exp \u239b\u239d n\u2211 j=1 \u03b5 jXj \u239e\u23a0\n+ \u2211\n1 \u2264 k < \u2264 n, \u03b5 j = \u00b11, j = k,\n(\u03b5k, \u03b5 ) \u2208 P{(i, \u2212i)}\nA(\u03b5) exp( n\u2211\nj =k, \u03b5 jXj + \u03b5k k + \u03b5 ) + terms involving more i j\n= 1 2 \u2211 1 \u2264 j \u2264 n, \u03b5 j = \u00b11\n[ A(\u03b5) exp ( n\u2211 j=1 \u03b5 jXj ) + A(\u2212\u03b5) exp (\u2212 n\u2211 j=1 \u03b5 jXj ) ]\n+ 1 2 \u2211 1 \u2264 k < \u2264 n,\n\u03b5 j = \u00b11, j = k, (\u03b5k, \u03b5 ) \u2208 P{(i, \u2212i)}\n\u23a1\u23a2\u23a2\u23a2\u23a2\u23a3 A(\u03b5) exp( n\u2211 j =k, \u03b5 jXj + \u03b5k k + \u03b5 ) +A(\u2212\u03b5) exp(\u2212 n\u2211\nj =k, \u03b5 jXj \u2212 \u03b5k k \u2212 \u03b5 )\n\u23a4\u23a5\u23a5\u23a5\u23a5\u23a6 + \u00b7 \u00b7 \u00b7\n\ufe38 \ufe37\ufe37 \ufe38 \u2211\n1 \u2264 k < \u2264 n, \u03b5 j, j =k, = \u00b11\nO \u239b\u239dcosh( n\u2211 j=1, j =k, \u03b5 jXj ) \u239e\u23a0 . (D4)\n35/47\nD ow nloaded from https://academ ic.oup.com /ptep/article/2023/4/043B03/7093422 by Indian Institute of Technology Patna user on 18 January 2024\nBy the symmetry (44), 22 = 11 \u2223\u2223\u2223 (Xj , j )\u2192(\u2212Xj , j ) implies that 22 = 11 \u2223\u2223\u2223 A(\u03b5)\u2192A(\u2212\u03b5) :\n12 = \u2211\n1 \u2264 k \u2264 n, \u03b5 j = { \u00b11, j = k +i, j = k\nA(\u03b5) exp( n\u2211\nj =k \u03b5 jXj + \u03b5k k)\n+ \u23a7\u23aa\u23aa\u23aa\u23aa\u23aa\u23aa\u23aa\u23aa\u23aa\u23a8\u23aa\u23aa\u23aa\u23aa\u23aa\u23aa\u23aa\u23aa\u23aa\u23a9 \u2211 1 \u2264 k < < m \u2264 n, \u03b5 j = \u00b11, j = k, , m (\u03b5k, \u03b5 , \u03b5m) \u2208 P{(i, i, \u2212i)} A(\u03b5) exp( n\u2211 j =k, ,m \u03b5 jXj + \u03b5k k + \u03b5 + \u03b5m m)\n+ terms involving more i j\ufe38 \ufe37\ufe37 \ufe38 \u23ab\u23aa\u23aa\u23aa\u23aa\u23aa\u23aa\u23aa\u23aa\u23aa\u23ac\u23aa\u23aa\u23aa\u23aa\u23aa\u23aa\u23aa\u23aa\u23aa\u23ad \u2211\n1 \u2264 k < < m \u2264 n, \u03b5 j, j =k, ,m = \u00b11\nO \u239b\u239dcosh( n\u2211 j=1, j =k, ,m \u03b5 jXj ) \u239e\u23a0 . (D5)\nBy the symmetry (44), 21 = 12 \u2223\u2223\u2223 (Xj , j )\u2192(\u2212Xj , j )\n. Concrete examples are mentioned as follows: The data of one-soliton solutions:\n= a(1) (eX1 + e\u2212X1) , 11 = A(1)eX1 + A(\u22121)e\u2212X1, 22 = A(\u22121)eX1 + A(1)e\u2212X1, 12 = A(i)ei 1, 21 = A(i)e\u2212i 1, (D6)\nwhere a(1) = 1, A(1) = \u03bb1, A(\u22121) = \u03bc1, A(i) = \u2212(\u03bb1 \u2212 \u03bc1). The data of two-soliton solutions ( jk := j \u2212 k, j, k = 1, 2):\n= { a(1, 1) ( eX1+X2 + e\u2212(X1+X2) + a(1, \u22121) (eX1\u2212X2 + e\u2212(X1\u2212X2) +a(i, \u2212i) (ei 12 + e\u2212i 12) } ,\n11 = \u23a7\u23aa\u23a8\u23aa\u23a9 [ A(1, 1)eX1+X2 + A(\u22121, \u22121)e\u2212(X1+X2 )] + [A(1, \u22121)eX1\u2212X2 + A(\u22121, 1)e\u2212(X1\u2212X2 )] + [A(i, \u2212i)ei 12 + A(\u2212i, i)e\u2212i 12] \u23ab\u23aa\u23ac\u23aa\u23ad , 22 = 11 \u2223\u2223\u2223 (Xj , j )\u2192(\u2212Xj ,\u2212 j ) = 11 \u2223\u2223\u2223 A(\u03b51,\u03b52 )\u2192A(\u2212\u03b51,\u2212\u03b52 ) ,\n12 = {\nA(1, i)eX1+i 2 + A(\u22121, i)e\u2212X1+i 2 +A(i, 1)eX2+i 1 + A(i, \u22121)e\u2212X2+i 1\n} ,\n21 = 12 \u2223\u2223\u2223 (Xj , j )\u2192(\u2212Xj ,\u2212 j ) , (D7)\n36/47\nD ow nloaded from https://academ ic.oup.com /ptep/article/2023/4/043B03/7093422 by Indian Institute of Technology Patna user on 18 January 2024\nwhere\na(1, 1) = (\u03bb1 \u2212 \u03bb2)(\u03bc1 \u2212 \u03bc2), a(1, \u22121) = (\u03bb1 \u2212 \u03bc2)(\u03bc1 \u2212 \u03bb2), a(i, \u2212i) = (\u03bb1 \u2212 \u03bc1)(\u03bb2 \u2212 \u03bc2) A(1, 1) = \u2212(\u03bb1 \u2212 \u03bb2)(\u03bc1 \u2212 \u03bc2)\u03bb1\u03bb2, A(\u22121, \u22121) = \u2212(\u03bb1 \u2212 \u03bb2)(\u03bc1 \u2212 \u03bc2)\u03bc1\u03bc2, A(1, \u22121) = \u2212(\u03bb1 \u2212 \u03bc2)(\u03bc1 \u2212 \u03bb2)\u03bb1\u03bc2, A(\u22121, 1) = \u2212(\u03bb1 \u2212 \u03bc2)(\u03bc1 \u2212 \u03bb2)\u03bc1\u03bb2, A(i, \u2212i) = \u2212(\u03bb1 \u2212 \u03bc1)(\u03bb2 \u2212 \u03bc2)\u03bb1\u03bc1, A(\u2212i, i) = \u2212(\u03bb1 \u2212 \u03bc1)(\u03bb2 \u2212 \u03bc2)\u03bb2\u03bc2, A(1, i) = (\u03bb1 \u2212 \u03bb2)(\u03bb1 \u2212 \u03bc2)(\u03bb2 \u2212 \u03bc2)\u03bc1, A(\u22121, i) = (\u03bc1 \u2212 \u03bc2)(\u03bc1 \u2212 \u03bb2)(\u03bb2 \u2212 \u03bc2)\u03bb1, A(i, 1) = (\u03bb1 \u2212 \u03bb2)(\u03bb1 \u2212 \u03bc1)(\u03bc1 \u2212 \u03bb2)\u03bc2, A(i, \u22121) = (\u03bc1 \u2212 \u03bc2)(\u03bb1 \u2212 \u03bc1)(\u03bb1 \u2212 \u03bc2)\u03bb2. (D8)\nD.3. Exact calculation of the NL\u03c3M term (two-soliton) For preparation, we introduce some symmetries between the coefficients of the soliton data before our calculation. Our observations are given in the following Remarks 1\u20133, which can be checked simply from Eqs. (D7) and (D8). Remark 1\nA(1, 1) = \u2212\u03bb1\u03bb2 a(1, 1), A(\u22121, \u22121) = \u2212\u03bc1\u03bc2 a(1, 1), A(1, \u22121) = \u2212\u03bb1\u03bc2 a(1, \u22121), A(\u22121, 1) = \u2212\u03bc1\u03bb2 a(1, \u22121). (D9)\nRemark 2\nA(1, i)A(\u22121, i) = \u03bb1\u03bc1(\u03bb2 \u2212 \u03bc2)2 a(1, 1)a(1, \u22121), A(i, 1)A(i, \u22121) = \u03bb2\u03bc2(\u03bb1 \u2212 \u03bc1)2 a(1, 1)a(1, \u22121), A(\u22121, i)A(i, 1) = \u03bb1\u03bc2(\u03bc1 \u2212 \u03bb2)2 a(1, 1)a(i, \u2212i), A(1, i)A(i, \u22121) = \u03bc1\u03bb2(\u03bb1 \u2212 \u03bc2)2 a(1, 1)a(i, \u2212i), A(\u22121, i)A(i, \u22121) = \u03bb1\u03bb2(\u03bc1 \u2212 \u03bc2)2 a(1, \u22121)a(i, \u2212i), A(1, i)A(i, 1) = \u03bc1\u03bc2(\u03bb1 \u2212 \u03bb2)2 a(1, \u22121)a(i, \u2212i). (D10)\nRemark 3\nA(1, i) \u2212 A(\u22121, i) = A(i, \u22121) \u2212 A(i, 1) = (\u03bb1\u03bc1 \u2212 \u03bb2\u03bc2) a(i, \u2212i), A(i, 1) \u2212 A(\u22121, i) = A(i, \u22121) \u2212 A(1, i) = (\u03bb1\u03bc2 \u2212 \u03bc1\u03bb2) a(1, \u22121), A(1, i) + A(i, 1) = A(\u22121, i) + A(i, \u22121) = (\u03bb1\u03bb2 \u2212 \u03bc1\u03bc2) a(1, 1), (D11)\nwhich implies the relation\nA(1, i) \u2212 A(\u22121, i) + A(i, 1) \u2212 A(i, \u22121) = 0 (D12) directly by taking some simple addition and subtraction over Eq. (D11). On the other hand, by taking the sum of squares over the left- and right-hand sides of Eq. (D11) and using the relation (D12), we get the following non-trivial identity. Remark 4\n(\u03bb1\u03bb2 \u2212 \u03bc1\u03bc2)2a2(1, 1) + (\u03bb1\u03bc2 \u2212 \u03bc1\u03bb2)2a2(1, \u22121) + (\u03bb1\u03bc1 \u2212 \u03bb2\u03bc2)2a2(i, \u2212i) = A2(1, i) + A2(\u22121, i) + A2(i, 1) + A2(i, \u22121). (D13)\n37/47\nD ow nloaded from https://academ ic.oup.com /ptep/article/2023/4/043B03/7093422 by Indian Institute of Technology Patna user on 18 January 2024\nNow let us start our main calculation of the two-soliton NL sigma model term. By using the soliton data (D7) and after a slightly tedious calculation, we can conclude that\n\u2202\u03bc 11\u2202\u03bc 22 \u2212 \u2202\u03bc 12\u2202\u03bc 21 \u2212 |\u03c3 |(\u2202\u03bc )2\n= (r(1)\u03bc + r(2)\u03bc )2\n[ A(1, 1)A(\u22121, \u22121) \u2212 |\u03c3 |a2(1, 1)] [e2(X1+X2 ) + e\u22122(X1+X2 )]\n+(r(1)\u03bc \u2212 r(2)\u03bc )2 [ A(1, \u22121)A(\u22121, 1) \u2212 |\u03c3 |a2(1, \u22121)] [e2(X1\u2212X2 ) + e\u22122(X1\u2212X2 )]\n+(s(1)\u03bc \u2212 s(2)\u03bc )2 [ A(i, \u2212i)A(\u2212i, i) \u2212 |\u03c3 |a2(i, \u2212i)] (e2 12 + e\u22122 12)\n+ \u23a7\u23aa\u23aa\u23a8\u23aa\u23aa\u23a9 (r(1)\u03bc + r(2)\u03bc )(r(1)\u03bc \u2212 r(2)\u03bc ) [ A(1, 1)A(\u22121, 1) + A(1, \u22121)A(\u22121, \u22121) \u22122|\u03c3 |a(1, 1)a(1, \u22121) ] \u2212(r(1)\u03bc + s(2)\u03bc )(r(1)\u03bc \u2212 s(2)\u03bc )A(1, i)A(\u22121, i) \u23ab\u23aa\u23aa\u23ac\u23aa\u23aa\u23ad [ e2X1 + e\u22122X1]\n\u2212 \u23a7\u23aa\u23aa\u23a8\u23aa\u23aa\u23a9 (r(1)\u03bc + r(2)\u03bc )(r(1)\u03bc \u2212 r(2)\u03bc ) [ A(1, 1)A(1, \u22121) + A(\u22121, 1)A(\u22121, \u22121) \u22122|\u03c3 |a(1, 1)a(1, \u22121) ] \u2212(s(1)\u03bc + r(2)\u03bc )(s(1)\u03bc \u2212 r(2)\u03bc )A(i, 1)A(i, \u22121) \u23ab\u23aa\u23aa\u23ac\u23aa\u23aa\u23ad [ e2X2 + e\u22122X2]\n+ \u23a7\u23aa\u23aa\u23a8\u23aa\u23aa\u23a9 (r(1)\u03bc + r(2)\u03bc )(s(1)\u03bc \u2212 s(2)\u03bc ) [ A(1, 1)A(\u2212i, i) + A(\u22121, \u22121)A(i, \u2212i) \u22122|\u03c3 |a(1, 1)a(i, \u2212i) ] \u2212(r(1)\u03bc \u2212 s(2)\u03bc )(s(1)\u03bc + r(2)\u03bc )A(\u22121, i)A(i, 1) \u23ab\u23aa\u23aa\u23ac\u23aa\u23aa\u23ad [ eX1\u2212X2+i 12 +e\u2212(X1\u2212X2+i 12 ) ]\n\u2212 \u23a7\u23aa\u23aa\u23a8\u23aa\u23aa\u23a9 (r(1)\u03bc + r(2)\u03bc )(s(1)\u03bc \u2212 s(2)\u03bc ) [ A(1, 1)A(i, \u2212i) + A(\u22121, \u22121)A(\u2212i, i) \u22122|\u03c3 |a(1, 1)a(i, \u2212i) ] \u2212(r(1)\u03bc + s(2)\u03bc )(s(1)\u03bc \u2212 r(2)\u03bc )A(1, i)A(i, \u22121) \u23ab\u23aa\u23aa\u23ac\u23aa\u23aa\u23ad [ eX1+X2\u2212i 12 +e\u2212(X1+X2\u2212i 12 ) ]\n+ \u23a7\u23aa\u23aa\u23a8\u23aa\u23aa\u23a9 (r(1)\u03bc \u2212 r(2)\u03bc )(s(1)\u03bc \u2212 s(2)\u03bc ) [ A(1, \u22121)A(\u2212i, i) + A(\u22121, 1)A(i, \u2212i) \u22122|\u03c3 |a(1, \u22121)a(i, \u2212i) ] \u2212(r(1)\u03bc \u2212 s(2)\u03bc )(s(1)\u03bc \u2212 r(2)\u03bc )A(\u22121, i)A(i, \u22121) \u23ab\u23aa\u23aa\u23ac\u23aa\u23aa\u23ad [ eX1\u2212X2+i 12 +e\u2212(X1\u2212X2+i 12 ) ]\n\u2212 \u23a7\u23aa\u23aa\u23a8\u23aa\u23aa\u23a9 (r(1)\u03bc \u2212 r(2)\u03bc )(s(1)\u03bc \u2212 s(2)\u03bc ) [ A(1, \u22121)A(i, \u2212i) + A(\u22121, 1)A(\u2212i, i) \u22122|\u03c3 |a(1, \u22121)a(i, \u2212i) ] \u2212(r(1)\u03bc + s(2)\u03bc )(s(1)\u03bc + r(2)\u03bc )A(1, i)A(i, 1) \u23ab\u23aa\u23aa\u23ac\u23aa\u23aa\u23ad [ eX1\u2212X2\u2212i 12 +e\u2212(X1\u2212X2\u2212i 12 ) ]\n\u2212 \u23a7\u23aa\u23aa\u23aa\u23aa\u23aa\u23aa\u23aa\u23aa\u23aa\u23a8\u23aa\u23aa\u23aa\u23aa\u23aa\u23aa\u23aa\u23aa\u23aa\u23a9 (r(1)\u03bc + r(2)\u03bc )2 [ A2(1, 1) + A2(\u22121, \u22121) \u2212 2|\u03c3 |a2(1, 1)] +(r(1)\u03bc \u2212 r(2)\u03bc )2 [ A2(1, \u22121) + A2(\u22121, 1) \u2212 2|\u03c3 |a2(1, \u22121)] +(s(1)\u03bc \u2212 s(2)\u03bc )2 [ A2(i, \u2212i) + A2(\u2212i, i) \u2212 2|\u03c3 |a2(i, \u2212i)]\n\u2212(r(1)\u03bc + s(2)\u03bc )2A2(1, i) \u2212 (r(1)\u03bc \u2212 s(2)\u03bc )2A2(\u22121, i) \u2212(s(1)\u03bc + r(2)\u03bc )2A2(i, 1) \u2212 (s(1)\u03bc \u2212 r(2)\u03bc )2A2(i, \u22121)\n\u23ab\u23aa\u23aa\u23aa\u23aa\u23aa\u23aa\u23aa\u23aa\u23aa\u23ac\u23aa\u23aa\u23aa\u23aa\u23aa\u23aa\u23aa\u23aa\u23aa\u23ad .\nBy Eqs. (D9) and (D10), we find that the coefficients of the leading terms exp (\u00b12(X1 \u00b1 X2)) are identical to zero and the remaining terms can be rewritten as\n38/47\nD ow nloaded from https://academ ic.oup.com /ptep/article/2023/4/043B03/7093422 by Indian Institute of Technology Patna user on 18 January 2024\n\u2202\u03bc 11\u2202\u03bc 22 \u2212 \u2202\u03bc 12\u2202\u03bc 21 \u2212 |\u03c3 |(\u2202\u03bc )2\n=\n\u23a7\u23aa\u23aa\u23aa\u23aa\u23aa\u23aa\u23aa\u23aa\u23aa\u23aa\u23aa\u23aa\u23a8\u23aa\u23aa\u23aa\u23aa\u23aa\u23aa\u23aa\u23aa\u23aa\u23aa\u23aa\u23aa\u23a9 \u2212(r(2)\u03bc + s(2)\u03bc )(r(2)\u03bc \u2212 s(2)\u03bc )A(1, i)A(\u22121, i) ( e2X1 + e\u22122X1) \u2212(r(1)\u03bc + s(1)\u03bc )(r(1)\u03bc \u2212 s(1)\u03bc )A(i, 1)A(i, \u22121) ( e2X2 + e\u22122X2) \u2212(r(1)\u03bc \u2212 s(1)\u03bc )(r(2)\u03bc + s(2)\u03bc )A(\u22121, i)A(i, 1) ( eX1+X2+i 12 + e\u2212(X1+X2+i 12 )) \u2212(r(1)\u03bc + s(1)\u03bc )(r(2)\u03bc \u2212 s(2)\u03bc )A(1, i)A(i, \u22121) ( eX1+X2\u2212i 12 + e\u2212(X1+X2\u2212i 12 )) +(r(1)\u03bc \u2212 s(1)\u03bc )(r(2)\u03bc \u2212 s(2)\u03bc )A(\u22121, i)A(i, \u22121) ( eX1\u2212X2+i 12 + e\u2212(X1\u2212X2+i 12 ))\n+(r(1)\u03bc + s(1)\u03bc )(r(2)\u03bc + s(2)\u03bc )A(1, i)A(i, 1) ( eX1\u2212X2\u2212i 12 + e\u2212(X1\u2212X2\u2212i 12 ))\n\u23ab\u23aa\u23aa\u23aa\u23aa\u23aa\u23aa\u23aa\u23aa\u23aa\u23aa\u23aa\u23aa\u23ac\u23aa\u23aa\u23aa\u23aa\u23aa\u23aa\u23aa\u23aa\u23aa\u23aa\u23aa\u23aa\u23ad\n\u2212 \u23a7\u23aa\u23aa\u23aa\u23aa\u23aa\u23aa\u23aa\u23aa\u23aa\u23aa\u23aa\u23a8\u23aa\u23aa\u23aa\u23aa\u23aa\u23aa\u23aa\u23aa\u23aa\u23aa\u23aa\u23a9 (r(1)\u03bc + r(2)\u03bc )2(\u03bb1\u03bb2 \u2212 \u03bc1\u03bc2)2 a2(1, 1) +(r(1)\u03bc \u2212 r(2)\u03bc )2(\u03bb1\u03bc2 \u2212 \u03bc1\u03bb2)2 a2(1, \u22121) +(s(1)\u03bc \u2212 s(2)\u03bc )2(\u03bb1\u03bc1 \u2212 \u03bb2\u03bc2)2 a2(i, \u2212i) \u2212(r(1)\u03bc + s(2)\u03bc )2A2(1, i) \u2212 (r(1)\u03bc \u2212 s(2)\u03bc )2A2(\u22121, i) \u2212(s(1)\u03bc + r(2)\u03bc )2A2(i, 1) \u2212 (s(1)\u03bc \u2212 r(2)\u03bc )2A2(i, \u22121)\ufe38 \ufe37\ufe37 \ufe38 \u23ab\u23aa\u23aa\u23aa\u23aa\u23aa\u23aa\u23aa\u23aa\u23aa\u23aa\u23aa\u23ac\u23aa\u23aa\u23aa\u23aa\u23aa\u23aa\u23aa\u23aa\u23aa\u23aa\u23aa\u23ad =: . (D14)\nNext, we want to show that the constant term above can be absorbed completely into the non-constant terms. By the definition of r( j)\u03bc , s ( j) \u03bc above Eq. (42), we can replace r ( j) \u03bc , s ( j) \u03bc with\n( j) \u03bc and obtain\n= \u23a7\u23aa\u23aa\u23aa\u23aa\u23aa\u23aa\u23aa\u23aa\u23aa\u23aa\u23aa\u23aa\u23aa\u23aa\u23a8\u23aa\u23aa\u23aa\u23aa\u23aa\u23aa\u23aa\u23aa\u23aa\u23aa\u23aa\u23aa\u23aa\u23aa\u23a9 ( (1) \u03bc + (1)\u03bc + (2)\u03bc + (2) \u03bc )2 (\u03bb1\u03bb2 \u2212 \u03bc1\u03bc2)2 a2(1, 1) + ( (1) \u03bc + (1)\u03bc \u2212 (2)\u03bc \u2212 (2) \u03bc )2 (\u03bb1\u03bc2 \u2212 \u03bc1\u03bb2)2 a2(1, \u22121) + ( (1) \u03bc \u2212 (1)\u03bc \u2212 (2)\u03bc + (2) \u03bc )2 (\u03bb1\u03bc1 \u2212 \u03bb2\u03bc2)2 a2(i, \u2212i) \u2212 ( (1) \u03bc + (1)\u03bc + (2)\u03bc \u2212 (2) \u03bc )2 A2(1, i) \u2212 ( (1) \u03bc + (1)\u03bc \u2212 (2)\u03bc + (2) \u03bc )2 A2(\u22121, i) \u2212 (\n(1) \u03bc \u2212 (1)\u03bc + (2)\u03bc + (2) \u03bc\n)2 A2(i, 1) \u2212 (\n(1) \u03bc \u2212 (1)\u03bc \u2212 (2)\u03bc \u2212 (2) \u03bc\n)2 A2(i, \u22121) \u23ab\u23aa\u23aa\u23aa\u23aa\u23aa\u23aa\u23aa\u23aa\u23aa\u23aa\u23aa\u23aa\u23aa\u23aa\u23ac\u23aa\u23aa\u23aa\u23aa\u23aa\u23aa\u23aa\u23aa\u23aa\u23aa\u23aa\u23aa\u23aa\u23aa\u23ad .\n39/47\nD ow nloaded from https://academ ic.oup.com /ptep/article/2023/4/043B03/7093422 by Indian Institute of Technology Patna user on 18 January 2024\nBy Eqs. (D13) and (D11),\n= \u22124 \u23a7\u23aa\u23aa\u23aa\u23aa\u23aa\u23aa\u23aa\u23aa\u23aa\u23aa\u23aa\u23aa\u23aa\u23aa\u23a8\u23aa\u23aa\u23aa\u23aa\u23aa\u23aa\u23aa\u23aa\u23aa\u23aa\u23aa\u23aa\u23aa\u23aa\u23a9 (1) \u03bc (1) \u03bc [\u2212(\u03bb1\u03bc1 \u2212 \u03bb2\u03bc2)2a2(i, \u2212i) + A2(i, 1) + A2(i, \u22121)] + (2)\u03bc (2)\u03bc [\u2212(\u03bb1\u03bc1 \u2212 \u03bb2\u03bc2)2a2(i, \u2212i) + A2(1, i) + A2(\u22121, i)] + (1)\u03bc (2)\u03bc [\u2212(\u03bb1\u03bc2 \u2212 \u03bc1\u03bb2)2a2(1, \u22121) + A2(1, i) + A2(i, \u22121)] + (1)\u03bc (2)\u03bc [\u2212(\u03bb1\u03bc2 \u2212 \u03bc1\u03bb2)2a2(1, \u22121) + A2(\u22121, i) + A2(i, 1)] \u2212 (1)\u03bc (2)\u03bc [\u2212(\u03bb1\u03bb2 \u2212 \u03bc1\u03bc2)2a2(1, 1) + A2(1, i) + A2(i, 1)] \u2212 (1)\u03bc (2) \u03bc [\u2212(\u03bb1\u03bb2 \u2212 \u03bc1\u03bc2)2a2(1, 1) + A2(\u22121, i) + A2(i, \u22121)] \u23ab\u23aa\u23aa\u23aa\u23aa\u23aa\u23aa\u23aa\u23aa\u23aa\u23aa\u23aa\u23aa\u23aa\u23aa\u23ac\u23aa\u23aa\u23aa\u23aa\u23aa\u23aa\u23aa\u23aa\u23aa\u23aa\u23aa\u23aa\u23aa\u23aa\u23ad\n= \u22128 \u23a7\u23aa\u23aa\u23aa\u23a8\u23aa\u23aa\u23aa\u23a9 (1) \u03bc (1) \u03bc A(i, 1)A(i, \u22121) + (2)\u03bc (2) \u03bc A(1, i)A(\u22121, i) + (1)\u03bc (2)\u03bc A(1, i)A(i, \u22121) + (1) \u03bc (2) \u03bc A(\u22121, i)A(i, 1)\n+ (1)\u03bc (2)\u03bc A(1, i)A(i, 1) + (1)\u03bc (2) \u03bc A(\u22121, i)A(i, \u22121) \u23ab\u23aa\u23aa\u23aa\u23ac\u23aa\u23aa\u23aa\u23ad . Comparing this with Eq. (D14), we have\n\u2202\u03bc 11\u2202\u03bc 22 \u2212 \u2202\u03bc 12\u2202\u03bc 21 \u2212 |\u03c3 |(\u2202\u03bc )2\n= \u22124 \u23a7\u23aa\u23aa\u23aa\u23aa\u23aa\u23aa\u23aa\u23aa\u23aa\u23aa\u23aa\u23aa\u23aa\u23aa\u23aa\u23aa\u23aa\u23a8\u23aa\u23aa\u23aa\u23aa\u23aa\u23aa\u23aa\u23aa\u23aa\u23aa\u23aa\u23aa\u23aa\u23aa\u23aa\u23aa\u23aa\u23a9 (1) \u03bc (1) \u03bc A(i, 1)A(i, \u22121) ( eX2 + e\u2212X2)2 + (2)\u03bc (2)\u03bc A(1, i)A(\u22121, i) ( eX1 + e\u2212X1)2 + (1)\u03bc (2)\u03bc A(1, i)A(i, \u22121) ( e X1+X2\u2212i 12 2 + e\u2212 (X1+X2\u2212i 12 )2 )2 + (1)\u03bc (2)\u03bc A(\u22121, i)A(i, 1) ( e X1+X2+i 12 2 + e\u2212 (X1+X2+i 12 )2 )2 \u2212 (1)\u03bc (2)\u03bc A(1, i)A(i, 1) ( e X1\u2212X2\u2212i 12 2 \u2212 e\u2212 (X1\u2212X2\u2212i 12 )2 )2\n\u2212 (1)\u03bc (2) \u03bc A(\u22121, i)A(i, \u22121)\n( e X1\u2212X2+i 12 2 \u2212 e\u2212 (X1\u2212X2+i 12 )2 )2 \u23ab\u23aa\u23aa\u23aa\u23aa\u23aa\u23aa\u23aa\u23aa\u23aa\u23aa\u23aa\u23aa\u23aa\u23aa\u23aa\u23aa\u23aa\u23ac\u23aa\u23aa\u23aa\u23aa\u23aa\u23aa\u23aa\u23aa\u23aa\u23aa\u23aa\u23aa\u23aa\u23aa\u23aa\u23aa\u23aa\u23ad .\nBy Eqs. (23) and (D10), we can conclude that\nTr [ (\u2202\u03bc\u03c3 )\u03c3\u22121 ]2 =\n\u22128 \u23a7\u23aa\u23aa\u23aa\u23aa\u23aa\u23aa\u23aa\u23aa\u23aa\u23aa\u23aa\u23aa\u23aa\u23aa\u23aa\u23aa\u23aa\u23a8\u23aa\u23aa\u23aa\u23aa\u23aa\u23aa\u23aa\u23aa\u23aa\u23aa\u23aa\u23aa\u23aa\u23aa\u23aa\u23aa\u23aa\u23a9 a(1, 1)a(1, \u22121) [ (1) \u03bc (1) \u03bc 11 cosh 2 X2 + (2)\u03bc (2)\u03bc 22 cosh2 X1 ] +a(1, 1)a(i, \u2212i) \u23a1\u23a2\u23a2\u23a2\u23a3 (1) \u03bc (2) \u03bc 12cosh 2 ( X1 + X2 \u2212 i 12 2 ) + (1)\u03bc (2)\u03bc 21 cosh2 ( X1 + X2 + i 12 2 ) \u23a4\u23a5\u23a5\u23a5\u23a6 \u2212a(1, \u22121)a(i, \u2212i) \u23a1\u23a2\u23a2\u23a2\u23a3 (1) \u03bc (2) \u03bc 12 sinh 2 ( X1 \u2212 X2 \u2212 i 12 2 ) + (1)\u03bc (2) \u03bc \u030312 sinh 2 ( X1 \u2212 X2 + i 12 2 ) \u23a4\u23a5\u23a5\u23a5\u23a6 \u23ab\u23aa\u23aa\u23aa\u23aa\u23aa\u23aa\u23aa\u23aa\u23aa\u23aa\u23aa\u23aa\u23aa\u23aa\u23aa\u23aa\u23aa\u23ac\u23aa\u23aa\u23aa\u23aa\u23aa\u23aa\u23aa\u23aa\u23aa\u23aa\u23aa\u23aa\u23aa\u23aa\u23aa\u23aa\u23aa\u23ad[ a(1, 1) cosh(X1 + X2) + a(1, \u22121) cosh(X1 \u2212 X2) + a(i, \u2212i) cos 12\n]2 , where\njk := (\u03bb j \u2212 \u03bck) 2 \u03bb j\u03bck , jk := (\u03bb j \u2212 \u03bbk) 2 \u03bb j\u03bbk , \u0303 jk := (\u03bc j \u2212 \u03bck) 2 \u03bc j\u03bck .\n40/47\nD ow nloaded from https://academ ic.oup.com /ptep/article/2023/4/043B03/7093422 by Indian Institute of Technology Patna user on 18 January 2024\nD.4. Exact calculation of the Wess\u2013Zumino action density (two-soliton) By substituting Eqs. (39), (D7), and (42) into Eq. (25) for (m, n, p) = (\u03bc, \u03bd, \u03c1), we have\nTr [ (\u2202\u03bc\u03c3 )\u03c3\u22121(\u2202\u03bd\u03c3 )\u03c3\u22121(\u2202\u03c1\u03c3 )\u03c3\u22121 ] = 1 2 (B\u03bc\u03bd\u03c1 + B\u03bd\u03c1\u03bc + B\u03c1\u03bc\u03bd ),\nB\u03bc\u03bd\u03c1 := 1|\u03c3 |2 4 (\u2223\u2223\u2223\u2223\u2223 11 22\u2202\u03bc 11 \u2202\u03bc 22 \u2223\u2223\u2223\u2223\u2223 \u2223\u2223\u2223\u2223\u2223 \u2202\u03bd 12 \u2202\u03bd 21\u2202\u03c1 12 \u2202\u03c1 21 \u2223\u2223\u2223\u2223\u2223 + \u2223\u2223\u2223\u2223\u2223 12 21\u2202\u03bc 12 \u2202\u03bc 21 \u2223\u2223\u2223\u2223\u2223 \u2223\u2223\u2223\u2223\u2223 \u2202\u03bd 11 \u2202\u03bd 22\u2202\u03c1 11 \u2202\u03c1 22 \u2223\u2223\u2223\u2223\u2223 ) ,\n(D15)\nwhere\n1 |\u03c3 | 2 \u2223\u2223\u2223\u2223\u2223 11 22\u2202\u03bc 11 \u2202\u03bc 22 \u2223\u2223\u2223\u2223\u2223\n=\n\u2212 \u23a7\u23aa\u23aa\u23aa\u23aa\u23aa\u23aa\u23aa\u23aa\u23aa\u23a8\u23aa\u23aa\u23aa\u23aa\u23aa\u23aa\u23aa\u23aa\u23aa\u23a9 2r(1)\u03bc abD11 cosh(2X2) + 2r(2)\u03bc abD22 cosh(2X1) + [ (r(1)\u03bc + r(2)\u03bc ) + (s(1)\u03bc \u2212 s(2)\u03bc ) ] acD12 cosh(X1 + X2 \u2212 i 12) + [ (r(1)\u03bc + r(2)\u03bc ) \u2212 (s(1)\u03bc \u2212 s(2)\u03bc ) ] acD21 cosh(X1 + X2 + i 12) + [ (r(1)\u03bc \u2212 r(2)\u03bc ) + (s(1)\u03bc \u2212 s(2)\u03bc ) ] bcE12 cosh(X1 \u2212 X2 \u2212 i 12) \u2212 [ (r(1)\u03bc \u2212 r(2)\u03bc ) \u2212 (s(1)\u03bc \u2212 s(2)\u03bc ) ] bcE\u030312 cosh(X1 \u2212 X2 + i 12) \u23ab\u23aa\u23aa\u23aa\u23aa\u23aa\u23aa\u23aa\u23aa\u23aa\u23ac\u23aa\u23aa\u23aa\u23aa\u23aa\u23aa\u23aa\u23aa\u23aa\u23ad \u2212 F\n2 [ a cosh(X1 + X2) + b cosh(X1 \u2212 X2) + c cos 12 ]2 , (D16) 1\n|\u03c3 | 2 \u2223\u2223\u2223\u2223\u2223 12 21\u2202\u03bc 12 \u2202\u03bc 21 \u2223\u2223\u2223\u2223\u2223\n=\n\u2212 \u23a7\u23aa\u23aa\u23aa\u23aa\u23aa\u23aa\u23aa\u23aa\u23aa\u23a8\u23aa\u23aa\u23aa\u23aa\u23aa\u23aa\u23aa\u23aa\u23aa\u23a9 2s(1)\u03bc abd11 cosh(2X2) + 2s(2)\u03bc abd22 cosh(2X1) + [ (r(1)\u03bc \u2212 r(2)\u03bc ) + (s(1)\u03bc + s(2)\u03bc ) ] acd12 cosh(X1 + X2 \u2212 i 12) \u2212 [ (r(1)\u03bc \u2212 r(2)\u03bc ) \u2212 (s(1)\u03bc + s(2)\u03bc ) ] acd21 cosh(X1 + X2 + i 12) + [ (r(1)\u03bc + r(2)\u03bc ) + (s(1)\u03bc + s(2)\u03bc ) ] bce12 cosh(X1 \u2212 X2 \u2212 i 12) \u2212 [ (r(1)\u03bc + r(2)\u03bc ) \u2212 (s(1)\u03bc + s(2)\u03bc ) ] bce\u030312 cosh(X1 \u2212 X2 + i 12) \u23ab\u23aa\u23aa\u23aa\u23aa\u23aa\u23aa\u23aa\u23aa\u23aa\u23ac\u23aa\u23aa\u23aa\u23aa\u23aa\u23aa\u23aa\u23aa\u23aa\u23ad + f\n2 [ a cosh(X1 + X2) + b cosh(X1 \u2212 X2) + c cos 12 ]2 , (D17) 1\n|\u03c3 | 2 \u2223\u2223\u2223\u2223\u2223 \u2202\u03bd 11 \u2202\u03bd 22\u2202\u03c1 11 \u2202\u03c1 22 \u2223\u2223\u2223\u2223\u2223\n=\n\u23a7\u23aa\u23aa\u23aa\u23aa\u23aa\u23aa\u23aa\u23aa\u23aa\u23a8\u23aa\u23aa\u23aa\u23aa\u23aa\u23aa\u23aa\u23aa\u23aa\u23a9 2 [ r(1)\u03bd r (2) \u03c1 \u2212 r(1)\u03c1 r(2)\u03bd ] ab [D11 sinh (2X2) \u2212 D22 sinh (2X1)] \u2212 [ (r(1)\u03bd + r(2)\u03bd )(s(1)\u03c1 \u2212 s(2)\u03c1 ) \u2212 (r(1)\u03c1 + r(2)\u03c1 )(s(1)\u03bd \u2212 s(2)\u03bd ) ] \u00b7 ac [D12 sinh(X1 + X2 \u2212 i 12) \u2212 D21 sinh(X1 + X2 + i 12)] \u2212 [ (r(1)\u03bd \u2212 r(2)\u03bd )(s(1)\u03c1 \u2212 s(2)\u03c1 ) \u2212 (r(1)\u03c1 \u2212 r(2)\u03c1 )(s(1)\u03bd \u2212 s(2)\u03bd ) ] \u00b7\nbc [ E12 sinh(X1 \u2212 X2 \u2212 i 12) + E\u030312 sinh(X1 \u2212 X2 + i 12) ] \u23ab\u23aa\u23aa\u23aa\u23aa\u23aa\u23aa\u23aa\u23aa\u23aa\u23ac\u23aa\u23aa\u23aa\u23aa\u23aa\u23aa\u23aa\u23aa\u23aa\u23ad 2 [ a cosh(X1 + X2) + b cosh(X1 \u2212 X2) + c cos 12\n]2 , (D18)\n41/47\nD ow nloaded from https://academ ic.oup.com /ptep/article/2023/4/043B03/7093422 by Indian Institute of Technology Patna user on 18 January 2024\nTable D1. Summary of coefficients.\nSpace U1 E (Metric) (+, +, \u2212, \u2212) (+, +, +, +) Djk (\u03bb j \u2212 \u03bbk)(\u03bb j + \u03bbk) \u2212(\u03bb j\u03bbk \u2212 1)(\u03bb j\u03bbk + 1)\n\u03bb j\u03bbk \u03bb j\u03bbk\nEjk (\u03bb j \u2212 \u03bbk)(\u03bb j + \u03bbk) (\u03bb j \u2212 \u03bbk)(\u03bb j + \u03bbk) \u03bbj\u03bbk \u03bbj\u03bbk E\u0303jk (\u03bb j \u2212 \u03bbk)(\u03bb j + \u03bbk) \u2212(\u03bb j \u2212 \u03bbk)(\u03bb j + \u03bbk) \u03bb j\u03bbk \u03bb j\u03bbk djk (\u03bb j \u2212 \u03bbk)2 \u2212(\u03bb j\u03bbk + 1)2 \u03bb j\u03bbk \u03bb j\u03bbk ejk (\u03bb j \u2212 \u03bbk)2 (\u03bb j \u2212 \u03bbk)2 \u03bbj\u03bbk \u03bbj\u03bbk e\u0303jk (\u03bb j \u2212 \u03bbk)2 (\u03bb j \u2212 \u03bbk)2 \u03bb j\u03bbk \u03bb j\u03bbk\n1 |\u03c3 | 2 \u2223\u2223\u2223\u2223\u2223 \u2202\u03bd 12 \u2202\u03bd 21\u2202\u03c1 12 \u2202\u03c1 21 \u2223\u2223\u2223\u2223\u2223\n=\n\u23a7\u23aa\u23aa\u23aa\u23aa\u23aa\u23aa\u23aa\u23aa\u23aa\u23aa\u23aa\u23aa\u23a8\u23aa\u23aa\u23aa\u23aa\u23aa\u23aa\u23aa\u23aa\u23aa\u23aa\u23aa\u23aa\u23a9 2 [ (s(1)\u03bd r (2) \u03c1 \u2212 s(1)\u03c1 r(2)\u03bd )abd11 sinh (2X2) \u2212 (r(1)\u03bd s(2)\u03c1 \u2212 r(1)\u03c1 s(2)\u03bd )abd22 sinh (2X1) ] \u2212 [ (r(1)\u03bd + s(2)\u03bd )(s(1)\u03c1 \u2212 r(2)\u03c1 ) \u2212 (r(1)\u03c1 + s(2)\u03c1 )(s(1)\u03bd \u2212 r(2)\u03bd ) ] acd12 sinh(X1 + X2 \u2212 i 12) \u2212 [ (r(1)\u03bd \u2212 s(2)\u03bd )(s(1)\u03c1 + r(2)\u03c1 ) \u2212 (r(1)\u03c1 \u2212 s(2)\u03c1 )(s(1)\u03bd + r(2)\u03bd ) ] acd21 sinh(X1 + X2 + i 12) \u2212 [ (r(1)\u03bd + s(2)\u03bd )(s(1)\u03c1 + r(2)\u03c1 ) \u2212 (r(1)\u03c1 + s(2)\u03c1 )(s(1)\u03bd + r(2)\u03bd ) ] bce12 sinh(X1 \u2212 X2 \u2212 i 12) \u2212 [ (r(1)\u03bd \u2212 s(2)\u03bd )(s(1)\u03c1 \u2212 r(2)\u03c1 ) \u2212 (r(1)\u03c1 \u2212 s(2)\u03c1 )(s(1)\u03bd \u2212 r(2)\u03bd ) ] bce\u030312 sinh(X1 \u2212 X2 + i 12) \u23ab\u23aa\u23aa\u23aa\u23aa\u23aa\u23aa\u23aa\u23aa\u23aa\u23aa\u23aa\u23aa\u23ac\u23aa\u23aa\u23aa\u23aa\u23aa\u23aa\u23aa\u23aa\u23aa\u23aa\u23aa\u23aa\u23ad 2 [ a cosh(X1 + X2) + b cosh(X1 + X2) + c cos 12\n]2 . (D19)\na, b, c are defined in Table 1 and Djk, djk, Ejk, E\u0303jk, ejk are defined in Table D1 for each real space respectively. F and f are some constants. Note that\n(Djk, Ejk) = { (\u2212Dk j, E\u0303jk) on U1(Dk j, \u2212 E\u0303jk) on E , (D20)\n(djk, ejk) = (dk j, e\u0303jk) on U1, E, (D21) which implies that Eqs. (D16)\u2013(D19) are all pure imaginary functions on U1 and hence Eq. (D15) is real-valued on U1. By Eq. (28), the Wess\u2013Zumino term is real-valued on U1. On the other hand, we find that Eqs. (D16), (D18) are real functions and Eqs. (D17), (D19) are pure imaginary functions on E. Therefore, Eq. (D15) is a pure imaginary function on E. This implies that the Wess\u2013Zumino term is real-valued on E because of (cf. Eq. (28))\nLWZ E= \u2212 i\n8\u03c0\n( Tr (\u03b81\u03b83\u03b84) x1 + Tr (\u03b82\u03b83\u03b84) x2 \u2212 Tr (\u03b83\u03b81\u03b82) x3 \u2212 Tr (\u03b84\u03b81\u03b82) x4 ) . (D22)\n42/47\nD ow nloaded from https://academ ic.oup.com /ptep/article/2023/4/043B03/7093422 by Indian Institute of Technology Patna user on 18 January 2024\nFor convenience, to discuss the asymptotic behavior of Eq. (D15), we consider the asymptotic limit {\nX1 is a finite real number|X2| |X1| . (D23)\nBy the same calculation as mentioned in Sect. 4.2, we have\n1 |\u03c3 | 2 \u2223\u2223\u2223\u2223\u2223 11 22\u2202\u03bc 11 \u2202\u03bc 22 \u2223\u2223\u2223\u2223\u2223 |X2| |X1| = \u22122r (1) \u03bc abD11 cosh 2 X2 + O(cosh X2)[ a cosh(X1 + X2) + b cosh(X1 + X2) + O(1)\n]2 = \u22122r (1) \u03bc abD11 + O(sechX2)\n[(a + b) coshX1 + (a \u2212 b) sinhX1tanhX2 + O(sechX2)]2 ,\n1 |\u03c3 | 2 \u2223\u2223\u2223\u2223\u2223 12 21\u2202\u03bc 12 \u2202\u03bc 21 \u2223\u2223\u2223\u2223\u2223 |X2| |X1| = \u22122s (1) \u03bc abd11 cosh 2 X2 + O(cosh X2)[ a cosh(X1 + X2) + b cosh(X1 + X2) + O(1)\n]2 = \u22122s (1) \u03bc abd11 + O(sechX2)\n[(a + b) coshX1 + (a \u2212 b) sinhX1tanhX2 + O(sechX2)]2 ,\n1 |\u03c3 | 2 \u2223\u2223\u2223\u2223\u2223 \u2202\u03bd 11 \u2202\u03bd 22\u2202\u03c1 11 \u2202\u03c1 22 \u2223\u2223\u2223\u2223\u2223 |X2| |X1| = 2 ( r(1)\u03bd r (2) \u03c1 \u2212 r(1)\u03c1 r(2)\u03bd ) abD11 cosh X2 sinh X2 + O(cosh X2)[ a cosh(X1 + X2) + b cosh(X1 + X2) + O(1) ]2\n= 2 ( r(1)\u03bd r (2) \u03c1 \u2212 r(1)\u03c1 r(2)\u03bd ) abD11 tanhX2 + O(sechX2)\n[(a + b) coshX1 + (a \u2212 b) sinhX1tanhX2 + O(sechX2)]2 ,\n1 |\u03c3 | 2 \u2223\u2223\u2223\u2223\u2223 \u2202\u03bd 12 \u2202\u03bd 21\u2202\u03c1 12 \u2202\u03c1 21 \u2223\u2223\u2223\u2223\u2223 |X2| |X1| = 2 ( s(1)\u03bd r (2) \u03c1 \u2212 s(1)\u03c1 r(2)\u03bd ) abd11 cosh X2 sinh X2 + O(cosh X2)[ a cosh(X1 + X2) + b cosh(X1 + X2) + O(1) ]2\n= 2 ( s(1)\u03bd r (2) \u03c1 \u2212 s(1)\u03c1 r(2)\u03bd ) abd11 tanhX2 + O(sechX2)\n[(a + b) coshX1 + (a \u2212 b) sinhX1tanhX2 + O(sechX2)]2 .\nTherefore, for fixed X1 and |X2| |X1|, we can conclude that\nB\u03bc\u03bd\u03c1 |X2| |X1| \u22124a 2b2C\u03bc\u03bd\u03c1 D11d11tanhX2 + O(sechX2) [(a + b) coshX1 + (a \u2212 b) sinhX1tanhX2 + O(sechX2)]4\nX2\u2192\u00b1\u221e\u2212\u2192 \u221332a 2b2C\u03bc\u03bd\u03c1 D11d11\n(aeX1 + beX1 )4 = \u22132C\u03bc\u03bd\u03c1D11d11sech 4(X1 + \u03b41) for fixed X1,\nwhere the phase shift factor is \u03b41 := (1/2) log(a/b). and C\u03bc\u03bd\u03c1 := ( r(1)\u03bc s (1) \u03bd + s(1)\u03bc r(1)\u03bd ) r(2)\u03c1 \u2212(\nr(1)\u03bc s (1) \u03c1 + s(1)\u03bc r(1)\u03c1 ) r(2)\u03bd .\nD.5. Asymptotic form of WZW4 action density (n-soliton) Without loss of generality, we consider one of the asymptotic regions of type RK , which is labeled by (the other cases are equivalent to this one)\n\u03b5 j = {\n+1, j = 1, . . . , K \u2212 1 \u22121, j = K + 1, . . . , n , (D24)\n43/47\nD ow nloaded from https://academ ic.oup.com /ptep/article/2023/4/043B03/7093422 by Indian Institute of Technology Patna user on 18 January 2024\nand define\nX K\u0302 := n\u2211\nj=1, j =K \u03b5 jXj\n(D25)= X1 + \u00b7 \u00b7 \u00b7 + XK\u22121 \u2212 XK+1 + \u00b7 \u00b7 \u00b7 + Xn.\nBy Eqs. (D3), (D4), and (D5), we can conclude that\nRK 2 { a(1, \u03b5K = +1, \u22121) cosh(X K\u0302 + XK ) +a(1, \u03b5K = \u22121, \u22121) cosh(X K\u0302 \u2212 XK ) } + n\u2211 j=1, j =K O ( cosh(X K\u0302 \u2212 \u03b5 jXj ) ) ,\n11 RK \u23a7\u23aa\u23aa\u23aa\u23a8\u23aa\u23aa\u23aa\u23a9 A(1, \u03b5K = +1, \u22121) exp(X K\u0302 + XK ) +A(1, \u03b5K = \u22121, \u22121) exp(X K\u0302 \u2212 XK ) +A(\u22121, \u03b5K = +1, 1) exp(\u2212X K\u0302 + XK ) +A(\u22121, \u03b5K = \u22121, 1) exp(\u2212X K\u0302 \u2212 XK ) \u23ab\u23aa\u23aa\u23aa\u23ac\u23aa\u23aa\u23aa\u23ad + n\u2211 j=1, j =J O ( cosh(X K\u0302 \u2212 \u03b5 jXj ) ) ,\n22 (RK ) = 11 (RK ) \u2223\u2223\u2223 A(\u03b51,...,\u03b5n ) \u2192 A(\u2212\u03b51,...,\u2212\u03b5n ) , (D25)\n12 RK { A(1, \u03b5K = +i, \u22121) exp(X K\u0302 + i K ) +A(\u22121, \u03b5K = +i, 1) exp(\u2212X K\u0302 + i K ) } + n\u2211 j=1, j =K O ( cosh(X K\u0302 \u2212 \u03b5 jXj ) ) ,\n21 (RK ) = 12 (RK ) \u2223\u2223\u2223 (Xj , K ) \u2192 (\u2212Xj ,\u2212 K ) .\n(D26)\nBy Eqs. (D25), (42), and direct calculation, we have the asymptotic form of the NL\u03c3M action density:\nTr [ (\u2202\u03bc\u03c3 )\u03c3\u22121(\u2202\u03bc\u03c3 )\u03c3\u22121 ]\nRK\n\u23a1\u23a2\u23a3 4dKK a(1, \u03b5K = +1, \u22121) cosh(2X K\u0302 )+ n\u2211 j=1, j =K O ( cosh(2X K\u0302 \u2212 \u03b5 jXj ) ) \u23a4\u23a5\u23a6\n\u23a7\u23a8\u23a9 [ a(1, \u03b5K = +1, \u22121) cosh(X K\u0302 + XK ) +a(1, \u03b5K = \u22121, \u22121) cosh(X K\u0302 \u2212 XK ) ] + n\u2211 j=1, j =K O ( cosh(X K\u0302 \u2212 \u03b5 jXj ) )\u23ab\u23ac\u23ad 2\n= 8dKK a(1, \u03b5K = +1, \u22121)a(1, \u03b5K = \u22121, \u22121) +\nn\u2211 j=1, j =K O ( sechXj ) \u23a7\u23aa\u23aa\u23aa\u23aa\u23a8\u23aa\u23aa\u23aa\u23aa\u23a9 [a(1, \u03b5K = +1, \u22121) + a(1, \u03b5K = \u22121, \u22121)] cosh XK + [a(1, \u03b5K = +1, \u22121) \u2212 a(1, \u03b5K = \u22121, \u22121)] tanh X K\u0302 sinh XK + n\u2211 j=1, j =K O ( sechXj ) \u23ab\u23aa\u23aa\u23aa\u23aa\u23ac\u23aa\u23aa\u23aa\u23aa\u23ad 2\nX K\u0302\u2192\u00b1\u221e\u2212\u2192 2dKKsech2(XK \u00b1 \u03b4K ) for fixed real number XK ,\nwhere the phase shift factor is \u03b4K := 12 log [ a(1, \u03b5K = +1, \u22121) a(1, \u03b5K = \u22121, \u22121) ] and dKK is defined in Table 1.\n44/47\nD ow nloaded from https://academ ic.oup.com /ptep/article/2023/4/043B03/7093422 by Indian Institute of Technology Patna user on 18 January 2024\nBy Eqs. (D25), (42), and direct calculation, we have the asymptotic form of the Wess\u2013Zumino action density:\nB\u03bc\u03bd\u03c1 RK\n\u22124AA\u0303C(K )\u03bc\u03bd\u03c1tanhXK\u0302 + n\u2211 j=1, j =K O ( sechXj )\n|\u03c3 |2 \u23a7\u23aa\u23aa\u23aa\u23aa\u23a8\u23aa\u23aa\u23aa\u23aa\u23a9 [a(1, \u03b5K = +1, \u22121) + a(1, \u03b5K = \u22121, \u22121)] cosh XK + [a(1, \u03b5K = +1, \u22121) \u2212 a(1, \u03b5K = \u22121, \u22121)] tanh XK\u0302 sinh XK + n\u2211 j=1, j =K O ( sechXj ) \u23ab\u23aa\u23aa\u23aa\u23aa\u23ac\u23aa\u23aa\u23aa\u23aa\u23ad 4 ,\nwhere C(K )\u03bc\u03bd\u03c1 := ( r(K )\u03bc s (K ) \u03bd + s(K )\u03bc r(K )\u03bd ) r(K\u0302 )\u03c1 \u2212 ( r(K )\u03bc s (K ) \u03c1 + s(K )\u03bc r(K )\u03c1 ) r(K\u0302 )\u03bd ), r (K ) \u03c1 := n\u2211 j=1, j =K \u03b5 j r( j)\u03c1 ,\nand\nA := [\nA(1, \u03b5K = +1, \u22121)A(\u22121, \u03b5K = +1, 1) \u2212A(1, \u03b5K = \u22121, \u22121)A(\u22121, \u03b5K = \u22121, 1)\n] ,\nA\u0303 := A(1, \u03b5K = +i, \u22121)A(\u22121, \u03b5K = +i, 1). By Eq. (59) and the fact that\nC(K )\u03bc\u03bd\u03c1 + C(K )\u03bd\u03c1\u03bc + C(K )\u03c1\u03bc\u03bd = 0, we have\nTr [ (\u2202\u03bc\u03c3 )\u03c3\u22121(\u2202\u03bd\u03c3 )\u03c3\u22121(\u2202\u03c1\u03c3 )\u03c3\u22121 ] \u2212\u2192 0 in the asymptotic region. Therefore, the Wess\u2013Zumino term is asymptotic to zero for the nsoliton case.\nReferences 1 L. J. Mason and N. M. Woodhouse, Integrability, Self-Duality, and Twistor Theory (Oxford Uni-\nversity Press, Oxford, UK, 1996). 2 R. S. Ward, Phil. Trans. R. Soc. Lond. A 315, 451 (1985). 3 Y. Kodama, KP Solitons and the Grassmannians (Springer, Berlin, 2017). 4 V. B. Matveev and M. A. Salle, Darboux Transformations and Solitons (Springer, Berlin, 1991). 5 M. Green, J. Schwarz, and E. Witten, Superstring Theory (Cambridge University Press, Cambridge,\nUK, 1987), Vol. 1. 6 H. Ooguri and C. Vafa, Nucl. Phys. B 361, 469 (1991). 7 H. Ooguri and C. Vafa, Nucl. Phys. B 367, 83 (1991). 8 T. Inami, H. Kanno, and T. Ueno, Mod. Phys. Lett. A 12, 2757 (1997) [arXiv:hep-th/9704010] [Se\narch inSPIRE]. 9 T. Inami, H. Kanno, T. Ueno, and C. S. Xiong, Phys. Lett. B 399, 97 (1997) [arXiv:hep-th/9610187]\n[Search inSPIRE]. 10 A. Losev, G. W. Moore, N. Nekrasov, and S. Shatashvili, Nucl. Phys. B Proc. Suppl. 46, 130 (1996)\n[arXiv:hep-th/9509151] [Search inSPIRE]. 11 V. P. Nair, Kahler-Chen-Simons theory, STRINGS, 479, (World Scientific, 1991) [arXiv:hep-\nth/9110042] [Search inSPIRE]. 12 V. P. Nair and J. Schiff , Phys. Lett. B 246, 423 (1990). 13 A. Parkes, Nucl. Phys. B 376, 279 (1992) [arXiv:hep-th/9110075] [Search inSPIRE]. 14 V. P. Nair and J. Schiff , Nucl. Phys. B 371, 329 (1992). 15 N. Marcus, Nucl. Phys. B 387, 263 (1992) [arXiv:hep-th/9207024] [Search inSPIRE].\n45/47\nD ow nloaded from https://academ ic.oup.com /ptep/article/2023/4/043B03/7093422 by Indian Institute of Technology Patna user on 18 January 2024\n16 N. Marcus, A tour through N=2 strings,String Theory, Quantum Gravity and the Unification of the Fundamental Interactions,391\u2013413 (World Scientific,1993) [arXiv:hep-th/9211059] [Search inSPIR E]. 17 S. C. Huang, On soliton solutions of the anti-self-dual Yang-Mills equations from the perspective of integrable systems, Ph.D. Thesis, Nagoya University (2021) [arXiv:2112.10702 [hep-th]] [Search inSPIRE]. 18 C. R. Gilson, M. Hamanaka, S. C. Huang, and J. J. C. Nimmo, J. Phys. A 53, 404002 (2020) [arXiv:2004.01718 [nlin.SI]] [Search inSPIRE]. 19 J. J. C. Nimmo, C. R. Gilson, and Y. Ohta, Theor. Math. Phys. 122, 239 (2000) [Teor. Mat. Fiz. 122, 284 (2000)]. 20 M. Hamanaka and S. C. Huang, J. High Energy Phys. 2010, 101 (2020) [arXiv:2004.09248 [hep-th]] [Search inSPIRE]. 21 M. Hamanaka and S. C. Huang, J. High Energy Phys. 2201, 039 (2022) [arXiv:2106.01353 [hep-th]] [Search inSPIRE]. 22 S. C. Huang, Proc. East Asia Joint Symp. on Fields and Strings 2021, p. 33 (2022) [arXiv:2201.13318 [hep-th]] [Search inSPIRE]. 23 S. K. Donaldson, Proc. Lond. Math. Soc. 3, 1 (1985). 24 H. J. de Vega, Commun. Math. Phys. 116, 659 (1988). 25 Y. Kodama, Solitons in Two-Dimensional Shallow Water (SIAM, Philadelphia, PA, 2018). 26 K. Ohkuma and M. Wadati, J. Phys. Soc. Jpn. 52, 749 (1983). 27 R. Ward , Soliton solutions in an integrable chiral model in 2+1 dimensions, J. Math. Phys. 29, 386\n(1988)https://aip.scitation.org/doi/10.1063/1.528078 28 B. Dai, C.-L. Terng, and K. Uhlenbeck, On the space-time monopole equation, in Surveys in\nDifferential Geometry (International Press, Somerville, MA, 2005), Vol. 10 [arXiv:math/0602607][ Search inSPIRE]. 29 D. Gluck, Y. Oz, and T. Sakai, J. High Energy Phys. 0308, 055 (2003) [arXiv:hep-th/0306112] [Sear ch inSPIRE]. 30 L. L. Chau, M. L. Ge, A. Sinha, and Y. S. Wu, Phys. Lett. B 121, 391 (1983). 31 L. Dolan, Phys. Lett. B 113, 387 (1982). 32 T. A. Ivanova and O. Lechtenfeld, Int. J. Mod. Phys. A 16, 303 (2001) [arXiv:hep-th/0007049] [Sear\nch inSPIRE]. 33 Y. Kodama and L. Williams, Invent. Math. 198, 637 (2014) [arXiv:1106.0023 [math.CO]] [Search in\nSPIRE]. 34 M. Hamanaka, Nucl. Phys. B 741, 368 (2006) [arXiv:hep-th/0601209] [Search inSPIRE]. 35 M. Hamanaka and K. Toda, Phys. Lett. A 316, 77 (2003) [arXiv:hep-th/0211148] [Search inSPIRE].\n36 O. Lechtenfeld, A. D. Popov, and B. Spendig, J. High Energy Phys. 0106, 011 (2001) [arXiv:hepth/010396] [Search inSPIRE]. 37 N. Seiberg and E. Witten, J. High Energy Phys. 9909, 032 (1999) [arXiv:hep-th/9908142] [Search in SPIRE]. 38 N. Nekrasov and A. Schwarz, Commun. Math. Phys. 198, 689 (1998) [arXiv:hep-th/9802068] [Sear ch inSPIRE]. 39 K. Ohmori, A review on tachyon condensation in open string field theories, Master thesis, University of Tokyo (2001) [arXiv:hep-th/0102085] [Search inSPIRE]. 40 J. A. Harvey, P. Kraus, and F. Larsen, J. High Energy Phys. 0012, 024 (2000) [arXiv:hep-th/0010060] [Search inSPIRE]. 41 E. Witten, Commun. Math. Phys. 252, 189 (2004) [arXiv:hep-th/0312171] [Search inSPIRE]. 42 R. Bittleston and D. Skinner, JHEP 02,227 (2023) [arXiv:2011.04638 [hep-th]] [Search inSPIRE]. 43 K. Costello and M. Yamazaki, [arXiv:1908.02289 [hep-th]] [Search inSPIRE]. 44 M. Sato, RIMSKokyuroku, (1981); M. Sato and Y. Sato, Soliton equations as dynamical systems on\ninfinite dimensional Grassmann manifold, in Nonlinear Partial Differential Equations in Applied Sciences (North-Holland, Amsterdam, 1983), p. 439, 259.\n45 A. Neitzke and C. Vafa, [arXiv:hep-th/0402128][Search inSPIRE]. 46 I. Gelfand and V. Retakh, Funct. Anal. Appl. 25, 91 (1991). 47 I. Gelfand and V. Retakh, Funct. Anal. Appl. 26, 231 (1992).\n46/47\nD ow nloaded from https://academ ic.oup.com /ptep/article/2023/4/043B03/7093422 by Indian Institute of Technology Patna user on 18 January 2024\n48 I. Gelfand, S. Gelfand, V. Retakh, and R. Wilson, Adv. Math. 193, 56 (2005) [arXiv:math.QA/0208146] [Search inSPIRE]. 49 C. R. Gilson and J. J. C. Nimmo, J. Phys. A 40, 3839 (2007) [arXiv:nlin.si/0701027] [Search inSPIRE].\n47/47\nD ow nloaded from https://academ ic.oup.com /ptep/article/2023/4/043B03/7093422 by Indian Institute of Technology Patna user on 18 January 2024"
        }
    ],
    "title": "Solitons in open N = 2 string theory",
    "year": 2023
}