{
    "abstractText": "This paper studies the monotone mean-variance (MMV) problem and the classical meanvariance (MV) problem with convex cone trading constraints in a market with random coefficients. We provide semiclosed optimal strategies and optimal values for both problems via certain backward stochastic differential equations (BSDEs). After noting the links between these BSDEs, we find that the two problems share the same optimal portfolio and optimal value. This generalizes the result of Shen and Zou [ SIAM J. Financial Math., 13 (2022), pp. SC99-SC112] from deterministic coefficients to random ones.",
    "authors": [
        {
            "affiliations": [],
            "name": "Ying Hu"
        },
        {
            "affiliations": [],
            "name": "Xiaomin Shi"
        },
        {
            "affiliations": [],
            "name": "Zuo Quan Xu"
        }
    ],
    "id": "SP:2aecdb0a8720d7ddd85a2c6a048a977247c54696",
    "references": [
        {
            "authors": [
                "A. Beck"
            ],
            "title": "Introduction to nonlinear optimization: Theory, algorithms, and applications with MATLAB. Society for Industrial and Applied Mathematics, Philadelphia2014",
            "year": 2014
        },
        {
            "authors": [
                "A. C\u0306ern\u00fd"
            ],
            "title": "Semimartingale theory of monotone mean-variance portfolio allocation",
            "venue": "Math. Finance,",
            "year": 2020
        },
        {
            "authors": [
                "A C\u0306ern\u00fd",
                "F Maccheroni",
                "M Marinacci",
                "A. Rustichini"
            ],
            "title": "On the computation of optimal monotone mean-variance portfolios via truncated quadratic utility",
            "venue": "J. Math. Econom.,",
            "year": 2012
        },
        {
            "authors": [
                "Du J",
                "Strub MS"
            ],
            "title": "Monotone and Classical Mean-Variance Preferences Coincide When Asset Prices are Continuous",
            "venue": "SSRN preprint,",
            "year": 2023
        },
        {
            "authors": [
                "Y Hu",
                "X Shi",
                "Q. Xu Z"
            ],
            "title": "Constrained stochastic LQ control with regime switching and application to portfolio selection",
            "venue": "Ann. Appl. Probab., 2022,",
            "year": 2022
        },
        {
            "authors": [
                "Y Hu",
                "X. Zhou"
            ],
            "title": "Constrained stochastic LQ control with random coefficients, and application to portfolio selection",
            "venue": "SIAM J. Control Optim.,",
            "year": 2005
        },
        {
            "authors": [
                "G. Luenberger D"
            ],
            "title": "Optimization by vector space methods",
            "year": 1997
        },
        {
            "authors": [
                "F Maccheroni",
                "M Marinacci",
                "A Rustichini",
                "M. Taboga"
            ],
            "title": "Portfolio selection with monotone meanvariance",
            "venue": "preferences. Math. Finance,",
            "year": 2009
        },
        {
            "authors": [
                "S Strub M",
                "D. Li"
            ],
            "title": "A note on monotone mean-variance preferences for continuous processes",
            "venue": "Oper. Res. Lett., 2020,",
            "year": 2020
        },
        {
            "authors": [
                "J Trybu la",
                "D. Zawisza"
            ],
            "title": "Continuous-time portfolio choice under monotone mean-variance preferences-stochastic factor case",
            "venue": "Math. Oper. Res.,",
            "year": 2019
        },
        {
            "authors": [
                "Y Zhou X",
                "D. Li"
            ],
            "title": "Continuous-time mean-variance portfolio selection: A stochastic LQ framework",
            "venue": "Appl. Math. Optim.,",
            "year": 2000
        }
    ],
    "sections": [
        {
            "text": "ar X\niv :2\n21 2.\n14 18\n8v 3\n[ q-\nfi n.\nM F]\n2 4\nA ug\n2 02\n3\nConstrained monotone mean-variance problem with random\ncoefficients\nYing Hu \u2217 Xiaomin Shi\u2020 Zuo Quan Xu\u2021\nAugust 25, 2023\nThis paper studies the monotone mean-variance (MMV) problem and the classical meanvariance (MV) problem with convex cone trading constraints in a market with random coefficients. We provide semiclosed optimal strategies and optimal values for both problems via certain backward stochastic differential equations (BSDEs). After noting the links between these BSDEs, we find that the two problems share the same optimal portfolio and optimal value. This generalizes the result of Shen and Zou [ SIAM J. Financial Math., 13 (2022), pp. SC99-SC112] from deterministic coefficients to random ones.\nKey words. monotone mean-variance, cone constraints, random coefficients, robust control\nMathematics Subject Classification (2020) 91B16 93E20 60H30 91G10\n1 Introduction\nThe mean-variance (MV) portfolio selection theory, pioneered by Markowitz [10] in a single-period setting, has become a cornerstone in modern finance theory. Zhou and Li [14] study the MV problem in a continuous-time setting using the embedding technique and the well-developed stochastic linear-quadratic (LQ) control theory. Although the MV model is a Nobel-Prize-winning work, the feature of its non-monotonicity brings troublesome in development because monotonicity is one of most compelling principles of economic rationality. To overcome the major drawback, Maccheroni et al. [9] propose and solve, in a single-period setting, the monotone mean-variance (MMV) model in which the objective functional is the best approximation of the MV functional among those which are monotone. C\u0306erny\u0301 et al. [3] connect the MMV portfolio selection problem to optimization of truncated quadratic utility. Trybu la and Zawisza [13] consider the MMV problem in a stochastic factor model, hence an incomplete market. By applying the Hamilton-Jacobi-BellmanIsaacs (HJBI) equations approach, they obtain the optimal investment strategy and the optimal\n\u2217Univ Rennes, CNRS, IRMAR-UMR 6625, F-35000 Rennes, France. Partially supported by Lebesgue Center of Mathematics \u201cInvestissements d\u2019avenir\u201dprogram-ANR-11-LABX-0020-01. Email: ying.hu@univ-rennes1.fr \u2020School of Statistics and Mathematics, Shandong University of Finance and Economics, Jinan 250100, China. Partially supported by NSFC (No. 11801315), NSF of Shandong Province (No. ZR2018QA001). Email: shixm@mail.sdu.edu.cn \u2021Department of Applied Mathematics, The Hong Kong Polytechnic University, Kowloon, Hong Kong. Partially supported by NSFC (No. 11971409), Hong Kong RGC (GRF 15202421 and 15204622), the PolyU-SDU Joint Research Center on Financial Mathematics, the CAS AMSS-PolyU Joint Laboratory of Applied Mathematics, the Research Centre for Quantitative Finance (1-CE03), and the Hong Kong Polytechnic University. Email: maxu@polyu.edu.hk\nvalue which coincide with that for the classical MV problem. Later, when the underlying asset prices are continuous, Strub and Li [12] prove that the terminal wealth levels corresponding to the optimal portfolio strategies for both the MMV and the MV problems will drop in the domain of the monotonicity of the classical MV functional. This, with earlier results in [9], leads to the conclusion that the optimal strategies for the MMV and the MV problems always coincide when the portfolios are unconstrained and the underlying asset prices are continuous. With conic convex constraints on the portfolios, Shen and Zou [11] solve the MMV and the MV problems successively by means of the HJBI equation approach, and find that the optimal strategies to both problems coincide. Please refer to [11] for a more detailed review of the MMV problems and their links with the classical MV problems, and to C\u0306erny\u0301 [2] for a new characterization of the MMV model.\nThis paper aims to generalize [11] to a diffusion model with random coefficients (including excess return rates and volatility rate) and cone trading constraints. We follow the same direction as [11] and [13], i.e. first solving the MMV and the MV problems, and then comparing their optimal portfolios and optimal values to see whether they coincide. A strong motivation for taking this direction is the statement \u201cIt is certainly possible to consider problems in a more general setting, but explicit solutions are likely unavailable...\u201d in [11, the footnote of page SC101]. In fact, the MMV problem is a robust control (optimization) problem which barely has an explicit solution compared with the MV problem. Fortunately, we firstly guess an optimal portfolio candidate, via a heuristic argument, by means of a specific backward stochastic differential equations (BSDE) and then prove a verification theorem rigorously. Along this line, we eventually provide a semiclosed solution for the constrained MMV problem with random coefficients. This is the main mathematical contribution of this paper. As for the constrained MV problem with random coefficients, Hu and Zhou [6] give the solution in a slightly different setting of minimizing a portfolio\u2019s variance subject to the constraint that its expected return equals a prescribed level. Therefore, in this paper, we need to generalize a little bit from some results in [6] to solve the present MV problem besides some tedious calculations to get the extreme values of certain deterministic quadratic functions. In the end, after noticing the links between two related BSDEs, the coincidence of the optimal portfolios and optimal values in the MMV and the MV problems is achieved.\nThe rest part of this paper is organized as follows. In Section 2, we present the financial market and formulate the constrained MMV problem with random coefficients. In Section 3, we derive heuristically the BSDEs and the optimal candidate. Section 4 provides a rigorous verification for the optimal strategies and optimal value. In Section 5, we solve the constrained MV problem with random coefficients and make a comparison with the MMV problem. Some concluding remarks are given in Section 6.\n2 Problem formulation\nLet (\u2126,F ,P) be a fixed complete probability space on which is defined a standard n-dimensional Brownian motion Wt = (W1,t, . . . ,Wn,t) \u2032. Define the filtration Ft = \u03c3{Ws : 0 6 s 6 t} \u2228 N , where N is the totality of all the P-null sets of F .\nLet Rm be the set of m-dimensional column vectors, let Rm+ be its subset of vectors whose components are nonnegative, and let Rm\u00d7n be the set of m \u00d7 n real matrices. We denote the transpose of M by M \u2032, and the norm by |M | = \u221a trace(MM \u2032). Let Sn be the set of symmetric\nn\u00d7n real matrices. We write M > (resp., >) 0 for any positive definite (resp., positive semidefinite) matrix M \u2208 Sn. We write A > (>) B if A,B \u2208 Sn and A\u2212B > (>) 0.\nDefine the following spaces:\nL0F (0, T ;R) = { \u03d5 : [0, T ] \u00d7 \u2126 \u2192 R \u2223 \u2223 \u2223 \u03d5 is an {Ft}t>0-predictable process } ,\nL2F (0, T ;R) = { \u03d5 \u2208 L0F (0, T ;R) \u2223 \u2223 \u2223 E\n\u222b T\n0 |\u03d5t|\n2dt < \u221e } ,\nL\u221eF (0, T ;R) = { \u03d5 \u2208 L0F (0, T ;R) \u2223 \u2223 \u2223 \u03d5 is essentially bounded } .\nConsider a financial market consisting of a risk-free asset (the money market instrument or bond) whose price is S0 and m risky securities (the stocks) whose prices are S1, . . . , Sm. And assume m 6 n, i.e., the number of risky securities is no more than the dimension of the Brownian motion. The asset prices Sk, k = 0, 1, . . . ,m, are driven by SDEs:\n{\ndS0,t = rtS0,tdt,\nS0,0 = s0,\nand \n \n \ndSk,t = Sk,t\n( (\u00b5k,t + rt)dt + n \u2211\nj=1 \u03c3kj,tdWj,t\n)\n,\nSk,0 = sk,\nwhere, for every k = 1, . . . ,m, r is the interest rate process and \u00b5k and \u03c3k := (\u03c3k1, . . . , \u03c3kn) are the mean excess return rate process and volatility rate process of the kth risky security.\nDefine the mean excess return vector \u00b5 = (\u00b51, . . . , \u00b5m) \u2032 and volatility matrix\n\u03c3 =\n\n    \n\u03c31 ...\n\u03c3m\n\n     \u2261 (\u03c3kj)m\u00d7n.\nThroughout this paper, we assume the interest rate r is a bounded deterministic function of t,\n\u00b5 \u2208 L\u221eF (0, T ;R m), \u03c3 \u2208 L\u221eF (0, T ;R m\u00d7n).\nAlso, there exists a constant \u03b4 > 0 such that \u03c3\u03c3\u2032 > \u03b4Im for a.e. t \u2208 [0, T ], where Im denotes the m-dimensional identity matrix. In particular, \u03c3\u03c6 = \u00b5, where\n\u03c6 = \u03c3\u2032(\u03c3\u03c3\u2032)\u22121\u00b5 (2.1)\nis called the pricing kernel of the market.\nConsider a small investor (\u201cHe\u201d) whose actions cannot affect the asset prices. He will decide at every time t \u2208 [0, T ] the amount \u03c0j,t of his wealth to invest in the jth risky asset, j = 1, . . . ,m. The vector process \u03c0 := (\u03c01, . . . , \u03c0m) \u2032 is called a portfolio of the investor. Then the investor\u2019s\nself-financing wealth process X corresponding to a portfolio \u03c0 is the unique strong solution of the SDE:\n{\ndXt = (rtXt + \u03c0 \u2032 t\u00b5t)dt + \u03c0 \u2032 t\u03c3tdWt, X0 = x. (2.2)\nLet \u0393 \u2286 Rm be a given closed convex cone; i.e., \u0393 is closed and convex, and if u \u2208 \u0393, then \u03bbu \u2208 \u0393 for all real \u03bb > 0.1 It stands for the constraint set for portfolios. The class of admissible portfolios is defined as the set\n\u03a0 := {\n\u03c0 \u2208 L2F (0, T ;R m)\n\u2223 \u2223 \u2223 \u03c0 \u2208 \u0393, a.e. a.s. } .\nAnd we will denote by X\u03c0 the wealth process (2.2) whenever it is necessary to indicate its dependence on \u03c0 \u2208 \u03a0.\nFor (t, \u03c9) \u2208 [0, T ] \u00d7 \u2126, define the set \u03c3t(\u03c9) \u2032\u0393 \u2286 Rn by\n\u03c3t(\u03c9) \u2032\u0393 =\n{\n\u03c3t(\u03c9) \u2032\u03c0\n\u2223 \u2223 \u03c0 \u2208 \u0393 } .\nFor every (t, \u03c9), the set \u03c3t(\u03c9) \u2032\u0393 is a closed convex cone.\nFor any process \u03b7 \u2208 L0F (0, T ;R n) such that\n\u039b\u03b7t := E(\n\u222b t\n0 \u03b7\u2032dW ) (2.3)\nis a martingale, define P\u03b7 by\ndP\u03b7\ndP\n\u2223 \u2223 \u2223 \u2223\nFt\n= \u039b\u03b7t . (2.4)\nBy Girsanov\u2019s theorem,\nW \u03b7t := Wt \u2212\n\u222b t\n0 \u03b7sds (2.5)\nis a Brownian motion under P\u03b7. Denote\nA := {\n\u03b7 \u2208 L0F (0, T ;R m)\n\u2223 \u2223 \u2223 E[\u039b \u03b7 t ] = 1 and E[(\u039b \u03b7 t ) 2] < \u221e for all t \u2208 [0, T ] } .\nIn this paper, we first solve the following MMV problem:\nsup \u03c0\u2208\u03a0 inf \u03b7\u2208A\nE P\u03b7 [ XT + 1\n2\u03b8 (\u039b\u03b7T \u2212 1)\n]\n, (2.6)\nwhere \u03b8 is a given positive constant.\n1The cone constraint in [5, section 5] shall also be convex cone constraint, for otherwise the dual method may not\nwork.\n3 Optimal candidate: a heuristic derivation\nIn order to solve the problem (2.6), we hope, via a heuristic argument, to find a family of stochastic process R(\u03b7,\u03c0) and a pair (\u03b7\u0302, \u03c0\u0302) with the following properties:\n1. R (\u03b7,\u03c0) T = XT + 1 2\u03b8 (\u039b \u03b7 T \u2212 1) for all (\u03b7, \u03c0) \u2208 A\u00d7 \u03a0.\n2. R (\u03b7,\u03c0) 0 = R0 is constant for all (\u03b7, \u03c0) \u2208 A\u00d7 \u03a0. 3. EP \u03b7\u0302 [\nX\u03c0T + 1 2\u03b8 (\u039b \u03b7\u0302 T \u2212 1)\n]\n6 R0 for all \u03c0 \u2208 \u03a0.\n4. EP \u03b7 [\nX \u03c0\u0302T + 1 2\u03b8 (\u039b \u03b7 T \u2212 1)\n]\n> R0 for all \u03b7 \u2208 A.\n5. EP \u03b7\u0302 [\nX \u03c0\u0302T + 1 2\u03b8 (\u039b \u03b7\u0302 T \u2212 1)\n]\n= R0.\nOnce this is done, we will then rigorously show that (\u03b7\u0302, \u03c0\u0302) is an optimal solution for the problem (2.6) and R0 is its optimal value.\nTo derive the above family, we let\nR (\u03b7,\u03c0) t = X \u03c0 t ht +\n1\n2\u03b8 (\u039b\u03b7t Yt \u2212 1), t \u2208 [0, T ], (\u03b7, \u03c0) \u2208 A\u00d7 \u03a0,\nwhere \u039b\u03b7t is defined by (2.3); (Y,Z) satisfies some BSDE\n{\ndY = \u2212fdt + Z \u2032tdW, YT = 1, Y > 0, (3.1)\nand (h,L) satisfies some BSDE\n{\ndh = \u2212gdt + L\u2032tdW, hT = 1. (3.2)\nOur aim reduces to finding proper drivers f and g, which are independent of (\u03b7, \u03c0), for the above two BSDEs. Notice the first property is already satisfied by the choice of boundary conditions given above.\nRecalling (2.5), in terms of W \u03b7, we have\n{\ndY = (\u2212f + Z \u2032\u03b7)dt + Z \u2032dW \u03b7,\nYT = 1, Y > 0,\nand\n{\ndh = (\u2212g + L\u2032\u03b7)dt + L\u2032dW \u03b7,\nhT = 1.\nApplying Ito\u0302\u2019s formula to Xtht and \u039btYt, we have\nd(Xh) = [rhX \u2212 gX + L\u2032\u03b7X + \u03c0\u2032(h\u00b5 + h\u03c3\u03b7 + \u03c3L)]dt + (\u00b7 \u00b7 \u00b7 )dW \u03b7,\nand\nd(\u039bY ) = [\u039bY |\u03b7|2 + 2\u039b\u03b7\u2032Z \u2212 \u039bf ]dt + (\u00b7 \u00b7 \u00b7 )dW \u03b7.\nCombining the above two equations, we obtain\ndR(\u03b7,\u03c0) = [ 1\n2\u03b8 \u039bY |\u03b7|2 +\n1 \u03b8 \u039b\u03b7\u2032Z + h\u03b7\u2032\u03c3\u2032\u03c0 + X\u03b7\u2032L + (rh\u2212 g)X + \u03c0\u2032(h\u00b5 + \u03c3L) \u2212 1 2\u03b8 \u039bf ] dt\n+ (\u00b7 \u00b7 \u00b7 )dW \u03b7.\nTaking g := rh, and noting that r is a deterministic function of t, we obtain the solution of (3.2):\nht = e \u222b T t rsds, Lt = 0, t \u2208 [0, T ]. (3.3)\nThis in particular implies that\nR (\u03b7,\u03c0) 0 = X \u03c0 0 h0 +\n1\n2\u03b8 (\u039b\u03b70Y0 \u2212 1) = xh0 +\n1\n2\u03b8 (Y0 \u2212 1) := R0\nis a constant for all (\u03b7, \u03c0). So the second property follows.\nSince Y > 0,\ndR(\u03b7,\u03c0) = [ 1\n2\u03b8 \u039bY |\u03b7|2 +\n1 \u03b8 \u039b\u03b7\u2032Z + h\u03b7\u2032\u03c3\u2032\u03c0 + h\u03c0\u2032\u00b5\u2212 1 2\u03b8 \u039bf ] dt + (\u00b7 \u00b7 \u00b7 )dW \u03b7\n= [\u039bY\n2\u03b8\n\u2223 \u2223 \u2223 \u03b7 + \u03b8\n\u039bY\n(1\n\u03b8 \u039bZ + h\u03c3\u2032\u03c0\n)\u2223\n\u2223 \u2223 2 \u2212 \u039bY\n2\u03b8\n\u03b82\n\u039b2Y 2\n\u2223 \u2223 \u2223 1\n\u03b8 \u039bZ + h\u03c3\u2032\u03c0\n\u2223 \u2223 \u2223 2 + h\u03c0\u2032\u00b5\u2212 1\n2\u03b8 \u039bf\n]\ndt\n+ (\u00b7 \u00b7 \u00b7 )dW \u03b7.\nIntegrating from 0 to T and taking expectation EP \u03b7 , we have\nE P \u03b7 [R (\u03b7,\u03c0) T ] = R0 + E P \u03b7\n\u222b T\n0\n\u039b 2\u03b8\n{\nY \u2223 \u2223 \u2223 \u03b7 + 1\nY\n( Z + \u03b8\n\u039b h\u03c3\u2032\u03c0\n)\u2223\n\u2223 \u2223\n2\n\u2212 [ f + 1\nY\n\u2223 \u2223 \u2223Z + \u03b8\n\u039b h\u03c3\u2032\u03c0\n\u2223 \u2223 \u2223 2 \u2212 2\u03b8\n\u039b h\u03c0\u2032\u03c3\u03c6\n]\n}\nds (3.4)\non recalling that \u03c6 is the pricing kernel, defined by (2.1).\nTo fulfill the third, fourth and fifth properties, since \u03b8,\u039b > 0, it suffices to find f , \u03c0\u0302, and \u03b7\u0302 such\nthat\nY \u2223 \u2223 \u2223\u03b7\u0302 + 1\nY\n( Z + \u03b8\n\u039b h\u03c3\u2032\u03c0\n)\u2223\n\u2223 \u2223 2 \u2212 [ f + 1\nY\n\u2223 \u2223 \u2223Z + \u03b8\n\u039b h\u03c3\u2032\u03c0\n\u2223 \u2223 \u2223 2 \u2212 2\u03b8\n\u039b h\u03c0\u2032\u03c3\u03c6\n]\n6 0 (3.5)\nfor all \u03c0 \u2208 \u03a0;\nY \u2223 \u2223 \u2223\u03b7 + 1\nY\n( Z + \u03b8\n\u039b h\u03c3\u2032\u03c0\u0302\n)\u2223\n\u2223 \u2223 2 \u2212 [ f + 1\nY\n\u2223 \u2223 \u2223Z + \u03b8\n\u039b h\u03c3\u2032\u03c0\u0302\n\u2223 \u2223 \u2223 2 \u2212 2\u03b8\n\u039b h\u03c0\u0302\u2032\u03c3\u03c6\n]\n> 0\nfor all \u03b7 \u2208 A; and\nY \u2223 \u2223 \u2223\u03b7\u0302 + 1\nY\n( Z + \u03b8\n\u039b h\u03c3\u2032\u03c0\u0302\n)\u2223\n\u2223 \u2223 2 \u2212 [ f + 1\nY\n\u2223 \u2223 \u2223Z + \u03b8\n\u039b h\u03c3\u2032\u03c0\u0302\n\u2223 \u2223 \u2223 2 \u2212 2\u03b8\n\u039b h\u03c0\u0302\u2032\u03c3\u03c6\n]\n= 0.\nThese motivate us to conjecture the following:\n\u03b7\u0302 = \u2212 1\nY\n( Z + \u03b8\n\u039b\u03b7\u0302 h\u03c3\u2032\u03c0\u0302\n)\n, (3.6)\nand\nf = \u2212 1\nY\n\u2223 \u2223 \u2223Z + \u03b8\n\u039b\u03b7\u0302 h\u03c3\u2032\u03c0\u0302\n\u2223 \u2223 \u2223 2 + 2\u03b8\n\u039b\u03b7\u0302 h\u03c0\u0302\u2032\u03c3\u03c6. (3.7)\nTo find a proper \u03c0\u0302, taking the above two expressions into (3.5), we get\nY \u2223 \u2223 \u2223\u2212 1\nY\n( Z + \u03b8\n\u039b h\u03c3\u2032\u03c0\u0302\n) + 1\nY\n( Z + \u03b8\n\u039b h\u03c3\u2032\u03c0\n)\u2223\n\u2223 \u2223\n2\n6 \u2212 1\nY\n\u2223 \u2223 \u2223 Z + \u03b8\n\u039b h\u03c3\u2032\u03c0\u0302\n\u2223 \u2223 \u2223 2 + 2\u03b8\n\u039b h\u03c0\u0302\u2032\u03c3\u03c6 +\n1 Y\n\u2223 \u2223 \u2223 Z + \u03b8\n\u039b h\u03c3\u2032\u03c0\n\u2223 \u2223 \u2223 2 \u2212 2\u03b8\n\u039b h\u03c0\u2032\u03c3\u03c6. (3.8)\nWrite u = \u03b8\u039bh\u03c3 \u2032\u03c0 and \u03be = \u03b8\u039bh\u03c3 \u2032\u03c0\u0302; then the above reads\n\u2223 \u2223u\u2212 \u03be \u2223 \u2223 2 + \u2223 \u2223Z + \u03be \u2223 \u2223 2 \u2212 \u2223 \u2223Z + u \u2223 \u2223 2 \u2212 2Y \u03c6\u2032\u03be + 2Y \u03c6\u2032u 6 0,\nnamely,\n(Y \u03c6\u2212 Z \u2212 \u03be)\u2032(u\u2212 \u03be) 6 0. (3.9)\nBecause \u03b8, \u039b, h > 0 and \u0393 is a cone, we see \u03c0 \u2208 \u0393 if and only if u \u2208 \u03c3\u2032\u0393.\nThe following lemma is the second projection theorem; see, e.g., [1, Theorem 9.8].\nLemma 3.1 Suppose \u03be \u2208 \u03c3\u2032\u0393. Then the inequality (3.9) holds for all u \u2208 \u03c3\u2032\u0393 if and only if\n\u03be = Proj\u03c3\u2032\u0393(\u03c6Y \u2212 Z). (3.10)\nHere, ProjC(a) denotes the projection of a to a closed convex set C, which is uniquely determined by\n|a\u2212 ProjC(a)| = min b\u2208C |a\u2212 b|.\nConsequently,\nf = \u2212 1\nY\n\u2223 \u2223 \u2223Z + \u03b8\n\u039b h\u03c3\u2032\u03c0\u0302\n\u2223 \u2223 \u2223 2 + 2\u03b8\n\u039b h\u03c0\u0302\u2032\u03c3\u03c6 (3.11)\n= \u2212 1\nY\n\u2223 \u2223 \u2223 Z + Proj\u03c3\u2032\u0393(Y \u03c6\u2212 Z) \u2223 \u2223 \u2223 2 + 2\u03c6\u2032Proj\u03c3\u2032\u0393(Y \u03c6\u2212 Z).\nOverall, we conjecture that\nf = \u2212 1\nY\n\u2223 \u2223 \u2223Z + Proj\u03c3\u2032\u0393(Y \u03c6\u2212 Z) \u2223 \u2223 \u2223 2 + 2\u03c6\u2032Proj\u03c3\u2032\u0393(Y \u03c6\u2212 Z), (3.12)\n\u03c0\u0302 = \u039b\u03b7\u0302\nh\u03b8 (\u03c3\u03c3\u2032)\u22121\u03c3Proj\u03c3\u2032\u0393(Y \u03c6\u2212 Z), (3.13)\n\u03b7\u0302 = \u2212 1\nY\n( Z + Proj\u03c3\u2032\u0393(Y \u03c6\u2212 Z) ) . (3.14)\nLet f be defined by (3.12) and \u03be by (3.10); then\nf = \u2212 1\nY\n\u2223 \u2223Z + \u03be \u2223 \u2223 2 + 2\u03c6\u2032\u03be\n= \u2212 1\nY |\u03be|2 +\n2 Y (\u03c6Y \u2212 Z)\u2032\u03be \u2212 1 Y |Z|2\n= \u2212 1\nY\n\u2223 \u2223 \u2223 \u03be \u2212 (\u03c6Y \u2212 Z) \u2223 \u2223 \u2223 2 + 1\nY |\u03c6Y \u2212 Z|2 \u2212\n1 Y |Z|2\n= \u2212 1\nY inf \u03c0\u2208\u0393\n\u2223 \u2223 \u2223\u03c3\u2032\u03c0 \u2212 (\u03c6Y \u2212 Z) \u2223 \u2223 \u2223 2 + 1\nY |\u03c6Y \u2212 Z|2 \u2212\n1 Y |Z|2\n= \u2212 1\nY inf \u03c0\u2208\u0393\n[ \u03c0\u2032\u03c3\u03c3\u2032\u03c0 \u2212 2\u03c0\u2032\u03c3(\u03c6Y \u2212 Z) ] \u2212 1\nY |Z|2 (3.15)\nSo the desired BSDE (3.1) is\n \n\ndY = [\n1 Y inf\u03c0\u2208\u0393\n[ \u03c0\u2032\u03c3\u03c3\u2032\u03c0 \u2212 2\u03c0\u2032\u03c3(\u03c6Y \u2212 Z) ]\n+ 1 Y |Z|2\n]\ndt + Z \u2032dW,\nYT = 1, Y > 0. (3.16)\n4 Solution\nDefinition 4.1 A pair (Y,Z) is called a solution to the BSDE (3.16) if it satisfies (3.16) and (Y,Z) \u2208 L\u221e FW (0, T ;R) \u00d7 L2 F (0, T ;Rm). The solution is called uniformly positive if Y > \u03b4 for all t \u2208 [0, T ], a.s. with some deterministic constant \u03b4 > 0.\nTheorem 4.2 There exists a unique uniformly positive solution (Y,Z) to the BSDE (3.16).\nProof: Consider \n\n\ndP = \u2212 inf \u03c0\u2208\u0393\n[ P\u03c0\u2032\u03c3\u03c3\u2032\u03c0 \u2212 2\u03c0\u2032(P\u00b5 + \u03c3\u2206) ] dt + \u2206\u2032dW,\nPT = 1, Pt > 0. (4.1)\nFrom [6, Theorem 4.2 and Theorem 5.2], the above BSDE (4.1) admits a unique solution (P,\u2206) \u2208 L\u221e F (0, T ;R) \u00d7 L2 F (0, T ;Rm) such that c1 6 Pt 6 c2 a.s. for all t \u2208 [0, T ], with some deterministic constants c2 > c1 > 0. Then\n(Y,Z) := ( 1\nP ,\u2212\n\u2206\nP 2\n)\n, (4.2)\nis well defined and (Y,Z) \u2208 L\u221e F (0, T ;R) \u00d7 L2 F (0, T ;Rm) with 1 c2 6 Yt 6 1 c1 a.s. for all t \u2208 [0, T ]. It can be directly verified, using Ito\u0302\u2019s formula, that (Y,Z) is a solution to (3.16). The above change (P,\u2206) \u2192 (Y,Z) is invertible, so the uniqueness of (3.16) follows from that of (4.1).\nLemma 4.3 Let (Y,Z) be the unique uniformly positive solution to (3.16). Let h, \u03c0\u0302, \u03b7\u0302 be defined in (3.3), (3.13), and (3.14), respectively. Then\n\u03b8htX \u03c0\u0302 t + Yt\u039b \u03b7\u0302 t \u2261 \u03b8h0x + Y0, t \u2208 [0, T ]. (4.3)\nProof: Let \u03be = Proj\u03c3\u2032\u0393(\u03c6Y \u2212Z) be defined by (3.10). By taking u as 2\u03be and 0 in (3.9), respectively, we immediately have\n\u2212\u03be\u2032(\u03c6Y \u2212 Z \u2212 \u03be) = |\u03be|2 \u2212 \u03be\u2032(\u03c6Y \u2212 Z) = 0. (4.4)\nApplying Ito\u0302\u2019s formula to \u03b8htX \u03c0\u0302 t + Yt\u039b \u03b7\u0302 t , we have\nd(\u03b8hX \u03c0\u0302 + Y \u039b\u03b7\u0302) = \u039b\u03b7\u0302\u03be\u2032\u03c6dt + \u039b\u03b7\u0302\u03be\u2032dW + \u039b\u03b7\u0302\nY\n[\ndist2\u03c3\u2032\u0393\n( \u03c6Y \u2212 Z ) \u2212 |\u03c6Y \u2212 Z|2 \u2212 \u03be\u2032Z ] dt\u2212 \u039b\u03b7\u0302\u03be\u2032dW\n= \u039b\u03b7\u0302\nY\n[ \u03be\u2032\u03c6Y + |\u03be \u2212 (\u03c6Y \u2212 Z)|2 \u2212 |\u03c6Y \u2212 Z|2 \u2212 \u03be\u2032Z ] dt\n= \u039b\u03b7\u0302\nY\n[ \u03be\u2032\u03c6Y + |\u03be|2 \u2212 2\u03be\u2032(\u03c6Y \u2212 Z) \u2212 \u03be\u2032Z ] dt\n= \u039b\u03b7\u0302\nY\n[ |\u03be|2 \u2212 \u03be\u2032(\u03c6Y \u2212 Z) ] dt = 0.\nThe claim thus follows.\nTheorem 4.4 (Verification) Let (Y,Z) be the unique uniformly positive solution to (3.16). Let h, \u03c0\u0302, \u03b7\u0302 be defined in (3.3), (3.13), and (3.14), respectively. Then we have \u03c0\u0302 \u2208 \u03a0, \u03b7\u0302 \u2208 A, and\nE P\u03b7\u0302 [ X\u03c0T + 1\n2\u03b8 (\u039b\u03b7\u0302T \u2212 1)\n] 6 xh0 + 1\n2\u03b8 (Y0 \u2212 1), \u2200\u03c0 \u2208 \u03a0, (4.5)\nE P\u03b7 [ X \u03c0\u0302T + 1\n2\u03b8 (\u039b\u03b7T \u2212 1)\n] > xh0 + 1\n2\u03b8 (Y0 \u2212 1), \u2200\u03b7 \u2208 A, (4.6)\nand\nE P\u03b7\u0302 [ X \u03c0\u0302T + 1\n2\u03b8 (\u039b\u03b7\u0302T \u2212 1)\n] = xh0 + 1\n2\u03b8 (Y0 \u2212 1). (4.7)\nProof: We divide the proof into three steps.\nStep 1: To prove \u03c0\u0302 \u2208 \u03a0 and \u03b7\u0302 \u2208 A. Let \u03be = Proj\u03c3\u2032\u0393(\u03c6Y \u2212 Z) be defined by (3.10); then there\nexists \u03b3 \u2208 \u0393 such that \u03be = \u03c3\u2032\u03b3. From (3.13),\n\u03c0\u0302 = \u039b\nh\u03b8 (\u03c3\u03c3\u2032)\u22121\u03c3Proj\u03c3\u2032\u0393(Y \u03c6\u2212 Z) =\n\u039b\nh\u03b8 (\u03c3\u03c3\u2032)\u22121\u03c3\u03c3\u2032\u03b3 =\n\u039b\nh\u03b8 \u03b3,\nhence, by (4.3),\n\u03c3\u2032\u03c0\u0302 = \u039b\nh\u03b8 \u03c3\u2032\u03b3 =\n\u039b\nh\u03b8 \u03be =\n\u03b8h0x + Y0 \u2212 \u03b8htX \u03c0\u0302 t\n\u03b8htYt \u03be =\na\u2212 htX \u03c0\u0302 t\nhtYt \u03be, (4.8)\nwhere\na := h0x + Y0/\u03b8.\nSubstituting (4.8) into (2.2), we have\n{\ndX \u03c0\u0302t = (rtX \u03c0\u0302 t +\na\u2212htX \u03c0\u0302 t\nhtYt \u03be\u2032t\u03c6t)dt +\na\u2212htX \u03c0\u0302 t\nhtYt \u03be\u2032tdWt,\nX \u03c0\u03020 = x.\nApplying Ito\u0302\u2019s formula to (htX \u03c0\u0302 t \u2212 a) 2, we have\nd(htX \u03c0\u0302 t \u2212 a) 2 = (htX \u03c0\u0302 t \u2212 a) 2 [ \u03be2t Y 2t \u2212 2 1 Yt \u03be\u2032t\u03c6t ] dt\u2212 2(htX \u03c0\u0302 t \u2212 a) 2 1 Yt \u03be\u2032tdWt.\nRecalling that Y follows (3.16) and applying Ito\u0302\u2019s formula to 1 Yt (htX \u03c0\u0302 t \u2212 a) 2, we have\nd [ 1\nYt (htX\n\u03c0\u0302 t \u2212 a)\n2 ] = (htX\n\u03c0\u0302 t \u2212 a) 2 Yt [ \u03be2t Y 2t \u2212 2 1 Yt \u03be\u2032t\u03c6t ] dt\n\u2212 (htX\n\u03c0\u0302 t \u2212 a) 2 Y 3t [ dist2\u03c3\u2032\u0393(\u03c6Y \u2212 Z) \u2212 |\u03c6Y \u2212 Z| 2 ] dt + 2 (htX \u03c0\u0302 t \u2212 a) 2 Y 3t \u03be\u2032tZdt\n\u2212 (htX\n\u03c0\u0302 t \u2212 a) 2 Y 2t Z \u2032dWt \u2212 2 (htX \u03c0\u0302 t \u2212 a) 2 Yt \u03be\u2032tdWt\n= (htX\n\u03c0\u0302 t \u2212 a) 2 Y 3t [ \u03be2t \u2212 2\u03be \u2032 t\u03c6tYt \u2212 dist 2 \u03c3\u2032\u0393(\u03c6Y \u2212 Z) + |\u03c6Y \u2212 Z| 2 + 2\u03be\u2032tZ ] dt\n\u2212 (htX\n\u03c0\u0302 t \u2212 a) 2 Y 2t (Z + 2Y \u03be)\u2032dWt\n= \u2212 (htX\n\u03c0\u0302 t \u2212 a) 2 Y 2t (Z + 2Y \u03be)\u2032dWt.\nSince the stochastic integral in the last equation is a local martingale, there exists an increasing sequence of stopping times \u03c4n such that \u03c4n \u2191 +\u221e as n \u2192 +\u221e such that\nE\n[ 1\nY\u03b9\u2227\u03c4n (h\u03b9\u2227\u03c4nX\n\u03c0\u0302 \u03b9\u2227\u03c4n\n\u2212 a)2 ] = 1\nY0 (h0x\u2212 a) 2 = Y0 \u03b82 ,\nfor any stopping time \u03b9 6 T . Letting n \u2192 \u221e, it follows from Fatou\u2019s lemma that\nE\n[ 1\nY\u03b9 (h\u03b9X\n\u03c0\u0302 \u03b9 \u2212 a)\n2 ] 6 Y0 \u03b82 .\nSince c1 6 Y , h 6 c2 for some constants c2 > c1 > 0, we get\nE\n[ (X \u03c0\u0302\u03b9 ) 2 ] 6 c3, (4.9)\nfor some constant c3 and any stopping time \u03b9 6 T . Now it is standard to prove \u03c0\u0302 \u2208 L 2 F (0, T ;Rm); see, e.g., [5, Lemma 4.3]. This proves \u03c0\u0302 \u2208 \u03a0.\nBy virtue of (4.3) and (4.9), c1 6 Y , h 6 c2, we immediately get that there exists some positive\nconstant c4,\nE[(\u039b\u03b7\u0302\u03b9 ) 2] < c4, (4.10)\nfor any stopping time \u03b9 6 T . This proves \u03b7\u0302 \u2208 A.\nStep 2: To prove (4.5). For any \u03c0 \u2208 \u03a0, applying Ito\u0302\u2019s formula to R(\u03b7\u0302,\u03c0) = X\u03c0t ht + 1 2\u03b8 (\u039b \u03b7\u0302 t Yt\u22121),\nwe have\nE P\u03b7\u0302 [R (\u03b7\u0302,\u03c0) t\u2227\u03c4n ] = xh0 + 1\n2\u03b8 (Y0 \u2212 1) + E\nP\u03b7\u0302\n\u222b t\u2227\u03c4n\n0\n[ h\u03c0\u2032(\u00b5 + \u03c3\u03b7\u0302) + 1\n2\u03b8 \u039btYt|\u03b7\u0302|\n2 + 1\n\u03b8 \u039b\u03b7\u0302\u2032Z \u2212\n1\n2\u03b8 \u039bf\n]\nds.\nOn one hand, for any \u03c0 \u2208 \u03a0, setting u = \u03c3\u2032\u03c0 in Lemma 3.1, we get\nh\u03c0\u2032(\u00b5 + \u03c3\u03b7\u0302) = h\nY \u03c0\u2032\u03c3(\u03c6Y \u2212 Z \u2212 \u03be) 6\nh Y \u03be\u2032(\u03c6Y \u2212 Z \u2212 \u03be) = 0, (4.11)\nwhere the last equality comes from (4.4).\nOn the other hand, recall (3.12) and (3.10):\nY |\u03b7\u0302|2 + 2\u03b7\u0302\u2032Z \u2212 f = Y |\u03b7\u0302|2 + 2\u03b7\u0302\u2032Z + 1\nY dist2\u03c3\u2032\u0393(\u03c6Y \u2212 Z) \u2212\n1 Y |\u03c6Y \u2212 Z|2 + 1 Y |Z|2\n= Y \u2223 \u2223 \u2223\u03b7\u0302 + 1 Y Z \u2223 \u2223 \u2223 2 + 1 Y dist2\u03c3\u2032\u0393(\u03c6Y \u2212 Z) \u2212 1 Y |\u03c6Y \u2212 Z|2 = 1\nY\n[ |\u03be|2 + dist2\u03c3\u2032\u0393(\u03c6Y \u2212 Z) \u2212 |\u03c6Y \u2212 Z| 2 ]\n= 1\nY\n[ |\u03be|2 + \u2223 \u2223 \u2223 \u03be \u2212 (\u03c6Y \u2212 Z) \u2223 \u2223 \u2223 2 \u2212 |\u03c6Y \u2212 Z|2 ]\n= 1\nY\n[ 2|\u03be|2 \u2212 2\u03be\u2032(\u03c6Y \u2212 Z) ] = 0, (4.12)\nwhere we used (4.4) in the last equality.\nCombining (4.11) and (4.12), we arrive at\nE P\u03b7\u0302 [R (\u03b7\u0302,\u03c0) t\u2227\u03c4n ] = E[\u039b\u03b7\u0302t\u2227\u03c4nR (\u03b7\u0302,\u03c0) t\u2227\u03c4n ] 6 xh0 + 1\n2\u03b8 (Y0 \u2212 1), \u2200t \u2208 [0, T ], \u2200\u03c0 \u2208 \u03a0. (4.13)\nFor any \u03c0 \u2208 \u03a0, it is standard to verify E[supt\u2208[0,T ](X \u03c0 t ) 2] < \u221e. Since h and Y are bounded, we\nget\nE\n[\nsup t\u2208[0,T ]\n|\u039b\u03b7\u0302tR \u03b7\u0302,\u03c0 t |\n] 6 CE [\nsup t\u2208[0,T ]\n|\u039b\u03b7\u0302tX \u03c0 t | ] + CE [\nsup t\u2208[0,T ]\n(\u039b\u03b7\u0302t ) 2 ] + CE [\nsup t\u2208[0,T ]\n\u039b\u03b7\u0302t\n]\n6 CE [\nsup t\u2208[0,T ]\n(X\u03c0t ) 2 ] + CE [\nsup t\u2208[0,T ]\n(\u039b\u03b7\u0302t ) 2 ] + C\n6 CE [\nsup t\u2208[0,T ]\n(X\u03c0t ) 2 ] + CE [ (\u039b\u03b7\u0302T ) 2 ] + C < \u221e,\nwhere C > 0 denotes a constant that may vary from line to line; we used the elementary inequality 2ab 6 a2 + b2 in the second inequality, Doob\u2019s inequality in the third inequality, and (4.10) in the fourth inequality. Sending n \u2192 \u221e in (4.13) and using the dominated convergence theorem, we get (4.5).\nStep 3: To prove (4.6). For any \u03b7 \u2208 A, we have\nE P\u03b7 [R (\u03b7,\u03c0\u0302) t\u2227\u03c4n ] = xh0 + 1\n2\u03b8 (Y0 \u2212 1) + E\nP\u03b7\n\u222b t\u2227\u03c4n\n0\n\u039b\u03b7 2\u03b8 [ Yt|\u03b7| 2 + 2\u03b7\u2032Z + 2\u03b8 \u039b\u03b7 h\u03b7\u2032\u03c3\u2032\u03c0\u0302 + 2\u03b8 \u039b\u03b7 h\u03c0\u0302\u2032\u03c3\u03c6\u2212 f ] ds\n= xh0 + 1\n2\u03b8 (Y0 \u2212 1) + E\nP\u03b7\n\u222b t\u2227\u03c4n\n0\n\u039b\u03b7 2\u03b8 [ Y \u2223 \u2223 \u2223\u03b7 + (Z Y + \u03b8 \u039b\u03b7Y h\u03c3\u2032\u03c0\u0302 )\u2223 \u2223 \u2223 2\n\u2212 1\nY\n\u2223 \u2223 \u2223Z + \u03b8\n\u039b\u03b7 h\u03c3\u2032\u03c0\u0302\n\u2223 \u2223 \u2223 2 + 2\u03b8\n\u039b\u03b7 h\u03c0\u0302\u2032\u03c3\u03c6\u2212 f\n]\nds\n> xh0 + 1\n2\u03b8 (Y0 \u2212 1) + E\nP\u03b7\n\u222b t\u2227\u03c4n\n0\n\u039b\u03b7 2\u03b8 [ \u2212 1 Y \u2223 \u2223 \u2223Z + \u03b8 \u039b\u03b7 h\u03c3\u2032\u03c0\u0302 \u2223 \u2223 \u2223 2 + 2\u03b8 \u039b\u03b7 h\u03c0\u0302\u2032\u03c3\u03c6\u2212 f ] ds. (4.14)\nPlease note that \u03c0\u0302 is a feedback of \u039b, so under \u03b7, the optimal \u03c0\u0302 in (3.13) should take\n\u03c0\u0302 = \u039b\u03b7\nh\u03b8 (\u03c3\u03c3\u2032)\u22121\u03c3Proj\u03c3\u2032\u0393(Y \u03c6\u2212 Z).\nRecall (4.8), and the definition of f in (3.12), we have\n\u2212 1\nY\n\u2223 \u2223 \u2223 Z + \u03b8\n\u039b\u03b7 h\u03c3\u2032\u03c0\u0302\n\u2223 \u2223 \u2223 2 + 2\u03b8\n\u039b\u03b7 h\u03c0\u0302\u2032\u03c3\u03c6\u2212 f\n= \u2212 1\nY\n\u2223 \u2223 \u2223Z + Proj\u03c3\u2032\u0393(Y \u03c6\u2212 Z) \u2223 \u2223 \u2223 2 + 2\u03c6\u2032Proj\u03c3\u2032\u0393(Y \u03c6\u2212 Z) \u2212 f = 0.\nHence from (4.14), we have\nE P\u03b7 [R (\u03b7,\u03c0\u0302) t\u2227\u03c4n ] > xh0 + 1\n2\u03b8 (Y0 \u2212 1).\nSimilar to Step 2, we can prove E[supt\u2208[0,T ] |\u039b \u03b7 tR \u03b7,\u03c0\u0302 t |] < \u221e. By sending n \u2192 \u221e we get (4.6).\nStep 4: To prove (4.7). Applying Ito\u0302\u2019s formula to R(\u03b7\u0302,\u03c0\u0302) = X \u03c0\u0302t ht + 1 2\u03b8 (\u039b \u03b7\u0302 t Yt \u2212 1), we have\nE P \u03b7\u0302 [R (\u03b7,\u03c0\u0302) t\u2227\u03c4n ] = xh0 + 1\n2\u03b8 (Y0 \u2212 1) + E\nP \u03b7\u0302\n\u222b t\u2227\u03c4n\n0\n[ 1\n2\u03b8 \u039btYt|\u03b7\u0302|\n2 + 1\n\u03b8 \u039b\u03b7\u0302\u2032Z + h\u03b7\u0302\u2032\u03c3\u2032\u03c0\u0302 + h\u03c0\u0302\u2032\u00b5\u2212\n1\n2\u03b8 \u039bf\n]\nds\n= xh0 + 1\n2\u03b8 (Y0 \u2212 1) + E\nP \u03b7\u0302\n\u222b t\u2227\u03c4n\n0\n[\u039bY\n2\u03b8\n\u2223 \u2223 \u2223 \u03b7\u0302 + \u03b8\n\u039bY\n(1\n\u03b8 \u039bZ + h\u03c3\u2032\u03c0\u0302\n)\u2223\n\u2223 \u2223\n2\n\u2212 \u03b8\n2\u039bY\n\u2223 \u2223 \u2223 1\n\u03b8 \u039bZ + h\u03c3\u2032\u03c0\u0302\n\u2223 \u2223 \u2223 2 + h\u03c0\u0302\u2032\u00b5\u2212 1\n2\u03b8 \u039bf\n]\nds\n= xh0 + 1\n2\u03b8 (Y0 \u2212 1),\nwhere the third equality comes from the definitions of f , \u03c0\u0302, and \u03b7\u0302 in (3.12), (3.13), and (3.14). Similar to Step 2, we can prove E[supt\u2208[0,T ] |\u039b \u03b7 tR \u03b7,\u03c0\u0302 t |] < \u221e and (4.7).\nAs a byproduct of Theorem 4.4, we have the following results for problem (2.6).\nCorollary 4.5 Let (Y,Z) be the unique uniformly positive solution to (3.16), and let h, \u03c0\u0302 be defined in (3.3) and (3.13), respectively. Then \u03c0\u0302 is optimal for the constrained MMV problem (2.6), and\nsup \u03c0\u2208\u03a0 inf \u03b7\u2208A\nE P \u03b7 [ XT + 1\n2\u03b8 (\u039b\u03b7T \u2212 1)\n] = xh0 + 1\n2\u03b8 (Y0 \u2212 1). (4.15)\nRemark 4.6 If \u0393 = Rm, then\nProj\u03c3\u2032\u0393(\u03c6Y \u2212 Z) = \u03c6Y \u2212 \u03c3 \u2032(\u03c3\u03c3\u2032)\u22121\u03c3Z.\nIndeed, it suffices to prove\nProj\u03c3\u2032\u0393(\u03c6Y \u2212 Z) = Proj\u03c3\u2032\u0393(\u03c6Y \u2212 \u03c3 \u2032(\u03c3\u03c3\u2032)\u22121\u03c3Z),\nsince \u03c6Y \u2212 \u03c3\u2032(\u03c3\u03c3\u2032)\u22121\u03c3Z \u2208 \u03c3\u2032Rm = \u03c3\u2032\u0393. Let \u03be = Proj\u03c3\u2032\u0393(\u03c6Y \u2212 Z) be defined by (3.10). Then, for any u \u2208 \u03c3\u2032\u0393,\n(u\u2212 \u03be)\u2032(\u03c6Y \u2212 \u03c3\u2032(\u03c3\u03c3\u2032)\u22121\u03c3Z \u2212 \u03be) = (u\u2212 \u03be)\u2032(\u03c6Y \u2212 Z + (In \u2212 \u03c3 \u2032(\u03c3\u03c3\u2032)\u22121\u03c3)Z \u2212 \u03be)\n= (u\u2212 \u03be)\u2032(\u03c6Y \u2212 Z \u2212 \u03be) + (u\u2212 \u03be)\u2032(In \u2212 \u03c3 \u2032(\u03c3\u03c3\u2032)\u22121\u03c3)Z 6 (u\u2212 \u03be)\u2032(In \u2212 \u03c3 \u2032(\u03c3\u03c3\u2032)\u22121\u03c3)Z\n= 0,\nwhere we used Lemma 3.1 to get the inequality and the fact u\u2212 \u03be \u2208 \u03c3\u2032\u0393 and \u03c3(In\u2212\u03c3 \u2032(\u03c3\u03c3\u2032)\u22121\u03c3) = 0 to get the last equality. Thanks to Lemma 3.1 again, this inequality implies \u03be = Proj\u03c3\u2032\u0393(\u03c6Y \u2212 \u03c3\u2032(\u03c3\u03c3\u2032)\u22121\u03c3Z).\nTherefore, by (3.12), (3.13), and (3.14),\nf = 1\nY (\u03c6Y \u2212 \u03c3Z)\u2032\u03c3\u2032(\u03c3\u03c3\u2032)\u22121\u03c3(\u03c6Y \u2212 Z) \u2212\n1 Y |Z|2,\n\u03c0\u0302 = \u039b\n\u03b8h (\u03c3\u03c3\u2032)\u22121\u03c3(\u03c6Y \u2212 Z),\n\u03b7\u0302 = \u2212 1\nY (Z + \u03c3\u2032(\u03c3\u03c3\u2032)\u22121\u03c3(\u03c6Y \u2212 Z)) = \u2212\u03c3\u2032(\u03c3\u03c3\u2032)\u22121\u03c3\u03c6\u2212 (In \u2212 \u03c3\n\u2032(\u03c3\u03c3\u2032)\u22121\u03c3) Z\nY .\nIf m = n, then \u03c3 is invertible, and \u03b7\u0302 = \u2212\u03c6 = \u2212\u03c3\u22121\u00b5.\n5 Comparison with the classical MV problem\nThe constrained classical MV problem is (see, e.g., [14]) is\nsup \u03c0\u2208\u03a0\n[ E(XT ) \u2212 \u03b8\n2 Var(XT )\n]\n. (5.1)\nWe will firstly solve the problem (5.1) and then draw a comparison with the MMV problem (2.6).\nFor any K \u2208 R, let us consider\nF (K) := inf \u03c0\u2208\u03a0K E\n[ (XT \u2212K) 2 ]\n= inf \u03c0\u2208\u03a0K\n[ E(X2T ) \u2212K 2 ] , (5.2)\nwhere\n\u03a0K := { \u03c0 \u2208 \u03a0 \u2223 \u2223 \u2223 E(X\u03c0T ) = K }\nwith the convention of F (K) = +\u221e if \u03a0K = \u2205. Trivially, F (K) > 0.\nAs illustrated in [13, page 12], the connection between problems (5.1) and (5.2) is given as\nfollows:\nsup \u03c0\u2208\u03a0\n[ E(XT ) \u2212 \u03b8\n2 Var(XT )\n]\n= sup K\u2208R sup \u03c0\u2208\u03a0K\n[ K \u2212 \u03b8\n2\n( E(X2T ) \u2212K 2 )]\n= sup K\u2208R\n[ K \u2212 \u03b8\n2 inf \u03c0\u2208\u03a0K\n( E(X2T ) \u2212K 2 )]\n= sup K\u2208R\n[ K \u2212 \u03b8\n2 F (K)\n]\n. (5.3)\nIn order to solve (5.2), we introduce a Lagrange multiplier \u03b3 \u2208 R and consider\nJ(K, \u03b3) := inf \u03c0\u2208\u03a0 E\n[\nX2T \u2212K 2 \u2212 2\u03b3(XT \u2212K)\n]\n= inf \u03c0\u2208\u03a0\n[\nE(XT \u2212 \u03b3) 2 \u2212 (K \u2212 \u03b3)2\n]\n. (5.4)\nBy the Lagrange duality theorem (see Luenberger [8]),\nF (K) = inf \u03c0\u2208\u03a0K\n( E(X2T ) \u2212K 2 )\n= sup \u03b3\u2208R J(K, \u03b3), K \u2208 R. (5.5)\nThe solution for problem (5.4) depends on the following two BSDEs:\n \n\ndP1 = \u2212 {\n2rP1 + inf \u03c0\u2208\u0393\n[\nP1\u03c0 \u2032\u03c3\u03c3\u2032\u03c0 + 2\u03c0\u2032(P1\u00b5 + \u03c3\u22061)\n]}\ndt + \u2206\u20321dW,\nP1,T = 1, P1,t > 0, for t \u2208 [0, T ], (5.6)\nand \n\n\ndP2 = \u2212 {\n2rP2 + inf \u03c0\u2208\u0393\n[\nP2\u03c0 \u2032\u03c3\u03c3\u2032\u03c0 \u2212 2\u03c0\u2032(P2\u00b5 + \u03c3\u22062)\n]}\ndt + \u2206\u20322dW,\nP2,T = 1, P2,t > 0, for t \u2208 [0, T ]. (5.7)\nRecall that ht = e \u222b T t rsds is deterministic and bounded. From [6, Theorem 4.2 and Theorem 5.2], there exists a unique uniformly positive solution (P1,\u22061) \u2208 L \u221e F (0, T ;R)\u00d7L2 F (0, T ;Rn) to the BSDE (5.6). And P1,0 6 h 2 0 from [6, Lemma 6.1]. Similar results hold for the BSDE (5.7) with P2,0 6 h 2 0.\nThe following results for the problem (5.4) generalize a little bit [6, Theorem 6.2] from \u0393 = Rm+ to a general closed convex cone \u0393 \u2286 Rm with exactly the same proof.\nLemma 5.1 Let (P1,\u22061) and (P2,\u22062) be the unique uniformly positive solutions to (5.6) and (5.7), respectively. Then the feedback strategy\n\u03c0\u03b3(t,X) = ( X \u2212 \u03b3\nht\n)+ \u03be1 + ( X \u2212 \u03b3\nht\n)\u2212\n\u03be2, (5.8)\nis optimal for the problem (5.4), where\n\u03be1 := (\u03c3\u03c3 \u2032)\u22121\u03c3Proj\u03c3\u2032\u0393\n( \u2212 \u03c6\u2212 \u22061 P1 ) and \u03be2 := (\u03c3\u03c3 \u2032)\u22121\u03c3Proj\u03c3\u2032\u0393 ( \u03c6 + \u22062 P2 ) . (5.9)\nAnd the optimal value of (5.4) is\nJ(K, \u03b3) =\n{\nJ1(K, \u03b3), if \u03b3 < xh0;\nJ2(K, \u03b3), if \u03b3 > xh0,\nwhere\nJ1(K, \u03b3) := (P1,0\nh20 \u2212 1\n) \u03b32 \u2212 2 ( x P1,0 h0 \u2212K ) \u03b3 + P1,0x 2 \u2212K2,\nJ2(K, \u03b3) := (P2,0\nh20 \u2212 1\n) \u03b32 \u2212 2 ( x P2,0 h0 \u2212K ) \u03b3 + P2,0x 2 \u2212K2.\nTo solve (5.5), we do some tedious calculation and obtain\nsup \u03b3<xh0 J1(K, \u03b3) =\n      \n     \n\u2212(K \u2212 xh0) 2, if K > xh0; +\u221e, if K < xh0 and P1,0 = h 2 0; P1,0(K\u2212xh0)2\nh2 0 \u2212P1,0\n, if K < xh0 and P1,0 < h 2 0;\n0, if K = xh0,\nand\nsup \u03b3>xh0 J2(K, \u03b3) =\n      \n     \n+\u221e, if K > xh0 and P2,0 = h 2 0; P2,0(K\u2212xh0)2\nh2 0 \u2212P2,0\n, if K > xh0 and P2,0 < h 2 0;\n\u2212(K \u2212 xh0) 2, if K < xh0;\n0, if K = xh0.\nTherefore,\nF (K) = sup \u03b3\u2208R\nJ(K, \u03b3) = max {\nsup \u03b3<xh0 J1(K, \u03b3), sup \u03b3>xh0\nJ2(K, \u03b3) }\n=\n         \n        \n+\u221e, if K > xh0 and P2,0 = h 2 0; P2,0(K\u2212xh0)2\nh2 0 \u2212P2,0\n, if K > xh0 and P2,0 < h 2 0;\n+\u221e, if K < xh0 and P1,0 = h 2 0; P1,0(K\u2212xh0)2\nh2 0 \u2212P1,0\n, if K < xh0 and P1,0 < h 2 0;\n0, if K = xh0,\nwith the argument maximum\n\u03b3\u0302(K) =\n         \n        \n+\u221e, if K > xh0 and P2,0 = h 2 0; h2 0 K\u2212xP2,0h0\nh2 0 \u2212P2,0\n, if K > xh0 and P2,0 < h 2 0;\n\u2212\u221e, if K < xh0 and P1,0 = h 2 0; h2 0 K\u2212xP1,0h0\nh2 0 \u2212P1,0\n, if K < xh0 and P1,0 < h 2 0;\nxh0, if K = xh0.\n(5.10)\nAccordingly,\nK \u2212 \u03b8\n2 F (K) =\n         \n        \n\u2212\u221e, if K > xh0 and P2,0 = h 2 0; K \u2212 \u03b82 P2,0(K\u2212xh0)2\nh2 0 \u2212P2,0\n, if K > xh0 and P2,0 < h 2 0;\n\u2212\u221e, if K < xh0 and P1,0 = h 2 0; K \u2212 \u03b82 P1,0(K\u2212xh0)2\nh2 0 \u2212P1,0\n, if K < xh0 and P1,0 < h 2 0;\nxh0, if K = xh0.\nAnd\nsup K\u2208R\n[K \u2212 \u03b8\n2 F (K)] =\n \n\nxh0 + 1 2\u03b8\n(\nh2 0\nP2,0 \u2212 1\n)\n, if P2,0 < h 2 0;\nxh0, if P2,0 = h 2 0,\n= xh0 + 1\n2\u03b8 ( h20 P2,0 \u2212 1 ) , (5.11)\nwith the argument maximum\nK\u0302 = xh0 + 1\n\u03b8 ( h20 P2,0 \u2212 1 ) > xh0. (5.12)\nSubstituting (5.12) into (5.10), we obtain\n\u03b3\u0302(K\u0302) = xh0 + 1\n\u03b8 h20 P2,0 .\nThe above analysis leads to the following results for the problem (5.1).\nTheorem 5.2 Let \u03be2 be defined in (5.9), and let (P1,\u22061) and (P2,\u22062) be the unique uniformly positive solutions to (5.6) and (5.7), respectively. Let\n\u03b3\u0302 = xh0 + 1\n\u03b8 h20 P2,0 , (5.13)\nand\n\u03c0\u03b3\u0302(t,X) = \u2212 ( X \u2212 \u03b3\u0302\nht\n)\n\u03be2. (5.14)\nThen \u03c0\u03b3\u0302 is the optimal feedback portfolio for the problem (5.1), and\nsup \u03c0\u2208\u03a0\n[ E(XT ) \u2212 \u03b8\n2 Var(XT )\n] = xh0 + 1\n2\u03b8 ( h20 P2,0 \u2212 1 ) . (5.15)\nProof: Notice \u03b3\u0302 = \u03b3\u0302(K\u0302); so, by (5.3) and (5.5),\nsup \u03c0\u2208\u03a0\n[ E(XT ) \u2212 \u03b8\n2 Var(XT )\n]\n= sup K\u2208R\n[ K \u2212 \u03b8\n2 F (K)\n)]\n= K\u0302 \u2212 \u03b8\n2 F (K\u0302) = K\u0302 \u2212\n\u03b8 2 J(K\u0302, \u03b3\u0302(K\u0302)) = K\u0302 \u2212 \u03b8 2 J(K\u0302, \u03b3\u0302).\nTherefore, the optimal portfolio for the problem (5.4) with (K, \u03b3) = (K\u0302, \u03b3\u0302) is also optimal to (5.1).\nWe now show that the portfolio (5.14) is optimal to the problem (5.4) with (K, \u03b3) = (K\u0302, \u03b3\u0302).\nTaking (5.14) to the wealth process (2.2), we get\nd ( X\u03c0 \u03b3\u0302 t \u2212 \u03b3\u0302\nht\n) = ( X\u03c0 \u03b3\u0302 t \u2212 \u03b3\u0302\nht\n)(\n(r \u2212 \u03be\u20322\u00b5)dt\u2212 \u03be2\u03c3 \u2032dW\n)\n,\nthen Ito\u0302\u2019s lemma gives\nX\u03c0 \u03b3\u0302 t \u2212 \u03b3\u0302\nht =\n(\nX\u03c0 \u03b3\u0302 0 \u2212 \u03b3\u0302\nh0\n) exp (\n\u222b t\n0 (r \u2212 \u03be\u20322\u00b5\u2212\n1 2 |\u03be\u20322\u03c3| 2)ds\u2212\n\u222b t\n0 \u03be\u20322\u03c3dWs\n)\n.\nSince X\u03c0 \u03b3\u0302 0 \u2212 \u03b3\u0302 h0 = \u2212 h0 \u03b8P2,0 6 0, it follows that X\u03c0 \u03b3\u0302 t \u2212 \u03b3\u0302 ht 6 0. Accordingly, the portfolio (5.14) is\n\u03c0\u03b3\u0302(t,X) = \u2212 ( X \u2212 \u03b3\u0302\nht\n) \u03be2 = ( X \u2212 \u03b3\u0302\nht\n)+ \u03be1 + ( X \u2212 \u03b3\u0302\nht\n)\u2212\n\u03be2,\nwhich is just (5.8), the optimal strategy for the problem (5.4).\nFinally, (5.15) comes from (5.3) and (5.11) evidently. In the end, we have the following connection between problems (2.6) and (5.1).\nTheorem 5.3 The problems (2.6) and (5.1) have the same optimal value\nxh0 + 1\n2\u03b8 (Y0 \u2212 1)\nand optimal feedback portfolio\n\u03c0\u0302 = \u03c0\u03b3\u0302 ,\nwhere \u03c0\u0302 and \u03c0\u03b3\u0302 are defined in (3.13) and (5.14), respectively. Proof: Recall that (Y,Z) is the unique uniformly positive solution to (3.16), and ht = e \u222b T t rsds. It can be directly verified, by Ito\u0302\u2019s formula, that\n(Y,Z) = (h2\nP2 ,\u2212\nh2 P 22 \u22062 ) . (5.16)\nComparing (4.15) and (5.15), the first claim follows.\nBy (4.8) and (5.16),\n\u03c0\u0302 = xh0 +\nY0 \u03b8 \u2212 htX \u03c0\u0302 t\nhtYt (\u03c3\u03c3\u2032)\u22121\u03c3Proj\u03c3\u2032\u0393(\u03c6Y \u2212 Z)\n= xh0 +\nh2 0\n\u03b8P2,0 \u2212 htX \u03c0\u0302 t\nh3t P2(\u03c3\u03c3\n\u2032)\u22121\u03c3Proj\u03c3\u2032\u0393\n( \u03c6 h2\nP2 +\nh2 P 22 \u22062 )\n= \u03b3\u0302 \u2212 htX \u03c0\u0302 t\nht (\u03c3\u03c3\u2032)\u22121\u03c3Proj\u03c3\u2032\u0393\n( \u03c6 + \u22062 P2 )\n= \u2212 ( X \u03c0\u0302t \u2212 \u03b3\u0302\nht\n)\n\u03be2,\nwhich is exactly the feedback optimal portfolio (5.14).\n6 Concluding remarks\nIn this paper, we study the MMV and the MV problems with cone constraints on the portfolios in a diffusion model with random coefficients. Semiclosed solutions for both problems in terms of the solutions to some BSDEs are provided. And by a careful comparison, we find that the solutions to these two problems are exactly the same. Further research along this line can be interesting as well; for instance: (1) When r is random, how does one solve the problem (2.6) even without any constraints on the portfolio? (2) When the wealth dynamics are discontinuous (e.g., with Poisson jumps), how does one solve the problem (2.6)?\nBoth Du and Strub [4] and Li, Liang, and Pang [7] claim that the optimal values and optimal strategies corresponding to the MMV and the MV problems coincide. The former paper assumes that the asset prices are continuous and that not investing in the risky assets is an admissible strategy, whereas the latter considers a jump diffusion model with stochastic factor but no trading constraint. It is still an open question that whether the consistency still holds in a general model with discontinuous asset price or trading constraint.\nAcknowledgments. The authors thank the associated editor and anonymous referee for their valuable comments and suggestions. We thank the anonymous referee for pointing out the work [7] to us. We also thank Strub for letting us know of his latest research work [4].\nReferences\n[1] Beck A. Introduction to nonlinear optimization: Theory, algorithms, and applications with\nMATLAB. Society for Industrial and Applied Mathematics, Philadelphia2014.\n[2] C\u0306erny\u0301 A. Semimartingale theory of monotone mean-variance portfolio allocation. Math. Fi-\nnance, 2020, 30(3): 1168-1178.\n[3] C\u0306erny\u0301 A, Maccheroni F, Marinacci M, Rustichini A. On the computation of optimal monotone\nmean-variance portfolios via truncated quadratic utility. J. Math. Econom., 2012, 48(6): 386- 395.\n[4] Du J, Strub MS. Monotone and Classical Mean-Variance Preferences\nCoincide When Asset Prices are Continuous, SSRN preprint, 2023, https://papers.ssrn.com/sol3/papers.cfm?abstract_id=4359422.\n[5] Hu Y, Shi X, Xu Z Q. Constrained stochastic LQ control with regime switching and application\nto portfolio selection. Ann. Appl. Probab., 2022, 32 (1):426-460.\n[6] Hu Y, Zhou X. Constrained stochastic LQ control with random coefficients, and application\nto portfolio selection. SIAM J. Control Optim., 2005, 44(2): 444-466.\n[7] Li Y, Liang Z, and Pang S. Comparison between mean-variance and monotone mean-\nvariance preferences under jump diffusion and stochastic factor model. arXiv preprint https://arxiv.org/abs/2211.14473.\n[8] Luenberger D. G. Optimization by vector space methods, John Wiley and Sons, New York,\n1997.\n[9] Maccheroni F, Marinacci M, Rustichini A, Taboga M. Portfolio selection with monotone mean-\nvariance preferences. Math. Finance, 2009, 19(3): 487-521.\n[10] Markowitz H. Portfolio selection. J. Finance, 1952, 7: 77-91.\n[11] Shen Y, Zou B. Cone-constrained monotone mean-variance portfolio selection under diffusion\nmodels. SIAM J. Financial Math., 2022, 13(4):SC99-SC112.\n[12] Strub M S, Li D. A note on monotone mean-variance preferences for continuous processes.\nOper. Res. Lett., 2020, 48(4): 397-400.\n[13] Trybu la J, Zawisza D. Continuous-time portfolio choice under monotone mean-variance\npreferences-stochastic factor case. Math. Oper. Res., 2019, 44(3): 966-987.\n[14] Zhou X Y, Li D. Continuous-time mean-variance portfolio selection: A stochastic LQ frame-\nwork. Appl. Math. Optim., 2000, 42(1): 19-33."
        }
    ],
    "title": "Constrained monotone mean-variance problem with random coefficients",
    "year": 2023
}