{
    "abstractText": "In the existing robust iterative learning control (ILC) for 2-D discrete systems, they typicallly require to satisfy a core hypothesis that the strict repetitiveness of tracking reference trajectory and system model should be satisfied. This paper first investigates the robustness and convergence of a P-type ILC law and a high-order ILC law for 2-D linear nonrepetitive discrete systems (LNDS) with arbitrarily bounded reference trajectory and iteration-dependent reference trajectory described by a high order internal model (HOIM) operator in iteration domain, respectively. It is theoretically proved by using the 2-D linear nonrepetitive inequalities that the ILC tracking error and the control input robustly converge to a bounded range, the bound of which depends continuously on the bounds of all the nonrepetitive uncertainties. If these uncertainties are progressively convergent along the iteration domain, a precise tracking on the 2-D reference trajectory can be achieved. Two illustrative examples are provided to demonstrate the validity of the presented ILC law. Additionally, some comparative result on the practical dynamical processes is given. INDEX TERMS 2-D linear discrete nonrepetitive systems (LNDS), 2-D linear nonrepetitive inequalities, iteration-dependent trajectory, robust iterative learning control.",
    "authors": [
        {
            "affiliations": [],
            "name": "HENG XIE"
        },
        {
            "affiliations": [],
            "name": "KAI WAN"
        },
        {
            "affiliations": [],
            "name": "QING-YUAN XU"
        }
    ],
    "id": "SP:b0fe4e49658c1ddbf283bbae7c28f5c66ae43957",
    "references": [
        {
            "authors": [
                "X.F. Li",
                "D. Shen",
                "B. Ding"
            ],
            "title": "Iterative learning control for output tracking of nonlinear systems with unavailable state information",
            "venue": "IEEE Trans. Neural Networks Learn. Syst., vol. 55, pp. 1-8, 2021.",
            "year": 2021
        },
        {
            "authors": [
                "X. Jin"
            ],
            "title": "Iterative learning control for MIMO nonlinear systems with iteration-varying trial lengths using nodified composite energy function analysis",
            "venue": "IEEE Trans. Cybern., vol. 99, pp. 1-11, 2020.",
            "year": 2020
        },
        {
            "authors": [
                "M. Yu",
                "S. Chai"
            ],
            "title": "Adaptive iterative learning control for discretetime nonlinear systems with multiple iteration-varying high-order internal models",
            "venue": "Int. J. Robust Nonlinear Control, vol. 31, no. 15, pp. 7390-7408, 2021.",
            "year": 2021
        },
        {
            "authors": [
                "Q. Zhu",
                "J.-X. Xu",
                "D.Q. Huang",
                "G.-D. Hu"
            ],
            "title": "Iterative learning control design for linear discrete-time systems with multiple high-order internal models",
            "venue": "Automatica, vol. 62, pp. 65-76, 2015.",
            "year": 2015
        },
        {
            "authors": [
                "X.H. Bu",
                "W. Yu",
                "Q. Yu",
                "Z.S. Hou",
                "J.Q. Yang"
            ],
            "title": "Event-triggered model-free adaptive iterative learning control for a class of nonlinear systems over fading channels",
            "venue": "IEEE Trans. Cybern., vol. 99, pp. 1-12, 2021.",
            "year": 2021
        },
        {
            "authors": [
                "D. Shen",
                "J.X. Xu"
            ],
            "title": "An iterative learning control algorithm with gain adaptation for stochastic systems,\u201dIEEE",
            "venue": "Trans. Autom. Control,",
            "year": 2021
        },
        {
            "authors": [
                "R.H. Chi",
                "Y.C. Wei",
                "R.R. Wang"
            ],
            "title": "Observer based switching ILC for consensus of nonlinear nonaffine multi-agent systems,\u201dJ",
            "venue": "Franklin Inst.,",
            "year": 2021
        },
        {
            "authors": [
                "D.Y. Meng",
                "K.L. Moore"
            ],
            "title": "Robust iterative learning control for nonrepetitive uncertain systems,\u201dIEEE",
            "venue": "Trans. Autom. Control,",
            "year": 2017
        },
        {
            "authors": [
                "D.Y. Meng",
                "K.L. Moore"
            ],
            "title": "Convergence of iterative learning control for SISO nonrepetitive systems subject to iteration-dependent uncertainties,\u201dAutomatica",
            "year": 2017
        },
        {
            "authors": [
                "Y.Y. Chen",
                "W. Jiang",
                "T. Charalambous"
            ],
            "title": "Machine learning based iterative learning control for non-repetitive time-varying systems",
            "venue": "arXiv preprint arXiv:2107.00421, 2021.",
            "year": 2021
        },
        {
            "authors": [
                "K. Wan",
                "X.D. Li"
            ],
            "title": "High-order internal model based iterative learning control for 2-D linear FMMI systems with iteration-varying trajectory tracking,\u201dIEEE",
            "venue": "Trans. Syst. Man Cybern.: Syst.,",
            "year": 2021
        },
        {
            "authors": [
                "K. Wan"
            ],
            "title": "Robust high-order iterative learning control approach for twodimensional linear discrete time-varying Fornasini\u2013Marchesini systems with iteration-dependent reference trajectory,\u201dInt",
            "venue": "J. Syst. Sci.,",
            "year": 2022
        },
        {
            "authors": [
                "Y.S. Wei",
                "K. Wan",
                "Q.Y. Xu"
            ],
            "title": "Design of adaptive ILC for 2-D FMM systems with unknown control directions ,\u201dIEEE",
            "venue": "Access, vol",
            "year": 2019
        },
        {
            "authors": [
                "J.M. Xing",
                "R.H. Chi",
                "N. Lin"
            ],
            "title": "Adaptive iterative learning control for 2D nonlinear systems with nonrepetitive uncertainties,\u201dInt",
            "venue": "J. Robust Nonlinear Control,",
            "year": 2021
        },
        {
            "authors": [
                "K. Wan",
                "Y.S. Wei"
            ],
            "title": "Adaptive ILC of tracking nonrepetitive trajectory for two-dimensional nonlinear discrete time-varying Fornasini\u2013Marchesini systems with iteration-varying boundary states,\u201dInt",
            "venue": "J. Control Autom. Syst., vol. 19,",
            "year": 2021
        },
        {
            "authors": [
                "J.E. Piou",
                "A.J. Dumanian"
            ],
            "title": "Application of the Fornasini-Marchesini first model to data collected on a complex target model,\u201d2014",
            "venue": "American Control Conference (ACC) Portland, Oregon,",
            "year": 2014
        },
        {
            "authors": [
                "T. Kaczorek"
            ],
            "title": "Two-dimensional linear systems",
            "venue": "Heidelberg, Germany: Springer-Verlag,",
            "year": 1985
        },
        {
            "authors": [
                "E. Rimon",
                "A.F. Stappen"
            ],
            "title": "Immobilizing 2-D serial chains in formclosure grasps,\u201dIEEE",
            "venue": "Trans. Rob.,",
            "year": 2012
        },
        {
            "authors": [
                "K. Wan",
                "D.M. Xu",
                "Y.S. Wei"
            ],
            "title": "Iterative learning control for 2-D linear discrete Fornasini\u2013Marchesini model with input saturation,\u201dInt",
            "venue": "J. Syst. Sci., vol. 51,",
            "year": 2020
        },
        {
            "authors": [
                "S.T. Sun",
                "X.D. Li"
            ],
            "title": "Robust networked ILC for switched nonlinear discrete systems with non-repetitive uncertainties and random data dropouts,\u201dInt",
            "venue": "J. Syst. Sci., vol. 52,",
            "year": 2021
        },
        {
            "authors": [
                "K. Wan"
            ],
            "title": "Robust decentralized iterative learning control for large-scale interconnected systems described by 2-D Fornasini\u2013Marchesini systems with iteration-dependent uncertainties including boundary states, disturbances, and reference trajectory,\u201dInt",
            "venue": "J. Adapt Control Signal Process., doi: 10.1002/acs.3506,",
            "year": 2022
        },
        {
            "authors": [
                "W. Marszalek"
            ],
            "title": "Two-dimensional state-space discrete models for hyperbolic partial differential equations,\u201dAppl",
            "venue": "Math. Model.,",
            "year": 1984
        }
    ],
    "sections": [
        {
            "text": "INDEX TERMS 2-D linear discrete nonrepetitive systems (LNDS), 2-D linear nonrepetitive inequalities, iteration-dependent trajectory, robust iterative learning control.\nI. INTRODUCTION\nITERATIVE learning control (ILC), as an effective and un-supervised control method, has been extensively used in addressing the finite-time-based trajectory tracking problem for systems with nonrepetitive uncertainties, such as linear systems [1]-[4], stochastic systems [5]-[6], multi-agent systems [7]-[8], and nonrepetitive systems [9]-[11]. In [9]-[10], the ILC tracking problem for 1-D nonrepetitive discrete systems with nonrepetitive uncertainties in initial states, external disturbances, plant model matrices and desired reference trajectories was investigated. With an extended contraction mapping approach, robustly convergent results have been established. These aforementioned ILC results are designed for 1-D discrete systems.\nHowever, ILC results on 2-D discrete systems with nonrepetitive uncertainties are rarely reported. Among the few exceptions are [12]-[17], which mainly investigate the nonrepetitive uncertainties in boundary states, reference trajectory, trial lengths, and external disturbances. In [12]-[13], the robust ILC tracking on nonrepetitive uncertainties from\nreference trajectories described by a known high-order internal model (HOIM) operator and boundary states was investigated. By using the HOIM-based inequalities theory, the ultimate ILC tracking error can only converge to a bounded range. In [14], a P-type ILC law with compensation technique is presented to deal with the robust tracking for 2-D repetitive discrete systems with nonrepetitive uncertainties arising from reference trajectory, boundary states, and disturbances. With 2-D linear equalities theory, the final ILC tracking error is robustly convergent to be a bounded region. To this end, an adaptive ILC algorithm is proposed in [15] to achieve the precise tracking for 2-D repetitive discrete systems with nonrepetitive uncertainties from boundary states and reference trajectory. Afterwards, adaptive ILC algorithm applied to 2-D linear and repetitive discrete systems are studied in [16] and [17]. Unfortunately, in [15]-[17], they require that the input matrix is assumed to be positive-definite and 2-D discrete systems considered is repetitive.\nIn practical applications, there have some 2-D linear nonrepetitive systems (LNDS) required to execute tracking con-\n1\nThis work is licensed under a Creative Commons Attribution 4.0 License. For more information, see https://creativecommons.org/licenses/by/4.0/\ntrol tasks with a repetitive mode, such as 2-D distributed grid sensor networks [18], target echoes collected by a radar [19], thermal process [20], and 2-D multi-functional robotic manipulators [21]. In the 2-D distributed grid sensor networks, the vehicle path under surveillance equipped with regularly spaced sensor nodes, the sensor number is denoted by i. The sensor node signals are sampled in time for discrete processing, and j denotes the sample number, which is a 2-D discrete spatio-temporal system. Concretely, the 2-D multi-functional robotic manipulator needs to pick up and put down different loads for each repetitive operation such that the parameter values of the 2-D robot manipulator may be affected due to various loads at different iterations. Also, to control the temperature of heater exchanger in 2-D thermal process is to reach the desired temperature by repetitively injecting the liquid in the inlet. Influenced by outside temperature at each repetitive operation, the parameter values of heater exchanger may be changed. Therefore, it is essential and meaningful to investigate the robust ILC techniques for 2-D LNDS with iteration-dependent reference trajectory.\nThis paper aims to investigate the robust ILC tracking problem of a P-type ILC law and a high-order ILC law for 2-D LNDS with arbitrarily bounded reference trajectory and HOIM-based reference trajectory, respectively. With the help of 2-D linear nonrepetitive inequalities approach, it is theoretically proved that the bounds of ILC tracking error and the control input are shown to depend continuously on the bounds of nonrepetitive uncertainties. Particularly, if all the uncertainties converge with increasing iteration, the actual tracking output can precisely track 2-D reference trajectory. The main contributions of this paper are summarized in the following.\n1) Compared with the existing ILC algorithms for 2-D repetitive discrete systems with iteration-dependent reference trajectory, this paper first investigates the ILC designs to 2-D LNDS with iteration-dependent reference trajectory.\n2) Different from the adaptive ILC algorithm in [15]-[17], the proposed P-type ILC law and high-order ILC law in this paper have no restrictions on the numbers of control inputs and outputs.\n3) 2-D linear nonrepetitive inequalities is first proposed to analysis the robust ILC tracking for 2-D LNDS. Additionally, it is verified that the tracking performance of the high-order ILC law outperforms the lower-order ILC law in dealing with the tracking problem on HOIM-based reference trajectory.\nThe remainder of this paper is arranged as follows: Problem statement for 2-D LNDS is introduced in section II. Section III-IV show robust analysis of the P-type ILC law (3) and the high-order ILC law (39) under Assumption 1. Two simulation examples are provided in section V. Finally, section VI gives some conclusions of this paper.\nII. PROBLEM STATEMENT Consider the ILC issue for 2-D linear nonrepetitive discrete systems (LNDS)[12], [20], operating over a fixed region i =\n0, 1, 2, \u00b7 \u00b7 \u00b7 , T1 \u2212 1 and j = 0, 1, 2, \u00b7 \u00b7 \u00b7 , T2 \u2212 1:\nxk(i+ 1, j + 1)\n= A1,k(i+ 1, j)xk(i+ 1, j) +A2,k(i, j)xk(i, j)\n+A3,k(i, j + 1)xk(i, j + 1) +Bk(i, j)uk(i, j), (1)\nyk(i, j) = Ck(i, j)xk(i, j), (2)\nwhere i and j are discrete indexes along the horizontal direction and the vertical direction; k = 0, 1, 2, \u00b7 \u00b7 \u00b7 represents the iteration number; uk(i, j) \u2208 R, xk(i, j) \u2208 Rn, and yk(i, j) \u2208 R denote the control input, system state, and system output, respectively; A1,k(i + 1, j) \u2208 Rn\u00d7n, A2,k(i, j) \u2208 Rn\u00d7n,A3,k(i, j+1) \u2208 Rn\u00d7n,Bk(i, j) \u2208 Rn\u00d71, and Ck(i, j) \u2208 R1\u00d7n are nonrepetitive parameter matrices. In practical 2-D LNDS (1)-(2), i.e., chemical reactors, heater exchangers, and pipe furnaces, the independent indexes i and j usually represent space locations and time instants, respectively [25].\nRobust ILC Objective: For 2-D LNDS (1)-(2), the objective of robust ILC is to design an updating learning algorithm on uk(i, j), such that the ILC tracking error and the control input can robustly converge to a bounded range, the bound of which depends on the boundedness parameters on all the uncertainties, i.e.,\nlim sup k\u2192+\u221e \u2016ek(i, j)\u2016 \u2264 be, lim sup k\u2192+\u221e \u2016uk(i, j)\u2016 \u2264 bu, (3)\nwhere be > 0 and bu > 0 are two constants. The used norm \u2016 \u00b7 \u2016 of this paper is Euclidean norm. When all the nonrepetitive uncertainties converges along the iteration direction, the system output tracks the desired reference trajectory perfectly, i.e.,\nlim k\u2192+\u221e\n[yk(i, j)\u2212 yd,k(i, j)] = 0. (4)\nTo investigate the robust ILC problem for 2-D LNDS (1)- (2), the following Assumptions 1-3 and Lemmas 1-2 are made correspondingly. Assumption 1: For the 2-D LNDS (1)-(2), let\n\u2016yd,k(i, j)\u2016 \u2264 bd, i = 0, 1, \u00b7 \u00b7 \u00b7 , T1, j = 0, 1, \u00b7 \u00b7 \u00b7 , T2, \u2016A1,k(i+ 1, j)\u2016 \u2264 bA1,\ni = 0, 1, \u00b7 \u00b7 \u00b7 , T1 \u2212 1, j = 0, 1, \u00b7 \u00b7 \u00b7 , T2 \u2212 1, \u2016A2,k(i, j)\u2016 \u2264 bA2,\ni = 0, 1, \u00b7 \u00b7 \u00b7 , T1 \u2212 1, j = 0, 1, \u00b7 \u00b7 \u00b7 , T2 \u2212 1, \u2016A3,k(i, j + 1)\u2016 \u2264 bA3,\ni = 0, 1, \u00b7 \u00b7 \u00b7 , T1 \u2212 1, j = 0, 1, \u00b7 \u00b7 \u00b7 , T2 \u2212 1, \u2016Bk(i, j)\u2016 \u2264 bB ,\ni = 0, 1, \u00b7 \u00b7 \u00b7 , T1 \u2212 1, j = 0, 1, \u00b7 \u00b7 \u00b7 , T2 \u2212 1, \u2016Ck(i, j)\u2016 \u2264 bC ,\ni = 0, 1, \u00b7 \u00b7 \u00b7 , T1, j = 0, 1, \u00b7 \u00b7 \u00b7 , T2, \u2016xk(i, 0)\u2016 \u2264 bxi0 , i = 0, 1, \u00b7 \u00b7 \u00b7 , T1 \u2212 1, \u2016xk(0, j)\u2016 \u2264 bx0j , j = 0, 1, \u00b7 \u00b7 \u00b7 , T2,\n2\nThis work is licensed under a Creative Commons Attribution 4.0 License. For more information, see https://creativecommons.org/licenses/by/4.0/\nwhere bd > 0, bA1 > 0, bA2 > 0, bA3 > 0, bB > 0, bC > 0, bxi0 > 0, and bx0j > 0 are some finite bounds. Remark 1: In the ILC field of 2-D systems, Assumption 1 is essential and reasonable on the boundedness of 2-D reference trajectory, parameter matrices, and boundary states in iteration domain, which is key relaxation on the strictly repetitive requirement provided in traditional ILC for 2-D systems. Assumption 2: For any given 2-D reference trajectory yd(i, j), under boundary states xd(0, j) = x0(0, j) and xd(i, 0) = x0(i, 0), there exists a unique input ud(i, j), i = 0, 1, 2, \u00b7 \u00b7 \u00b7 , T1 \u2212 1, j = 0, 1, 2, \u00b7 \u00b7 \u00b7 , T2 \u2212 1 to make\nxd(i+ 1, j + 1)\n= A1(i+ 1, j)xd(i+ 1, j) +A2(i, j)xd(i, j)\n+A3(i, j + 1)xd(i, j + 1) +B(i, j)ud(i, j),\nyd(i, j) = C(i, j)xd(i, j),\nwhere x0(0, j) and x0(i, 0) are fixed functions with respective to j and i. Remark 2: Assumption 2 is a reasonable and basic assumption that it can guarantee our tracking task be achievable, which is popular in [22]. However, it is worth pointing out that Assumption 2 may be difficult to achieve in some cases, because it is usually hard to determine the unique desired input ud(i, j) for the 2-D reference trajectory. To avoid using the Assumption 2, an alternative analysis approach for ILC is to directly consider the tracking errors ek(i + 1, j + 1) and ek+1(i+ 1, j + 1) in [9] and [24]. Assumption 3: Let the reference trajectory yd,k(i, j), system parameters A1,k(i+ 1, j), A2,k(i, j), A3,k(i, j+ 1), Bk(i, j) and Ck(i, j), boundary states xk(i, 0) and xk(0, j) be the progressively convergent, i.e.,\nlim k\u2192+\u221e yd,k(i, j) = yd(i, j),\ni = 0, 1, \u00b7 \u00b7 \u00b7 , T1, j = 0, 1, \u00b7 \u00b7 \u00b7 , T2, lim\nk\u2192+\u221e A1,k(i+ 1, j) = A1(i+ 1, j),\ni = 0, 1, \u00b7 \u00b7 \u00b7 , T1 \u2212 1, j = 0, 1, \u00b7 \u00b7 \u00b7 , T2 \u2212 1, lim\nk\u2192+\u221e A2,k(i, j) = A2(i, j),\ni = 0, 1, \u00b7 \u00b7 \u00b7 , T1 \u2212 1, j = 0, 1, \u00b7 \u00b7 \u00b7 , T2 \u2212 1, lim\nk\u2192+\u221e A3,k(i, j + 1) = A3(i, j + 1),\ni = 0, 1, \u00b7 \u00b7 \u00b7 , T1 \u2212 1, j = 0, 1, \u00b7 \u00b7 \u00b7 , T2 \u2212 1, lim\nk\u2192+\u221e Bk(i, j) = B(i, j),\ni = 0, 1, \u00b7 \u00b7 \u00b7 , T1 \u2212 1, j = 0, 1, \u00b7 \u00b7 \u00b7 , T2 \u2212 1, lim\nk\u2192+\u221e Ck(i, j) = C(i, j),\ni = 0, 1, \u00b7 \u00b7 \u00b7 , T1, j = 0, 1, \u00b7 \u00b7 \u00b7 , T2, lim\nk\u2192+\u221e xk(i, 0) = x0(i, 0), i = 0, 1, \u00b7 \u00b7 \u00b7 , T1 \u2212 1,\nlim k\u2192+\u221e\nxk(0, j) = x0(0, j), j = 0, 1, \u00b7 \u00b7 \u00b7 , T2,\nfor some iteration-invariant matrices/vectors yd(i, j), A1(i+ 1, j), A2(i, j), A3(i, j + 1), B(i, j), and C(i, j).\nRemark 3: Assumption 3 is an extension to the progressively convergent condition deriving from ILC for 1-D discrete systems and has been used in ILC for 2-D repetitive systems [12], [14]. It is worth noting that Assumption 3 is not essential in achieving the robust ILC objective (3) but necessary in ensuring the perfect ILC tracking on 2-D reference trajectory, which is the same as those for robust ILC of 2-D repetitive systems. Lemma 1: Let nonnegative real sequences {dk} and {wk} satisfy the following inequality:\ndk+1 \u2264 N\u22121\u2211 h=0 \u03c1k\u2212hdk\u2212h + wk, k = N \u2212 1, N,N + 1, . . . ,\nwith \u03c1k\u2212h \u2265 0. If \u03c1k, \u03c1k\u22121, . . . , \u03c1k\u2212N+1 make \u03c1 =\u2211N\u22121 h=0 \u03c1k\u2212h < 1, then, the condition lim supk\u2192+\u221e wk \u2264 w\u221e implies lim sup k\u2192+\u221e dk \u2264 w\u221e 1\u2212 \u03c1 .\nThe proof of Lemma 1 is similar with that of Lemma 2.1 in [23], and is thus omitted. Lemma 2: For the following 2-D linear nonrepetitive inequalities over j = 0, 1, 2, \u00b7 \u00b7 \u00b7 , T2 \u2212 1:\n\u03b7k(j + 1) \u2264 N1\u22121\u2211 h=0 D1,k\u2212h(j)\u03b7k\u2212h(j) + N2\u22121\u2211 h=0 D2,k\u2212h(j)\n\u00d7 \u03c8k\u2212h(j) + \u03b1k(j),\n\u03c8k+1(j) \u2264 N1\u22121\u2211 h=0 D3,k\u2212h(j)\u03b7k\u2212h(j) + N2\u22121\u2211 h=0 D4,k\u2212h(j)\n\u00d7 \u03c8k\u2212h(j) + \u03b2k(j),\nwhere D1,k\u2212h(j), D2,k\u2212h(j), D3,k\u2212h(j) and D4,k\u2212h(j) are nonnegative and bounded functions. \u03b1k(j) and \u03b2k(j) are nonnegative and bounded functions, i.e., \u2016\u03b1k(j)\u2016 \u2264 b\u03b1, \u2016\u03b2k(j)\u2016 \u2264 b\u03b2 . Let boundary states \u03b7k(0) and \u03c8k(j), k = 0, 1, 2, \u00b7 \u00b7 \u00b7 , N2 \u2212 1 be bounded, if \u2211N2\u22121 h=0 D4,k\u2212h(j) < 1 is satisfied, then, we have\nlim sup k\u2192+\u221e\n\u2016\u03b7k(j)\u2016 \u2264 \u03b2\u03b7, j = 1, 2, \u00b7 \u00b7 \u00b7 , T2,\nlim sup k\u2192+\u221e\n\u2016\u03c8k(j)\u2016 \u2264 \u03b2\u03c8, j = 0, 1, 2, \u00b7 \u00b7 \u00b7 , T2 \u2212 1.\nIn particular, as limk\u2192+\u221e \u03b1k(j) = limk\u2192+\u221e \u03b2k(j) = 0, j = 0, 1, 2, \u00b7 \u00b7 \u00b7 , T2 \u2212 1, and limk\u2192+\u221e \u03b7k(0) = 0, there is\nlim k\u2192+\u221e\n\u03c8k(j) = 0, j = 0, 1, 2, \u00b7 \u00b7 \u00b7 , T2 \u2212 1.\nThe proof of Lemma 2 can follow that of Lemma 3 in [12], so it is omitted. Remark 4: Lemma 2 is a 2-D linear nonrepetitive inequalities and can be used to analysis the robustness and convergence of high-order ILC law [13] for 2-D repetitive discrete systems. In traditional ILC results for 2-D repetitive discrete systems, the used analysis approach can not be applied to the nonrepetitive case. To this end, the 2-D linear nonrepetitive inequalities approach in this paper is necessary to be developed.\n3\nThis work is licensed under a Creative Commons Attribution 4.0 License. For more information, see https://creativecommons.org/licenses/by/4.0/\nIn this paper, the following P-type ILC law for 2-D LNDS (1)-(2) is used for i = 0, 1, 2, \u00b7 \u00b7 \u00b7 , T1 \u2212 1 and j = 0, 1, 2, \u00b7 \u00b7 \u00b7 , T2 \u2212 1:\nuk+1(i, j) = uk(i, j) + Lk(i, j)ek(i+ 1, j + 1), (5)\nwhere the learning gain Lk(i, j) is to be designed.\nIII. ROBUST ANALYSIS OF THE P-TYPE ILC LAW (5) UNDER ASSUMPTION 1 In this section, we will investigate the robustness property of the ILC law (5) for 2-D LNDS (1)-(2), and the following Theorem 1 is presented. Theorem 1: Consider the 2-D LNDS (1)-(2) under Assumption 1, and let the ILC law (5) be applied. If the learning gain Lk(i, j) is chosen to make\n|1\u2212 Lk(i, j)Ck(i+ 1, j + 1)Bk(i, j)| < 1, (6)\nthen, the robust tracking objective (3) can be achieved. Proof: Using the P-type ILC law (5) and considering (1)-(2), it yields\nuk+1(i, j)\u2212 uk(i, j) = Lk(i, j) [ yd,k(i+ 1, j + 1)\u2212 Ck(i+ 1, j + 1)\n\u00d7 xk(i+ 1, j + 1) ]\n= Lk(i, j)yd,k(i+ 1, j + 1)\u2212 Lk(i, j)Ck(i+ 1, j + 1) \u00d7 [ A1,k(i+ 1, j)xk(i+ 1, j) +A2,k(i, j)xk(i, j)\n+A3,k(i, j + 1)xk(i, j + 1) +Bk(i, j)uk(i, j) ] , (7)\nwhere i = 0, 1, 2, \u00b7 \u00b7 \u00b7 , T1 \u2212 1 and j = 0, 1, 2, \u00b7 \u00b7 \u00b7 , T2 \u2212 1. Taking the arrangement on (7), it becomes\nuk+1(i, j) = [1\u2212 Lk(i, j)Ck(i+ 1, j + 1)Bk(i, j)]uk(i, j) + \u03c6k(i, j), (8)\nwhere\n\u03c6k(i, j)\n= Lk(i, j)yd,k(i+ 1, j + 1)\u2212 Lk(i, j)Ck(i+ 1, j + 1) \u00d7 [ A1,k(i+ 1, j)xk(i+ 1, j) +A2,k(i, j)xk(i, j)\n+A3,k(i, j + 1)xk(i, j + 1) ] . (9)\nTaking the norm on both sides of (8), we obtain\n\u2016uk+1(i, j)\u2016 \u2264 |1\u2212 Lk(i, j)Ck(i+ 1, j + 1)Bk(i, j)| \u00d7 \u2016uk(i, j)\u2016+ \u2016\u03c6k(i, j)\u2016. (10)\nWith regard to \u03c6k(i, j) given in (9), from Assumption 1, there is\n\u2016\u03c6k(i, j)\u2016 \u2264 bd\u2016Lk(i, j)\u2016+ bC\u2016Lk(i, j)\u2016 ( bA1\u2016xk(i+ 1, j)\u2016\n+ bA2\u2016xk(i, j)\u2016+ bA3\u2016xk(i, j + 1)\u2016 ) . (11)\nSubstituting (11) into (10), it generates\n\u2016uk+1(i, j)\u2016 \u2264 |1\u2212 Lk(i, j)Ck(i+ 1, j + 1)Bk(i, j)|\u2016uk(i, j)\u2016\n+ bd\u2016Lk(i, j)\u2016+ bC\u2016Lk(i, j)\u2016 ( bA1\u2016xk(i+ 1, j)\u2016\n+ bA2\u2016xk(i, j)\u2016+ bA3\u2016xk(i, j + 1)\u2016 ) . (12)\nLet Uk(j) = [ \u2016uk(0, j)\u2016, \u2016uk(1, j)\u2016, \u00b7 \u00b7 \u00b7 , \u2016uk(T1 \u2212 1, j)\u2016 ]T ,\n(13) Xk(j) = [ \u2016xk(1, j)\u2016, \u2016xk(2, j)\u2016, \u00b7 \u00b7 \u00b7 , \u2016xk(T1, j)\u2016 ]T .\n(14)\nThen, (12) can be rewritten as\nUk+1(j)\n\u2264 \u03a61,k(j)Uk(j) + \u03a62,k(j)Xk(j + 1) + \u03a63,k(j)Xk(j) + \u03a64,k(j)\u2016xk(0, j + 1)\u2016+ \u03a65,k(j)\u2016xk(0, j)\u2016 + \u03a66,k(j), (15)\nwhere\n\u03a61,k(j) =  a0k(0, j) 0 0 0 a1k(0, j) 0 0 0 a2k(0, j) ...\n. . . . . . 0 \u00b7 \u00b7 \u00b7 0 \u00b7 \u00b7 \u00b7 0 \u00b7 \u00b7 \u00b7 0 . . .\n... . . . 0 0 a0k(T1 \u2212 1, j)  , a0k(i, j) = |1\u2212 Lk(i, j)Ck(i+ 1, j + 1)Bk(i, j)|,\n\u03a62,k(j) =  0 0 0 . . . 0 a1k(1, j) 0 0 . . . 0 0 a1k(2, j) 0 . . . ... ...\n. . . . . . . . . 0 0 . . . 0 a1k(T1 \u2212 1, j) 0  , a1k(i, j) = bA3bC\u2016Lk(i, j)\u2016,\n\u03a63,k(j) =  a2k(0, j) 0 0 a3k(1, j) a 2 k(1, j) 0 0 a3k(2, j) a 2 k(2, j) ... . . . . . .\n0 \u00b7 \u00b7 \u00b7 0 \u00b7 \u00b7 \u00b7 0 \u00b7 \u00b7 \u00b7 0 . . .\n... . . . 0\na3k(T1 \u2212 1, j) a2k(T1 \u2212 1, j)\n ,\n4\nThis work is licensed under a Creative Commons Attribution 4.0 License. For more information, see https://creativecommons.org/licenses/by/4.0/\na2k(i, j) = bCbA1\u2016Lk(i, j)\u2016, a3k(i, j) = bCbA2\u2016Lk(i, j)\u2016,\n\u03a64,k(j) =  bCbA3\u2016Lk(0, j)\u2016\n0 0 ... 0\n ,\n\u03a65,k(j) =  bCbA2\u2016Lk(0, j)\u2016\n0 0 ... 0\n ,\n\u03a66,k(j) =  bLbd 0 0 . . . 0 0 bLbd 0 . . . 0 0 0 bLbd . . . ... ...\n. . . . . . . . . 0 0 . . . 0 0 bLbd\n . (16)\nOn the other hand, taking the norm on both sides of (1), there is\n\u2016xk(i+ 1, j + 1)\u2016 \u2264 bA1\u2016xk(i+ 1, j)\u2016+ bA2\u2016xk(i, j)\u2016+ bA3\u2016xk(i, j + 1)\u2016\n+ \u2016Bk(i, j)\u2016\u2016uk(i, j)\u2016. (17)\nFrom (13)-(14), (17) can be formulated as\n\u03a81,k(j)Xk(j + 1)\n\u2264 \u03a82,k(j)Xk(j) + \u03a83,k(j)Uk(j) + \u03a84,k(j)\u2016xk(0, j + 1)\u2016 + \u03a85,k(j)\u2016xk(0, j)\u2016, (18)\nwhere\n\u03a81,k(j) =  In 0 0 . . . 0 \u2212bA3 In 0 . . . 0 0 \u2212bA3 In . . . ... ...\n. . . . . . . . . 0 0 . . . 0 \u2212bA3 In\n ,\n\u03a82,k(j) =  bA1 0 0 . . . 0 bA2 bA1 0 . . . 0 0 bA2 bA1 . . . ... ...\n. . . . . . . . . 0 0 . . . 0 bA2 bA1\n ,\n\u03a83,k(j) =  bB 0 0 . . . 0 0 bB 0 . . . 0 0 0 bB . . . ... ...\n. . . . . . . . . 0 0 . . . 0 0 bB\n ,\n\u03a84,k(j) =  bA3 0 0 ... 0  , \u03a85,k(j) =  bA2 0 0 ... 0  . Since \u03a81,k(j) is a nonsingular matrix, multiplying by \u03a8\u221211,k(j) on both sides of (18), it obtains\nXk(j + 1) \u2264 \u03a8\u221211,k(j)\u03a82,k(j)Xk(j) + \u03a8 \u22121 1,k(j)\u03a83,k(j)Uk(j)\n+ \u03a8\u221211,k(j)\u03a84,k(j)\u2016xk(0, j + 1)\u2016 + \u03a8\u221211,k(j)\u03a85,k(j)\u2016xk(0, j)\u2016. (19)\nInserting (19) into (15), it yields\nUk+1(j) \u2264 ( \u03a61,k(j) + \u03a62,k(j)\u03a8 \u22121 1,k(j)\u03a83,k(j) ) Uk(j)\n+ ( \u03a63,k(j) + \u03a62,k(j)\u03a8 \u22121 1,k(j)\u03a82,k(j) ) Xk(j)\n+ ( \u03a64,k(j) + \u03a62,k(j)\u03a8 \u22121 1,k(j)\u03a84,k(j) ) \u2016xk(0, j + 1)\u2016\n+ ( \u03a65,k(j) + \u03a62,k(j)\u03a8 \u22121 1,k(j)\u03a85,k(j) ) \u2016xk(0, j)\u2016\n+ \u03a66,k(j). (20)\nFor (19) and (20), according to Lemma 2, if \u2016\u03a61,k(j) + \u03a62,k(j)\u03a8 \u22121 1,k(j)\u03a83,k(j)\u2016 < 1 (equivalently, |1 \u2212 Lk(i, j)Ck(i+ 1, j + 1)Bk(i, j)| < 1), we have{ lim supk\u2192+\u221eXk(j) \u2264 \u03b2X , j = 1, 2, \u00b7 \u00b7 \u00b7 , T2, lim supk\u2192+\u221e Uk(j) \u2264 \u03b2U , j = 0, 1, 2, \u00b7 \u00b7 \u00b7 , T2 \u2212 1, (21) where \u03b2X > 0 and \u03b2U > 0 are two positive constants. From (13) and (14), we further obtain\nlim sup k\u2192+\u221e\n\u2016xk(i, j)\u2016 \u2264 \u03b2X , (22)\nlim sup k\u2192+\u221e\n\u2016uk(i, j)\u2016 \u2264 \u03b2U . (23)\nUsing Assumption 1 and (22), we have\nlim sup k\u2192+\u221e\n\u2016ek(i, j)\u2016\n= lim sup k\u2192+\u221e\n\u2016yd,k(i, j)\u2212 Ck(i, j)xk(i, j)\u2016\n\u2264 bd + bC lim sup k\u2192+\u221e \u2016xk(i, j)\u2016 \u2264 bd + bC\u03b2X , \u03b2e,\nwhere \u03b2e is associated with the boundedness parameters bd, bA1, bA2, bA3, bC , bB , bxi0 , and bx0j presented in Assumption 1. The proof of Theorem 1 is completed.\nFrom Theorem 1, it provides the boundedness result on ILC tracking error and the control input for 2-D LNDS (1)- (2) under Assumption 1. While a progressively convergent condition on the reference trajectory, system parameters, and boundary states is imposed on the 2-D LNDS (1)-(2), a perfectly convergent result is given. There is the following Theorem 2. Theorem 2: Consider the 2-D LNDS (1)-(2) under Assumptions 1-3, and let the ILC law (5) be used. If the learning gain Lk(i, j) is chosen to make (6) be satisfied, then, the perfect tracking objective (4) can be accomplished.\n5\nThis work is licensed under a Creative Commons Attribution 4.0 License. For more information, see https://creativecommons.org/licenses/by/4.0/\nProof: For i = 0, 1, \u00b7 \u00b7 \u00b7 , T1 \u2212 1 and j = 0, 1, \u00b7 \u00b7 \u00b7 , T2 \u2212 1, define\n\u03b4uk(i, j) = ud(i, j)\u2212 uk(i, j), (24)\nand for i = 1, 2, \u00b7 \u00b7 \u00b7 , T1 and j = 1, 2, \u00b7 \u00b7 \u00b7 , T2,\n\u03b4xk(i, j) = xd(i, j)\u2212 xk(i, j). (25)\nUsing (25) and inserting (1) with Assumption 2, there is\n\u2016\u03b4xk(i+ 1, j + 1)\u2016 = \u2016xd(i+ 1, j + 1)\u2212 xk(i+ 1, j + 1)\u2016 = \u2016A1(i+ 1, j)xd(i+ 1, j) +A2(i, j)xd(i, j)\n+A3(i, j + 1)xd(i, j + 1) +B(i, j)ud(i, j)\n\u2212A1,k(i+ 1, j)xk(i+ 1, j)\u2212A2,k(i, j)xk(i, j) \u2212A3,k(i, j + 1)xk(i, j + 1)\u2212Bk(i, j)uk(i, j)\u2016 \u2264 \u2016A1,k(i+ 1, j)\u2016\u2016\u03b4xk(i+ 1, j)\u2016+ \u2016A1,k(i+ 1, j) \u2212A1(i+ 1, j)\u2016\u2016xd(i+ 1, j)\u2016+ \u2016A2,k(i, j)\u2016\u2016\u03b4xk(i, j)\u2016 + \u2016A2,k(i, j)\u2212A2(i, j)\u2016\u2016xd(i, j)\u2016+ \u2016A3,k(i, j + 1)\u2016 \u00d7 \u2016\u03b4xk(i, j + 1)\u2016+ \u2016A3,k(i, j + 1)\u2212A3(i, j + 1)\u2016 \u00d7 \u2016xd(i, j + 1)\u2016+ \u2016Bk(i, j)\u2016\u2016\u03b4uk(i, j)\u2016 + \u2016B(i, j)\u2212Bk(i, j)\u2016\u2016ud(i, j)\u2016, (26)\nwhere \u2016xd(i, j)\u2016 \u2264 bxd and \u2016ud(i, j)\u2016 \u2264 bud. Subsequently, applying (5) and considering (1), we deduce\n\u03b4uk+1(i, j) = \u03b4uk(i, j)\u2212 Lk(i, j) [ yd,k(i+ 1, j + 1)\u2212 yd(i+ 1, j + 1)\n+ C(i+ 1, j + 1)xd(i+ 1, j + 1) \u2212 Ck(i+ 1, j + 1)xk(i+ 1, j + 1) ]\n= \u03b4uk(i, j)\u2212 Lk(i, j)[yd,k(i+ 1, j + 1)\u2212 yd(i+ 1, j + 1)] \u2212 Lk(i, j)[C(i+ 1, j + 1)\u2212 Ck(i+ 1, j + 1)] \u00d7 xd(i+ 1, j + 1)\u2212 Lk(i, j)Ck(i+ 1, j + 1) \u00d7 \u03b4xk(i+ 1, j + 1)\n= [ 1\u2212 Lk(i, j)Ck(i+ 1, j + 1)Bk(i, j) ] \u03b4uk(i, j)\n+ \u03a8k(i, j), (27)\nwhere\n\u03a8k(i, j)\n=\u2212 Lk(i, j)[yd,k(i+ 1, j + 1)\u2212 yd(i+ 1, j + 1)] \u2212 Lk(i, j)[C(i+ 1, j + 1)\u2212 Ck(i+ 1, j + 1)] \u00d7 xd(i+ 1, j + 1)\u2212 Lk(i, j)Ck(i+ 1, j + 1)\n\u00d7 [ A1(i+ 1, j)xd(i+ 1, j) +A2(i, j)xd(i, j)\n+A3(i, j + 1)xd(i, j + 1)\u2212A1,k(i+ 1, j)xk(i+ 1, j) \u2212A2,k(i, j)xk(i, j)\u2212A3,k(i, j + 1)xk(i, j + 1)\n+ [B(i, j)\u2212Bk(i, j)]ud(i, j) ] .\nTaking the norm on both sides of (27), and using (18), we have\n\u2016\u03b4uk+1(i, j)\u2016 \u2264 |1\u2212 Lk(i, j)Ck(i+ 1, j + 1)Bk(i, j)|\u2016\u03b4uk(i, j)\u2016\n+ \u2016\u03a8k(i, j)\u2016, (28)\nwhere\n\u2016\u03a8k(i, j)\u2016 \u2264 \u2016Lk(i, j)\u2016 [ \u2016yd,k(i+ 1, j + 1)\u2212 yd(i+ 1, j + 1)\u2016\n+ bd\u2016C(i+ 1, j + 1)\u2212 Ck(i+ 1, j + 1)\u2016 ]\n+ \u2016Lk(i, j)\u2016bC [ bA1\u2016\u03b4xk(i+ 1, j)\u2016\n+ \u2016A1,k(i+ 1, j)\u2212A1(i+ 1, j)\u2016bxd + bA2\u2016\u03b4xk(i, j)\u2016 + \u2016A2,k(i, j)\u2212A2(i, j)\u2016bxd + bA3\u2016\u03b4xk(i, j + 1)\u2016+ \u2016A3,k(i, j + 1)\u2212A3(i, j + 1)\u2016\n\u00d7 bxd + \u2016B(i, j)\u2212Bk(i, j)\u2016bud ] . (29)\nAdditionally, Using Assumption 1 and (1), we have\n\u2016ek(i, j)\u2016 = \u2016yd,k(i, j)\u2212 Ck(i, j)xk(i, j)\u2016 = \u2016yd,k(i, j)\u2212 yd(i, j) + C(i, j)xd(i, j)\u2212 Ck(i, j)xk(i, j)\u2016 = \u2016yd,k(i, j)\u2212 yd(i, j) + [C(i, j)\u2212 Ck(i, j)]xd(i, j)\n+ Ck(i, j)[xd(i, j)\u2212 xk(i, j)]\u2016 \u2264 \u2016yd,k(i, j)\u2212 yd(i, j)\u2016+ \u2016C(i, j)\u2212 Ck(i, j)\u2016bd\n+ bC\u2016\u03b4xk(i, j)\u2016. (30)\nLet\n\u03b4X\u0304k(j) = [ \u2016\u03b4xk(1, j)\u2016, \u2016\u03b4xk(2, j)\u2016, \u00b7 \u00b7 \u00b7 , \u2016\u03b4xk(T1, j)\u2016 ]T , (31)\n\u03b4U\u0304k(j) = [ \u2016\u03b4uk(0, j)\u2016, \u2016\u03b4uk(1, j)\u2016, \u00b7 \u00b7 \u00b7 , \u2016\u03b4uk(T1 \u2212 1, j)\u2016 ]T .\n(32)\nSimilar to the proof of Theorem 1, the form of (28) with (29) is similar with that of (10) with (11), and so is (26) to (12). Then, using Lemma 2, if the condition (6) is satisfied, we obtain\nlim k\u2192+\u221e\n\u03b4X\u0304k(j) = 0, j = 1, 2, \u00b7 \u00b7 \u00b7 , T2, (33)\nlim k\u2192+\u221e\n\u03b4U\u0304k(j) = 0, j = 0, 1, 2, \u00b7 \u00b7 \u00b7 , T2 \u2212 1. (34)\nFrom (31) and (32), it yields\nlim k\u2192+\u221e\n\u2016\u03b4xk(i, j)\u2016 = 0, (35)\nlim k\u2192+\u221e\n\u2016\u03b4uk(i, j)\u2016 = 0. (36)\nFrom Assumption 3, using (30) and (35), there is\nlim k\u2192+\u221e \u2016ek(i, j)\u2016 = 0, i = 1, 2, \u00b7 \u00b7 \u00b7 , T1, j = 1, 2, \u00b7 \u00b7 \u00b7 , T2. (37)\n6\nThis work is licensed under a Creative Commons Attribution 4.0 License. For more information, see https://creativecommons.org/licenses/by/4.0/\nThe proof of Theorem 2 is completed. Remark 5: For practical 2-D LNDS (1)-(2), we may identify or estimate the nominal information on Ck(i, j) and Bk(i, j) to determine the learning gain Lk(i, j) in the P-type ILC law (5). Let\nBk(i, j) = B(i, j)+\u03b4Bk(i, j), Ck(i, j) = C(i, j)+\u03b4Ck(i, j),\nwhere B(i, j) and C(i, j) are the nominal system matrices, and \u03b4Bk(i, j) and \u03b4Ck(i, j) are bounded nonrepetitive uncertainties of them such that \u2016\u03b4Bk(i, j)\u2016 \u2264 \u03b2\u03b4B(i, j), \u2016\u03b4Ck(i, j)\u2016 \u2264 \u03b2\u03b4C(i, j). Correspondingly, we employ iteration-invariant learning gain Lk(i, j) = L(i, j). The convergence condition (6) becomes as\n|1\u2212 L(i, j)C(i+ 1, j + 1)B(i, j)|+ \u03b2CB(i, j)|L(i, j)| < 1,\nwhere \u03b2CB(i, j) = \u03b2\u03b4B(i, j)\u2016C(i + 1, j + 1)\u2016 + \u03b2\u03b4B(i, j)\u03b2\u03b4C(i + 1, j + 1) + \u03b2\u03b4C(i + 1, j + 1)\u2016B(i, j)\u2016. The identified nominal matrices play a dominant role in implementing P-type ILC law. Therefore, we may reasonably obtain |C(i+1, j+1)B(i, j)| > \u03b2CB(i, j), which guarantees (6) with the selection of L(i, j) = 1C(i+1,j+1)B(i,j) . Remark 6: In Theorems 1 and 2, the proposed P-type ILC law may be difficult to address the robust ILC problem of the iteration-dependent reference trajectory generated by a HOIM strategy, which is illustrated by simulation example. To this end, a high-order ILC law is designed to deal with this HOIM-based reference trajectory, which is denoted as\nyd,k+1(i, j) = M\u2211 m=0 hmyd,k\u2212m(i, j), k \u2265M, (38)\nwhere yd,k(i, j), k = 0, 1, 2, \u00b7 \u00b7 \u00b7 ,M are the initial reference trajectories; hm, m = 0, 1, 2, \u00b7 \u00b7 \u00b7 ,M are the coefficients designed to describe the variation of the 2-D reference trajectory in iteration domain, such that all roots of the stable characteristic polynomial S(z) = zM+1\u2212h0zM\u2212h1zM\u22121\u2212 \u00b7 \u00b7 \u00b7 \u2212 hM = 0 lie in the unit circle except at least one simple root on the unit circle [12].\nIn this section, a high-order ILC law for 2-D LNDS (1)-(2) is given as follows:\nuk+1(i, j) = M\u2211 m=0 hmuk\u2212m(i, j)\n+ M\u2211 m=0 Lm,k(i, j)ek\u2212m(i+ 1, j + 1), (39)\nwhere Lm,k(i, j), m = 0, 1, 2, \u00b7 \u00b7 \u00b7 ,M are the learning gains to be designed.\nIV. ROBUST ANALYSIS OF THE HIGH-ORDER ILC LAW (39) UNDER ASSUMPTION 1 To analysis the robustness and convergence of the proposed high-order ILC law (39) for 2-D LNDS (1)-(2) under Assumption 1 and (38), the following Theorem 3 is presented. Theorem 3: Consider the 2-D LNDS (1)-(2) under Assumption 1 and HOIM-based reference trajectory (38), and let\nthe high-order ILC law (39) be applied. If the learning gain Lm,k(i, j) is chosen to make\nM\u2211 m=0 |hm \u2212 Lm,k(i, j)Ck\u2212m(i+ 1, j + 1)Bk\u2212m(i, j)| < 1,\n(40)\nthen, the robust tracking objective (3) can be achieved. Proof. Using (39) and considering (1)-(2), it yields\nuk+1(i, j)\u2212 M\u2211 m=0 hmuk\u2212m(i, j)\n= M\u2211 m=0 Lm,k(i, j)[yd,k\u2212m(i+ 1, j + 1)\n\u2212 Ck\u2212m(i+ 1, j + 1)xk\u2212m(i+ 1, j + 1)]\n= M\u2211 m=0 Lm,k(i, j)yd,k\u2212m(i+ 1, j + 1)\n\u2212 M\u2211 m=0 Lm,k(i, j)Ck\u2212m(i+ 1, j + 1)\n\u00d7 [ A1,k\u2212m(i+ 1, j)xk\u2212m(i+ 1, j)\n+A2,k\u2212m(i, j)xk\u2212m(i, j)\n+A3,k\u2212m(i, j + 1)xk\u2212m(i, j + 1) +Bk\u2212m(i, j)uk\u2212m(i, j) ] , (41)\nwhere i = 0, 1, 2, \u00b7 \u00b7 \u00b7 , T1 \u2212 1 and j = 0, 1, 2, \u00b7 \u00b7 \u00b7 , T2 \u2212 1. Arranging (41), it becomes\nuk+1(i, j)\n= M\u2211 m=0 [hm \u2212 Lm,k(i, j)Ck\u2212m(i+ 1, j + 1)Bk\u2212m(i, j)]\n\u00d7 uk\u2212m(i, j) + \u03c6\u0304k(i, j), (42)\nwhere\n\u03c6\u0304k(i, j) = M\u2211 m=0 Lm,k(i, j)yd,k\u2212m(i+ 1, j + 1)\n\u2212 M\u2211 m=0 Lm,k(i, j)Ck\u2212m(i+ 1, j + 1)\n\u00d7 [ A1,k\u2212m(i+ 1, j)xk\u2212m(i+ 1, j)\n+A2,k\u2212m(i, j)xk\u2212m(i, j) +A3,k\u2212m(i, j + 1)xk\u2212m(i, j + 1) ] . (43)\nTaking the norm on both sides of (42), we obtain\n\u2016uk+1(i, j)\u2016\n\u2264 M\u2211 m=0 |hm \u2212 Lm,k(i, j)Ck\u2212m(i+ 1, j + 1)Bk\u2212m(i, j)|\n\u00d7 \u2016uk\u2212m(i, j)\u2016+ \u2016\u03c6\u0304k(i, j)\u2016. (44)\n7\nThis work is licensed under a Creative Commons Attribution 4.0 License. For more information, see https://creativecommons.org/licenses/by/4.0/\nRegarding to \u03c6\u0304k(i, j) given in (43), from Assumption 1, there is\n\u2016\u03c6\u0304k(i, j)\u2016\n\u2264 bdbL(M + 1) + bCbL M\u2211 m=0 ( bA1\u2016xk\u2212m(i+ 1, j)\u2016\n+ bA2\u2016xk\u2212m(i, j)\u2016+ bA3\u2016xk\u2212m(i, j + 1)\u2016 ) . (45)\nSubstituting (45) into (44), it becomes\n\u2016uk+1(i, j)\u2016\n\u2264 M\u2211 m=0 |hm \u2212 Lm,k(i, j)Ck\u2212m(i+ 1, j + 1)Bk\u2212m(i, j)|\n\u00d7 \u2016uk\u2212m(i, j)\u2016+ bdbL(M + 1)\n+ bCbL M\u2211 m=0 ( bA1\u2016xk\u2212m(i+ 1, j)\u2016+ bA2\u2016xk\u2212m(i, j)\u2016\n+ bA3\u2016xk\u2212m(i, j + 1)\u2016 ) . (46)\nFrom the definitions on Uk(j) and Xk(j) in (13) and (14), we obtain\nUk+1(j)\n\u2264 M\u2211 m=0 \u03a61,k\u2212m(j)Uk\u2212m(j) + M\u2211 m=0 \u03a62,k\u2212m(j)Xk\u2212m(j + 1)\n+ M\u2211 m=0 \u03a63,k\u2212m(j)Xk\u2212m(j) + M\u2211 m=0 \u03a64,k\u2212m(j)\n\u00d7 \u2016xk\u2212m(0, j + 1)\u2016+ M\u2211 m=0 \u03a65,k\u2212m(j)\u2016xk\u2212m(0, j)\u2016\n+ M\u2211 m=0 \u03a66,k\u2212m(j), (47)\nwhere \u03a61,k, \u03a62,k, \u03a63,k, \u03a64,k, \u03a65,k, and \u03a66,k are given in (15). Similarly, we still can get (19). Inserting (19) into (47), there is\nUk+1(j)\n\u2264 M\u2211 m=0 ( \u03a61,k\u2212m(j) + \u03a62,k\u2212m(j)\u03a8 \u22121 1,k(j)\u03a83,k(j) ) Uk\u2212m(j)\n+ M\u2211 m=0 ( \u03a63,k\u2212m(j) + \u03a62,k\u2212m(j)\u03a8 \u22121 1,k(j)\u03a82,k(j) ) \u00d7Xk\u2212m(j)\n+ M\u2211 m=0 ( \u03a64,k\u2212m(j) + \u03a62,k\u2212m(j)\u03a8 \u22121 1,k(j)\u03a84,k(j) ) \u00d7 \u2016xk\u2212m(0, j + 1)\u2016\n+ M\u2211 m=0 ( \u03a65,k\u2212m(j) + \u03a62,k\u2212m(j)\u03a8 \u22121 1,k(j)\u03a85,k(j) ) \u00d7 \u2016xk\u2212m(0, j)\u2016+\nM\u2211 m=0 \u03a66,k\u2212m(j), (48)\nwhere \u03a81,k(j), \u03a82,k(j), \u03a83,k(j), \u03a84,k(j), and \u03a85,k(j) are given in (18). For (19) and (48), based on Lemma 2, if \u2211M m=0 \u2016\u03a61,k\u2212m(j) + \u03a62,k\u2212m(j)\u03a8 \u22121 1,k(j)\u03a83,k(j)\u2016 <\n1 (equivalently, \u2211M m=0 |hm \u2212 Lm,k(i, j)Ck\u2212m(i + 1, j + 1)Bk\u2212m(i, j)| < 1), the robust ILC tracking objective (3) can be finished. The proof of Theorem 3 is completed. Remark 7: Similar to Remark 5, we use the estimated information on Ck(i, j) and Bk(i, j) to select the learning gains Lm,k(i, j), m = 0, 1, 2, \u00b7 \u00b7 \u00b7 ,M in the high-order ILC law (39). The convergence condition (40) is reformulated as\nM\u2211 m=0 [ |hm \u2212 Lm(i, j)C(i+ 1, j + 1)B(i, j)|\n+ \u03b2CB(i, j)|Lm(i, j)| ] < 1,\nwhere \u03b2CB(i, j) is defined in Remark 5. Thus, we may reasonably get |C(i+ 1, j+ 1)B(i, j)| > \u03b2CB(i, j) \u2211M m=0 hm, which guarantees (40) with Lm(i, j) = hmC(i+1,j+1)B(i,j) . As the high order ILC law (39) is applied to the 2-D LNDS (1)-(2) with xk(0, j) and xk(i, 0) satisfying the HOIM-based iterative boundary conditions, which is given as the following Assumption 4. Assumption 4: Let the system parameters A1,k(i + 1, j), A2,k(i, j), A3,k(i, j + 1), Bk(i, j) and Ck(i, j) be progressively convergent, i.e.,\nlim k\u2192+\u221e A1,k(i+ 1, j) = A1(i+ 1, j),\nlim k\u2192+\u221e A2,k(i, j) = A2(i, j),\nlim k\u2192+\u221e A3,k(i, j + 1) = A3(i, j + 1),\nlim k\u2192+\u221e Bk(i, j) = B(i, j),\nlim k\u2192+\u221e Ck(i, j) = C(i, j),\nand meanwhile, the boundary states xk(i, 0) and xk(0, j) satisfy the HOIM asymptotically, i.e.,\nlim k\u2192\u221e\n[ xk+1(i, 0)\u2212\nM\u2211 m=0 hmxk\u2212m(i, 0)\n] = 0,\nlim k\u2192\u221e\n[ xk+1(0, j)\u2212\nM\u2211 m=0 hmxk\u2212m(0, j)\n] = 0.\nWith Assumption 4, we present the following Theorem 4 to provide the perfect tracking result on HOIM-based reference trajectory. Theorem 4: Consider the 2-D LNDS (1)-(2) under Assumption 4 and HOIM-based reference trajectory (38), and let the high-order ILC law (39) be used. If the learning gains Lm,k(i, j) are chosen to make (40) and\nM\u2211 m=0 |hm \u2212 Ck(i+ 1, j + 1)Bk(i, j)Lm,k(i, j)| < 1, (49)\nbe satisfied, then, the result of perfect tracking objective (4) can be obtained.\n8\nThis work is licensed under a Creative Commons Attribution 4.0 License. For more information, see https://creativecommons.org/licenses/by/4.0/\nProof. Using ek(i, j) = yd,k(i, j)\u2212yk(i, j), considering (38), (1) and (2), there is\nek+1(i+ 1, j + 1)\n= M\u2211 m=0 hmyd,k\u2212m(i+ 1, j + 1)\u2212 yk+1(i+ 1, j + 1)\n= M\u2211 m=0 hm[ek\u2212m(i+ 1, j + 1) + yk\u2212m(i+ 1, j + 1)]\n\u2212 Ck+1(i+ 1, j + 1)xk+1(i+ 1, j + 1)\n= M\u2211 m=0 hmek\u2212m(i+ 1, j + 1)\n+ M\u2211 m=0 hmCk\u2212m(i+ 1, j + 1) [ A1,k\u2212m(i+ 1, j) \u00d7 xk\u2212m(i+ 1, j) +A2,k\u2212m(i, j)xk\u2212m(i, j) +A3,k\u2212m(i, j + 1)xk\u2212m(i, j + 1) +Bk\u2212m(i, j)\n\u00d7 uk\u2212m(i, j) ] \u2212 Ck+1(i+ 1, j + 1) [ A1,k+1(i+ 1, j)\n\u00d7 xk+1(i+ 1, j) +A2,k+1(i, j)xk+1(i, j) +A3,k+1(i, j + 1)xk+1(i, j + 1) +Bk+1(i, j)uk+1(i, j) ]\n= M\u2211 m=0 hmek\u2212m(i+ 1, j + 1)\u2212 Ck(i+ 1, j + 1)Bk(i, j)\n\u00d7 uk+1(i, j) + M\u2211 m=0 hmCk\u2212m(i+ 1, j + 1)\n\u00d7 [ A1,k\u2212m(i+ 1, j)xk\u2212m(i+ 1, j) +A2,k\u2212m(i, j)\n\u00d7 xk\u2212m(i, j) +A3,k\u2212m(i, j + 1)xk\u2212m(i, j + 1) +Bk\u2212m(i, j)uk\u2212m(i, j) ] \u2212 Ck+1(i+ 1, j + 1)\n\u00d7 [ A1,k+1(i+ 1, j)xk+1(i+ 1, j) +A2,k+1(i, j)\n\u00d7 xk+1(i, j) +A3,k+1(i, j + 1)xk+1(i, j + 1) ]\n+ [Ck(i+ 1, j + 1)Bk(i, j)\u2212 Ck+1(i+ 1, j + 1) \u00d7Bk+1(i, j)]uk+1(i, j). (50)\nUsing the high-order ILC law (39), there is\nek+1(i+ 1, j + 1)\n= M\u2211 m=0 [hm \u2212 Ck(i+ 1, j + 1)Bk(i, j)Lm,k(i, j)]\n\u00d7 ek\u2212m(i+ 1, j + 1) + \u03b8k(i, j), (51)\nwhere\n\u03b8k(i, j)\n= M\u2211 m=0 hmCk\u2212m(i+ 1, j + 1) [ A1,k\u2212m(i+ 1, j)\n\u00d7 xk\u2212m(i+ 1, j) +A2,k\u2212m(i, j)xk\u2212m(i, j) +A3,k\u2212m(i, j + 1)xk\u2212m(i, j + 1) ]\n+ M\u2211 m=0 hm[Ck\u2212m(i+ 1, j + 1)Bk\u2212m(i, j) \u2212 Ck(i+ 1, j + 1)Bk(i, j)]uk\u2212m(i, j)\n\u2212 Ck+1(i+ 1, j + 1) [ A1,k+1(i+ 1, j)xk+1(i+ 1, j)\n+A2,k+1(i, j)xk+1(i, j) +A3,k+1(i, j + 1) \u00d7 xk+1(i, j + 1) ] + [Ck(i+ 1, j + 1)Bk(i, j)\n\u2212 Ck+1(i+ 1, j + 1)Bk+1(i, j)]uk+1(i, j). (52)\nSimilar with Theorem 3, according to (41) and (51), if the learning gain Lm,k(i, j) is selected to satisfy (40) and (49), then, the perfect tracking objective is obtained. The proof of Theorem 4 is complete.\nV. TWO ILLUSTRATIVE EXAMPLES In this section, to illustrate the effectiveness and feasibility of the P-type ILC law (5) and high-order ILC law (39) for 2-D LNDS (1)-(2) under Assumptions 1-4, two simulation examples are presented.\nExample 1: We consider the 2-D LNDS (1)-(2) with\nA1,k(i+ 1, j)\n=\n[ 0.0139 + 0.1 sin(2\u03c0(i+ j)/10) 0.01 +m1,k\n0.01 0.03\n] ,\nA2,k(i, j)\n= [ 0.0139 0.02\u2212 0.1 cos(2\u03c0(i+ j)/10) 0.01 0.04 +m2,k ] ,\nA3,k(i, j + 1)\n=\n[ 0.01 +m3,k 0.02\n0.0139 0.3 + 0.1 sin(2\u03c0(i+ j)/10)\n] ,\nBk(i, j)\n=\n[ 2\n0.1 cos(2\u03c0(i+ j)/10) +m4,k\n] ,\nCk(i, j) = [ \u22121 \u22120.5 sin(2\u03c0(i+ j)/10) +m5,k ] ,\nwhere m1(k), m2(k), m3(k), m4(k), and m5(k) are randomly varying at the intervals [\u22120.1, 0.1], [0, 0.2], [\u22120.1, 0.1], [0, 0.1], and [\u22120.1, 0.1], respectively. In the Ptype ILC law (5) with the initial control input u0(i, j) = 0, i = 0, 1, 2, \u00b7 \u00b7 \u00b7 , 19, j = 0, 1, 2, \u00b7 \u00b7 \u00b7 , 19, let the learning gain Lk(i, j) be selected as Lk(i, j) = \u22120.1, which satisfies the convergence condition (6) in Theorems 1 and 2. The following indexes EEk and SSk are used to evaluate the accuracy of ILC tracking error and the control input,\nEEk = 20\u2211 i=1 20\u2211 j=1 |yd,k(i, j)\u2212 yk(i, j)| ,\nSSk = 19\u2211 i=0 19\u2211 j=0 |uk(i, j)| .\n9\nThis work is licensed under a Creative Commons Attribution 4.0 License. For more information, see https://creativecommons.org/licenses/by/4.0/\nCase 1: Under Assumption 1, let the 2-D reference trajectory and boundary states be given as\nyd,k(i, j) = sin(2\u03c0(i+ j)/10) +m6(k),\ni = 0, 1, \u00b7 \u00b7 \u00b7 , 20, j = 0, 1, \u00b7 \u00b7 \u00b7 , 20,\nxk(0, j) =\n[ 0.5\nsin(j) +m7(k)\n] , j = 0, 1, \u00b7 \u00b7 \u00b7 , 20,\nxk(i, 0) = [ \u2212 sin(0.2\u03c0i) m8(k) ] , i = 1, 2, \u00b7 \u00b7 \u00b7 , 20,\nwhere m6(k), m7(k), and m8(k) are randomly varying at the intervals (\u22121, 1), (\u22121, 1) and (0, 2). As a result, the profile of the tracking error index EEk with k is presented in Figure 1, and the variation situation of the control input index SSk with k is shown in Figure 2. Obviously, it is observed from Figures 1-2 that the ultimate ILC tracking error and the control input converge to a bounded range. Consequently, the robustness of the P-type ILC law (5) under Assumption 1 is validated.\nCase 2: Under Assumption 3, let m1(k) = (0.1)k+1, m2(k) = (0.2)\nk+1, m3(k) = (0.1)k+1, m4(k) = (0.5)k+1, m6(k) = (0.2)\nk, m7(k) = (0.3)k, and m8(k) = (0.2)k. The 2-D reference trajectory yd,30(i, j), i = 0, 1, \u00b7 \u00b7 \u00b7 , 20, j = 0, 1, \u00b7 \u00b7 \u00b7 , 20 is shown in Figure 3. Consequently, Figure 4 shows the profiles of ILC tracking error ek(i, j) at k = 3, 5, 7, 30. And the profiles of the tracking error index EEk with k and the control input index SSk with k by using the P-type ILC law (5) are presented in Figures 5 and 6. It is observed from Figures 4-6 that the system output yk(i, j) can precisely track the 2-D reference trajectory. Therefore, the convergence of the P-type ILC law (5) is verified.\nExample 2. Consider some practical dynamical linear processes with repetitive operation [20], [22], which is given as\n\u22022Tk(w, t)\n\u2202w\u2202t = a1,k(w, t)\n\u2202Tk(w, t)\n\u2202t + a2,k(w, t)\n\u2202Tk(w, t)\n\u2202w + a0,k(w, t)Tk(w, t) + bk(w, t)fk(w, t),\n(53)\n10\nThis work is licensed under a Creative Commons Attribution 4.0 License. For more information, see https://creativecommons.org/licenses/by/4.0/\nwhere fk(w, t) is the control input; Tk(w, t) denotes the temperature; a0,k(w, t), a1,k(w, t), a2,k(w, t), and bk(w, t) are coefficients. Let\nxk(i, j) = Tk(i\u2206w, j\u2206t), uk(i, j) = fk(i\u2206w, j\u2206t),\nwhere \u2206w and \u2206t are sampling step sizes for space variable w and time variable t. Then, (53) can be discretized into the following 2-D LNDS\nxk(i+ 1, j + 1)\n=[1 + a2,k(i, j)\u2206t]xk(i+ 1, j)\n+ [a0,k(i, j)\u2206w\u2206t\u2212 a1,k(i, j)\u2206w \u2212 a2,k(i, j)\u2206t\u2212 1] \u00d7 xk(i, j) + [1 + a1,k(i, j)\u2206w]xk(i, j + 1) + bk(i, j)\u2206w\u2206tuk(i, j). (54)\nLet \u2206w = 0.1, \u2206t = 0.1, a0,k(i, j) = \u2212145.5 + 110 sin[2\u03c0(i + j)/10)] + 100m2,k, a1,k(i, j) = \u22129.5 + sin[2\u03c0(i+j)/10)]+10m3,k, a2,k(i, j) = \u22129+10 sin[2\u03c0(i+ j)/10)]+10m1,k, bk(i, j) = 23.5+10 cos[2\u03c0(i+ j)/10)]+ 10m4,k, and yk(i, j) = 2xk(i, j), where m1(k), m2(k), m3(k), and m4(k) are randomly varying at the intervals (\u22120.1, 0.1), (0, 0.2), (\u22120.1, 0.1), and (\u22120.1, 0.1), respectively. The following 2-D HOIM-based reference trajectory yd,k(i, j) is given as:\nyd,k+1(i, j) = \u221a\n2yd,k(i, j)\u2212 yd,k\u22121(i, j), yd,0(i, j) = 2 cos[2\u03c0(i\u2212 j)/10], yd,1(i, j) = cos[0.2\u03c0(i+ j)].\nUnder the high-order ILC law (39) with u0(i, j) = u1(i, j) = 0, i = 0, 1, 2, \u00b7 \u00b7 \u00b7 , 19, j = 0, 1, 2, \u00b7 \u00b7 \u00b7 , 19, let the learning gains \u03931,k(i, j) and \u03932,k(i, j) be selected as \u03931,k(i, j) = 0.6 + 0.01i+ 0.01j and \u03932,k(i, j) = \u22120.9 + 0.01i+ 0.01j, which satisfy the convergent condition in Theorems 3 and 4. We use the maximum absolute tracking error index MMk to evaluate the tracking performance, i.e.,\nMMk = max i=1,2,\u00b7\u00b7\u00b7 ,20 max j=1,2,\u00b7\u00b7\u00b7 ,20\n|yd,k(i, j)\u2212 yk(i, j)| .\nCase 1: Under Assumption 1, let the boundary states be given as\nxk+1(0, j) = \u221a\n2xk(0, j)\u2212 xk\u22121(0, j) + n1,k, x0(0, j) = 2 cos(0.2\u03c0j), x1(0, j) = cos(0.2\u03c0j),\nxk+1(i, 0) = \u221a\n2xk(i, 0)\u2212 xk\u22121(i, 0) + n2,k, x0(i, 0) = 2 cos(0.2\u03c0i), x1(i, 0) = cos(0.2\u03c0i),\nwhere n1,k and n2,k are uniformly varying at (0, 0.2). The profiles of MMk with k under the high-order ILC law (39) and P-type ILC law (5) is shown in Figure 7. Apparently, we can be seen from Figure 7 that compared with P-type ILC law (5), the high-order ILC law (39) can well address the robustness ILC tracking on HOIM-based reference trajectory.\nCase 2: In Case 1, let m1(k) = (0.1)k+1, m2(k) = (0.2)k+1, m3(k) = (0.2)k+1, and m4(k) nh,k = (0.1)k+1, n1(k) = (0.1) k+1, n2(k) = (0.2)k+1. The ILC tracking\nerrors ek(i, j) at k = 5, 10, 20, 70 and the 2-D reference trajectory yd,70(i, j), i = 0, 1, \u00b7 \u00b7 \u00b7 , 20, j = 0, 1, \u00b7 \u00b7 \u00b7 , 20 are presented in Figures 8 and 9, respectively. Obviously, the effectiveness of Theorem 4 is validated. Additionally, we give a comparison result on the proposed high-order ILC law (39) and the P-type ILC law (5) uk+1(i, j) = uk(i, j) + (0.6 + 0.01i + 0.01j)ek(i + 1, j + 1), i = 0, 1, 2, \u00b7 \u00b7 \u00b7 , 19, j = 0, 1, 2, \u00b7 \u00b7 \u00b7 , 19, which is shown in Figure 10. It is verified that the tracking performance of the high-order ILC law outperforms the lower-order ILC law.\nVI. CONCLUSION In this article, the robust and convergent properties of the proposed P-type ILC law and the high-order ILC law for 2- D LNDS with iteration-dependent reference trajectory have been proved. With 2-D linear nonrepetitive inequalities, the ultimate ILC tracking error robustly converges to a bounded range. Certainly, the proposed ILC analysis approach, as a new tool, is applicable to some nonrepetitive systems, i.e., spatially distributed or interconnected systems. Additionally, this paper discloses that high-order ILC law not only is adapted to the variation of 2-D HOIM-based reference trajectories but also can accommodate the nonrepetitiveness from boundary states and system parameters.\nREFERENCES [1] X. F. Li, D. Shen, and B. Ding, \u201cIterative learning control for output\ntracking of nonlinear systems with unavailable state information,\u201d IEEE Trans. Neural Networks Learn. Syst., vol. 55, pp. 1-8, 2021. [2] X. Jin, \u201cIterative learning control for MIMO nonlinear systems with iteration-varying trial lengths using nodified composite energy function analysis,\u201d IEEE Trans. Cybern., vol. 99, pp. 1-11, 2020. [3] M. Yu and S. Chai, \u201cAdaptive iterative learning control for discretetime nonlinear systems with multiple iteration-varying high-order internal models,\u201d Int. J. Robust Nonlinear Control, vol. 31, no. 15, pp. 7390-7408, 2021. [4] Q. Zhu, J.-X. Xu, D. Q. Huang, and G.-D. Hu, \u201cIterative learning control design for linear discrete-time systems with multiple high-order internal models,\u201d Automatica, vol. 62, pp. 65-76, 2015. [5] X. H. Bu, W. Yu, Q. Yu, Z. S. Hou, and J. Q. Yang, \u201c Event-triggered model-free adaptive iterative learning control for a class of nonlinear systems over fading channels,\u201d IEEE Trans. Cybern., vol. 99, pp. 1-12, 2021. [6] D. Shen and J. X. Xu, \u201cAn iterative learning control algorithm with gain adaptation for stochastic systems,\u201dIEEE Trans. Autom. Control, vol. 65, no. 3, pp. 1280-1287, 2021. [7] R. H. Chi, Y. C. Wei, and R. R. Wang, \u201cObserver based switching ILC for consensus of nonlinear nonaffine multi-agent systems,\u201dJ. Franklin Inst., vol. 358, no. 12, pp. 6195-6216, 2021.\n11\nThis work is licensed under a Creative Commons Attribution 4.0 License. For more information, see https://creativecommons.org/licenses/by/4.0/\n[8] D. Luo, J. R. Wang, and D. Shen, \u201cIterative learning control for locally lipschitz nonlinear fractional-order multi-agent systems,\u201dJ. Franklin Inst., vol. 357, no. 11, pp. 6671-6693, 2020. [9] D. Y. Meng and K. L. Moore, \u201cRobust iterative learning control for nonrepetitive uncertain systems,\u201dIEEE Trans. Autom. Control, vol. 62, no. 2, pp. 907-913, 2017. [10] D. Y. Meng and K. L. Moore, \u201cConvergence of iterative learning control for SISO nonrepetitive systems subject to iteration-dependent uncertainties,\u201dAutomatica, vol. 79, pp. 167-177, 2017. [11] Y. Y. Chen, W. Jiang and T. Charalambous, \u201cMachine learning based iterative learning control for non-repetitive time-varying systems,\u201d arXiv preprint arXiv:2107.00421, 2021. [12] K. Wan and X. D. Li, \u201cHigh-order internal model based iterative learning control for 2-D linear FMMI systems with iteration-varying trajectory tracking,\u201dIEEE Trans. Syst. Man Cybern.: Syst., vol. 51, no. 3, pp. 1462- 1472, 2021. [13] K. Wan, \u201cRobust high-order iterative learning control approach for twodimensional linear discrete time-varying Fornasini\u2013Marchesini systems with iteration-dependent reference trajectory,\u201dInt. J. Syst. Sci., vol. 53, no. 5, pp. 1068-1089, 2022. [14] K. Wan and X. D. Li, \u201cRobust iterative learning control of 2-D linear discrete FMMII systems subject to iteration-dependent uncertainties,\u201dIEEE Trans. Syst. Man Cybern.: Syst., vol. 51, no. 10, pp. 5949-5961, 2021.\n[15] Y. S. Wei, K. Wan, and Q. Y. Xu, \u201cDesign of adaptive ILC for 2-D FMM systems with unknown control directions ,\u201dIEEE Access, vol. 7, pp. 134920-134925, 2019. [16] J. M. Xing, R. H. Chi, and N. Lin, \u201cAdaptive iterative learning control for 2D nonlinear systems with nonrepetitive uncertainties,\u201dInt. J. Robust Nonlinear Control, vol. 31, pp. 1168-1180, 2021. [17] K. Wan and Y. S. Wei, \u201cAdaptive ILC of tracking nonrepetitive trajectory for two-dimensional nonlinear discrete time-varying Fornasini\u2013Marchesini systems with iteration-varying boundary states,\u201dInt. J. Control Autom. Syst., vol. 19, no. 1, pp. 417-425, 2021. [18] M. G. B. Sumanasena and P. H. Bauer, \u201c Realization using the FornasiniMarchesini model for implementations in distributed grid sensor networks,\u201dIEEE Trans. Circuits Syst. Regul. Pap., vol. 58, no. 11, pp. 2708- 2717, 2011. [19] J. E. Piou and A. J. Dumanian, \u201cApplication of the Fornasini-Marchesini first model to data collected on a complex target model,\u201d2014 American Control Conference (ACC) Portland, Oregon, USA, pp. 2279-2284, 2014. [20] T. Kaczorek. Two-dimensional linear systems. Heidelberg, Germany: Springer-Verlag, 1985. [21] E. Rimon and A. F. Stappen, \u201cImmobilizing 2-D serial chains in formclosure grasps,\u201dIEEE Trans. Rob., vol. 28, no. 1, pp. 32-42, 2012. [22] K. Wan, D. M. Xu and Y. S. Wei, \u201cIterative learning control for 2-D linear discrete Fornasini\u2013Marchesini model with input saturation,\u201dInt. J. Syst. Sci., vol. 51, no.8, pp. 1482-1494, 2020. [23] S. T. Sun and X. D. Li, \u201cRobust networked ILC for switched nonlinear discrete systems with non-repetitive uncertainties and random data dropouts,\u201dInt. J. Syst. Sci., vol. 52, no.9, pp. 1746-1760, 2021. [24] K. Wan, \u201cRobust decentralized iterative learning control for large-scale interconnected systems described by 2-D Fornasini\u2013Marchesini systems with iteration-dependent uncertainties including boundary states, disturbances, and reference trajectory,\u201dInt. J. Adapt Control Signal Process., doi: 10.1002/acs.3506, 2022. [25] W. Marszalek, \u201cTwo-dimensional state-space discrete models for hyperbolic partial differential equations,\u201dAppl. Math. Model., vol. 8, no.1, pp. 11-14, 1984.\nHENG XIE received the Ph.D. degree in material processing engineering from the South China University of Technology, Guangzhou, China in 2015. Her research interests include intelligent manufacturing, electrical materials, and iterative learning control.\nKAI WAN received the Ph.D. degree intelligent control from the School of Electronic and Information Technology, Sun Yat-sen University, Guangzhou, China, in 2019. His research interests include two-dimensional systems, robust control, and iterative learning control.\n12\nThis work is licensed under a Creative Commons Attribution 4.0 License. For more information, see https://creativecommons.org/licenses/by/4.0/\nQING-YUAN XU received the B.S. degree from the School of Information and Electrical Engineering, China University of Mining and Technology, Xuzhou, China, in 2008, and the M.Phil. and Ph.D. degrees from Sun Yat-sen University, Guangzhou, China, in 2010 and 2018, respectively. Her current research interests include iterative learning control and adaptive tracking control.\n13\nThis work is licensed under a Creative Commons Attribution 4.0 License. For more information, see https://creativecommons.org/licenses/by/4.0/"
        }
    ],
    "title": "Robust iterative learning control for 2-D linear nonrepetitive discrete systems with iteration-dependent trajectory",
    "year": 2022
}