{
    "abstractText": "Te presence of these indicators undermines our confdence in the integrity of the article\u2019s content and we cannot, therefore, vouch for its reliability. Please note that this notice is intended solely to alert readers that the content of this article is unreliable. We have not investigated whether authors were aware of or involved in the systematic manipulation of the publication process. Wiley and Hindawi regrets that the usual quality checks did not identify these issues before publication and have since put additional measures in place to safeguard research integrity. We wish to credit our own Research Integrity and Research Publishing teams and anonymous and named external researchers and research integrity experts for contributing to this investigation. Te corresponding author, as the representative of all authors, has been given the opportunity to register their agreement or disagreement to this retraction. We have kept a record of any response received. References",
    "authors": [],
    "id": "SP:2f971f214ffe9b8e826b14d4eed40ce99239d0a8",
    "references": [
        {
            "authors": [
                "X. Yin",
                "L. Sun",
                "Y. Fu",
                "R. Lu",
                "Y. Zhang"
            ],
            "title": "U-Net-Based Medical Image Segmentation",
            "venue": "Journal of Healthcare Engineering, vol. 2022, Article ID 4189781, 16 pages, 2022. Hindawi Journal of Healthcare Engineering Volume 2023, Article ID 9890389, 1 page https://doi.org/10.1155/2023/9890389",
            "year": 2022
        }
    ],
    "sections": [
        {
            "heading": "Retraction",
            "text": ""
        },
        {
            "heading": "Retracted: U-Net-Based Medical Image Segmentation",
            "text": ""
        },
        {
            "heading": "Journal of Healthcare Engineering",
            "text": "Received 17 October 2023; Accepted 17 October 2023; Published 18 October 2023\nCopyright \u00a9 2023 Journal of Healthcare Engineering. Tis is an open access article distributed under the Creative Commons Attribution License, which permits unrestricted use, distribution, and reproduction in anymedium, provided the original work is properly cited.\nTis article has been retracted by Hindawi following an investigation undertaken by the publisher [1]. Tis investigation has uncovered evidence of one or more of the following indicators of systematic manipulation of the publication process:\n(1) Discrepancies in scope (2) Discrepancies in the description of the research\nreported (3) Discrepancies between the availability of data and\nthe research described (4) Inappropriate citations (5) Incoherent, meaningless and/or irrelevant content\nincluded in the article (6) Peer-review manipulation\nTe presence of these indicators undermines our confdence in the integrity of the article\u2019s content and we cannot, therefore, vouch for its reliability. Please note that this notice is intended solely to alert readers that the content of this article is unreliable. We have not investigated whether authors were aware of or involved in the systematic manipulation of the publication process.\nWiley and Hindawi regrets that the usual quality checks did not identify these issues before publication and have since put additional measures in place to safeguard research integrity.\nWe wish to credit our own Research Integrity and Research Publishing teams and anonymous and named external researchers and research integrity experts for contributing to this investigation.\nTe corresponding author, as the representative of all authors, has been given the opportunity to register their agreement or disagreement to this retraction. We have kept a record of any response received.\nReferences\n[1] X. Yin, L. Sun, Y. Fu, R. Lu, and Y. Zhang, \u201cU-Net-Based Medical Image Segmentation,\u201d Journal of Healthcare Engineering, vol. 2022, Article ID 4189781, 16 pages, 2022.\nHindawi Journal of Healthcare Engineering Volume 2023, Article ID 9890389, 1 page https://doi.org/10.1155/2023/9890389"
        }
    ],
    "title": "Retraction Retracted: U-Net-Based Medical Image Segmentation",
    "year": 2023
}