{
    "abstractText": "In this paper, we develop two variants of B\u00e9zout subresultant formulas for several polynomials, i.e., hybrid B\u00e9zout subresultant polynomial and non-homogeneous B\u00e9zout subresultant polynomial. Rather than simply extending the variants of B\u00e9zout subresultant formulas developed by DiazToca and Gonzalez-Vega in 2004 for two polynomials to arbitrary number of polynomials, we propose a new approach to formulating two variants of the B\u00e9zout-type subresultant polynomials for a set of univariate polynomials. Experimental results show that the B\u00e9zout-type subresultant formulas behave better than other known formulas when used to compute multi-polynomial subresultants, among which the non-homogeneous B\u00e9zout-type formula shows the best performance.",
    "authors": [
        {
            "affiliations": [],
            "name": "Weidong Wang"
        },
        {
            "affiliations": [],
            "name": "Jing Yang"
        }
    ],
    "id": "SP:c564007b7aa3efe358527514622aeb6ef420c557",
    "references": [
        {
            "authors": [
                "Dennis S Arnon",
                "George E Collins",
                "Scott McCallum"
            ],
            "title": "Cylindrical algebraic decomposition I: The basic algorithm",
            "venue": "SIAM Journal on Computing,",
            "year": 1984
        },
        {
            "authors": [
                "Mohammadali Asadi",
                "Alexander Brandt",
                "David J. Jeffrey",
                "Marc Moreno Maza"
            ],
            "title": "Subresultant chains using B\u00e9zout matrices",
            "venue": "Computer Algebra in Scientific Computing,",
            "year": 2022
        },
        {
            "authors": [
                "Stephen Barnett"
            ],
            "title": "Greatest common divisor of several polynomials",
            "venue": "In Mathematical proceedings of the Cambridge philosophical society,",
            "year": 1971
        },
        {
            "authors": [
                "Stephen Barnett"
            ],
            "title": "Polynomials and linear control systems",
            "venue": "Marcel Dekker, Inc.,",
            "year": 1983
        },
        {
            "authors": [
                "Alin Bostan",
                "Carlos D\u2019Andrea",
                "Teresa Krick",
                "Agn\u00e8s Szanto",
                "Marcelo Valdettaro"
            ],
            "title": "Subresultants in multiple roots: an extremal case",
            "venue": "Linear Algebra and its Applications,",
            "year": 2017
        },
        {
            "authors": [
                "George E Collins"
            ],
            "title": "Subresultants and reduced polynomial remainder sequences",
            "venue": "Journal of the ACM (JACM),",
            "year": 1967
        },
        {
            "authors": [
                "George E Collins",
                "Hoon Hong"
            ],
            "title": "Partial cylindrical algebraic decomposition for quantifier elimination",
            "venue": "Journal of Symbolic Computation,",
            "year": 1991
        },
        {
            "authors": [
                "David A Cox",
                "Carlos D\u2019Andrea"
            ],
            "title": "Subresultants and the shape lemma",
            "venue": "arXiv preprint arXiv:2112.10306,",
            "year": 2021
        },
        {
            "authors": [
                "Gema M Diaz-Toca",
                "Laureano Gonzalez-Vega"
            ],
            "title": "Barnett\u2019s theorems about the greatest common divisor of several univariate polynomials through Bezout-like matrices",
            "venue": "Journal of Symbolic Computation,",
            "year": 2002
        },
        {
            "authors": [
                "Gema M Diaz-Toca",
                "Laureano Gonzalez-Vega"
            ],
            "title": "Various new expressions for subresultants and their applications",
            "venue": "Applicable Algebra in Engineering, Communication and Computing,",
            "year": 2004
        },
        {
            "authors": [
                "Hoon Hong",
                "Jing Yang"
            ],
            "title": "A condition for multiplicity structure of univariate polynomials",
            "venue": "Journal of Symbolic Computation,",
            "year": 2021
        },
        {
            "authors": [
                "Hoon Hong",
                "Jing Yang"
            ],
            "title": "Subresultant of several univariate polynomials",
            "venue": "arXiv preprint arXiv:2112.15370,",
            "year": 2021
        },
        {
            "authors": [
                "Xiaorong Hou",
                "Dongming Wang"
            ],
            "title": "Subresultants with the B\u00e9zout matrix. In Computer Mathematics, pages 19\u201328",
            "venue": "World Scientific,",
            "year": 2000
        },
        {
            "authors": [
                "Deepak Kapur",
                "Tushar Saxena",
                "Lu Yang"
            ],
            "title": "Algebraic and geometric reasoning using dixon resultants",
            "venue": "In Proceedings of the international symposium on Symbolic and algebraic computation,",
            "year": 1994
        },
        {
            "authors": [
                "Alain Lascoux",
                "Piotr Pragacz"
            ],
            "title": "Double Sylvester sums for subresultants and multi-Schur functions",
            "venue": "Journal of Symbolic Computation,",
            "year": 2003
        },
        {
            "authors": [
                "Yong-Bin Li"
            ],
            "title": "A new approach for constructing subresultants",
            "venue": "Applied mathematics and computation,",
            "year": 2006
        },
        {
            "authors": [
                "Akira Terui"
            ],
            "title": "Recursive polynomial remainder sequence and its subresultants",
            "venue": "Journal of Algebra,",
            "year": 2008
        },
        {
            "authors": [
                "Dongming Wang"
            ],
            "title": "Decomposing polynomial systems into simple systems",
            "venue": "Journal of Symbolic Computation,",
            "year": 1998
        },
        {
            "authors": [
                "Dongming Wang"
            ],
            "title": "Computing triangular systems and regular systems",
            "venue": "Journal of Symbolic Computation,",
            "year": 2000
        }
    ],
    "sections": [
        {
            "text": "1 Introduction\nResultant and subresultant are the most important objects in resultant theory which has numerous applications (e.g., [1,7,14,19,20]). Due to their importance, extensive research has been carried out both in theoretical and practical aspects on resultants, subresultants and their variants [3, 5, 6, 8, 11, 12, 15, 17, 18]. One of the essential topics in resultant theory is the representation of resultant and subresultant polynomials. Good representations with nice structures often bring lots of convenience for theoretical development and subsequent applications, among which determinental formulas for subresultant polynomials are a class of representations with prominent merits especially in the developments of theory and efficient algorithms. For this reason, people constructed various types of determinental formulas for subresultant polynomials since the concept was proposed, including Sylvester-type [16,17], Be\u0301zout-type [13], Barnett-type [4,9],\n\u2217Corresponding author: yangjing0930@gmail.com\nar X\niv :2\n30 4.\n00 26\n2v 2\n[ cs\n.S C\nand so on [10]. However, the classical subresultant polynomials are only defined for two polynomials. In [12], Hong and Yang extended the concept of subresultant polynomial for two polynomials to the multi-polynomial case and gave three types of determinental formulas for the extended subresultant polynomials, i.e., Sylvester-type, Be\u0301zout-type and Barnett-type formulas. These subresultant polynomials have their own interesting structures. By exploiting the hidden structures, it is expected that people may develop various algorithms for computing subresultant polynomials effectively. It is revealed in [10] that Be\u0301zout matrix and its variant called hybrid Be\u0301zout matrix show better behavior than the Barnett matrix when used for computing the greatest common divisor of several univariate polynomials. In [2], Asadi et al. proposed a speculative approach based on the (hybrid) Be\u0301zout matrix to compute the subresultant chains over rings of multivariate polynomials. For computing subresultant polynomials of several polynomials efficiently, it is needed to exploit the form of known subresultants and develop new formulas from them.\nIn this paper, we present two new variants of Be\u0301zout subresultant matrix for several univariate polynomials, i.e., hybrid Be\u0301zout subresultant matrix and nonhomogeneous Be\u0301zout subresultant matrix. It is shown that the determinants of the two matrices are equivalent to the subresultant polynomials defined in terms of roots. The proof idea is borrowed from [12] and reformulated in a more friendly way. Compared with the generalized Be\u0301zout subresultant polynomials for several polynomials, the two variants given in the current paper often have smaller degree. We also compare the efficiency of computing multi-polynomial subresultants with the five known subresultant formulas. It is shown that the Be\u0301zout formula and its two variants behave better than the Sylvester-type and Barnett-type. Among the three Be\u0301zout-type formulas, the non-homogeneous Be\u0301zout behaves best. After profiling, it is observed that the hybrid Be\u0301zout matrix dominates the three in forming the subresultant matrix and thus has high potentiality to be optimized when used for computing subresultants.\nThe paper is structured as follows. In the Section 2, we review the concepts of Be\u0301zout matrix and its two variants (i.e., hybrid Be\u0301zout matrix and non-homogeneous Be\u0301zout matrix) and subresultant polynomial for several polynomials. The main result of the paper is presented in the Section 3 and the proof is given in Section 4. Experimental results are reported in Section 5 with further remarks.\n2 Preliminaries\nWe start with a brief introduction on the Be\u0301zout-type subresultant polynomial for two univariate polynomials as well as its two variants. Then the concept of subresultant polynomial for several univariate polynomials is reviewed. We adopt the expression in roots of one of the given polynomials to define the subresultant polynomial because it is very helpful for the reasoning purpose. Unless otherwise stated, the polynomials appearing in the rest of the paper are all univariate polynomials over the rational field, denoted by Q, with x as the\nvariable.\n2.1 Be\u0301zout-type subresultant and its variants for two polynomials\nWe now recall the concepts of Be\u0301zout matrix and Be\u0301zout resultant for two polynomials as well as their two invariants including hybrid Be\u0301zout matrix/resultant and non-homogeneous Be\u0301zout matrix/resultant. In the rest of the subsection, we assume A,B \u2208 Q[x] are with degrees m and n, respectively, where m \u2265 n. More explicitly,\nA = amx m + am\u22121x m\u22121 + \u00b7 \u00b7 \u00b7+ a0 B = bnx n + bn\u22121x n\u22121 + \u00b7 \u00b7 \u00b7+ b0\nDefinition 1. The Be\u0301zout matrix Bez(A,B) of A and B with respect to x is defined by\nBez(A,B) :=  cm\u22121,0 \u00b7 \u00b7 \u00b7 cm\u22121,m\u22121... ... c0,0 \u00b7 \u00b7 \u00b7 c0,m\u22121  where ci,jis given by\nA(x)B(x)\u2212A(y)B(x) x\u2212 y = m\u22121\u2211 i,j=0 ci,jx iyj (1)\nThe determinant of Bez(A,B) is called the Be\u0301zout resultant of A and B with respect to x.\nDefinition 2. The hybrid Be\u0301zout matrix H(A,B) of A and B with respect to x is defined by\nH(A,B) :=  b0 b1 \u00b7 \u00b7 \u00b7 bn . . . . . . . . . b0 b1 \u00b7 \u00b7 \u00b7 bn f1,m f1,m\u22121 \u00b7 \u00b7 \u00b7 \u00b7 \u00b7 \u00b7 f1,2 f1,1\n... ...\n... ...\nfn,m fn,m\u22121 \u00b7 \u00b7 \u00b7 \u00b7 \u00b7 \u00b7 fn,2 fn,1\n m\u2212 n rowsn rows where fr,j is the coefficient of the following polynomial\nkr = (amx r\u22121 + \u00b7 \u00b7 \u00b7+ am\u2212r+1)(bn\u2212rxm\u2212r + \u00b7 \u00b7 \u00b7+ b0xm\u2212n)\n\u2212 (am\u2212rxm\u2212r + \u00b7 \u00b7 \u00b7+ a0)(bnxr\u22121 + \u00b7 \u00b7 \u00b7+ bn\u2212r+1)\n= m\u2211 j=1 fr,jx m\u2212j\nin the term xm\u2212j for j = 1, . . . ,m. The determinant of H(A,B) is called the hybrid Be\u0301zout resultant of A and B with respect to x.\nDefinition 3. The non-homogeneous Be\u0301zout matrix N(A,B) of A and B with respect to x is defined by\nN(A,B) :=  b0 b1 \u00b7 \u00b7 \u00b7 bn . . . . . . . . . b0 b1 \u00b7 \u00b7 \u00b7 bn cn\u22121,0 cn\u22121,1 \u00b7 \u00b7 \u00b7 \u00b7 \u00b7 \u00b7 cn\u22121,m\u22122 cn\u22121,m\u22121\n... ...\n... ...\nc0,0 c0,1 \u00b7 \u00b7 \u00b7 \u00b7 \u00b7 \u00b7 c0,m\u22122 c0,m\u22121\n m\u2212 n rowsn rows where ci,j\u2019s are as in (1). The determinant of N(A,B) is called the nonhomogeneous Be\u0301zout resultant of A and B with respect to x.\n2.2 Subresultant in roots for several polynomials\nThe following notations are needed for stating the definition of subresultant for several univariate polynomials given by Hong and Yang in [12].\nNotation 4.\n\u2022 F = (F0, F1, . . . , Ft) \u2282 Q[x];\n\u2022 di = degFi; \u2022 F0 = a0d0 \u220fd0 j=1(x\u2212 \u03b1i);\n\u2022 \u03b4 = (\u03b41, \u03b42, . . . , \u03b4t) \u2208 Nt;\n\u2022 |\u03b4| = \u03b41 + \u00b7 \u00b7 \u00b7+ \u03b4t \u2264 d0;\n\u2022 V =  \u03b1 0 1 \u00b7 \u00b7 \u00b7 \u03b10d0 ... ...\n\u03b1d0\u221211 \u00b7 \u00b7 \u00b7 \u03b1 d0\u22121 d0 . With the above notations, we recall the concept of the \u03b4-th subresultant polynomial for several univariate polynomials which is defined in terms of roots of the first polynomial.\nDefinition 5. The generalized \u03b4-th subresultant polynomial S\u03b4 of F is defined by\nS\u03b4(F ) := a \u03b40 0d0 detM\u03b4/ detV\nwhere\n\u2022 M\u03b4 =  \u03b101F1(\u03b11) \u00b7 \u00b7 \u00b7 \u03b10d0F1(\u03b1d0) ... ... \u03b1\u03b41\u221211 F1(\u03b11) \u00b7 \u00b7 \u00b7 \u03b1 \u03b41\u22121 d0 F1(\u03b1d0) ... ... ... ... \u03b101Ft(\u03b11) \u00b7 \u00b7 \u00b7 \u03b10d0Ft(\u03b1d0) ... ... \u03b1\u03b4t\u221211 Ft(\u03b11) \u00b7 \u00b7 \u00b7 \u03b1 \u03b4t\u22121 d0 Ft(\u03b1d0) \u03b101(x\u2212 \u03b11) \u00b7 \u00b7 \u00b7 \u03b10d0(x\u2212 \u03b1d0) ...\n... \u03b1\u03b5\u221211 (x\u2212 \u03b11) \u00b7 \u00b7 \u00b7 \u03b1 \u03b5\u22121 d0 (x\u2212 \u03b1d0)\n ;\n\u2022 \u03b40 = max(d1 + \u03b41 \u2212 d0, . . . , dt + \u03b4t \u2212 d0, 1\u2212 |\u03b4|);\n\u2022 \u03b5 = d0 \u2212 |\u03b4|.\nThe rational expression for S\u03b4 in Definition 5 should be interpreted as follows, otherwise the denominator will vanish when F is not squarefree.\n(1) Treat \u03b11, . . . , \u03b1n as indeterminates and carry out the exact division, which results in a symmetric polynomial in terms of \u03b11, . . . , , \u03b1n.\n(2) Evaluate the polynomial with \u03b11, . . . , \u03b1n assigned the value of roots of F .\nTherefore, S\u03b4 is essentially a polynomial in \u03b11, . . . , \u03b1d0 although it is presented in the form of rational function. Furthermore, note that S\u03b4 is symmetric in \u03b11, . . . , \u03b1d0 and thus it can be written as a polynomial in the coefficients of polynomials in F . In fact, Hong and Yang provided three representations of S\u03b4 in terms of coefficients, including the Sylvester-type, the Be\u0301zout type and the Barnett-type subresultants. In particular, the explicit formula for the Be\u0301zouttype subresultant for F is presented below. The construction of the Be\u0301zouttype subresultant inspires us with a promising approach to construct the hybrid Be\u0301zout-type and non-homogeneous Be\u0301zout-type subresultants.\nTheorem 6. Assume d0 = max0\u2264i\u2264t di and \u03b4 6= (0, . . . , 0). Let\nBez\u03b4(F ) := [ R1 R2 \u00b7 \u00b7 \u00b7 Rt X\u03b4,d0 ]T where\n\u2022 Ri consists of the first \u03b4i columns of Bez(F0, Fi), and\n\u2022 X\u03b4,d0 =  x \u22121 . . . . . . x \u22121   d0 rows\n\ufe38 \ufe37\ufe37 \ufe38 d0\u2212|\u03b4| columns\nThen we have S\u03b4 = a \u03b40\u2212|\u03b4| 0d0 det Bez\u03b4(F ).\n3 Main Results\nIn this section, we propose a new approach to construct the hybrid Be\u0301zout matrix and non-homogeneous Be\u0301zout subresultant matrix for a set of univariate polynomials, which is different from the way developed by Diaz-Toca and Gonzalez-Vega in [10]. We will show that the determinants of the two matrices are identical with the subresultant polynomial of the given polynomial set.\nIn [12], Hong and Yang proposed a method for constructing the Be\u0301zout subresultant matrix for several polynomials from the Be\u0301zout matrices Bez(F0, F1), . . . , Bez(F0, Ft). Following the similar idea, we construct the hybrid Be\u0301zout subresultant matrix and non-homogeneous Be\u0301zout subresultant matrix for more than two univariate polynomials below. For stating the main result, we assume Fi = aidix di + \u00b7 \u00b7 \u00b7+ ai0 for i = 0, 1, . . . , t where d0 = max0\u2264i\u2264t di and\nBez(F0, Fi) =  c (i) d0\u22121,0 \u00b7 \u00b7 \u00b7 c (i) d0\u22121,d0\u22121 ... ...\nc (i) 0,0 \u00b7 \u00b7 \u00b7 c (i) 0,d0\u22121  Definition 7. Given F = (F0, F1, . . . , Ft) where Fi = \u2211di j=0 aijx\nj, the generalized \u03b4-th hybrid Be\u0301zout subresultant matrix H\u03b4 of F is defined by\nH\u03b4(F ) := [ R1 R2 \u00b7 \u00b7 \u00b7 Rt X\u03b4,d0 ]T where Ri is the transpose of the submatrix of H(F0, Fi) obtained by selecting its first \u03b4i rows, that it,\nRi = \nai0 \u00b7 \u00b7 \u00b7 aidi . . .\n. . .\nai0 \u00b7 \u00b7 \u00b7 aidi f (i) 1,d0 \u00b7 \u00b7 \u00b7 \u00b7 \u00b7 \u00b7 f (i)1,2 f (i) 1,1\n... ...\n...\nf (i) \u03b4i+di\u2212d0,d0 \u00b7 \u00b7 \u00b7 \u00b7 \u00b7 \u00b7 f (i) \u03b4i+di\u2212d0,2 f (i) \u03b4i+di\u2212d0,1\n Tmin(\u03b4i, d0 \u2212 di) rowsmax(0, \u03b4i + di \u2212 d0) rows\nand f (i) r,j is the coefficient of the following polynomial\nk(i)r = (a0d0x r\u22121 + \u00b7 \u00b7 \u00b7+ a0d0\u2212r+1)(aidi\u2212rxd0\u2212r + \u00b7 \u00b7 \u00b7+ ai0xd0\u2212di)\n\u2212 (a0d0\u2212rxd0\u2212r + \u00b7 \u00b7 \u00b7+ a00)(aidixr\u22121 + \u00b7 \u00b7 \u00b7+ aidi\u2212r+1) (2)\n= d0\u2211 j=1 f (i) r,jx d0\u2212j\nin the term xd0\u2212j for j = 1, . . . , d0. Definition 8. Given F = (F0, F1, . . . , Ft) where Fi = \u2211di j=0 aijx\nj, the generalized \u03b4-th non-homogenous Be\u0301zout subresultant matrix N\u03b4 of F is defined by\nN\u03b4(F ) := [ R1 R2 \u00b7 \u00b7 \u00b7 Rt X\u03b4,d0 ]T where Ri is the transpose of the submatrix of N(F0, Fi) obtained by selecting its firt \u03b4i rows, that it,\nRi =  ai0 \u00b7 \u00b7 \u00b7 aidi . . .\n. . .\nai0 \u00b7 \u00b7 \u00b7 aidi c (i) di\u22121,0 \u00b7 \u00b7 \u00b7 \u00b7 \u00b7 \u00b7 c (i) di\u22121,d0\u22122 c (i) di\u22121,d0\u22121\n... ...\n...\nc (i) d0\u2212\u03b4i,0 \u00b7 \u00b7 \u00b7 \u00b7 \u00b7 \u00b7 c (i) d0\u2212\u03b4i,d0\u22122 c (i) d0\u2212\u03b4i,d0\u22121\n Tmin(\u03b4i, d0 \u2212 di) rowsmax(0, \u03b4i + di \u2212 d0) rows Remark 9. The matrices H\u03b4(F ) and N\u03b4(F ) can be viewed as a generalization of the subresultant matrix developed by Li in [16] for the Sylvester-type subresultant polynomial of two univariate polynomials.\nTheorem 10 (Main result). We have\n(1) S\u03b4(F ) = c \u00b7 detH\u03b4(F ),\n(2) S\u03b4(F ) = c \u00b7 detN\u03b4(F ),\nwhere c = a \u03b40\u2212\n\u2211t i=1 max(0,\u03b4i+di\u2212d0)\n0d0 .\nRemark 11.\n(1) The difference between the construction of Be\u0301zout-type subresultant variants in this paper and that in [10] is that we select rows to formulate the subresultant matrices while the latter selects columns. In the two-polynomial case, both approaches produce the same subresultant polynomials.\n(2) Note that max(0, \u03b4i+di\u2212d0) \u2264 \u03b4i and thus \u2211t i=1 max(0, \u03b4i + di \u2212 d0) \u2264 |\u03b4|.\nTherefore, when compared with the generalized Be\u0301zout subresultant polynomials developed in [12], the two invariants of Be\u0301zout-type subresultant polynomials developed in the current paper often have smaller degrees.\nExample 12. Consider F = (F0, F1, F2) where\nF0 = a05x 5 + a04x 4 + a03x 3 + a02x 2 + a01x+ a00, F1 = a14x 4 + a13x 3 + a12x 2 + a11x+ a10, F2 = a24x 4 + a23x 3 + a22x 2 + a21x+ a20.\nand a05a14a24 6= 0. Let \u03b4 = (2, 2). By Definitions 7 and 8,\nH\u03b4(F ) =  a10 \u2212a00a14 a20 \u2212a00a24 x a11 \u2212a01a14 + a05a10 a21 \u2212a01a24 + a05a20 \u22121 a12 \u2212a02a14 + a05a11 a22 \u2212a02a24 + a05a21 0 a13 \u2212a03a14 + a05a12 a23 \u2212a03a24 + a05a22 0\na14 \u2212a04a14 + a13a05 a24 \u2212a04a24 + a23a05 0\n T ,\nN\u03b4(F ) =  a10 \u2212a00a14 + a04a10 a20 \u2212a00a24 + a04a20 x a11 \u2212a01a14 + a04a11 + a05a10 a21 \u2212a01a24 + a04a21 + a05a20 \u22121 a12 \u2212a02a14 + a04a12 + a05a11 a22 \u2212a02a24 + a04a22 + a05a21 0 a13 \u2212a03a14 + a04a13 + a05a12 a23 \u2212a03a24 + a04a23 + a05a22 0\na14 a13a05 a24 a23a05 0\n T .\nFurther calculation yields\n\u03b40 = max(\u03b41 + d1 \u2212 d0, \u02dc\u03b42 + d2 \u2212 d0, 1\u2212 (\u03b41 + \u03b42)) = 1,\nc = a \u03b40\u2212(max(0,\u03b41+d1\u2212d0)+max(0,\u03b42+d2\u2212d0)) 05 = a \u22121 05 .\nBy Theorem 10, we have\nS\u03b4(F ) = a \u22121 05 \u00b7 detH\u03b4(F ) = a \u22121 05 \u00b7 detN\u03b4(F ).\nIf one computes S\u03b4(F ) with Be\u0301zout subresultant matrix of F , then by Theorem 6,\nS\u03b4(F ) = a \u22123 05 \u00b7 det Bez\u03b4(F ),\nwhich indicates that det Bez\u03b4(F ) has a higher degree than detH\u03b4(F ) and detN\u03b4(F ).\n4 Proof\nIn this section, we show the proof of Theorem 10.\n4.1 Proof of Theorem 10-(1)\nProof. By Definition 5, we only need to show that\nS\u03b4(F ) \u00b7 detV = c \u00b7 det(H\u03b4(F ) \u00b7 V )\nNext we will keep simplifying the determinant of H\u03b4(F ) \u00b7 V . Consider the product H\u03b4(F ) \u00b7 V :\nH\u03b4(F ) \u00b7 V =  RT1 ... RTt\nXT\u03b4,d0\n \u00b7 V =  RT1 V ... RTt V\nXT\u03b4,d0V  where\nRi = \nai0 \u00b7 \u00b7 \u00b7 aidi . . .\n. . .\nai0 \u00b7 \u00b7 \u00b7 aidi f (i) 1,d0 \u00b7 \u00b7 \u00b7 \u00b7 \u00b7 \u00b7 f (i)1,2 f (i) 1,1\n... ...\n...\nf (i) \u03b4i+di\u2212d0,d0 \u00b7 \u00b7 \u00b7 \u00b7 \u00b7 \u00b7 f (i) \u03b4i+di\u2212d0,2 f (i) \u03b4i+di\u2212d0,1\n T min(\u03b4i, d0 \u2212 di) rowsmax(0, \u03b4i + di \u2212 d0) rows Meanwhile, we partition the denominator M\u03b4 of S\u03b4(F ), into t+ 1 parts, that is,\nM\u03b4(F ) =  M1\n... Mt X\u03b5  (3) where\nMi =  \u03b1 0 1Fi(\u03b11) \u00b7 \u00b7 \u00b7 \u03b10d0Fi(\u03b1d0) ... ...\n\u03b1\u03b41\u221211 Fi(\u03b11) \u00b7 \u00b7 \u00b7 \u03b1 \u03b41\u22121 d0 Fi(\u03b1d0)\n\nX\u03b5 =  \u03b1 0 1(x\u2212 \u03b11) \u00b7 \u00b7 \u00b7 \u03b10d0(x\u2212 \u03b1d0) ... ...\n\u03b1\u03b5\u221211 (x\u2212 \u03b11) \u00b7 \u00b7 \u00b7 \u03b1 \u03b5\u22121 d0 (x\u2212 \u03b1d0)  We will show that there exists a \u03b4i \u00d7 \u03b4i matrix Ti such that TiMi = RTi V and XT\u03b4,d0V = X\u03b5.\n1. Show that TiMi = R T i V .\nNote that\nR T i V = \n\u03b101(ai0\u03b1 0 1 + \u00b7 \u00b7 \u00b7+ aidi\u03b1 di 1 ) \u00b7 \u00b7 \u00b7 \u03b1 0 d0 (ai0\u03b1 0 d0 + \u00b7 \u00b7 \u00b7+ aidi\u03b1 di d0 )\n. . . . . .\n\u03b1 d0\u2212d1\u22121 1 (ai0\u03b1 0 1 + \u00b7 \u00b7 \u00b7+ aidi\u03b1 di 1 ) \u00b7 \u00b7 \u00b7 \u03b1 d0\u2212d1\u22121 d0 (ai0\u03b1 0 d0 + \u00b7 \u00b7 \u00b7+ aidi\u03b1 d1 d0 )\nf (i) 1,d0 \u03b101 + \u00b7 \u00b7 \u00b7+ f (i) 1,1\u03b1 d0\u22121 1 \u00b7 \u00b7 \u00b7 f (i) 1,d0 \u03b10d0 + \u00b7 \u00b7 \u00b7+ f(i)1,1\u03b1 d0\u22121 d0\n. . . . . .\nf (i) \u03b4i+di\u2212d0,d0 \u03b101 + \u00b7 \u00b7 \u00b7+ f (i) \u03b4i+di\u2212d0,1 \u03b1 d0\u22121 1 \u00b7 \u00b7 \u00b7f (1) \u03b4i+di\u2212d0,d0 \u03b10d0 + \u00b7 \u00b7 \u00b7+ f(1)\u03b4i+di\u2212d0,1\u03b1 d0\u22121 d0\n\nFrom the above matrix, we have the following observations:\n\u2022 ai0\u03b10j + \u00b7 \u00b7 \u00b7+ aidi\u03b1 di j = Fi(\u03b1j); \u2022 f (i)r,d0\u03b1 0 j + \u00b7 \u00b7 \u00b7+ f (i) r,1\u03b1 d0\u22121 j = k (i) r (\u03b1j).\nThus we have\nRTi V = \n\u03b101Fi(\u03b11) \u00b7 \u00b7 \u00b7 \u03b10d0Fi(\u03b1d0) ... ...\n\u03b1d0\u2212di\u221211 Fi(\u03b11) \u00b7 \u00b7 \u00b7 \u03b1 d0\u2212di\u22121 d0 Fi(\u03b1d0)\nk (i) 1 (\u03b11) \u00b7 \u00b7 \u00b7 k (i) 1 (\u03b1d0)\n... ...\nk (i) \u03b4i+di\u2212d0(\u03b11) \u00b7 \u00b7 \u00b7 k (i) \u03b4i+di\u2212d0(\u03b1d0)  Recall (2). Plugging x = \u03b1i into it, we obtain:\nk(i)r (\u03b1j) = (a0d0\u03b1 r\u22121 j + \u00b7 \u00b7 \u00b7+ a0d0\u2212r+1)(aidi\u2212r\u03b1 d0\u2212r j + \u00b7 \u00b7 \u00b7+ ai0\u03b1 d0\u2212di j )\n\u2212 (a0d0\u2212r\u03b1 d0\u2212r j + \u00b7 \u00b7 \u00b7+ a00)(aidi\u03b1 r\u22121 j + \u00b7 \u00b7 \u00b7+ aidi\u2212r+1)\n= (a0d0\u03b1 r\u22121 j + \u00b7 \u00b7 \u00b7+ a0d0\u2212r+1)(aidi\u2212r\u03b1 d0\u2212r j + \u00b7 \u00b7 \u00b7+ ai0\u03b1 d0\u2212di j )\n+ (a0d0\u03b1 d0 j + \u00b7 \u00b7 \u00b7+ a0d0\u2212r+1\u03b1 d0\u2212r+1 j )(aidi\u03b1 r\u22121 j + \u00b7 \u00b7 \u00b7+ aidi\u2212r+1)\n= (a0d0\u03b1 r\u22121 j + \u00b7 \u00b7 \u00b7+ a0d0\u2212r+1) \u00b7 (ai0\u03b1 d0 j + \u00b7 \u00b7 \u00b7+ ai0\u03b1 d0\u2212di j ) = \u03b1d0\u2212dij Fi(\u03b1j)(a0d0\u03b1 r\u22121 j + \u00b7 \u00b7 \u00b7+ a0d0\u2212r+1)\nwhich immediately yields that\nRTi V = \n\u03b101Fi(\u03b11) \u00b7 \u00b7 \u00b7 \u03b10d0Fi(\u03b1d0) ... ...\n\u03b1d0\u2212di\u221211 Fi(\u03b11) \u00b7 \u00b7 \u00b7 \u03b1 d0\u2212di\u22121 d0 Fi(\u03b1d0)\n\u03b1d0\u2212di1 Fi(\u03b11)G0(\u03b11) \u00b7 \u00b7 \u00b7 \u03b1 d0\u2212di d0\nFi(\u03b1d0)G0(\u03b1d0) ... ...\n\u03b1d0\u2212di1 Fi(\u03b11)G\u03b4i+di\u2212d0\u22121(\u03b11) \u00b7 \u00b7 \u00b7 \u03b1 d0\u2212di d0 Fi(\u03b1d0)G\u03b4i+di\u2212d0\u22121(\u03b1d0)  where Gr(\u03b1j) = a0d0\u03b1 r\u22121 j + \u00b7 \u00b7 \u00b7 + a0d0\u2212r+1. We continue to simplify the lower part of RTi V (which has max(0, \u03b4i + di \u2212 d0) rows) with a series of row operations.\nObserving that G0(\u03b1j) G1(\u03b1j)\n... G\u03b4i+di\u2212d0\u22121(\u03b1j)\n = \na0d0 a0d0\u22121 a0d0\n... ...\n. . .\na02d0\u2212\u03b4i\u2212di+1 \u00b7 \u00b7 \u00b7 \u00b7 a0d0\n \n\u03b10j \u03b11j ...\n\u03b1\u03b4i+di\u2212d0\u22121j\n\nwe immediately have \u03b1 d0\u2212di 1 Fi(\u03b11)Gi,0(\u03b11) \u00b7 \u00b7 \u00b7 \u03b1 d0\u2212di d0 Fi(\u03b1d0)Gi,0(\u03b1d0) ... ...\n\u03b1d0\u2212di1 Fi(\u03b11)Gi,\u03b4i+di\u2212d0\u22121(\u03b11) \u00b7 \u00b7 \u00b7 \u03b1 d0\u2212di d0 Fi(\u03b1d0)Gi,\u03b4i+di\u2212d0\u22121(\u03b1d0)\n\n=  a0d0 a0d0\u22121 a0d0 ... ... . . .\na02d0\u2212\u03b4i\u2212di+1 \u00b7 \u00b7 \u00b7 \u00b7 a0d0\n \u03b1 d0\u2212di 1 Fi(\u03b11) \u00b7 \u00b7 \u00b7 \u03b1 d0\u2212di d0 Fi(\u03b1d0) ... ...\n\u03b1\u03b4i\u221211 Fi(\u03b11) \u00b7 \u00b7 \u00b7 \u03b1 \u03b4i\u22121 d0 Fi(\u03b1d0)  Hence, let\nT\u0303i =  a0d0 a0d0\u22121 a0d0 ... ... . . .\na02d0\u2212\u03b4i\u2212di+1 \u00b7 \u00b7 \u00b7 \u00b7 a0d0  which has the order max(0, \u03b4i + di \u2212 d0). Then\nRTi V =\n[ Ii\nT\u0303i ] \n\u03b101Fi(\u03b11) \u00b7 \u00b7 \u00b7 \u03b10d0Fi(\u03b1d0) ... ...\n\u03b1d0\u2212di\u221211 Fi(\u03b11) \u00b7 \u00b7 \u00b7 \u03b1 d0\u2212di\u22121 d0 Fi(\u03b1d0)\n\u03b1d0\u2212di1 Fi(\u03b11) \u00b7 \u00b7 \u00b7 \u03b1 d0\u2212di d0\nFi(\u03b1d0) ... ...\n\u03b1\u03b4i\u221211 Fi(\u03b11) \u00b7 \u00b7 \u00b7 \u03b1 \u03b4i\u22121 d0 Fi(\u03b1d0)  where Ii is of order min(\u03b4i, d0 \u2212 di). Let Ti = [ Ii\nT\u0303i\n] . Then Ti is of\norder \u03b4i and R T i V = TiMi.\n2. Show that XT\u03b4,d0V = X\u03b5.\nIt is easy to be verified by carrying out the following matrix product:\nXT\u03b4,d0V = x \u22121. . . . . . x \u22121\n \u03b5\u00d7d0  \u03b1 0 1 \u00b7 \u00b7 \u00b7 \u03b10d0 ... ... \u03b1d0\u221211 \u00b7 \u00b7 \u00b7 \u03b1 d0\u22121 d0 \n=  \u03b1 0 1(x\u2212 \u03b11) \u00b7 \u00b7 \u00b7 \u03b10d0(x\u2212 \u03b1d0) ... ...\n\u03b1\u03b5\u221211 (x\u2212 \u03b11) \u00b7 \u00b7 \u00b7 \u03b1 \u03b5\u22121 d0 (x\u2212 \u03b1d0)\nX\u03b5\nTo sum up, we have T1 . . .\nTt I\n  M1 ... Mt\nX\u03b5\n =  RT1 V ... RTt V\nX\u03b4,d0V  = H\u03b4(F ) \u00b7 V Finally, taking determinants on the left and right sides, we obtain the following:\nt\u220f i=1 detTi \u00b7 detM\u03b4 = detH\u03b4(F ) \u00b7 detV\nwhere\ndetTi = det\n[ Ii\nT\u0303i\n] = det T\u0303i\nRecall that T\u0303i is of order max(0, \u03b4i + di \u2212 d0) and is a lower-triangular matrix with diagonal entries to be a0d0 . Thus\ndet T\u0303i = a max(0,\u03b4i+di\u2212d0) 0d0\nwhich yields detTi = a max(0,\u03b4i+di\u2212d0) 0d0 . Then it is easy to derive that\nS\u03b4(F ) = a \u03b40 0d0 \u00b7 detM\u03b4/ detV\n= a\u03b400d0 detH\u03b4(F ) / t\u220f i=1 detTi = a \u03b40\u2212 \u2211t i=1 max(0,\u03b4i+di\u2212d0)\n0d0 detH\u03b4(F )\n4.2 Proof of Theorem 10-(2)\nProof. By Definition 5, we only need to show that\nS\u03b4(F ) \u00b7 detV = c \u00b7 det(N\u03b4(F ) \u00b7 V )\nNext we will keep simplifying the determinant of N\u03b4(F ) \u00b7 V . Consider the product N\u03b4(F ) \u00b7 V . We have\nN\u03b4(F ) \u00b7 V =  RT1 ...\nRTt\nXT\u03b4,d0\n \u00b7 V =  RT1 V ...\nRTt V\nXT\u03b4,d0V\n\nwhere\nRi =  ai0 \u00b7 \u00b7 \u00b7 aidi . . .\n. . .\nai0 \u00b7 \u00b7 \u00b7 aidi c (i) di\u22121,0 \u00b7 \u00b7 \u00b7 \u00b7 \u00b7 \u00b7 c (i) di\u22121,d0\u22122 c (i) di\u22121,d0\u22121\n... ...\n...\nc (i) d0\u2212\u03b4i,0 \u00b7 \u00b7 \u00b7 \u00b7 \u00b7 \u00b7 c (i) d0\u2212\u03b4i,d0\u22122 c (i) d0\u2212\u03b4i,d0\u22121\n Tmin(\u03b4i, d0 \u2212 di) rowsmax(0, \u03b4i + di \u2212 d0) rows As done in (3), we partition the denominator M\u03b4 of S\u03b4(F ), into t + 1 parts, denoted by M1, . . . ,Mt, X\u03b5. By the proof of Theorem 10-1, X\nT \u03b4,d0 V = X\u03b5. It\nremains to show RTi V = TiMi for some \u03b4i \u00d7 \u03b4i matrix Ti. Note that\nRTi V = \n\u03b101Fi(\u03b11) \u00b7 \u00b7 \u00b7 \u03b10d0Fi(\u03b1d0) ... ...\n\u03b1d0\u2212di\u221211 Fi(\u03b11) \u00b7 \u00b7 \u00b7 \u03b1 d0\u2212di\u22121 d0 Fi(\u03b1d0)\nC (i) di\u22121 \u00b7 \u03b1\u03041 \u00b7 \u00b7 \u00b7 C (i) di\u22121 \u00b7 \u03b1\u0304d0\n... ...\nC (i) d0\u2212\u03b4i \u00b7 \u03b1\u03041 \u00b7 \u00b7 \u00b7 C (i) d0\u2212\u03b4i \u00b7 \u03b1\u0304d0  where\nC (i) k \u00b7 \u03b1\u0304j = [ c (i) k,0 c (i) k,1 \u00b7 \u00b7 \u00b7 c (i) k,d0\u22121 ] \u00b7  \u03b10j \u03b11j ...\n\u03b1d0\u22121j  Now we partition RTi V into two blocks, i.e.,\nRTi V =\n[ U1\nU2\n]\nwith\nU1 =  \u03b1 0 1Fi(\u03b11) \u00b7 \u00b7 \u00b7 \u03b10d0Fi(\u03b1d0) ... ...\n\u03b1d0\u2212di\u221211 Fi(\u03b11) \u00b7 \u00b7 \u00b7 \u03b1 d0\u2212di\u22121 d0 Fi(\u03b1d0)\n\nU2 =  C (i) di\u22121 \u00b7 \u03b1\u03041 \u00b7 \u00b7 \u00b7 C (i) di\u22121 \u00b7 \u03b1\u0304d0 ... ...\nC (i) d0\u2212\u03b4i \u00b7 \u03b1\u03041 \u00b7 \u00b7 \u00b7 C (i) d0\u2212\u03b4i \u00b7 \u03b1\u0304d0\n\nWe continue to simplify U2 (which has max(0, \u03b4i \u2212 d0 + di) rows) with a series of row operations.\nRecall [12, Lemma 35] which states that\nC (i) k \u00b7 \u03b1\u0304j = a0d0Fi(\u03b1j)(\u22121) d0\u2212k\u22121e (j) d0\u2212k\u22121\nwhere e (j) ` denotes the `-th elementary symmetric function on \u03b11, \u03b12, . . . , \u03b1j\u22121, \u03b1j+1, . . . , \u03b1d0 . Substituting the above equation into U2 and factoring a0d0 out, we have\nU2 = a0d0  Fi(\u03b11)(\u22121)d0\u2212die(1)d0\u2212di \u00b7 \u00b7 \u00b7 Fi(\u03b1d0)(\u22121) d0\u2212die (d0) d0\u2212di ... ...\nFi(\u03b11)(\u22121)\u03b4i\u22121e(1)\u03b4i\u22121 \u00b7 \u00b7 \u00b7 Fi(\u03b1d0)(\u22121) \u03b4i\u22121e (d0) \u03b4i\u22121  By [12, Lemma 36],\ne (i) j = j\u2211 k=0 (\u22121)kej\u2212k\u03b1ki = [(\u22121)0ej (\u22121)1ej\u22121 \u00b7 \u00b7 \u00b7 (\u22121)je0 0 \u00b7 \u00b7 \u00b7 0] \u00b7  \u03b10i \u03b11i ...\n\u03b1d0\u22121i  where e` is the `-th elementary symmetric polynomial on \u03b11, . . . , \u03b1d0 with the convention e (i) 0 := 0. Denote [(\u22121)0ej (\u22121)1ej\u22121 \u00b7 \u00b7 \u00b7 (\u22121)je0 0 \u00b7 \u00b7 \u00b7 0] with e\u0304j . Then e (i) j = e\u0304j\u03b1\u0304i and thus\nU2 = a0d0\nFi(\u03b11)(\u22121) d0\u2212di e\u0304d0\u2212di \u03b1\u03041 \u00b7 \u00b7 \u00b7 Fi(\u03b1d0)(\u22121) d0\u2212di e\u0304d0\u2212di \u03b1\u0304d0 ... ...\nFi(\u03b11)(\u22121)\u03b4i\u22121e\u0304\u03b4i\u22121\u03b1\u03041 \u00b7 \u00b7 \u00b7 Fi(\u03b1d0)(\u22121) \u03b4i\u22121e\u0304\u03b4i\u22121\u03b1\u0304d0\n\n= a0d0\n(\u22121) d0\u2212di e\u0304d0\u2212di ...\n(\u22121)\u03b4i\u22121e\u0304\u03b4i\u22121\n [\u03b1\u03041 \u00b7 \u00b7 \u00b7 \u03b1\u0304d0] Fi(\u03b11) . . .\nFi(\u03b1d0)  Noting that the last d0\u2212\u03b4i columns of e\u0304d0\u2212di , . . . , e\u0304\u03b4i\u22121 are all zeros, we truncate these columns and denote the resulting vectors with e\u0303d0\u2212di , . . . , e\u0303\u03b4i\u22121. With the the last d0 \u2212 \u03b4i rows of [ \u03b1\u03041 \u00b7 \u00b7 \u00b7 \u03b1\u0304d0 ] cancelled by these zero columns, we obtain\nU2 = T\u0303i  \u03b1 0 1 \u00b7 \u00b7 \u00b7 \u03b10d0 ... ...\n\u03b1\u03b4i\u221211 \u00b7 \u00b7 \u00b7 \u03b1 \u03b4i\u22121 d0\n Fi(\u03b11) . . .\nFi(\u03b1d0)  where\nT\u0303i = a0d0\n(\u22121) d0\u2212di e\u0303d0\u2212di ...\n(\u22121)\u03b4i\u22121e\u0303\u03b4i\u22121\n\nIt is easy to see that T\u0303i is of order max(0, \u03b4i \u2212 d0 + di)\u00d7 \u03b4i. On the other hand, it is observed that\nU1 = [ Ii 0 ]  \u03b1 0 1 \u00b7 \u00b7 \u00b7 \u03b10d0 ... ...\n\u03b1\u03b4i\u221211 \u00b7 \u00b7 \u00b7 \u03b1 \u03b4i\u22121 d0\n Fi(\u03b11) . . .\nFi(\u03b1d0)  where the order of Ii is min(\u03b4i, d0 \u2212 di). We construct\nTi =\n[ Ii 0\nT\u0303i ] and it follows that\nRTi V =\n[ U1\nU2\n] = Ti  \u03b1 0 1 \u00b7 \u00b7 \u00b7 \u03b10d0 ... ...\n\u03b1\u03b4i\u221211 \u00b7 \u00b7 \u00b7 \u03b1 \u03b4i\u22121 d0\n Fi(\u03b11) . . .\nFi(\u03b1d0)  = TiMi Finally assembling RTi V together, we achieve the following:\nN\u03b4(F ) \u00b7 V =  RT1 V ...\nRTt V\nXT\u03b4,d0V\n =  T1M1\n... TtMt X\u03b5\n =  T1 . . .\nTt I\u03b5\n  M1\n... Mt X\u03b5  where I\u03b5 is the identity matrix of order \u03b5. Taking determinant on both sides yields\ndetN\u03b4(F ) \u00b7 detV = t\u220f i=1 detTi \u00b7 detM\u03b4\nFurther calculation derives\ndetTi = det\n[ I 0\nT\u0303i\n] = a \u2211t i=1 max(0,\u03b4i\u2212d0+di)\n0d0\nwhich immediately implies\nS\u03b4(F ) = a \u03b40 0d0 detM\u03b4/ detV = a \u03b40 0d0 \u00b7 detN\u03b4(F ) \u00b7 1\u220ft i=1 detTi = c \u00b7 detN\u03b4(F )\nwhere c = a\n\u03b40\u2212 \u2211t i=1 max(0,\u03b4i\u2212d0+di) 0d0\n5 Experimental Results\nIn this section, we run a collection of examples to examine the efficiency for computing the subresultant polynomials with various subresultant formulas. The involved formulas includes the Sylvester type, the Barnett type, and the Be\u0301zout type as well as its two variants developed in the current paper. These examples are run on a PC equipped with the Intel Core i7-10710U processor and a 16.0G RAM. In particular, the comparison is carried out from two aspects. One is the time cost for computing different subresultant polynomials with the same polynomial set as \u03b4 changes. The other is the time cost charged by each stage in the computation of multi-polynomial subresultant polynomials.\nFigure 1 illustrates the cost for two polynomial sets as \u03b4 changes. The degrees of the involving polynomials are (15, 12, 9) and (14, 12, 12) while the\nnumber of parameters are both 2. Considering the total numbers of possible \u03b4\u2019s are 120 and 136 respectively, in the two examples, it is impractical to list all of them. Thus we select 14 \u03b4\u2019s for each case. In Fig. 1 below, the time changes are described by broken lines with different colors. It is seen that the three Be\u0301zout-type formulas behave better than the other two (i.e., the Sylvester type and Barnett type). Moreover, the non-homogeneous Be\u0301zout type shows the least time consumption.\nTo get a better understanding on the time efficiency of the three Be\u0301zout type formulas, we make a further profiling on them. With some analysis on the program, we identify two operations that cover most of the running time, which are matrix generation and determinant calculation. In Table 1, we show the time cost for each operation with 10 test examples. The total time cost listed in the table is the sum of time cost for all possible \u03b4\u2019s and the numbers of involved parameters are all 2. It is seen that in most cases, the non-homogeneous Be\u0301zout formula dominates all the three formulas while the hybrid Be\u0301zout behaves worst. However, after a closer look, it is found that the time for generating the hybrid Be\u0301zout matrix takes almost no time compared with other two formulas. The calculation of determinants takes up almost all the time. Then it naturally leads to a question: is there an efficient method for computing the determinant of a hybrid Be\u0301zout matrix with its structure to be fully exploited? This topic is an interesting topic that needs to be further studied.\nAcknowledgements. The authors\u2019 work was supported by National Natural Science Foundation of China (Grant Nos. 12261010 and 11801101), Natural Science Foundation of Guangxi (Grant No. AD18126010) and the Natural Science Cultivation Project of Guangxi Minzu University (Grant No. 2022MDKJ001).\nReferences\n[1] Dennis S Arnon, George E Collins, and Scott McCallum. Cylindrical algebraic decomposition I: The basic algorithm. SIAM Journal on Computing, 13(4):865\u2013877, 1984.\n[2] Mohammadali Asadi, Alexander Brandt, David J. Jeffrey, and Marc Moreno Maza. Subresultant chains using Be\u0301zout matrices. In Franc\u0327ois Boulier, Matthew England, Timur M. Sadykov, and Evgenii V. Vorozhtsov, editors, Computer Algebra in Scientific Computing, pages 29\u201350, Cham, 2022. Springer International Publishing.\n[3] Stephen Barnett. Greatest common divisor of several polynomials. In Mathematical proceedings of the Cambridge philosophical society, volume 70, pages 263\u2013268. Cambridge University Press, 1971.\n[4] Stephen Barnett. Polynomials and linear control systems. Marcel Dekker, Inc., 1983.\n[5] Alin Bostan, Carlos D\u2019Andrea, Teresa Krick, Agne\u0300s Szanto, and Marcelo Valdettaro. Subresultants in multiple roots: an extremal case. Linear Algebra and its Applications, 529:185\u2013198, 2017.\n[6] George E Collins. Subresultants and reduced polynomial remainder sequences. Journal of the ACM (JACM), 14(1):128\u2013142, 1967.\n[7] George E Collins and Hoon Hong. Partial cylindrical algebraic decomposition for quantifier elimination. Journal of Symbolic Computation, 12(3):299\u2013328, 1991.\n[8] David A Cox and Carlos D\u2019Andrea. Subresultants and the shape lemma. arXiv preprint arXiv:2112.10306, 2021.\n[9] Gema M Diaz-Toca and Laureano Gonzalez-Vega. Barnett\u2019s theorems about the greatest common divisor of several univariate polynomials through Bezout-like matrices. Journal of Symbolic Computation, 34(1):59\u2013 81, 2002.\n[10] Gema M Diaz-Toca and Laureano Gonzalez-Vega. Various new expressions for subresultants and their applications. Applicable Algebra in Engineering, Communication and Computing, 15(3):233\u2013266, 2004.\n[11] Hoon Hong and Jing Yang. A condition for multiplicity structure of univariate polynomials. Journal of Symbolic Computation, 104:523\u2013538, 2021.\n[12] Hoon Hong and Jing Yang. Subresultant of several univariate polynomials. arXiv preprint arXiv:2112.15370, 2021.\n[13] Xiaorong Hou and Dongming Wang. Subresultants with the Be\u0301zout matrix. In Computer Mathematics, pages 19\u201328. World Scientific, 2000.\n[14] Deepak Kapur, Tushar Saxena, and Lu Yang. Algebraic and geometric reasoning using dixon resultants. In Proceedings of the international symposium on Symbolic and algebraic computation, pages 99\u2013107, 1994.\n[15] Alain Lascoux and Piotr Pragacz. Double Sylvester sums for subresultants and multi-Schur functions. Journal of Symbolic Computation, 35(6):689\u2013 710, 2003.\n[16] Yong-Bin Li. A new approach for constructing subresultants. Applied mathematics and computation, 183(1):471\u2013476, 2006.\n[17] Sylvester. On a theory of syzygetic relations of two rational integral functions, comprising an application to the theory of Sturm\u2019s functions, and that of the greatest algebraic common measure. Phil. Trans, 143:407\u2013548, 1853.\n[18] Akira Terui. Recursive polynomial remainder sequence and its subresultants. Journal of Algebra, 320(2):633\u2013659, 2008.\n[19] Dongming Wang. Decomposing polynomial systems into simple systems. Journal of Symbolic Computation, 25(3):295\u2013314, 1998.\n[20] Dongming Wang. Computing triangular systems and regular systems. Journal of Symbolic Computation, 30(2):221\u2013236, 2000."
        }
    ],
    "title": "Two Variants of Be\u0301zout Subresultants for Several Univariate Polynomials",
    "year": 2023
}