{
    "abstractText": "In this paper, we study the sixth order equation with the simply supported boundary conditions in a polygonal domain. We propose a new mixed formulation that decomposes the sixth order problem into a system of Poisson equations. Depending on the interior angles of the domain, additional Poisson problems may be needed to confine the solution to the correct Sobolev space. In addition, we propose a C finite element algorithm for the sixth order problem and provide the optimal error analysis. Numerical results are reported to verify the theoretical findings.",
    "authors": [
        {
            "affiliations": [],
            "name": "HENGGUANG LI"
        },
        {
            "affiliations": [],
            "name": "PEIMENG YIN"
        },
        {
            "affiliations": [],
            "name": "P. YIN"
        }
    ],
    "id": "SP:939b1cff9eff9e4379abbc1a766c26cd8829780f",
    "references": [
        {
            "authors": [
                "R. Backofen",
                "A. R\u00e4tz",
                "A. Voigt"
            ],
            "title": "Nucleation and growth by a phase field crystal (PFC) model",
            "venue": "Philosophical Magazine Letters,",
            "year": 2007
        },
        {
            "authors": [
                "J.W. Barrett",
                "S. Langdon",
                "R. N\u00fcrnberg"
            ],
            "title": "Finite element approximation of a sixth order nonlinear degenerate parabolic equation",
            "venue": "Numerische Mathematik,",
            "year": 2004
        },
        {
            "authors": [
                "J.H. Bramble",
                "M. Zl\u00e1mal"
            ],
            "title": "Triangular elements in the finite element method",
            "venue": "Mathematics of Computation,",
            "year": 1970
        },
        {
            "authors": [
                "S.C. Brenner",
                "L.R. Scott"
            ],
            "title": "The Mathematical Theory of Finite Element Methods, volume 15 of Texts in Applied Mathematics",
            "venue": "FEM FOR SIXTH ORDER EQUATION",
            "year": 2002
        },
        {
            "authors": [
                "M. Cheng",
                "J.A. Warren"
            ],
            "title": "An efficient algorithm for solving the phase field crystal model",
            "venue": "Journal of Computational Physics,",
            "year": 2008
        },
        {
            "authors": [
                "P. Ciarlet"
            ],
            "title": "The Finite Element Method for Elliptic Problems, volume 4 of Studies in Mathematics and Its Applications",
            "year": 1978
        },
        {
            "authors": [
                "J. Droniou",
                "M. Ilyas",
                "B.P. Lamichhane",
                "G.E. Wheeler"
            ],
            "title": "A mixed finite element method for a sixth-order elliptic problem",
            "venue": "IMA Journal of Numerical Analysis,",
            "year": 2019
        },
        {
            "authors": [
                "L. Evans"
            ],
            "title": "Partial Differential Equations, volume 19 of Graduate Studies in Mathematics",
            "venue": "AMS, Rhode Island,",
            "year": 1998
        },
        {
            "authors": [
                "P. Grisvard"
            ],
            "title": "Elliptic Problems in Nonsmooth Domains",
            "year": 1985
        },
        {
            "authors": [
                "P. Grisvard"
            ],
            "title": "Singularities in Boundary Value Problems, volume 22 of Research Notes in Applied Mathematics",
            "year": 1992
        },
        {
            "authors": [
                "T. Gudi",
                "M. Neilan"
            ],
            "title": "An interior penalty method for a sixth-order elliptic equation",
            "venue": "IMA journal of numerical analysis,",
            "year": 2011
        },
        {
            "authors": [
                "Z. Hu",
                "S.M. Wise",
                "C. Wang",
                "J.S. Lowengrub"
            ],
            "title": "Stable and efficient finite-difference nonlinear-multigrid schemes for the phase field crystal equation",
            "venue": "Journal of Computational Physics,",
            "year": 2009
        },
        {
            "authors": [
                "V.A. Kondrat\u2032ev"
            ],
            "title": "Boundary value problems for elliptic equations in domains with conical or angular points",
            "venue": "Trudy Moskov. Mat. Obs\u030cc\u030c.,",
            "year": 1967
        },
        {
            "authors": [
                "V. Kozlov",
                "V. Maz\u2032ya",
                "J. Rossmann"
            ],
            "title": "Elliptic boundary value problems in domains with point singularities, volume 52 of Mathematical Surveys and Monographs",
            "year": 1997
        },
        {
            "authors": [
                "V. Kozlov",
                "V. Maz\u2032ya",
                "J. Rossmann"
            ],
            "title": "Spectral problems associated with corner singularities of solutions to elliptic equations, volume 85 of Mathematical Surveys and Monographs",
            "year": 2001
        },
        {
            "authors": [
                "H. Li"
            ],
            "title": "Graded Finite Element Methods for Elliptic Problems in Nonsmooth Domains",
            "venue": "Surveys and Tutorials in the Applied Mathematical Sciences (STAMS,",
            "year": 2022
        },
        {
            "authors": [
                "H. Li",
                "S. Nicaise"
            ],
            "title": "Regularity and a priori error analysis on anisotropic meshes of a Dirichlet problem in polyhedral domains",
            "venue": "Numer. Math.,",
            "year": 2018
        },
        {
            "authors": [
                "H. Li",
                "P. Yin",
                "Z. Zhang"
            ],
            "title": "A C finite element method for the biharmonic problem with Navier boundary conditions in a polygonal domain",
            "venue": "IMA Journal of Numerical Analysis,",
            "year": 2022
        },
        {
            "authors": [
                "S. Nazarov",
                "B.A. Plamenevsky"
            ],
            "title": "Elliptic Problems in Domains with Piecewise Smooth Boundaries, volume 13",
            "venue": "Walter de Gruyter,",
            "year": 1994
        },
        {
            "authors": [
                "S.A. Nazarov",
                "G. Kh"
            ],
            "title": "Svirs. Boundary value problems for the biharmonic equation and the iterated Laplacian in a three-dimensional domain with an edge",
            "venue": "Zap. Nauchn. Sem. S.-Peterburg. Otdel. Mat. Inst. Steklov. (POMI), 336(Kraev. Zadachi Mat. Fiz. i Smezh. Vopr. Teor. Funkts. 37):153\u2013198,",
            "year": 2006
        },
        {
            "authors": [
                "H. Ugail"
            ],
            "title": "Partial Differential Equations for Geometric Design",
            "venue": "Springer Science & Business Media,",
            "year": 2011
        },
        {
            "authors": [
                "A. \u017de\u0144\u0131\u030csek"
            ],
            "title": "Interpolation polynomials on the triangle",
            "venue": "Numerische Mathematik,",
            "year": 1970
        },
        {
            "authors": [
                "S.M. Wise",
                "C. Wang",
                "J.S. Lowengrub"
            ],
            "title": "An energy-stable and convergent finite-difference scheme for the phase field crystal equation",
            "venue": "SIAM Journal on Numerical Analysis,",
            "year": 2009
        },
        {
            "authors": [
                "S. Wu",
                "J. Xu"
            ],
            "title": "P interior penalty nonconforming finite element methods for 2m-th order pdes in R",
            "venue": "arXiv preprint arXiv:1710.07678,",
            "year": 2017
        },
        {
            "authors": [
                "S. Wu",
                "J. Xu"
            ],
            "title": "Nonconforming finite element spaces for 2mth order partial differential equations on R simplicial grids when m = n + 1",
            "venue": "Mathematics of Computation,",
            "year": 2019
        },
        {
            "authors": [
                "S. Zhang",
                "Z. Zhang"
            ],
            "title": "Invalidity of decoupling a biharmonic equation to two Poisson equations on non-convex polygons",
            "venue": "Int. J. Numer. Anal. Model.,",
            "year": 2008
        }
    ],
    "sections": [
        {
            "text": "conditions in a polygonal domain. We propose a new mixed formulation that decomposes the sixth order problem into a system of Poisson equations. Depending on the interior angles of the domain, additional Poisson problems may be needed to confine the solution to the correct Sobolev space. In addition, we propose a C0 finite element algorithm for the sixth order problem and provide the optimal error analysis. Numerical results are reported to verify the theoretical findings.\n1. Introduction\nConsider the sixth order triharmonic problem\n\u2212\u22063u = f in \u2126, u = \u2206u = \u22062u = 0 on \u2202\u2126, (1.1)\nwhere \u2126 \u2282 R2 is a polygonal domain and f \u2208 L2(\u2126). The boundary conditions in (1.1) are known as the simply supported boundary conditions [7]. The sixth order partial differential equations (PDEs) arises from many mathematical models such as differential geometry [21], the thin film equations [2], and the phase field crystal model [1, 5, 12, 23]. The conforming finite element approximation for (1.1) requires H3 conforming finite element which usually involves delicate constructions of the finite element space and of the variational formulation [22, 3, 6, 4]. Recently, a nonconforming H3 conforming finite element was proposed in [25], and the element is composed of H1 conforming finite element and additional bubble functions. C0 interior penalty discontinuous Galerkin (IPDG) and C1-IPDG method were also proposed in [11] for the sixth order elliptic equations, but the choice of penalty parameters could be involved. To balance the weak continuity and the complexity in choosing the penalty parameters, a family of Pm interior nonconforming finite element methods was proposed in [24]. A mixed finite element was proposed in [7] based on the low-order H1-conforming finite element or C0 finite element, and optimal error estimate was given under the regularity assumption u \u2208 Hk+1(\u2126) for k = N \u222a {0}. However, the regularity\nDate: April 18, 2023. 2020 Mathematics Subject Classification. 65N12, 65N30, 35J40. Key words and phrases. Sixth order equation, polygonal domain, mixed formulation, C0 finite element method, optimal error estimates. FThis manuscript has been authored in part by UT-Battelle, LLC, under contract DE-AC05-00OR22725 with the US Department of Energy (DOE). The US government retains and the publisher, by accepting the article for publication, acknowledges that the US government retains a nonexclusive, paid-up, irrevocable, worldwide license to publish or reproduce the published form of this manuscript, or allow others to do so, for US government purposes. DOE will provide public access to these results of federally sponsored research in accordance with the DOE Public Access Plan (http://energy.gov/downloads/doe-public-access-plan). 1\nar X\niv :2\n30 4.\n07 93\n6v 1\n[ m\nat h.\nN A\n] 1\n7 A\npr 2\n02 3\nassumption does not always hold, it depends on the domain and the source term. Moreover, the solution of the sixth order problem (1.1) may not be unique in H1(\u2126) and H2(\u2126) if the domain is a polygonal domain.\nThe mixed finite method based on C0 finite element for the sixth order problem (1.1) is appealing since the boundary conditions allow one to obtain three Poisson equations that are completely decoupled, which implies that a reasonable numerical solution should be achieved by merely applying a finite element Poisson solver in the mixed formulation. Though the mixed finite element is easy to implement, its solution is not always reliable. We take the biharmonic equation with Navier boundary conditions or simply supported boundary conditions in a 2D polygonal domain as an example. The solution of the mixed formulation could be different from the solution of the original biharmonic problem when the domain possesses a reentrant corner, and this is known as the Sapongyan paradox [20, 26]. To confine the solution of the mixed formulation to the same space as the original solution, an additional Poisson problem need to be solved [18]. This kind of solution mismatch also happens between the sixth order problem (1.1) and its mixed formulation.\nIn this paper, we propose and analyze a C0 finite element method for solving the sixth order problem (1.1). In particular, we shall devise a mixed formulation to transform equation (1.1) into a system of Poisson equations with the total number depending on the interior angles. This is based on the observation that the aforementioned direct mixed formulation (decomposition into three Poisson equations) in fact defines a weak solution in a larger space than that for equation (1.1). This mismatch in function spaces does not affect the solution in a polygonal domain for which largest interior angle less than \u03c0/2; while the largest interior angle is greater than \u03c0/2, it allows additional singular functions and therefore results in a solution different from that in equation (1.1). Our proposed mixed formulation ensures that the associated solution is identical to the solution of (1.1) in polygonal domains. This is accomplished by introducing additional intermediate Poisson problems that confine the solution in the correct space.\nTo solve the proposed mixed formulation, we present a numerical algorithm based on the piecewise linear C0 finite element on quasi-uniform meshes. Meanwhile, we carry out the error analysis on the finite element approximations for both the auxiliary functions and the solution u. For the auxiliary functions, the error in the H1 norm is standard and has a convergence rate h \u03c0 \u03c9 , where \u03c9 is the interior angle of the reentrant corner; its L2 error estimate can be obtained using the duality argument. For the solution u, the error in the H1 norm is bounded by: (i) the interpolation error of the solution u in H1; (ii) the H\u22121 error for the auxiliary functions; and (iii) the weighted L2 error for the solutions of the additional intermediate Poisson problems. The H1 convergence rate for the solution u depends on the interior angles.\nThe rest of the paper is organized as follows. In Section 2, following the general regularity theory for second order elliptic equations [13, 10, 14, 15, 19], we introduce the weak solution of the sixth order problem (1.1) and the direct mixed formulation. In addition, we discuss the orthogonal space of the image of the operator \u2212\u2206 in H10 (\u2126) and identify a basis function in this space. Then we propose a modified mixed formulation and show the equivalence of the solution to the original sixth order problem. In Section 3, we propose the finite element algorithm and obtain error estimates\non quasi-uniform meshes for both the solution u and the auxiliary functions. We report numerical test results in Section 4 to validate the theory.\nThroughout the paper, the generic constant C > 0 in our estimates may be different at different occurrences. It will depend on the computational domain, but not on the functions involved or the mesh level in the finite element algorithms.\n2. The sixth order problem\n2.1. Well-posedness of the solution. Denote by Hm(\u2126), m \u2265 0, the Sobolev space that consists of functions whose ith derivatives are square integrable for 0 \u2264 i \u2264 m. Let L2(\u2126) := H0(\u2126). If m is not an integer, then it defines the fractional Sobolev space. Recall that H l0(\u2126) \u2282 H l(\u2126) for l \u2264 1 is the subspace consisting of functions with zero traces on the boundary \u2202\u2126. We shall denote the norm \u2016 \u00b7 \u2016L2(\u2126) by \u2016 \u00b7 \u2016 when there is no ambiguity about the underlying domain. Let V = {\u03c6 | \u03c6 \u2208 H3(\u2126), \u03c6|\u2202\u2126 = 0, \u2206\u03c6|\u2202\u2126 = 0}, (2.1) then the variational formulation for equation (1.1) is to find u \u2208 V such that,\na(u, \u03c6) := \u222b \u2126 \u2207\u2206u \u00b7 \u2207\u2206\u03c6dx = \u222b \u2126 f\u03c6dx = (f, \u03c6), \u2200\u03c6 \u2208 V. (2.2)\nFor (2.2), we have the following result.\nLemma 2.1. Given f \u2208 H\u22121(\u2126), the variational formulation (2.2) admits a unique solution in V and it satisfies\n\u2016u\u2016H3(\u2126) \u2264 C\u2016f\u2016H\u22121(\u2126). (2.3)\nProof. We delay the existence to Theorem 2.16. Let\u2019s assume that (2.2) has two solutions and denote by u\u0304 their difference, then we have\na(u\u0304, \u03c6) = 0, \u03c6 \u2208 V.\nNote that u\u0304 \u2208 V \u2282 H2(\u2126) \u2229H10 (\u2126) implies \u2206u\u0304 \u2208 H10 (\u2126). By the Poincare\u0301-type inequality [10]:\n\u2016\u2207\u2206u\u0304\u2016 \u2265 C0\u2016\u2206u\u0304\u2016H1(\u2126) \u2265 C0\u2016\u2206u\u0304\u2016 \u2265 C\u2016u\u0304\u2016H2(\u2126).\nBy setting \u03c6 = u\u0304, it follows\n0 = a(u\u0304, u\u0304) = \u2016\u2207\u2206u\u0304\u20162 \u2265 C\u2016u\u0304\u2016H2(\u2126) = 0,\nthus u\u0304 = 0, which implies u\u0304 is unique in H2(\u2126), so it must be unique in V . We will delay the proof of (2.3) to Theorem 2.18.\n2.2. The direct mixed formulation. Intuitively, equation (1.1) can be decoupled to the system of three Poisson problems by introducing auxiliary functions w, v such that{ \u2212\u2206w = f in \u2126,\nw = 0 on \u2202\u2126;\n{ \u2212\u2206v = w in \u2126,\nv = 0 on \u2202\u2126; and\n{ \u2212\u2206u\u0304 = v in \u2126,\nu\u0304 = 0 on \u2202\u2126. (2.4)\nWe refer to (2.4) as the direct mixed formulation. Note that numerical solvers for the Poisson problems (2.4) are readily available, while numerical approximation of the sixth-order problem (1.1)\nis generally a much harder task. The mixed weak formulation of (2.4) is to find u\u0304, v, w \u2208 H10 (\u2126) such that\nA(w, \u03c6) =(f, \u03c6), \u2200\u03c6 \u2208 H10 (\u2126), (2.5a) A(v, \u03c8) =(w,\u03c8), \u2200\u03c8 \u2208 H10 (\u2126), (2.5b) A(u\u0304, \u03c4) :=(v, \u03c4), \u2200\u03c4 \u2208 H10 (\u2126), (2.5c)\nwhere\nA(\u03c6, \u03c8) = \u222b \u2126 \u2207\u03c6 \u00b7 \u2207\u03c8dx.\nGiven f \u2208 H\u22121(\u2126) \u2282 V \u2217, it is clear that the weak solutions u\u0304, v, w are well defined by (2.5) because they are solutions of decoupled Poisson problems [8]. Since our goal is to solve the sixth order problem (1.1), an important question is whether the solution u in (2.2) and the solution u\u0304 in (2.5) are the same. In the next subsection, we shall study the structure of the solution in a polygonal domain in order to design effective numerical algorithms for problem (1.1).\n2.3. Image of the Laplace operator in H10 (\u2126) and its orthogonal space. Assume that the polygonal domain \u2126 possesses at most one interior angle greater than \u03c0 2 . We denote the largest interior angle of \u2126 by \u03c9 which is associated with the vertex Q. Without lost of generality, we set Q to be the origin. Let (r, \u03b8) be the polar coordinates centered at the vertex Q, such that \u03c9 is spanned by two half lines \u03b8 = 0 and \u03b8 = \u03c9. Given R > 0, we identify a sector KR\u03c9 \u2282 \u2126 with radius R as\nKR\u03c9 = {(r, \u03b8)|0 \u2264 r \u2264 R, 0 \u2264 \u03b8 \u2264 \u03c9}.\nA sketch drawing of the domain \u2126 is shown in Figure 1.\nWe first introduce some H\u22121(\u2126) and H10 (\u2126) functions in domain \u2126 in the following way.\nDefinition 2.2. Given the parameters \u03c4 \u2208 (0, 1) and R satisfying KR\u03c9 \u2282 \u2126, let N \u2265 0 depending on \u03c9 be the total number of the functions satisfying N < 2\u03c9\n\u03c0 .\n(i) For 1 \u2264 i \u2264 N , we define H\u22121(\u2126) functions,\n\u03bei(r, \u03b8; \u03c4, R) := \u03c7i(r, \u03b8; \u03c4, R) + \u03b6i(r, \u03b8; \u03c4, R), (2.6)\nwhere\n\u03c7i(r, \u03b8; \u03c4, R) =\u03b7(r; \u03c4, R)r \u2212 i\u03c0 \u03c9 sin\n( i\u03c0\n\u03c9 \u03b8\n) , (2.7)\nwith \u03b7(r; \u03c4, R) \u2208 C\u221e(\u2126) satisfying \u03b7(r; \u03c4, R) = 1 for 0 \u2264 r \u2264 \u03c4R and \u03b7(r; \u03c4, R) = 0 for r > R, and \u03b6 \u2208 H10 (\u2126) satisfies\n\u2212\u2206\u03b6i = \u2206\u03c7i in \u2126, \u03b6i = 0 on \u2202\u2126. (2.8)\n(ii) For 1 \u2264 i \u2264 N , we obtain \u03c3i \u2208 H10 (\u2126) in \u2126,\n\u2212\u2206\u03c3i = \u03bei in \u2126, \u03c3i = 0 on \u2202\u2126. (2.9)\nFor a given \u03c9, the range of \u03c0 \u03c9 and the value of N can be found in Table 1.\nFrom (2.7), we see that \u03c7i \u2208 C\u221e(\u2126\\K\u03b4\u03c9) for any \u03b4 > 0 and \u03c7i = 0 for (r, \u03b8) \u2208 \u2126\\KR\u03c9 . Moreover, \u2206\u03c7i = 0 for (r, \u03b8) \u2208 K\u03c4R\u03c9 \u222a (\u2126 \\KR\u03c9 ).\nRemark 2.3. If N = 0, both the set {\u03bei}Ni=1 and {\u03c3i}Ni=1 are empty.\nLemma 2.4. Given \u03b7 \u2208 C\u221e(\u2126) in Definition 2.2, the functions \u03bei \u2208 H\u22121(\u2126), i = 1, \u00b7 \u00b7 \u00b7 , N , are uniquely defined and satisfy\n\u2212\u2206\u03bei = 0 in \u2126, \u03bei = 0 on \u2202\u2126. (2.10)\nMoreover, \u03bei depends on the domain \u2126, but not on \u03c4 or R. Namely, for any \u03c41, \u03c42 and R1, R2 satisfying 0 < \u03b4 < min{\u03c41R1, \u03c42R2}, it follows\n\u03be(r, \u03b8) := \u03be(r, \u03b8; \u03c41, R1) = \u03be(r, \u03b8; \u03c42, R2). (2.11)\nProof. Note that for a given \u03b7, the function \u03c7i \u2208 H\u22121(\u2126) in (2.7) is uniquely defined, and so is \u2206\u03c7i. It can be further verified that \u2206\u03c7i \u2208 L2(\u2126). Therefore, \u03b6i \u2208 H10 (\u2126) is uniquely defined via (2.8). Thus, \u03bei in (2.6) is uniquely defined due to the uniqueness of \u03c7i and \u03b6i. Taking \u2212\u2206 on both side of (2.6), we have by (2.8),\n\u2212\u2206\u03bei = \u2212 (\u2206\u03c7i + \u2206\u03b6i) = 0.\n\u03c7i = 0 and \u03b6i = 0 on \u2202\u2126 imply \u03bei = 0 on \u2202\u2126.\nWe proceed to prove (2.11). For 0 < \u03b4 < min{\u03c41R1, \u03c42R2}, we have K\u03b4\u03c9 \u2282 K\u03c41R1\u03c9 \u2229K\u03c42R2\u03c9 \u2282 \u2126. By (2.7), we have\n\u03c7i(r, \u03b8; \u03c41, R1)\u2212 \u03c7i(r, \u03b8; \u03c42, R2) = 0, (r, \u03b8) \u2208 K\u03b4\u03c9.\nRecall that \u03c7i(r, \u03b8; \u03c4j, Rj) \u2208 C\u221e(\u2126 \\K\u03b4\u03c9), j = 1, 2, then it follows\n\u03c7i(r, \u03b8; \u03c41, R1)\u2212 \u03c7i(r, \u03b8; \u03c42, R2) \u2208 C\u221e(\u2126).\nSince \u03b6i(r, \u03b8; \u03c4j, Rj) \u2208 H10 (\u2126), j = 1, 2, we have\n\u03be\u0303i :=\u03bei(r, \u03b8; \u03c41, R1)\u2212 \u03bei(r, \u03b8; \u03c42, R2)\n=\u03b6i(r, \u03b8; \u03c41, R1)\u2212 \u03b6i(r, \u03b8; \u03c42, R2) + (\u03c7i(r, \u03b8; \u03c41, R1)\u2212 \u03c7i(r, \u03b8; \u03c42, R2)) \u2208 H10 (\u2126).\nMeanwhile, from (2.10), we have\n\u2206\u03be\u0303i = \u2206\u03bei(r, \u03b8; \u03c41, R1)\u2212\u2206\u03bei(r, \u03b8; \u03c42, R2) = 0 in \u2126, \u03be\u0303i = 0 on \u2202\u2126.\nBy the Lax-Milgram Theorem, we have \u03be\u0303i = 0, and thus (2.11) holds.\nFrom now on we shall write \u03bei(r, \u03b8) instead of \u03bei(r, \u03b8; \u03c4, R), since it is independent of \u03c4 and R. We also notice that \u03bei(r, \u03b8) 6\u2261 0, because otherwise we have \u03c7i = \u2212\u03b6i \u2208 H10 (\u2126), which contradicts the fact that \u03c7i /\u2208 H10 (\u2126).\nRemark 2.5. An H\u22121(\u2126) solution of the boundary value problem (2.10) is a function \u03bei \u2208 H\u22121(\u2126) satisfying (2.10). However, different from the H1(\u2126) solution, the H\u22121(\u2126) solution to problem (2.10) is not unique. For example, there are at least two H\u22121(\u2126) solutions for (2.10), one is \u03bei = 0, which is also the unique H1(\u2126) solution, and the other one is \u03bei 6\u2261 0 as defined in (2.6).\nLemma 2.6. The functions \u03c3i \u2208 H10 (\u2126), i = 1, \u00b7 \u00b7 \u00b7 , N , in Definition 2.2 are uniquely defined and satisfy\n\u22062\u03c3i = 0 in \u2126, \u03c3i = 0, \u2206\u03c3i = 0 on \u2202\u2126. (2.12)\nProof. Note that \u03c3i is obtained through (2.9). By Lemma 2.4, \u03bei is uniquely defined, thus it follows the uniqueness \u03c3i. (2.12) is obtained by combining (2.9) and (2.10).\nFor both functions \u03bei and \u03c3i, we have the following result.\nTheorem 2.7. (a) The H\u22121(\u2126) functions \u03bei(= \u2206\u03c3i), i = 1, 2, \u00b7 \u00b7 \u00b7 , N , are linearly independent. (b) The functions \u03c3i,\u2207\u03c3i, i = 1, 2, \u00b7 \u00b7 \u00b7 , N , are also linearly independent, respectively.\nProof. (a) \u03bei(r, \u03b8) 6\u2261 0, because otherwise we have \u03c7i = \u2212\u03b6i \u2208 H10 (\u2126), which contradicts the fact that \u03c7i /\u2208 H10 (\u2126). We assume that\nN\u2211 i=1 Ci\u03bei = 0,\nwhere Ci, i = 1, 2, \u00b7 \u00b7 \u00b7 , N are some constants. Then we have N\u2211 i=1 Ci\u03c7i = \u2212 N\u2211 i=1 Ci\u03b6i \u2208 H10 (\u2126). Since \u03c7i 6\u2208 H10 (\u2126), i = 1, 2, \u00b7 \u00b7 \u00b7 , N , thus we must have N\u2211 i=1 Ci\u03c7i = 0. (2.13) Multiplying (2.13) by r\u2212 \u03c0 \u03c9 , we have CNr \u2212 \u03c0 \u03c9\u03c7N = \u2212 \u2211N\u22121 i=1 Cir \u2212 \u03c0 \u03c9\u03c7i \u2208 H\u22121(\u2126), which contradicts the fact that CNr \u2212 \u03c0 \u03c9\u03c7N 6\u2208 H\u22121(\u2126). Thus, it follows\nCN = 0.\nMultiplying (2.13) by r\u2212 i\u03c0 \u03c9 , i = 2, \u00b7 \u00b7 \u00b7 , N , the same argument gives\nCN+1\u2212i = 0.\nThus, \u03bei, i = 1, 2, \u00b7 \u00b7 \u00b7 , N , are linearly independent. (b) We assume that \u2211N i=1C \u2032 i\u03c3i = 0 for some constants C \u2032 i. Taking \u2212\u2206 on both sides of the equation, it follows N\u2211 i=1 C \u2032i\u03bei = 0. By (a), we have C \u2032i = 0, i = 1, \u00b7 \u00b7 \u00b7 , N , which implies \u03c3i, i = 1, 2, \u00b7 \u00b7 \u00b7 , N , are linearly independent. The linear independence of \u2207\u03c3i can be proved in a similar way.\nBy the linear independence of \u03c3i \u2208 H10 (\u2126), i = 1, \u00b7 \u00b7 \u00b7 , N , we can define a spaceM and itsM\u22a5.\nDefinition 2.8. Let\u2019s define the gradient orthogonal space of M \u2282 H10 (\u2126) by M\u22a5 = span{\u03c3i}, i = 1, \u00b7 \u00b7 \u00b7 , N satisfying M\u2295M\u22a5 = H10 (\u2126). Namely, for any functions vM \u2208 M and v\u22a5 \u2208 M\u22a5, it follows (\u2207vM,\u2207v\u22a5) = 0.\nTheorem 2.7 implies that dim(M\u22a5) = N . We further have the following result.\nLemma 2.9. For any function vM \u2208M, it follows\n\u3008vM, \u03bei\u3009 = 0, i = 1, \u00b7 \u00b7 \u00b7 , N. (2.14)\nProof. By the weak formulation of (2.9), we have\n\u3008vM, \u03bei\u3009 = (\u2207vM,\u2207\u03c3i). (2.15)\nNote that \u03c3i \u2208M\u22a5. By Definition 2.8, the conclusion holds.\nFor \u2200v \u2208 H10 (\u2126), we introduce the decomposition,\nv = vM + N\u2211 i=1 ci\u03c3i, (2.16)\nwhere vM \u2208M and the coefficients ci are determined by the linear system, N\u2211 i=1 ci\u3008\u03c3i, \u03bej\u3009 = \u3008v, \u03bej\u3009, j = 1, \u00b7 \u00b7 \u00b7 , N. (2.17) By the weak formulation of (2.9), we know that for \u2200\u03c6 \u2208 H10 (\u2126),\n(\u2207\u03c3j,\u2207\u03c6) = \u3008\u03bej, \u03c6\u3009, j = 1, \u00b7 \u00b7 \u00b7 , N. (2.18)\nSo the linear system (2.17) is equivalent to the following linear system\nN\u2211 i=1 ci(\u2207\u03c3i,\u2207\u03c3j) = (\u2207v,\u2207\u03c3j), j = 1, \u00b7 \u00b7 \u00b7 , N. (2.19)\nLemma 2.10. The linear system (2.17) or (2.19) admits a unique solution ci, i = 1, \u00b7 \u00b7 \u00b7 , N .\nProof. Since (2.17) and (2.19) are equivalent, so we only need to consider (2.19), which is a finite dimensional linear system, whose existence is equivalent to its uniqueness. Let c\u0304i be the difference of two possible solutions, it follows( N\u2211 i=1 c\u0304i\u2207\u03c3i,\u2207\u03c3j ) = N\u2211 i=1 c\u0304i(\u2207\u03c3i,\u2207\u03c3j) = 0, j = 1, \u00b7 \u00b7 \u00b7 , N.\nA linear combination in terms of \u2207\u03c3j gives( N\u2211 i=1 c\u0304i\u2207\u03c3i, N\u2211 j=1 c\u0304j\u2207\u03c3j ) = 0, which means \u2016 \u2211N\ni=1 c\u0304i\u2207\u03c3i\u2016 = 0, thus we have\nN\u2211 i=1 c\u0304i\u2207\u03c3i = 0.\nTheorem 2.7 indicates c\u0304i = 0, i = 1, \u00b7 \u00b7 \u00b7 , N . Thus, the conclusion holds.\nLemma 2.11. The mapping v \u2192 vM in (2.16) defines a contraction mapping H10 (\u2126) \u2192 M, namely,\n\u2016vM\u2016H1(\u2126) \u2264 \u2016v\u2016H1(\u2126).\nProof. Multiplying (2.16) by \u2212\u2206vM, integrating over the domain \u2126 and applying Green\u2019s Theorem lead to\n(\u2207v,\u2207vM) = (\u2207vM,\u2207vM) + ( N\u2211 i=1 ci\u2207\u03c3i,\u2207vM ) . (2.20)\nNote that\n(\u2207vM,\u2207\u03c3j) = ( \u2207 ( v \u2212\nN\u2211 i=1 ci\u03c3i\n) ,\u2207\u03c3j ) = (\u2207v,\u2207\u03c3j)\u2212\nN\u2211 i=1 ci (\u2207\u03c3i,\u2207\u03c3j) = 0, j = 1, \u00b7 \u00b7 \u00b7 , N,\nwhere we have used (2.19) in the last equality. Thus for the last term in (2.20) we have( N\u2211 i=1 ci\u2207\u03c3i,\u2207vM ) = 0.\nThen, applying Ho\u0308lder\u2019s inequality to (2.20), it follows\n\u2016\u2207vM\u20162 = (\u2207v,\u2207vM) \u2264 \u2016\u2207vM\u2016\u2016\u2207v\u2016,\nwhich gives the conclusion.\n2.4. The modified mixed formulation. Based on the discussion above, we propose a modified mixed formulation for (1.1),{ \u2212\u2206w = f in \u2126,\nw = 0 on \u2202\u2126;\n{ \u2212\u2206v = w in \u2126,\nv = 0 on \u2202\u2126;\n{ \u2212\u2206u\u0303 = v \u2212 \u2211N i=1 ci\u03c3i in \u2126,\nu\u0303 = 0 on \u2202\u2126, (2.21)\nwhere \u03c3i are given in (2.9) and ci are given by (2.19).\nThe modified mixed weak formulation for (2.21) is to find w, v, u\u0303 \u2208 H10 (\u2126) such that\nA(w, \u03c6) =(f, \u03c6), (2.22a)\nA(v, \u03c6) =(w,\u03c8), (2.22b)\nA(u\u0303, \u03c4) = ( v \u2212\nN\u2211 i=1 ci\u03c3i, \u03c4\n) , (2.22c)\nfor any \u03c6, \u03c8, \u03c4 \u2208 H10 (\u2126).\nLemma 2.12. (i) Assume that 0 \u2264 s \u2264 1. Then for \u03c6 \u2208 Hs0(\u2126) \u2282 H10 (\u2126) it follows that r\u2212s\u03c6 \u2208 L2(\u2126) and\n\u2016r\u2212s\u03c6\u2016 \u2264 C\u2016\u03c6\u2016Hs(\u2126) \u2264 C\u2016\u03c6\u2016H1(\u2126). (2.23)\n(ii) If \u03b3 \u2208 [0, 1), s\u2032 \u2264 1 + \u03b3, and \u03c6 \u2208 Hs \u2032\u2212\u03b3 0 (\u2126) \u2282 H10 (\u2126), then we have r\u2212s \u2032 \u03c6 \u2208 H\u2212\u03b3(\u2126) and\n\u2016r\u2212s\u2032\u03c6\u2016H\u2212\u03b3(\u2126) \u2264 C\u2016r\u2212s \u2032+\u03b3\u03c6\u2016. (2.24)\nProof. (i) The estimate (2.23) follows from [10, Theorem 1.2.15].\n(ii) Since s\u2032 \u2212 \u03b3 \u2264 1, then we have r\u2212s\u2032+\u03b3\u03c6 \u2208 L2(\u2126) by (i) and the estimate \u2016r\u2212s\u2032+\u03b3\u03c6\u2016 \u2264 C\u2016\u03c6\u2016Hs\u2032\u2212\u03b3(\u2126). For (2.24), we have\n\u2016r\u2212s\u2032\u03c6\u2016H\u2212\u03b3(\u2126) := sup \u03c8\u2208H\u03b30 (\u2126) \u3008r\u2212s\u2032\u03c6, \u03c8\u3009 \u2016\u03c8\u2016H\u03b3(\u2126) = sup \u03c8\u2208H\u03b30 (\u2126) \u3008r\u2212s\u2032+\u03b3\u03c6, r\u2212\u03b3\u03c8\u3009 \u2016\u03c8\u2016H\u03b3(\u2126)\n\u2264 sup \u03c8\u2208H\u03b30 (\u2126) \u2016r\u2212s\u2032+\u03b3\u03c6\u2016\u2016r\u2212\u03b3\u03c8\u2016 \u2016\u03c8\u2016H\u03b3(\u2126) \u2264 C\u2016r\u2212s\u2032+\u03b3\u03c6\u2016,\nwhere (2.23) is used.\nNext, we introduce some regularity results for the Poisson problem{ \u2212\u2206z = g in \u2126,\nz = 0 on \u2202\u2126. (2.25)\nLemma 2.13. For g \u2208 Hmin{\u03b1\u22121,s}(\u2126) for any s \u2208 (\u22121, 0] and \u03b1 \u2208 (1 2 , \u03c0 \u03c9 ), then (2.25) admits a unique solution z \u2208 Hmin{\u03b1+1,s+2}(\u2126) and holds the estimates\n\u2016z\u2016Hmin{\u03b1+1,s+2}(\u2126) \u2264 C\u2016g\u2016Hmin{\u03b1\u22121,s}(\u2126). (2.26)\nProof. The proof follows from [19, Theorem 3.1].\nLemma 2.14. For \u03b2i = 1\u2212 i\u03c0\u03c9 > \u22121, i = 1, \u00b7 \u00b7 \u00b7 , N , and \u03b1 \u2208 ( 1 2 , \u03c0 \u03c9 ) with \u03c9 \u2208 (\u03c0 2 , 2\u03c0), if \u03c6 \u2208 H10 (\u2126) and g = r2 min{\u03b1\u22121,\u03b2i}\u03c6, then (2.25) admits a unique solution z \u2208 Hmin{2+\u03b2i,1+\u03b1}(\u2126) and holds the estimates\n\u2016z\u2016Hmin{2+\u03b2i,1+\u03b1}(\u2126) \u2264 C\u2016rmin{\u03b1\u22121,\u03b2i}\u03c6\u2016. (2.27)\nProof. If \u03c9 \u2208 (\u03c0 2 , \u03c0), we have \u03b2N = \u03b21 < 1 \u2212 \u03c0\u03c9 < 0, and \u03b1 \u2212 1 > 0. Then for this case it follows min{\u03b1 \u2212 1, \u03b2i} = \u03b2i < 0. If \u03c9 \u2208 (\u03c0, 2\u03c0), we have \u03b1 \u2208 (12 , \u03c0 \u03c9 ) \u2282 (1 2 , 1), so that min{\u03b1 \u2212 1, \u03b2i} \u2264 \u03b1\u2212 1 < 0. By Lemma 2.12, we have rmin{\u03b1\u22121,\u03b2i}\u03c6 \u2208 L2(\u2126) and\n\u2016rmin{\u03b1\u22121,\u03b2i}\u03c6\u2016 \u2264 C\u2016\u03c6\u2016H\u2212min{\u03b1\u22121,\u03b2i}(\u2126) \u2264 C\u2016\u03c6\u2016H1(\u2126). (2.28)\nAgain by Lemma 2.12, it follows g \u2208 Hmin{\u03b1\u22121,\u03b2i}(\u2126) and\n\u2016g\u2016Hmin{\u03b1\u22121,\u03b2i}(\u2126) = \u2016r2 min{\u03b1\u22121,\u03b2i}\u03c6\u2016Hmin{\u03b1\u22121,\u03b2i}(\u2126) \u2264 C\u2016rmin{\u03b1\u22121,\u03b2i}\u03c6\u2016. (2.29)\nBy Lemma 2.13, the Poisson problem (2.25) admits a unique solution z \u2208 Hmin{2+\u03b2i,1+\u03b1}(\u2126) and\n\u2016z\u2016Hmin{2+\u03b2i,1+\u03b1}(\u2126) \u2264 C\u2016g\u2016Hmin{\u03b1\u22121,\u03b2i}(\u2126). (2.30)\nThus, (2.29) and (2.30) give the estimate (2.27).\nMore generally, we have the following result for (2.25).\nLemma 2.15. Let \u03c9 \u03c0 (s+ 1) \u2208 (m,m+ 1), where m is a positive integer and g \u2208 Hs(\u2126) for s \u2265 0. Then the solution z of the Poisson problem (2.25) from the space H1+\u03b1(\u2126) \u2229H10 (\u2126) possesses the asymptotic representation\nz(x) = z\u0303(x) + \u03b7(r) m\u2211 j=1 (j\u03c0)\u2212 1 2djr j\u03c0 \u03c9 sin ( j\u03c0\u03b8 \u03c9 ) , (2.31)\nwhere z\u0303(x) \u2208 Hs+2(\u2126) \u2229H10 (\u2126) and the coefficients dj are defined by\ndj = \u3008g, \u03bej\u3009, j = 1, \u00b7 \u00b7 \u00b7 ,m.\nMoreover, it follows that\n\u2016z\u0303\u2016Hs+2 + m\u2211 j=1 |dj| \u2264 C\u2016g\u2016Hs(\u2126). (2.32)\nProof. The proof can be found in Theorem 3.4 in [19] and Section 2.7 in [10].\nFor the modified mixed formulation (2.22), we have the following result.\nTheorem 2.16. Let u\u0303 be the solution of the modified mixed weak formulation (2.22), then it satisfies the weak formulation (2.2), namely, u = u\u0303 in V .\nProof. Note that v, \u03c3i \u2208 H10 (\u2126), thus v \u2212 \u2211N\ni=1 ci\u03c3i \u2208 H10 (\u2126). Therefore, applying Lemma 2.15 to the last Poisson equation in (2.21), it follows that dj = \u3008v \u2212 \u2211N i=1 ci\u03c3i, \u03bej\u3009 = 0, j = 1, \u00b7 \u00b7 \u00b7 , N by\n(2.17) and u\u0303 \u2208 H3(\u2126) \u2229H10 (\u2126). Since \u2206u\u0303|\u2202\u2126 = \u2212(v \u2212 \u2211N\ni=1 ci\u03c3i)|\u2202\u2126 = 0, so it follows u\u0303 \u2208 V . On the other hand,\n\u2212\u22063u\u0303 = \u22062v \u2212 N\u2211 i=1 ci\u2206 2\u03c3i = \u2212\u2206(\u2212\u2206v) = \u2212\u2206w = f,\nwhere we have used the result (2.12). Thus, we have u\u0303 \u2208 V satisfies (2.2). Thus, by the uniqueness of the solution of (2.2) in V , the conclusion holds.\nTherefore, by Theorem 2.16, the solution u of the sixth order problem (1.1) satisfies{ \u2212\u2206w = f in \u2126,\nw = 0 on \u2202\u2126;\n{ \u2212\u2206v = w in \u2126,\nv = 0 on \u2202\u2126;\n{ \u2212\u2206u = v \u2212 \u2211N i=1 ci\u03c3i in \u2126,\nu = 0 on \u2202\u2126, (2.33)\nThe corresponding weak formulation is to find w, v, u \u2208 H10 (\u2126) such that for any \u03c6, \u03c8, \u03c4 \u2208 H10 (\u2126),\nA(w, \u03c6) =(f, \u03c6), (2.34a)\nA(v, \u03c8) =(w,\u03c8), (2.34b)\nA(u, \u03c4) = ( v \u2212\nN\u2211 i=1 ci\u03c3i, \u03c4\n) , (2.34c)\nwhere ci, i = 1, \u00b7 \u00b7 \u00b7 , N , are given in (2.19).\nRemark 2.17. For the following cases, the modified mixed formulation (2.33) is identical to the direct mixed formulation (2.4): (i) N = 0, which happens if \u03c9 < \u03c0 2 as shown in Table 1; (ii) ci = 0, i = 1, \u00b7 \u00b7 \u00b7 , N in (2.17) or (2.19), which is possible for some special function f such that the solution v \u2208M in (2.33) or (2.34).\nIn addition, we have the following regularity result.\nTheorem 2.18. Given f \u2208 H\u22121(\u2126), for w, u in (2.33), it follows\n\u2016w\u2016H1(\u2126) \u2264C\u2016f\u2016H\u22121(\u2126), (2.35a)\n\u2016v\u2016H1(\u2126) \u2264C\u2016f\u2016H\u22121(\u2126), (2.35b) \u2016u\u2016H3(\u2126) \u2264C\u2016f\u2016H\u22121(\u2126). (2.35c)\nProof. The estimate (2.35a) is a direct consequence of the fact that the Laplace operator is an isomorphism between H10 (\u2126) and H \u22121(\u2126). In a similar fashion,\n\u2016v\u2016H1(\u2126) \u2264 \u2016w\u2016H\u22121(\u2126) \u2264 C\u2016w\u2016H1(\u2126) \u2264 C\u2016f\u2016H\u22121(\u2126),\nwhich gives the estimate (2.35b). By Theorem 2.16, it follows u \u2208 V . Moreover, (2.32) gives\n\u2016u\u2016H3 \u2264 C \u2225\u2225\u2225\u2225\u2225v \u2212 N\u2211 i=1 ci\u03c3i \u2225\u2225\u2225\u2225\u2225 H1(\u2126) = C\u2016vM\u2016H1(\u2126) \u2264 C\u2016v\u2016H1(\u2126) \u2264 C\u2016f\u2016H\u22121(\u2126), (2.36)\nwhere we have used Lemma 2.11 in the last inequality.\nNote that {\u2207\u03c3i}Ni=1 is not orthogonal if \u03c9 > \u03c0. For analysis convenience, we apply Schmidt orthogonalization to obtain an orthogonal basis {\u2207\u03c3\u0303i}Ni=1, namely, we take\n\u03c3\u03031 =\u03c31, \u03c3\u03032 =\u03c32 \u2212 (\u2207\u03c32,\u2207\u03c3\u03031) \u2016\u2207\u03c3\u03031\u20162 \u03c3\u03031, \u03c3\u03033 =\u03c33 \u2212 (\u2207\u03c33,\u2207\u03c3\u03031) \u2016\u2207\u03c3\u03031\u20162 \u03c3\u03031 \u2212 (\u2207\u03c33,\u2207\u03c3\u03032) \u2016\u2207\u03c3\u03032\u20162 \u03c3\u03032.\n(2.37)\nFurthermore, we denote {\u03be\u0303i}Ni=1 by\n\u03be\u03031 =\u03be1, \u03be\u03032 =\u03be2 \u2212 (\u2207\u03c32,\u2207\u03c3\u03031) \u2016\u2207\u03c3\u03031\u20162 \u03be\u03031, \u03be\u03033 =\u03be3 \u2212 (\u2207\u03c33,\u2207\u03c3\u03031) \u2016\u2207\u03c3\u03031\u20162 \u03be\u03031 \u2212 (\u2207\u03c33,\u2207\u03c3\u03032) \u2016\u2207\u03c3\u03032\u20162 \u03be\u03032.\n(2.38)\nThen it follows that\n\u2212\u2206\u03c3\u0303i = \u03be\u0303i in \u2126, \u03c3\u0303i = 0 on \u2202\u2126, (2.39)\nand its weak formulation is to find \u03c3\u0303i \u2208 H10 (\u2126) such that \u2200\u03c6 \u2208 H10 (\u2126),\nA(\u03c3\u0303i, \u03c6) = \u3008\u03be\u0303i, \u03c6\u3009. (2.40)\nWith the new basis {\u03c3i}Ni=1, the third Poisson problem in (2.33) can be equivalently written as{ \u2212\u2206u = v \u2212 \u2211N i=1 c\u0303i\u03c3\u0303i i, n \u2126,\nu = 0 on \u2202\u2126, (2.41)\nwhere the coefficients\nc\u0303i = \u3008v, \u03be\u0303i\u3009 \u3008\u03c3\u0303i, \u03be\u0303i\u3009 , i = 1, \u00b7 \u00b7 \u00b7 , N, (2.42)\nor equivalently,\nc\u0303i = (\u2207v,\u2207\u03c3\u0303i) \u2016\u2207\u03c3\u0303i\u20162 , i = 1, \u00b7 \u00b7 \u00b7 , N. (2.43)\nCorrespondingly, the weak formulation (2.34c) becomes\nA(u, \u03c4) = ( v \u2212\nN\u2211 i=1 c\u0303i\u03c3\u0303i, \u03c4\n) . (2.44)\n3. The finite element method\nIn this section, we propose a linear C0 finite element method for solving the biharmonic problem (1.1). Then we derive the finite element error analysis for the solution u to show that our method shall achieve the optimal convergence rate.\n3.1. The finite element algorithm. Let Tn be a triangulation of \u2126 with shape-regular triangles and let Sn \u2282 H10 (\u2126) be the C0 Lagrange linear finite element space associated with Tn. Then we proceed to propose the finite element algorithm.\nAlgorithm 3.1. We define the finite element solution of the biharmonic problem (1.1) by utilizing the decoupling in (2.34) as follows.\n\u2022 Step 1. Find the finite element solution wn \u2208 Sn of the Poisson equation\nA(wn, \u03c6) = (f, \u03c6), \u2200\u03c6 \u2208 Sn. (3.1)\n\u2022 Step 2. Find the finite element solution vn \u2208 Sn of the Poisson equation\nA(vn, \u03c8) = (wn, \u03c8), \u2200\u03c8 \u2208 Sn. (3.2)\n\u2022 Step 3. With \u03c7i, i = 1, \u00b7 \u00b7 \u00b7 , N defined in (2.7), we compute the finite element solution \u03b6i,n \u2208 Sn of the Poisson equation\nA(\u03b6i,n, \u03c6) = (\u2206\u03c7i, \u03c6), \u2200\u03c6 \u2208 Sn, (3.3)\nand set \u03bei,n = \u03b6i,n + \u03c7i.\n\u2022 Step 4. Find the finite element solution \u03c3i,n \u2208 Sn, i = 1, \u00b7 \u00b7 \u00b7 , N of the Poisson equation\nA(\u03c3i,n, \u03c6) = (\u03bei,n, \u03c6), \u2200\u03c6 \u2208 Sn. (3.4)\n\u2022 Step 5. Find the coefficient ci,n \u2208 R by solving the linear system N\u2211 i=1 ci,n\u3008\u03c3i,n, \u03bej,n\u3009 = \u3008vn, \u03bej,n\u3009, j = 1, \u00b7 \u00b7 \u00b7 , N. (3.5) \u2022 Step 6. Find the finite element solution un \u2208 Sn of the Poisson equation\nA(un, \u03c4) = ( vn \u2212\nN\u2211 i=1 ci,n\u03c3i,n, \u03c4\n) , \u2200\u03c4 \u2208 Sn. (3.6)\nRemark 3.2. According to (3.3), \u03b6i,n \u2208 Sn, while \u03bei,n \u2208 H\u22121(\u2126) but \u03bei,n 6\u2208 Sn. In practice, \u03bei,n can be approximated by using high-order quadrature rules. In addition, the finite element approximations in Algorithm 3.1 are well defined based on the Lax-Milgram Theorem.\nTheorem 3.3. (a) The H\u22121(\u2126) functions \u03bei,n, i = 1, 2, \u00b7 \u00b7 \u00b7 , N , are linearly independent. (b) The functions \u03c3i,n,\u2207\u03c3i,n, i = 1, 2, \u00b7 \u00b7 \u00b7 , N , are also linearly independent, respectively.\nProof. (a) The proof is similar to the proof of Theorem 2.7(a). (b) We assume that \u2211N\ni=1C \u2032 i\u03c3i,n = 0 for some constants C \u2032 i. The combination of (3.4) gives(\nN\u2211 i=1 C \u2032i\u03bei,n, \u03c6\n) = A ( N\u2211 i=1 C \u2032i\u03c3i,n, \u03c6 ) = 0.\nBy (a), we have C \u2032i = 0, i = 1, \u00b7 \u00b7 \u00b7 , N , which implies \u03c3i,n, i = 1, 2, \u00b7 \u00b7 \u00b7 , N , are linearly independent. The linear independence of \u2207\u03c3i,n can be proved similarly.\nAgain, we apply the Schmidt orthogonalization to obtain an orthogonal basis {\u2207\u03c3\u0303i,n}Ni=1,\n\u03c3\u03031,n =\u03c31,n, \u03c3\u03032,n =\u03c32,n \u2212 (\u2207\u03c32,n,\u2207\u03c3\u03031,n) \u2016\u2207\u03c3\u03031,n\u20162 \u03c3\u03031,n, \u03c3\u03033,n =\u03c33,n \u2212 (\u2207\u03c33,n,\u2207\u03c3\u03031,n) \u2016\u2207\u03c3\u03031,n\u20162 \u03c3\u03031,n \u2212 (\u2207\u03c33,n,\u2207\u03c3\u03032,n) \u2016\u2207\u03c3\u03032,n\u20162 \u03c3\u03032,n.\n(3.7)\nSimilarly, we take {\u03be\u0303i}Ni=1,\n\u03be\u03031,n =\u03be1,n, \u03be\u03032,n =\u03be2,n \u2212 (\u2207\u03c32,n,\u2207\u03c3\u03031,n) \u2016\u2207\u03c3\u03031,n\u20162 \u03be\u03031,n, \u03be\u03033,n =\u03be3,n \u2212 (\u2207\u03c33,n,\u2207\u03c3\u03031,n) \u2016\u2207\u03c3\u03031,n\u20162 \u03be\u03031,n \u2212 (\u2207\u03c33,n,\u2207\u03c3\u03032,n) \u2016\u2207\u03c3\u03032,n\u20162 \u03be\u03032,n.\n(3.8)\nWith the new basis, we have A(\u03c3\u0303i,n, \u03c6) = \u3008\u03be\u0303i,n, \u03c6\u3009. (3.9) With the orthogonal basis {\u2207\u03c3i,n}Ni=1, the last two steps in Algorithm 3.1 can be modified as\n\u2022 Step 5\u2019. Find the coefficient c\u0303i,n \u2208 R,\nc\u0303i,n = \u3008vn, \u03be\u0303i,n\u3009 \u3008\u03c3\u0303i,n, \u03be\u0303i,n\u3009 , i = 1, \u00b7 \u00b7 \u00b7 , N. (3.10)\n\u2022 Step 6\u2019. Find the finite element solution un \u2208 Sn of the Poisson equation\nA(un, \u03c4) = ( vn \u2212\nN\u2211 i=1 c\u0303i,n\u03c3\u0303i,n, \u03c4\n) , \u2200\u03c4 \u2208 Sn. (3.11)\n3.2. Optimal error estimates on quasi-uniform meshes. Suppose that the mesh Tn consists of quasi-uniform triangles with size h. Recall the interpolation error estimates [6] on Tn for any z \u2208 Hs(\u2126), s > 1, \u2016z \u2212 zI\u2016Hm(\u2126) \u2264 Chs\u2212m\u2016z\u2016Hl(\u2126), (3.12) where m = 0, 1 and zI \u2208 Sn represents the nodal interpolation of z. Let zn \u2208 Sn be the finite element solution of the Poisson equation (2.25) in the polygonal domain, if z \u2208 Hs(\u2126), s > 1, the standard error estimate [6, 16] yields\n\u2016z \u2212 zn\u2016H1(\u2126) \u2264 Chmin{s,1}\u2016z\u2016H1+min{s,1}(\u2126), \u2016z \u2212 zn\u2016 \u2264 Ch2 min{s,1}\u2016z\u2016H1+min{l,1}(\u2126). (3.13)\nGiven g \u2208 L2(\u2126) in (2.25), it is well known that the solution z \u2208 H1+\u03b1(\u2126) with \u03b1 < \u03c0 \u03c9 (see e.g., [9, 10, 16]). Note that f,\u2206\u03c7i \u2208 L2(\u2126) in Poisson equations (2.8) and (2.33), so it follows w, \u03b6i \u2208 H1+\u03b1(\u2126). Note that \u03bei \u2208 H\u22121(\u2126), but Step 3 in Algorithm 3.1 indicates \u03bei\u2212 \u03bei,n = \u03b6i\u2212 \u03b6i,n. Therefore, we have the following error estimates.\nLemma 3.4. Given wn and \u03bei,n in Algorithm 3.1, it follows\n\u2016w \u2212 wn\u2016H1(\u2126) \u2264 Chmin{\u03b1,1}\u2016w\u2016H1+min{\u03b1,1}(\u2126), (3.14a) \u2016w \u2212 wn\u2016 \u2264 Ch2 min{\u03b1,1}\u2016w\u2016H1+min{\u03b1,1}(\u2126), (3.14b) \u2016\u03bei \u2212 \u03bei,n\u2016H1(\u2126) \u2264 Chmin{\u03b1,1}\u2016\u03b6i\u2016H1+min{\u03b1,1}(\u2126), (3.14c) \u2016\u03bei \u2212 \u03bei,n\u2016H\u22121(\u2126) \u2264 C\u2016\u03bei \u2212 \u03bei,n\u2016 \u2264 Ch2 min{\u03b1,1}\u2016\u03b6i\u2016H1+min{\u03b1,1}(\u2126). (3.14d)\nBy (2.6) in Definition 2.2, we have \u03bei \u2208 H\u03b2i \u2282 H\u22121(\u2126), where \u22121 < \u03b2i < 1\u2212 i\u03c0\u03c9 with i = 1, \u00b7 \u00b7 \u00b7 , N satisfying \u03b21 > \u00b7 \u00b7 \u00b7 > \u03b2N , thus from (2.9) we have \u03c3i \u2208 Hmin{2+\u03b2i,1+\u03b1}, which is further explained in Table 2.\nLemma 3.5. For \u03c3i,n in Algorithm 3.1, we have for 1 \u2264 i \u2264 N ,\n\u2016\u03c3i \u2212 \u03c3i,n\u2016H1(\u2126) \u2264 Chmin{1+\u03b2i,\u03b1}, (3.15a) \u2016\u03c3i \u2212 \u03c3i,n\u2016 \u2264 Chmin{1+\u03b2i+min{\u03b1,1},2\u03b1}, (3.15b) \u2016rmin{\u03b1\u22121,\u03b2i}(\u03c3j \u2212 \u03c3j,n)\u2016 \u2264 Chmin{1+\u03b2i,\u03b1}+min{1+\u03b2j ,\u03b1}, (3.15c)\nwhere 1 \u2264 j \u2264 N .\nProof. The difference of weak formulation of (2.9) and (3.4) gives\nA(\u03c3i \u2212 \u03c3i,n, \u03c6) = (\u03bei \u2212 \u03bei,n, \u03c6). (3.16)\nLet \u03c3iI \u2208 Sn be the nodal interpolation of \u03c3i. Set i = \u03c3iI \u2212 \u03c3i, ei = \u03c3iI \u2212 \u03c3i,n and take \u03c6 = e in the equation above, we have\nA(ei, ei) = A( i, ei) + (\u03bei \u2212 \u03bei,n, ei),\nwhich implies\n\u2016ei\u2016H1(\u2126) \u2264 \u2016 i\u2016H1(\u2126) + \u2016\u03bei \u2212 \u03bei,n\u2016H\u22121(\u2126),\nUsing the triangle inequality, it follows \u2016\u03c3i \u2212 \u03c3i,n\u2016H1(\u2126) \u2264\u2016ei\u2016H1(\u2126) + \u2016 i\u2016H1(\u2126) \u2264 C ( \u2016 i\u2016H1(\u2126) + \u2016\u03bei \u2212 \u03bei,n\u2016H\u22121(\u2126) ) \u2264 Chmin{1+\u03b2i,\u03b1},\nwhere we have used the projection error (3.12) and (3.14d).\nTo obtain the error in L2 norm, we consider the Poisson problem (2.25). By the Aubin-Nitsche\nLemma in [6, Theorem 3.2.4], we have\n\u2016\u03c3i \u2212 \u03c3i,n\u2016 \u2264 C\u2016\u03c3i \u2212 \u03c3i,n\u2016H1(\u2126) sup g\u2208L2(\u2126)\n( inf\u03c8\u2208Sn \u2016z \u2212 \u03c8\u2016H1(\u2126)\n\u2016g\u2016\n) . (3.17)\nBy the regularity (2.26a), we have\ninf \u03c8\u2208Sn \u2016z \u2212 \u03c8\u2016H1(\u2126) \u2264 \u2016z \u2212 zI\u2016H1(\u2126) \u2264 Chmin{\u03b1,1}\u2016z\u2016H1+min{\u03b1,1}(\u2126) \u2264 Chmin{\u03b1,1}\u2016g\u2016. (3.18)\nPlugging (3.18) and (3.15a) into (3.17) gives the estimate (3.15b).\nWe take g = r2 min{\u03b1\u22121,\u03b2i}(\u03c3j \u2212 \u03c3j,n), i = 1, \u00b7 \u00b7 \u00b7 , N in (2.25), since \u03c3j \u2212 \u03c3j,n \u2208 H10 (\u2126), so Lemma 2.14 indicates that z \u2208 Hmin{2+\u03b2i,1+\u03b1}(\u2126). By (3.12), we have the interpolation error\n\u2016z \u2212 zI\u2016H1(\u2126) \u2264 Chmin{1+\u03b2i,\u03b1}\u2016z\u2016Hmin{2+\u03b2i,1+\u03b1}(\u2126). (3.19)\nThe weak formulation of (2.25) is find to z \u2208 H10 (\u2126) such that\n\u3008r2 min{\u03b1\u22121,\u03b2i}(\u03c3j \u2212 \u03c3j,n), \u03c8\u3009 = A(z, \u03c8), \u2200\u03c8 \u2208 H10 (\u2126).\nSet \u03c8 = \u03c3j \u2212 \u03c3j,n and subtract (3.16) with \u03c6 = zI from the equation above, it follows\n\u2016rmin{\u03b1\u22121,\u03b2i}(\u03c3j \u2212 \u03c3j,n)\u20162 =A(\u03c3j \u2212 \u03c3j,n, z \u2212 zI) + (\u03bej \u2212 \u03bej,n, zI)\n=A(\u03c3j \u2212 \u03c3j,n, z \u2212 zI) + (\u03bej \u2212 \u03bej,n, zI \u2212 z) + (\u03bej \u2212 \u03bej,n, z) \u2264\u2016\u03c3j \u2212 \u03c3j,n\u2016H1(\u2126)\u2016z \u2212 zI\u2016H1(\u2126) + \u2016\u03bej \u2212 \u03bej,n\u2016H\u22121(\u2126)(\u2016zI \u2212 z\u2016H1(\u2126) + \u2016z\u2016H1(\u2126)).\nApplying the estimates in (3.14d), (3.15a) and (3.19), we have\n\u2016rmin{\u03b1\u22121,\u03b2i}(\u03c3j \u2212 \u03c3j,n)\u20162 \u2264Chmin{1+\u03b2i,\u03b1}+min{1+\u03b2j ,\u03b1}\u2016z\u2016Hmin{2+\u03b2i,1+\u03b1}(\u2126) \u2264Chmin{1+\u03b2i,\u03b1}+min{1+\u03b2j ,\u03b1}\u2016rmin{\u03b1\u22121,\u03b2i}(\u03c3j \u2212 \u03c3j,n)\u2016,\nwhich gives the error estimate (3.15c).\nLemma 3.4 and Lemma 3.5 imply that \u2016\u03bei,n\u2016H\u22121(\u2126), \u2016\u03c3i,n\u2016 and \u2016\u2207\u03c3i,n\u2016, i = 1, \u00b7 \u00b7 \u00b7 , N are uniformly bounded when h \u2264 h0 for some constant h0.\nLemma 3.6. For the basis \u03c3\u0303i and the corresponding finite element solution \u03c3\u0303i,n, we have\n\u2016\u03c3\u0303i \u2212 \u03c3\u0303i,n\u2016H1(\u2126) \u2264 Chmin{1+\u03b2i,\u03b1}, i = 1, \u00b7 \u00b7 \u00b7 , N. (3.20)\nProof. By Lemma 3.5, it is obvious that\n\u2016\u03c3\u03031 \u2212 \u03c3\u03031,n\u2016H1(\u2126) = \u2016\u03c31 \u2212 \u03c31,n\u2016H1(\u2126) \u2264 Chmin{1+\u03b21,\u03b1}.\nWe assume that the conclusion holds for i \u2264 j \u2212 1,\n\u2016\u03c3\u0303i \u2212 \u03c3\u0303i,n\u2016H1(\u2126) \u2264 Chmin{1+\u03b2i,\u03b1}. (3.21)\nA quick calculation gives that\n\u2207\u03c3\u0303j \u2212\u2207\u03c3\u0303j,n =\u2207\u03c3j \u2212\u2207\u03c3j,n \u2212 j\u22121\u2211 i=1 ( (\u2207\u03c3j,\u2207\u03c3\u0303i) \u2016\u2207\u03c3\u0303i\u20162 \u2207\u03c3\u0303i \u2212 (\u2207\u03c3j,n,\u2207\u03c3\u0303i,n) \u2016\u2207\u03c3\u0303i,n\u20162 \u2207\u03c3\u0303i,n )\n= (\u2207\u03c3j \u2212\u2207\u03c3j,n)\u2212 j\u22121\u2211 i=1 ((\u2207\u03c3j,\u2207\u03c3\u0303i)\u2016\u2207\u03c3\u0303i,n\u20162\u2207\u03c3\u0303i \u2212 (\u2207\u03c3j,n,\u2207\u03c3\u0303i,n)\u2016\u2207\u03c3\u0303i\u20162\u2207\u03c3\u0303i,n) \u2016\u2207\u03c3\u0303i\u20162\u2016\u2207\u03c3\u0303i,n\u20162 .\nWe then have\n\u2016\u2207\u03c3\u0303j \u2212\u2207\u03c3\u0303j,n\u2016 \u2264 \u2016\u2207\u03c3j \u2212\u2207\u03c3j,n\u2016+ j\u22121\u2211 i=1 \u2016(\u2207\u03c3j,\u2207\u03c3\u0303i)\u2016\u2207\u03c3\u0303i,n\u20162\u2207\u03c3\u0303i \u2212 (\u2207\u03c3j,n,\u2207\u03c3\u0303i,n)\u2016\u2207\u03c3\u0303i\u20162\u2207\u03c3\u0303i,n\u2016 \u2016\u2207\u03c3\u0303i\u20162\u2016\u2207\u03c3\u0303i,n\u20162 .\nWe know that \u2207\u03c3\u0303i obtained through (2.37) also depend only on \u2126. Therefore, we have\n0 < \u03b31 \u2264 \u2016\u2207\u03c3\u0303i\u2016 \u2264 \u03b32, i = 1, \u00b7 \u00b7 \u00b7 , N, (3.22) where \u03b31 = min1\u2264i\u2264N{\u2016\u2207\u03c3\u0303i\u2016}, and \u03b32 = max1\u2264i\u2264N{\u2016\u2207\u03c3\u0303i\u2016}. Let h \u2264 h0 \u2264 min { 1, ( \u03b31 2C ) 1 min{1+\u03b2i,\u03b1} } , i = 1, \u00b7 \u00b7 \u00b7 , j \u2212 1 in (3.20), it follows that 1\n2 \u03b31 \u2264 \u2016\u2207\u03c3\u0303i,n\u2016 \u2264 \u03b32 \u2212\n1 2 \u03b31, i = 1, \u00b7 \u00b7 \u00b7 , j \u2212 1. (3.23)\n(3.22) and (3.23) implies 1\n\u2016\u2207\u03c3\u0303i\u20162\u2016\u2207\u03c3\u0303i,n\u20162 \u2264 C, (3.24)\nwhere C is a constant. By Lemma 3.5, it follows\n\u2016\u2207\u03c3j \u2212\u2207\u03c3j,n\u2016 = \u2016\u03c3j \u2212 \u03c3j,n\u2016H1(\u2126) \u2264 Chmin{1+\u03b2j ,\u03b1}. (3.25)\nTo this end, we will get an error estimate for \u2016(\u2207\u03c3j,\u2207\u03c3\u0303i)\u2016\u2207\u03c3\u0303i,n\u20162\u2207\u03c3\u0303i \u2212 (\u2207\u03c3j,n,\u2207\u03c3\u0303i,n)\u2016\u2207\u03c3\u0303i\u20162\u2207\u03c3\u0303i,n\u2016. Note that\n(\u2207\u03c3j,\u2207\u03c3\u0303i)\u2016\u2207\u03c3\u0303i,n\u20162\u2207\u03c3\u0303i \u2212 (\u2207\u03c3j,n,\u2207\u03c3\u0303i,n)\u2016\u2207\u03c3\u0303i\u20162\u2207\u03c3\u0303i,n = (\u2207\u03c3j \u2212\u2207\u03c3j,n,\u2207\u03c3\u0303i)\u2016\u2207\u03c3\u0303i,n\u20162\u2207\u03c3\u0303i + (\u2207\u03c3j,n,\u2207\u03c3\u0303i \u2212\u2207\u03c3\u0303i,n)\u2016\u2207\u03c3\u0303i,n\u20162\u2207\u03c3\u0303i + (\u2207\u03c3j,n,\u2207\u03c3\u0303i,n)(\u2016\u2207\u03c3\u0303i,n\u20162 \u2212 \u2016\u2207\u03c3\u0303i\u20162)\u2207\u03c3\u0303i + (\u2207\u03c3j,n,\u2207\u03c3\u0303i,n)\u2016\u2207\u03c3\u0303i\u20162(\u2207\u03c3\u0303i \u2212\u2207\u03c3\u0303i,n)\n:= T1 + T2 + T3 + T4.\nBy Lemma 3.5 again, we have\n\u2016T1\u2016 \u2264 \u2016\u2207\u03c3\u0303i,n\u20162\u2016\u2207\u03c3\u0303i\u20162\u2016\u2207\u03c3j \u2212\u2207\u03c3j,n\u2016 \u2264 Chmin{1+\u03b2j ,\u03b1}.\nBy assumption (3.21), we have\n\u2016T2\u2016 \u2264 \u2016\u2207\u03c3j,n\u2016\u2016\u2207\u03c3\u0303i,n\u20162\u2016\u2207\u03c3\u0303i\u2016\u2016\u2207\u03c3\u0303i \u2212\u2207\u03c3\u0303i,n\u2016 \u2264 Chmin{1+\u03b2i,\u03b1}.\n\u2016T3\u2016 \u2264 \u2016\u2207\u03c3j,n\u2016\u2016\u2207\u03c3\u0303i,n\u2016\u2016\u2207\u03c3\u0303i\u2016 (\u2016\u2207\u03c3\u0303i\u2016+ \u2016\u2207\u03c3\u0303i,n\u2016) |\u2016\u2207\u03c3\u0303i\u2016 \u2212 \u2016\u2207\u03c3\u0303i,n\u2016| \u2264 Chmin{1+\u03b2i,\u03b1}, where we used the inequality |\u2016\u2207\u03c3\u0303i\u2016 \u2212 \u2016\u2207\u03c3\u0303i,n\u2016| \u2264 \u2016\u2207\u03c3\u0303i \u2212\u2207\u03c3\u0303i,n\u2016.\nLast, we have\n\u2016T4\u2016 \u2264 \u2016\u2207\u03c3j,n\u2016\u2016\u2207\u03c3\u0303i,n\u2016\u2016\u2207\u03c3\u0303i\u20162\u2016\u2207\u03c3\u0303i \u2212\u2207\u03c3\u0303i,n\u2016 \u2264 Chmin{1+\u03b2i,\u03b1}.\nThus, we have\u2225\u2225(\u2207\u03c3j,\u2207\u03c3\u0303i)\u2016\u2207\u03c3\u0303i,n\u20162\u2207\u03c3\u0303i \u2212 (\u2207\u03c3j,n,\u2207\u03c3\u0303i,n)\u2016\u2207\u03c3\u0303i\u20162\u2207\u03c3\u0303i,n\u2225\u2225 \u2264 4\u2211 l=1 \u2016Tl\u2016 \u2264 Chmin{1+\u03b2i,\u03b1}. (3.26) Note that \u03b2i > \u03b2j, thus the combination of (3.25) and (3.26) gives\n\u2016\u03c3\u0303j \u2212 \u03c3\u0303j,n\u2016H1(\u2126) \u2264 Chmin{1+\u03b2j ,\u03b1}. (3.27)\nThe method of induction leads to the conclusion.\nLemma 3.7. For i = 1, \u00b7 \u00b7 \u00b7 , N , it follows r\u2212min{\u03b1\u22121,\u03b2i}\u03be\u0303i \u2208 L2(\u2126) and\n\u2016r\u2212min{\u03b1\u22121,\u03b2i}\u03be\u0303i\u2016 \u2264 C, (3.28)\nwhere C depends on \u03b2i and \u2126.\nProof. By (2.6), we have for k \u2264 i,\nr\u2212min{\u03b1\u22121,\u03b2i}\u03bek = \u03b7(r; \u03c4, R)r \u2212min{\u03b1\u22121,\u03b2i}\u2212 k\u03c0\u03c9 sin\n( k\u03c0\n\u03c9 \u03b8\n) + r\u2212min{\u03b1\u22121,\u03b2i}\u03b6k := T11 + T12.\nSince \u03b2i < 1\u2212 i\u03c0\u03c9 , so\n\u2212min{\u03b1\u2212 1, \u03b2i} \u2212 k\u03c0\n\u03c9 > \u03b2i \u2212min{\u03b1\u2212 1, \u03b2i} \u2212 1 \u2265 \u22121.\nSo we can verify that T11 \u2208 L2(\u2126), namely,\n\u2016T11\u2016 \u2264 C. (3.29)\nFor T12, we have\n\u2016T12\u2016 \u2264 \u2016r\u2212min{\u03b1\u22121,\u03b2i}\u2016L\u221e(\u2126)\u2016\u03b6k\u2016 \u2264 C\u2016\u03b6k\u2016H1(\u2126). (3.30)\n(3.29) and (3.30) imply that\n\u2016r\u2212min{\u03b1\u22121,\u03b2i}\u03bek\u2016 \u2264 \u2016T11\u2016+ \u2016T12\u2016 \u2264 C. (3.31)\nBy the construction of \u03be\u0303i in (2.38), we can obtain the estimate (3.28).\nLemma 3.8. For i = 1, \u00b7 \u00b7 \u00b7 , N , the orthogonalized functions \u03c3\u0303i in (2.37), \u03be\u0303i in (2.38), and their finite element approximations \u03c3\u0303i,n in (3.7), \u03be\u0303i,n in (3.8) satisfy\n\u2016\u03be\u0303i \u2212 \u03be\u0303i,n\u2016H\u22121(\u2126) \u2264 Chmin{1+\u03b2i+min{\u03b1,1},2\u03b1}, (3.32a) \u2016\u03c3\u0303i \u2212 \u03c3\u0303i,n\u2016 \u2264 Chmin{1+\u03b2i+min{\u03b1,1},2\u03b1}, (3.32b) \u2016rmin{\u03b1\u22121,\u03b2k}(\u03c3\u0303i \u2212 \u03c3\u0303i,n)\u2016 \u2264 Chmin{1+\u03b2k,\u03b1}+min{1+\u03b2i,\u03b1}, (3.32c)\nwhere 1 \u2264 k \u2264 N .\nProof. It is easy to check that the estimates in (3.32) hold when i = 1, and we also assume that they also hold for i \u2264 j \u2212 1 if N \u2265 2. Next, we prove the estimates in (3.32) hold at j. The proof of (3.32b) is similar to that for (3.32a), so we will skip its proof.\nUsing the similar argument as in Lemma 3.6, we have that \u2016\u03be\u0303i\u2016H\u22121(\u2126), \u2016\u03c3\u0303i\u2016, i = 1, \u00b7 \u00b7 \u00b7 , N are uniformly bounded. When h \u2264 h0 for some h0, it follows that \u2016\u03be\u0303i,n\u2016H\u22121(\u2126), \u2016\u03c3\u0303i,n\u2016, 1 \u2264 i \u2264 j \u2212 1 are also uniformly bounded.\nThe difference of the \u03be\u0303j \u2212 \u03be\u0303j,n, j = 2, \u00b7 \u00b7 \u00b7 , N , gives\n\u03be\u0303j \u2212 \u03be\u0303j,n =\u03bej \u2212 \u03bej,n \u2212 j\u22121\u2211 i=1 ( (\u2207\u03c3j,\u2207\u03c3\u0303i) \u2016\u2207\u03c3\u0303i\u20162 \u03be\u0303i \u2212 (\u2207\u03c3j,n,\u2207\u03c3\u0303i,n) \u2016\u2207\u03c3\u0303i,n\u20162 \u03be\u0303i,n )\n= (\u03bej \u2212 \u03bej,n)\u2212 j\u22121\u2211 i=1\n( (\u2207\u03c3j,\u2207\u03c3\u0303i)\u2016\u2207\u03c3\u0303i,n\u20162\u03be\u0303i \u2212 (\u2207\u03c3j,n,\u2207\u03c3\u0303i,n)\u2016\u2207\u03c3\u0303i\u20162\u03be\u0303i,n ) \u2016\u2207\u03c3\u0303i\u20162\u2016\u2207\u03c3\u0303i,n\u20162 .\n(3.33)\nBy (3.24), 1\u2016\u2207\u03c3\u0303i\u20162\u2016\u2207\u03c3\u0303i,n\u20162 are uniformly bounded. We denote by\n(\u2207\u03c3j,\u2207\u03c3\u0303i)\u2016\u2207\u03c3\u0303i,n\u20162\u03be\u0303i \u2212 (\u2207\u03c3j,n,\u2207\u03c3\u0303i,n)\u2016\u2207\u03c3\u0303i\u20162\u03be\u0303i,n = (\u2207\u03c3j \u2212\u2207\u03c3j,n,\u2207\u03c3\u0303i)\u2016\u2207\u03c3\u0303i,n\u20162\u03be\u0303i + (\u2207\u03c3j,n,\u2207\u03c3\u0303i \u2212\u2207\u03c3\u0303i,n)\u2016\u2207\u03c3\u0303i,n\u20162\u03be\u0303i + (\u2207\u03c3j,n,\u2207\u03c3\u0303i,n)(\u2016\u2207\u03c3\u0303i,n\u20162 \u2212 \u2016\u2207\u03c3\u0303i\u20162)\u03be\u0303i + (\u2207\u03c3j,n,\u2207\u03c3\u0303i,n)\u2016\u2207\u03c3\u0303i\u20162(\u03be\u0303i \u2212 \u03be\u0303i,n)\n:= T1 + T2 + T3 + T4.\nBy (3.33), it follows\n\u2016\u03be\u0303j \u2212 \u03be\u0303j,n\u2016H\u22121(\u2126) \u2264 \u2016\u03bej \u2212 \u03bej,n\u2016H\u22121(\u2126) + j\u22121\u2211 i=1\n\u2225\u2225\u2225(\u2207\u03c3j,\u2207\u03c3\u0303i)\u2016\u2207\u03c3\u0303i,n\u20162\u03be\u0303i \u2212 (\u2207\u03c3j,n,\u2207\u03c3\u0303i,n)\u2016\u2207\u03c3\u0303i\u20162\u03be\u0303i,n\u2225\u2225\u2225 H\u22121(\u2126)\n\u2016\u2207\u03c3\u0303i\u20162\u2016\u2207\u03c3\u0303i,n\u20162 .\nFrom (3.14d), we have\n\u2016\u03bej \u2212 \u03bej,n\u2016H\u22121(\u2126) \u2264 Ch2 min{\u03b1,1}. (3.34)\nBy taking \u03c6 = \u03c3j \u2212 \u03c3j,n \u2208 H10 (\u2126) in (2.40), we have\n(\u2207\u03c3j \u2212\u2207\u03c3j,n,\u2207\u03c3\u0303i) = \u3008\u03c3j \u2212 \u03c3j,n, \u03be\u0303i\u3009, (3.35)\nwhich implies that\nT1 = \u3008\u03c3j \u2212 \u03c3j,n, \u03be\u0303i\u3009\u2016\u2207\u03c3\u0303i,n\u20162\u03be\u0303i = \u3008rmin{\u03b1\u22121,\u03b2i}(\u03c3j \u2212 \u03c3j,n), r\u2212min{\u03b1\u22121,\u03b2i}\u03be\u0303i\u3009\u2016\u2207\u03c3\u0303i,n\u20162\u03be\u0303i.\nBy Lemma 3.7, we have r\u2212min{\u03b1\u22121,\u03b2i}\u03be\u0303i \u2208 L2(\u2126). Therefore, we have the estimate\n\u2016T1\u2016H\u22121(\u2126) \u2264\u2016rmin{\u03b1\u22121,\u03b2i}(\u03c3j \u2212 \u03c3j,n)\u2016\u2016r\u2212min{\u03b1\u22121,\u03b2i}\u03be\u0303i\u2016\u2016\u2207\u03c3\u0303i,n\u20162\u2016\u03be\u0303i\u2016H\u22121(\u2126) \u2264Chmin{1+\u03b2i,\u03b1}+min{1+\u03b2j ,\u03b1} = Chmin{1+\u03b2j+min{\u03b1,1},2\u03b1},\nwhere we have used the estimate (3.15c).\nSubtracting equation (3.9) from equation (2.40) and setting \u03c6 = \u03c3j,n yields\n(\u2207\u03c3j,n,\u2207\u03c3\u0303i \u2212\u2207\u03c3\u0303i,n) = \u3008\u03c3j,n, \u03be\u0303i \u2212 \u03be\u0303i,n\u3009.\nThus, we have by the assumption,\n\u2016T2\u2016H\u22121(\u2126) \u2264 \u2016\u03c3j,n\u2016\u2016\u03be\u0303i \u2212 \u03be\u0303i,n\u2016H\u22121(\u2126)\u2016\u2207\u03c3\u0303i,n\u20162\u2016\u03be\u0303i\u2016H\u22121(\u2126) \u2264 Chmin{1+\u03b2i+min{\u03b1,1},2\u03b1}.\nWe have by (2.40) and (3.9),\n\u2016\u2207\u03c3\u0303i,n\u20162 \u2212 \u2016\u2207\u03c3\u0303i\u20162 = \u3008\u03c3\u0303i,n, \u03be\u0303i,n\u3009 \u2212 \u3008\u03c3\u0303i, \u03be\u0303i\u3009 = \u3008\u03c3\u0303i,n \u2212 \u03c3\u0303i, \u03be\u0303i,n\u3009+ \u3008\u03c3\u0303i, \u03be\u0303i,n \u2212 \u03be\u0303i\u3009 := T31 + T32.\nBy the assumption for (3.32c), we have\n|T31| = |\u3008\u03c3\u0303i,n \u2212 \u03c3\u0303i, \u03be\u0303i,n\u3009| \u2264 \u2016rmin{\u03b1\u22121,\u03b2i}(\u03c3\u0303i,n \u2212 \u03c3\u0303i)\u2016\u2016r\u2212min{\u03b1\u22121,\u03b2i}\u03be\u0303i,n\u2016 \u2264 Chmin{1+\u03b2i+min{\u03b1,1},2\u03b1}.\nFor the second term, we have by the assumption for (3.32a),\n|T32| = |\u3008\u03c3\u0303i, \u03be\u0303i,n \u2212 \u03be\u0303i\u3009| \u2264 \u2016\u03c3\u0303i\u2016H1(\u2126)\u2016\u03be\u0303i,n \u2212 \u03be\u0303i\u2016H\u22121(\u2126) \u2264 Chmin{1+\u03b2i+min{\u03b1,1},2\u03b1}.\nThe estimates of |T31| and |T32| indicate that\n\u2016T3\u2016H\u22121(\u2126) \u2264 Chmin{1+\u03b2i+min{\u03b1,1},2\u03b1}.\nAgain by the assumption for (3.32a), we have\n\u2016T4\u2016H\u22121(\u2126) \u2264 \u2016\u2207\u03c3j,n\u2016\u2016\u2207\u03c3\u0303i,n\u2016\u2016\u2207\u03c3\u0303i\u20162\u2016\u03be\u0303i \u2212 \u03be\u0303i,n\u2016H\u22121(\u2126) \u2264 Chmin{1+\u03b2i+min{\u03b1,1},2\u03b1}.\nNote that \u03b2i > \u03b2j, we have\n4\u2211 l=1 \u2016Tl\u2016H\u22121(\u2126) \u2264 Chmin{1+\u03b2j+min{\u03b1,1},2\u03b1}. (3.36)\nThe combination of (3.34) and (3.36) indicate that (3.32a) holds at j, so that the method of induction state that (3.32a) holds for i = 1, \u00b7 \u00b7 \u00b7 , N .\nNext, we prove the estimate (3.32c) hold at j. For j = 2, \u00b7 \u00b7 \u00b7 , N , we have\nrmin{\u03b1\u22121,\u03b2k}(\u03c3\u0303j \u2212 \u03c3\u0303j,n) = rmin{\u03b1\u22121,\u03b2k}(\u03c3j \u2212 \u03c3j,n)\n\u2212 rmin{\u03b1\u22121,\u03b2k} j\u22121\u2211 i=1 ( (\u2207\u03c3j,\u2207\u03c3\u0303i) \u2016\u2207\u03c3\u0303i\u20162 \u03c3\u0303i \u2212 (\u2207\u03c3j,n,\u2207\u03c3\u0303i,n) \u2016\u2207\u03c3\u0303i,n\u20162 \u03c3\u0303i,n ) = rmin{\u03b1\u22121,\u03b2k} (\u03c3j \u2212 \u03c3j,n) \u2212 j\u22121\u2211 i=1 ( (\u2207\u03c3j,\u2207\u03c3\u0303i)\u2016\u2207\u03c3\u0303i,n\u20162rmin{\u03b1\u22121,\u03b2k}\u03c3\u0303i \u2212 (\u2207\u03c3j,n,\u2207\u03c3\u0303i,n)\u2016\u2207\u03c3\u0303i\u20162rmin{\u03b1\u22121,\u03b2k}\u03c3\u0303i,n ) \u2016\u2207\u03c3\u0303i\u20162\u2016\u2207\u03c3\u0303i,n\u20162 ,\n(3.37)\nwhere 1 \u2264 k \u2264 N . By (3.24), 1\u2016\u2207\u03c3\u0303i\u20162\u2016\u2207\u03c3\u0303i,n\u20162 are uniformly bounded. We denote by\n(\u2207\u03c3j,\u2207\u03c3\u0303i)\u2016\u2207\u03c3\u0303i,n\u20162rmin{\u03b1\u22121,\u03b2k}\u03c3\u0303i \u2212 (\u2207\u03c3j,n,\u2207\u03c3\u0303i,n)\u2016\u2207\u03c3\u0303i\u20162rmin{\u03b1\u22121,\u03b2k}\u03c3\u0303i,n = (\u2207\u03c3j \u2212\u2207\u03c3j,n,\u2207\u03c3\u0303i)\u2016\u2207\u03c3\u0303i,n\u20162rmin{\u03b1\u22121,\u03b2k}\u03c3\u0303i + (\u2207\u03c3j,n,\u2207\u03c3\u0303i \u2212\u2207\u03c3\u0303i,n)\u2016\u2207\u03c3\u0303i,n\u20162rmin{\u03b1\u22121,\u03b2k}\u03c3\u0303i + (\u2207\u03c3j,n,\u2207\u03c3\u0303i,n)(\u2016\u2207\u03c3\u0303i,n\u20162 \u2212 \u2016\u2207\u03c3\u0303i\u20162)rmin{\u03b1\u22121,\u03b2k}\u03c3\u0303i + (\u2207\u03c3j,n,\u2207\u03c3\u0303i,n)\u2016\u2207\u03c3\u0303i\u20162rmin{\u03b1\u22121,\u03b2k}(\u03c3\u0303i \u2212 \u03c3\u0303i,n)\n:= K1 +K2 +K3 +K4.\nBy (3.37), it follows\n\u2016rmin{\u03b1\u22121,\u03b2k}(\u03c3\u0303j \u2212 \u03c3\u0303j,n)\u2016 \u2264 \u2016rmin{\u03b1\u22121,\u03b2k} (\u03c3j \u2212 \u03c3j,n) \u2016\n+ j\u22121\u2211 i=1 \u2225\u2225(\u2207\u03c3j,\u2207\u03c3\u0303i)\u2016\u2207\u03c3\u0303i,n\u20162rmin{\u03b1\u22121,\u03b2k}\u03c3\u0303i \u2212 (\u2207\u03c3j,n,\u2207\u03c3\u0303i,n)\u2016\u2207\u03c3\u0303i\u20162rmin{\u03b1\u22121,\u03b2k}\u03c3\u0303i,n\u2225\u2225 \u2016\u2207\u03c3\u0303i\u20162\u2016\u2207\u03c3\u0303i,n\u20162 ,\nFrom (3.15b), we have\n\u2016rmin{\u03b1\u22121,\u03b2k} (\u03c3j \u2212 \u03c3j,n) \u2016 \u2264 Chmin{1+\u03b2k,\u03b1}+min{1+\u03b2j ,\u03b1}. (3.38)\nSimilar to the estimate of T1, we have by (3.35),\nK1 = \u3008rmin{\u03b1\u22121,\u03b2i}(\u03c3j \u2212 \u03c3j,n), r\u2212min{\u03b1\u22121,\u03b2i}\u03be\u0303i\u3009\u2016\u2207\u03c3\u0303i,n\u20162rmin{\u03b1\u22121,\u03b2k}\u03c3\u0303i.\nSince \u03c3\u0303i \u2208 Hmin{2+\u03b2i,1+\u03b1}, so we have rmin{\u03b1\u22121,\u03b2k}\u03c3\u0303i \u2208 L2(\u2126) by Lemma 2.12 or from (2.28). Therefore, we have the estimate\n\u2016K1\u2016 \u2264\u2016rmin{\u03b1\u22121,\u03b2i}(\u03c3j \u2212 \u03c3j,n)\u2016\u2016r\u2212min{\u03b1\u22121,\u03b2i}\u03be\u0303i\u2016\u2016\u2207\u03c3\u0303i,n\u20162\u2016rmin{\u03b1\u22121,\u03b2k}\u03c3\u0303i\u2016\n\u2264Chmin{1+\u03b2i,\u03b1}+min{1+\u03b2j ,\u03b1} = Chmin{1+\u03b2i+min{\u03b1,1},2\u03b1},\nthe last equality is due to the fact that min{1 + \u03b2i, \u03b1} = \u03b1 when 1 \u2264 i < N . Similar to the estimate of T2, we have\n\u2016K2\u2016H\u22121(\u2126) \u2264 \u2016\u03c3j,n\u2016\u2016\u03be\u0303i \u2212 \u03be\u0303i,n\u2016H\u22121(\u2126)\u2016\u2207\u03c3\u0303i,n\u20162\u2016rmin{\u03b1\u22121,\u03b2k}\u03c3\u0303i\u2016 \u2264 Chmin{1+\u03b2i+min{\u03b1,1},2\u03b1}.\nThe estimates of |T31| and |T32| above also indicate that\n\u2016K3\u2016 \u2264 Chmin{1+\u03b2i+min{\u03b1,1},2\u03b1}.\nBy the assumption for (3.32c), we have\n\u2016K4\u2016 \u2264 \u2016\u2207\u03c3j,n\u2016\u2016\u2207\u03c3\u0303i,n\u2016\u2016\u2207\u03c3\u0303i\u20162\u2016rmin{\u03b1\u22121,\u03b2k}(\u03c3\u0303i \u2212 \u03c3\u0303i,n)\u2016 \u2264 Chmin{1+\u03b2k,\u03b1}+min{1+\u03b2i,\u03b1}.\nNote again that \u03b2i > \u03b2j, we have\n4\u2211 l=1 \u2016Kl\u2016 \u2264 Chmin{1+\u03b2k,\u03b1}+min{1+\u03b2j ,\u03b1}. (3.39)\nThe combination of (3.38) and (3.39) indicate that (3.32c) holds at j, so that the method of induction state that (3.32c) holds for i = 1, \u00b7 \u00b7 \u00b7 , N .\nNote that v \u2208 H1+\u03b1(\u2126), then we have the following estimates for vn in (3.2).\nLemma 3.9. Let vn \u2208 Sn be the finite element approximation to (3.2), and v be the solution to the Poisson equation in the mixed formulation (2.33). Then it follows\n\u2016v \u2212 vn\u2016H1(\u2126) \u2264 Chmin{\u03b1,1}, (3.40a) \u2016v \u2212 vn\u2016 \u2264 Ch2 min{\u03b1,1}. (3.40b)\nProof. Subtracting (2.34b) from (3.2) gives the Galerkin orthogonality\nA(v \u2212 vn, \u03c8) = (w \u2212 wn, \u03c8). (3.41)\nLet vI \u2208 Sn be the nodal interpolation of v. Set = vI \u2212 u, e = vI \u2212 vn and take \u03c8 = e in the equation above, we have\nA(e, e) = A( , e) + (w \u2212 wn, e),\nwhich implies\n\u2016e\u2016H1(\u2126) \u2264 \u2016 \u2016H1(\u2126) + \u2016w \u2212 wn\u2016H\u22121(\u2126),\nUsing the triangle inequality, it follows \u2016v \u2212 vn\u2016H1(\u2126) \u2264\u2016e\u2016H1(\u2126) + \u2016 \u2016H1(\u2126) \u2264 C ( \u2016 \u2016H1(\u2126) + \u2016w \u2212 wn\u2016H\u22121(\u2126) ) ,\n\u2264C ( \u2016 \u2016H1(\u2126) + \u2016w \u2212 wn\u2016 ) \u2264 Chmin{\u03b1,1},\nwhere we have used the projection error (3.12) and (3.14b). To obtain the L2 error, we consider the problem (2.25) with g = v \u2212 vn, then we have\n\u2016v \u2212 vn\u20162 = A(v \u2212 vn, z).\nSubtract (3.41) from the above equation and set \u03c8 = zI , we have\n\u2016v \u2212 vn\u20162 =A(v \u2212 vn, z \u2212 zI) + (w \u2212 wn, zI)\n=A(v \u2212 vn, z \u2212 zI) + (w \u2212 wn, zI \u2212 z) + (w \u2212 wn, z) \u2264\u2016v \u2212 vn\u2016H1(\u2126)\u2016z \u2212 zI\u2016H1(\u2126) + \u2016w \u2212 wn\u2016\u2016z \u2212 zI\u2016+ \u2016w \u2212 wn\u2016\u2016z\u2016 \u2264Ch2 min{\u03b1,1}\u2016z\u2016H1+min{\u03b1,1}(\u2126) \u2264 Ch2 min{\u03b1,1}\u2016v \u2212 vn\u2016,\n(3.42)\nwhere in the last inequality we have use the estimates (3.12), (3.14b), (3.40a). By the regularity (2.26a), we have\n\u2016z\u2016H1+min{\u03b1,1}(\u2126) \u2264 C\u2016v \u2212 vn\u2016Hmin{\u03b1,1}\u22121(\u2126) \u2264 C\u2016v \u2212 vn\u2016. (3.43)\n(3.42) and (3.43) give the L2 error estimate (3.40b).\nNext we carry out the error estimate for the finite element approximation un in (3.6).\nTheorem 3.10. Let un \u2208 Sn be the finite element approximation to (3.6), and u be the solution to the sixth order problem (2.2). Then it follows\n\u2016u\u2212 un\u2016H1(\u2126) \u2264 C0h+ N\u2211 i=1 Cih min{2(1+\u03b2i),1} \u2264 Ch\u03b3, (3.44)\nwhere \u03b2i < 1\u2212 i\u03c0\u03c9 , the convergence rate \u03b3 = 1 if N = 0, and \u03b3 = min{2(1 + \u03b2N), 1} if 1 \u2264 N \u2264 3, the constants C, Ci depend on the coefficients c\u0303i in (2.42).\nProof. Subtract (3.11) from (2.44c), we have\nA(u\u2212 un, \u03c4) =(v \u2212 vn, \u03c4)\u2212 N\u2211 i=1 (c\u0303i\u03c3\u0303i \u2212 c\u0303i,n\u03c3\u0303i,n, \u03c4)\n=(v \u2212 vn, \u03c4) + N\u2211 i=1 [c\u0303i,n(\u03c3\u0303i,n \u2212 \u03c3\u0303i, \u03c4) + (c\u0303i,n \u2212 c\u0303i)(\u03c3\u0303i, \u03c4)] .\n(3.45)\nLet uI \u2208 Sn be the nodal interpolation of u. Set = uI \u2212 u, e = uI \u2212 un and take \u03c4 = e in (3.45), we have\nA(e, e) = A( , e) + (v \u2212 vn, e) + N\u2211 i=1 [c\u0303i,n(\u03c3\u0303i,n \u2212 \u03c3\u0303i, e) + (c\u0303i,n \u2212 c\u0303i)(\u03c3\u0303i, e)] .\nThus, we have\n\u2016e\u2016H1(\u2126) \u2264 C ( \u2016 \u2016H1(\u2126) + \u2016v \u2212 vn\u2016H\u22121(\u2126) +\nN\u2211 i=1 [ |c\u0303i,n|\u2016\u03c3\u0303i \u2212 \u03c3\u0303i,n\u2016H\u22121(\u2126) + |c\u0303i \u2212 c\u0303i,n|\u2016\u03c3\u0303i\u2016H\u22121(\u2126)\n]) .\nUsing the triangle inequality and the inequality above, we have\n\u2016u\u2212 un\u2016H1(\u2126) \u2264 \u2016e\u2016H1(\u2126) + \u2016 \u2016H1(\u2126)\n\u2264 C ( \u2016 \u2016H1(\u2126) + \u2016v \u2212 vn\u2016H\u22121(\u2126) +\nN\u2211 i=1 [ |c\u0303i,n|\u2016\u03c3\u0303i \u2212 \u03c3\u0303i,n\u2016H\u22121(\u2126) + |c\u0303i \u2212 c\u0303i,n|\u2016\u03c3\u0303i\u2016H\u22121(\u2126)\n]) . (3.46)\nWe shall estimate every term in (3.46). Recall the solution u \u2208 H3(\u2126). By the interpolation error estimate (3.12),\n\u2016 \u2016H1(\u2126) = \u2016u\u2212 uI\u2016H1(\u2126) \u2264 Ch\u2016u\u2016H2(\u2126). (3.47)\nRecall that \u03c0 \u03c9 > 1 2 . Thus, choosing \u03b1 = 1/2 < \u03c0 \u03c9 in (3.40b), we have\n\u2016v \u2212 vn\u2016H\u22121(\u2126) \u2264 \u2016v \u2212 vn\u2016 \u2264 Ch. (3.48)\nBy (3.32a), we have\n\u2016\u03be\u0303i \u2212 \u03be\u0303i,n\u2016H\u22121(\u2126) \u2264 Chmin{1+\u03b2i+min{\u03b1,1},2\u03b1}. (3.49)\nFrom (3.32b), we also have\n\u2016\u03c3\u0303i \u2212 \u03c3\u0303i,n\u2016H\u22121(\u2126) \u2264 \u2016\u03c3\u0303i \u2212 \u03c3\u0303i,n\u2016 \u2264 Chmin{1+\u03b2i+min{\u03b1,1},2\u03b1}.\nTo obtain the error estimate for the third term in (3.46), we still need to shown |c\u0303i,n| is uniformly bounded. By (3.10), we have\n|c\u0303i,n| = \u2223\u2223\u2223\u2223\u2223 \u3008vn, \u03be\u0303i,n\u3009\u3008\u03c3\u0303i,n, \u03be\u0303i,n\u3009 \u2223\u2223\u2223\u2223\u2223 = \u2223\u2223\u2223\u2223 (\u2207\u03c3\u0303i,n,\u2207vn)(\u2207\u03c3\u0303i,n,\u2207\u03c3\u0303i,n) \u2223\u2223\u2223\u2223 \u2264 \u2016vn\u2016H1(\u2126)\u2016\u03c3\u0303i,n\u2016H1(\u2126)\u2016\u03c3\u0303i,n\u20162H1(\u2126) \u2264 \u2016vn\u2016H1(\u2126)\u2016\u03c3\u0303i,n\u2016H1(\u2126) , (3.50)\nwhere we have used Ho\u0308lder\u2019s inequality. By the regularity result (2.35) and the estimate (3.40), we have \u2016vn\u2016H1(\u2126) \u2264 C\u2016f\u2016 when h \u2264 h0 for some h0, which together with (3.23) implies that (3.50) is uniformly bounded.\nSubtracting (3.10) from (2.42) or (2.43), we obtain\nc\u0303i\u2212c\u0303i,n = (\u2207v,\u2207(\u03c3\u0303i \u2212 \u03c3\u0303i,n))\n\u2016\u2207\u03c3\u0303i\u20162 + (\u2207\u03c3\u0303i,n,\u2207(v \u2212 vn)) \u2016\u2207\u03c3\u0303i\u20162 + \u2016\u2207\u03c3\u0303i,n\u20162 \u2212 \u2016\u2207\u03c3\u0303i\u20162 \u2016\u2207\u03c3\u0303i\u20162\u2016\u2207\u03c3\u0303i,n\u20162 (\u2207vn,\u2207\u03c3\u0303i,n) := T1+T2+T3.\nSet \u03c8 = (\u03c3\u0303i \u2212 \u03c3\u0303i,n) \u2208 H10 (\u2126) in (2.44), we obtain\n(\u2207v,\u2207(\u03c3\u0303i \u2212 \u03c3\u0303i,n)) = (w, \u03c3\u0303i \u2212 \u03c3\u0303i,n).\nThus, we have by (3.32)\n\u2016T1\u2016 \u2264 \u2016w\u2016 \u2016\u2207\u03c3\u0303i\u20162 \u2016\u03c3\u0303i \u2212 \u03c3\u0303i,n\u2016 \u2264 Chmin{1+\u03b2i+min{\u03b1,1},2\u03b1}.\nSubtract (3.2) from (2.44b) and set \u03c8 = \u03c3\u0303i,n, it follows\n(\u2207\u03c3\u0303i,n,\u2207(v \u2212 vn)) = (w \u2212 wn,\u2207\u03c3i,n).\nThen we have by (3.14b) and taking \u03b1 = 1 2 ,\n\u2016T2\u2016 \u2264 1\n\u2016\u2207\u03c3\u0303i\u2016 \u2016w \u2212 wn\u2016 \u2264 Ch2 min{\u03b1,1} = Ch.\nNote that\n\u2016\u2207\u03c3\u0303i,n\u20162 \u2212 \u2016\u2207\u03c3\u0303i\u20162 =(\u2207\u03c3\u0303i,n \u2212\u2207\u03c3\u0303i,\u2207\u03c3\u0303i,n) + (\u2207\u03c3\u0303i,n \u2212\u2207\u03c3\u0303i,\u2207\u03c3\u0303i)\n=\u3008\u03be\u0303i,n \u2212 \u03be\u0303i, \u03c3\u0303i,n\u3009+ \u3008\u03c3\u0303i,n \u2212 \u03c3\u0303i, \u03be\u0303i\u3009.\nIt is easy to check\n|\u3008\u03be\u0303i,n \u2212 \u03be\u0303i, \u03c3\u0303i,n\u3009| \u2264 \u2016\u03be\u0303i,n \u2212 \u03be\u0303i\u2016H\u22121(\u2126)\u2016\u03c3\u0303i,n\u2016H1(\u2126) \u2264 Chmin{1+\u03b2i+min{\u03b1,1},2\u03b1}.\nNote that\n|\u3008\u03c3\u0303i,n \u2212 \u03c3\u0303i, \u03be\u0303i\u3009| =|\u3008rmin{\u03b1\u22121,\u03b2i}(\u03c3\u0303i \u2212 \u03c3\u0303i,n), r\u2212min{\u03b1\u22121,\u03b2i}\u03be\u0303i\u3009|\n\u2264\u2016rmin{\u03b1\u22121,\u03b2i}(\u03c3\u0303i \u2212 \u03c3\u0303i,n)\u2016\u2016r\u2212min{\u03b1\u22121,\u03b2i}\u03be\u0303i\u2016 \u2264 Ch2 min{1+\u03b2i,\u03b1}.\nThe last two inequality implies that\n\u2016T3\u2016 \u2264 Ch2 min{1+\u03b2i,\u03b1}.\nThus, we have\n|c\u0303i \u2212 c\u0303i,n| \u2264 3\u2211 l=1 \u2016Tl\u2016 \u2264 Ch2 min{1+\u03b2i,\u03b1}. (3.51)\nPlugging (3.47), (3.48), (3.49) and (3.51) with \u03b1 = 1 2 into (3.46), the conclusion holds.\nRemark 3.11. For the following cases, we have min{2(1 +\u03b2i), 1} = 1, (i) 1 \u2264 i < N ; (ii) i = N and \u03b2i \u2265 \u221212 . To better view \u2016u\u2212 un\u2016H1(\u2126) in (3.44), we explicitly show the value of min{2(1 + \u03b2i), 1} and the value or interval of \u03b3 in Table 3.\nIn this section, we present numerical test results to validate our theoretical predictions for Algorithm 3.1 solving equation (1.1). As a comparison, we also compute the finite element method for the direct mixed formulation (2.4), which we call direct mixed finite element method. We will use the following convergence rate as an indicator of the actual convergence rate. If the exact solutions u, v, w in (2.33) are given, then calculate the convergence rate by\nR = log2 |\u03c6\u2212 \u03c6j\u22121|H1(\u2126) |\u03c6\u2212 \u03c6j|H1(\u2126) , (4.1)\notherwise,\nR = log2 |\u03c6j \u2212 \u03c6j\u22121|H1(\u2126) |\u03c6j+1 \u2212 \u03c6j|H1(\u2126) . (4.2)\nHere \u03c6j denotes the finite element solution on the mesh Tj obtained after j refinements of the initial triangulation T0. It can be either uj, vj or wj depending on the underlying Poisson problem. In particular, suppose the actual convergence rate is \u2016\u03c6 \u2212 \u03c6j\u2016H1(\u2126) = O(h\u03b2) for \u03b2 > 0. Then for the P1 finite element method, the rate in (4.2) is also a good approximation of the exponent \u03b2 as the level of refinements j increases [17].\nWe use the following cut-off function in Algorithm 3.1:\n\u03b7(r; \u03c4, R) =  0, if r \u2265 R, 1, if r \u2264 \u03c4R, 1 2 \u2212 15 16 ( 2r R(1\u2212\u03c4) \u2212 1+\u03c4 1\u2212\u03c4 ) + 5 8 ( 2r R(1\u2212\u03c4) \u2212 1+\u03c4 1\u2212\u03c4 )3 \u2212 3 16 ( 2r R(1\u2212\u03c4) \u2212 1+\u03c4 1\u2212\u03c4 )5 , otherwise.\nWe set the default parameters R = 32 5 , \u03c4 = 1 8 . If a different R is used, it will be specified.\nExample 4.1. We solve the problem (1.1) on different domains using both the direct mixed finite element method and Algorithm 3.1 on quasi-uniform meshes obtained by midpoint refinements with the given initial mesh. We start with a \u201cwrong solution\u201d u 6\u2208 H3(\u2126),\nu(r, \u03b8) = \u03b7\u0303(r; \u03c4, R)r \u03c0 \u03c9 sin (\u03c0 \u03c9 \u03b8 ) , (4.3)\nwhere \u03b7\u0303(r; \u03c4, R) is also a cut-off function\n\u03b7\u0303(r; \u03c4, R) =  0, if r > R, 1, if r < \u03c4R,\n1 2\n+ \u22116\ni=0Ci\n( 2r\nR(1\u2212\u03c4) \u2212 1+\u03c4 1\u2212\u03c4\n)2i+1 , otherwise,\n(4.4)\nwith R = 32 5 , \u03c4 = 1 8 , and the coefficients Ci are determined by solving the linear system\n\u03b7\u0303(i)(R; \u03c4, R) = 0, i = 0, \u00b7 \u00b7 \u00b7 , 6.\nThe source term f is obtained by calculating\nf = \u2212\u2206(\u2206(\u2206u)),\nand it can be verified that f \u2208 L2(\u2126). Note that u 6\u2208 H3(\u2126) and therefore u is not the solution of weak formulation (2.2) because the \u201ctrue solution\u201d should be a function in H3(\u2126). The purpose of this example is to test the convergence of the finite element method for the direct mixed formulation and Algorithm 3.1 to the \u201cwrong solution\u201d u in (4.3). Test case 1. Take \u2126 as the triangle M QQ1Q2 with Q(0, 0), Q1(16, 0) and Q2(\u22128, 8 \u221a 3). The domain \u2126 with the initial mesh is shown in Figure 2(a), and the \u201cwrong solution\u201d u is shown in Figure 2(b). Here, \u03c9 = \u2220Q1QQ2 = 2\u03c03 \u2208 ( \u03c0 2 , \u03c0).\nThe direct mixed finite element solution uU10 and the difference |u\u2212uU10| are shown in Figure 2(c) and Figure 2(d), respectively. The error \u2016u\u2212 uUj \u2016H1(\u2126) is shown in Table 4. These results indicate that the direct mixed finite element solution converges to the \u201cwrong solution\u201d u 6\u2208 H3(\u2126). On the other hand, since \u03c9 = 2\u03c0\n3 \u2208 (\u03c0 2 , \u03c0), so it follows N = 1 in Algorithm 3.1 by checking Table\n1. The solution uA10 from Algorithm 3.1 and the difference |u\u2212 uA10| are shown in Figure 2(e) and Figure 2(f), respectively. The error \u2016u \u2212 uAj \u2016H1(\u2126) is shown in Table 4. These results imply that the solution of Algorithm 3.1 does not converge to the \u201cwrong solution\u201d, since the solution of Algorithm 3.1 converges to the solution in H3(\u2126) as stated in Theorem 2.16.\nTest case 2. Here, we consider the domain \u2126 to be the polygon with vertices Q(0, 0), Q1( 16 \u221a 3 3 , 0), Q2( 16\u22128 \u221a 2\n1+ \u221a 3 , 16\u22128\n\u221a 2\n1+ \u221a 3 + 8 \u221a 2), Q3(\u22128 \u221a 2+ 2 \u221a 3 2\n1+ 1\u221a 3\n, 8 \u221a 2\u2212 8 \u221a 2+ 2 \u221a 3 2\n1+ 1\u221a 3\n) and Q4(\u221283 ,\u22124 \u221a 3). Then we have \u03c9 =\n\u2220Q1QQ4 \u2248 1.383\u03c0 \u2208 (\u03c0, 3\u03c02 ). The domain \u2126 with the initial mesh is shown in Figure 3(a), and the \u201cwrong solution\u201d u is shown in Figure 3(b).\nThe direct mixed finite element solution uU10 and the difference |u\u2212uU10| are shown in Figure 3(c) and Figure 3(d), respectively. The error \u2016u \u2212 uUj \u2016H1(\u2126) is shown in Table 5. These results imply that the direct mixed finite element solution converges to the \u201cwrong solution\u201d u 6\u2208 H3(\u2126). On the other hand, since \u03c9 \u2208 (\u03c0, 3\u03c0\n2 ), we have N = 2 in Algorithm 3.1. The solution uA10 of Algorithm\n3.1 and the difference |u \u2212 uA10| are shown in Figure 3(e) and Figure 3(f), respectively. The error\n\u2016u \u2212 uAj \u2016H1(\u2126) is shown in Table 5. These results imply that the solution of Algorithm 3.1 does not converge to the \u201cwrong solution\u201d.\nTest case 3. Consider the polygonal domain \u2126 with verticesQ(0, 0), Q1( 16 \u221a 3 3 , 0), Q2( 16\u22128 \u221a 2 1+ \u221a 3 , 16\u22128 \u221a 2 1+ \u221a 3 + 8 \u221a 2), Q3(\u22128 \u221a 2+ 2 \u221a 3 2\n1+ 1\u221a 3\n, 8 \u221a 2\u2212 8 \u221a 2+ 2 \u221a 3 2\n1+ 1\u221a 3\n) and Q4(4,\u22128 \u221a 3). Then we have \u03c9 = \u2220Q1QQ4 \u2248 1.589\u03c0 \u2208\n(3\u03c0 2 , 2\u03c0). The domain \u2126 with the initial mesh is shown in Figure 4(a), and the \u201cwrong solution\u201d u is shown in Figure 4(b).\nThe direct mixed finite element solution uU10 and the difference |u\u2212uU10| are shown in Figure 4(c) and Figure 4(d), respectively. The error \u2016u\u2212uUj \u2016H1(\u2126) is shown in Table 6. These results continue to indicate that the direct mixed finite element solution converges to the \u201cwrong solution\u201d u 6\u2208 H3(\u2126). On the other hand, since \u03c9 \u2208 (3\u03c0\n2 , 2\u03c0), it follows N = 3 in Algorithm 3.1. The solution uA10 of\nAlgorithm 3.1 and the difference |u\u2212 uA10| are shown in Figure 4(e) and Figure 4(f), respectively. The error \u2016u\u2212 uAj \u2016H1(\u2126) is shown in Table 6. These results confirm that the solution of Algorithm 3.1 does not converge to the \u201cwrong solution\u201d.\nExample 4.2. We solve the triharmonic problem in Example 4.1 again using the direct mixed finite element method and Algorithm 3.1 on quasi-uniform meshes. Here, we take the solution uex of the\nfollowing Poisson problem as the exact solution,\n\u2212\u2206uex = f0 \u2212 N\u2211 i=1 ci\u03c3i in \u2126, uex = 0 on \u2202\u2126, (4.5)\nwhere\nf0 = \u2212\u2206 ( \u03b7\u0303(r; \u03c4, R)r N\u03c0 \u03c9 sin ( N\u03c0\n\u03c9 \u03b8\n)) \u2208 H10 (\u2126),\nwith \u03b7\u0303(r; \u03c4, R) given in (4.4), \u03c3i given in (2.9), and ci is the solution of the linear system (2.17). Note that the function f0 = \u2212\u2206u for u in (4.3). By Lemma 2.15, we have uex \u2208 H3(\u2126) and it satisfies\n\u2212\u22063uex = \u2212\u22062(\u2206uex) = \u22062f0 \u2212 N\u2211 i=1 ci\u2206 2\u03c3i = \u2206 2f0 = \u2212\u22062(\u2206u) = \u2212\u2206(\u2206(\u2206u)) = f,\nwhere we have used the result in Lemma 2.6. Here, the source term f is the same as that in Example 4.1. The purpose of this example is to test the convergence of the direct mixed finite element method and Algorithm 3.1 to the exact solution uex in (4.5). From Test case 2 to Test case 4, we will use the finite element method solution uexn (instead of using the complicated notation uex,n+1) of (4.5) on mesh Tn+1 as an approximation of uex. Test case 1. Take \u2126 as the triangle M QQ1Q2 with Q(0, 0), Q1(8, 0) and Q2(4, 4 \u221a 3). In this case, the exact solution uex = u for a given u in (4.3), and its contour is given in Figure 5(a). Here, \u03c9 = \u2220Q1QQ2 = \u03c03 \u2208 (0, \u03c0 2 ). Thus Algorithm 3.1 coincides with the direct mixed finite element method. The solution uA10(= u U 10) from Algorithm 3.1 and the difference |u \u2212 uA10| are shown in Figure 5(b) and Figure 5(c), respectively. The error \u2016u \u2212 uAj \u2016H1(\u2126) and convergence rate R are shown in Table 7. These results show that the solution of Algorithm 3.1 converges to the exact solution in the optimal convergence rate R = 1, which coincides with the result in Theorem 3.10 or Table 3.\nTest case 2. We consider the same domain and initial mesh (see Figure 2(a)) as Test case 1 in Example 4.1. Note that \u03c9 = \u2220Q1QQ2 = 2\u03c03 \u2208 ( \u03c0 2 , \u03c0). The finite element solution uexn of the exact solution uex is shown in Figure 6(a). The direct mixed finite element solution u U 10 and the difference |uexn \u2212 uU10| are shown in Figure 2(c) and Figure 6(b), respectively. The error \u2016uexn \u2212 uUj \u2016H1(\u2126) is shown in Table 8. These results indicate that the direct mixed finite element solution does not converge to the exact solution. Note that N = 1 in Algorithm 3.1, the solution uA10 from Algorithm 3.1 and the difference |uexn \u2212 uA10| are shown in Figure 2(e) and Figure 6(c), respectively. The error \u2016uexn\u2212 uAj \u2016H1(\u2126) is shown in Table 8. These results imply that the solution of Algorithm 3.1 converges to the exact solution.\nTest case 3. We consider the same domain and initial mesh (see Figure 3(a)) as Test case 2 in Example 4.1. Recall that \u03c9 = \u2220Q1QQ4 \u2248 1.383\u03c0 \u2208 (\u03c0, 3\u03c02 ). The exact solution uexn is shown in Figure 7(a). The direct mixed finite element solution uU10 and the difference |uexn \u2212 uU10| are\nshown in Figure 3(c) and Figure 7(b), respectively. The error \u2016uexn \u2212 uUj \u2016H1(\u2126) is shown in Table 9. These results indicate that the direct mixed finite element solution does not converge to the exact solution. Note that N = 2 in Algorithm 3.1 in this case. The solution uA10 of Algorithm 3.1 and the difference |uexn \u2212 uA10| are shown in Figure 3(e) and Figure 7(c), respectively. The error \u2016uexn \u2212 uAj \u2016H1(\u2126) is shown in Table 9. These results also imply that the solution of Algorithm 3.1 converges to the exact solution.\nTest case 4. We consider the same domain and initial mesh (see Figure 4(a)) as Test case 3 in Example 4.1. Recall that \u03c9 = \u2220Q1QQ4 \u2248 1.589\u03c0 \u2208 (3\u03c02 , 2\u03c0). The approximation uexn of the exact solution is shown in Figure 8(a). The direct mixed finite element solution uU10 and the difference |uexn \u2212 uU10| are shown in Figure 4(c) and Figure 8(b), respectively. The error \u2016uexn \u2212 uUj \u2016H1(\u2126) is shown in Table 6. These results continue to indicate that the direct mixed finite element solution does not converge to the exact solution. Note that N = 3 in Algorithm 3.1, the solution uA10 of Algorithm 3.1 and the difference |uexn \u2212 uA10| are shown in Figure 4(e) and Figure 8(c), respectively. The error \u2016uexn \u2212 uAj \u2016H1(\u2126) is shown in Table 10. These results confirm that the solution of Algorithm 3.1 converges to the exact solution.\nExample 4.3. In this example, we investigate the convergence of Algorithm 3.1 by considering equation (1.1) with f = sin ( N\u03c0 \u03c9 \u03b8 ) on different domains with angle \u03c9 categorized in Theorem 3.10 or Table 3, where N is shown in Table 1. For \u03c9 < \u03c0 2 , the numerical test on convergence rate can be found in Example 4.2 Test case 1. In the rest of this example, we focus on \u03c9 > \u03c0 2 .\nTest case 1. Take \u2126 as the triangle M QQ1Q2 with Q(0, 0), Q1(16, 0) and Q2(16x0, 16 \u221a\n1\u2212 x20) for some |x0| < 1. The convergence rates for different \u03c9 = \u2220Q1QQ2 \u2208 (\u03c02 , \u03c0) determined by choosing different x0 are shown in Table 11. Here, R = 24 5 , \u03c4 = 1 8\nare used when x0 = \u22120.8, and default values are used for other cases. The results show that the convergence rate is not optimal when \u03c9 < 2\u03c0 3 , and it is optimal when \u03c9 \u2208 [2\u03c0 3 , \u03c0). These results are consistent with the expected convergence rate R in Theorem 3.10 or Table 3 for \u03c9 \u2208 (\u03c0 2 , \u03c0).\nTest case 2. We consider the polygon \u2126 with vertices Q(0, 0), Q1(16, 0), Q2(\u22128, 8 \u221a 3), and Q3(\u22128,\u22128y0 \u221a 3) for some y0 \u2208 (0, 1], which gives \u03c9 = \u2220Q1QQ3 \u2208 (\u03c0, 4\u03c03 ]. We then consider the\ndomain \u2126 (see Figure 4(a)) presented in Example 4.1 Test case 2, and the corresponding angle \u03c9 \u2208 (4\u03c0 3 , 3\u03c0 2 ). The convergence rates for different \u03c9 \u2208 (\u03c0, 3\u03c0 2 ) are shown in Table 12. The results show that the convergence rate is not optimal when \u03c9 < 4\u03c0 3 , and it is optimal when \u03c9 \u2208 [4\u03c0 3 , 3\u03c0 2 ). These results are consistent with the expected convergence rate in Theorem 3.10 or Table 3 for \u03c9 \u2208 (\u03c0, 3\u03c0 2 ).\nTest case 3. We consider the polygon \u2126 with vertices Q(0, 0), Q1( 16 \u221a 3 3 , 0), Q2( 16\u22128 \u221a 2 1+ \u221a 3 , 16\u22128 \u221a 2 1+ \u221a 3 + 8 \u221a 2), Q3(\u22128 \u221a 2+ 2 \u221a 3 2\n1+ 1\u221a 3\n, 8 \u221a 2\u2212 8 \u221a 2+ 2 \u221a 3 2\n1+ 1\u221a 3\n), and Q4(x1,\u22128 \u221a 3) for some x1 \u2208 (0, 8 \u221a 3], which generates\n\u03c9 = \u2220Q1QQ4 \u2208 (3\u03c02 , 7\u03c0 4 ]. The convergence rates for different \u03c9 \u2208 (3\u03c0 2 , 2\u03c0) are shown in Table 13. These results are consistent with the expected convergence rate in Theorem 3.10 or Table 3 for \u03c9 \u2208 (3\u03c0 2 , 2\u03c0).\nthe Wayne State University Faculty Competition for Postdoctoral Fellows Award.\nReferences\n[1] R. Backofen, A. Ra\u0308tz, and A. Voigt. Nucleation and growth by a phase field crystal (PFC) model. Philosophical\nMagazine Letters, 87(11):813\u2013820, 2007.\n[2] J. W. Barrett, S. Langdon, and R. Nu\u0308rnberg. Finite element approximation of a sixth order nonlinear degenerate\nparabolic equation. Numerische Mathematik, 96(3):401\u2013434, 2004.\n[3] J. H. Bramble and M. Zla\u0301mal. Triangular elements in the finite element method. Mathematics of Computation,\n24(112):809\u2013820, 1970.\n[4] S. C. Brenner and L. R. Scott. The Mathematical Theory of Finite Element Methods, volume 15 of Texts in\nApplied Mathematics. Springer-Verlag, New York, second edition, 2002.\n[5] M. Cheng and J. A. Warren. An efficient algorithm for solving the phase field crystal model. Journal of\nComputational Physics, 227(12):6241\u20136248, 2008.\n[6] P. Ciarlet. The Finite Element Method for Elliptic Problems, volume 4 of Studies in Mathematics and Its\nApplications. North-Holland, Amsterdam, 1978.\n[7] J. Droniou, M. Ilyas, B. P. Lamichhane, and G. E. Wheeler. A mixed finite element method for a sixth-order\nelliptic problem. IMA Journal of Numerical Analysis, 39(1):374\u2013397, 2019.\n[8] L. Evans. Partial Differential Equations, volume 19 of Graduate Studies in Mathematics. AMS, Rhode Island,\n1998.\n[9] P. Grisvard. Elliptic Problems in Nonsmooth Domains. Pitman, Boston, 1985.\n[10] P. Grisvard. Singularities in Boundary Value Problems, volume 22 of Research Notes in Applied Mathematics.\nSpringer-Verlag, New York, 1992.\n[11] T. Gudi and M. Neilan. An interior penalty method for a sixth-order elliptic equation. IMA journal of numerical\nanalysis, 31(4):1734\u20131753, 2011.\n[12] Z. Hu, S. M. Wise, C. Wang, and J. S. Lowengrub. Stable and efficient finite-difference nonlinear-multigrid\nschemes for the phase field crystal equation. Journal of Computational Physics, 228(15):5323\u20135339, 2009.\n[13] V.A. Kondrat\u2032ev. Boundary value problems for elliptic equations in domains with conical or angular points.\nTrudy Moskov. Mat. Obs\u030cc\u030c., 16:209\u2013292, 1967.\n[14] V. Kozlov, V. Maz\u2032ya, and J. Rossmann. Elliptic boundary value problems in domains with point singularities,\nvolume 52 of Mathematical Surveys and Monographs. American Mathematical Society, Providence, RI, 1997.\n[15] V. Kozlov, V. Maz\u2032ya, and J. Rossmann. Spectral problems associated with corner singularities of solutions\nto elliptic equations, volume 85 of Mathematical Surveys and Monographs. American Mathematical Society, Providence, RI, 2001.\n[16] H. Li. Graded Finite Element Methods for Elliptic Problems in Nonsmooth Domains. Surveys and Tutorials in\nthe Applied Mathematical Sciences (STAMS, volume 10). Springer, 2022.\n[17] H. Li and S. Nicaise. Regularity and a priori error analysis on anisotropic meshes of a Dirichlet problem in\npolyhedral domains. Numer. Math., 139(1):47\u201392, 2018.\n[18] H. Li, P. Yin, and Z. Zhang. A C0 finite element method for the biharmonic problem with Navier\nboundary conditions in a polygonal domain. IMA Journal of Numerical Analysis, pages 1\u201323, 2022. https://doi.org/10.1093/imanum/drac026.\n[19] S. Nazarov and B. A. Plamenevsky. Elliptic Problems in Domains with Piecewise Smooth Boundaries, vol-\nume 13. Walter de Gruyter, 1994.\n[20] S.A. Nazarov and G. Kh. Svirs. Boundary value problems for the biharmonic equation and the iterated Lapla-\ncian in a three-dimensional domain with an edge. Zap. Nauchn. Sem. S.-Peterburg. Otdel. Mat. Inst. Steklov. (POMI), 336(Kraev. Zadachi Mat. Fiz. i Smezh. Vopr. Teor. Funkts. 37):153\u2013198, 276\u2013277, 2006.\n[21] H. Ugail. Partial Differential Equations for Geometric Design. Springer Science & Business Media, 2011. [22] A. Z\u030cen\u0301\u0131\u030csek. Interpolation polynomials on the triangle. Numerische Mathematik, 15:283\u2013296, 1970. [23] S. M. Wise, C. Wang, and J. S. Lowengrub. An energy-stable and convergent finite-difference scheme for the\nphase field crystal equation. SIAM Journal on Numerical Analysis, 47(3):2269\u20132288, 2009.\n[24] S. Wu and J. Xu. Pm interior penalty nonconforming finite element methods for 2m-th order pdes in Rn. arXiv preprint arXiv:1710.07678, 2017. [25] S. Wu and J. Xu. Nonconforming finite element spaces for 2mth order partial differential equations on Rn\nsimplicial grids when m = n + 1. Mathematics of Computation, 88(316):531\u2013551, 2019.\n[26] S. Zhang and Z. Zhang. Invalidity of decoupling a biharmonic equation to two Poisson equations on non-convex\npolygons. Int. J. Numer. Anal. Model., 5(1):73\u201376, 2008.\n\u2020 Wayne State University, Department of Mathematics, Detroit, MI 48202, USA Email address: li@wayne.edu\n\u2021 Multiscale Methods and Dynamics Group, Computer Science and Mathematics Division, Oak\nRidge National Laboratory, Oak Ridge, TN 37831, USA.\nEmail address: yinp@ornl.gov"
        }
    ],
    "title": "A C FINITE ELEMENT ALGORITHM FOR THE SIXTH ORDER PROBLEM WITH SIMPLY SUPPORTED BOUNDARY CONDITIONS",
    "year": 2023
}