{
    "abstractText": "Te presence of these indicators undermines our confdence in the integrity of the article\u2019s content and we cannot, therefore, vouch for its reliability. Please note that this notice is intended solely to alert readers that the content of this article is unreliable. We have not investigated whether authors were aware of or involved in the systematic manipulation of the publication process. Wiley and Hindawi regrets that the usual quality checks did not identify these issues before publication and have since put additional measures in place to safeguard research integrity. We wish to credit our own Research Integrity and Research Publishing teams and anonymous and named external researchers and research integrity experts for contributing to this investigation. Te corresponding author, as the representative of all authors, has been given the opportunity to register their agreement or disagreement to this retraction. We have kept a record of any response received. References",
    "authors": [],
    "id": "SP:2dacab9a5af31683c1a65a9431d6265ee0233ede",
    "references": [
        {
            "authors": [
                "L. Jiang",
                "X. Wang"
            ],
            "title": "Optimization of Online Teaching Quality Evaluation Model Based on Hierarchical PSO-BP Neural Network",
            "venue": "Complexity, vol. 2020, Article ID 6647683, 12 pages, 2020. Hindawi Complexity Volume 2023, Article ID 9846469, 1 page https://doi.org/10.1155/2023/9846469",
            "year": 2020
        }
    ],
    "sections": [
        {
            "heading": "Retraction",
            "text": ""
        },
        {
            "heading": "Retracted: Optimization of Online Teaching Quality Evaluation",
            "text": ""
        },
        {
            "heading": "Model Based on Hierarchical PSO-BP Neural Network",
            "text": ""
        },
        {
            "heading": "Complexity",
            "text": "Received 13 September 2023; Accepted 13 September 2023; Published 14 September 2023\nCopyright \u00a9 2023 Complexity.Tis is an open access article distributed under the Creative Commons Attribution License, which permits unrestricted use, distribution, and reproduction in any medium, provided the original work is properly cited.\nTis article has been retracted by Hindawi following an investigation undertaken by the publisher [1]. Tis investigation has uncovered evidence of one or more of the following indicators of systematic manipulation of the publication process:\n(1) Discrepancies in scope (2) Discrepancies in the description of the research\nreported (3) Discrepancies between the availability of data and\nthe research described (4) Inappropriate citations (5) Incoherent, meaningless and/or irrelevant content\nincluded in the article (6) Peer-review manipulation\nTe presence of these indicators undermines our confdence in the integrity of the article\u2019s content and we cannot, therefore, vouch for its reliability. Please note that this notice is intended solely to alert readers that the content of this article is unreliable. We have not investigated whether authors were aware of or involved in the systematic manipulation of the publication process.\nWiley and Hindawi regrets that the usual quality checks did not identify these issues before publication and have since put additional measures in place to safeguard research integrity.\nWe wish to credit our own Research Integrity and Research Publishing teams and anonymous and named external researchers and research integrity experts for contributing to this investigation.\nTe corresponding author, as the representative of all authors, has been given the opportunity to register their agreement or disagreement to this retraction. We have kept a record of any response received.\nReferences\n[1] L. Jiang and X. Wang, \u201cOptimization of Online Teaching Quality Evaluation Model Based on Hierarchical PSO-BP Neural Network,\u201d Complexity, vol. 2020, Article ID 6647683, 12 pages, 2020.\nHindawi Complexity Volume 2023, Article ID 9846469, 1 page https://doi.org/10.1155/2023/9846469"
        }
    ],
    "title": "Retraction Retracted: Optimization of Online Teaching Quality Evaluation Model Based on Hierarchical PSO-BP Neural Network",
    "year": 2023
}