{
    "abstractText": "We prove that the scaled maximum steady-state waiting time and the scaled maximum steady-state queue length among N GI/GI/1-queues in the N-server fork-join queue, converge to a normally distributed random variable as N \u2192 \u221e. The maximum steady-state waiting time in this queueing system scales around 1 \u03b3 logN , where \u03b3 is determined by the cumulant generating function \u039b of the service distribution and solves the Cram\u00e9rLundberg equation with stochastic service times and deterministic inter-arrival times. This value 1 \u03b3 logN is reached at a certain hitting time. The number of arrivals until that hitting time satisfies the central limit theorem, with standard deviation \u03c3A \u221a \u039b(\u03b3)\u03b3 . By using distributional Little\u2019s law, we can extend this result to the",
    "authors": [
        {
            "affiliations": [],
            "name": "Dennis Schol"
        },
        {
            "affiliations": [],
            "name": "Maria Vlasiou"
        }
    ],
    "id": "SP:726ae3753862ef278aac6db43fbfd3d8b484f83a",
    "references": [
        {
            "authors": [
                "S\u00f8ren Asmussen"
            ],
            "title": "Applied probability and queues, volume",
            "year": 2003
        },
        {
            "authors": [
                "Fran\u00e7ois Baccelli"
            ],
            "title": "Two parallel queues created by arrivals with two demands: The M/G/2 symmetrical case",
            "venue": "Technical report RR\u20130426,",
            "year": 1985
        },
        {
            "authors": [
                "Fran\u00e7ois Baccelli",
                "Armand M. Makowski"
            ],
            "title": "Queueing models for systems with synchronization constraints",
            "venue": "Proceedings of the IEEE,",
            "year": 1989
        },
        {
            "authors": [
                "Amir Dembo",
                "Ofer Zeitouni"
            ],
            "title": "Large deviations techniques and applications, volume 38",
            "venue": "Springer Science & Business Media,",
            "year": 2009
        },
        {
            "authors": [
                "Monroe David Donsker"
            ],
            "title": "An invariance principle for certain probability limit theorems, volume 6",
            "venue": "Memoirs of the American Mathematical Society,",
            "year": 1951
        },
        {
            "authors": [
                "Leopold Flatto",
                "Sann Hahn"
            ],
            "title": "Two parallel queues created by arrivals with two demands I",
            "venue": "SIAM Journal on Applied Mathematics,",
            "year": 1984
        },
        {
            "authors": [
                "Laurens de Haan",
                "Ana Ferreira"
            ],
            "title": "Extreme value theory: an introduction",
            "venue": "Springer Science & Business Media,",
            "year": 2006
        },
        {
            "authors": [
                "Rasoul Haji",
                "Gordon F Newell"
            ],
            "title": "A relation between stationary queue and waiting time distributions",
            "venue": "Journal of Applied Probability,",
            "year": 1971
        },
        {
            "authors": [
                "Stephanus J. de Klein"
            ],
            "title": "Fredholm integral equations in queueing analysis",
            "venue": "PhD thesis, Rijksuniversiteit Utrecht,",
            "year": 1988
        },
        {
            "authors": [
                "Sung-Seok Ko",
                "Richard F. Serfozo"
            ],
            "title": "Response times in M/M/s fork-join networks",
            "venue": "Advances in Applied Probability,",
            "year": 2004
        },
        {
            "authors": [
                "David V Lindley"
            ],
            "title": "The theory of queues with a single server",
            "venue": "In Mathematical Proceedings of the Cambridge Philosophical Society,",
            "year": 1952
        },
        {
            "authors": [
                "Mirjam Meijer",
                "Dennis Schol",
                "Willem van Jaarsveld",
                "Maria Vlasiou",
                "Bert Zwart"
            ],
            "title": "Extreme-value theory for large fork-join queues, with applications to high-tech supply chains",
            "year": 2021
        },
        {
            "authors": [
                "Reinhard Michel"
            ],
            "title": "On the constant in the nonuniform version of the Berry-Ess\u00e9en theorem",
            "venue": "Zeitschrift fu\u0308r Wahrscheinlichkeitstheorie und verwandte Gebiete,",
            "year": 1981
        },
        {
            "authors": [
                "Randolph Nelson",
                "Asser N Tantawi"
            ],
            "title": "Approximate analysis of fork/join synchronization in parallel queues",
            "venue": "IEEE Transactions on Computers,",
            "year": 1988
        },
        {
            "authors": [
                "Dennis Schol",
                "Maria Vlasiou",
                "Bert Zwart"
            ],
            "title": "Large fork-join queues with nearly deterministic arrival and service",
            "venue": "times. Mathematics of Operations Research,",
            "year": 2021
        },
        {
            "authors": [
                "Dennis Schol",
                "Maria Vlasiou",
                "Bert Zwart"
            ],
            "title": "Tail asymptotics for the delay in a brownian fork-join queue",
            "venue": "arXiv preprint arXiv:2208.04796,",
            "year": 2022
        },
        {
            "authors": [
                "Paul E. Wright"
            ],
            "title": "Two parallel processors with coupled inputs",
            "venue": "Advances in Applied Probability,",
            "year": 1992
        }
    ],
    "sections": [
        {
            "text": "ar X\niv :2\n30 9.\n08 37\n3v 1\n[ m\nat h.\nPR ]\n1 5\nSe p\n20 23\nWe prove that the scaled maximum steady-state waiting time and the scaled maximum steady-state queue length among N GI/GI/1-queues in the N-server fork-join queue, converge to a normally distributed random variable as N \u2192 \u221e. The maximum steady-state waiting time in this queueing system scales around 1\n\u03b3 logN ,\nwhere \u03b3 is determined by the cumulant generating function \u039b of the service distribution and solves the Cram\u00e9rLundberg equation with stochastic service times and deterministic inter-arrival times. This value 1\n\u03b3 logN is\nreached at a certain hitting time. The number of arrivals until that hitting time satisfies the central limit theorem, with standard deviation \u03c3A\u221a \u039b\u2032(\u03b3)\u03b3 . By using distributional Little\u2019s law, we can extend this result to the maximum queue length. Finally, we extend these results to a fork-join queue with different classes of servers.\n1 Introduction\nFork-join queues are a useful modeling tool for congestion in complex networks, such as assembly systems, communication networks, and supply chains. Such networks can be large and assembly is only possible upon availability of all parts. Thus, the bottleneck of the system is caused by the slowest production line in the system. This setting motivates us to investigate such delays in a stylized version of a large fork-join queueing system. In this setting, a key quantity of interest is the behavior of the longest queue when the system is in the steady-state situation. Furthermore, we assume that arrival and service processes are general and mutually independent.\nAs we try to model systems with many servers, we are typically interested in the behavior of this random variable as N \u2192 \u221e. In [12], it is shown that maxi\u2264N (Bi(s) + BA(s) \u2212 \u03b2s) is in the domain of attraction of the normal distribution:\nP\n(\nmax i\u2264N\n(Bi(s) +BA(s)\u2212 \u03b2s) > \u03c32\n2\u03b2 logN + x\n\u221a\nlogN\n) N\u2192\u221e\u2212\u2192 P ( \u03c3\u03c3A\u221a 2\u03b2 X > x ) , (1)\nwith X d = N (0, 1), where {Bi(t), t \u2265 0} and {BA(t), t \u2265 0} are Brownian motions with standard deviations \u03c3 and \u03c3A, respectively. We see from the limit in (1) that maxi\u2264N (Bi(s) +BA(s) \u2212 \u03b2s) centers around \u03c3 2\n2\u03b2 logN and\ndeviates with order \u221a logN .\nThis convergence result provides a prediction of the typical delay. In this study, we aim to extend this result to a more general setting. In particular, we investigate the maximum steady-state waiting time among the N servers with a common arrival process maxi\u2264N Wi(\u221e) = maxi\u2264N supk\u22650 \u2211k j=1(Si(j)\u2212A(j)). This expression follows from Lindley\u2019s recursion. Furthermore, we have that both (Si(j), j \u2265 1, 1 \u2264 i \u2264 N) and (A(j), j \u2265 1) are i.i.d. and the inter-arrival times and service times are mutually independent. Thus Si(j) indicates the service time of the j-th customer in queue i, A(j) indicates the inter-arrival time between the (j \u2212 1)-st and the j-th customer. We see that the maximum steady-state wating time is a maximum of N dependent random variables, due to the common arrival process (A(j), j \u2265 1).\nThe earliest literature on fork-join queues focuses on systems with two service stations. Analytic results, such as asymptotics on limiting distributions, can be found in [2, 6, 9, 17]. However, due to the complexity of fork-join queues, these results cannot be expanded to fork-join queues with more than two service stations. Thus, most of the work on fork-join queues with more than two service stations is focused on finding approximations of performance measures. For example, an approximation of the distribution of the response time in M/M/s fork-join queues is given in Ko and Serfozo [10]. Upper and lower bounds for the mean response time of servers, and other performance measures, are given by Nelson, Tantawi [14] and Baccelli, Makowski [3]. These bounds can be used for fork-join queues with large size, but apart from this, there is not much literature on the convergence of the longest queue length in a fork-join queue as N \u2192 \u221e. Some results can be found in [12, 15, 16]. In [12], the same convergence\nresults are given as in this paper, but only for the Brownian fork-join queue, thus this paper extends on these results.\nThis paper is organized as follows. In Section 2, we present our main results; in Theorem 1 we state that the longest steady-state waiting time satisfies a central limit result; in Theorem 2 we show that a similar result holds for the longest queue length, and in Corollary 1 we present a similar result when the service distributions can differ among the different queues. In Section 3 we give an intuition why the results hold and how we prove these. Section 4 is devoted to proofs.\n2 Model\nWe investigate a fork-join queue with N servers. Each of the N servers has the same arrival stream of jobs and works independently from all other servers but with the same service distribution. In this section, we state the main result for the longest steady-state waiting time in Theorem 1. We also show that a similar result holds for the maximum queue length in Lemma 2 and Theorem 2. Furthermore, we extend the result in Theorem 2 to a heterogeneous model in Corollary 1.\nWe now specify some properties of the service times and interarrival times in this fork-join queueing system. First, the sequence of non-negative random variables (Si(j), i \u2265 1, j \u2265 1) are i.i.d. with Si(j) \u223c S, and Si(j) indicating the service time of the j-th subtask in queue i. Furthermore, the sequence of non-negative random variables (A(j), j \u2265 1) are i.i.d. with A(j) \u223c A, E[A(j)] = 1/\u03bb, Var(A(j)) = \u03c32A, and A(j) indicating the interarrival time between the (j \u2212 1)-st and the j-th task. Finally, we have that E[Si(j) \u2212 A(j)] = \u2212\u00b5, with \u00b5 > 0, and (A(j), j \u2265 1) and (Si(j), i \u2265 1, j \u2265 1) are mutually independent.\nWe can now write the cumulative distribution function of the longest steady-state waiting time as the cumulative distribution function of the maximum of N all-time suprema of random walks involving the interarrival and service times.\nLemma 1. For the model given in Section 2 with Wi(1) = 0 for all i \u2264 N , we have that the longest waiting time in steady state satisfies\nmax i\u2264N Wi(\u221e) d= max i\u2264N sup k\u22650\nk \u2211\nj=1\n(Si(j)\u2212A(j)). (2)\nProof. Using Lindley\u2019s recursion [11], we can write the waiting time of tasks in front of server i as\nWi(n) = sup 0\u2264k\u2264n\nn \u2211\nj=k+1\n(Si(j)\u2212A(j)).\nThus, the longest steady steady-state waiting time satisfies.\nmax i\u2264N Wi(n) = max i\u2264N sup 0\u2264k\u2264n\nn \u2211\nj=k+1\n(Si(j)\u2212A(j)).\nWe have that P(max\ni\u2264N Wi(\u221e) \u2265 x) = lim n\u2192\u221e P(max i\u2264N Wi(n) \u2265 x).\nBecause,\nmax i\u2264N\nWi(n) d = max\ni\u2264N sup\n0\u2264k\u2264n\nk \u2211\nj=1\n(Si(j)\u2212A(j)), (3)\nwe obtain the lemma by using the monotone convergence theorem.\nIn order to be able to prove convergence of the longest steady-state waiting time, we need some additional structure for the service-time distribution. We define\n\u039b(\u03b8) := log(E[exp(\u03b8(S \u2212 1/\u03bb)]). (4)\nMoreover, we write D(\u039b) := {\u03b8 : \u039b(\u03b8) < \u221e} and D\u25e6(\u039b) as the interior of D(\u039b).\nAssumption 1. We assume there exists a \u03b3 > 0 such that\n1. \u039b(\u03b3) = 0,\n2. \u03b3 \u2208 D\u25e6(\u039b). The first assumption indicates that the random variable S\u22121/\u03bb has a tail that is bounded by an exponential. The second assumption is needed for our proofs. In [4, Ex. 2.2.24], it is namely stated that when \u03b3 \u2208 D\u25e6(\u039b), \u039b is infinitely differentiable at the point \u03b3. For example, when S \u2212 1/\u03bb has density function fS\u22121/\u03bb(x) = c1 exp(\u2212x)/(1 + x2) for x > 0, where c1, \u03bb are chosen such that P(S \u2212 1/\u03bb < x) is a cumulative distribution function and \u03b3 = 1, then the first assumption is satisfied but the second is not, since \u039b(\u03b8) is not differentiable at \u03b8 = \u03b3. Our main result is given in Theorem 1.\nTheorem 1. For the model in Section 2 where the sequence of service times (Si(j), i \u2265 1, j \u2265 1) satisfies Assumption 1, we have that\nmaxi\u2264N Wi(\u221e)\u2212 1\u03b3 logN\u221a logN d\u2212\u2192 \u03c3A\u221a \u039b\u2032(\u03b3)\u03b3 X, (5)\nwith X \u223c N (0, 1), as N \u2192 \u221e. Lemma 2 (Distributional Little\u2019s Law). Let for t \u2265 0, NA(t) indicate the number of arrivals up to time t, where the interarrival times are i.i.d. with A(j) \u223c A. Then\nmax i\u2264N\nQi(\u221e) d= NA (\nmax i\u2264N\nWi(\u221e) ) . (6)\nProof. In [8], a short proof is given that for the GI/GI/1 queue under the FCFS policy, Q d = NA(W ). We follow the same steps to prove that maxi\u2264N Qi(\u221e) d= NA (maxi\u2264N Wi(\u221e)). First, let t > 0 be given such that the system is in steady state. Furthermore, let W\u0303i(j) be the waiting time of the i-th subtask of the j-th task numbered backward in time, beginning at time t. Thus, W\u0303i(1) is the waiting time of the i-th subtask of the last task arriving before time t. Now, let the random variable T (j) be such that t\u2212 T (j) is the arrival time of the j-th task numbered backward in time. Then, observe that the event {maxi\u2264N Qi(t) \u2265 j} is equivalent to the event that at least one subtask of the j-th task numbered backward in time is still in the queue at time t. Thus,\n{\nmax i\u2264N\nQi(t) \u2265 j } = {\nmax i\u2264N\nW\u0303i(j) \u2265 T (j) } ,\nfor j \u2265 1. The event {T (j) \u2264 x} is equivalent to the event that the number of arrivals during the period [t\u2212 x, t) is larger than or equal to j. The arrival process is a stationary process, thus the event {T (j) \u2264 x} is equivalent to the event {NA(x) \u2265 j}. Additionally, the random variables maxi\u2264N W\u0303i(j) and T (j) are independent. Therefore,\n{\nmax i\u2264N\nQi(t) \u2265 j } = { NA (\nmax i\u2264N\nW\u0303i(j) ) \u2265 j } .\nAs the system is in steady state, we get that {\nmax i\u2264N\nQi(\u221e) \u2265 j } = { NA (\nmax i\u2264N\nW\u0303i(\u221e) ) \u2265 j } .\nNow, combining the result in Lemma 2 with the main result in Theorem 1, we can find a similar convergence result for the maximum queue length in steady state.\nTheorem 2. For the model in Section 2 where the sequence of service times (Si(j), i \u2265 1, j \u2265 1) satisfies Assumption 1, we have that\nmaxi\u2264N Qi(\u221e)\u2212 \u03bb\u03b3 logN\u221a logN d\u2212\u2192 \u221a \u03bb2\u03c32A \u039b\u2032(\u03b3)\u03b3 + \u03bb3\u03c32A \u03b3 X, (7)\nwith X \u223c N (0, 1), as N \u2192 \u221e.\nProof. Let A\u0302(j) \u223c A, let (A\u0302(j), j \u2265 1) be mutually independent, and A\u0302(j) and maxi\u2264N Wi(\u221e) be mutually independent for all j \u2265 1. Then, using Lemma 2 and Theorem 1, we get that\nP\n(\nmax i\u2264N\nQi(\u221e) \u2264 \u03bb\n\u03b3 logN + x\n\u221a\nlogN\n)\n= P\n(\nNA\n(\nmax i\u2264N\nWi(\u221e) ) \u2264 \u230a\u03bb\n\u03b3 logN + x\n\u221a\nlogN \u230b\n)\n= P\n\n  max i\u2264N Wi(\u221e) \u2264\n\u230a\n\u03bb \u03b3 logN+x\n\u221a logN \u230b\n\u2211\nj=1\nA\u0302(j)\n\n \n= P\n\n  maxi\u2264N Wi(\u221e)\u2212 1\u03b3 logN\u221a logN \u2264 \u2211\n\u230a\n\u03bb \u03b3 logN+x\n\u221a logN \u230b\nj=1 A\u0302(j)\u2212 1\u03b3 logN\u221a logN\n\n \nN\u2192\u221e\u2212\u2192 P ( \u03c3A \u221a\n\u039b\u2032(\u03b3)\u03b3 X1 \u2264\n\u03c3A \u221a \u03bb\u221a\n\u03b3 X2 +\nx\n\u03bb\n)\n,\nwith X1, X2 independent and standard normally distributed, this convergence holds, as (A\u0302(j), j \u2265 1) and maxi\u2264N Wi(\u221e) are independent. Thus, the theorem follows.\nUntil now, we considered the fork-join queueing system where each server has the same service distribution. In Corollary 1, we show that we can extend the convergence of the longest steady-state waiting time to a more heterogeneous setting. We examine a fork-join queueing system with N servers, where each of these N servers belongs to one of K classes. Additionally, we assume that the size of class k with k \u2208 {1, . . . ,K} grows as \u03b1kN , as N becomes large, with 0 < \u03b1k < 1.\nCorollary 1. Let K \u2208 N, let k = 1, . . . ,K, furthermore, take an increasing sequence of integers given by M\n(N) 0 ,M (N) 1 ,M (N) 2 , . . . ,M (N) K > 0 with M (N) 0 = 1, M (N) K = N , and M (N) k \u2212 M (N) k\u22121 \u2208 N. Moreover, (M (N) k \u2212\nM (N) k\u22121)/N N\u2192\u221e\u2212\u2192 \u03b1k \u2208 (0, 1] with \u2211K k=1 \u03b1k = 1. Let (Si(j), j \u2265 1,M (N) k\u22121 < i \u2264 M (N) k ) be i.i.d. with Si(j) \u223c Sk, (A(j), j \u2265 1) be i.i.d. with A(j) \u223c A, E[A(j)] = 1/\u03bb, Var(A(j)) = \u03c32A, E[Si(j) \u2212 A(j)] = \u2212\u00b5k with \u00b5k > 0, \u039bk(\u03b8) = log(E[exp(\u03b8(Sk \u2212 1/\u03bb)]), \u039bk satisfies Assumption 1. Furthermore, Si1(j1) and Si2(j2) are mutually independent for all i1, i2, j1, j2. Let K\n\u2217 = argmin{\u03b3k, k = 1, . . . ,K}. We assume that |K\u2217| = 1 and k\u2217 \u2208 K\u2217. Then,\nmaxi\u2264N Wi(\u221e)\u2212 1\u03b3k\u2217 logN\u221a logN d\u2212\u2192 \u03c3A\u221a \u039b\u2032k\u2217(\u03b3k\u2217)\u03b3k\u2217 X, (8)\nwith X \u223c N (0, 1), as N \u2192 \u221e. Proof. We prove this corollary by giving an asymptotically sharp lower and upper bound. First, observe that\nmax i\u2264N Wi(\u221e) \u2265st. max M (N)\nk\u2217\u22121 <i\u2264M(N) k\u2217\nsup k\u22650\nk \u2211\nj=1\n(Si(j)\u2212A(j)),\nwith X \u2265st. Y meaning that P(X \u2265 x) \u2265 P(Y \u2265 x) for all x. Applying the result from Theorem 1 on the lower bound results in (8). By using the union bound we get the following upper bound:\nP\n(\nmax i\u2264N\nWi(\u221e) \u2265 1\n\u03b3k\u2217 logN + x\n\u221a\nlogN\n)\n=\nK \u2211\nl=1\nP\n\n max M\n(N) l\u22121<i\u2264M (N) l\nsup k\u22650\nk \u2211\nj=1\n(Si(j)\u2212A(j)) \u2265 1\n\u03b3k\u2217 logN + x\n\u221a\nlogN\n\n.\nWhen l 6= k\u2217, we get after applying the results from Theorem 1 that\nP\n\n max M\n(N) l\u22121<i\u2264M (N) l\nsup k\u22650\nk \u2211\nj=1\n(Si(j)\u2212A(j)) \u2265 1\n\u03b3l logN + x\n\u221a\nlogN\n\n N\u2192\u221e\u2212\u2192 1\u2212 \u03a6 ( \u221a \u039b\u2032l(\u03b3l)\u03b3l \u03c3A x ) ,\nwith \u03a6 the cumulative distribution function of a standard normal random variable. Because \u03b3k\u2217 < \u03b3l we get that\nP\n\n max M\n(N) l\u22121<i\u2264M (N) l\nsup k\u22650\nk \u2211\nj=1\n(Si(j)\u2212A(j)) \u2265 1\n\u03b3K\u2217 logN + x\n\u221a\nlogN\n\n N\u2192\u221e\u2212\u2192 0.\nThe corollary follows.\nRemark 1. In Corollary 1 we assume that |K\u2217| = 1. The situation that |K\u2217| > 1 follows analogously. Assume for instance that |K\u2217| = 2, then we can introduce a new random variable S\u0303 such that S\u0303i(j) \u223c S1 with probability \u03b1 and S\u0303i(j) \u223c S2 with probability 1 \u2212 \u03b1, such that \u03b31 = \u03b32 = \u03b3K\u2217 . As N is large enough this fork-join queueing system behaves analogous to the original fork-join queue, and for this system |K\u2217| = 1.\nWe give the proofs of the convergence of the longest steady-state waiting time in Section 4. First, we give a heuristic explanation of why the convergence result in Theorem 1 is true, and we illustrate the structure of the proof.\n3 Heuristic analysis\nTo prove Theorem 1, we analyze lower and upper bounds of the tail probability of the longest steady-state waiting time among the N servers P(maxi\u2264N Wi(\u221e) > 1\u03b3 logN+x \u221a logN) and we show that these lower and upper bounds converge to the same limit as N \u2192 \u221e. The longest steady-state waiting time has the form maxi\u2264N Wi(\u221e) d= supk\u22650 maxi\u2264N \u2211k j=1(Si(j) \u2212 A(j)). Thus the longest steady-state waiting time is the all-time supremum of the maximum of N random walks. For all processes (X(t), t \u2265 0), we have for all t > 0\nP\n(\nsup s>0 X(s) > x\n)\n\u2265 P(X(t) > x). (9)\nFurthermore, due to the union bound, we have for all 0 < t1 < t2 that\nP\n(\nsup s>0 X(s) > x\n) \u2264 P (\nsup 0<s<t1 X(s) > x\n)\n+ P\n(\nsup t1\u2264s<t2 X(s) > x\n)\n+ P\n(\nsup s\u2265t2 X(s) > x\n)\n. (10)\nWe use these types of lower and upper bounds to prove Theorem 1. Obviously, not all choices of t, t1, and t2 give sharp bounds. We can however make an educated guess about which choices will give the sharpest bounds. Let us first replace the sequence of random variables (A(j), j \u2265 1) with their expectation 1/\u03bb. Thus, we look at a simplified fork-join queue with deterministic arrivals. Because the arrivals are deterministic, the waiting times are mutually independent, and we are able to use standard extreme-value theory. We know from the Cram\u00e9r-Lundberg approximation [1, Ch. XIII, Thm. 5.2] that P(supk\u22650 \u2211k j=1(Si(j) \u2212 1/\u03bb) > x) \u223c C exp(\u2212\u03b3x), as x \u2192 \u221e, with 0 < C < 1. Thus, P(supk\u22650 \u2211k\nj=1(Si(j) \u2212 1/\u03bb) > 1\u03b3 logN) \u223c C/N , as N \u2192 \u221e. Now we can conclude by using basic extreme-value results; see [7, Thm. 5.4.1, p. 188], that\nmaxi\u2264N supk\u22650 \u2211k j=1 ( Si(j)\u2212 1\u03bb )\nlogN\nP\u2212\u2192 1 \u03b3 ,\nas N \u2192 \u221e. Thus, we know that maxi\u2264N supk\u22650 \u2211k j=1(Si(j)\u22121/\u03bb) centers around 1\u03b3 logN . In order to find suitable lower and upper bounds of the form as given in (9) and (10), we need to estimate the hitting time\n\u03c4 (N) := inf\n\n\n k \u2265 0 : max i\u2264N\nk \u2211\nj=1\n(\nSi(j)\u2212 1\n\u03bb\n)\n\u2265 1 \u03b3 logN\n\n\n\n.\nAs mentioned before, we have that P(supk\u22650 \u2211k j=1 ( Si(j)\u2212 1\u03bb ) > 1\u03b3 logN) \u223c C/N as N \u2192 \u221e. Thus, a good estimate \u03c4\u0302 (N) for \u03c4 (N) should also satisfy the property that\nlim inf N\u2192\u221e N P\n\n\n\u03c4\u0302 (N) \u2211\nj=1\n(\nSi(j)\u2212 1\n\u03bb\n)\n> 1\n\u03b3 logN\n\n > 0 (11)\nand\nlim sup N\u2192\u221e N P\n\n\n\u03c4\u0302 (N) \u2211\nj=1\n(\nSi(j)\u2212 1\n\u03bb\n)\n> 1\n\u03b3 logN\n\n < \u221e. (12)\nNow, by using Cram\u00e9r\u2019s theorem and by using the fact that \u039b is at least twice differentiable at \u03b3, we know that\nlim n\u2192\u221e\n1 n log\n\nP\n\n\nn \u2211\nj=1\n(\nSi(j)\u2212 1\n\u03bb\n)\n\u2265 nx\n\n\n\n = \u2212\u039b\u2217(x), (13)\nfor all x > E[Si(j)\u22121/\u03bb] with \u039b\u2217(x) = supt\u2208R(tx\u2212\u039b(t)); see [1, Ch. XIII, Thm. 2.1 (2.3)]. We write \u03c4\u0302 (N) = c\u0302 logN . Then we can conclude from Equation (13) that\nlim N\u2192\u221e\n1\nlogN log\n\nP\n\n\n\u230ac\u0302 logN\u230b \u2211\nj=1\n(\nSi(j)\u2212 1\n\u03bb\n)\n\u2265 xc\u0302 logN\n\n\n\n = \u2212\u039b\u2217(x)c\u0302. (14)\nThus, in order to find a good estimate \u03c4\u0302 (N) for the hitting time \u03c4 (N) we need to solve two equations. First, xc\u0302 = 1/\u03b3, because we know that the longest steady-state waiting time under deterministic arrivals is approximately equal to 1 \u03b3 logN . Therefore the expression xc\u0302 logN in (14) should be the same as 1 \u03b3 logN . Second, \u2212\u039b\u2217(x)c\u0302 = \u22121, because we know from (11), (12), and (14) that for large N\nP\n\n\n\u230ac\u0302 logN\u230b \u2211\nj=1\n(\nSi(j)\u2212 1\n\u03bb\n)\n\u2265 xc\u0302 logN\n\n \u2248 1 N = exp(\u2212\u039b\u2217(x)c\u0302 logN).\nCombining these two equations gives c\u0302 = 1\u039b\u2032(\u03b3)\u03b3 and x = \u039b \u2032(\u03b3). Clearly, xc\u0302 = 1/\u03b3, and\n\u039b\u2217(x)c\u0302 = \u039b\u2217(\u039b\u2032(\u03b3))\n\u03b3\u039b\u2032(\u03b3) .\nFrom [4, Lem. 2.2.5(c)], we know that \u039b\u2217(\u039b\u2032(\u03b3)) = \u03b3\u039b\u2032(\u03b3), thus indeed, \u039b\u2217(x)c\u0302 = 1. Finally, we can conclude that \u03c4\u0302 (N) = c\u0302 logN = 1\u03b3\u039b\u2032(\u03b3) logN . Obviously, in order to be a good estimation for a hitting time we need to have that \u039b\u2032(\u03b3) > 0. This is the case because \u039b(\u03b8) is convex; see [1, Ch. XIII, Thm. 5.1]. Until this point, we know the first-order scaling of the largest of N steady-state waiting times with deterministic arrivals, and we can give an estimation of the hitting time of this value. Now, we can use these results to obtain a second-order convergence result for the longest steady-state waiting time with stochastic arrivals. Following the analysis above together with the lower bound in (9), we see that\nP\n(\nmaxi\u2264N Wi(\u221e) \u2212 1\u03b3 logN\u221a logN \u2265 x )\n\u2265 P\n\n \nmaxi\u2264N sup( 1 \u039b\u2032(\u03b3)\u03b3 \u2212\u01eb ) logN<k< 1 \u039b\u2032(\u03b3)\u03b3 logN\n\u2211k j=1(Si(j)\u2212A(j))\u2212 1\u03b3 logN\n\u221a logN\n\u2265 x\n\n  , (15)\nwith \u01eb > 0 and small. In Lemma 3, we prove that the right-hand side in (15) converges to a function that is close to the tail probability of a normally distributed random variable. Furthermore, we show in Lemmas 4, 5, and 6, that this lower bound is sharp. To achieve this, we first divide the supremum over all positive numbers in the random variable maxi\u2264N Wi(\u221e) in three parts. After that, we take the supremum over the intervals [ 0, ( 1 \u039b\u2032(\u03b3)\u03b3 \u2212 \u01eb ) logN ]\n, ((\n1 \u039b\u2032(\u03b3)\u03b3 \u2212 \u01eb\n) logN, (\n1 \u039b\u2032(\u03b3)\u03b3 + \u01eb\n) logN ] , and ((\n1 \u039b\u2032(\u03b3)\u03b3 + \u01eb\n) logN,\u221e ) , with \u01eb > 0 and small. Consequently, we\nshow that the tail probabilities of the first and third suprema of the maximum of N random walks asymptotically vanish, while\nP\n\nmax i\u2264N sup (\n1 \u039b\u2032(\u03b3)\u03b3\n\u2212\u01eb ) logN<k< (\n1 \u039b\u2032(\u03b3)\u03b3\n+\u01eb ) logN\nk \u2211\nj=1\n(Si(j)\u2212A(j)) > 1\n\u03b3 logN + x\n\u221a\nlogN\n\n\nconverges to a limit close to the lower bound as N \u2192 \u221e.\nRemark 2. The lower bound presented in Equation (9) gives us information about the convergence rate of the\nresult in Theorem 1. From the Berry-Ess\u00e9en theorem [13], we know that when 1\u221a n \u2211n i=1 Xi d\u2212\u2192 X \u223c N (0, 1), the convergence rate is of order 1/ \u221a n. Thus, the lower bound in (9) shows that the convergence rate is of order 1/ \u221a logN .\n4 Proofs\nLemma 3. Given the model in Section 2 where the sequence of service times (Si(j), i \u2265 1, j \u2265 1) satisfies Assumption 1, 0 < \u01eb < 1\u039b\u2032(\u03b3)\u03b3 , t (N) 1 = ( 1 \u039b\u2032(\u03b3)\u03b3 \u2212 \u01eb ) logN , and t (N) 2 = 1 \u039b\u2032(\u03b3)\u03b3 logN , then for all x \u2208 R, we have that\nlim inf N\u2192\u221e P\n\nmax i\u2264N sup t (N) 1 <k<t (N) 2\nk \u2211\nj=1\n(Si(j)\u2212A(j)) > 1\n\u03b3 logN + x\n\u221a\nlogN\n\n\n\u2265 P (\n\u03c3A\n\u221a\n1\n\u039b\u2032(\u03b3)\u03b3 \u2212 \u01ebX1 \u2212 \u03c3A\n\u221a \u01eb |X2| > x\n)\n, (16)\nwith X1, X2 \u223c N (0, 1) and independent. Proof. In order to prove this convergence result, we first bound\nmax i\u2264N sup t (N) 1 <k<t (N) 2\nk \u2211\nj=1\n(Si(j)\u2212A(j)) \u2265 max i\u2264N sup t (N) 1 <k<t (N) 2\nk \u2211\nj=1\n(\nSi(j)\u2212 1\n\u03bb\n)\n+ inf t (N) 1 <k<t (N) 2\nk \u2211\nj=1\n(\n1 \u03bb \u2212A(j)\n)\n.\nWe treat the terms on the right-hand side separately. We first prove that\ninf t (N) 1 <k<t (N) 2\n\u2211k j=1\n(\n1 \u03bb \u2212A(j)\n)\n\u221a logN\nd\u2212\u2192 \u03c3A \u221a 1\n\u039b\u2032(\u03b3)\u03b3 \u2212 \u01ebX1 \u2212 \u03c3A\n\u221a \u01eb |X2| , (17)\nas N \u2192 \u221e. Afterwards, we prove that\nmaxi\u2264N supt(N)1 <k<t (N) 2\n\u2211k j=1\n( Si(j)\u2212 1\u03bb ) \u2212 1\u03b3 logN\u221a logN P\u2212\u2192 0, (18)\nas N \u2192 \u221e. The first convergence result follows from Donsker\u2019s theorem. The left-hand side in (17) is an infimum of a random walk with drift 0. Then for (B(t), t \u2265 0) a Brownian motion with drift 0 and standard deviation 1, by using Donsker\u2019s theorem [5] and the fact that the infimum is a continuous functional, we obtain that\nP\n\n\ninf t (N) 1 <k<t (N) 2\n\u2211k j=1( 1 \u03bb \u2212A(j))\u221a\nlogN > x\n\n N\u2192\u221e\u2212\u2192 P\n\n inf (\n1 \u039b\u2032(\u03b3)\u03b3\n\u2212\u01eb )\n<s< 1 \u039b\u2032(\u03b3)\u03b3\n\u03c3AB(s) > x\n\n.\nFurthermore, we can rewrite\ninf 1\n\u039b\u2032(\u03b3)\u03b3 \u2212\u01eb<s< 1 \u039b\u2032(\u03b3)\u03b3\n\u03c3AB(s) d = \u03c3AB\n(\n1 \u039b\u2032(\u03b3)\u03b3 \u2212 \u01eb ) \u2212 inf 0<s<\u01eb \u03c3AB\u0303(s),\nwhere B\u0303 is an independent copy of B. Obviously, we have that \u03c3AB ( 1 \u039b\u2032(\u03b3)\u03b3 \u2212 \u01eb ) d = \u03c3A \u221a 1 \u039b\u2032(\u03b3)\u03b3 \u2212 \u01ebX1 with X1 \u223c N (0, 1). Because inf0<s<\u01eb \u03c3AB\u0303(s) d= \u03c3A \u221a \u01eb|X2|, with X2 \u223c N (0, 1), we have that the limit in (17) follows.\nIn order to prove the second convergence result, we define for A \u2208 Fk, with {Fk, k \u2265 1} the natural filtration, the probability measure\nPi(A) := E\n\nexp\n \u03b3 k \u2211\nj=1\n(\nSi(j)\u2212 1\n\u03bb\n)\n\n 1(A)\n\n ;\nsee [1, Ch. XIII, Par. 3]. Now, we know that\nEi\n[\nSi(j)\u2212 1\n\u03bb\n]\n= E\n[(\nSi(j)\u2212 1\n\u03bb\n)\nexp\n(\n\u03b3\n(\nSi(j)\u2212 1\n\u03bb\n))]\n= \u039b\u2032(\u03b3).\nThus, by checking the conditions in [1, Ch. XIII, Thm. 5.6], we see that\nP\n\n sup 0\u2264k<t(N)2\nk \u2211\nj=1\n(\nSi(j)\u2212 1\n\u03bb\n)\n\u2265 1 \u03b3 logN + x \u221a logN\n\n\n= C exp\n( \u2212 \u03b3 ( 1\n\u03b3 logN + x\n\u221a\nlogN\n))\n\u03a6\n( \u2212 x \u221a \u03b3\u039b\u2032(\u03b3) \u221a\n\u039b\u2032\u2032(\u03b3)\n)\n(1 + o(1)). (19)\nWith the same approach, we get from [1, Ch. XIII, Thm. 5.6] that\nP\n\n sup 0\u2264k<t(N)1\nk \u2211\nj=1\n(\nSi(j)\u2212 1\n\u03bb\n)\n\u2265 1 \u03b3 logN + x \u221a logN\n\n = o\n(\nC exp\n( \u2212 \u03b3 ( 1\n\u03b3 logN + x\n\u221a\nlogN\n)))\n, (20)\nas N \u2192 \u221e, for all x \u2208 R. By applying the union bound, we get that\nP\n\n sup 0\u2264k<t(N)2\nk \u2211\nj=1\n(\nSi(j)\u2212 1\n\u03bb\n)\n\u2265 1 \u03b3 logN + x \u221a logN\n\n\n\u2264 P\n\n sup 0\u2264k<t(N)1\nk \u2211\nj=1\n(\nSi(j)\u2212 1\n\u03bb\n)\n\u2265 1 \u03b3 logN + x \u221a logN\n\n+ P\n\n sup t (N) 1 <k<t (N) 2\nk \u2211\nj=1\n(\nSi(j)\u2212 1\n\u03bb\n)\n\u2265 1 \u03b3 logN + x \u221a logN\n\n\n\u2264 P\n\n sup 0\u2264k<t(N)1\nk \u2211\nj=1\n(\nSi(j)\u2212 1\n\u03bb\n)\n\u2265 1 \u03b3 logN + x \u221a logN\n\n+ P\n\n sup 0\u2264k<t(N)2\nk \u2211\nj=1\n(\nSi(j)\u2212 1\n\u03bb\n)\n\u2265 1 \u03b3 logN + x \u221a logN\n\n.\nWe can conclude from these bounds, together with (19) and (20) that\nP\n\n sup t (N) 1 <k<t (N) 2\nk \u2211\nj=1\n(\nSi(j)\u2212 1\n\u03bb\n)\n\u2265 1 \u03b3 logN + x \u221a logN\n\n\n= C exp\n( \u2212 \u03b3 ( 1\n\u03b3 logN + x\n\u221a\nlogN\n))\n\u03a6\n( \u2212 x \u221a \u03b3\u039b\u2032(\u03b3) \u221a\n\u039b\u2032\u2032(\u03b3)\n)\n(1 + o(1)). (21)\nBy using this expression it is easy to derive that for x > 0\nP\n\nmax i\u2264N sup t (N) 1 <k<t (N) 2\nk \u2211\nj=1\n(\nSi(j)\u2212 1\n\u03bb\n)\n\u2264 1 \u03b3 logN + x \u221a logN\n\n\n= P\n\n sup t (N) 1 <k<t (N) 2\nk \u2211\nj=1\n(\nSi(j)\u2212 1\n\u03bb\n)\n\u2264 1 \u03b3 logN + x \u221a logN\n\n\nN\nN\u2192\u221e\u2212\u2192 1.\nSimilarly, for x < 0,\nP\n\nmax i\u2264N sup t (N) 1 <k<t (N) 2\nk \u2211\nj=1\n(\nSi(j)\u2212 1\n\u03bb\n)\n\u2264 1 \u03b3 logN + x \u221a logN\n\n\n= P\n\n sup t (N) 1 <k<t (N) 2\nk \u2211\nj=1\n(\nSi(j)\u2212 1\n\u03bb\n)\n\u2264 1 \u03b3 logN + x \u221a logN\n\n\nN\nN\u2192\u221e\u2212\u2192 0.\nCombining these two results gives us the limit in (18). Finally, the convergence result in (16) follows from the two limits in (17) and (18).\nLemma 4. Given the model in Section 2 where the sequence of service times (Si(j), i \u2265 1, j \u2265 1) satisfies Assumption 1, t\n(N) 1 =\n(\n1 \u039b\u2032(\u03b3)\u03b3 \u2212 \u01eb\n)\nlogN , \u03b4 = \u03b41\u039b\u2032(\u03b3)\u03b3 + \u03b42 with \u03b41,2 > 0 and small, and \u01eb = \u03b4 1/4, then for all x \u2208 R, we have\nthat\nP\n\nmax i\u2264N sup 0\u2264k<t(N)1\nk \u2211\nj=1\n(Si(j)\u2212A(j)) > 1\n\u03b3 logN + x\n\u221a\nlogN\n\n N\u2192\u221e\u2212\u2192 0. (22)\nProof. We derive upper bounds for the left-hand side of (22) that converge to 0 as N \u2192 \u221e. We get by using the subadditivity property of the sup operator and the union bound that\nP\n\nmax i\u2264N sup 0\u2264k<t(N)1\nk \u2211\nj=1\n(Si(j)\u2212A(j)) > 1\n\u03b3 logN\n\n (23)\n\u2264 P\n\nmax i\u2264N sup 0\u2264k<t(N)1\nk \u2211\nj=1\n(\nSi(j)\u2212 1\n\u03bb + \u03b41\n)\n>\n(\n1 \u03b3 \u2212 \u03b42\n)\nlogN\n\n (24)\n+ P\n\nsup k\u22650\nk \u2211\nj=1\n(\n1 \u03bb \u2212 \u03b41 \u2212A(j)\n)\n> \u03b42 logN + x \u221a logN\n\n. (25)\nFirst, because E[ 1\u03bb \u2212 \u03b41 \u2212A(j)] < 0, we get that\nP\n\nsup k\u22650\nk \u2211\nj=1\n(\n1 \u03bb \u2212 \u03b41 \u2212A(j)\n)\n> \u03b42 logN + x \u221a logN\n\n N\u2192\u221e\u2212\u2192 0.\nSecond, we can bound the term in (24) as follows;\nP\n\nmax i\u2264N sup 0\u2264k<t(N)1\nk \u2211\nj=1\n(\nSi(j)\u2212 1\n\u03bb + \u03b41\n)\n>\n(\n1 \u03b3 \u2212 \u03b42\n)\nlogN\n\n\n\u2264 P\n\nmax i\u2264N sup 0\u2264k<t(N)1\nk \u2211\nj=1\n(\nSi(j)\u2212 1\n\u03bb\n)\n>\n(\n1 \u03b3 \u2212 \u03b41 \u039b\u2032(\u03b3)\u03b3 \u2212 \u03b42\n)\nlogN\n\n.\nNow, we can bound this further to\nP\n\nmax i\u2264N sup 0\u2264k<t(N)1\nk \u2211\nj=1\n(\nSi(j)\u2212 1\n\u03bb\n)\n>\n(\n1 \u03b3 \u2212 \u03b41 \u039b\u2032(\u03b3)\u03b3 \u2212 \u03b42\n)\nlogN\n\n\n\u2264 \u230at(N)1 \u230b \u2211\nk=0\nN P\n\n\nk \u2211\nj=1\n(\nSi(j)\u2212 1\n\u03bb\n)\n>\n(\n1 \u03b3 \u2212 \u03b41 \u039b\u2032(\u03b3)\u03b3 \u2212 \u03b42\n)\nlogN\n\n.\nBy using Chernoff\u2019s bound we obtain that for \u039b(\u03b8) < \u221e\n\u230at(N)1 \u230b \u2211\nk=0\nN P\n\n\nk \u2211\nj=1\n(\nSi(j)\u2212 1\n\u03bb\n)\n>\n(\n1 \u03b3 \u2212 \u03b41 \u039b\u2032(\u03b3)\u03b3 \u2212 \u03b42\n)\nlogN\n\n (26)\n\u2264 N \u230at(N)1 \u230b \u2211\nk=0\nexp(k\u039b(\u03b8)) exp\n( \u2212 \u03b8 ( 1 \u03b3 \u2212 \u03b41 \u039b\u2032(\u03b3)\u03b3 \u2212 \u03b42 ) logN )\n= N \u22121 + exp\n( (\u230at(N)1 \u230b+ 1)\u039b(\u03b8) )\nexp(\u039b(\u03b8)) \u2212 1 exp ( \u2212 \u03b8 ( 1 \u03b3 \u2212 \u03b41 \u039b\u2032(\u03b3)\u03b3 \u2212 \u03b42 ) logN ) . (27)\nNow,\nlog\n(\nN \u22121+exp\n( (\u230at(N)1 \u230b+1)\u039b(\u03b8) )\nexp(\u039b(\u03b8))\u22121 exp\n( \u2212 \u03b8 (\n1 \u03b3 \u2212 \u03b41\u039b\u2032(\u03b3)\u03b3 \u2212 \u03b42\n)\nlogN\n))\nlogN\nN\u2192\u221e\u2212\u2192 1\u2212 ( \u03b8 ( 1 \u03b3 \u2212 \u03b41 \u039b\u2032(\u03b3)\u03b3 \u2212 \u03b42 ) \u2212 ( 1 \u039b\u2032(\u03b3)\u03b3 \u2212 \u01eb ) \u039b(\u03b8) ) .\nIn order to make the bound in (27) as sharp as possible, we need to choose a convenient \u03b8. The choice of \u03b8 that gives the sharpest bound maximizes the function \u03b8 (\n1 \u03b3 \u2212 \u03b41\u039b\u2032(\u03b3)\u03b3 \u2212 \u03b42\n) \u2212 (\n1 \u039b\u2032(\u03b3)\u03b3 \u2212 \u01eb\n)\n\u039b(\u03b8). We have that \u03b4 = \u03b41\u039b\u2032(\u03b3)\u03b3 + \u03b42\nand \u01eb = \u03b41/4. Furthermore, we choose \u03b8 = \u03b3 + \u221a \u03b4. This gives us a sharp enough bound in (27). We obviously have that\nsup \u03b7\u2208R\n(\n\u03b7\n(\n1 \u03b3 \u2212 \u03b4 ) \u2212 ( 1 \u039b\u2032(\u03b3)\u03b3 \u2212 \u03b41/4 ) \u039b(\u03b7) ) \u2265 ( (\u03b3 + \u221a \u03b4) ( 1 \u03b3 \u2212 \u03b4 ) \u2212 ( 1 \u039b\u2032(\u03b3)\u03b3 \u2212 \u03b41/4 ) \u039b(\u03b3 + \u221a \u03b4) ) .\nThe first order Taylor series of \u039b(\u03b3 + \u221a \u03b4) around \u03b3 gives\n\u039b(\u03b3 + \u221a \u03b4) = \u039b(\u03b3) + \u221a \u03b4\u039b\u2032(\u03b3) +O(\u03b4) = \u221a \u03b4\u039b\u2032(\u03b3) +O(\u03b4).\nThus, (\n(\u03b3 + \u221a \u03b4) ( 1 \u03b3 \u2212 \u03b4 ) \u2212 ( 1 \u039b\u2032(\u03b3)\u03b3 \u2212 \u03b41/4 ) \u039b(\u03b3 + \u221a \u03b4) ) = 1 + \u03b43/4\u039b\u2032(\u03b3) +O(\u03b4) > 1,\nfor \u03b4 small enough. Thus the expression in (27) is upper bounded by the term N\u2212\u03b4 3/4\u039b\u2032(\u03b3)\u2212O(\u03b4) N\u2192\u221e\u2212\u2192 0.\nLemma 5. Given the model in Section 2 where the sequence of service times (Si(j), i \u2265 1, j \u2265 1) satisfies Assumption 1, 0 < \u01eb < 1\u039b\u2032(\u03b3)\u03b3 , t (N) 1 = ( 1 \u039b\u2032(\u03b3)\u03b3 \u2212 \u01eb ) logN , and t (N) 3 = ( 1 \u039b\u2032(\u03b3)\u03b3 + \u01eb )\nlogN , then for all x \u2208 R, we have that\nlim sup N\u2192\u221e P\n\nmax i\u2264N sup t (N) 1 \u2264k<t (N) 3\nk \u2211\nj=1\n(Si(j)\u2212A(j)) > 1\n\u03b3 logN + x\n\u221a\nlogN\n\n\n\u2264 P (\n\u03c3A\n\u221a\n1\n\u039b\u2032(\u03b3)\u03b3 \u2212 \u01ebX1 + \u03c3A\n\u221a 2\u01eb |X2| > x\n)\n, (28)\nwith X1, X2 \u223c N (0, 1) and independent.\nProof. In order to prove this lemma, we first rewrite\nmaxi\u2264N supt(N)1 \u2264k<t (N) 3 \u2211k j=1(Si(j)\u2212A(j))\u2212 1\u03b3 logN\u221a logN\n\u2264 maxi\u2264N supt(N)1 \u2264k<t (N) 3\n\u2211k j=1\n( Si(j)\u2212 1\u03bb ) \u2212 1\u03b3 logN\u221a logN + sup t (N) 1 \u2264k<t (N) 3 \u2211k j=1 ( 1 \u03bb \u2212A(j) ) \u221a logN\n\u2264 maxi\u2264N supk\u22650\n\u2211k j=1 ( Si(j)\u2212 1\u03bb ) \u2212 1\u03b3 logN\u221a logN + sup t (N) 1 \u2264k<t (N) 3 \u2211k j=1 ( 1 \u03bb \u2212A(j) ) \u221a logN . (29)\nWe first look at the first term in (29). This term gives the rescaled longest steady-state waiting time of N i.i.d. D/G/1 queues. We know that\nP\n\nsup k\u22650\nk \u2211\nj=1\n(\nSi(j)\u2212 1\n\u03bb\n)\n> x\n\n \u223c C exp(\u2212\u03b3x),\nas x \u2192 \u221e, with 0 < C < 1; see [1, Ch. XIII, Thm. 5.2]. Thus for x > 0,\nP\n(\nmaxi\u2264N supk\u22650 \u2211k j=1 ( Si(j)\u2212 1\u03bb ) \u2212 1\u03b3 logN\u221a logN > x\n)\n\u223c 1\u2212 ( 1\u2212 C exp(\u2212\u03b3(1/\u03b3 logN + x \u221a logN)) )N N\u2192\u221e\u2212\u2192 0.\nSimilarly, for x < 0,\nP\n(\nmaxi\u2264N supk\u22650 \u2211k j=1 ( Si(j)\u2212 1\u03bb ) \u2212 1\u03b3 logN\u221a logN > x\n)\n\u223c 1\u2212 ( 1\u2212 C exp(\u2212\u03b3(1/\u03b3 logN + x \u221a logN)) )N N\u2192\u221e\u2212\u2192 1.\nThus, the first term in (29) converges in probability to 0. Now, we prove convergence of the tail probability of the second term in (29). This term is a supremum of a random walk with drift 0. Then for (B(t), t \u2265 0) a Brownian motion with drift 0 and standard deviation 1, by using Donsker\u2019s theorem [5] and the fact that the supremum is a continuous functional, we obtain with a similar analysis as in Lemma 3, that\nP\n\n\nsup t (N) 1 \u2264k<t (N) 3\n\u2211k j=1( 1 \u03bb \u2212A(j))\u221a\nlogN > x\n\n N\u2192\u221e\u2212\u2192 P (\n\u03c3A\n\u221a\n1\n\u039b\u2032(\u03b3)\u03b3 \u2212 \u01ebX1 + \u03c3A\n\u221a 2\u01eb |X2| > x\n)\n.\nLemma 6. Given the model in Section 2 where the sequence of service times (Si(j), i \u2265 1, j \u2265 1) satisfies Assumption 1, \u03b4 = \u03b41\u039b\u2032(\u03b3)\u03b3 + \u03b42 with \u03b41,2 > 0 and small, \u01eb = \u03b4 1/4, and t (N) 3 = ( 1 \u039b\u2032(\u03b3)\u03b3 + \u01eb )\nlogN , then for all x \u2208 R, we have that\nP\n\nmax i\u2264N sup k\u2265t(N)3\nk \u2211\nj=1\n(Si(j)\u2212 A(j)) > 1\n\u03b3 logN + x\n\u221a\nlogN\n\n N\u2192\u221e\u2212\u2192 0. (30)\nProof. As in the proof of Lemma 4, we derive upper bounds for\nP\n\nmax i\u2264N sup k\u2265t(N)3\nk \u2211\nj=1\n(Si(j)\u2212A(j)) > 1\n\u03b3 logN + x\n\u221a\nlogN\n\n\nthat converge to 0 as N \u2192 \u221e. First, we see that by using subadditivity and the union bound, we obtain\nP\n\nmax i\u2264N sup k\u2265t(N)3\nk \u2211\nj=1\n(Si(j)\u2212A(j)) > 1\n\u03b3 logN + x\n\u221a\nlogN\n\n\n\u2264 P\n\nmax i\u2264N sup k\u2265t(N)3\nk \u2211\nj=1\n(\nSi(j)\u2212 1\n\u03bb + \u03b41\n)\n>\n(\n1 \u03b3 \u2212 \u03b42\n)\nlogN\n\n\n+ P\n\nsup k\u22650\nk \u2211\nj=1\n(\n1 \u03bb \u2212 \u03b41 \u2212A(j)\n)\n> \u03b42 logN + x \u221a logN\n\n.\nAs in the proof of Lemma 4, we have that\nP\n\nsup k\u22650\nk \u2211\nj=1\n(\n1 \u03bb \u2212 \u03b41 \u2212A(j)\n)\n> \u03b42 logN + x \u221a logN\n\n N\u2192\u221e\u2212\u2192 0.\nFurthermore, observe that logE[exp(\u03b8(Si(j)\u2212 1/\u03bb+ \u03b41))] = \u039b(\u03b8) + \u03b8\u03b41. Now, as in the proof of Lemma 4, we can bound\nP\n\nmax i\u2264N sup k\u2265t(N)3\nk \u2211\nj=1\n(\nSi(j)\u2212 1\n\u03bb + \u03b41\n)\n>\n(\n1 \u03b3 \u2212 \u03b42\n)\nlogN\n\n (31)\n\u2264 N \u221e \u2211\nk=\u230at(N)3 \u230b\nP\n\n\nk \u2211\nj=1\n(\nSi(j)\u2212 1\n\u03bb + \u03b41\n)\n>\n(\n1 \u03b3 \u2212 \u03b42\n)\nlogN\n\n (32)\n\u2264 N \u221e \u2211\nk=\u230at(N)3 \u230b\nexp(k(\u039b(\u03b8) + \u03b8\u03b41)) exp\n( \u2212\u03b8 ( 1\n\u03b3 \u2212 \u03b42\n)\nlogN\n)\n= N exp\n( \u230at(N)3 \u230b(\u039b(\u03b8) + \u03b8\u03b41) )\nexp(\u039b(\u03b8) + \u03b8\u03b41)\u2212 1 exp\n( \u2212\u03b8 ( 1\n\u03b3 \u2212 \u03b42\n)\nlogN\n)\n, (33)\nwhen \u039b(\u03b8) + \u03b8\u03b41 < 0. When \u039b(\u03b8) + \u03b8\u03b41 \u2265 0 the sum in the upper bound diverges to \u221e. Now, for the case \u039b(\u03b8) + \u03b8\u03b41 < 0, we have that\nlog\n(\nN exp\n( \u230at(N)3 \u230b(\u039b(\u03b8)+\u03b8\u03b41) )\nexp(\u039b(\u03b8)+\u03b8\u03b41)\u22121 exp ( \u2212\u03b8 ( 1 \u03b3 \u2212 \u03b42 ) logN )\n)\nlogN\nN\u2192\u221e\u2212\u2192 1 + ( 1\n\u039b\u2032(\u03b3)\u03b3 + \u01eb\n) (\u039b(\u03b8) + \u03b8\u03b41)\u2212 \u03b8 ( 1\n\u03b3 \u2212 \u03b42\n)\n.\nAs in the proof of Lemma 4, we have \u03b4 = \u03b41\u039b\u2032(\u03b3)\u03b3 + \u03b42 and \u01eb = \u03b4 1/4. We now get after a similar derivation as in the\nproof of Lemma 4 that \u03b8 = \u03b3 \u2212 \u221a \u03b4 gives a sharp bound. First, observe that \u039b(\u03b3 \u2212 \u221a \u03b4) = \u2212 \u221a \u03b4\u039b\u2032(\u03b3) + O(\u03b4), thus\n\u039b(\u03b8) + \u03b8\u03b41 = \u2212 \u221a \u03b4\u039b\u2032(\u03b3) + (\u03b3 \u2212 \u221a \u03b4)\u03b41 +O(\u03b4) = \u2212 \u221a \u03b4\u039b\u2032(\u03b3) +O(\u03b4) < 0 for \u03b4 small enough, thus the upper bound in (33) holds. Second, we see that\nsup \u03b7\u2208R\n(\n\u03b7\n(\n1 \u03b3 \u2212 \u03b42\n) \u2212 ( 1\n\u039b\u2032(\u03b3)\u03b3 + \u01eb\n)\n(\u039b(\u03b7) + \u03b7\u03b41)\n)\n\u2265 (\u03b3 \u2212 \u221a \u03b4) ( 1\n\u03b3 \u2212 \u03b42\n) \u2212 ( 1\n\u039b\u2032(\u03b3)\u03b3 + \u01eb\n) (\u039b(\u03b3 \u2212 \u221a \u03b4) + (\u03b3 \u2212 \u221a \u03b4)\u03b41).\nSo, we can conclude that\n(\u03b3 \u2212 \u221a \u03b4) ( 1\n\u03b3 \u2212 \u03b42\n) \u2212 ( 1\n\u039b\u2032(\u03b3)\u03b3 + \u03b41/4\n) (\u039b(\u03b3 \u2212 \u221a \u03b4) + (\u03b3 \u2212 \u221a \u03b4)\u03b41) = 1 + \u03b4 3/4\u039b\u2032(\u03b3) +O(\u03b4) > 1\nfor \u03b4 small enough, thus the expression in (33) converges to 0 as N \u2192 \u221e.\nProof of Theorem 1. First, to prove a lower bound, we see that\nmax i\u2264N Wi(\u221e) \u2265st. max i\u2264N\n\u230a\n1 (\u039b\u2032(\u03b3)\u03b3)\nlogN \u230b\n\u2211\nj=1\n(Si(j)\u2212A(j)).\nThus, combining this inequality with the result from Lemma 3, we see that\nlim inf N\u2192\u221e P\n(\nmax i\u2264N\nWi(\u221e) > 1\n\u03b3 logN + x\n\u221a\nlogN\n) \u2265 P (\n\u03c3A\n\u221a\n1\n\u039b\u2032(\u03b3)\u03b3 X > x\n)\n.\nSecond, by using the union bound of the types as given in (10) and explained in Section 3, we get from Lemmas 4,\n5, and 6, with t (N) 1 =\n(\n1 \u039b\u2032(\u03b3)\u03b3 \u2212 \u01eb\n)\nlogN and t (N) 3 =\n(\n1 \u039b\u2032(\u03b3)\u03b3 + \u01eb\n)\nlogN , that\nlim sup N\u2192\u221e P\n(\nmax i\u2264N\nWi(\u221e) > 1\n\u03b3 logN + x\n\u221a\nlogN\n)\n\u2264 lim sup N\u2192\u221e P\n\nmax i\u2264N sup t (N) 1 \u2264k<t (N) 3\nk \u2211\nj=1\n(Si(j)\u2212A(j)) > 1\n\u03b3 logN + x\n\u221a\nlogN\n\n\n\u2264 P (\n\u03c3A\n\u221a\n1\n\u039b\u2032(\u03b3)\u03b3 \u2212 \u01ebX1 + \u03c3A\n\u221a 2\u01eb |X2| > x\n)\n.\nFinally, we have that\nP\n(\n\u03c3A\n\u221a\n1\n\u039b\u2032(\u03b3)\u03b3 \u2212 \u01ebX1 + \u03c3A\n\u221a 2\u01eb |X2| > x\n) \u01eb\u21930\u2212\u2192 P (\n\u03c3A\n\u221a\n1\n\u039b\u2032(\u03b3)\u03b3 X > x\n)\n.\nReferences\n[1] S\u00f8ren Asmussen. Applied probability and queues, volume 2. Springer, 2003.\n[2] Fran\u00e7ois Baccelli. Two parallel queues created by arrivals with two demands: The M/G/2 symmetrical case. Technical report RR\u20130426, INRIA, 1985.\n[3] Fran\u00e7ois Baccelli and Armand M. Makowski. Queueing models for systems with synchronization constraints. Proceedings of the IEEE, 77(1):138\u2013161, 1989.\n[4] Amir Dembo and Ofer Zeitouni. Large deviations techniques and applications, volume 38. Springer Science & Business Media, 2009.\n[5] Monroe David Donsker. An invariance principle for certain probability limit theorems, volume 6. Memoirs of the American Mathematical Society, 1951.\n[6] Leopold Flatto and Sann Hahn. Two parallel queues created by arrivals with two demands I. SIAM Journal on Applied Mathematics, 44(5):1041\u20131053, 1984.\n[7] Laurens de Haan and Ana Ferreira. Extreme value theory: an introduction. Springer Science & Business Media, 2006.\n[8] Rasoul Haji and Gordon F Newell. A relation between stationary queue and waiting time distributions. Journal of Applied Probability, 8(3):617\u2013620, 1971.\n[9] Stephanus J. de Klein. Fredholm integral equations in queueing analysis. PhD thesis, Rijksuniversiteit Utrecht, 1988.\n[10] Sung-Seok Ko and Richard F. Serfozo. Response times in M/M/s fork-join networks. Advances in Applied Probability, 36(3):854\u2013871, 2004.\n[11] David V Lindley. The theory of queues with a single server. In Mathematical Proceedings of the Cambridge Philosophical Society, volume 48, pages 277\u2013289. Cambridge University Press, 1952.\n[12] Mirjam Meijer, Dennis Schol, Willem van Jaarsveld, Maria Vlasiou, and Bert Zwart. Extreme-value theory for large fork-join queues, with applications to high-tech supply chains. https://arxiv.org/abs/2105.09189, 2021.\n[13] Reinhard Michel. On the constant in the nonuniform version of the Berry-Ess\u00e9en theorem. Zeitschrift f\u00fcr Wahrscheinlichkeitstheorie und verwandte Gebiete, 55(1):109\u2013117, 1981.\n[14] Randolph Nelson and Asser N Tantawi. Approximate analysis of fork/join synchronization in parallel queues. IEEE Transactions on Computers, 37(6):739\u2013743, 1988.\n[15] Dennis Schol, Maria Vlasiou, and Bert Zwart. Large fork-join queues with nearly deterministic arrival and service times. Mathematics of Operations Research, 47(2):1335\u20131364, 2021.\n[16] Dennis Schol, Maria Vlasiou, and Bert Zwart. Tail asymptotics for the delay in a brownian fork-join queue. arXiv preprint arXiv:2208.04796, 2022.\n[17] Paul E. Wright. Two parallel processors with coupled inputs. Advances in Applied Probability, 24(4):986\u20131007, 1992."
        }
    ],
    "title": "Extreme values for the waiting time in large fork-join queues",
    "year": 2023
}