{
    "abstractText": "We investigate the point process of moduli of the Ginibre and hyperbolic ensembles. We show that far from the origin and at an appropriate scale, these processes exhibit Gaussian and Poisson fluctuations. Among the possible Gaussian fluctuations, we can find white noise but also fluctuations with non-trivial covariance at a particular scale. 1. Formulation of the main results The main results of this paper, Theorems 1.1-1.6, establish limit theorems for additive statistics of the Ginibre ensemble and the hyperbolic ensembles, introduced by Krishnapur, including the determinantal point process with the Bergman kernel, which, by the Peres-Vir\u00e1g theorem, is the zero set of the Gaussian analytic function on the unit disc. In this section, we begin by recalling the notion of determinantal point process, which are point processes where the correlation functions take the form of a determinant. Afterwards, the specific examples we are interested in, namely the Ginibre point process and the hyperbolic ensembles, are discussed. Finally, we state the main results of this note, Theorems 1.1-1.6. 1.1. Determinantal point process. LetX be a locally compact Polish space and B0(X) the collection of all pre-compact Borel subsets of X . We shall denote by Conf(X), the space of all locally finite configurations over X , that is, Conf(X) := { \u03be = \u2211 i \u03b4xi \u2223\u2223 \u2200i, xi \u2208 X and \u03be(\u2206) < \u221e for all \u2206 \u2208 B0(X) } . We shall consider this set endowed with the vague topology, i.e., the weakest topology on Conf(X) such that for any compactly supported continuous function f on X , the map Conf(X) \u220b \u03be 7\u2192 \u222b X fd\u03be is continuous. It can be seen that the configuration space Conf(X) equipped with the vague topology turns out to be a Polish space. Additionally, it can be seen that the Borel \u03c3-algebra F on Conf(X) is generated by the cylinder sets C n = { \u03be \u2208 Conf(X) | \u03be(\u2206) = n } , where n \u2208 N = {0, 1, 2, \u00b7 \u00b7 \u00b7 } and \u2206 \u2208 B0(X). Finally, we will say that a measurable map X : (\u03a9,F(\u03a9),P) \u2192 (Conf(X),F) 2010 Mathematics Subject Classification. Primary 60G55; Secondary 30B20, 30H20.",
    "authors": [
        {
            "affiliations": [],
            "name": "ZHAOFENG LIN"
        }
    ],
    "id": "SP:b63b37b0885b8e486c5d1876bb9b895887d2d2d1",
    "references": [
        {
            "authors": [
                "A. Borodin"
            ],
            "title": "Determinantal point processes",
            "venue": "Oxford Handbook of Random Matrix Theory, Oxford Univ. Press, Oxford, ",
            "year": 2011
        },
        {
            "authors": [
                "A.I. Bufetov"
            ],
            "title": "The conditional measures for the determinantal point process with the Bergman kernel",
            "venue": "arXiv:2112.15557 ",
            "year": 2021
        },
        {
            "authors": [
                "A.I. Bufetov",
                "Y. Qiu"
            ],
            "title": "Determinantal point processes associated with Hilbert spaces of holomorphic functions",
            "venue": "Comm. Math. Phys. 351 ",
            "year": 2017
        },
        {
            "authors": [
                "D.J. Daley",
                "D. Vere-Jones"
            ],
            "title": "An introduction to the theory of point processes",
            "venue": "Vol. II. General theory and structure. Second edition. Probability and its Applications (New York). Springer, New York",
            "year": 2008
        },
        {
            "authors": [
                "S. Ghosh"
            ],
            "title": "Determinantal processes and completeness of random exponentials: the critical case",
            "venue": "Probab. Theory Related Fields 163 ",
            "year": 2015
        },
        {
            "authors": [
                "S. Ghosh",
                "Y. Peres"
            ],
            "title": "Rigidity and tolerance in point processes: Gaussian zeros and Ginibre eigenvalues",
            "venue": "Duke Math. J. 166 ",
            "year": 2017
        },
        {
            "authors": [
                "J. Ginibre"
            ],
            "title": "Statistical ensembles of complex",
            "venue": "quaternion, and real matrices. J. Mathematical Phys. 6 ",
            "year": 1965
        },
        {
            "authors": [
                "J.B. Hough",
                "M. Krishnapur",
                "Y. Peres",
                "B. Vir\u00e1g"
            ],
            "title": "Zeros of Gaussian analytic functions and determinantal point processes",
            "venue": "University Lecture Series, 51. American Mathematical Society, Providence, RI",
            "year": 2009
        },
        {
            "authors": [
                "Y.G. Kondratiev",
                "T. Kuna"
            ],
            "title": "Harmonic analysis on configuration space",
            "venue": "I. General theory. Infin. Dimens. Anal. Quantum Probab. Relat. Top. 5 ",
            "year": 2002
        },
        {
            "authors": [
                "E. Kostlan"
            ],
            "title": "On the spectra of Gaussian matrices",
            "venue": "Linear Algebra Appl. 162/164 (1992), 385-388. Directions in matrix theory ",
            "year": 1990
        },
        {
            "authors": [
                "M. Krishnapur"
            ],
            "title": "From random matrices to random analytic functions",
            "venue": "Ann. Probab. 37 ",
            "year": 2009
        },
        {
            "authors": [
                "A. Lenard"
            ],
            "title": "Correlation functions and the uniqueness of the state in classical statistical mechanics",
            "venue": "Comm. Math. Phys. 30 ",
            "year": 1973
        },
        {
            "authors": [
                "O. Macchi"
            ],
            "title": "The coincidence approach to stochastic point processes",
            "venue": "Advances in Appl. Probability. 7 ",
            "year": 1975
        },
        {
            "authors": [
                "Y. Peres"
            ],
            "title": "B",
            "venue": "Vir\u00e1g, Zeros of the i.i.d. Gaussian power series: A conformally invariant determinantal process. Acta Math. 194 ",
            "year": 2005
        },
        {
            "authors": [
                "T. Shirai",
                "Y. Takahashi"
            ],
            "title": "Fermion process and Fredholm determinant",
            "venue": "Proceedings of the Second ISAAC Congress, Vol. 1 ",
            "year": 1999
        },
        {
            "authors": [
                "A. Soshnikov"
            ],
            "title": "Determinantal random point fields",
            "venue": "Russian Math. Surveys. 55 ",
            "year": 2000
        },
        {
            "authors": [
                "A. Soshnikov",
                "Gaussian"
            ],
            "title": "limit for determinantal random point fields",
            "venue": "Ann. Probab",
            "year": 2002
        }
    ],
    "sections": [
        {
            "text": "ar X\niv :2\n20 2.\n11 68\n7v 1\n[ m\nat h.\nPR ]\n2 3\nFe b\n20 22\n1. Formulation of the main results\nThe main results of this paper, Theorems 1.1-1.6, establish limit theorems for additive statistics of the Ginibre ensemble and the hyperbolic ensembles, introduced by Krishnapur, including the determinantal point process with the Bergman kernel, which, by the Peres-Vira\u0301g theorem, is the zero set of the Gaussian analytic function on the unit disc.\nIn this section, we begin by recalling the notion of determinantal point process, which are point processes where the correlation functions take the form of a determinant. Afterwards, the specific examples we are interested in, namely the Ginibre point process and the hyperbolic ensembles, are discussed. Finally, we state the main results of this note, Theorems 1.1-1.6.\n1.1. Determinantal point process. LetX be a locally compact Polish space and B0(X) the collection of all pre-compact Borel subsets of X . We shall denote by Conf(X), the space of all locally finite configurations over X , that is,\nConf(X) := { \u03be = \u2211 i \u03b4xi \u2223\u2223 \u2200i, xi \u2208 X and \u03be(\u2206) < \u221e for all \u2206 \u2208 B0(X) } .\nWe shall consider this set endowed with the vague topology, i.e., the weakest topology on Conf(X) such that for any compactly supported continuous function f on X , the map Conf(X) \u220b \u03be 7\u2192 \u222b X fd\u03be is continuous. It can be seen that the configuration space Conf(X) equipped with the vague topology turns out to be a Polish space. Additionally, it can be seen that the Borel \u03c3-algebra F on Conf(X) is generated by the cylinder sets C\u2206n = { \u03be \u2208 Conf(X) | \u03be(\u2206) = n } , where n \u2208 N = {0, 1, 2, \u00b7 \u00b7 \u00b7 } and \u2206 \u2208 B0(X). Finally, we will say that a measurable map\nX : (\u2126,F(\u2126),P) \u2192 (Conf(X),F)\n2010 Mathematics Subject Classification. Primary 60G55; Secondary 30B20, 30H20. Key words and phrases. Ginibre ensemble; hyperbolic ensemble; process of moduli; normality; white\nnoise; Poisson point process. A. I. Bufetov\u2019s research has received funding from the European Research Council (ERC) under the European Union\u2019s Horizon 2020 research and innovation programme, grant agreement No 647133 (ICHAOS), as well as from the ANR grant ANR-18-CE40-0035 REPKA. Z. Lin is supported by grants NSFC 11722102 and NSFC 12026250.\n1\nis a point process on X , where (\u2126,F(\u2126),P) is any probability space. For futher background, see [5, 10, 13].\nA point process X is called simple if it almost surely assigns at most measure one to singletons. In the simple case, X can be identified with a random discrete subset of X and for any Borel set \u2206 on X , the number X (\u2206) \u2208 N \u222a {\u221e} represents the number of points of this discrete subset that fall in \u2206. So, for instance, we will use the notation {T (x) : x \u2208 X } instead of the usual pushforward notation T\u2217X , for simplicity.\nDeterminantal point processes have been introduced by Odile Macchi [14] in the seventies. We recall the definition. Let \u00b5 be a Radon measure on X and let K : X\u00d7X \u2192 C be a measurable function. A simple point process X is called determinantal on X associated to the kernel K with respect to the reference measure \u00b5 if, for every k \u2208 N+ and any family of mutually disjoint subsets \u22061,\u22062, \u00b7 \u00b7 \u00b7 ,\u2206k \u2208 B0(X),\nE\n[ k\u220f\ni=1\nX (\u2206i) ] =\n\u222b\n\u22061\u00d7\u00b7\u00b7\u00b7\u00d7\u2206k det [ K(xi, xj) ] 1\u2264i,j\u2264kd\u00b5(x1) \u00b7 \u00b7 \u00b7d\u00b5(xk).(1.1)\nSee, e.g., [1, 2, 3, 4, 9, 15, 16, 17, 18] for further background of determinantal point process.\nThe moments of the linear statistics \u2211 x\u2208X f(x) := \u222b X fdX under a determinantal point process can be calculated from (1.1). For instance, when the kernel K is Hermitian and satisfies the reproducing property, i.e., it represents an orthogonal projection, then\nE\n[\u2211\nx\u2208X f(x)\n] =\n\u222b\nX\nf(x)K(x, x)d\u00b5(x),(1.2)\nand\nVar (\u2211\nx\u2208X f(x)\n) = 1\n2\n\u222b\nX2\n[ f(x)\u2212 f(y) ]2\u2223\u2223K(x, y) \u2223\u22232d\u00b5(x)d\u00b5(y).(1.3)\nSee, e.g., [6, Proposition 4.1], [7, Lemma 8.5] and [18, formulas (4) and (5)].\n1.2. The Ginibre ensemble. Consider the Gaussian measure \u00b5 on the whole plane C given by\nd\u00b5(z) = 1\n\u03c0 e\u2212|z| 2 dm(z),\nwhere dm is the usual Lebesgue measure. We also need to consider the space O(\u039b) of holomorphic functions on an open set \u039b \u2282 C.\nIn the finite-dimensional setting, the Ginibre ensemble was introduced by Ginibre [8] as a model based on the eigenvalues of non-Hermitian random matrices, and the infinite Ginibre ensemble is obtained as a weak limit of these finite-dimensional point processes. The infinite Ginibre ensemble can be defined as follows.\nDefinition 1.1 (Ginibre ensemble). The Ginibre ensemble G is the determinantal point process associated to the Fock kernel, i.e., the kernel of the orthogonal projection of L2(C, \u00b5) onto L2(C, \u00b5) \u2229O(C), with respect to the reference measure \u00b5.\nEquivalently, the Ginibre ensemble is the point process G on C such that for any pairwise disjoint measurable subsets \u22061,\u22062, . . . ,\u2206k of C, we have that\nE\n[ k\u220f\ni=1\nG(\u2206i) ] =\n\u222b\n\u22061\u00d7\u00b7\u00b7\u00b7\u00d7\u2206k det [ KG(zi, zj) ] 1\u2264i,j\u2264kdm(z1) \u00b7 \u00b7 \u00b7dm(zk),\nwhere KG : C\u00d7 C \u2192 C is given by\nKG(z, w) = 1\n\u03c0\n\u221e\u2211\nn=0\nznwn\nn! e\u2212\n|z|2 2 e\u2212 |w|2 2 = 1\n\u03c0 ezw\u2212\n|z|2\n2 \u2212 |w|\n2\n2 .\n1.3. The hyperbolic ensembles. For each \u03b1 > 0, consider the probability measure \u00b5\u03b1 on the unit disc D given by\nd\u00b5\u03b1(z) = \u03b1\n\u03c0 (1\u2212 |z|2)\u03b1\u22121dm(z)\nand recall that O(D) denotes the space of holomorphic functions on D. Definition 1.2 (Hyperbolic ensemble). For \u03b1 > 0, the \u03b1-hyperbolic ensemble H\u03b1 is the determinantal point process associated to the \u00b5\u03b1-weighted Bergman kernel, i.e., the kernel of the orthogonal projection of L2(D, \u00b5\u03b1) onto L\n2(D, \u00b5\u03b1) \u2229 O(D), with respect to the reference measure \u00b5\u03b1.\nEquivalently, the \u03b1-hyperbolic ensemble is the point process H\u03b1 on D such that for any pairwise disjoint measurable subsets \u22061,\u22062, . . . ,\u2206k of D, we have that\nE\n[ k\u220f\ni=1\nH\u03b1(\u2206i) ] =\n\u222b\n\u22061\u00d7\u00b7\u00b7\u00b7\u00d7\u2206k det [ KH\u03b1(zi, zj) ] 1\u2264i,j\u2264kdm(z1) \u00b7 \u00b7 \u00b7dm(zk),\nwhere KH\u03b1 : D\u00d7 D \u2192 C is given by\nKH\u03b1(z, w) = 1\n\u03c0\n\u221e\u2211\nn=0\nk(\u03b1)n z nwn(1\u2212 |z|2)\u03b1\u22121(1\u2212 |w|2)\u03b1\u22121 = \u03b1\n\u03c0 (1\u2212 |z|2)\u03b1\u22121(1\u2212 |w|2)\u03b1\u22121 (1\u2212 zw)\u03b1+1 ,\nwhile\nk(\u03b1)n = \u03b1(\u03b1+ 1) \u00b7 \u00b7 \u00b7 (\u03b1 + n)\nn! =\n\u0393(\u03b1+ n + 1) \u0393(\u03b1)\u0393(n+ 1) .\nFor \u03b1 = 1, Peres and Vira\u0301g [15] showed that the zeros of the random analytic function\n\u03c6(z) = a0 + a1z + a2z 2 + \u00b7 \u00b7 \u00b7 ,\nwhere ak, k \u2265 0, are independent and identically distributed standard complex Gaussian random variables, follow the law of the 1-hyperbolic ensemble H1. Krishnapur [12] extended the result of Peres and Vira\u0301g to positive integer \u03b1 = m, showing that, if Gk, k \u2265 0, are independent and identically distributed m\u00d7m matrices, each with independent and identically distributed standard complex Gaussian entries, then the zeros of the random analytic function\n\u03a6(z) = det(G0 +G1z +G2z 2 + \u00b7 \u00b7 \u00b7 )\nfollow the law of the m-hyperbolic ensemble Hm.\n1.4. Main results. Recall that the unit disc D endowed with the metric d\u00b5\u03b1 is the Poincare\u0301 model for the Lobachevsky plane. Our results involve the point process formed by {|z| : z \u2208 G} and the one formed by {|z|h : z \u2208 H\u03b1}, \u03b1 > 0, where\n|z|h = log 1 + |z| 1\u2212 |z|\nis the hyperbolic distance from z to the origin. By [9, Theorem 4.7.1], which was first noticed by Kostlan [11, Lemma 1.4] in the case of a finite number of particles, the point process {|z| : z \u2208 G} follows the law of {\u03c1n : n \u2208 N}, where (\u03c1n)n\u22650 is a family of non-negative independent random variables such that\n\u03c1n \u223c 2r2n+1e\u2212r 2\nn! dr.\nSimilarly, from [9, Theorem 4.7.1], see also [12] and [15], for \u03b1 > 0, the point process {|z| : z \u2208 H\u03b1} follows the law of {\u03c1(\u03b1)n : n \u2208 N}, where (\u03c1(\u03b1)n )n\u22650 is a family of independent random variables taking values in [0, 1] such that\n\u03c1(\u03b1)n \u223c 2 \u0393(\u03b1 + n+ 1) \u0393(\u03b1)\u0393(n+ 1) r2n+1(1\u2212 r2)\u03b1\u22121dr.\nThe asymptotic behavious of {|z| \u2212R : z \u2208 G} and of {|z|h \u2212R : z \u2208 H\u03b1}, \u03b1 > 0, as R goes to infinity and under different scalings is described in the theorems below. Theorem 1.1 and 1.2 deal with a convergence of the normalized process towards a Gaussian field whose covariance kernel is not the one of the white noise. Theorem 1.3 and Theorem 1.4 deal with the intermediate case of a convergence towards the white noise. Finally, the last two theorems, Theorem 1.5 and Theorem 1.6, deal with the extreme case of the convergence towards a homogeneous Poisson process.\n1.4.1. Convergence towards a non-trivial Gaussian limit.\nTheorem 1.1. Denote C (\u03b1) R = \u03b1e R/8 for each \u03b1 > 0. Then for any bounded measurable and compactly supported function f : R \u2192 R,\n1\u221a C\n(\u03b1) R\n\u2211\nz\u2208H\u03b1\nf ( |z|h \u2212 R ) \u2212 2 \u221a C (\u03b1) R \u222b\nR\nf(x)exdx law\u2212\u2212\u2212\u2212\u2192 R\u2192+\u221e N ( 0, V (\u03b1) f ) ,\nwhere\nV (\u03b1) f =\n1\nB(\u03b1, \u03b1+ 1)\n\u222b\nR2\n[ f(x)\u2212 f(y) ]2 e(\u03b1+1)(x+y)\n(ex + ey)2\u03b1+1 dxdy.\nTheorem 1.2. For any bounded measurable and compactly supported function f : R \u2192 R, 1\u221a R \u2211 z\u2208G f ( |z| \u2212R ) \u2212 2 \u221a R \u222b R f(x)dx law\u2212\u2212\u2212\u2212\u2192 R\u2192+\u221e N (0, Vf),\nwhere\nVf = 1\u221a \u03c0\n\u222b\nR2\n[ f(x)\u2212 f(y) ]2 e\u2212(x\u2212y) 2 dxdy.\n1.4.2. Convergence towards white noise.\nTheorem 1.3. Suppose that aR satisfies 1 \u226a aR \u226a eR as R \u2192 +\u221e. Denote C\n(\u03b1) R = \u03b1e R/8 for each \u03b1 > 0. Then for any bounded measurable and compactly supported function f : R \u2192 R,\n\u221a aR\nC (\u03b1) R\n\u2211\nz\u2208H\u03b1\nf ( aR(|z|h \u2212R) ) \u2212 2\n\u221a C\n(\u03b1) R\naR\n\u222b\nR\nf(x)dx law\u2212\u2212\u2212\u2212\u2192 R\u2192+\u221e N ( 0, 2\n\u222b\nR\nf 2(x)dx ) .\nTheorem 1.4. Suppose that aR satisfies 1 \u226a aR \u226a R as R \u2192 +\u221e. Then for any bounded measurable and compactly supported function f : R \u2192 R,\n\u221a aR R \u2211 z\u2208G f ( aR(|z| \u2212R) ) \u2212 2 \u221a R aR \u222b R f(x)dx law\u2212\u2212\u2212\u2212\u2192 R\u2192+\u221e N ( 0, 2 \u222b R f 2(x)dx ) .\nTheorems 1.1-1.4 will be obtained as corollaries of the central limit theorem of Soshnikov.\n1.4.3. Convergence towards a Poisson point process.\nTheorem 1.5. Let P\u03b1/4 be the Poisson point process on R with constant intensity \u03b1/4, \u03b1 > 0. Then,\n{ eR(|z|h \u2212 R) : z \u2208 H\u03b1 } law\u2212\u2212\u2212\u2212\u2192 R\u2192+\u221e P\u03b1/4.\nTheorem 1.6. Let P2 be the Poisson point process on R with constant intensity 2. Then, { R(|z| \u2212 R) : z \u2208 G\n} law\u2212\u2212\u2212\u2212\u2192 R\u2192+\u221e P2.\nRemark 1.1. An analog of the theorems above is the case of an independent and identically distributed sequence (Xi)i\u22651 of real random variables that follows a probability distribution \u00b5. The analogue of Theorem 1.1 and Theorem 1.2 is the classical central limit theorem that tells us that, for any compactly supported function f : R \u2192 R, we have \u2211n\ni=1 f(Xi)\u2212 n \u222b fd\u00b5\u221a\nn\nlaw\u2212\u2212\u2212\u2212\u2192 n\u2192+\u221e\nN ( 0, 1\n2\n\u222b\nR2\n[f(x)\u2212 f(y)]2d\u00b5(x)d\u00b5(y) ) .\nIf these random variables admit a density \u03c1 which is continuous at 0, we have the convergence towards a Poisson point process, the analogue of Theorem 1.5 and Theorem 1.6,\n{nXi : 1 \u2264 i \u2264 n} law\u2212\u2212\u2212\u2212\u2192 n\u2192+\u221e P\u03c1(0).\nNotice that we can also see, at intermediate scalings, a convergence towards the white noise for the centered linear statistics.\n2. The hyperbolic process proof of Theorem 1.1\nTo study the limiting behaviour of the linear statistics \u2211\nz\u2208H\u03b1\nf ( |z|h \u2212R ) ,\nwe start by understanding the asymptotics of its expected value. Later, we study its limiting variance and conclude by Soshnikov\u2019s central limit theorem [18, Theorem 1].\nWe prepare two lemmas that contain some bounds that we will use.\nLemma 2.1. There exists two constants C,M > 0 such that, for every y \u2265 M and t \u2265 0, \u2223\u2223\u2223\u2223\u2223 ( 1\u2212 2 y + 1 )2\u230aty\u230b \u2212 e\u22124t \u2223\u2223\u2223\u2223\u2223 \u2264 Ce\u2212t/C y ,\nwhere \u230aty\u230b is the biggest integer that does not exceed ty. Proof of Lemma 2.1. We can use Lagrange\u2019s mean value theorem to control the difference\n\u2223\u2223\u2223\u2223 ( 1\u2212 2\ny + 1\n)2\u230aty\u230b+1 \u2212 e\u22124t \u2223\u2223\u2223\u2223\n\u2264 \u2223\u2223\u2223\u2223\u2223 [( 1 + 1\ny+1 2\n\u2212 1 ) y+1 2 ]\u2212 2(2\u230aty\u230b+1) y+1 \u2212 e\u2212 2(2\u230aty\u230b+1) y+1 \u2223\u2223\u2223\u2223\u2223+ \u2223\u2223\u2223e\u2212 2(2\u230aty\u230b+1) y+1 \u2212 e\u22124t \u2223\u2223\u2223\n= 2(2\u230aty\u230b+ 1)\ny + 1\n1\n\u03be 2(2\u230aty\u230b+1) y+1 +1\n[( 1 +\n1 y+1 2 \u2212 1 ) y+1\n2 \u2212 e ] + e\u03b7 \u2223\u2223\u2223\u2223 2(2\u230aty\u230b+ 1)\ny + 1 \u2212 4t\n\u2223\u2223\u2223\u2223 ,\nwhere \u03be \u2265 e and \u03b7 \u2264 \u2212A(t+1) for some fixed positive constant A < 4 and y large enough. The asymptotics of each of these terms as y goes to +\u221e gives us the result.\nNow, notice that there exist two constants C,M > 0 such that, for every y \u2265 M and t \u2265 0, we have the bounds\n\u2022 2(2\u230aty\u230b+ 1) y + 1 \u2264 C(t+ 1), \u2022 1 \u03be 2(2\u230aty\u230b+1) y+1 +1 \u2264 Ce\u2212t/C , \u2022 [( 1 + 1\ny+1 2\n\u2212 1 ) y+1\n2 \u2212 e ] \u2264 C\ny , \u2022 e\u03b7 \u2264 Ce\u2212t/C ,\n\u2022 \u2223\u2223\u2223\u2223 2(2\u230aty\u230b+ 1)\ny + 1 \u2212 4t\n\u2223\u2223\u2223\u2223 \u2264 C(t+ 1).\nThe lemma follows by noticing that (t + 1)2e\u2212t/C \u2264 C\u0303e\u2212t/C\u0303 for some C\u0303 > 0. For the next lemma, we recall the notation\nk(\u03b1)n = \u0393(\u03b1 + n+ 1)\n\u0393(\u03b1)\u0393(n+ 1) .\nLemma 2.2. There exists a constant C > 0 such that\u2223\u2223\u2223\u2223k\u230ay\u230b \u2212 y\u03b1\n\u0393(\u03b1)\n\u2223\u2223\u2223\u2223 \u2264 { C, y \u2208 [0, 1) Cy\u03b1\u22121, y \u2208 [1,+\u221e) ,\nwhere \u230ay\u230b is the biggest integer that does not exceed y. Proof of Lemma 2.2. This is a consequence of Stirling\u2019s series that tells us that\nk(\u03b1)n = \u0393(\u03b1+ n + 1)\n\u0393(\u03b1)\u0393(n+ 1) =\nn\u03b1\n\u0393(\u03b1) +O(n\u03b1\u22121) as n \u2192 \u221e.\nThe piecewise inequality comes from the fact that k (\u03b1) 0 6= 0.\nWith these lemmas, it is easier to understand the asymptotics of the expected value.\n2.1. Expected value calculation for Theorem 1.1. We will show a bit more than it is needed about the expected value asymptotics. We will see that\nE\n[ \u2211\nz\u2208H\u03b1\nf ( |z|h \u2212R )] = 2C (\u03b1) R\n\u222b\nR\nf(x)exdx+O(1).\nWe begin by writing\nE\n[ \u2211\nz\u2208H\u03b1\nf ( |z|h \u2212R )] = \u221e\u2211\nn=0\nE [ f ( |\u03c1(\u03b1)n |h \u2212 R )]\n=\n\u221e\u2211\nn=0\n\u222b +\u221e\n0\nf ( log 1 + r 1\u2212 r \u2212R ) 2k(\u03b1)n r 2n+1(1\u2212 r2)\u03b1\u22121dr,\nwhere we recall the notation k (\u03b1) n = \u0393(\u03b1+n+1) \u0393(\u03b1)\u0393(n+1) . By taking x = log 1+r 1\u2212r \u2212R, we get\nr = eR+x \u2212 1 eR+x + 1 and dr = 2eR+x (eR+x + 1)2 dx,\nso that\nE\n[ \u2211\nz\u2208H\u03b1\nf ( |z|h \u2212 R\n)]\n= 4\n\u221e\u2211\nn=0\n\u222b +\u221e\n\u2212R f(x)k(\u03b1)n (eR+x \u2212 1 eR+x + 1 )2n+1[ 1\u2212 (eR+x \u2212 1 eR+x + 1 )2]\u03b1\u22121 eR+x (eR+x + 1)2 dx\n= 4\u03b1 \u222b +\u221e\n\u2212R\n\u221e\u2211\nn=0\nf(x)k(\u03b1)n\n( 1\u2212 2\neR+x + 1 )2n+1 e\u03b1(R+x) (eR+x + 1)2\u03b1 dx\n= 4\u03b1 \u222b +\u221e\n\u2212R\n\u221e\u2211\nn=0\nf(x)k(\u03b1)n\n( 1\u2212 2\neR+x + 1 )2n+1 e\u2212\u03b1(R+x) (1 + e\u2212(R+x))2\u03b1 dx.\nNotice that we have interchanged the summation and integration here which is possible since f is bounded and compactly supported. Therefore, by taking n = \u230ateR+x\u230b, we get\ne\u2212R E [ \u2211 z\u2208H\u03b1 f ( |z|h \u2212 R )]\n= 4\u03b1 \u222b +\u221e\n\u2212R\n( \u221e\u2211\nn=0\nf(x)exk(\u03b1)n\n( 1\u2212 2\neR+x + 1 )2n+1 e\u2212\u03b1(R+x) (1 + e\u2212(R+x))2\u03b1 (e\u2212(R+x))\n) dx\n= 4\u03b1 \u222b +\u221e\n\u2212R\n(\u222b +\u221e\n0\nf(x)exk (\u03b1)\n\u230ateR+x\u230b\n( 1\u2212 2\neR+x + 1 )2\u230ateR+x\u230b+1 e\u2212\u03b1(R+x) (1 + e\u2212(R+x))2\u03b1 dt ) dx.\n(2.4)\nWe define the functions \u03981 and \u03982 of (x, t, R) and the function \u03983 of (x,R) by\nk (\u03b1) \u230ateR+x\u230b = t\u03b1e\u03b1(R+x)\n\u0393(\u03b1) + \u03981(x, t, R),(2.5)\n( 1\u2212 2\neR+x + 1\n)2\u230ateR+x\u230b+1 = e\u22124t +\u03982(x, t, R),(2.6)\n1\n(1 + e\u2212(R+x))2\u03b1 = 1 + \u03983(x,R).(2.7)\nBy Lemma 2.2 and Lemma 2.1 (and by a standard fact for (2.7)), there exists a constant C > 0 such that, for R large enough,\n|\u03981(x, t, R)| \u2264 {\nC, (x, t) \u2208 suppf \u00d7 [0, e\u2212R) Ct\u03b1\u22121e(\u03b1\u22121)R, (x, t) \u2208 suppf \u00d7 [e\u2212R,+\u221e) ,\n|\u03982(x, t, R)| \u2264 Ce\u2212t/Ce\u2212R, (x, t) \u2208 suppf \u00d7 [0,+\u221e),\n|\u03983(x,R)| \u2264 Ce\u2212R, x \u2208 suppf.\nWith the help of the estimates (2.5), (2.6) and (2.7), it follows from (2.4) that\ne\u2212R E [ \u2211\nz\u2208H\u03b1\nf ( |z|h \u2212R\n)]\n= 4\u03b1 \u222b +\u221e\n\u2212R\n\u222b +\u221e\n0\nf(x)ex t\u03b1e\u03b1(R+x)\n\u0393(\u03b1) e\u22124te\u2212\u03b1(R+x)dtdx +O(e\u2212R)\n= 4\u03b1\n\u0393(\u03b1)\n\u222b +\u221e\n0\nt\u03b1e\u22124tdt\n\u222b\nR\nf(x)exdx+O(e\u2212R)\n= \u03b1\n4\n\u222b\nR\nf(x)exdx+O(e\u2212R).\nThat is,\nE\n[ \u2211\nz\u2208H\u03b1\nf ( |z|h \u2212R )] = 2C (\u03b1) R\n\u222b\nR\nf(x)exdx+O(1).\n2.2. Variance calculation for Theorem 1.1. We now turn to calculate the variance of the linear statistics \u2211 z\u2208H\u03b1 f ( |z|h \u2212 R ) ,\nVar ( \u2211\nz\u2208H\u03b1\nf ( |z|h \u2212 R )) = \u221e\u2211\nn=0\nVar ( f ( |\u03c1(\u03b1)n |h \u2212 R ))\n= \u221e\u2211\nn=0\nE [ f 2 ( |\u03c1(\u03b1)n |h \u2212 R )] \u2212 \u221e\u2211\nn=0\nE [ f ( |\u03c1(\u03b1)n |h \u2212 R )]2 .\nDue to the asymptotics in Lemma 2.1 and Lemma 2.2 we can obtain a bit more that it is needed. For the first term \u2211\u221e n=0E [ f 2 ( |\u03c1(\u03b1)n |h \u2212R )] , by Subsection 2.1, we have\n\u221e\u2211\nn=0\nE [ f 2 ( |\u03c1(\u03b1)n |h \u2212 R )] = 2C (\u03b1) R\n\u222b\nR\nf 2(x)exdx+O(1).\nAs for the second term \u2211\u221e n=0E [ f ( |\u03c1(\u03b1)n |h \u2212 R )]2 , we can study it in the same way,\n\u221e\u2211\nn=0\nE [ f ( |\u03c1(\u03b1)n |h \u2212 R )]2\n= 42\u03b1 \u221e\u2211\nn=0\n(\u222b +\u221e\n\u2212R f(x)k(\u03b1)n\n( 1\u2212 2\neR+x + 1 )2n+1 e\u2212\u03b1(R+x) (1 + e\u2212(R+x))2\u03b1 dx )2 .\nNotice that the summation is outside the integration. Setting n = \u230ateR\u230b, we have\ne\u2212R \u221e\u2211\nn=0\nE [ f ( |\u03c1(\u03b1)n |h \u2212R )]2\n= 42\u03b1 \u221e\u2211\nn=0\n(\u222b +\u221e\n\u2212R f(x)k(\u03b1)n\n( 1\u2212 2\neR+x + 1 )2n+1 e\u2212\u03b1(R+x) (1 + e\u2212(R+x))2\u03b1 dx )2 e\u2212R\n= 42\u03b1 \u222b +\u221e\n0\n(\u222b +\u221e\n\u2212R f(x)k\n(\u03b1) \u230ateR\u230b\n( 1\u2212 2\neR+x + 1 )2\u230ateR\u230b+1 e\u2212\u03b1(R+x) (1 + e\u2212(R+x))2\u03b1 dx )2 dt.\n(2.8)\nWe define the function \u03984 of (t, R) and the function \u03985 of (x, t, R) by\nk (\u03b1) \u230ateR\u230b = t\u03b1e\u03b1R\n\u0393(\u03b1) + \u03984(t, R),(2.9)\n( 1\u2212 2\neR+x + 1\n)2\u230ateR\u230b+1 = e\u22124te \u2212x\n+\u03985(x, t, R),(2.10)\nso that, by Lemma 2.2 and Lemma 2.1, there exists a constant C > 0 such that, for R large enough, we have the bounds\n|\u03984(t, R)| \u2264 {\nC, t \u2208 [0, e\u2212R) Ct\u03b1\u22121e(\u03b1\u22121)R, t \u2208 [e\u2212R,+\u221e) ,\n|\u03985(x, t, R)| \u2264 Ce\u2212t/Ce\u2212R whenever (x, t) \u2208 suppf \u00d7 [0,+\u221e). With the help of these estimates and recalling the standard estimate (2.7), it follows that\ne\u2212R \u221e\u2211\nn=0\nE [ f ( |\u03c1(\u03b1)n |h \u2212 R )]2\n= 42\u03b1 \u222b +\u221e\n0\n(\u222b +\u221e\n\u2212R f(x)\nt\u03b1e\u03b1R\n\u0393(\u03b1) e\u22124te \u2212x e\u2212\u03b1(R+x)dx\n)2 dt+O(e\u2212R)\n= 42\u03b1\n\u03932(\u03b1)\n\u222b\nR2\nf(x)f(y)e\u2212\u03b1(x+y) \u222b +\u221e\n0\nt2\u03b1e\u22124t(e \u2212x+e\u2212y)dtdxdy +O(e\u2212R)\n= 1\n4\u03932(\u03b1)\n\u222b\nR2\nf(x)f(y) e\u2212\u03b1(x+y)\n(e\u2212x + e\u2212y)2\u03b1+1\n\u222b +\u221e\n0\nu2\u03b1e\u2212ududxdy +O(e\u2212R)\n= \u03b1\n4B(\u03b1, \u03b1+ 1)\n\u222b\nR2\nf(x)f(y) e(\u03b1+1)(x+y)\n(ex + ey)2\u03b1+1 dxdy +O(e\u2212R),\nthat is,\n\u221e\u2211\nn=0\nE [ f ( |\u03c1(\u03b1)n |h \u2212R )]2 =\n2C (\u03b1) R\nB(\u03b1, \u03b1+ 1)\n\u222b\nR2\nf(x)f(y) e(\u03b1+1)(x+y)\n(ex + ey)2\u03b1+1 dxdy +O(1).\nTherefore, we obtain\nVar ( \u2211\nz\u2208H\u03b1\nf ( |z|h \u2212 R\n))\n= 2C (\u03b1) R\n\u222b\nR\nf 2(x)exdx\u2212 2C (\u03b1) R\nB(\u03b1, \u03b1+ 1)\n\u222b\nR2\nf(x)f(y) e(\u03b1+1)(x+y)\n(ex + ey)2\u03b1+1 dxdy +O(1).\nBy noticing that\n1\nB(\u03b1, \u03b1 + 1)\n\u222b\nR\ne(\u03b1+1)(x+y)\n(ex + ey)2\u03b1+1 dy = ex,\nwe may conclude that\nVar ( \u2211\nz\u2208H\u03b1\nf ( |z|h \u2212 R )) =\nC (\u03b1) R\nB(\u03b1, \u03b1 + 1)\n\u222b\nR2\n[ f(x)\u2212 f(y) ]2 e(\u03b1+1)(x+y)\n(ex + ey)2\u03b1+1 dxdy +O(1).\n2.3. Soshnikov\u2019s conditions and conclusion of the proof. We will use the following central limit theorem, derived by Soshnikov [18, Theorem 1], to prove Theorem 1.1.\nTheorem 2.3 (The central limit theorem of Soshnikov). For L > 0, suppose that XL is a determinantal point process on a locally compact Polish space XL with Hermitian kernel KL with respect to the reference Radon measure \u00b5L. By slightly abusing the notation, also denote KL the associated integral operator with integral kernel KL on L\n2(XL, \u00b5L), that is, KL : L 2(XL, \u00b5L) \u2192 L2(XL, \u00b5L) is defined by\nKLf(x) =\n\u222b\nXL\nKL(x, y)f(y)d\u00b5L(y), f \u2208 L2(XL, \u00b5L),\nand suppose that for any pre-compact Borel set \u2206 \u2282 XL, the operator KL \u03c7\u2206 is trace-class, where \u03c7\u2206 denotes the multiplication operator by the indicator of \u2206.\nLet fL be a real-valued bounded measurable function on XL with compact support and consider the linear statistics SfL = \u2211 x\u2208XL fL(x). If\n\u2022 VarSfL \u2192 +\u221e as L \u2192 +\u221e, \u2022 supx\u2208XL |fL(x)| = o((VarfL)\u03b5) as L \u2192 +\u221e for any \u03b5 > 0 and \u2022 ES|fL| = O((VarSfL)\u03b4) as L \u2192 +\u221e for some \u03b4 > 0,\nthen the centered normalized linear statistics converges in law to the standard normal\ndistribution, i.e.,\nSfL \u2212 ESfL\u221a VarSfL law\u2212\u2212\u2212\u2192 L\u2192\u221e N (0, 1)\nWhen R \u2192 +\u221e, with the help of Subsection 2.1 and Subsection 2.2, we have\nE\n[ \u2211\nz\u2208H\u03b1\n\u2223\u2223f ( |z|h \u2212 R )\u2223\u2223 ] \u223c 2C(\u03b1)R\n\u222b\nR\n|f(x)|exdx, and\nVar ( \u2211\nz\u2208H\u03b1\nf ( |z|h \u2212 R )) \u223c C(\u03b1)R V (\u03b1) f .\nApplying Soshnikov\u2019s Theorem 2.3 to \u2211 z\u2208H\u03b1 f ( |z|h \u2212R ) , we get\n\u2211 z\u2208H\u03b1 f ( |z|h \u2212R ) \u2212 E [\u2211 z\u2208H\u03b1 f ( |z|h \u2212 R )] \u221a\nVar (\u2211 z\u2208H\u03b1 f ( |z|h \u2212 R\n)) law\u2212\u2212\u2212\u2212\u2192 R\u2192+\u221e N (0, 1).\nThis gives that\n1\u221a C\n(\u03b1) R\n\u2211\nz\u2208H\u03b1\nf ( |z|h \u2212 R ) \u2212 1\u221a\nC (\u03b1) R\nE\n[ \u2211\nz\u2208H\u03b1\nf ( |z|h \u2212 R )] law\u2212\u2212\u2212\u2212\u2192 R\u2192+\u221e N ( 0, V (\u03b1) f ) .\nMoreover, it follows from Subsection 2.1 that\n1\u221a C\n(\u03b1) R\nE\n[ \u2211\nz\u2208H\u03b1\nf ( |z|h \u2212R )] \u2212 2 \u221a C (\u03b1) R \u222b\nR\nf(x)exdx \u2212\u2212\u2212\u2212\u2192 R\u2192+\u221e 0,\nhence\n1\u221a C\n(\u03b1) R\n\u2211\nz\u2208H\u03b1\nf ( |z|h \u2212 R ) \u2212 2 \u221a C (\u03b1) R \u222b\nR\nf(x)exdx law\u2212\u2212\u2212\u2212\u2192 R\u2192+\u221e N ( 0, V (\u03b1) f ) .\nThis completes the proof of Theorem 1.1.\n3. The Ginibre process proof of Theorem 1.2\nThe proof of Theorem 1.2 follows the same ideas as the proof of Theorem 1.1. Moreover, the calculation of the variance can be nicely done using the same Riemann sum\u2019s argument as before. Nevertheless, we have decided to use formulas (1.2) and (1.3) to emphasize a slightly different way.\n3.1. Expected value calculation for Theorem 1.2. For the expectation of the random variable \u2211 z\u2208G f ( |z| \u2212 R ) , notice that, since KG(z, z) = 1/\u03c0, we have\nE\n[\u2211\nz\u2208G f ( |z| \u2212 R )] =\n\u222b\nC\nf ( |z| \u2212R ) KG(z, z)dm(z)\n= 1\n\u03c0\n\u222b\nC\nf ( |z| \u2212 R ) dm(z).\nBy using polar coordinates and making a variable substitution, we get\nE\n[\u2211\nz\u2208G f ( |z| \u2212 R )] = 2\n\u222b +\u221e\n0\nf(r \u2212 R)rdr\n= 2\n\u222b +\u221e\n\u2212R f(x)dx \u00b7 R + 2\n\u222b +\u221e\n\u2212R xf(x)dx,\nthat is,\nE\n[\u2211\nz\u2208G f ( |z| \u2212 R )] = 2R\n\u222b\nR\nf(x)dx+O(1).\n3.2. Variance calculation for Theorem 1.2. For the variance of the random variable\u2211 z\u2208G f ( |z| \u2212 R ) , we use that\n\u2223\u2223KG(z, w) \u2223\u22232 = 1\n\u03c02 e\u2212|z\u2212w| 2 ,\nto obtain\nVar (\u2211 z\u2208G f ( |z| \u2212 R )) = 1 2\n\u222b\nC2\n[ f ( |z| \u2212 R ) \u2212 f ( |w| \u2212 R )]2\u2223\u2223KG(z, w) \u2223\u22232dm(z)dm(w)\n= 1\n2\u03c02\n\u222b\nC2\n[ f ( |z| \u2212R ) \u2212 f ( |w| \u2212 R )]2 e\u2212|z\u2212w| 2 dm(z)dm(w).\nBy using polar coordinates, we get\nVar (\u2211 z\u2208G f ( |z| \u2212 R ))\n= 1\n2\u03c02\n\u222b +\u221e\n0\n\u222b +\u221e\n0\n\u222b \u03c0\n\u2212\u03c0\n\u222b \u03c0\n\u2212\u03c0\n[ f(r \u2212 R)\u2212 f(\u03c1\u2212 R) ]2 e\u2212|re i\u03b8\u2212\u03c1ei\u03d5|2r\u03c1d\u03b8d\u03d5drd\u03c1\n= 1\n\u03c0\n\u222b +\u221e\n0\n\u222b +\u221e\n0\n\u222b \u03c0\n\u2212\u03c0\n[ f(r \u2212 R)\u2212 f(\u03c1\u2212R) ]2 e\u2212|re i\u03b8\u2212\u03c1|2r\u03c1d\u03b8d\u03d5dr\n= 2\n\u03c0\n\u222b +\u221e\n0\n\u222b +\u221e\n0\n[ f(r \u2212 R)\u2212 f(\u03c1\u2212 R) ]2 e\u2212r 2\u2212\u03c12r\u03c1\n\u222b \u03c0\n0\ne2r\u03c1 cos \u03b8d\u03b8drd\u03c1.\nBy the change of variables x = r \u2212R and y = \u03c1\u2212R, we have\nVar (\u2211 z\u2208G f ( |z| \u2212 R ))\n= 2\n\u03c0\n\u222b +\u221e\n\u2212R\n\u222b +\u221e\n\u2212R\n[ f(x)\u2212 f(y) ]2 e\u2212(R+x) 2\u2212(R+y)2(R + x)(R + y)\n\u222b \u03c0\n0\ne2(R+x)(R+y) cos \u03b8d\u03b8dxdy\n= 2\n\u03c0\n\u222b +\u221e\n\u2212R\n\u222b +\u221e\n\u2212R\n[ f(x)\u2212 f(y) ]2 e\u2212(x\u2212y) 2 (R + x)(R + y)\n\u222b \u03c0\n0\ne\u22124(R+x)(R+y) sin 2 \u03b8 2d\u03b8dxdy.\nLet \u03b8 = t/ \u221a (R + x)(R + y), we obtain\nVar (\u2211 z\u2208G f ( |z| \u2212 R )) = 2 \u03c0\n\u222b +\u221e\n\u2212R\n\u222b +\u221e\n\u2212R\n[ f(x)\u2212 f(y) ]2 e\u2212(x\u2212y) 2 \u221a (R + x)(R + y)\n\u00b7 \u222b \u03c0\u221a(R+x)(R+y)\n0\ne \u22124(R+x)(R+y) sin2 t 2 \u221a (R+x)(R+y)dtdxdy.\nConsider the integral \u222b\nR3\n[ f(x)\u2212 f(y) ]2 e\u2212(x\u2212y) 2 \u221a (1 + x/R)(1 + y/R) e \u22124(R+x)(R+y) sin2 t 2 \u221a (R+x)(R+y)\n\u00b7 \u03c7[ 0,\u03c0 \u221a (R+x)(R+y) ](t)\u03c7[\u2212R,+\u221e)(x)\u03c7[\u2212R,+\u221e)(y)dtdxdy.\nWhen R is sufficiently large, the integrand is dominated by [ f(x)\u2212 f(y) ]2 e\u2212(x\u2212y) 2 \u221a (1 + |x|)(1 + |y|) e\u2212 4\u03c02 t2\u03c7[0,+\u221e](t),\nhence by the dominated convergence theorem, as R \u2192 +\u221e, the integral converges to\u221a \u03c0\n2\n\u222b\nR2\n[ f(x)\u2212 f(y) ]2 e\u2212(x\u2212y) 2 dxdy.\nIt follows that, when R \u2192 +\u221e,\nVar (\u2211 z\u2208G f ( |z| \u2212 R )) \u223c R\u221a \u03c0\n\u222b\nR2\n[ f(x)\u2212 f(y) ]2 e\u2212(x\u2212y) 2 dxdy.\n3.3. Soshnikov\u2019s conditions and conclusion of the proof. When R \u2192 +\u221e, with the help of Subsection 3.1 and Subsection 3.2, we have\nE\n[\u2211\nz\u2208G\n\u2223\u2223f ( |z| \u2212 R )\u2223\u2223 ] \u223c 2R\n\u222b\nR\n|f(x)|dx, and\nVar (\u2211 z\u2208G f ( |z| \u2212 R )) \u223c RVf .\nApplying Soshnikov\u2019s Theorem 2.3 to \u2211 z\u2208G f ( |z| \u2212R ) , we get\n\u2211 z\u2208G f ( |z| \u2212R ) \u2212 E [\u2211 z\u2208G f ( |z| \u2212 R )] \u221a\nVar (\u2211 z\u2208G f ( |z| \u2212R\n)) law\u2212\u2212\u2212\u2212\u2192 R\u2192+\u221e N (0, 1).\nThis gives that\n1\u221a R\n\u2211 z\u2208G f ( |z| \u2212R ) \u2212 1\u221a R E [\u2211 z\u2208G f ( |z| \u2212 R )] law\u2212\u2212\u2212\u2212\u2192 R\u2192+\u221e N (0, Vf).\nMoreover, it follows from Subsection 3.1 that\n1\u221a R E\n[\u2211\nz\u2208G f ( |z| \u2212R )] \u2212 2 \u221a R\n\u222b\nR\nf(x)exdx \u2212\u2212\u2212\u2212\u2192 R\u2192+\u221e 0,\nhence 1\u221a R \u2211 z\u2208G f ( |z| \u2212 R ) \u2212 2 \u221a R \u222b R f(x)exdx law\u2212\u2212\u2212\u2212\u2192 R\u2192+\u221e N (0, Vf).\nThis completes the proof of Theorem 1.2.\n4. Proof of Theorem 1.3 (hyperbolic case)\nIn the case 1 \u226a aR \u226a eR as R \u2192 +\u221e, the proof of Theorem 1.3 follows the same steps as the proof of Theorem 1.1: first we need to understand the expected value, then to calculate the limiting variance, and finally to use Soshnikov\u2019s Theorem 2.3.\nLet us begin by writing\nE\n[ \u2211\nz\u2208H\u03b1\nf ( aR(|z|h \u2212 R)\n)]\n= 4\u03b1 \u222b +\u221e\n\u2212R\n\u221e\u2211\nn=0\nf(aRy)k (\u03b1) n\n( 1\u2212 2\neR+y + 1 )2n+1 e\u2212\u03b1(R+y) (1 + e\u2212(R+y))2\u03b1 dy\n= 4\u03b1 \u222b +\u221e\n\u2212RaR\n\u221e\u2211\nn=0\nf(x)k(\u03b1)n\n( 1\u2212 2\ne R+ x aR + 1\n)2n+1 e\u2212\u03b1(R+ x aR )\n( 1 + e \u2212(R+ x aR\n))2\u03b1 dx\naR .\nBy taking n = \u230ateR+x/aR\u230b, we get aR eR E [ \u2211\nz\u2208H\u03b1\nf ( aR(|z|h \u2212 R)\n)]\n= 4\u03b1 \u222b +\u221e\n\u2212RaR\n( \u221e\u2211\nn=0\nf(x)e x\naR k(\u03b1)n\n( 1\u2212 2\ne R+ x aR + 1\n)2n+1 e\u2212\u03b1(R+ x aR )\n( 1 + e \u2212(R+ x aR\n))2\u03b1 (e \u2212(R+ x aR ) )\n) dx\n= 4\u03b1 \u222b +\u221e\n\u2212RaR\n(\u222b +\u221e\n0\nf(x)e x aR k (\u03b1)\n\u230ateR+ x aR \u230b\n( 1\u2212 2\ne R+ x aR + 1\n)2\u230ateR+ xaR \u230b+1 e\u2212\u03b1(R+ x aR )\n(1 + e \u2212(R+ x aR ) )2\u03b1\ndt ) dx.\nThis can be done in the same way as in Subsection 2.1. Notice that x \u2208 suppf and 1 \u226a aR \u226a eR as R \u2192 +\u221e. We can show that for sufficiently large R,\naR eR E\n[ \u2211\nz\u2208H\u03b1\nf ( aR(|z|h \u2212 R)\n)]\n= 4\u03b1 \u222b +\u221e\n\u2212RaR\n\u222b +\u221e\n0\nf(x) t\u03b1e\n\u03b1(R+ x aR ) \u0393(\u03b1) e\u22124te \u2212\u03b1(R+ x aR ) dtdx+O(e\u2212R)\n= 4\u03b1\n\u0393(\u03b1)\n\u222b +\u221e\n0\nt\u03b1e\u22124tdt\n\u222b\nR\nf(x)dx+O(e\u2212R)\n= \u03b1\n4\n\u222b\nR\nf(x)dx+O(e\u2212R),\nthat is,\nE\n[ \u2211\nz\u2208H\u03b1\nf ( aR(|z|h \u2212 R) )] = 2C (\u03b1) R\naR\n\u222b\nR\nf(x)dx+O ( 1 aR ) .\nAs for the variance\nVar ( \u2211\nz\u2208H\u03b1\nf ( aR(|z|h \u2212 R) )) = \u221e\u2211\nn=0\nE [ f 2 ( aR(|\u03c1(\u03b1)n |h \u2212 R) )] \u2212 \u221e\u2211\nn=0\nE [ f ( aR(|\u03c1(\u03b1)n |h \u2212 R) )]2 ,\nthe first term satisfies\n\u221e\u2211\nn=0\nE [ f 2 ( aR(|\u03c1(\u03b1)n |h \u2212R) )] = 2C (\u03b1) R\naR\n\u222b\nR\nf 2(x)dx+O ( 1 aR ) .\nThe second term can be dealt with in the same way as in Subsection 2.2,\n\u221e\u2211\nn=0\nE [ f ( aR(|\u03c1(\u03b1)n |h \u2212 R) )]2\n= 42\u03b1 \u221e\u2211\nn=0\n(\u222b +\u221e\n\u2212R f(aRx)k\n(\u03b1) n\n( 1\u2212 2\neR+x + 1 )2n+1 e\u03b1(R+x) (eR+x + 1)2\u03b1 dx\n)2\n= 42\u03b1 \u221e\u2211\nn=0\n(\u222b +\u221e\n\u2212RaR f(x)k(\u03b1)n\n( 1\u2212 2\ne R+ x aR + 1\n)2n+1 e\u03b1(R+ x aR )\n(e R+ x aR + 1)2\u03b1 dx )2 \u00b7 1 a2R ,\nset n = \u230ateR\u230b, then \u221e\u2211\nn=0\nE [ f ( aR(|\u03c1(\u03b1)n |h \u2212 R) )]2\n= 42\u03b1 \u222b +\u221e\n0\n(\u222b +\u221e\n\u2212RaR f(x)k\n(\u03b1) \u230ateR\u230b\n( 1\u2212 2\ne R+ x aR + 1\n)2\u230ateR\u230b+1 e\u03b1(R+ x aR )\n(e R+ x aR + 1)2\u03b1 dx\n)2 dt \u00b7 e R\na2R .\nHence when R \u2192 +\u221e, \u221e\u2211\nn=0\nE [ f ( aR(|\u03c1(\u03b1)n |h \u2212R) )]2 \u223c 42\u03b1\n\u222b +\u221e\n0\n(\u222b +\u221e\n\u2212RaR f(x)\nt\u03b1e\u03b1R\n\u0393(\u03b1) e\u22124te\u22122\u03b1Re\u03b1Rdx\n)2 dt \u00b7 e R\na2R\n= 42\u03b1\n\u03932(\u03b1)\n\u222b +\u221e\n0\nt2\u03b1e\u22128tdt\n(\u222b\nR\nf(x)dx )2 \u00b7 e R\na2R\n= \u03b1\n22\u03b1+3B(\u03b1, \u03b1+ 1)\n(\u222b\nR\nf(x)dx )2 \u00b7 e R\na2R\n= O (C(\u03b1)R\na2R\n) .\nTherefore, we obtain\nVar ( \u2211\nz\u2208H\u03b1\nf ( aR(|z|h \u2212 R) )) = 2C (\u03b1) R\naR\n\u222b\nR\nf 2(x)dx+O ( 1 aR ) +O (C(\u03b1)R a2R ) .\nIn the case 1 \u226a aR \u226a eR as R \u2192 +\u221e, applying Soshnikov\u2019s Theorem 2.3, the above calculations yield that\n\u2211 z\u2208H\u03b1 f ( aR(|z|h \u2212R) ) \u2212 E [\u2211 z\u2208H\u03b1 f ( aR(|z|h \u2212 R) )] \u221a Var (\u2211 z\u2208H\u03b1 f ( aR(|z|h \u2212 R) )) law\u2212\u2212\u2212\u2212\u2192 R\u2192+\u221e N (0, 1).\nThis gives that \u221a\naR\nC (\u03b1) R\n\u2211 z\u2208H\u03b1 f ( aR(|z|h \u2212R)\n) \u2212 \u221a aR\nC (\u03b1) R\nE\n[ \u2211\nz\u2208H\u03b1 f ( aR(|z|h \u2212 R)\n)]\nlaw\u2212\u2212\u2212\u2212\u2192 R\u2192+\u221e\nN ( 0, 2\n\u222b\nR\nf 2(x)dx ) .\nMoreover,\n\u221a aR\nC (\u03b1) R\nE\n[ \u2211\nz\u2208H\u03b1\nf ( aR(|z|h \u2212R) )] \u2212 2\n\u221a C\n(\u03b1) R\naR\n\u222b\nR\nf(x)dx \u2212\u2212\u2212\u2212\u2192 R\u2192+\u221e 0,\nhence \u221a\naR\nC (\u03b1) R\n\u2211\nz\u2208H\u03b1\nf ( aR(|z|h \u2212R) ) \u2212 2\n\u221a C\n(\u03b1) R\naR\n\u222b\nR\nf(x)dx law\u2212\u2212\u2212\u2212\u2192 R\u2192+\u221e N ( 0, 2\n\u222b\nR\nf 2(x)dx ) ,\nThis completes the proof of Theorem 1.3.\n5. Proof of Theorem 1.4 (Ginibre case)\nIn the case 1 \u226a aR \u226a R as R \u2192 +\u221e, the proof of Theorem 1.4 follows the same steps as the proof of Theorem 1.2.\nFor the expectation of the random variable \u2211 z\u2208G f ( aR(|z| \u2212 R) ) , we have\nE\n[\u2211\nz\u2208G f ( aR(|z| \u2212R) )] = 2\n\u222b +\u221e\n\u2212R f(aRx)dx \u00b7 R + 2\n\u222b +\u221e\n\u2212R xf(aRx)dx\n= 2\n\u222b +\u221e\n\u2212RaR f(x)dx \u00b7 R aR + 2\n\u222b +\u221e\n\u2212RaR xf(x)dx \u00b7 1 a2R ,\nthat is,\nE\n[\u2211\nz\u2208G f ( aR(|z| \u2212 R) )] = 2R aR\n\u222b\nR f(x)dx+O ( 1 a2R ) .\nAs for the variance of the random variable \u2211 z\u2208G f ( aR(|z| \u2212R) ) , we have\nVar (\u2211 z\u2208G f ( aR(|z| \u2212R) ))\n= 2\n\u03c0\n\u222b +\u221e\n\u2212R\n\u222b +\u221e\n\u2212R\n[ f(aRx)\u2212 f(aRy) ]2 e\u2212(x\u2212y) 2 \u221a (R + x)(R + y)\n\u00b7 \u222b \u03c0\u221a(R+x)(R+y)\n0\ne \u22124(R+x)(R+y) sin2 t 2 \u221a (R+x)(R+y)dtdxdy\n= 2\n\u03c0\n\u222b +\u221e\n\u2212RaR\n\u222b +\u221e\n\u2212RaR\n[ f(x)\u2212 f(y) ]2 e \u2212 (x\u2212y) 2 a2 R \u221a( R + x\naR\n)( R + y\naR\n)\n\u00b7 \u222b \u03c0\u221a(R+ x aR )(R+ y aR )\n0\ne \u22124(R+ x aR )(R+ y aR ) sin2 t\n2 \u221a\n(R+ xaR )(R+ y aR ) dtdxdy \u00b7 1\na2R = I1(R) + I2(R),\nwhere\nI1(R) = 4\n\u03c0\n\u222b +\u221e\n\u2212RaR\n\u222b +\u221e\n\u2212RaR\n\u222b \u03c0\u221a(R+ x aR )(R+ y aR )\n0\nf 2(x)e \u2212 (x\u2212y)\n2\na2 R \u221a( 1 + x\nRaR\n)( 1 + y\nRaR\n)\n\u00b7 e \u22124(R+ x aR )(R+ y aR ) sin2 t\n2 \u221a\n(R+ xaR )(R+ y aR ) dtdxdy \u00b7 R\na2R\n= 4\n\u03c0\n\u222b +\u221e\n\u2212R\n\u222b +\u221e\n\u2212RaR\n\u222b \u03c0\u221a(R+ x aR )(R+u)\n0\nf 2(x)e \u2212( x aR \u2212u)2 \u221a( 1 + x\nRaR\n)( 1 + u\nR\n)\n\u00b7 e \u22124(R+ x aR )(R+u) sin2 t\n2 \u221a\n(R+ xaR )(R+u) dtdxdu \u00b7 R aR ,\nand\nI2(R) = 4\n\u03c0\n\u222b +\u221e\n\u2212RaR\n\u222b +\u221e\n\u2212RaR\n\u222b \u03c0\u221a(R+ x aR )(R+ y aR )\n0\nf(x)f(y)e \u2212 (x\u2212y)\n2\na2R \u221a( 1 + x\nRaR\n)( 1 + y\nRaR\n)\n\u00b7 e \u22124(R+ x aR )(R+ y aR ) sin2 t\n2 \u221a\n(R+ xaR )(R+ y aR ) dtdxdy \u00b7 R\na2R .\nConsider the integral \u222b\nR3\nf 2(x)e \u2212( x aR \u2212u)2 \u221a( 1 + x\nRaR\n)( 1 + u\nR\n) e \u22124(R+ x aR )(R+u) sin2 t 2 \u221a (R+ xaR )(R+u)\n\u00b7 \u03c7[ 0,\u03c0 \u221a\n(R+ x aR\n)(R+u) ](t)\u03c7[\u2212RaR,+\u221e)(x)\u03c7[\u2212R,+\u221e)(u)dtdxdu.\nWhen R is sufficiently large, the integrand is dominated by\ne2l 2 f 2(x)e\u2212(|u|\u2212l) 2 \u221a\n(1 + |x|)(1 + |u|) e\u2212 4\u03c02 t2\u03c7[0,+\u221e)(t), where l = max\nx\u2208suppf |x|. Here we used the fact that when x \u2208 suppf ,\ne \u2212( x aR \u2212u)2 = e \u2212u2+2u x aR \u2212 x2 a2 R \u2264 e\u2212u2+2|u||x|+|x|2 \u2264 e\u2212u2+2|u|l+l2 = e2l2e\u2212(|u|\u2212l)2 .\nHence by the dominated convergence theorem, as R \u2192 +\u221e, the integral converges to \u222b\nR3\nf 2(x)e\u2212u 2 e\u2212t 2 \u03c7[0,+\u221e)(t)dtdxdu = \u03c0\n2\n\u222b\nR\nf 2(x)dx.\nIt follows that when R \u2192 +\u221e,\nI1(R) \u223c 2R\naR\n\u222b\nR\nf 2(x)dx.\nConsider the integral \u222b\nR3\nf(x)f(y)e \u2212 (x\u2212y)\n2\na2 R \u221a( 1 + x\nRaR\n)( 1 + y\nRaR\n) e \u22124(R+ x aR )(R+ y aR ) sin2 t 2 \u221a (R+ xaR )(R+ y aR )\n\u00b7 \u03c7[ 0,\u03c0 \u221a (R+ x\naR )(R+ y aR )\n](t)\u03c7[\u2212RaR,+\u221e)(x)\u03c7[\u2212RaR,+\u221e)(u)dtdxdy.\nWhen R is sufficiently large, the integrand is dominated by\n|f(x)f(y)| \u221a (1 + |x|)(1 + |y|) e\u2212 4\u03c02 t2\u03c7[0,+\u221e)(t).\nHence by the dominated convergence theorem, as R \u2192 +\u221e, the integral converges to \u222b\nR3\nf(x)f(y)e\u2212t 2\n\u03c7[0,+\u221e)(t)dtdxdy =\n\u221a \u03c0\n2\n(\u222b\nR\nf(x)dx )2 .\nIt follows that when R \u2192 +\u221e,\nI2(R) \u223c 2R\u221a \u03c0a2R\n(\u222b\nR\nf(x)dx )2 = o ( R aR ) .\nTherefore, when R \u2192 +\u221e,\nVar (\u2211 z\u2208G f ( aR(|z| \u2212R) )) \u223c 2R aR\n\u222b\nR\nf 2(x)dx.\nIn the case 1 \u226a aR \u226a R as R \u2192 +\u221e, applying Soshnikov\u2019s Theorem 2.3, the above calculations yield that\n\u2211 z\u2208G f ( aR(|z| \u2212R) ) \u2212 E [\u2211 z\u2208G f ( aR(|z| \u2212 R) )] \u221a Var (\u2211 z\u2208G f ( aR(|z| \u2212 R) )) law\u2212\u2212\u2212\u2212\u2192 R\u2192+\u221e N (0, 1).\nThis gives that \u221a\naR R\n\u2211 z\u2208G f ( aR(|z| \u2212 R)\n) \u2212 \u221a\naR R E\n[\u2211\nz\u2208G f ( aR(|z| \u2212 R) )] law\u2212\u2212\u2212\u2212\u2192 R\u2192+\u221e N ( 0, 2\n\u222b\nR\nf 2(x)dx ) .\nMoreover, \u221a\naR R E\n[\u2211\nz\u2208G f ( aR(|z| \u2212R)\n)] \u2212 2 \u221a R\naR\n\u222b\nR\nf(x)dx \u2212\u2212\u2212\u2212\u2192 R\u2192+\u221e 0,\nhence \u221a\naR R\n\u2211 z\u2208G f ( aR(|z| \u2212R)\n) \u2212 2 \u221a R\naR\n\u222b\nR\nf(x)dx law\u2212\u2212\u2212\u2212\u2192 R\u2192+\u221e N ( 0, 2\n\u222b\nR\nf 2(x)dx ) .\nThis completes the proof of Theorem 1.4.\n6. Proof of Theorem 1.5 and Theorem 1.6\n6.1. A Lemma of convergence towards the Poisson point process. The main reason why a Poisson point process appears is because we are dealing with independent particles. Nevertheless, this is not enough. We need that each particle escapes every bounded set and we need this to be done in a uniform way. More precisely, we use the following lemma.\nLemma 6.1. For each R > 0, let {X(R)n : n \u2208 N} be a sequence of independent real-valued random variables. Suppose that for every compact K \u2282 R,\nsup n\u22650 P(X(R)n \u2208 K) \u2212\u2212\u2212\u2212\u2192 R\u2192+\u221e 0,\nand suppose that there is a positive Radon measure \u03bd on R such that \u221e\u2211\nn=0\nE [ f(X(R)n ) ] \u2212\u2212\u2212\u2212\u2192 R\u2192+\u221e\n\u222b\nR\nfd\u03bd\nfor every measurable compactly supported function f : R \u2192 [0, 1). Then for every measurable compactly supported function f : R \u2192 [0, 1),\nE\n[ \u221e\u220f\nn=0\n( 1\u2212 f(X(R)n ) ) ] \u2212\u2212\u2212\u2212\u2192 R\u2192+\u221e exp ( \u2212 \u222b\nR\nfd\u03bd ) .\nProof of Lemma 6.1. For every measurable compactly supported function f : R \u2192 [0, 1), by independence, we have\nE\n[ \u221e\u220f\nn=0\n( 1\u2212 f(X(R)n ) ) ] = \u221e\u220f\nn=0\nE [ 1\u2212 f(X(R)n ) ] =\n\u221e\u220f\nn=0\n( 1\u2212 E [ f(X(R)n ) ]) ,\nand then\nlogE\n[ \u221e\u220f\nn=0\n( 1\u2212 f(X(R)n ) ) ] = \u221e\u2211\nn=0\nlog ( 1\u2212 E [ f(X(R)n ) ]) .\nWe can use the fact that log(1 \u2212 x) = \u2212x + \u0398(x), where \u0398(x) = O(x2) as x \u2192 0, to obtain that\n\u221e\u2211\nn=0\nlog ( 1\u2212 E [ f(X(R)n ) ]) = \u2212 \u221e\u2211\nn=0\nE [ f(X(R)n ) ] +\n\u221e\u2211\nn=0\n\u0398 ( E [ f(X(R)n ) ]) .\nNote that\nsup n\u22650\nE [ f(X(R)n ) ] \u2264 sup\nn\u22650 P(X(R)n \u2208 suppf) \u2212\u2212\u2212\u2212\u2192 R\u2192+\u221e 0,\nand the convergence of \u2211\u221e n=0E [ f(X (R) n ) ] , we get\n\u221e\u2211\nn=0\n\u0398 ( E [ f(X(R)n ) ]) = O\n( \u221e\u2211\nn=0\nE [ f(X(R)n )\n]2 )\n= O ( sup n\u22650 E [ f(X(R)n ) ]) \u2212\u2212\u2212\u2212\u2192 R\u2192+\u221e 0.\nThis implies that \u221e\u2211\nn=0\nlog ( 1\u2212 E [ f(X(R)n ) ]) \u2212\u2212\u2212\u2212\u2192 R\u2192+\u221e \u2212 \u222b\nR\nfd\u03bd.\nTherefore,\nE\n[ \u221e\u220f\nn=0\n( 1\u2212 f(X(R)n ) ) ] \u2212\u2212\u2212\u2212\u2192 R\u2192+\u221e exp ( \u2212 \u222b\nR\nfd\u03bd ) .\nThis completes the proof of Lemma 6.1.\nCorollary 6.2 (Convergence towards a PPP). Under the conditions of Lemma 6.1. If, moreover, X (R) = {X(R)n : n \u2208 N} is a point process on R for each R > 0. Then\nX (R) law\u2212\u2212\u2212\u2212\u2192 R\u2192+\u221e P\u03bd ,\nwhere P\u03bd is the Poisson point process on R with mean measure or intensity \u03bd.\n6.2. Proof of Theorem 1.5 (hyperbolic case). Recall that (\u03c1 (\u03b1) n )n\u22650, \u03b1 > 0, is a family of non-negative independent random variables such that\n\u03c1(\u03b1)n \u223c 2 \u0393(\u03b1 + n+ 1) \u0393(\u03b1)\u0393(n+ 1) r2n+1(1\u2212 r2)\u03b1\u22121dr.\nFix \u03b1 > 0, if we define X (R) n = eR(|\u03c1(\u03b1)n |h \u2212 R) for each R > 0 and n \u2208 N, we can obtain that\n{eR(|z|h \u2212 R) : z \u2208 H\u03b1} \u223c {X(R)n : n \u2208 N}. We are going to show that\n{X(R)n : n \u2208 N} law\u2212\u2212\u2212\u2212\u2192 R\u2192+\u221e P\u03b1/4.\nFor every measurable compactly supported function f : R \u2192 [0, 1), a similar argument as Section 4 gives that\n\u221e\u2211\nn=0\nE [ f(X(R)n ) ]\n= 4\u03b1 \u222b +\u221e\n\u2212ReR\n\u222b +\u221e\n0\nf(x)ex/e R k (\u03b1)\n\u230ateR+x/eR\u230b\n( 1\u2212 2\neR+x/eR + 1 )2\u230ateR+x/eR\u230b+1 e\u03b1(R+x/eR) (eR+x/eR + 1)2\u03b1 dtdx\n\u2212\u2212\u2212\u2212\u2192 R\u2192+\u221e\n\u03b1\n4\n\u222b\nR\nf(x)dx.\nHence by Corollary 6.2, we shall prove that for every T > 0,\nsup n\u22650 P(X(R)n \u2208 [\u2212T, T ]) \u2212\u2212\u2212\u2212\u2192 R\u2192+\u221e 0.\nWhen R is large enough, we have\nP(X(R)n \u2208 [\u2212T, T ]) = 4\u03b1 \u222b T\n\u2212T\n\u0393(\u03b1 + n+ 1)\n\u0393(\u03b1)\u0393(n+ 1)\n( 1\u2212 2\neR+x/eR + 1 )2n+1 e\u03b1(R+x/eR) (eR+x/eR + 1)2\u03b1 dx \u00b7 1 eR\n\u2264 2 2\u03b1+1T eR \u00b7 \u0393(\u03b1 + n+ 1) \u0393(\u03b1)\u0393(n+ 1)\n( 1\u2212 2\neR+T/eR + 1 )2n+1 1 e\u03b1(R\u2212T/eR)\n\u2264 2 4\u03b1+1T eR \u00b7 \u0393(\u03b1 + n+ 1) \u0393(\u03b1)\u0393(n+ 1)\n( 1\u2212 1\n2eR )2n+1 1 e\u03b1R .\nNotice that there exists a constant C > 0 depending only on \u03b1 such that for any n \u2208 N, \u0393(\u03b1 + n+ 1)\n\u0393(\u03b1)\u0393(n+ 1) \u2264 Cn\u03b1,\nand ( 1\u2212 1\n2eR\n)2n+1 = [( 1 + 1 2eR \u2212 1 )2eR]\u2212 2n+1 2eR \u2264 e\u2212n/eR .\nHence\nP(X(R)n \u2208 [\u2212T, T ]) \u2264 24\u03b1+1CT\neR (n/eR)\u03b1e\u2212n/e R .\nSince x\u03b1e\u2212x is bounded for x > 0, we get\nsup n\u22650\nP(X(R)n \u2208 [\u2212T, T ]) = O(e\u2212R).\nThis completes the proof of Theorem 1.5.\n6.3. Proof of Theorem 1.6 (Ginibre case). Recall that (\u03c1n)n\u22650 is a family of nonnegative independent random variables such that\n\u03c1n \u223c 2r2n+1e\u2212r 2\nn! dr.\nIf we define X (R) n = R(\u03c1n \u2212 R) for each R > 0 and n \u2208 N, we can obtain that\n{R(|z| \u2212R) : z \u2208 G} \u223c {X(R)n : n \u2208 N}.\nWe are going to show that\n{X(R)n : n \u2208 N} law\u2212\u2212\u2212\u2212\u2192 R\u2192+\u221e P2.\nFor every measurable compactly supported function f : R \u2192 [0, 1), a similar argument as Section 5 gives that\n\u221e\u2211\nn=0\nE [ f(X(R)n ) ] = 2\n\u222b +\u221e\n\u2212R2 f(x)dx+ 2\n\u222b +\u221e\n\u2212R2 xf(x)dx \u00b7 1 R2 \u2212\u2212\u2212\u2212\u2192 R\u2192+\u221e 2\n\u222b\nR\nf(x)dx.\nHence by Corollary 6.2, we shall prove that for every T > 0,\nsup n\u22650 P(X(R)n \u2208 [\u2212T, T ]) \u2212\u2212\u2212\u2212\u2192 R\u2192+\u221e 0.\nWhen R is large enough, we have\nP(X(R)n \u2208 [\u2212T, T ]) = 2 \u222b T\n\u2212T\n(R + x R )2n+1\nn! e\u2212(R+\nx R )dx \u00b7 1\nR\n\u2264 4R 2n(1 + T R2 )2n\nn! e\u2212R 2\n\u222b T\n\u2212T e\u22122x\u2212\nx2 R2 dx\n\u2264 8Te2T R 2ne\n2nT R2\nn! e\u2212R 2\n\u2264 8Te2T ( \u2308R2e 2TR2 \u2309 )n\nn! e\u2212R 2 .\nNotice that\n\u2308R2e 2TR2 \u2309n n!\n\u2264 ( \u2308R2e 2TR2 \u2309 )\u2308R2e 2TR2 \u2309\n\u2308R2e 2TR2 \u2309! = O\n  e \u2308R2e 2T R2 \u2309\n\u221a \u2308R2e 2TR2 \u2309\n  = O (eR2\nR\n) ,\nwhere we used the Stirling\u2019s approximation. It follows that\nsup n\u22650\nP(X(R)n \u2208 [\u2212T, T ]) = O(R\u22121).\nThis completes the proof of Theorem 1.6.\n7. The case of superexponential growth\n7.1. Fluctuations in the hyperbolic case. Theorem 1.5 explains that the limiting behaviour of the point process {eR(|z|h \u2212 R) : z \u2208 H\u03b1} is Poisson when R \u2192 +\u221e. For a bounded measurable and compactly supported function f : R \u2192 R, Theorem 1.1 illustrates that the limiting behaviour of\n\u2211 z\u2208H\u03b1 f(|z|h \u2212R) is Gaussian when R \u2192 +\u221e.\nIn the case 1 \u226a aR \u226a eR as R \u2192 +\u221e, Theorem 1.3 shows that the limiting behaviour of \u2211 z\u2208H\u03b1 f ( aR(|z|h \u2212 R) ) is also Gaussian. For completeness, we continue to consider\nthe limiting behaviour of \u2211 z\u2208H\u03b1 f ( aR(|z|h \u2212 R) ) in the case aR \u226b eR and aR \u226a 1 as R \u2192 +\u221e. In the case aR \u226b eR as R \u2192 +\u221e, for a bounded measurable and compactly supported\nfunction f : R \u2192 R, the limiting behaviour of \u2211z\u2208H\u03b1 f ( aR(|z|h \u2212 R) ) is zero. This can\nbe seen by\nVar ( \u2211\nz\u2208H\u03b1\nf ( aR(|z|h \u2212R) )) \u2212\u2212\u2212\u2212\u2192 R\u2192+\u221e 0.\nIn fact, a similar argument as in Section 4 implies that\nVar ( \u2211\nz\u2208H\u03b1\nf ( aR(|z|h \u2212R) )) \u2264 \u2211\nz\u2208H\u03b1\nE [ f 2 ( aR(|z|h \u2212 R) )] \u223c \u03b1e R\n4aR\n\u222b\nR\nf 2(x)dx \u2212\u2212\u2212\u2212\u2192 R\u2192+\u221e 0.\nWe now turn to consider the case aR \u226a 1 as R \u2192 +\u221e. For a bounded measurable and compactly supported function f : R \u2192 R, denote Mf the essential right endpoint of suppf , that is,\nMf := inf { M \u2208 R \u2223\u2223 f(x) = 0 almost everywhere on [M,+\u221e) } .\nTheorem 7.1. Suppose that aR > 0 satisfies aR \u226a 1 as R \u2192 +\u221e. Let f be a real-valued bounded measurable function on R with compact support such that f(M\u2212f ) := lim\nx\u2192M\u2212f f(x)\nexists and is non-zero. If R +Mf/aR \u2192 +\u221e as R \u2192 +\u221e, then for each \u03b1 > 0, \u2211\nz\u2208H\u03b1 f ( aR(|z|h \u2212R) ) \u2212 E [\u2211 z\u2208H\u03b1 f ( aR(|z|h \u2212 R) )] \u221a Var (\u2211 z\u2208H\u03b1 f ( aR(|z|h \u2212 R) )) law\u2212\u2212\u2212\u2212\u2192 R\u2192+\u221e N (0, 1).\nWith the help of Theorem 7.1, we can do more detailed discussion when aR \u226a 1 as R \u2192 +\u221e.\n(i) In the case R\u22121 \u226a aR \u226a 1, we always have R + Mf/aR \u2192 +\u221e, so the limiting behaviour of\n\u2211 z\u2208H\u03b1 f ( aR(|z|h \u2212R) ) is Gaussian when f(M\u2212f ) exists and is non-zero.\n(ii) In the case aR = R \u22121, if Mf \u2264 \u22121, since aR(|z|h \u2212 R) > \u22121 except z = 0,\u2211\nz\u2208H\u03b1 f ( R\u22121(|z|h\u2212R) ) is almost surely the zero random variable for every R > 0; ifMf >\n\u22121, we have R+Mf/aR \u2192 +\u221e, so the limiting behaviour of \u2211 z\u2208H\u03b1 f ( R\u22121(|z|h \u2212R) ) is Gaussian when f(M\u2212f ) exists and is non-zero. (iii) In the case aR \u226a R\u22121, if Mf < 0, since aR(|z|h \u2212 R) > \u2212RaR \u2192 0 except z = 0,\u2211 z\u2208H\u03b1 f ( aR(|z|h\u2212R) ) is almost surely the zero random variable for sufficiently large R; if\nMf \u2265 0, we have R+Mf/aR \u2192 +\u221e, so the limiting behaviour of \u2211 z\u2208H\u03b1 f ( aR(|z|h\u2212R) ) is Gaussian when f(M\u2212f ) exists and is non-zero.\nQuestion 1. For the hyperbolic situation, in the case aR = R \u22121 and Mf > \u22121, or aR \u226a R\u22121 and Mf \u2265 0, does the central limit theorem also holds without the condition that f(M\u2212f ) exists and is non-zero?\nProof of Theorem 7.1. We will use Soshnikov\u2019s Theorem 2.3 to prove this theorem. The calculations are similar as Section 4.\nLet us first calculate the expectation\nE\n[ \u2211\nz\u2208H\u03b1\n\u2223\u2223f ( aR(|z|h \u2212R) )\u2223\u2223 ]\n= 4\u03b1 \u222b Mf\n\u2212RaR\n\u222b +\u221e\n0\n|f(x)|e x aR k (\u03b1)\n\u230ateR+ x aR \u230b\n( 1\u2212 2\ne R+ x aR + 1\n)2\u230ateR+ xaR \u230b+1 e\u03b1(R+ x aR )\n(e R+ x aR + 1)2\u03b1 dtdx \u00b7 e\nR\naR .\nMake a variable substitution by x = aRy +Mf , then\nE\n[ \u2211\nz\u2208H\u03b1\n\u2223\u2223f ( aR(|z|h \u2212 R) )\u2223\u2223 ]\n= 4\u03b1 \u222b 0\n\u2212R\u2212Mf/aR\n\u222b +\u221e\n0\n|f(aRy +Mf )|eyk(\u03b1)\u230ateR+Mf/aR+y\u230b ( 1\u2212 2\neR+Mf/aR+y + 1\n)2\u230ateR+Mf/aR+y\u230b+1\n\u00b7 e \u03b1(R+Mf /aR+y)\n(eR+Mf /aR+y + 1)2\u03b1 dtdy \u00b7 eR+Mf/aR .\nHence\nE\n[ \u2211\nz\u2208H\u03b1\n\u2223\u2223f ( aR(|z|h \u2212R) )\u2223\u2223 ] \u223c \u03b1|f(M\u2212f )| 4 eR+Mf /aR .\nNext we shall calculate the variance\nVar ( \u2211\nz\u2208H\u03b1\nf ( aR(|z|h \u2212 R) )) = \u221e\u2211\nn=0\nE [ f 2 ( aR(|\u03c1(\u03b1)n |h \u2212 R) )] \u2212 \u221e\u2211\nn=0\nE [ f ( aR(|\u03c1(\u03b1)n |h \u2212 R) )]2 .\nFor the first term, we have\n\u221e\u2211\nn=0\nE [ f 2 ( aR(|\u03c1(\u03b1)n |h \u2212 R) )] \u223c \u03b1|f(M\u2212f )|2 4 eR+Mf /aR .\nAs for the second term\n\u221e\u2211\nn=0\nE [ f ( aR(|\u03c1(\u03b1)n |h \u2212 R) )]2\n= 42\u03b1 \u221e\u2211\nn=0\n(\u222b Mf\n\u2212RaR f(x)k(\u03b1)n\n( 1\u2212 2\ne R+ x aR + 1\n)2n+1 e\u03b1(R+ x aR )\n(e R+ x aR + 1)2\u03b1 dx )2 \u00b7 1 a2R ,\nset n = \u230ateR+Mf /aR\u230b, then\n\u221e\u2211\nn=0\nE [ f ( aR(|\u03c1(\u03b1)n |h \u2212R) )]2\n= 42\u03b1 \u222b +\u221e\n0\n(\u222b Mf\n\u2212RaR f(x)k\n(\u03b1) \u230ateR+Mf/aR\u230b\n( 1\u2212 2\ne R+ x aR + 1\n)2\u230ateR+Mf/aR\u230b+1\n\u00b7 e \u03b1(R+ x aR )\n(e R+ x aR + 1)2\u03b1 dx\n)2 dt \u00b7 e R+Mf/aR\na2R .\nMake a variable substitution by x = aRy +Mf , so\n\u221e\u2211\nn=0\nE [ f ( aR(|\u03c1(\u03b1)n |h \u2212 R) )]2\n= 42\u03b1 \u222b +\u221e\n0\n(\u222b 0\n\u2212R\u2212Mf/aR f(aRy +Mf )k\n(\u03b1) \u230ateR+Mf/aR\u230b\n( 1\u2212 2\neR+Mf/aR+y + 1\n)2\u230ateR+Mf/aR\u230b+1\n\u00b7 e \u03b1(R+Mf /aR+y)\n(eR+Mf/aR+y + 1)2\u03b1 dy\n)2 dt \u00b7 eR+Mf/aR\n\u223c \u03b1|f(M\u2212f )|2 4B(\u03b1, \u03b1+ 1)\n\u222b 0\n\u2212\u221e\n\u222b 0\n\u2212\u221e\ne(\u03b1+1)(x+y)\n(ex + ey)2\u03b1+1 dxdy \u00b7 eR+Mf/aR .\nNotice taht\n1\nB(\u03b1, \u03b1+ 1)\n\u222b +\u221e\n\u2212\u221e\n\u222b 0\n\u2212\u221e\ne(\u03b1+1)(x+y)\n(ex + ey)2\u03b1+1 dxdy = 1,\nwe conclude that\nVar ( \u2211\nz\u2208H\u03b1\nf ( aR(|z|h \u2212 R) )) \u223c \u03b1|f(M\u2212f )|2 4B(\u03b1, \u03b1+ 1)\n\u222b +\u221e\n0\n\u222b 0\n\u2212\u221e\ne(\u03b1+1)(x+y)\n(ex + ey)2\u03b1+1 dxdy \u00b7 eR+Mf/aR .\nThe above calculations yield that when R \u2192 +\u221e,\nE\n[ \u2211\nz\u2208H\u03b1\n\u2223\u2223f ( aR(|z|h \u2212 R) )\u2223\u2223 ] = O ( Var ( \u2211\nz\u2208H\u03b1\nf ( aR(|z|h \u2212 R) )) ) ,\nand then we can use Soshnikov\u2019s Theorem 2.3 to get the central limit theorem. This completes the proof of Theorem 7.1.\n7.2. Fluctuations in the Ginibre case. Theorem 1.6 explains that the limiting behaviour of the point process {R(|z| \u2212 R) : z \u2208 G} is Poisson when R \u2192 +\u221e. For a bounded measurable and compactly supported function f : R \u2192 R, Theorem 1.2 illustrates that the limiting behaviour of \u2211 z\u2208G f(|z| \u2212 R) is Gaussian when R \u2192 +\u221e. In the case 1 \u226a aR \u226a R as R \u2192 +\u221e, Theorem 1.4 shows that the limiting behaviour of \u2211 z\u2208G f ( aR(|z| \u2212 R) ) is also Gaussian. For completeness, we continue to consider the\nlimiting behaviour of \u2211 z\u2208G f ( aR(|z| \u2212R) ) in the case aR \u226b R and aR \u226a 1 as R \u2192 +\u221e.\nIn the case aR \u226b R as R \u2192 +\u221e, for a bounded measurable and compactly supported function f : R \u2192 R, the limiting behaviour of \u2211z\u2208G f ( aR(|z| \u2212 R) ) is zero. This can be seen by\nVar (\u2211 z\u2208G f ( aR(|z| \u2212R) )) \u2212\u2212\u2212\u2212\u2192 R\u2192+\u221e 0.\nIn fact, a similar argument as Section 5 implies that\nVar (\u2211 z\u2208G f ( aR(|z| \u2212 R) )) \u2264 \u2211 z\u2208G E [ f 2 ( aR(|z| \u2212 R) )] \u223c 2R aR\n\u222b\nR\nf 2(x)dx \u2212\u2212\u2212\u2212\u2192 R\u2192+\u221e 0.\nWe now turn to consider the case aR \u226a 1 as R \u2192 +\u221e.\nTheorem 7.2. Suppose that aR > 0 satisfies aR \u226a 1 as R \u2192 +\u221e. Let f be a real-valued bounded measurable function on R with compact support such that f(M\u2212f ) := lim\nx\u2192M\u2212f f(x)\nexists and is non-zero. If R +Mf/aR \u2192 +\u221e as R \u2192 +\u221e, then,\n\u2211 z\u2208G f ( aR(|z| \u2212R) ) \u2212 E [\u2211 z\u2208G f ( aR(|z| \u2212 R) )] \u221a Var (\u2211 z\u2208G f ( aR(|z| \u2212 R) )) law\u2212\u2212\u2212\u2212\u2192 R\u2192+\u221e N (0, 1).\nWith the help of Theorem 7.2, we can do more detailed discussion when aR \u226a 1 as R \u2192 +\u221e.\n(i) In the case R\u22121 \u226a aR \u226a 1, we always have R + Mf/aR \u2192 +\u221e, so the limiting behaviour of \u2211 z\u2208G f ( aR(|z| \u2212R) ) is Gaussian when f(M\u2212f ) exists and is non-zero.\n(ii) In the case aR = R \u22121, if Mf \u2264 \u22121, since aR(|z| \u2212 R) > \u22121 except z = 0,\u2211\nz\u2208G f ( R\u22121(|z| \u2212 R) ) is almost surely the zero random variable for every R > 0; if\nMf > \u22121, we have R+Mf/aR \u2192 +\u221e, so the limiting behaviour of \u2211 z\u2208G f ( R\u22121(|z|\u2212R) ) is Gaussian when f(M\u2212f ) exists and is non-zero. (iii) In the case aR \u226a R\u22121, if Mf < 0, since aR(|z| \u2212 R) > \u2212RaR \u2192 0 except z = 0,\u2211 z\u2208G f ( aR(|z| \u2212R) ) is almost surely the zero random variable for sufficiently large R; if\nMf \u2265 0, we have R +Mf/aR \u2192 +\u221e, so the limiting behaviour of \u2211 z\u2208G f ( aR(|z| \u2212 R) ) is Gaussian when f(M\u2212f ) exists and is non-zero.\nQuestion 2. For the Ginibre situation, in the case aR = R \u22121 and Mf > \u22121, or aR \u226a R\u22121 and Mf \u2265 0, does the central limit theorem also holds without the condition that f(M\u2212f ) exists and is non-zero?\nProof of Theorem 7.2. We will use Soshnikov\u2019s Theorem 2.3 to prove this theorem. The calculations are similar as Section 5.\nLet us first calculate the expectation\nE\n[\u2211\nz\u2208G\n\u2223\u2223f ( aR(|z| \u2212 R) \u2223\u2223) ] = 2\n\u222b Mf\n\u2212RaR |f(x)|dx \u00b7 R aR + 2\n\u222b Mf\n\u2212RaR x|f(x)|dx \u00b7 1 a2R\n= 2\n\u222b Mf\n\u2212RaR |f(x)|\n( R + x\naR\n) dx \u00b7 1\naR .\nMake a variable substitution by x = aRy +Mf , then\nE\n[\u2211\nz\u2208G\n\u2223\u2223f ( aR(|z| \u2212 R) \u2223\u2223) ] = 2\n\u222b 0\n\u2212R\u2212Mf/aR |f(aRy +Mf )|\n( R +Mf/aR + y ) dy\n\u2264 2 \u2016f\u2016\u221e (R +Mf/aR)2.\nNext we shall calculate the variance\nVar (\u2211 z\u2208G f ( aR(|z| \u2212 R) ))\n= 2\n\u03c0\n\u222b +\u221e\n\u2212RaR\n\u222b +\u221e\n\u2212RaR\n\u222b \u03c0\u221a(R+ x aR )(R+ y aR )\n0\n[ f(x)\u2212 f(y) ]2 e \u2212 (x\u2212y) 2 a2 R \u221a( R + x\naR\n)( R + y\naR\n)\n\u00b7 e \u22124(R+ x aR )(R+ y aR ) sin2 t\n2 \u221a\n(R+ xaR )(R+ y aR ) dtdxdy \u00b7 1\na2R = I1(R) + I2(R),\nwhere\nI1(R) = 4\n\u03c0\n\u222b +\u221e\n\u2212RaR\n\u222b Mf\n\u2212RaR\n\u222b \u03c0\u221a(R+ x aR )(R+ y aR )\n0\nf 2(x)e \u2212 (x\u2212y)\n2\na2 R \u221a( R + x\naR\n)( R + y\naR\n)\n\u00b7 e \u22124(R+ x aR )(R+ y aR ) sin2 t\n2 \u221a\n(R+ xaR )(R+ y aR ) dtdxdy \u00b7 1\na2R ,\nand\nI2(R) = 4\n\u03c0\n\u222b Mf\n\u2212RaR\n\u222b Mf\n\u2212RaR\n\u222b \u03c0\u221a(R+ x aR )(R+ y aR )\n0\nf(x)f(y)e \u2212 (x\u2212y)\n2\na2 R \u221a( R + x\naR\n)( R + y\naR\n)\n\u00b7 e \u22124(R+ x aR )(R+ y aR ) sin2 t\n2 \u221a\n(R+ xaR )(R+ y aR ) dtdxdy \u00b7 1\na2R\n\u2264 4 \u03c0\n\u222b Mf\n\u2212RaR\n\u222b Mf\n\u2212RaR\n\u222b \u03c0\u221a(R+ x aR )(R+ y aR )\n0\nf 2(x)e \u2212 (x\u2212y)\n2\na2R \u221a( R + x\naR\n)( R + y\naR\n)\n\u00b7 e \u22124(R+ x aR )(R+ y aR ) sin2 t\n2 \u221a\n(R+ xaR )(R+ y aR ) dtdxdy \u00b7 1\na2R .\nIt follows that\nVar (\u2211 z\u2208G f ( aR(|z| \u2212 R) ))\n\u2265 4 \u03c0\n\u222b +\u221e\nMf\n\u222b Mf\n\u2212RaR\n\u222b \u03c0\u221a(R+ x aR )(R+ y aR )\n0\nf 2(x)e \u2212 (x\u2212y)\n2\na2R \u221a( R + x\naR\n)( R + y\naR\n)\n\u00b7 e \u22124(R+ x aR )(R+ y aR ) sin2 t\n2 \u221a\n(R+ xaR )(R+ y aR ) dtdxdy \u00b7 1\na2R .\nSet x = aRu+Mf and y = aRv +Mf , then\nVar (\u2211 z\u2208G f ( aR(|z| \u2212 R) ))\n\u2265 4 \u03c0\n\u222b +\u221e\n0\n\u222b 0\n\u2212R\u2212Mf/aR\n\u222b \u03c0\u221a(R+Mf /aR+u)(R+Mf/aR+v)\n0\nf 2(aRu+Mf )e \u2212(u\u2212v)2\n\u00b7 \u221a\n(R +Mf/aR + u)(R +Mf/aR + v)\n\u00b7 e \u22124(R+Mf /aR+u)(R+Mf/aR+v) sin2 t\n2 \u221a\n(R+Mf/aR+u)(R+Mf/aR+v)dtdudv\n\u223c 2\u221a \u03c0 |f(M\u2212f )|2\n\u222b +\u221e\n0\n\u222b 0\n\u2212\u221e e\u2212(u\u2212v) 2 dudv \u00b7 (R +Mf/aR).\nThe above calculations yield that when R \u2192 +\u221e,\nE\n[\u2211\nz\u2208G\n\u2223\u2223f ( aR(|z| \u2212 R) )\u2223\u2223 ] = O   ( Var (\u2211\nz\u2208G f ( aR(|z| \u2212 R)\n)) )2  ,\nand then we can use Soshnikov\u2019s Theorem 2.3 to get the central limit theorem. This completes the proof of Theorem 7.2.\nReferences\n[1] A. Borodin, Determinantal point processes. Oxford Handbook of Random Matrix Theory, Oxford Univ. Press, Oxford, (2011). [2] A. I. Bufetov, The conditional measures for the determinantal point process with the Bergman kernel. arXiv:2112.15557 (Dec 2021). [3] A. I. Bufetov, A. V. Dymov, A functional limit theorem for the sine-process. Int. Math. Res. Not. IMRN 2019, no. 1, 249-319. [4] A. I. Bufetov, Y. Qiu, Determinantal point processes associated with Hilbert spaces of holomorphic functions. Comm. Math. Phys. 351 (2017), 1-44. [5] D. J. Daley, D. Vere-Jones, An introduction to the theory of point processes. Vol. II. General theory and structure. Second edition. Probability and its Applications (New York). Springer, New York, 2008. [6] S. Ghosh, Determinantal processes and completeness of random exponentials: the critical case. Probab. Theory Related Fields 163 (2015), 643-665. [7] S. Ghosh, Y. Peres, Rigidity and tolerance in point processes: Gaussian zeros and Ginibre eigenvalues. Duke Math. J. 166 (2017), 1789-1858. [8] J. Ginibre, Statistical ensembles of complex, quaternion, and real matrices. J. Mathematical Phys. 6 (1965), 440-449. [9] J. B. Hough, M. Krishnapur, Y. Peres, B. Vira\u0301g, Zeros of Gaussian analytic functions and determinantal point processes. University Lecture Series, 51. American Mathematical Society, Providence, RI, 2009. [10] Y. G. Kondratiev, T. Kuna, Harmonic analysis on configuration space. I. General theory. Infin. Dimens. Anal. Quantum Probab. Relat. Top. 5 (2002), 201-233. [11] E. Kostlan, On the spectra of Gaussian matrices. Linear Algebra Appl. 162/164 (1992), 385-388. Directions in matrix theory (Auburn, AL, 1990). [12] M. Krishnapur, From random matrices to random analytic functions. Ann. Probab. 37 (2009), 314- 346 [13] A. Lenard, Correlation functions and the uniqueness of the state in classical statistical mechanics. Comm. Math. Phys. 30 (1973), 35-44.\n[14] O. Macchi, The coincidence approach to stochastic point processes. Advances in Appl. Probability. 7 (1975), 83-122. [15] Y. Peres, B. Vira\u0301g, Zeros of the i.i.d. Gaussian power series: A conformally invariant determinantal process. Acta Math. 194 (2005), 1-35. [16] T. Shirai, Y. Takahashi, Fermion process and Fredholm determinant. Proceedings of the Second ISAAC Congress, Vol. 1 (Fukuoka, 1999), 15-23. Int. Soc. Anal. Appl. Comput., 7, Kluwer Acad. Publ., Dordrecht, 2000. [17] A. Soshnikov, Determinantal random point fields. Russian Math. Surveys. 55 (2000), 923-975. [18] A. Soshnikov,Gaussian limit for determinantal random point fields. Ann. Probab. 30 (2002), 171-187.\nAlexander I. Bufetov: CNRS, Aix-Marseille Universite\u0301, Centrale Marseille, Institut de Mathe\u0301matiques de Marseille, UMR7373, 39 Rue F. Joliot Curie 13453, Marseille, France; Steklov Mathematical Institute of RAS, Moscow, Russia; Institute for Information Transmission Problems, Moscow, Russia.\nEmail address : alexander.bufetov@univ-amu.fr; bufetov@mi-ras.ru\nDavid Garc\u0301\u0131a-Zelada: Laboratoire de Probabilite\u0301s, Statistique et Mode\u0301lisation, UMR CNRS 8001, Sorbonne Universite\u0301, 4 Place Jussieu, 75005 Paris, France\nEmail address : david.garcia-zelada@sorbonne-universite.fr\nZhaofeng Lin: Shanghai Center for Mathematical Sciences, Fudan University, Shanghai, 200438, China.\nEmail address : zflin18@fudan.edu.cn"
        }
    ],
    "year": 2022
}